ID,Source,Tag_Code,Tag_Name,Title,Url
1,Lobsters,compsci,CSE,A Simple Constraint Programming Implementation,https://bor0.wordpress.com/2020/08/22/a-simple-constraint-programming-implementation/
2,Lobsters,compsci,CSE,"In Rust, ordinary vectors are values",http://smallcultfollowing.com/babysteps/blog/2018/02/01/in-rust-ordinary-vectors-are-values/
3,Lobsters,compsci,CSE,CheriABI: Enforcing Valid Pointer Provenance and Minimizing Pointer Privilege in the POSIX C Run-time Environment,https://www.microsoft.com/en-us/research/publication/cheriabi-enforcing-valid-pointer-provenance-and-minimizing-pointer-privilege-in-the-posix-c-run-time-environment/
4,Lobsters,compsci,CSE,Are CRDTs suitable for shared editing?,https://blog.kevinjahns.de/are-crdts-suitable-for-shared-editing/
5,Lobsters,compsci,CSE,QEMU version 5.1.0 released,https://www.qemu.org/2020/08/11/qemu-5-1-0/
6,Lobsters,compsci,CSE,Aspect-Oriented Programming,https://patents.google.com/patent/US6467086B1/en
7,Lobsters,compsci,CSE,REMS - Rigorous Engineering of Mainstream Systems,https://www.cl.cam.ac.uk/~pes20/rems/
8,Lobsters,compsci,CSE,History of Computer Architecture and RISC (Dave Patterson),https://www.youtube.com/watch?v=1FtEGIp3a_M
9,Lobsters,compsci,CSE,TensorFlow Datasets: The Bad Parts,https://determined.ai/blog/tf-dataset-the-bad-parts/
10,Lobsters,compsci,CSE,Cheap FPGA Development Boards,https://joelw.id.au/FPGA/CheapFPGADevelopmentBoards
11,Lobsters,compsci,CSE,"Geometric Folding Algorithms: Linkages, Origami, Polyhedra",https://ocw.mit.edu/courses/electrical-engineering-and-computer-science/6-849-geometric-folding-algorithms-linkages-origami-polyhedra-fall-2012/
12,Lobsters,compsci,CSE,Historical Computers in Japan-Computer Museum,http://museum.ipsj.or.jp/en/computer/index.html
13,Lobsters,compsci,CSE,Aminet: Hosting freely distributable Amiga software,http://aminet.net/
14,Lobsters,compsci,CSE,Defunctionalization and Freyd’s Theorem,https://bartoszmilewski.com/2020/08/03/defunctionalization-and-freyds-theorem/
15,Lobsters,compsci,CSE,Incrementally Improving The DOM,https://blog.functorial.com/posts/2018-04-08-Incrementally-Improving-The-DOM.html
16,Lobsters,compsci,CSE,RANS: More advanced usage of regular expressions,https://sinya8282.github.io/RANS/
17,Lobsters,compsci,CSE,Kissat SAT Solver,http://fmv.jku.at/kissat/
18,Lobsters,compsci,CSE,Finite Vector Spaces as Model of Simply-Typed Lambda-Calculi,https://www.cis.upenn.edu/~stevez/papers/VZ14.pdf
19,Lobsters,compsci,CSE,Programming in Martin-Löf’s Type Theory: An Introduction (1990),http://www.cse.chalmers.se/research/group/logic/book/book.pdf
20,Lobsters,compsci,CSE,Corecursion and coinduction: what they are and how they relate to recursion and induction,https://www.cl.cam.ac.uk/archive/mjcg/plans/Coinduction.pdf
21,Lobsters,compsci,CSE,Slowsort - a pessimal sorting algorithm,https://arpitbhayani.me/blogs/slowsort
22,Lobsters,compsci,CSE,Computation graphs and graph computation,http://breandan.net/2020/06/30/graph-computation/
23,Lobsters,compsci,CSE,Bloom filters debunked: Dispelling 30 Years of bad math with Coq,https://gopiandcode.uk/logs/log-bloomfilters-debunked.html
24,Lobsters,compsci,CSE,Wolfsort is a stable adaptive hybrid radix sort,https://github.com/scandum/wolfsort
25,Lobsters,compsci,CSE,cl-aristid: Draw Lindenmayer Systems with Common LISP,https://github.com/FdelMazo/cl-aristid
26,Lobsters,compsci,CSE,A Simple Constraint Programming Implementation,https://bor0.wordpress.com/2020/08/22/a-simple-constraint-programming-implementation/
27,Lobsters,compsci,CSE,"In Rust, ordinary vectors are values",http://smallcultfollowing.com/babysteps/blog/2018/02/01/in-rust-ordinary-vectors-are-values/
28,Lobsters,compsci,CSE,CheriABI: Enforcing Valid Pointer Provenance and Minimizing Pointer Privilege in the POSIX C Run-time Environment,https://www.microsoft.com/en-us/research/publication/cheriabi-enforcing-valid-pointer-provenance-and-minimizing-pointer-privilege-in-the-posix-c-run-time-environment/
29,Lobsters,compsci,CSE,Are CRDTs suitable for shared editing?,https://blog.kevinjahns.de/are-crdts-suitable-for-shared-editing/
30,Lobsters,compsci,CSE,QEMU version 5.1.0 released,https://www.qemu.org/2020/08/11/qemu-5-1-0/
31,Lobsters,compsci,CSE,Aspect-Oriented Programming,https://patents.google.com/patent/US6467086B1/en
32,Lobsters,compsci,CSE,REMS - Rigorous Engineering of Mainstream Systems,https://www.cl.cam.ac.uk/~pes20/rems/
33,Lobsters,compsci,CSE,History of Computer Architecture and RISC (Dave Patterson),https://www.youtube.com/watch?v=1FtEGIp3a_M
34,Lobsters,compsci,CSE,TensorFlow Datasets: The Bad Parts,https://determined.ai/blog/tf-dataset-the-bad-parts/
35,Lobsters,compsci,CSE,Cheap FPGA Development Boards,https://joelw.id.au/FPGA/CheapFPGADevelopmentBoards
36,Lobsters,compsci,CSE,"Geometric Folding Algorithms: Linkages, Origami, Polyhedra",https://ocw.mit.edu/courses/electrical-engineering-and-computer-science/6-849-geometric-folding-algorithms-linkages-origami-polyhedra-fall-2012/
37,Lobsters,compsci,CSE,Historical Computers in Japan-Computer Museum,http://museum.ipsj.or.jp/en/computer/index.html
38,Lobsters,compsci,CSE,Aminet: Hosting freely distributable Amiga software,http://aminet.net/
39,Lobsters,compsci,CSE,Defunctionalization and Freyd’s Theorem,https://bartoszmilewski.com/2020/08/03/defunctionalization-and-freyds-theorem/
40,Lobsters,compsci,CSE,Incrementally Improving The DOM,https://blog.functorial.com/posts/2018-04-08-Incrementally-Improving-The-DOM.html
41,Lobsters,compsci,CSE,RANS: More advanced usage of regular expressions,https://sinya8282.github.io/RANS/
42,Lobsters,compsci,CSE,Kissat SAT Solver,http://fmv.jku.at/kissat/
43,Lobsters,compsci,CSE,Finite Vector Spaces as Model of Simply-Typed Lambda-Calculi,https://www.cis.upenn.edu/~stevez/papers/VZ14.pdf
44,Lobsters,compsci,CSE,Programming in Martin-Löf’s Type Theory: An Introduction (1990),http://www.cse.chalmers.se/research/group/logic/book/book.pdf
45,Lobsters,compsci,CSE,Corecursion and coinduction: what they are and how they relate to recursion and induction,https://www.cl.cam.ac.uk/archive/mjcg/plans/Coinduction.pdf
46,Lobsters,compsci,CSE,Slowsort - a pessimal sorting algorithm,https://arpitbhayani.me/blogs/slowsort
47,Lobsters,compsci,CSE,Computation graphs and graph computation,http://breandan.net/2020/06/30/graph-computation/
48,Lobsters,compsci,CSE,Bloom filters debunked: Dispelling 30 Years of bad math with Coq,https://gopiandcode.uk/logs/log-bloomfilters-debunked.html
49,Lobsters,compsci,CSE,Wolfsort is a stable adaptive hybrid radix sort,https://github.com/scandum/wolfsort
50,Lobsters,compsci,CSE,cl-aristid: Draw Lindenmayer Systems with Common LISP,https://github.com/FdelMazo/cl-aristid
51,Lobsters,compsci,CSE,The Implementation of Functional Programming Languages (1987),https://www.microsoft.com/en-us/research/wp-content/uploads/1987/01/slpj-book-1987-small.pdf
52,Lobsters,compsci,CSE,Inside a Collaborative Text Editor,https://caolan.uk/articles/inside-a-collaborative-text-editor/
53,Lobsters,compsci,CSE,USENIX ATC '20 Technical Sessions,https://www.usenix.org/conference/atc20/technical-sessions
54,Lobsters,compsci,CSE,Eytzinger Binary Search,https://algorithmica.org/en/eytzinger
55,Lobsters,compsci,CSE,Decoding a JPEG Image using Python,https://yasoob.me/posts/understanding-and-writing-jpeg-decoder-in-python/
56,Lobsters,compsci,CSE,On the asymptotic complexity of sorting,https://eccc.weizmann.ac.il/report/2020/096/
57,Lobsters,compsci,CSE,Creating Randomness Without Math.random,https://healeycodes.com/creating-randomness/
58,Lobsters,compsci,CSE,CRDTs: The Hard Parts,https://martin.kleppmann.com/2020/07/06/crdt-hard-parts-hydra.html
59,Lobsters,compsci,CSE,What is hyper-automation? Demystifying a new buzzword,https://www.functionize.com/blog/what-is-hyper-automation/
60,Lobsters,compsci,CSE,The ACM Digital Library Should Remain Open,https://www.scott-a-s.com/acm-digital-library-should-remain-open/
61,Lobsters,compsci,CSE,Prototyping a Small Genetic Algorithms Library in Haskell (2019),https://dev.to/tobedetermined/prototyping-a-small-genetic-algorithms-library-in-haskell-17li
62,Lobsters,compsci,CSE,A Practical Introduction to Graphs (Network Diagrams),https://healeycodes.com/practical-intro-to-graphs/
63,Lobsters,compsci,CSE,Kosaraju's Algorithm for finding Strongly Connected Components,https://hassamuddin.com/blog/kosaraju/
64,Lobsters,compsci,CSE,ScaNN: Scalable Nearest Neighbors,https://github.com/google-research/google-research/tree/master/scann
65,Lobsters,compsci,CSE,David Patterson: Computer Architecture and Data Storage,https://lexfridman.com/david-patterson/
66,Lobsters,compsci,CSE,An introduction to Conflict-Free Replicated Data Types,https://lars.hupel.info/topics/crdt/01-intro.html
67,Lobsters,compsci,CSE,NGT: Nearest Neighbor Search with Neighborhood Graph and Tree,https://github.com/yahoojapan/NGT
68,Lobsters,compsci,CSE,EsoLangVM Compiler Infrastructure,https://github.com/shinh/elvm
69,Lobsters,compsci,CSE,Learning operating system development using Linux kernel and Raspberry Pi,https://s-matyukevich.github.io/raspberry-pi-os/
70,Lobsters,compsci,CSE,Handwriting Recognition Technology in the Newton's Second Generation “Print Recognizer” (2004),http://wwnc.newtontalk.net/2004/program/larryyaeger/slides-larryyaeger.pdf
71,Lobsters,compsci,CSE,Deobfuscated topological sort,https://zachahn.com/posts/1592795405/
72,Lobsters,compsci,CSE,Summer of Zoom – A curated list of remote conferences,http://oktatok.karolyrobert.hu/buday.gergely/summer-of-zoom/
73,Lobsters,compsci,CSE,Faster than radix sort: Kirkpatrick-Reisch sorting,https://sortingsearching.com/2020/06/06/kirkpatrick-reisch.html
74,Lobsters,compsci,CSE,How to make PageRank faster (with lots of math and a hint of Python),https://dev.to/karjudev/how-to-make-pagerank-faster-with-lots-of-math-and-a-hint-of-python-2e92
75,Lobsters,compsci,CSE,Computer science papers we love,https://github.com/papers-we-love/papers-we-love
76,Lobsters,compsci,CSE,How To Become A Hacker,https://zalberico.com/essay/2020/04/19/how-to-become-a-hacker.html
77,Lobsters,compsci,CSE,Building a computer in Conway's game of life,https://www.nicolasloizeau.com/gol-computer
78,Lobsters,compsci,CSE,Category Theory -- The math behind hyper-convergence automation,https://multix.sfo2.cdn.digitaloceanspaces.com/Category%20Theory%20TechBBQ.pdf
79,Lobsters,compsci,CSE,Masked Types for Sound Object Initialization (2009),https://www.cs.cornell.edu/andru/papers/masked-types.pdf
80,Lobsters,compsci,CSE,Beta introductory quantum computing textbook,https://www.scottaaronson.com/qclec.pdf
81,Lobsters,compsci,CSE,“Concurrent Buns” – A chef’s guide to concurrency verification (2009),https://johnwickerson.wordpress.com/2009/03/16/chefs/
82,Lobsters,compsci,CSE,Diffing Explorations,https://github.com/numist/Diffing-Explorations
83,Lobsters,compsci,CSE,Harnessing Vision for Computation (2008),https://www.gwern.net/docs/cs/2008-changizi.pdf
84,Lobsters,compsci,CSE,(call/cc this-class),https://pavpanchekha.com/esp/continuations.html
85,Lobsters,compsci,CSE,Graduate Student Solves Decades-Old Conway Knot Problem,https://www.quantamagazine.org/graduate-student-solves-decades-old-conway-knot-problem-20200519/
86,Lobsters,compsci,CSE,Happy 10th Birthday RISC-V,https://riscv.org/2020/05/happy-10th-birthday-risc-v/
87,Lobsters,compsci,CSE,Why isn't there a formal grammar for Markdown? (2014),https://roopc.net/posts/2014/markdown-cfg/
88,Lobsters,compsci,CSE,State of Loom,http://cr.openjdk.java.net/~rpressler/loom/loom/sol1_part1.html
89,Lobsters,compsci,CSE,Speed improvements using hash tables,https://blog.asrpo.com/hashtables
90,Lobsters,compsci,CSE,Comb the Hairball with BioFabric,http://www.biofabric.org/
91,Lobsters,compsci,CSE,BioFabric - Wikipedia,https://en.wikipedia.org/wiki/BioFabric
92,Lobsters,compsci,CSE,LibrettOS: a dynamically adaptable multiserver-library OS,https://dl.acm.org/doi/10.1145/3381052.3381316
93,Lobsters,compsci,CSE,Succinct Data Structures and Delta Encoding for Modern Databases,https://github.com/terminusdb/terminus-server/blob/dev/docs/whitepaper/terminusdb.pdf
94,Lobsters,compsci,CSE,Quantum JavaScript (Q.js),https://quantumjavascript.app/
95,Lobsters,compsci,CSE,C-Kermit 4.0.025 source code 1985/02/05,http://www.kermitproject.org/ckermit40.html
96,Lobsters,compsci,CSE,Insignificant Choice Polynomial Time,https://arxiv.org/abs/2005.04598
97,Lobsters,compsci,CSE,Creating a computer science canon: a course of “classic” readings in computer science (2003),http://cs.unomaha.edu/~stanw/papers/csci8550/p336-eisenberg.pdf
98,Lobsters,compsci,CSE,Looking for people who'd like to read CS papers together remotely,https://github.com/zx9w/read-together
99,Lobsters,compsci,CSE,Kotlingrad: Shape-Safe Differentiable Programming with Algebraic Data Types,https://github.com/breandan/kotlingrad
100,Lobsters,compsci,CSE,Decision Diagrams for Optimization,https://www.andrew.cmu.edu/user/vanhoeve/mdd/
101,Lobsters,compsci,CSE,A Guide to Big O notation,https://eaj.no/a-guide-to-big-o-notation
102,Lobsters,compsci,CSE,Concurrent Hash Tables,https://dl.acm.org/doi/pdf/10.1145/3309206
103,Lobsters,compsci,CSE,State Machine In Real Life,https://www.solipsys.co.uk/new/StateMachineInRealLife.html?te02lo
104,Lobsters,compsci,CSE,"Computers Do Not Make Art, People Do",https://cacm.acm.org/magazines/2020/5/244330-computers-do-not-make-art-people-do/fulltext
105,Lobsters,compsci,CSE,Can we compile C code into PowerPoint?,https://www.youtube.com/watch?v=LArkm4v5mWA
106,Lobsters,compsci,CSE,B-trees,https://shachaf.net/w/b-trees
107,Lobsters,compsci,CSE,Maybe Visual Programming is The Answer. Maybe Not,https://blog.metaobject.com/2020/04/maybe-visual-programming-is-answer.html
108,Lobsters,compsci,CSE,Git fractals - Sierpiński triangle,http://philippe.bruhat.net/stuff/git-fractals/sierpinski.html
109,Lobsters,compsci,CSE,The Poet of Logic Programming (interview with Robert Kowalski),https://thesearch.space/episodes/1-the-poet-of-logic-programming
110,Lobsters,compsci,CSE,Conversations with a six-year-old on functional programming (2018),https://byorgey.wordpress.com/2018/05/06/conversations-with-a-six-year-old-on-functional-programming/
111,Lobsters,compsci,CSE,The Pervert's Guide to Computer Programming Languages,https://www.youtube.com/watch?v=mZyvIHYn2zk
112,Lobsters,compsci,CSE,minerva: A 32-bit RISC-V soft processor,https://github.com/lambdaconcept/minerva
113,Lobsters,compsci,CSE,ionescu007/minlzma,https://github.com/ionescu007/minlzma
114,Lobsters,compsci,CSE,"Cozy, the collection synthesizer",https://github.com/CozySynthesizer/cozy
115,Lobsters,compsci,CSE,Writing an Emulator in JavaScript (and Interfacing with Multiple UIs),https://www.taniarascia.com/writing-an-emulator-in-javascript-chip8/
116,Lobsters,compsci,CSE,Modern 64k intro compression,https://www.youtube.com/watch?v=O5LfE_qNzes
117,Lobsters,compsci,CSE,Conflict-free Replicated Data Types,https://crdt.tech/
118,Lobsters,compsci,CSE,"Our Government Runs on a 60-Year-Old Coding Language, and Now It’s Falling Apart",https://onezero.medium.com/our-government-runs-on-a-60-year-old-coding-language-and-now-its-falling-apart-61ec0bc8e121
119,Lobsters,compsci,CSE,Quantum Country: A free introduction to quantum computing,https://quantum.country/
120,Lobsters,compsci,CSE,"Code as requirements, using generators",https://medium.com/@lmatteis/code-as-requirements-using-generators-ec02cb9e8c40
121,Lobsters,compsci,CSE,The predecessor function for Church Numerals in the Lambda Calculus,http://gregfjohnson.com/pred/
122,Lobsters,compsci,CSE,From conventional to institution-independent logic programming,https://academic.oup.com/logcom/logcom/article-abstract/27/6/1679/2917800
123,Lobsters,compsci,CSE,Why any Fundamental Improvement in Software has to be a Generalisation,https://blog.metaobject.com/2020/04/why-any-fundamental-improvement-in.html
124,Lobsters,compsci,CSE,Even Faster Math Functions,https://basesandframes.wordpress.com/2020/04/04/even-faster-math-functions/
125,Lobsters,compsci,CSE,Bits and Bytes: Fight or Flight,https://medium.com/@yasinehsan11/bits-and-bytes-fight-or-flight-3786842b56da
126,Lobsters,compsci,CSE,SIGBOVIK 2020,http://sigbovik.org/2020/proceedings.pdf
127,Lobsters,compsci,CSE,SIGBOVIK 2020 (Online),http://sigbovik.org/2020/
128,Lobsters,compsci,CSE,There's a Mathematician In Your Compiler,https://humanreadablemag.com/issues/2/articles/theres-a-mathematician-in-your-compiler
129,Lobsters,compsci,CSE,Libelf by Example,https://leanpub.com/libelfbyexample
130,Lobsters,compsci,CSE,Message from ACM Regarding Open Access to ACM Digital Library during Coronavirus,https://www.acm.org/articles/bulletins/2020/march/dl-access-during-covid-19
131,Lobsters,compsci,CSE,Lessons from the Unix stdio ABI: 40 Years Later,https://fingolfin.org/blog/20200327/stdio-abi.html
132,Lobsters,compsci,CSE,3 3 Strassen 's Subcubic Matrix Multiplication Algorithm,https://www.youtube.com/watch?v=ORrM-aSNZUs
133,Lobsters,compsci,CSE,Landmark Computer Science Proof Cascades Through Physics and Math,https://www.quantamagazine.org/landmark-computer-science-proof-cascades-through-physics-and-math-20200304/
134,Lobsters,compsci,CSE,PCLSRing: Keeping Process State Modular,http://fare.tunes.org/tmp/emergent/pclsr.htm
135,Lobsters,compsci,CSE,What do Finite Automata Tell Us?,https://thecomputation.com/2020/03/25/what-do-fa-tell-us.html
136,Lobsters,compsci,CSE,A Brief History of Quantum Computers,https://thecomputation.com/2020/03/19/brief-history-of-quantum-computing.html
137,Lobsters,compsci,CSE,Left recursion in recursive descent parsers a new solution?,/s/3pdhus/left_recursion_recursive_descent
138,Lobsters,compsci,CSE,Mechanized Reasoning about a Capability Machine,https://cs.au.dk/~birke/papers/iris-capabilities-prisc-conf.pdf
139,Lobsters,compsci,CSE,Foundations of Databases,http://webdam.inria.fr/Alice/pdfs/all.pdf
140,Lobsters,compsci,CSE,Monads for functional programming,https://homepages.inf.ed.ac.uk/wadler/papers/marktoberdorf/baastad.pdf
141,Lobsters,compsci,CSE,Equality Is Hard,https://www.craigstuntz.com/posts/2020-03-09-equality-is-hard.html
142,Lobsters,compsci,CSE,Understanding Parser Combinators,https://fsharpforfunandprofit.com/posts/understanding-parser-combinators/
143,Lobsters,compsci,CSE,Transferring Real Honey Into A Simulation,https://www.youtube.com/watch?v=yX84nGi-V7E
144,Lobsters,compsci,CSE,Syntactic Unification Is Easy,https://blog.witchoflight.com/2020/syntactic-unification/
145,Lobsters,compsci,CSE,A Networked World (Part 1),https://johncarlosbaez.wordpress.com/2015/03/27/spivak-part-1/
146,Lobsters,compsci,CSE,Meaningful availability,https://blog.acolyer.org/2020/02/26/meaningful-availability/
147,Lobsters,compsci,CSE,Introduction to Sorting Networks,https://hoytech.github.io/sorting-networks/
148,Lobsters,compsci,CSE,Toward Semantic Foundations for Program Editors,https://arxiv.org/pdf/1703.08694.pdf
149,Lobsters,compsci,CSE,Gagallium : Formal proof and analysis of an incremental cycle detection algorithm,http://gallium.inria.fr/blog/incremental-cycle-detection/
150,Lobsters,compsci,CSE,How These Things Work - A book about CS from first principles,https://reasonablypolymorphic.com/book/preface
151,Lobsters,compsci,CSE,Computers can be understood,https://blog.nelhage.com/post/computers-can-be-understood/
152,Lobsters,compsci,CSE,A paper algorithm notation,http://canonical.org/~kragen/sw/dev3/paperalgo
153,Lobsters,compsci,CSE,A Snake Egg Puzzle Solver,https://github.com/tuzz/snake-egg-puzzle
154,Lobsters,compsci,CSE,Journal for the Mathematics of Composition,https://compositionality-journal.org/
155,Lobsters,compsci,CSE,Genetic programming is waiting for better tools,https://www.youtube.com/watch?v=Z5f1SDv-SCk
156,Lobsters,compsci,CSE,Operating Systems: Threads,https://www.cs.uic.edu/~jbell/CourseNotes/OperatingSystems/4_Threads.html
157,Lobsters,compsci,CSE,"PCG, A Family of Better Random Number Generators",http://www.pcg-random.org/index.html
158,Lobsters,compsci,CSE,On Parallel Programming,https://penberg.org/blog/parallel.html
159,Lobsters,compsci,CSE,HackerRank Finds New Generation Gaps,https://www.i-programmer.info/news/99/13443.html
160,Lobsters,compsci,CSE,Research should not stop with the research paper,https://lemire.me/blog/2020/02/07/research-should-not-stop-with-the-research-paper/
161,Lobsters,compsci,CSE,"Combinatris: Tetris, but with SK combinators",http://dirk.rave.org/combinatris/
162,Lobsters,compsci,CSE,SlowerLogLog,https://www.evanmiller.org/slower-log-log.html
163,Lobsters,compsci,CSE,Doubling System Read Throughput with Only 26 Lines of Code,https://pingcap.com/blog/doubling-system-read-throughput-with-only-26-lines-of-code/
164,Lobsters,compsci,CSE,The Missing Semester of Your CS Education (MIT course),https://missing.csail.mit.edu/
165,Lobsters,compsci,CSE,Finding Mona Lisa in the Game of Life,https://kevingal.com/blog/mona-lisa-gol.html
166,Lobsters,compsci,CSE,DEC64: Decimal Floating Point,http://www.dec64.com/
167,Lobsters,compsci,CSE,Kube Explained: Part 2 - Containers,https://link.kelda.io/l-kube-explained-part-2
168,Lobsters,compsci,CSE,A (brief) retrospective on transactional memory (2010),http://joeduffyblog.com/2010/01/03/a-brief-retrospective-on-transactional-memory/
169,Lobsters,compsci,CSE,Reproducible computations with Guix,https://guix.gnu.org/blog/2020/reproducible-computations-with-guix/
170,Lobsters,compsci,CSE,A non-symmetric divide-and-conquer recursive formula for the convolution of polynomials and power series,https://arxiv.org/abs/1912.00452
171,Lobsters,compsci,CSE,Pair programming in Sentient,https://tuzz.tech/blog/pair-programming-in-sentient
172,Lobsters,compsci,CSE,Improving the ptrace(2) API and preparing for LLVM-10.0,https://blog.netbsd.org/tnf/entry/improving_the_ptrace_2_api
173,Lobsters,compsci,CSE,Working towards LLDB on i386,https://blog.netbsd.org/tnf/entry/working_towards_lldb_on_i386
174,Lobsters,compsci,CSE,Work Is Work,https://codahale.com/work-is-work/
175,Lobsters,compsci,CSE,Easy Visual Question Answering,https://victorzhou.com/blog/easy-vqa/
176,Lobsters,compsci,CSE,Tree-walking algorithms: Incrementally enumerating leaf nodes of an N-ary tree,https://devblogs.microsoft.com/oldnewthing/20200106-00/?p=103300
177,Lobsters,compsci,CSE,The Genuine Sieve of Eratosthenes,https://www.cs.hmc.edu/~oneill/papers/Sieve-JFP.pdf
178,Lobsters,compsci,CSE,The Role of Composition in Computer Programming,https://web.archive.org/web/20040331204752/http://www.dbmcintyre.pwp.blueyonder.co.uk/index_f/menu_f/j_f/apl95.pdf
179,Lobsters,compsci,CSE,Random Access Permutations,https://blog.edwardloveall.com/random-access-permutations
180,Lobsters,compsci,CSE,Walking the faster-than-light tightrope: quantum entanglement and the CHSH game,https://ahelwer.ca/post/2018-12-07-chsh/
181,Lobsters,compsci,CSE,Simulating physical reality with a quantum computer,https://ahelwer.ca/post/2019-12-21-quantum-chemistry/
182,Lobsters,compsci,CSE,Emulating Persistent Memory in the Linux Kernel with Different Page Sizes,https://www.williamwalcher.xyz/hacking-libvmmalloc-fun-profit/
183,Lobsters,compsci,CSE,Xor Filters: Faster and Smaller Than Bloom Filters,https://lemire.me/blog/2019/12/19/xor-filters-faster-and-smaller-than-bloom-filters/
184,Lobsters,compsci,CSE,Burritos for the Hungry Mathematician,http://emorehouse.web.wesleyan.edu/silliness/burrito_monads.pdf
185,Lobsters,compsci,CSE,Evolving Languages (5 Steps to Go),https://www.geeklan.co.uk/files/ossg-evolving-languages.pdf
186,Lobsters,compsci,CSE,The Four Stages of Objective-Smalltalk,https://blog.metaobject.com/2019/12/the-4-stages-of-objective-smalltalk.html
187,Lobsters,compsci,CSE,Storage Combinators in Go,https://github.com/xoba/sc
188,Lobsters,compsci,CSE,"Clang build bot now uses two-stage builds, and other LLVM/LLDB news",https://blog.netbsd.org/tnf/entry/clang_build_bot_now_usage
189,Lobsters,compsci,CSE,Prolog Problems,https://sites.google.com/site/prologsite/prolog-problems
190,Lobsters,compsci,CSE,Depending Less on Structure,https://dev.to/lmatteis/depending-less-on-structure-5bl8
191,Lobsters,compsci,CSE,"The Art of Computer Programming, Volume 4, Fascicle 5",https://www.amazon.com/Art-Computer-Programming-Fascicle-Preliminaries/dp/0134671791
192,Lobsters,compsci,CSE,"Toward more efficient computing, with magnetic waves",http://news.mit.edu/2019/computing-magnetic-waves-efficient-1128
193,Lobsters,compsci,CSE,Formality in requirements: new publication,https://bertrandmeyer.com/2019/11/14/formality-requirements-new-publication/
194,Lobsters,compsci,CSE,History of … one CPU instructions: Part 1. LDDQU/movdqu explained,https://software.intel.com/en-us/blogs/2012/04/16/history-of-one-cpu-instructions-part-1-lddqumovdqu-explained
195,Lobsters,compsci,CSE,Functional Perl release,https://marc.info/?l=perl5-porters&m=157442915530310&w=2
196,Lobsters,compsci,CSE,Hierarchical Hexagonal Clustering and Indexing,https://www.researchgate.net/publication/333438802_Hierarchical_Hexagonal_Clustering_and_Indexing
197,Lobsters,compsci,CSE,Grappling with infinity in constraint solvers,https://tuzz.tech/blog/grappling-with-infinity
198,Lobsters,compsci,CSE,Go Forth with TTL,https://www.youtube.com/watch?v=iNg5-Xb5pTg&t=1731
199,Lobsters,compsci,CSE,NaN Gates and Flip FLOPS,http://tom7.org/nand/
200,Lobsters,compsci,CSE,Solving Puzzles with Amb,https://thesmartnik.com/solving-pazzles-wth-amb.html
201,Lobsters,compsci,CSE,LLDB Threading support now ready for mainline,http://blog.netbsd.org/tnf/entry/lldb_threading_support_now_ready
202,Lobsters,compsci,CSE,On The Turing Completeness of PowerPoint,https://www.youtube.com/watch?v=sdkxWqsk17c
