ID,Source,Tag_Code,Tag_Name,Title,Url
399,Lobsters,compsci,CSE,Dr. Alan Kay on the Meaning of Object-Oriented Programming,http://www.purl.org/stefan_ram/pub/doc_kay_oop_en
400,Lobsters,compsci,CSE,Papers and Algorithms in LLVM's Source Code,https://github.com/oilshell/blog-code/blob/master/grep-for-papers/llvm.txt
401,Lobsters,compsci,CSE,Presenting XXH3,http://fastcompression.blogspot.com/2019/03/presenting-xxh3.html
402,Lobsters,compsci,CSE,The Slot Map (2013),http://seanmiddleditch.com/data-structures-for-game-developers-the-slot-map/
403,Lobsters,compsci,CSE,Exploiting and Automated Detection of Vulnerabilities in Web Applications (2007),http://www.zemris.fer.hr/~sgros/publications/diploma_thesis/suhina_vanja_seminar.pdf
404,Lobsters,compsci,CSE,M-expression,https://en.wikipedia.org/wiki/M-expression
405,Lobsters,compsci,CSE,Worstsort,https://byorgey.wordpress.com/2019/02/16/worstsort/
406,Lobsters,compsci,CSE,Contradiction in divide by zero,http://boxbase.org/entries/2019/mar/11/contradiction-in-divide-by-zero/
407,Lobsters,compsci,CSE,Flow-based Programming,http://www.jpaulmorrison.com/fbp/
408,Lobsters,compsci,CSE,Generating Finite State Machines from Abstract State Machines (2002),https://www.microsoft.com/en-us/research/wp-content/uploads/2002/07/issta02.pdf
409,Lobsters,compsci,CSE,How many words do you need to describe all words,https://news.ycombinator.com/item?id=19331307
410,Lobsters,compsci,CSE,The Linear Time Algorithm for Finding Fibonacci Numbers is not Linear,https://catonmat.net/linear-time-fibonacci
411,Lobsters,compsci,CSE,Computer science in JavaScript: Linked list,https://humanwhocodes.com/blog/2019/01/computer-science-in-javascript-linked-list/
412,Lobsters,compsci,CSE,Keeping CALM: when distributed consistency is easy,https://blog.acolyer.org/2019/03/06/keeping-calm-when-distributed-consistency-is-easy/
413,Lobsters,compsci,CSE,Introduction to Theoretical Computer Science,https://introtcs.org/public/index.html
414,Lobsters,compsci,CSE,Domain Modeling with Abstract Algebra,https://medium.com/@reidev275/domain-modeling-with-abstract-algebra-47f8f9e0d012
415,Lobsters,compsci,CSE,Increasing coverage of signal semantics in regression tests,https://blog.netbsd.org/tnf/entry/increasing_coverage_of_signal_semantics
416,Lobsters,compsci,CSE,"Some opinions about “algorithms startups”, from a sample size of approximately 1",https://branchfree.org/2018/06/12/some-opinions-about-algorithms-startups-from-a-sample-size-of-approximately-1/
417,Lobsters,compsci,CSE,A Critical Review of Dynamic Taint Analysis and Forward Symbolic Execution,https://asankhaya.github.io/pdf/ACriticalReviewofDynamicTaintAnalysisandForwardSymbolicExecution.pdf
418,Lobsters,compsci,CSE,"How do we tell truths that might hurt? (Dijkstra, 1982)",https://www.cs.utexas.edu/users/EWD/ewd04xx/EWD498.PDF
419,Lobsters,compsci,CSE,The Physics of Software,http://www.physicsofsoftware.com/papers.html
420,Lobsters,compsci,CSE,The NetBSD Foundation participating in Google Summer of Code 2019,https://blog.netbsd.org/tnf/entry/the_netbsd_foundation_participating_in
421,Lobsters,compsci,CSE,Static Analysis for Inference of Explicit Information Flow (2008),http://www.cs.rpi.edu/~milanova/docs/paste08.pdf
422,Lobsters,compsci,CSE,A Gentle Introduction to Lambda Calculus - Part 1: Syntax,https://lucasfcosta.com/2018/07/29/An-Introduction-to-Lambda-Calculus-Part-1.html
423,Lobsters,compsci,CSE,Type systems and logic,https://codewords.recurse.com/issues/one/type-systems-and-logic
424,Lobsters,compsci,CSE,A Survey of Runtime Policy Enforcement Techniques and Implementations (2011),https://core.ac.uk/download/pdf/150083566.pdf
425,Lobsters,compsci,CSE,Diving into Merkle Trees,https://ordepdev.me/posts/diving-into-merkle-trees
426,Lobsters,compsci,CSE,List of unsolved problems in computer science,https://en.wikipedia.org/wiki/List_of_unsolved_problems_in_computer_science
427,Lobsters,compsci,CSE,Rahul Gopinath's Summary of His Research on Mutation Testing,http://rahul.gopinath.org/
428,Lobsters,compsci,CSE,Generating Combinations: Gosper's Hack,http://andy.kitchen/combinations.html
429,Lobsters,compsci,CSE,A Generalised Solution to Distributed Consensus,https://arxiv.org/abs/1902.06776
430,Lobsters,compsci,CSE,Fisher-Yates Shuffle,https://en.wikipedia.org/wiki/Fisher%E2%80%93Yates_shuffle
431,Lobsters,compsci,CSE,Incompleteness Ex Machina,https://www.scottaaronson.com/incompleteness.pdf
432,Lobsters,compsci,CSE,rANS on 6502,https://yupferris.github.io/blog/2019/02/11/rANS-on-6502.html
433,Lobsters,compsci,CSE,What is Differentiable Programming?,https://fluxml.ai/2019/02/07/what-is-differentiable-programming.html
434,Lobsters,compsci,CSE,A survey on dynamic and stochastic vehicle routing problems (2015),https://hal.inria.fr/hal-01224562/document
435,Lobsters,compsci,CSE,fantasyland/fantasy-land: Specification for interoperability of common algebraic structures in Java,https://github.com/fantasyland/fantasy-land
436,Lobsters,compsci,CSE,MIT Hacker Tools: a lecture series on programmer tools,https://hacker-tools.github.io/
437,Lobsters,compsci,CSE,Tutorial: Creating an LLVM Backend for the Cpu0 Architecture,http://jonathan2251.github.io/lbd/
438,Lobsters,compsci,CSE,Modern LZ Compression,https://glinscott.github.io/lz/index.html
439,Lobsters,compsci,CSE,Integration of the LLVM sanitizers with the base system,https://blog.netbsd.org/tnf/entry/integration_of_the_llvm_sanitziers
440,Lobsters,compsci,CSE,Quadtree vs Spatial Hashing - a Visualization (2014),http://zufallsgenerator.github.io/2014/01/26/visually-comparing-algorithms/
441,Lobsters,compsci,CSE,Nested data structures with functional lenses,https://yapee.svbtle.com/nested-data-structures-with-lens
442,Lobsters,compsci,CSE,Multi-Scale Turing Patterns,https://softologyblog.wordpress.com/2011/07/05/multi-scale-turing-patterns/
443,Lobsters,compsci,CSE,Checks and Balances: Constraint Solving without Surprises in Object-Constraint Programming Language,http://www.vpri.org/pdf/tr2015002_oopsla15_babelsberg.pdf
444,Lobsters,compsci,CSE,Coding the Matrix: Linear Algebra through Computer Science Applications,http://academictorrents.com/details/54cd86f3038dfd446b037891406ba4e0b1200d5a
445,Lobsters,compsci,CSE,What is soundness (in static analysis)?,http://www.pl-enthusiast.net/2017/10/23/what-is-soundness-in-static-analysis/
446,Lobsters,compsci,CSE,Using Hammock Graphs to Structure Programs (2004),https://biblio.ugent.be/publication/291746/file/451220.pdf
447,Lobsters,compsci,CSE,Data structures to name-drop when you want to sound smart in an interview,http://blog.amynguyen.net/?p=853
448,Lobsters,compsci,CSE,Visit CERN/LHC,https://visits.web.cern.ch/
449,Lobsters,compsci,CSE,Impossible Programs,https://codon.com/impossible-programs
450,Lobsters,compsci,CSE,C++ Compile-Time Exceptions -- Debugging C++ templates should be less surreal and horrible,https://blog.esciencecenter.nl/c-compile-time-exceptions-5443f5bf06fe
451,Lobsters,compsci,CSE,"Analog computation, Part 1: What and why",https://www.analogictips.com/analog-computation-part-1-what-and-why/
452,Lobsters,compsci,CSE,"Paper Review: Empirical Study on Crash Recovery Bugs in Large-Scale, Distributed Systems",https://muratbuffalo.blogspot.com/2019/01/paper-review-empirical-study-on-crash.html
453,Lobsters,compsci,CSE,Quantum computing as a field is obvious bullshit,https://scottlocklin.wordpress.com/2019/01/15/quantum-computing-as-a-field-is-obvious-bullshit/
454,Lobsters,compsci,CSE,L4Linux - Linux running on the L4 microkernel,https://l4linux.org/overview.shtml
455,Lobsters,compsci,CSE,The Oodle LZNIB Algorithm,http://cbloomrants.blogspot.com/2019/01/the-oodle-lznib-algorithm.html
456,Lobsters,compsci,CSE,The first report on LLD porting,http://blog.netbsd.org/tnf/entry/the_first_report_on_lld
457,Lobsters,compsci,CSE,Complexity Explorer,https://www.complexityexplorer.org/
458,Lobsters,compsci,CSE,How Radix trees made blocking IPs 5000 times faster,https://blog.sqreen.io/demystifying-radix-trees/
459,Lobsters,compsci,CSE,Finite State Entropy: A New Breed of Entropy Coder (2013),https://fastcompression.blogspot.com/2013/12/finite-state-entropy-new-breed-of.html
460,Lobsters,compsci,CSE,Building Blocks for Theoretical Computer Science,http://mfleck.cs.illinois.edu/building-blocks/
461,Lobsters,compsci,CSE,Interpreting Programs in Static Single Assignment Form (2004),http://citeseerx.ist.psu.edu/viewdoc/download?doi=10.1.1.74.9046&rep=rep1&type=pdf
462,Lobsters,compsci,CSE,List of open source internships for students,https://github.com/tapaswenipathak/Open-Source-Internships
463,Lobsters,compsci,CSE,Data Structures and Functional Programming (ocaml and coq),https://www.cs.cornell.edu/courses/cs3110/2017fa/
464,Lobsters,compsci,CSE,In honor of Donald Knuth's 81 birthday Stanford uploaded 111 lectures on Youtube,http://www.youtube.com/playlist?list=PL94E35692EB9D36F3
465,Lobsters,compsci,CSE,Learning the Linux Kernel with tracing,https://www.youtube.com/watch?v=JRyrhsx-L5Y
466,Lobsters,compsci,CSE,The continuation passing transform and the Yoneda embedding,https://reperiendi.wordpress.com/2007/12/19/the-continuation-passing-transform-and-the-yoneda-embedding/
467,Lobsters,compsci,CSE,Reverse Engineering Machines with the Yoneda Lemma,http://blog.sigfpe.com/2006/11/yoneda-lemma.html
468,Lobsters,compsci,CSE,IBM Q System One,https://www.research.ibm.com/ibm-q/system-one/
469,Lobsters,compsci,CSE,Parallel Algorithms for Depth-First Search (1991),https://repository.upenn.edu/cgi/viewcontent.cgi?article=1444&context=cis_reports
470,Lobsters,compsci,CSE,Can you sign a quantum state?,https://arxiv.org/abs/1811.11858
471,Lobsters,compsci,CSE,Graphs are to categories as lists are to monoids,https://alhassy.github.io/PathCat/
472,Lobsters,compsci,CSE,Graph of NP-Complete Problems,https://adriann.github.io/npc/npc.html
473,Lobsters,compsci,CSE,Are all combinatorial problems susceptible to optimisation by caching?,/s/lvzzra/are_all_combinatorial_problems
474,Lobsters,compsci,CSE,Packrat Parsing: a Practical Linear-Time Algorithm with Backtracking (2002),https://pdos.csail.mit.edu/~baford/packrat/thesis/
475,Lobsters,compsci,CSE,An All-in-One DAG Toolkit,https://vaibhavsagar.com/blog/2017/06/10/dag-toolkit/
476,Lobsters,compsci,CSE,Leveraging Rust types for modular specification and verification,https://www.research-collection.ethz.ch/handle/20.500.11850/311092
477,Lobsters,compsci,CSE,Input Output Files in R from Cloud or Local storage,https://github.com/socialcopsdev/flyio
478,Lobsters,compsci,CSE,Algorithms by Jeff Erickson,http://jeffe.cs.illinois.edu/teaching/algorithms/#book
479,Lobsters,compsci,CSE,"A fluent, easy-to-use, object oriented Ruby HTTP/REST",https://github.com/gojektech/wrest
480,Lobsters,compsci,CSE,NetBSD entering 2019 with more complete LLVM support,http://blog.netbsd.org/tnf/entry/netbsd_entering_2019_with_more
481,Lobsters,compsci,CSE,Reversing an n-bit number in O(log n) time,https://medium.com/@ehudt/reversing-an-n-bit-number-in-o-log-n-time-9bf69363d452
482,Lobsters,compsci,CSE,Strings with hamming distance exactly 1,https://chaoxuprime.com/posts/2018-12-23-strings-with-hamming-distance-exactly-1.html
483,Lobsters,compsci,CSE,An enhanced HTTP client for Go,https://github.com/gojektech/heimdall
484,Lobsters,compsci,CSE,A stream processing framework to build stateless applications on Kafka in clojure,https://github.com/gojektech/ziggurat
485,Lobsters,compsci,CSE,DSMR: A Parallel Algorithm for Single-Source Shortest Path Problem (2016),http://iss.ices.utexas.edu/Publications/Papers/ICS2016.pdf
486,Lobsters,compsci,CSE,threadpool(9) -- an API for scheduling jobs on shared pools of threads,http://mail-index.netbsd.org/tech-kern/2018/12/26/msg024438.html
487,Lobsters,compsci,CSE,I hate the Pumping Lemma,https://bosker.wordpress.com/2013/08/18/i-hate-the-pumping-lemma/
488,Lobsters,compsci,CSE,A formally verified transformation to unify multiple nested clocks for a Lustre-like language,http://scis.scichina.com/en/2019/012801.pdf
489,Lobsters,compsci,CSE,Amoeba finds approximate solutions to NP-hard problem in linear time,https://phys.org/news/2018-12-amoeba-approximate-solutions-np-hard-problem.html
490,Lobsters,compsci,CSE,Fast vs. slow for engineers vs. theorists,https://twitter.com/polikarn/status/1073258037954007040
491,Lobsters,compsci,CSE,Exploring Quantum Neural Networks,http://ai.googleblog.com/2018/12/exploring-quantum-neural-networks.html
492,Lobsters,compsci,CSE,Best CS paper(s) that you read in 2018?,/s/otvlfc/best_cs_paper_s_you_read_2018
493,Lobsters,compsci,CSE,An introduction to gradient boosting,https://charlienewey.github.io/introduction-to-gradient-boosting/
494,Lobsters,compsci,CSE,Optimizing Siri on HomePod in Far‑Field Settings,https://machinelearning.apple.com/2018/12/03/optimizing-siri-on-homepod-in-far-field-settings.html
495,Lobsters,compsci,CSE,The NetBSD support update before the LLVM-8.0 branching point,http://blog.netbsd.org/tnf/entry/the_netbsd_support_update_before
496,Lobsters,compsci,CSE,Introducing NGS,https://hackernoon.com/introducing-ngs-d3d216d0daef
497,Lobsters,compsci,CSE,Foundations and Trends in Programming Languages: Program Synthesis,https://www.microsoft.com/en-us/research/wp-content/uploads/2017/10/program_synthesis_now.pdf
498,Lobsters,compsci,CSE,Rate-distortion optimization,https://fgiesen.wordpress.com/2018/12/10/rate-distortion-optimization/
499,Lobsters,compsci,CSE,Old Neglected Theorems Are Still Theorems,https://existentialtype.wordpress.com/2014/03/20/old-neglected-theorems-are-still-theorems/
500,Lobsters,compsci,CSE,Thoughts for a new minimal markup language,/s/chyhrd/thoughts_for_new_minimal_markup_language
501,Lobsters,compsci,CSE,Active Text for Structuring and Understanding Source Code (1996),https://pdfs.semanticscholar.org/7ff2/6dad3e5a3a4112e1ce1f291b09b89c91476d.pdf
502,Lobsters,compsci,CSE,The Swiss Army Knife of Hashmaps,https://blog.waffles.space/2018/12/07/deep-dive-into-hashbrown/
503,Lobsters,compsci,CSE,Uncertainty propagation in data processing systems,https://blog.acolyer.org/2018/11/23/uncertainty-propagation-in-data-processing-systems/
504,Lobsters,compsci,CSE,Formally Verified On-Line Diagnosis (1999),https://www.researchgate.net/profile/Neeraj_Suri/publication/2828216_Formally_Verified_On-Line_Diagnosis/links/00b495352419ec56d5000000/Formally-Verified-On-Line-Diagnosis.pdf?origin=publication_detail
505,Lobsters,compsci,CSE,CS631 - Advanced Programming in the UNIX Environment,https://stevens.netmeister.org/631/lecture14.pdf
506,Lobsters,compsci,CSE,How to Grow Neat Software Architecture out of Jupyter Notebooks,https://github.com/guillaume-chevalier/How-to-Grow-Neat-Software-Architecture-out-of-Jupyter-Notebooks
507,Lobsters,compsci,CSE,Functional programming bibliography?,/s/enbund/functional_programming_bibliography
508,Lobsters,compsci,CSE,A Highly Productive Implementation of an Out-of-Order Processor Generator,https://www2.eecs.berkeley.edu/Pubs/TechRpts/2018/EECS-2018-151.pdf
509,Lobsters,compsci,CSE,Reducing the delta with upstream version of sanitizers,https://blog.netbsd.org/tnf/entry/reducing_the_delta_with_upstream
510,Lobsters,compsci,CSE,The Arcane Algorithm Archive,https://www.algorithm-archive.org/
511,Lobsters,compsci,CSE,NP-hard does not mean hard,https://jeremykun.com/2017/12/29/np-hard-does-not-mean-hard/
512,Lobsters,compsci,CSE,Common Mistakes about Generational Garbage Collection,https://orbifold.xyz/garbage.html
513,Lobsters,compsci,CSE,From Nand to Tetris: Building a Modern Computer from First Principles,https://nand2tetris.org
514,Lobsters,compsci,CSE,Let's reinvent FRP (2017),http://vindum.io/blog/lets-reinvent-frp/
515,Lobsters,compsci,CSE,Every 7.8μs your computer’s memory has a hiccup,https://blog.cloudflare.com/every-7-8us-your-computers-memory-has-a-hiccup/
516,Lobsters,compsci,CSE,How physical addresses map to rows and banks in DRAM (2015),http://lackingrhoticity.blogspot.com/2015/05/how-physical-addresses-map-to-rows-and-banks.html
517,Lobsters,compsci,CSE,Two Approaches to Structured Concurrency,http://250bpm.com/blog:139
518,Lobsters,compsci,CSE,Virtual Reality [2016],http://vr.cs.uiuc.edu/
519,Lobsters,compsci,CSE,Computing History at Bell Labs,https://research.swtch.com/bell-labs
520,Lobsters,compsci,CSE,HICAMP: Architectural Support for Efficient Concurrency-safe Shared Structured Data Access,https://www.cs.princeton.edu/courses/archive/spring16/cos598F/p287-cheriton.pdf
521,Lobsters,compsci,CSE,Cliff Click is writing a new language: AA,https://github.com/cliffclick/aa
522,Lobsters,compsci,CSE,Regular Expression Matching Can Be Simple And Fast,https://swtch.com/~rsc/regexp/regexp1.html
523,Lobsters,compsci,CSE,Beating hash tables with trees? The ART-ful radix trie,https://www.the-paper-trail.org/post/art-paper-notes/
524,Lobsters,compsci,CSE,join(1) - relational database operator,https://man.openbsd.org/join.1
525,Lobsters,compsci,CSE,Aho-Corasick,https://brunorb.com/aho-corasick/
526,Lobsters,compsci,CSE,An Introduction to the Hitchhiker Tree,https://blog.datopia.io/2018/11/03/hitchhiker-tree/
527,Lobsters,compsci,CSE,NetBSD LLVM Sanitizers in The Bay Area,https://blog.netbsd.org/tnf/entry/netbsd_llvm_sanitizers_in_the
528,Lobsters,compsci,CSE,Plan 9 C compiler for RISC-V by Richard Miller,https://marc.info/?l=9fans&m=154076971426092&w=2
529,Lobsters,compsci,CSE,A Little Taste of Dependent Types,https://www.youtube.com/watch?v=VxINoKFm-S4
530,Lobsters,compsci,CSE,SYN packet handling in the wild,https://blog.cloudflare.com/syn-packet-handling-in-the-wild/
531,Lobsters,compsci,CSE,RobinHood: tail latency aware caching – dynamic reallocation from cache-rich to cache-poor,https://blog.acolyer.org/2018/10/26/robinhood-tail-latency-aware-caching-dynamic-reallocation-from-cache-rich-to-cache-poor/
532,Lobsters,compsci,CSE,SciLua: Scientific Computing with LuaJIT,http://scilua.org/
533,Lobsters,compsci,CSE,The Maude System,http://maude.cs.illinois.edu/w/index.php/The_Maude_System
534,Lobsters,compsci,CSE,Principles of Algorithmic Problem Solving,https://www.csc.kth.se/~jsannemo/slask/main.pdf
535,Lobsters,compsci,CSE,Zip Trees,https://arxiv.org/pdf/1806.06726
536,Lobsters,compsci,CSE,"Hand-rolling a minimal interpreted programming language from scratch: grammar, parser and evaluation",https://rbaron.net/blog/2018/10/05/Hand-rolling-a-minimal-interpreted-programming-language-from-scratch.html
537,Lobsters,compsci,CSE,QArt Codes (2012),https://research.swtch.com/qart
538,Lobsters,compsci,CSE,Consistency Models,http://jepsen.io/consistency
539,Lobsters,compsci,CSE,Survey of Approaches for Handling Static Analysis Alarms (2016),https://www.win.tue.nl/~aserebre/SCAM2016.pdf
540,Lobsters,compsci,CSE,Introduction to Locality-Sensitive Hashing,http://unboxresearch.com/articles/lsh_post1.html
541,Lobsters,compsci,CSE,"Hash, displace, and compress",http://cmph.sourceforge.net/papers/esa09.pdf
542,Lobsters,compsci,CSE,A Grad Student Solved a Fundamental Quantum Computing Problem,https://www.wired.com/story/a-grad-student-solved-a-fundamental-quantum-computing-problem/
543,Lobsters,compsci,CSE,Cache-Oblivious Algorithms and Data Structures (2002),http://erikdemaine.org/papers/BRICS2002/paper.pdf
544,Lobsters,compsci,CSE,"Aleph: A leaderless, asynchronous, byzantine fault tolerant consensus protocol",https://arxiv.org/pdf/1810.05256.pdf
545,Lobsters,compsci,CSE,"Local Minima, Saddle Points, and Plateaus",http://theorangeduck.com/page/local-minima-saddle-points-plateaus
546,Lobsters,compsci,CSE,Checkpointing and Consistent Recovery Lines: How We Handle Failure in Wallaroo,https://blog.wallaroolabs.com/2018/10/checkpointing-and-consistent-recovery-lines-how-we-handle-failure-in-wallaroo/
547,Lobsters,compsci,CSE,Real Differences between OT and CRDT for Co-Editors,https://arxiv.org/abs/1810.02137
548,Lobsters,compsci,CSE,List of Theoretical CS conferences and workshops,https://cstheory.stackexchange.com/q/7900/36569
549,Lobsters,compsci,CSE,"Noria: dynamic, partially-stateful data-flow for high-performance web applications",https://www.usenix.org/conference/osdi18/presentation/gjengset
550,Lobsters,compsci,CSE,Fractal Tree Index,https://en.wikipedia.org/wiki/Fractal_tree_index
551,Lobsters,compsci,CSE,Log(Graph): A Near-Optimal High-Performance Graph Representation,https://people.csail.mit.edu/jshun/papers/loggraph.pdf
552,Lobsters,compsci,CSE,Build Systems à la Carte,https://www.youtube.com/watch?v=BQVT6wiwCxM
553,Lobsters,compsci,CSE,Kinda okay generated text,https://blog.ftql.pw/posts/random-text/
554,Lobsters,compsci,CSE,CS 673 — Computational Creativity,http://axon.cs.byu.edu/Dan/673/
555,Lobsters,compsci,CSE,Programming-by-Example for Audio: Synthesizing Digital Signal Processing Programs,http://marksantolucito.com/dsp-pbe.pdf
556,Lobsters,compsci,CSE,Optimizing MiniZinc,https://www.hillelwayne.com/post/minizinc-2/
557,Lobsters,compsci,CSE,"Solvers, Synthesis, and Learning",https://cs.nyu.edu/~barrett/summerschool/seshia.pdf
558,Lobsters,compsci,CSE,An Introduction to Probabilistic Programming,https://arxiv.org/abs/1809.10756
559,Lobsters,compsci,CSE,Nand to CPU,https://blog.asrpo.com/nand2cpu
560,Lobsters,compsci,CSE,Pharo: A roadmap to solid evolution,https://www.slideshare.net/EstebanLM/pharo-a-roadmap-to-solid-evolution
561,Lobsters,compsci,CSE,"Diagramming datastructures, packet and on disk formats?",/s/2qcryb/diagramming_datastructures_packet_on
562,Lobsters,compsci,CSE,Foundations of Dataflow Analysis,https://chinmaydd.in/2018/09/22/FoundationsDFlow
563,Lobsters,compsci,CSE,Turing Machines (Stanford Encyclopedia of Philosophy),https://plato.stanford.edu/entries/turing-machine/
564,Lobsters,compsci,CSE,Constraint Solving with Minizinc,https://www.hillelwayne.com/post/minizinc/
565,Lobsters,compsci,CSE,You and Your Research (1986),https://jamesclear.com/great-speeches/you-and-your-research-by-richard-hamming
566,Lobsters,compsci,CSE,Performing Efficient Broad Crawls with the AOPIC Algorithm,https://intoli.com/blog/aopic-algorithm/
567,Lobsters,compsci,CSE,Whatever Happened to the Semantic Web?,https://twobithistory.org/2018/05/27/semantic-web.html
568,Lobsters,compsci,CSE,How libcorrect Implements Forward Error Correction,https://quiet.github.io/quiet-blog/2018/09/16/How-Libcorrect-Does-Forward-Error-Correction.html
569,Lobsters,compsci,CSE,"Functional Reactive Approach to Developing Small-Scale, Embedded Systems",http://www.psg.c.titech.ac.jp/frp_embedded.html
570,Lobsters,compsci,CSE,Moment-based quantile sketches for efficient aggregation,https://dawn.cs.stanford.edu/2018/08/29/moments/
571,Lobsters,compsci,CSE,Of Program Analysis and more,https://chinmaydd.in/2018/09/05/ProgramAnalysis
572,Lobsters,compsci,CSE,Functional Languages for Real-Time Control,https://www.cs.cmu.edu/~rbd/bib-arctic.html
573,Lobsters,compsci,CSE,Papers with Code,https://github.com/zziz/pwc
574,Lobsters,compsci,CSE,Yesterday's Computer of Tomorrow: The Xerox Alto (2017),https://www.youtube.com/watch?v=4m_GhapEBLQ
575,Lobsters,compsci,CSE,A celebration of code – 6 pieces of code that had an impact,https://www.reaktor.com/celebrationofcode/
576,Lobsters,compsci,CSE,"How to Match ""A B C"" where A+B=C with Regex",http://www.drregex.com/2018/09/a-regex-i-submitted-to-reddit-climbed.html
577,Lobsters,compsci,CSE,"A Brief, Animated Introduction to Programming with Python",https://ourcodestories.com/markm208/Playlist/16
578,Lobsters,compsci,CSE,pegdebug - visual and interactive debugging of peg parsing,https://mqnc.github.io/pegdebug/example/output.html
579,Lobsters,compsci,CSE,An optimal solution to the Towers of Hanoi Puzzle,https://web.archive.org/web/20040605074124/http://yupana.autonoma.edu.co/publicaciones/yupana/003/hanoi/hanoi_eng.html
580,Lobsters,compsci,CSE,Finishing leftover tasks from Google Summer of Code,https://blog.netbsd.org/tnf/entry/finishing_leftover_tasks_from_google
581,Lobsters,compsci,CSE,"50 times faster data loading for Pandas: no problem, using C++",https://blog.esciencecenter.nl/irregular-data-in-pandas-using-c-88ce311cb9ef
582,Lobsters,compsci,CSE,A Little Taste of Dependent Types (David Thrane Christiansen),https://www.youtube.com/watch?v=1BWYy2-WM-o
583,Lobsters,compsci,CSE,The Multi-Armed Bandit Problem and Its Solutions,https://lilianweng.github.io/lil-log/2018/01/23/the-multi-armed-bandit-problem-and-its-solutions.html
584,Lobsters,compsci,CSE,Fully Countering Trusting Trust through Diverse Double-Compiling [2009],https://www.dwheeler.com/trusting-trust/dissertation/html/wheeler-trusting-trust-ddc.html
585,Lobsters,compsci,CSE,Ideal Hash Trees (2001),https://infoscience.epfl.ch/record/64398/files/idealhashtrees.pdf
586,Lobsters,compsci,CSE,The Early History Of Smalltalk,http://worrydream.com/EarlyHistoryOfSmalltalk/
587,Lobsters,compsci,CSE,Production Ready Microservices at Scale in Ruby,https://www.youtube.com/watch?v=SJpKo2hz6ws
588,Lobsters,compsci,CSE,The Emperor's Old Clothes,http://delivery.acm.org/10.1145/360000/358561/p75-hoare.pdf
589,Lobsters,compsci,CSE,The Abstract Calculus,https://medium.com/@maiavictor/the-abstract-calculus-fe8c46bcf39c
590,Lobsters,compsci,CSE,The Evolutionary Origins of Hierarchy (2016),http://journals.plos.org/ploscompbiol/article?id=10.1371/journal.pcbi.1004829
591,Lobsters,compsci,CSE,Federated Learning,https://florian.github.io/federated-learning/
592,Lobsters,compsci,CSE,William Byrd on The Most Beautiful Program Ever Written,https://paperswelove.org/2017/video/will-byrd-most-beautiful-program/
593,Lobsters,compsci,CSE,CrowdTruth 2.0: Quality Metrics for Crowdsourcing with Disagreement,https://arxiv.org/abs/1808.06080
594,Lobsters,compsci,CSE,Collapsing Towers of Interpreters,/s/yj31ty/collapsing_towers_interpreters
