ID,Source,Tag_Code,Tag_Name,Title,Url
595,Lobsters,compsci,CSE,Comprehensive Threadripper tests - memory vs cpu freq at capped power,http://lists.dragonflybsd.org/pipermail/users/2018-August/357856.html
596,Lobsters,compsci,CSE,What Did Ada Lovelace's Program Actually Do?,https://twobithistory.org/2018/08/18/ada-lovelace-note-g.html
597,Lobsters,compsci,CSE,Universal Method for Approximate Nearest-Neighbor Search Found,https://www.quantamagazine.org/universal-method-to-sort-complex-information-found-20180813/
598,Lobsters,compsci,CSE,"Kitsune: Efficient, General-Purpose Framework for Dynamic, Software Updating in C",http://kitsune-dsu.com
599,Lobsters,compsci,CSE,A Very Small SAT Solver,http://www.cse.chalmers.se/~algehed/blogpostsHTML/SAT.html
600,Lobsters,compsci,CSE,"Modern SAT solvers: fast, neat and underused (part 2 of N)",http://codingnest.com/modern-sat-solvers-fast-neat-and-underused-part-2-of-n/
601,Lobsters,compsci,CSE,Luna v1.4 released — a programming language with dual (textual/visual) representation,https://luna-lang.org
602,Lobsters,compsci,CSE,Those Memex Dreams Again,http://natecull.org/wordpress/2017/06/26/dataspace-0/
603,Lobsters,compsci,CSE,"GSoC 2018 Reports: Integrate libFuzzer with the Basesystem, Part 3",https://blog.netbsd.org/tnf/entry/gsoc_2018_reports_integrate_libfuzzer2
604,Lobsters,compsci,CSE,Dijkstra's in Disguise,https://blog.evjang.com/2018/08/dijkstras.html
605,Lobsters,compsci,CSE,Functional Bits: Lambda Calculus based Algorithmic Information Theory,https://tromp.github.io/cl/LC.pdf
606,Lobsters,compsci,CSE,Bounding data races in space and time – part I,https://blog.acolyer.org/2018/08/09/bounding-data-races-in-space-and-time-part-i/
607,Lobsters,compsci,CSE,Eller's Algorithm,http://www.neocomputer.org/projects/eller.html
608,Lobsters,compsci,CSE,GLB: GitHub’s open source load balancer,https://githubengineering.com/glb-director-open-source-load-balancer/
609,Lobsters,compsci,CSE,Herbie: Automatically Improving Floating Point Accuracy,https://herbie.uwplse.org/
610,Lobsters,compsci,CSE,Tries as the evolution of nothing,http://wordsandbuttons.online/tries_as_the_evolution_of_nothing.html
611,Lobsters,compsci,CSE,Introduction to µUBSan - a clean-room reimplementation of the Undefined Behavior Sanitizer runtime,https://blog.netbsd.org/tnf/entry/introduction_to_%C2%B5ubsan_a_clean
612,Lobsters,compsci,CSE,Data Structures for Text Sequences (1998),https://www.cs.unm.edu/~crowley/papers/sds.pdf
613,Lobsters,compsci,CSE,Floating (point) butterfly effect: Searching for tiny bugs that cause big problems,https://blog.esciencecenter.nl/floating-point-butterfly-effect-62ebe004200f
614,Lobsters,compsci,CSE,A Survey of Programming Languages and Platforms for Multi-Agent Systems (2006),https://vsis-www.informatik.uni-hamburg.de/getDoc.php/publications/259/bordini_informatica_final.pdf
615,Lobsters,compsci,CSE,"Modern SAT solvers: fast, neat and underused (part 1 of N)",http://codingnest.com/modern-sat-solvers-fast-neat-underused-part-1-of-n/
616,Lobsters,compsci,CSE,"Survey of Contemporary, Real-Time, Operating Systems (2004)",http://www.eng.auburn.edu/~baskiyar/MyArticles/Survey-of-RTOS-Informatica.pdf
617,Lobsters,compsci,CSE,"A Typed, Algebraic Approach to Parsing",http://semantic-domain.blogspot.com/2018/07/a-typed-algebraic-approach-to-parsing.html
618,Lobsters,compsci,CSE,A Practical Theory Of Programming,http://www.cs.toronto.edu/~hehner/aPToP/aPToP.pdf
619,Lobsters,compsci,CSE,Prospecting for Hash Functions,https://nullprogram.com/blog/2018/07/31/
620,Lobsters,compsci,CSE,Teenager Finds Classical Alternative to Quantum Recommendation Algorithm,https://www.quantamagazine.org/teenager-finds-classical-alternative-to-quantum-recommendation-algorithm-20180731/
621,Lobsters,compsci,CSE,Evolving Floorplans,http://www.joelsimon.net/evo_floorplans.html
622,Lobsters,compsci,CSE,"Given Enough Eyeballs, All Bugs Are Shallow? Revisiting Eric Raymond with Bug Bounty Programs",https://weis2016.econinfosec.org/wp-content/uploads/sites/2/2015/08/WEIS_2016_paper_76.pdf
623,Lobsters,compsci,CSE,[1807.08248] Subset Sum Made Simple,https://arxiv.org/abs/1807.08248
624,Lobsters,compsci,CSE,Efficiently Generating a Number in a Range,http://www.pcg-random.org/posts/bounded-rands.html
625,Lobsters,compsci,CSE,A Short Guide to Hard Problems,https://www.quantamagazine.org/a-short-guide-to-hard-problems-20180716/
626,Lobsters,compsci,CSE,When your data model means something else,http://www.pathsensitive.com/2018/07/when-your-data-model-means-something.html
627,Lobsters,compsci,CSE,Base Date? 17-Nov-1858? Julian Calendar? (1999),http://h41379.www4.hpe.com/wizard/wiz_2315.html
628,Lobsters,compsci,CSE,The Remote Monad,http://www.ittc.ku.edu/research/thesis/documents/justin_dawson_thesis.pdf
629,Lobsters,compsci,CSE,Blockchain for the Internet of Things: a Systematic Literature Review (2016),https://nexa.polito.it/nexacenterfiles/Blockchain%20for%20the%20Internet%20of%20Things%3A%20a%20Systematic%20Literature%20Review.pdf
630,Lobsters,compsci,CSE,Getting to Go,https://blog.golang.org/ismmkeynote
631,Lobsters,compsci,CSE,Accidentally Quadratic! mercurial changegroup application,https://accidentallyquadratic.tumblr.com/post/161243900944/mercurial-changegroup-application
632,Lobsters,compsci,CSE,Spiffy: Enabling File-System Aware Storage Applications,https://www.usenix.org/system/files/conference/fast18/fast18-sun.pdf
633,Lobsters,compsci,CSE,Optimisation Techniques,https://www.computist.xyz/2018/07/optimisation-techniques.html
634,Lobsters,compsci,CSE,Deriving the Y Combinator in JavaScript,https://enlight.nyc/y-combinator/
635,Lobsters,compsci,CSE,Escaped Text,https://rain-1.github.io/escaping.html
636,Lobsters,compsci,CSE,Inside ASCII (1978),https://trnsz.com/~jhj/misc/Inside_ASCII.pdf
637,Lobsters,compsci,CSE,“Breakthrough” algorithm exponentially faster than any previous one,https://www.seas.harvard.edu/content/breakthrough-algorithm-exponentially-faster-than-any-previous-one
638,Lobsters,compsci,CSE,"Functors, Applicatives, And Monads In Pictures","https://github.com/dbrattli/OSlash/wiki/Functors,-Applicatives,-And-Monads-In-Pictures"
639,Lobsters,compsci,CSE,Monads Made Simple,https://mpc.sh/blog/monads-made-simple/
640,Lobsters,compsci,CSE,The Federalist Papers: Author Identification Through K-Means Clustering,https://blog.jonlu.ca/posts/the-federalist-papers-author-identification-through-k-means-clustering
641,Lobsters,compsci,CSE,Looking at TDD: An Academic Survey,https://www.tedmyoung.com/looking-at-tdd-an-academic-survey/
642,Lobsters,compsci,CSE,"Lossy text compression, for some reason?! (2016)",https://www.youtube.com/watch?v=meovx9OqWJc
643,Lobsters,compsci,CSE,Bartosz Milewski's 'Category Theory for Programmers' compiled in EPUB,https://github.com/onlurking/category-theory-for-programmers
644,Lobsters,compsci,CSE,"If You’re Not Writing a Program, Don't Use a Programming Language",http://muratbuffalo.blogspot.com/2018/07/if-youre-not-writing-program-dont-use.html
645,Lobsters,compsci,CSE,Short introduction to programming in Self,https://www.youtube.com/watch?v=sgrlpUtrIR4
646,Lobsters,compsci,CSE,MKSANITIZER - bug detector software integration with the NetBSD userland,https://blog.netbsd.org/tnf/entry/mksanitizer_bug_detector_software_integration
647,Lobsters,compsci,CSE,Quantum Computing Expert Explains One Concept in 5 Levels of Difficulty,https://www.youtube.com/watch?v=OWJCfOvochA
648,Lobsters,compsci,CSE,Have you ever needed to generate a random number in code?,https://threadreaderapp.com/thread/1012719876706840578.html
649,Lobsters,compsci,CSE,A Personal History of Modeless Text Editing and Cut/Copy-Paste (2012),http://worrydream.com/refs/Tesler%20-%20A%20Personal%20History%20of%20Modeless%20Text%20Editing%20and%20Cut-Copy-Paste.pdf
650,Lobsters,compsci,CSE,High-Coverage Hint Generation for Massive Courses,https://people.eecs.berkeley.edu/%7Emangpo/www/papers/61a_hint_Iticse2017.pdf
651,Lobsters,compsci,CSE,The Arcane Algorithm Archive,https://www.algorithm-archive.org/
652,Lobsters,compsci,CSE,Georgia Tech's Online MOOC-based Master Program (Open edX Keynote),https://www.youtube.com/watch?v=-ETTblOvH6w
653,Lobsters,compsci,CSE,World's first commercial 5G network launches,https://www.techradar.com/news/worlds-first-5g-network-launches
654,Lobsters,compsci,CSE,Deep code search,https://blog.acolyer.org/2018/06/26/deep-code-search/
655,Lobsters,compsci,CSE,Codec2: a whole Podcast on a Floppy Disk,https://auphonic.com/blog/2018/06/01/codec2-podcast-on-floppy-disk/
656,Lobsters,compsci,CSE,Why teach kids to program? (2017),https://arp242.net/weblog/kids-programming.html
657,Lobsters,compsci,CSE,BQP is not contained PH,https://www.quantamagazine.org/finally-a-problem-that-only-quantum-computers-will-ever-be-able-to-solve-20180621/
658,Lobsters,compsci,CSE,All* perfect pangrams of English,https://medium.com/@FallingForFallacies/all-perfect-pangrams-of-english-8c8d0f621bee
659,Lobsters,compsci,CSE,Synthesizing Data Structure Transformations from Input-Output Examples,https://www.cs.rice.edu/~sc40/pubs/pldi15.pdf
660,Lobsters,compsci,CSE,Fibonacci Hashing: The Optimization that the World Forgot (or: a Better Alternative to Integer Modulo),https://probablydance.com/2018/06/16/fibonacci-hashing-the-optimization-that-the-world-forgot-or-a-better-alternative-to-integer-modulo/
661,Lobsters,compsci,CSE,List of Applications of Set Theory in Computer Science,https://www.quora.com/What-are-the-applications-of-set-theory-in-computer-science
662,Lobsters,compsci,CSE,"GSoC 2018 Reports: Kernel Undefined Behavior Sanitizer, Part 1",https://blog.netbsd.org/tnf/entry/gsoc_2018_reports_kernel_undefined
663,Lobsters,compsci,CSE,What UNIX shell could have been,https://rain-1.github.io/shell-2.html
664,Lobsters,compsci,CSE,"GSoC 2018 Reports: Integrate libFuzzer with the Basesystem, Part 1",https://blog.netbsd.org/tnf/entry/gsoc_2018_reports_integrate_libfuzzer
665,Lobsters,compsci,CSE,"GSoC 2018 Reports: Kernel Address Sanitizer, Part 1",http://blog.netbsd.org/tnf/entry/gsoc_2018_reports_kernel_address
666,Lobsters,compsci,CSE,Sudoku and Backtracking,https://hackernoon.com/sudoku-and-backtracking-6613d33229af
667,Lobsters,compsci,CSE,LAMBDAFICTATOR: From Imperative to Functional Programming via Automated Refactoring (2013),http://dig.cs.illinois.edu/papers/icse13tool-LambdaFicator.pdf
668,Lobsters,compsci,CSE,Introduction to fountain codes: LT Codes with Python,https://franpapers.com/en/algorithmic/2018-introduction-to-fountain-codes-lt-codes-with-python/
669,Lobsters,compsci,CSE,A Gentle Intro to PLT (Programming Language Theory),https://mpc.sh/blog/a-gentle-intro-to-plt/
670,Lobsters,compsci,CSE,Program to generate regexes that match numbers divisible by N,https://github.com/tchajed/div-regex
671,Lobsters,compsci,CSE,The Land Before Binary,https://medium.com/@bellmar/the-land-before-binary-cc705d5bdd70
672,Lobsters,compsci,CSE,SpaceSearch: A Library for Building and Verifying Solver-Aided Tools (2017),https://stefanheule.com/papers/icfp17-spacesearch.pdf
673,Lobsters,compsci,CSE,Graph Theory Crash Course,https://aaronlelevier.github.io/graph-theory-crash-course/
674,Lobsters,compsci,CSE,Coverage of signal routines in the kernel in the context of ptrace(2),https://blog.netbsd.org/tnf/entry/coverage_of_signal_routines_in
675,Lobsters,compsci,CSE,How to add numbers (part 2),https://robey.lag.net/2012/11/14/how-to-add-numbers-2.html
676,Lobsters,compsci,CSE,Learning Topic Models Provably and Efficiently,https://cacm.acm.org/magazines/2018/4/226373-learning-topic-models-provably-and-efficiently/fulltext
677,Lobsters,compsci,CSE,The Philosophy of Computational Complexity,https://ristret.com/s/qk8wpt/philosophy_computational_complexity
678,Lobsters,compsci,CSE,Analysis of Selected Aspects of GRAD (1974),http://www.jfsowa.com/computer/memo125.htm 
679,Lobsters,compsci,CSE,A new fast hash table in response to Google’s new fast hash table,https://probablydance.com/2018/05/28/a-new-fast-hash-table-in-response-to-googles-new-fast-hash-table/
680,Lobsters,compsci,CSE,How to add numbers (part 1),https://robey.lag.net/2012/11/07/how-to-add-numbers-1.html
681,Lobsters,compsci,CSE,"Failure Modes, dep author's view of vgo",https://sdboyer.io/vgo/failure-modes/
682,Lobsters,compsci,CSE,Type Safety in Three Easy Lemmas (2013),http://siek.blogspot.com/2013/05/type-safety-in-three-easy-lemmas.html
683,Lobsters,compsci,CSE,Optimally Robust Private Information Retrieval,https://cypherpunks.ca/~iang/pubs/orpir-usenix.pdf
684,Lobsters,compsci,CSE,Succinct Trees in Practice (2010),https://www.dcc.uchile.cl/~gnavarro/ps/alenex10.pdf
685,Lobsters,compsci,CSE,Algorithms Behind Modern Storage Systems,https://queue.acm.org/detail.cfm?id=3220266
686,Lobsters,compsci,CSE,Quantum Computing for Computer Scientists,https://www.youtube.com/watch?v=F_Riqjdh2oM
687,Lobsters,compsci,CSE,Out of the Tar Pit,http://curtclifton.net/papers/MoseleyMarks06a.pdf
688,Lobsters,compsci,CSE,An O(N) Sorting Algorithm: Machine Learning Sorting,https://arxiv.org/abs/1805.04272
689,Lobsters,compsci,CSE,"Introducing scdoc, a man page generator",http://sircmpwn.github.io/2018/05/13/scdoc.html
690,Lobsters,compsci,CSE,Common Knowledge Revisited (1995),https://www.cs.cornell.edu/home/halpern/papers/ck_revisited.pdf
691,Lobsters,compsci,CSE,The circuit less traveled,https://fosdem.org/2018/schedule/event/alternative_histories/
692,Lobsters,compsci,CSE,Refal: Programming with Pattern Matching and Term Rewriting (1968),https://en.wikipedia.org/wiki/Refal
693,Lobsters,compsci,CSE,Yad Studio: Markov Algorithms IDE and Interpreter,https://yad-studio.github.io
694,Lobsters,compsci,CSE,Ask: Algorithmic complexity in documentation,/s/sfenha/ask_algorithmic_complexity
695,Lobsters,compsci,CSE,Forking fixes in the context of debuggers,https://blog.netbsd.org/tnf/entry/forking_fixes_in_the_context
696,Lobsters,compsci,CSE,Announcing Google Summer of Code 2018 projects,https://blog.netbsd.org/tnf/entry/announcing_google_summer_of_code
697,Lobsters,compsci,CSE,Simulation of Biology,https://www.cc.gatech.edu/~turk/bio_sim/
698,Lobsters,compsci,CSE,Lessons from Building Static Analysis Tools at Google,https://cacm.acm.org/magazines/2018/4/226371-lessons-from-building-static-analysis-tools-at-google/fulltext
699,Lobsters,compsci,CSE,When do changes induce fixes? (On Fridays.) (2005),https://www.st.cs.uni-saarland.de/papers/msr2005/msr2005.pdf
700,Lobsters,compsci,CSE,Call for Papers | EuroBSDcon 2018,https://2018.eurobsdcon.org/call-for-papers/
701,Lobsters,compsci,CSE,ForwardCom: Forward compatible computer system,http://www.forwardcom.info/
702,Lobsters,compsci,CSE,Can Logic Programming Execute as Fast as Imperative Programming? (1990),http://www2.eecs.berkeley.edu/Pubs/TechRpts/1990/CSD-90-600.pdf
703,Lobsters,compsci,CSE,Compatible Time-Sharing System (1961-1973) Fiftieth Anniversary Commemorative Overview [2011-2012],http://multicians.org/thvv/compatible-time-sharing-system.pdf
704,Lobsters,compsci,CSE,A Tale of Two Fibonacci Lambda Functions,https://www.reddit.com/r/serverless/
705,Lobsters,compsci,CSE,Help needed: Static typing and algebra,/s/gjodxi/help_needed_static_typing_algebra
706,Lobsters,compsci,CSE,Papers from the Lost Culture of Array Languages,http://prog21.dadgum.com/114.html
707,Lobsters,compsci,CSE,MirBSD Korn Shell on Jehanne,http://www.mirbsd.org/permalinks/wlog-10_e20180415-tg.htm
708,Lobsters,compsci,CSE,Software Testing as Species Discovery (statistical properties of fuzzing campaigns),https://arxiv.org/abs/1803.02130
709,Lobsters,compsci,CSE,Automatic Protoboard Layout from Circuit Schematics (2013),https://dspace.mit.edu/bitstream/handle/1721.1/91847/894250012-MIT.pdf?sequence=2
710,Lobsters,compsci,CSE,"Fantas, Eel, and Specification (Fantasy Land Javascript)",http://www.tomharding.me/fantasy-land/
711,Lobsters,compsci,CSE,(Some of) my problems with correctness research,https://www.drmaciver.com/2018/04/some-of-my-problems-with-correctness-research/
712,Lobsters,compsci,CSE,Formal Specification and Verification of Interactive Systems with Plasticity for Nuclear Plants,https://tel.archives-ouvertes.fr/tel-01253619/document
713,Lobsters,compsci,CSE,Type-and-Example-Directed Program Synthesis (2015),http://www.cis.upenn.edu/~stevez/papers/OZ15.pdf
714,Lobsters,compsci,CSE,Consensus Protocols: Path to Atomic Broadcast,https://medium.com/@ifesdjeen/on-ways-to-agree-part-2-path-to-atomic-broadcast-662cc86a4e5f
715,Lobsters,compsci,CSE,Fuchsia is not Linux,https://fuchsia.googlesource.com/docs/+/master/the-book/
716,Lobsters,compsci,CSE,Making real-time collaboration over CloudKit and P2P networks possible using CRDTs and Swift.,https://github.com/archagon/crdt-playground
717,Lobsters,compsci,CSE,Function pipeline monoid,https://typeclasses.com/news/2018-04-a-monoid-is
718,Lobsters,compsci,CSE,Next generation video: Introducing AV1,https://people.xiph.org/~xiphmont/demo/av1/demo1.shtml
719,Lobsters,compsci,CSE,A catamorphic lambda-calculus interpreter,https://www.michaelpj.com/blog/2018/04/08/catamorphic-lc-interpreter.html
720,Lobsters,compsci,CSE,Some Minesweeper Conﬁgurations,http://web.mat.bham.ac.uk/R.W.Kaye/minesw/minesw.pdf
721,Lobsters,compsci,CSE,PubGrub: Next-Generation Version Solving,https://medium.com/@nex3/pubgrub-2fb6470504f
722,Lobsters,compsci,CSE,Programming with a Differentiable Forth Interpreter (2017),https://arxiv.org/pdf/1605.06640.pdf
723,Lobsters,compsci,CSE,Linux kernel memory-model (documentation & tooling),https://git.kernel.org/pub/scm/linux/kernel/git/torvalds/linux.git/commit/?id=1c27b644c0fdbc61e113b8faee14baeb8df32486
724,Lobsters,compsci,CSE,Ethereum's Compact Merkle Trie (Part I),https://nervous.io/clojure/crypto/2018/04/04/clojure-evm-iii/
725,Lobsters,compsci,CSE,Decentralizing Public Key Infrastructures with ClaimChains,https://arxiv.org/pdf/1707.06279.pdf
726,Lobsters,compsci,CSE,Computational Microscope,https://www.scientificcomputing.com/news/2018/04/team-uses-blue-waters-supercomputer-bring-subatomic-resolution-computational-microscope
727,Lobsters,compsci,CSE,Variability and Reproducibility in Software Engineering: Study of Companies that Built Same System,https://www.gwern.net/docs/statistics/bias/2009-anda.pdf
728,Lobsters,compsci,CSE,Awesome List of Distributed System Resources,https://github.com/rShetty/awesome-distributed-systems
729,Lobsters,compsci,CSE,Data Laced with History: Causal Trees & Operational CRDTs,http://archagon.net/blog/2018/03/24/data-laced-with-history/
730,Lobsters,compsci,CSE,The differences between tinkering and research (2016),http://togelius.blogspot.com/2016/04/the-differences-between-tinkering-and.html
731,Lobsters,compsci,CSE,Using Models at Runtime to Address Assurance for Self-Adaptive Systems (2014),https://arxiv.org/pdf/1505.00903.pdf
732,Lobsters,compsci,CSE,a lambda calculus for quantum computation,http://www.het.brown.edu/people/andre/qlambda/index.html
733,Lobsters,compsci,CSE,Rethinking Software Design,https://www.youtube.com/watch?v=blLhklI625s
734,Lobsters,compsci,CSE,How sorted array process faster than Unsorted array? (in short Branch Prediction),https://medium.com/@_neerajpal/how-sorted-array-process-faster-than-unsorted-array-in-short-branch-prediction-772c96e147b2
735,Lobsters,compsci,CSE,"On Ways To Agree: Links, Generals and Impossibility Problem",https://medium.com/@ifesdjeen/on-ways-to-agree-part-1-links-and-flp-impossibility-f6bd8a6a0980
736,Lobsters,compsci,CSE,Computer Science in Every High School,https://www.tealsk12.org/
737,Lobsters,compsci,CSE,Katahdin - a programming language where the syntax and semantics are mutable at runtime,http://chrisseaton.com/katahdin/
738,Lobsters,compsci,CSE,Synthesis-Based Loose Programming (2010),https://pdfs.semanticscholar.org/d272/645780501ccb188a9bb8b6814bf49cfe871c.pdf
739,Lobsters,compsci,CSE,It certainly looks bad for Uber,http://ideas.4brad.com/it-certainly-looks-bad-uber
740,Lobsters,compsci,CSE,Alan Kay's answer to Why is functional programming seen as the opposite of OOP,https://www.quora.com/Why-is-functional-programming-seen-as-the-opposite-of-OOP-rather-than-an-addition-to-it
741,Lobsters,compsci,CSE,Why we still can’t stop plagiarism in undergraduate computer science,https://kevinchen.co/blog/cant-stop-plagiarism-in-computer-science/
742,Lobsters,compsci,CSE,John Hennessy and David Patterson will receive the 2017 ACM A.M. Turing Award,https://www.acm.org/media-center/2018/march/turing-award-2017
743,Lobsters,compsci,CSE,[1803.06617] Towards an Area-Efficient Implementation of a High ILP EDGE Soft Processor,https://arxiv.org/abs/1803.06617
744,Lobsters,compsci,CSE,Persistence for the Masses: RRB-Vectors in a Systems Language (2017),https://public.sinusoid.es/misc/immer/immer-icfp17.pdf
745,Lobsters,compsci,CSE,Automatic Synthesis of Distributed Protocols (2017),https://www.cis.upenn.edu/~alur/Sigact17.pdf
746,Lobsters,compsci,CSE,Software Foundations - Vol 1-3,https://softwarefoundations.cis.upenn.edu/current/index.html
747,Lobsters,compsci,CSE,Ask L: Visualising the entire stack of abstractions from transistor to user,/s/sulia9/ask_l_visualising_entire_stack
748,Lobsters,compsci,CSE,Microkernels - The component-based operating systems,http://www.microkernel.info/
749,Lobsters,compsci,CSE,Various Models of Execution for Futures and Promises,http://dist-prog-book.com/chapter/2/futures.html
750,Lobsters,compsci,CSE,Attacking Merkle Trees with a Second Preimage Attack,https://flawed.net.nz/2018/02/21/attacking-merkle-trees-with-a-second-preimage-attack/
751,Lobsters,compsci,CSE,Beginning Functional Programming,https://www.grokacademy.com/lessons/beginning-functional-programming/
752,Lobsters,compsci,CSE,Message Passing and the Actor Model,http://dist-prog-book.com/chapter/3/message-passing.html
753,Lobsters,compsci,CSE,Finding the longest palindromic substring,https://interviewcache.com/blog/longest-palindromic-substring/
754,Lobsters,compsci,CSE,Explained Simply: How an AI program mastered the ancient game of Go,https://medium.com/@mngrwl/explained-simply-how-an-ai-program-mastered-the-ancient-game-of-go-62b8940a9080
755,Lobsters,compsci,CSE,Elementary Knightship Found,http://www.conwaylife.com/forums/viewtopic.php?t=3303
756,Lobsters,compsci,CSE,A Framework for Extending microKanren with Constraints (2016),https://arxiv.org/pdf/1701.00633.pdf
757,Lobsters,compsci,CSE,Lobste.rs access pattern statistics for research purposes,/s/cqnzl5/lobste_rs_access_pattern_statistics_for
758,Lobsters,compsci,CSE,Yet another definition of Intelligence,https://medium.com/@giacomo_59737/yet-another-definition-of-intelligence-9bbaaa73086d
759,Lobsters,compsci,CSE,"A Preview of Bristlecone, Google’s New Quantum Processor",https://research.googleblog.com/2018/03/a-preview-of-bristlecone-googles-new.html
760,Lobsters,compsci,CSE,LLDB restoration and return to ptrace(2),https://blog.netbsd.org/tnf/entry/lldb_restoration_and_return_to
761,Lobsters,compsci,CSE,Constructing human-grade parsers,http://duriansoftware.com/joe/Constructing-human-grade-parsers.html
762,Lobsters,compsci,CSE,J Software releases many APL/mathematical works under Creative Commons license,http://code.jsoftware.com/wiki/Community/Creative_Commons
763,Lobsters,compsci,CSE,An Efficient Snell's-Law Method for Optimal-Path Planning AcrossMultiple Two-dimensional Irregular Homogeneous-Cost Regions,http://faculty.nps.edu/ncrowe/snell2.htm
764,Lobsters,compsci,CSE,Computing With Random Pulses Promises to Simplify Circuitry and Save Power,https://spectrum.ieee.org/computing/hardware/computing-with-random-pulses-promises-to-simplify-circuitry-and-save-power
765,Lobsters,compsci,CSE,The threats to Artificial Intelligence,http://shamar.github.io/documents/2018_Milano_The-Delusions-of-Neural-Networks.pdf
766,Lobsters,compsci,CSE,Mathematics and Computation,https://www.math.ias.edu/avi/book
767,Lobsters,compsci,CSE,Understanding Dijkstra's Algorithm,https://aos.github.io/2018/02/24/understanding-dijkstras-algorithm/
768,Lobsters,compsci,CSE,"Wizards and warriors, part one",https://ericlippert.com/2015/04/27/wizards-and-warriors-part-one/
769,Lobsters,compsci,CSE,A Systematic Study of Automated Program Repair: Fixing 55 out of 105 Bugs for $8 Each (2012),https://web.eecs.umich.edu/~weimerw/p/weimer-icse2012-genprog-preprint.pdf
770,Lobsters,compsci,CSE,The Basic Toolbox,https://blog.regehr.org/archives/1578
771,Lobsters,compsci,CSE,A vendor neutral open approach to decoupled data synchronization,https://blog.ably.io/a-vendor-neutral-open-approach-to-decoupled-data-synchronization-26d8914cb28b
772,Lobsters,compsci,CSE,Scalable Bloom Filters,http://citeseerx.ist.psu.edu/viewdoc/download?doi=10.1.1.62.7953&rep=rep1&type=pdf
773,Lobsters,compsci,CSE,I don’t understand Graph Theory.,https://medium.com/@vardanator/i-dont-understand-graph-theory-1c96572a1401
774,Lobsters,compsci,CSE,Gradual Typing,https://golem.ph.utexas.edu/category/2018/02/gradual_typing.html
775,Lobsters,compsci,CSE,Determining Cat Chirality,http://blog.dimview.org/math/2017/07/28/cat-chirality.html
776,Lobsters,compsci,CSE,IDEA - nonverbal algorithm assembly instructions,https://idea-instructions.com/
777,Lobsters,compsci,CSE,"""Pure Functional Programming in Excel"" by Felienne Hermans (2016)",https://www.youtube.com/watch?v=0yKf8TrLUOw
778,Lobsters,compsci,CSE,bhgv/Inferno-OS_Android - an Android port of Inferno OS,https://github.com/bhgv/Inferno-OS_Android
779,Lobsters,compsci,CSE,On the P vs NP question: a proof of inequality,https://arxiv.org/abs/1802.05484
780,Lobsters,compsci,CSE,The P-versus-NP page,http://www.win.tue.nl/~gwoegi/P-versus-NP.htm
