ID,Source,Tag_Code,Tag_Name,Title,Url
781,Lobsters,compsci,CSE,Synthesis - An Efficient Implementation of Fundamental Operating System Services (1992),https://pdfs.semanticscholar.org/206a/4efe87abbea5f711a28397447b8ae2159d3b.pdf
782,Lobsters,compsci,CSE,To Dissect a Mockingbird: A Graphical Notation for the Lambda Calculus with Animated Reduction,http://dkeenan.com/Lambda/
783,Lobsters,compsci,CSE,Let’s Not Forget the ‘science’ in ‘computer Science’,https://cacm.acm.org/blogs/blog-cacm/225148-lets-not-forget-the-science-in-computer-science/fulltext
784,Lobsters,compsci,CSE,Rust's ownership model formally proven with Coq,https://dl.acm.org/citation.cfm?doid=3177123.3158154
785,Lobsters,compsci,CSE,"CCHR: The Fastest CHR Implementation, in C (2007)",https://lirias.kuleuven.be/bitstream/123456789/146633/1/cchr
786,Lobsters,compsci,CSE,POPL 2018 Tutorial (Computational Type Theory),https://existentialtype.wordpress.com/2018/01/15/popl-2018-tutorial/
787,Lobsters,compsci,CSE,A practitioner’s guide to reading programming languages papers,https://blog.acolyer.org/2018/01/26/a-practitioners-guide-to-reading-programming-languages-papers/
788,Lobsters,compsci,CSE,Alan Turing’s Manual for the Ferranti Mk. I,http://www.panix.com/~rst/turing.pdf
789,Lobsters,compsci,CSE,Stratified Synthesis: Automatically Learning the x64 Instruction Set (2016),https://raw.githubusercontent.com/StanfordPL/stoke/develop/docs/papers/pldi16.pdf
790,Lobsters,compsci,CSE,Genetic Programming + Proof Search = Automatic Improvement (2015),https://link.springer.com/content/pdf/10.1007%2Fs10817-017-9409-5.pdf
791,Lobsters,compsci,CSE,"Natural Synthesis of Provably-Correct, Data-Structure Manipulations (2017)",https://engineering.purdue.edu/~xqiu/natural-synthesis.pdf
792,Lobsters,compsci,CSE,FlexSC: Flexible System Call Scheduling with Exception-Less System Calls (2010),https://www.usenix.org/legacy/events/osdi10/tech/full_papers/Soares.pdf
793,Lobsters,compsci,CSE,Hyperkernel: Push-Button Verification of an OS Kernel (2017),https://homes.cs.washington.edu/~helgi/papers/hyperkernel.pdf
794,Lobsters,compsci,CSE,Using Self-Organizing Maps to solve the Traveling Salesman Problem,https://diego.codes/post/som-tsp/
795,Lobsters,compsci,CSE,“Dancing Links” pre-fascicle 5c of Knuth's TAOCP,https://www-cs-faculty.stanford.edu/~knuth/fasc5c.ps.gz
796,Lobsters,compsci,CSE,The Natural Lambda,http://cbloomrants.blogspot.com/2018/01/the-natural-lambda.html
797,Lobsters,compsci,CSE,Bela: an embedded platform for audio and sensor processing,https://www.geeklan.co.uk/files/oshug63-bela.pdf
798,Lobsters,compsci,CSE,Constraint Handling Rules: What Else? (2015),http://www.informatik.uni-ulm.de/pm/fileadmin/pm/home/fruehwirth/drafts/CHR-ruleml-keynote-online-2015r.pdf
799,Lobsters,compsci,CSE,My Favorite Algorithm: Linear Time Median Finding,https://rcoh.me/posts/linear-time-median-finding/
800,Lobsters,compsci,CSE,Ridiculously fast base64 encoding and decoding,https://lemire.me/blog/2018/01/17/ridiculously-fast-base64-encoding-and-decoding/
801,Lobsters,compsci,CSE,Flux - Visualizing Haskell Programs as Data-Flow Diagrams (2016),https://www.uni-ulm.de/en/in/pm/research/projects/flux/
802,Lobsters,compsci,CSE,A Primer on Boolean Satisfiability,https://homes.cs.washington.edu/~emina/blog/2017-06-23-a-primer-on-sat.html
803,Lobsters,compsci,CSE,The Lambda and the Kappa Architectures,https://muratbuffalo.blogspot.com/2018/01/the-lambda-and-kappa-architectures.html
804,Lobsters,compsci,CSE,The Power of Two Random Choices: A Survey of Techniques and Results (2001),http://www.eecs.harvard.edu/~michaelm/postscripts/handbook2001.pdf
805,Lobsters,compsci,CSE,Parasitic Computing,https://pdfs.semanticscholar.org/24bd/35f377212dfb846afe6abfee0cc6bf14964f.pdf
806,Lobsters,compsci,CSE,Refinement Types in ML (1991),https://www.cs.cmu.edu/~fp/papers/pldi91.pdf
807,Lobsters,compsci,CSE,Verifying Bubble Sort in Whiley,http://whiley.org/2017/12/19/verifying-bubble-sort-in-whiley/
808,Lobsters,compsci,CSE,What the Four Color Theorem Can Teach Us About Writing Software,http://alexkudlick.com/blog/what-the-four-color-theorem-can-teach-us-about-writing-software/
809,Lobsters,compsci,CSE,"List of Ways to Find Information, Flow Violations in Hardware and Software (Jan2018)",https://pastebin.com/ajqxDJ3J
810,Lobsters,compsci,CSE,"Counterpoint: Intel Weaknesses Known in 1990's; Ignored by ""Security Professionals""",https://news.ycombinator.com/item?id=16092183
811,Lobsters,compsci,CSE,The Intel 80x86 Processor Architectures: Pitfalls for Secure Systems (1995),https://pdfs.semanticscholar.org/2209/42809262c17b6631c0f6536c91aaf7756857.pdf
812,Lobsters,compsci,CSE,"SafeFS: Secure, Modular, Customizable, Software-Defined Filesystem (2016)",https://github.com/safecloud-project/safefs
813,Lobsters,compsci,CSE,Jehanne in 2017,http://jehanne.io/2018/01/06/jehanne-in-2017.html
814,Lobsters,compsci,CSE,"Robust and Efficient Elimination of Cache and Timing, Side Channels (2015)",https://arxiv.org/pdf/1506.00189.pdf
815,Lobsters,compsci,CSE,Racket-on-Chez Status: January 2018,http://blog.racket-lang.org/2018/01/racket-on-chez-status.html
816,Lobsters,compsci,CSE,"prom: A Flexible, Prolog-based make tool (1991)",https://pdfs.semanticscholar.org/1769/1bb51fcb8acaecf4e05a2e53225cb58c69ed.pdf
817,Lobsters,compsci,CSE,"Security Testing of a Secure, Cache Design (2016)",http://palms.ee.princeton.edu/system/files/HASP_vfinal.pdf
818,Lobsters,compsci,CSE,Call for Papers: MoreVMs 2018,https://2018.programming-conference.org/track/MoreVMs-2018
819,Lobsters,compsci,CSE,"Formally-Verified Interpreter for a Shell-like, Programming Language (2017)",https://hal-univ-diderot.archives-ouvertes.fr/hal-01534747/document
820,Lobsters,compsci,CSE,How To Find Arbitrage Opportunities In Python,https://dailycodingproblem.com/blog/2018/01/02/find-an-arbitrage.html
821,Lobsters,compsci,CSE,Happy extra rare new year + solution to leap second problem,http://boxbase.org/entries/2018/jan/1/rare_new_year/
822,Lobsters,compsci,CSE,OSSU - Path to a free self-taught education in Computer Science,https://github.com/ossu/computer-science
823,Lobsters,compsci,CSE,What was the best CS paper you read in 2017?,/s/frsikr/what_was_best_cs_paper_you_read_2017
824,Lobsters,compsci,CSE,Operating System Design Book Series,http://www.fysnet.net/osdesign_book_series.htm
825,Lobsters,compsci,CSE,My Favorite Deep Learning Papers of 2017,http://cachestocaches.com/2017/12/favorite-deep-learning-2017/
826,Lobsters,compsci,CSE,My favorite papers of 2017,http://www.nicolabortignon.com/my-favorite-4-papers-of-2017/
827,Lobsters,compsci,CSE,"Weird machines, exploitability, and provable unexploitability",http://ieeexplore.ieee.org/stamp/stamp.jsp?tp=&arnumber=8226852
828,Lobsters,compsci,CSE,"Twizzer: An Operating System for Next-Generation, Memory Hierarchies (2017)",https://www.ssrc.ucsc.edu/Papers/ssrctr-17-01.pdf
829,Lobsters,compsci,CSE,BYTE Magazine Scans (1975-95),https://archive.org/details/byte-magazine
830,Lobsters,compsci,CSE,jschauma/cs631apue - CS631 Advanced Programming in the UNIX Environment,https://github.com/jschauma/cs631apue
831,Lobsters,compsci,CSE,Design Flow and Characterization Methodology for Dual Mode Logic (2015),http://www.eng.biu.ac.il/fishale/files/2012/10/Design-Flow-and-Characterization-Methodology-for-Dual-Mode-Logic.pdf
832,Lobsters,compsci,CSE,Data Structures Used in the OpenBSD Kernel (2012),http://kindsoftware.com/documents/reports/Britt12.pdf
833,Lobsters,compsci,CSE,Introduction to Software Verification,https://www.youtube.com/watch?v=dGsD_K-IAgA&t=680s
834,Lobsters,compsci,CSE,Driller - Augmenting Fuzzing Through Selective Symbolic Execution (2016),http://cs.ucsb.edu/~chris/research/doc/ndss16_driller.pdf
835,Lobsters,compsci,CSE,Dynamicland,https://dynamicland.org
836,Lobsters,compsci,CSE,Digital Computers: On Encoding Logical-Mathematical Formulas into the Machine Itself (1954),http://www.itu.dk/people/sestoft/boehmthesis/boehm.pdf
837,Lobsters,compsci,CSE,A Deeper Inspection Into Compilation And Interpretation,https://medium.com/basecs/a-deeper-inspection-into-compilation-and-interpretation-d98952ebc842
838,Lobsters,compsci,CSE,Fourteen Years of Software Engineering at ETH Zurich,https://arxiv.org/abs/1712.05078
839,Lobsters,compsci,CSE,Parsing with derivatives - Elegant matching of regular languages in clojure,http://blog.klipse.tech//clojure/2016/10/02/parsing-with-derivatives-regular.html
840,Lobsters,compsci,CSE,F9: Secure Microkernel for Deeply-Embedded Devices (2017),https://archive.fosdem.org/2017/schedule/event/microkernel_microkernel_for_embedded_devices/
841,Lobsters,compsci,CSE,Refinement Reflection: Complete Verification with SMT (2017),https://arxiv.org/pdf/1711.03842.pdf
842,Lobsters,compsci,CSE,Fuzzy Thinking: Fuzz Testing and Formal Grammar,https://maxhallinan.com/posts/2017/12/09/fuzzy-thinking/
843,Lobsters,compsci,CSE,Learning Combinatorial Algorithms Over Graphs (2017),https://arxiv.org/abs/1704.01665
844,Lobsters,compsci,CSE,Squeak Makes a Good Python Debugger (2017),https://www.timfelgentreff.de/public/uni/NiephausPX2017.pdf
845,Lobsters,compsci,CSE,"Construction and Formal Verification of Fault-Tolerant, Distributed, Mutual Exclusion (2017)",https://icfp17.sigplan.org/event/erlang-2017-papers-construction-and-formal-verification-of-a-fault-tolerant-distributed-mutual-exclusion-algorithm
846,Lobsters,compsci,CSE,"Sancus: A Low-Cost, Security Architecture for IoT Devices (2017)",https://www.esat.kuleuven.be/cosic/publications/article-2785.pdf
847,Lobsters,compsci,CSE,CuriOS: Improving Reliability through Operating System Structure (2008),https://www.usenix.org/legacy/events/osdi08/tech/full_papers/david/david_html/index.html
848,Lobsters,compsci,CSE,A Conjecture That Had To Be True,http://scpdweb.stanford.edu/free-stuff/live-webinars-lectures/donald-knuths-annual-christmas-lecture
849,Lobsters,compsci,CSE,Machine Learning for Systems and Systems for Machine Learning (2017),http://learningsys.org/nips17/assets/slides/dean-nips17.pdf
850,Lobsters,compsci,CSE,The Case for Learned Index Structures,https://www.arxiv-vanity.com/papers/1712.01208v1/
851,Lobsters,compsci,CSE,Learn Anything White Paper,https://github.com/learn-anything/learn-anything/wiki/White-Paper
852,Lobsters,compsci,CSE,Falsehoods programmers believe about programming,http://www.sicpers.info/2017/12/falsehoods-programmers-believe-about-programming/
853,Lobsters,compsci,CSE,Interview of Xavier Leroy ­— POPL 18,https://www.cs.cmu.edu/~popl-interviews/leroy.html
854,Lobsters,compsci,CSE,Verification of Erlang Programs using Abstract Interpretation and Model Checking (2001),https://pdfs.semanticscholar.org/8174/3408a73d77c83cc88d6d9be8f994a0d2f4f2.pdf
855,Lobsters,compsci,CSE,Stateful Contracts for Affine Types (2010),http://users.eecs.northwestern.edu/~jesse/pubs/affine-contracts/
856,Lobsters,compsci,CSE,Introspection for C and Its Applications to Library Robustness (2017),https://arxiv.org/pdf/1712.01163.pdf
857,Lobsters,compsci,CSE,How to Teach Programming (and Other Things),http://third-bit.com/teaching/
858,Lobsters,compsci,CSE,How to Design an Effective Lesson,https://vimeo.com/245351211
859,Lobsters,compsci,CSE,Type-Safe Redis Queries: Case Study of Type-Level Programming in Haskell (2017),https://arxiv.org/pdf/1708.09158.pdf
860,Lobsters,compsci,CSE,Bloom Filter Sort (bfsort),http://blog.stermon.com/articles/2017/12/06/bloom-filter-sort-bfsort
861,Lobsters,compsci,CSE,"The Habit Programming Language: The Revised, Preliminary Report (2010)",http://hasp.cs.pdx.edu/habit-report-Nov2010.pdf
862,Lobsters,compsci,CSE,How to Implement Regular Expressions in JavaScript using Derivatives,http://dpk.io/dregs/toydregs
863,Lobsters,compsci,CSE,Debugging Church Numerals in Haskell,http://www.hansdieterhiep.nl/tutorials/debugging-church-numerals-in-haskell/
864,Lobsters,compsci,CSE,New Version of Learn Anything released (Open Source website to learn anything with Interactive maps),/s/r73vux/new_version_learn_anything_released_open
865,Lobsters,compsci,CSE,"Testing Non-Interference, Quickly (2012)",https://www.cis.upenn.edu/~aarthur/testing-noninterference-icfp2013.pdf
866,Lobsters,compsci,CSE,Towards a User-Mode Approach to Partitioned Scheduling in seL4 Microkernel (2012),https://pdfs.semanticscholar.org/fb1a/bc5174ec17853c720420666c6df7c6a91121.pdf
867,Lobsters,compsci,CSE,"Quest - Lightweight, Predictable, and Dependendable Kernel for Multicore Processors (2012)",http://www.cs.bu.edu/fac/richwest/quest.php
868,Lobsters,compsci,CSE,"CrowdFlow: Efficient, Information-Flow Security (2013)",http://citeseer.ist.psu.edu/viewdoc/summary?doi=10.1.1.713.3783
869,Lobsters,compsci,CSE,"base_cs: Exploring the basics of computer science, every Monday, for a year.",https://medium.com/basecs
870,Lobsters,compsci,CSE,A Gentle Introduction to Erasure Codes,https://www.akalin.com/intro-erasure-codes
871,Lobsters,compsci,CSE,"The New QuickCheck: Random, Exhaustive, and Symbolic Testing Under One Roof (2012)",http://citeseer.ist.psu.edu/viewdoc/summary?doi=10.1.1.230.6416
872,Lobsters,compsci,CSE,"Synthesis of Statically-Analyzable, Accelerator Networks from Sequential Programs (2016)",https://people.eecs.berkeley.edu/~johnw/papers/ICCAD2016.pdf
873,Lobsters,compsci,CSE,A Type-Safe Apparatus Executing Higher-Order Functions in Conjunction with Hardware Error Tolerance,http://arro.anglia.ac.uk/581958/1/Kimmitt%20thesis_web.pdf
874,Lobsters,compsci,CSE,What is a Monad?,https://www.youtube.com/watch?v=t1e8gqXLbsU
875,Lobsters,compsci,CSE,Parallel Functional Programming Using D-Clean (2012),http://www.tnkcs.inf.elte.hu/vedes/Zsok_Viktoria_Tezisek_en.pdf
876,Lobsters,compsci,CSE,Model-Based Testing with Logical Properties vs State Machines (2011),https://www.researchgate.net/publication/235900230_Model_Based_Testing_with_Logical_Properties_versus_State_Machines
877,Lobsters,compsci,CSE,Simon Peyton Jones - Getting from A to B - Fast route finding on slow computers,https://www.youtube.com/watch?v=L1XDdy-hOH8
878,Lobsters,compsci,CSE,Is it possible to have useful functional types in a purely nominative type system?,/s/ehqip0/is_it_possible_have_useful_functional
879,Lobsters,compsci,CSE,DIABLO: Datacenter-in-a-Box Simulator Using FPGA's (2013),http://diablo.cs.berkeley.edu/about.html
880,Lobsters,compsci,CSE,The COGENT Case for Property-Based Testing (2017),http://www.ssrg.nicta.com.au/publications/csiro_full_text//Chen_OKKH_17.pdf
881,Lobsters,compsci,CSE,Few notes on the Binomial and Fibonacci heaps,http://blog.jakuba.net/2017/11/22/fibonacci-heap.html
882,Lobsters,compsci,CSE,"HydrOS: A Massively-Fault-Tolerant, Operating System",http://hydros-project.org/
883,Lobsters,compsci,CSE,Plan 9 Operating System for the Raspberry Pi - ported by Richard Miller (2012),https://www.youtube.com/watch?v=O7ZELOUIyvw
884,Lobsters,compsci,CSE,“Super Mario Brothers” is hard (2016),http://news.mit.edu/2016/mario-brothers-hard-complexity-class-pspace-0601
885,Lobsters,compsci,CSE,Privad: Practical Privacy in Online Advertising (2011),http://citeseerx.ist.psu.edu/viewdoc/download?doi=10.1.1.210.4751&rep=rep1&type=pdf
886,Lobsters,compsci,CSE,Demystifying Floating Point Precision,https://blog.demofox.org/2017/11/21/floating-point-precision/
887,Lobsters,compsci,CSE,"Laddie - Language for Automated, Device Drivers (2008)",https://www.eg.bucknell.edu/~lwittie/research/Laddie.pdf
888,Lobsters,compsci,CSE,The LUA record type for Lua-powered DNS records,https://gist.github.com/ahupowerdns/1e8bfbba95a277a4fac09cb3654eb2ac
889,Lobsters,compsci,CSE,Much Ado About Nothing: Putting Java's Null in its Place (2008),https://www2.ccs.neu.edu/racket/pubs/dissertation-cobbe.pdf
890,Lobsters,compsci,CSE,OberonScript - A Lightweight Compiler and Runtime System for the Web (2006),https://www.microsoft.com/en-us/research/wp-content/uploads/2016/02/tr-2006-50.pdf
891,Lobsters,compsci,CSE,Automated Testing of Graphics Shader Compilers (2017),http://www.doc.ic.ac.uk/~afd/homepages/papers/pdfs/2017/OOPSLA.pdf
892,Lobsters,compsci,CSE,Fast exact integer divisions using floating-point operations,https://lemire.me/blog/2017/11/16/fast-exact-integer-divisions-using-floating-point-operations/
893,Lobsters,compsci,CSE,Souper: A Synthesizing Super-Optimizer (2017),https://arxiv.org/pdf/1711.04422.pdf
894,Lobsters,compsci,CSE,À la carte Entropy,http://shape-of-code.coding-guidelines.com/2017/11/15/a-la-carte-entropy/
895,Lobsters,compsci,CSE,What are some good/interesting papers in CS for a beginner?,/s/npo38i/what_are_some_good_interesting_papers_cs
896,Lobsters,compsci,CSE,"A Touch of Evil: High-Assurance, Cryptographic Hardware from Untrusted Components (2017)",https://acmccs.github.io/papers/p1583-mavroudisA.pdf
897,Lobsters,compsci,CSE,Runtime Checking of Concurrent Data Structures (2005),https://core.ac.uk/download/pdf/82158063.pdf
898,Lobsters,compsci,CSE,Package Management Sudoku,https://web.archive.org/web/20160326062818/http://algebraicthunk.net/~dburrows/blog/entry/package-management-sudoku/
899,Lobsters,compsci,CSE,De Bruijn sequences; leading/trailing zero bits counting,https://yurichev.com/blog/de_bruijn/
900,Lobsters,compsci,CSE,Functional Programming Jargon,https://functional.works-hub.com/blog/Functional-Programming-Jargon
901,Lobsters,compsci,CSE,Automatic Generation of Normalized Relational Schemas from Nested Key-Value Data,http://cs-www.cs.yale.edu/homes/dna/papers/schemagen-sigmod16.pdf
902,Lobsters,compsci,CSE,Gerard Huet Reflects On The History Of Theorem Provers,https://50ans.inria.fr/en/gerard-huet-languages-and-software/
903,Lobsters,compsci,CSE,"Implementing a key-value store, part 1: Linear Hashing",https://samrat.me/posts/2017-11-04-kvstore-linear-hashing/
904,Lobsters,compsci,CSE,Adventures in Programming Interviews: Misleadingly Simple NP-Hard Problem,https://hackernoon.com/adventures-in-programming-interviews-misleadingly-difficult-np-hard-problem-43092597018c
905,Lobsters,compsci,CSE,A Guide to Alloy (2007),http://www.doc.ic.ac.uk/project/examples/2007/271j/suprema_on_alloy/Final%20Report/LaTeX/report.pdf
906,Lobsters,compsci,CSE,"Locksmith - Practical, Static, Race Detection for C",http://www.cs.umd.edu/~mwh/papers/locksmith-journal.pdf
907,Lobsters,compsci,CSE,A look at some bounded queues - part 2,http://cbloomrants.blogspot.com/2011/07/07-30-11-look-at-some-bounded-queues.html
908,Lobsters,compsci,CSE,So you want to write a type checker...,http://languagengine.co/blog/so-you-want-to-write-a-type-checker/
909,Lobsters,compsci,CSE,Hard Things in Computer Science: Naming things,http://250bpm.com/blog:110
910,Lobsters,compsci,CSE,Best-Ever Algorithm Found for Huge Streams of Data,https://www.quantamagazine.org/best-ever-algorithm-found-for-huge-streams-of-data-20171024/
911,Lobsters,compsci,CSE,Free and non free books all can learn from,https://github.com/learn-anything/books
912,Lobsters,compsci,CSE,Security Analysis of x86 Processor Microcode (2014),https://www.dcddcc.com/docs/2014_paper_microcode.pdf
913,Lobsters,compsci,CSE,The World's Fastest Scrabble Program (1988),https://www.cs.cmu.edu/afs/cs/academic/class/15451-s06/www/lectures/scrabble.pdf
914,Lobsters,compsci,CSE,Big-O: how code slows as data grows,https://nedbatchelder.com/text/slowsgrows.html
915,Lobsters,compsci,CSE,Dynamic Programming: First Principles,http://www.flawlessrhetoric.com/Dynamic-Programming-First-Principles
916,Lobsters,compsci,CSE,Efficient Immutable Collections,https://michael.steindorfer.name/publications/phd-thesis-efficient-immutable-collections.pdf
917,Lobsters,compsci,CSE,How Error Correcting Codes and Reed-Solomon works,https://monades.roperzh.com/error-correction-reed-solomon/
918,Lobsters,compsci,CSE,Exploring lock-free Rust 1: Locks,https://morestina.net/blog/742/exploring-lock-free-rust-1-locks
919,Lobsters,compsci,CSE,How Merkle trees enable the decentralized Web,https://taravancil.com/blog/how-merkle-trees-enable-decentralized-web/
920,Lobsters,compsci,CSE,A visualisation of Langton's ant,http://langton-ant.s3-website-eu-west-1.amazonaws.com
921,Lobsters,compsci,CSE,The Electoral College and the knapsack problem,https://mike.place/2017/ecknapsack/
922,Lobsters,compsci,CSE,WTF is a Thread,https://www.schneems.com/2017/10/23/wtf-is-a-thread/
923,Lobsters,compsci,CSE,Tracing the Dynabook: A Study of Technocultural Transformations,https://tkbr.publishing.sfu.ca/dynabook/
924,Lobsters,compsci,CSE,Diff engine for Markdown,https://kristaps.bsd.lv/lowdown/diff.html
925,Lobsters,compsci,CSE,Gap Buffers: a data structure for editable text,https://routley.io/tech/2017/09/01/gap-buffer.html
926,Lobsters,compsci,CSE,Why should we teach programming (Hint: It’s not to learn problem-solving),https://computinged.wordpress.com/2017/10/18/why-should-we-teach-programming-hint-its-not-to-learn-problem-solving/
927,Lobsters,compsci,CSE,On termination,https://mail.haskell.org/pipermail/haskell-cafe/2003-May/004343.html
928,Lobsters,compsci,CSE,"Bryan Cantrill on ARC: A Self-Tuning, Low Overhead Replacement Cache",https://www.youtube.com/watch?v=F8sZRBdmqc0
929,Lobsters,compsci,CSE,The Lost Huffman Paper,http://cbloomrants.blogspot.com/2010/08/08-12-10-lost-huffman-paper.html
930,Lobsters,compsci,CSE,It's time for a new old language,https://www.youtube.com/watch?v=dCuZkaaou0Q
931,Lobsters,compsci,CSE,Big Integer Subtraction on the Power Architecture,http://exm.us/big-integer-subtraction.html
932,Lobsters,compsci,CSE,Bartosz Milewski's 'Category Theory for Programmers' compiled in PDF,https://github.com/hmemcpy/milewski-ctfp-pdf
933,Lobsters,compsci,CSE,"FaCT: Flexible, Constant-Time, Programming Language (2017)",https://cseweb.ucsd.edu/~dstefan/pubs/cauligi:2017:fact.pdf
934,Lobsters,compsci,CSE,isomorƒ: automated refactoring suggestions,https://isomorf.io/#!/syntax-picker/tours-ideas
935,Lobsters,compsci,CSE,"Menuet – A pre-emptive, real-time and multiprocessor OS written in assembly",http://www.menuetos.net/
936,Lobsters,compsci,CSE,Another tutorial for writing a Forth interpreter in assembly (Part 3),http://blog.asrpo.com/forth_tutorial_part_3
937,Lobsters,compsci,CSE,"x86 Proved: Coq Library for Modelling, Specification, Generation, and Proof for x86 Machine Code",https://x86proved.codeplex.com/
938,Lobsters,compsci,CSE,Epigrams on Programming (1982),http://www.developingandstuff.com/2015/02/epigrams-on-programming-highlighted.html
939,Lobsters,compsci,CSE,Locality sensitive hashing explained,https://medium.com/engineering-brainly/locality-sensitive-hashing-explained-304eb39291e4
940,Lobsters,compsci,CSE,"Vale: Verifying High-Performance, Cryptographic, Assembly Code (2017)",https://project-everest.github.io/assets/vale2017.pdf
941,Lobsters,compsci,CSE,Cooperative Software Development,http://faculty.washington.edu/ajko/books/cooperative-software-development/
942,Lobsters,compsci,CSE,"On Disk IO, Part 4: B-Trees and RUM Conjecture",https://medium.com/@ifesdjeen/on-disk-storage-part-4-b-trees-30791060741
943,Lobsters,compsci,CSE,Kaizen of Programming,http://250bpm.com/blog:102
944,Lobsters,compsci,CSE,Another tutorial for writing a Forth interpreter in assembly (Part 2),https://blog.asrpo.com/forth_tutorial_part_2
945,Lobsters,compsci,CSE,Stop Bashing COBOL: COBOL as a Research Theme,http://www.cs.vu.nl/Cobol/stop-bashing-cobol.pdf
946,Lobsters,compsci,CSE,Spinning Around In Cycles With Directed Acyclic Graphs,https://medium.com/basecs/spinning-around-in-cycles-with-directed-acyclic-graphs-a233496d4688
947,Lobsters,compsci,CSE,A Combinatory Compiler,https://crypto.stanford.edu/~blynn/lambda/sk.html
948,Lobsters,compsci,CSE,Design by Contract in Smalltalk (1996),https://www.researchgate.net/profile/Ernesto_Pimentel/publication/220278660_Design_by_Contract_in_Smalltalk/links/545364f70cf2bccc4909c69b/Design-by-Contract-in-Smalltalk.pdf
949,Lobsters,compsci,CSE,Text Editor: Data Structures,http://averylaird.com/programming/editor/2017/09/30/the-piece-table/
950,Lobsters,compsci,CSE,The Lux Programming Language [Strange Loop 2017],https://www.youtube.com/watch?v=T-BZvBWiamU
951,Lobsters,compsci,CSE,PRNG Reference,http://hclarke.ca/prng-reference.html
952,Lobsters,compsci,CSE,"Experimental Creative Writing with the Vectorized Word by Allison Parrish, Strange Loop 2017",https://www.youtube.com/watch?v=L3D0JEA1Jdc
953,Lobsters,compsci,CSE,Eliminating Input-Based Attacks by Deriving En/Decoders from Context-Free Grammars,http://spw17.langsec.org/papers/bieschke-automatic-unparsers.pdf
954,Lobsters,compsci,CSE,Microsoft Develops New Programming Language For Quantum Computers,"http://www.tomshardware.com/news/microsoft-quantum-computer-programming-language,35534.html"
955,Lobsters,compsci,CSE,"On Disk IO, Part 3: LSM Trees",https://medium.com/@ifesdjeen/on-disk-io-part-3-lsm-trees-8b2da218496f
956,Lobsters,compsci,CSE,Compression Decompressed,https://unwttng.com/compression-decompressed
957,Lobsters,compsci,CSE,Another tutorial for writing a Forth interpreter in assembly (Part 1),https://blog.asrpo.com/forth_tutorial_part_1
958,Lobsters,compsci,CSE,"Combined Static and Dynamic, Automated, Test Generation (2011)",https://pdfs.semanticscholar.org/b351/f99c0d579d7f4df2c79fd465bdf300045e63.pdf
959,Lobsters,compsci,CSE,Deep Dive Through A Graph: DFS Traversal,https://medium.com/basecs/deep-dive-through-a-graph-dfs-traversal-8177df5d0f13
960,Lobsters,compsci,CSE,Conservative Logic,http://52.7.130.124/wp-content/uploads/2015/07/ConservativeLogic.pdf
961,Lobsters,compsci,CSE,Robust-first Computing,http://robust.cs.unm.edu/
962,Lobsters,compsci,CSE,MindWeb – A Computer Science Bachelor Curriculum,https://mindweb.network/board/computer-science-a-full-bachelor-curriculum
963,Lobsters,compsci,CSE,Having an Effect,http://okmij.org/ftp/Computation/having-effect.html
