ID,Source,Tag_Code,Tag_Name,Title,Url
414,Lobsters,cryptocurrencies,Bitcoin and Cryptocurrencies,App Coins and the dawn of the Decentralized Business Model,https://medium.com/the-coinbase-blog/app-coins-and-the-dawn-of-the-decentralized-business-model-8b8c951e734f
415,Lobsters,cryptocurrencies,Bitcoin and Cryptocurrencies,Comments to SEC on Proposed Winkelvoss Bitcoin ETF,https://www.sec.gov/comments/sr-batsbzx-2016-30/batsbzx201630-20.pdf
416,Lobsters,cryptocurrencies,Bitcoin and Cryptocurrencies,Keybase chooses Zcash,https://keybase.io/blog/keybase-and-zcash
417,Lobsters,cryptocurrencies,Bitcoin and Cryptocurrencies,Cypherpunk Desert Bus: My Role In The 2016 Zcash Trusted Setup Ceremony,https://petertodd.org/2016/cypherpunk-desert-bus-zcash-trusted-setup-ceremony
418,Lobsters,cryptocurrencies,Bitcoin and Cryptocurrencies,OpenBazaar: Truly Free Trade Through Crypto,http://www.alexkyte.me/2016/11/openbazaar-truly-free-trade-through.html
419,Lobsters,cryptocurrencies,Bitcoin and Cryptocurrencies,"Ethereum, The Blockchain of Code",http://www.alexkyte.me/2016/11/ethereum-or-blockchain-of-code.html
420,Lobsters,cryptocurrencies,Bitcoin and Cryptocurrencies,Dragonchain,https://dragonchain.github.io
421,Lobsters,cryptocurrencies,Bitcoin and Cryptocurrencies,ZeroCash: Bitcoin Tumbling with Zero Knowledge Proofs,http://www.alexkyte.me/2016/10/zerocash-bitcoin-with-privacy.html
422,Lobsters,cryptocurrencies,Bitcoin and Cryptocurrencies,Design of the ZCash Parameter Generation Ceremony,https://z.cash/blog/the-design-of-the-ceremony.html
423,Lobsters,cryptocurrencies,Bitcoin and Cryptocurrencies,PyMoneroWallet: the Python library for the Monero wallet,https://carlchenet.com/pymonerowallet-the-python-library-for-the-monero-wallet/
424,Lobsters,cryptocurrencies,Bitcoin and Cryptocurrencies,Unhackable Application Backends for an Internet without Trust,http://www.alexkyte.me/2016/10/golem-generic-trustless-stateful-p2p.html
425,Lobsters,cryptocurrencies,Bitcoin and Cryptocurrencies,"On Fungibility, Bitcoin, Monero and why ZCash is a bad idea.",http://weuse.cash/2016/06/09/btc-xmr-zcash/
426,Lobsters,cryptocurrencies,Bitcoin and Cryptocurrencies,Zcash Parameters And How They Will Be Generated,https://z.cash/blog/generating-zcash-parameters.html
427,Lobsters,cryptocurrencies,Bitcoin and Cryptocurrencies,"Golem: Trustless, Distributed P2P Hosting",http://www.alexkyte.me/2016/09/golem-auditable-distributed-p2p-hosting.html
428,Lobsters,cryptocurrencies,Bitcoin and Cryptocurrencies,The Ethereum network is currently undergoing a DoS attack,https://blog.ethereum.org/2016/09/22/ethereum-network-currently-undergoing-dos-attack/
429,Lobsters,cryptocurrencies,Bitcoin and Cryptocurrencies,What are the primary differences between Monero and Bitcoin?,http://monero.stackexchange.com/questions/415/what-are-the-primary-differences-between-monero-and-bitcoin
430,Lobsters,cryptocurrencies,Bitcoin and Cryptocurrencies,The Generalization of the Blockchain,http://www.alexkyte.me/2016/09/bitcoin-sequence-of-proofs.html
431,Lobsters,cryptocurrencies,Bitcoin and Cryptocurrencies,DDoSCoin: Cryptocurrency with a malicious proof-of-work,https://www.usenix.org/system/files/conference/woot16/woot16-paper-wustrow.pdf
432,Lobsters,cryptocurrencies,Bitcoin and Cryptocurrencies,How To Compromise Zcash And Take Over The World,https://blog.okturtles.com/2016/09/how-to-compromise-zcash-and-take-over-the-world/
433,Lobsters,cryptocurrencies,Bitcoin and Cryptocurrencies,Shadow Project,https://shadowproject.io/en
434,Lobsters,cryptocurrencies,Bitcoin and Cryptocurrencies,33% of all bitcoin exchanges operational during 2009-2015 were hacked,https://news.hodlhodl.com/news/33-of-all-bitcoin-exchanges-operational-during-2009-2015-were-hacked-268
435,Lobsters,cryptocurrencies,Bitcoin and Cryptocurrencies,Another lesson in confirmation bias,http://blog.erratasec.com/2016/08/another-lesson-in-confirmation-bias.html
436,Lobsters,cryptocurrencies,Bitcoin and Cryptocurrencies,Crypto Tokens and the Coming Age of Protocol Innovation,http://continuations.com/post/148098927445/crypto-tokens-and-the-coming-age-of-protocol
437,Lobsters,cryptocurrencies,Bitcoin and Cryptocurrencies,RFC 7914 - The scrypt Password-Based Key Derivation Function,https://tools.ietf.org/html/rfc7914
438,Lobsters,cryptocurrencies,Bitcoin and Cryptocurrencies,Stealing bitcoins with badges: How Silk Road’s dirty cops got caught,http://arstechnica.com/tech-policy/2016/08/stealing-bitcoins-with-badges-how-silk-roads-dirty-cops-got-caught/
439,Lobsters,cryptocurrencies,Bitcoin and Cryptocurrencies,The Ethereum Classic Declaration of Independence,https://ethereumclassic.github.io/assets/ETC_Declaration_of_Independence.pdf
440,Lobsters,cryptocurrencies,Bitcoin and Cryptocurrencies,DDoSCoin: Cryptocurrency with a Malicious Proof-of-Work,https://www.usenix.org/conference/woot16/workshop-program/presentation/wustrow
441,Lobsters,cryptocurrencies,Bitcoin and Cryptocurrencies,Onward from the Hard Fork - Ethereum Blog,https://blog.ethereum.org/2016/07/26/onward_from_the_hard_fork/
442,Lobsters,cryptocurrencies,Bitcoin and Cryptocurrencies,"Bitcoin’s not money, judge rules as she tosses money-laundering charge",https://www.washingtonpost.com/news/morning-mix/wp/2016/07/26/bitcoins-not-money-judge-rules-as-she-tosses-money-laundering-charge/
443,Lobsters,cryptocurrencies,Bitcoin and Cryptocurrencies,Blockchain Graveyard,https://magoo.github.io/Blockchain-Graveyard/
444,Lobsters,cryptocurrencies,Bitcoin and Cryptocurrencies,Dutch Central Bank Presents Results of Cryptocurrency Experiments,http://www.coindesk.com/dutch-central-bank-cryptocurrency-experiments/
445,Lobsters,cryptocurrencies,Bitcoin and Cryptocurrencies,CFTC Brings Significant Enforcement Action Against Bitfinex,https://www.lw.com/thoughtLeadership/CFTC-brings-significant-enforcement-action-against-online-cryptocurrency-exchange
446,Lobsters,cryptocurrencies,Bitcoin and Cryptocurrencies,"How the Verge Totally Misrepresented the DAO, and Bitcoin",http://bitcoinist.net/verge-misrepresent-dao-bitcoin/
447,Lobsters,cryptocurrencies,Bitcoin and Cryptocurrencies,"Open letter from the DAO ""attacker""",http://pastebin.com/CcGUBgDG
448,Lobsters,cryptocurrencies,Bitcoin and Cryptocurrencies,Thoughts on The DAO Hack,http://hackingdistributed.com/2016/06/17/thoughts-on-the-dao-hack/
449,Lobsters,cryptocurrencies,Bitcoin and Cryptocurrencies,Blockchain Company's Smart Contracts Were Dumb,http://www.bloomberg.com/view/articles/2016-06-17/blockchain-company-s-smart-contracts-were-dumb
450,Lobsters,cryptocurrencies,Bitcoin and Cryptocurrencies,Scanning Live Ethereum Contracts for the 'Unchecked-Send' Bug,http://hackingdistributed.com/2016/06/16/scanning-live-ethereum-contracts-for-bugs/
451,Lobsters,cryptocurrencies,Bitcoin and Cryptocurrencies,Critical Update Re: DAO Vulnerability,https://blog.ethereum.org/2016/06/17/critical-update-re-dao-vulnerability/
452,Lobsters,cryptocurrencies,Bitcoin and Cryptocurrencies,Digital Currency for Social Good: a Reading List,https://medium.com/@mozzadrella/digital-currency-for-social-good-a-reading-list-adc2a1e385e2
453,Lobsters,cryptocurrencies,Bitcoin and Cryptocurrencies,I Just Invented Bitcoin,http://hackaday.com/2006/06/08/i-just-invented-bitcoin/
454,Lobsters,cryptocurrencies,Bitcoin and Cryptocurrencies,"Hacking Team hacker steals €10K in Bitcoin, sends it to Kurdish anticapitalists in Rojava",http://arstechnica.co.uk/security/2016/05/robin-hood-hacker-rojava-syria-bitcoin-donation/
455,Lobsters,cryptocurrencies,Bitcoin and Cryptocurrencies,Hackchain – Continuous Bitcoin-Inspired CTF Competition,http://hackcha.in/
456,Lobsters,cryptocurrencies,Bitcoin and Cryptocurrencies,Questions about torrents and blockchains,/s/azgqny/questions_about_torrents_blockchains
457,Lobsters,cryptocurrencies,Bitcoin and Cryptocurrencies,IoT Startup: The Ethereum Computer is Going to Change Everything,https://news.bitcoin.com/iot-startup-ethereum-computer-going-change-everything/
458,Lobsters,cryptocurrencies,Bitcoin and Cryptocurrencies,"At the Libertarian Convention, where blockchain evangelists dream of a perfect election",http://www.theverge.com/2016/5/5/11592806/libertarian-bitcoin-blockchain-voting-john-mcafee
459,Lobsters,cryptocurrencies,Bitcoin and Cryptocurrencies,"Mr Bitcoin: ""I don't want money, I don't want fame!"" BBC News",https://www.youtube.com/watch?v=5DCAC1j2HTY
460,Lobsters,cryptocurrencies,Bitcoin and Cryptocurrencies,Craig Wright claims to be Bitcoin inventor Satoshi Nakamoto,http://www.economist.com/news/briefings/21698061-craig-steven-wright-claims-be-satoshi-nakamoto-bitcoin
461,Lobsters,cryptocurrencies,Bitcoin and Cryptocurrencies,Looting of the Fox: The Story of Sabotage at ShapeShift,https://news.bitcoin.com/looting-fox-sabotage-shapeshift/
462,Lobsters,cryptocurrencies,Bitcoin and Cryptocurrencies,The Maddest Hacker - How To Rob An Industry Venture Capitalist,https://soundcloud.com/marak/the-maddest-hacker-how-to-rob-an-industry-venture-capitalist
463,Lobsters,cryptocurrencies,Bitcoin and Cryptocurrencies,Distributed Off Grid Bank of Waterless Toilets That Power & Credits Own Blockchain,http://www.transitionlinks.org/?p=9382
464,Lobsters,cryptocurrencies,Bitcoin and Cryptocurrencies,"Tahoe-LAFS loses, then finds Bitcoin key for donations",https://tahoe-lafs.org/pipermail/tahoe-dev/2016-March/009695.html
465,Lobsters,cryptocurrencies,Bitcoin and Cryptocurrencies,How to Sue A DAO,https://www.linkedin.com/pulse/how-sue-dao-stephen-palley
466,Lobsters,cryptocurrencies,Bitcoin and Cryptocurrencies,Poke holes in this idea: DataCenterCoin ?,/s/vrykf9/poke_holes_this_idea_datacentercoin
467,Lobsters,cryptocurrencies,Bitcoin and Cryptocurrencies,What Happened At The Satoshi Roundtable,https://medium.com/@barmstrong/what-happened-at-the-satoshi-roundtable-6c11a10d8cdf
468,Lobsters,cryptocurrencies,Bitcoin and Cryptocurrencies,Bitcoin! Keep Calm And RBF/CPFP On!,https://fixingtao.com/2016/03/bitcoin-keep-calm-and-rbfcpfp-on/
469,Lobsters,cryptocurrencies,Bitcoin and Cryptocurrencies,"Bitcoin Guarantees Strong, not Eventual, Consistency",http://hackingdistributed.com/2016/03/01/bitcoin-guarantees-strong-not-eventual-consistency/
470,Lobsters,cryptocurrencies,Bitcoin and Cryptocurrencies,Smart Contracts Running on a BFT Hardened Raft,https://github.com/buckie/juno
471,Lobsters,cryptocurrencies,Bitcoin and Cryptocurrencies,The Zcash Catch,https://blog.okturtles.com/2016/03/the-zcash-catch/
472,Lobsters,cryptocurrencies,Bitcoin and Cryptocurrencies,Bitcoin Core 0.12.0 Released!,https://bitcoincore.org/en/2016/02/23/release-0.12.0/
473,Lobsters,cryptocurrencies,Bitcoin and Cryptocurrencies,BigchainDB • The scalable blockchain database.,https://www.bigchaindb.com/
474,Lobsters,cryptocurrencies,Bitcoin and Cryptocurrencies,The Bitcoin Brain Drain: A Short Paper on the Use and Abuse of Bitcoin Brain Wallet,http://fc16.ifca.ai/preproceedings/36_Vasek.pdf
475,Lobsters,cryptocurrencies,Bitcoin and Cryptocurrencies,The Princeton Bitcoin textbook is now freely available,https://freedom-to-tinker.com/blog/randomwalker/the-princeton-bitcoin-textbook-is-now-freely-available/
476,Lobsters,cryptocurrencies,Bitcoin and Cryptocurrencies,"Zcash, an Untraceable Bitcoin Alternative, Launches in Alpha",http://www.wired.com/2016/01/zcash-an-untraceable-bitcoin-alternative-launches-in-alpha/
477,Lobsters,cryptocurrencies,Bitcoin and Cryptocurrencies,Hard Forks and Truly Decentralized Systems,http://bitledger.info/why-a-hard-fork-should-be-fought-and-its-not-evil-to-discuss/
478,Lobsters,cryptocurrencies,Bitcoin and Cryptocurrencies,Whiny Ragequitting,https://medium.com/@bramcohen/whiny-ragequitting-cab164b1e88
479,Lobsters,cryptocurrencies,Bitcoin and Cryptocurrencies,"Bitcoin Is Dead, Long Live Bitcoin",http://avc.com/2016/01/bitcoin-is-dead-long-live-bitcoin/
480,Lobsters,cryptocurrencies,Bitcoin and Cryptocurrencies,18 Month Old Cryptsy Hack Admitted After Bank Run,http://blog.cryptsy.com/post/137323646202/announcement
481,Lobsters,cryptocurrencies,Bitcoin and Cryptocurrencies,The resolution of the Bitcoin experiment,https://medium.com/@octskyward/the-resolution-of-the-bitcoin-experiment-dabb30201f7#.3qodf0p0m
482,Lobsters,cryptocurrencies,Bitcoin and Cryptocurrencies,Argon2 and Egalitarian Computing,https://www.cryptolux.org/images/c/c5/Rwc-slides.pdf
483,Lobsters,cryptocurrencies,Bitcoin and Cryptocurrencies,On the dangers of a blockchain monoculture,https://tonyarcieri.com/on-the-dangers-of-a-blockchain-monoculture
484,Lobsters,cryptocurrencies,Bitcoin and Cryptocurrencies,Problems on the Blockchain,http://benbyford.com/articles/problems-on-the-blockchain/
485,Lobsters,cryptocurrencies,Bitcoin and Cryptocurrencies,Extracting the Private Key from a TREZOR,https://jochen-hoenicke.de/trezor-power-analysis/
486,Lobsters,cryptocurrencies,Bitcoin and Cryptocurrencies,National Security Implications of Virtual Currency,http://www.rand.org/content/dam/rand/pubs/research_reports/RR1200/RR1231/RAND_RR1231.pdf
487,Lobsters,cryptocurrencies,Bitcoin and Cryptocurrencies,Algorithmic Autonomy: Freedom and the Blockchain by David Golumbia,http://networkcultures.org/moneylab/2015/12/11/algorithmic-autonomy-freedom-and-the-blockchain/
488,Lobsters,cryptocurrencies,Bitcoin and Cryptocurrencies,Australian police raid Sydney home of reported bitcoin creator,http://www.reuters.com/article/us-australia-bitcoin-exclusive-idUSKBN0TS0AB20151209
489,Lobsters,cryptocurrencies,Bitcoin and Cryptocurrencies,Bitcoin's Creator Satoshi Nakamoto Is Probably This Unknown Australian Genius,http://www.wired.com/2015/12/bitcoins-creator-satoshi-nakamoto-is-probably-this-unknown-australian-genius/
490,Lobsters,cryptocurrencies,Bitcoin and Cryptocurrencies,"Rename ""bitcoin"" to ""cryptocurrency""",/s/jocvwx/rename_bitcoin_cryptocurrency
491,Lobsters,cryptocurrencies,Bitcoin and Cryptocurrencies,DagCoin: a cryptocurrency without blocks,https://bitslog.wordpress.com/2015/09/11/dagcoin/
492,Lobsters,cryptocurrencies,Bitcoin and Cryptocurrencies,"SEC Complaint: Homero Joshua Garza, Gaw Miners, LLC, and Zenminer, LLC d/b/a Zen Cloud",https://www.sec.gov/litigation/complaints/2015/comp23415.pdf
493,Lobsters,cryptocurrencies,Bitcoin and Cryptocurrencies,A VC's Thoughts on Ethereum,https://medium.com/@kpcb_edge/our-thoughts-on-ethereum-31520b164e00
494,Lobsters,cryptocurrencies,Bitcoin and Cryptocurrencies,Bitcoin’s biggest challenges,https://blog.companyzero.com/2015/11/bitcoins-biggest-challenges/
495,Lobsters,cryptocurrencies,Bitcoin and Cryptocurrencies,The first US-issued VISA bitcoin debit card,https://blog.coinbase.com/2015/11/20/introducing-the-shift-card/
496,Lobsters,cryptocurrencies,Bitcoin and Cryptocurrencies,Mining (And Learning) With The 21 Bitcoin Computer,http://techcrunch.com/2015/11/18/mining-and-learning-with-the-21-bitcoin-computer/
497,Lobsters,cryptocurrencies,Bitcoin and Cryptocurrencies,How to destroy bitcoins?,https://medium.com/@alcio/how-to-destroy-bitcoins-255bb6f2142e
498,Lobsters,cryptocurrencies,Bitcoin and Cryptocurrencies,Rootstock merges Bitcoin and Ethereum to help the World Bank drive financial inclusion,http://www.ibtimes.co.uk/rootstock-merges-bitcoin-ethereum-help-world-bank-drive-financial-inclusion
499,Lobsters,cryptocurrencies,Bitcoin and Cryptocurrencies,The 21 Bitcoin Computer,https://21.co/
500,Lobsters,cryptocurrencies,Bitcoin and Cryptocurrencies,Programmable blockchains in context: Ethereum’s Future,https://medium.com/@ConsenSys/programmable-blockchains-in-context-ethereum-s-future-cd8451eb421e#.4i1ehojnj
501,Lobsters,cryptocurrencies,Bitcoin and Cryptocurrencies,Bitcoin is 100x less secure than commonly believed,http://bytemaster.github.io/update/2015/09/29/Bitcoin-is-100x-less-secure-than-commonly-believed/
502,Lobsters,cryptocurrencies,Bitcoin and Cryptocurrencies,Bitcoin and the Uniform Commercial Code,http://papers.ssrn.com/sol3/papers.cfm?abstract_id=2649441
503,Lobsters,cryptocurrencies,Bitcoin and Cryptocurrencies,Curated links to understand dangers of BitcoinXT,http://pastebin.com/TuTdggVe
504,Lobsters,cryptocurrencies,Bitcoin and Cryptocurrencies,Bitcoin XT appears to be the biggest attack on Bitcoin in history.,https://twitter.com/taoeffect/status/634534985328906240
505,Lobsters,cryptocurrencies,Bitcoin and Cryptocurrencies,Adam Back on Bitcoin XT,http://spectrum.ieee.org/tech-talk/computing/networks/the-bitcoin-for-is-a-coup
506,Lobsters,cryptocurrencies,Bitcoin and Cryptocurrencies,"""Bitcoin XT's vision for a decentralized future is cheap, it only costs about 20 miracles""",https://forum.blockstack.org/t/blockstack-community-thoughts-on-block-size-bitcoin-xt-debate/152/24?u=greg
507,Lobsters,cryptocurrencies,Bitcoin and Cryptocurrencies,Why is Bitcoin forking?,https://medium.com/@octskyward/why-is-bitcoin-forking-d647312d22c1
508,Lobsters,cryptocurrencies,Bitcoin and Cryptocurrencies,Bitcoin fork released,https://lists.linuxfoundation.org/pipermail/bitcoin-dev/2015-August/010235.html
509,Lobsters,cryptocurrencies,Bitcoin and Cryptocurrencies,"Why soft forks are bad, and what they mean for bitcoin.",https://medium.com/@octskyward/on-consensus-and-forks-c6a050c792e7
510,Lobsters,cryptocurrencies,Bitcoin and Cryptocurrencies,Why I'm releasing a brainwallet cracker at DEFCON 23,https://rya.nc/defcon-brainwallets.html
511,Lobsters,cryptocurrencies,Bitcoin and Cryptocurrencies,Ethereum: Final Steps,https://blog.ethereum.org/2015/07/27/final-steps/
512,Lobsters,cryptocurrencies,Bitcoin and Cryptocurrencies,Cointrol — Bitcoin trading bot written in Python,https://github.com/jkbrzt/cointrol
513,Lobsters,cryptocurrencies,Bitcoin and Cryptocurrencies,Bitcoin Is Unsustainable,http://motherboard.vice.com/read/bitcoin-is-unsustainable
514,Lobsters,cryptocurrencies,Bitcoin and Cryptocurrencies,Some Miners Generating Invalid Blocks,https://bitcoin.org/en/alert/2015-07-04-spv-mining
515,Lobsters,cryptocurrencies,Bitcoin and Cryptocurrencies,Brittle systems,http://blog.dshr.org/2015/06/brittle-systems.html
516,Lobsters,cryptocurrencies,Bitcoin and Cryptocurrencies,Proof of Transition: New Thin Client Technique for Blockchains,http://blog.okturtles.com/2015/06/proof-of-transition-new-thin-client-technique-for-blockchains/
517,Lobsters,cryptocurrencies,Bitcoin and Cryptocurrencies,Breakdown of entropy in a Bitcoin app,https://www.reddit.com/r/Bitcoin/comments/37oxow/the_security_issue_of_blockchaininfos_android/crolfk4
518,Lobsters,cryptocurrencies,Bitcoin and Cryptocurrencies,Bitcoin mining on a 55 year old IBM 1401 mainframe: 80 seconds per hash,http://www.righto.com/2015/05/bitcoin-mining-on-55-year-old-ibm-1401.html
519,Lobsters,cryptocurrencies,Bitcoin and Cryptocurrencies,The Death of Bitcoin: an examination of next generation Bitcoin-replacement cryptocurrencies,http://tonyarcieri.com/the-death-of-bitcoin
520,Lobsters,cryptocurrencies,Bitcoin and Cryptocurrencies,Virtual-Notary,http://virtual-notary.org/
521,Lobsters,cryptocurrencies,Bitcoin and Cryptocurrencies,Why the block chain matters,http://www.wired.co.uk/magazine/archive/2015/06/features/bitcoin-reid-hoffman/viewall
522,Lobsters,cryptocurrencies,Bitcoin and Cryptocurrencies,Group Currency = Cryptocurrency + Basic Income,http://groupcurrency.org
523,Lobsters,cryptocurrencies,Bitcoin and Cryptocurrencies,Bitcoin Mining Profit Calculator: Gaiden,http://bitcalc.beepboopbitcoin.com/
524,Lobsters,cryptocurrencies,Bitcoin and Cryptocurrencies,Bitcoin is Not a Good Consumer Product,http://lucumr.pocoo.org/2015/4/13/bitcoin-and-cryptocurrencies/
525,Lobsters,cryptocurrencies,Bitcoin and Cryptocurrencies,Eclipse Attacks on Bitcoin’s Peer-to-Peer Network,http://cs-people.bu.edu/heilman/eclipse/
526,Lobsters,cryptocurrencies,Bitcoin and Cryptocurrencies,Chainalysis CEO Denies 'Sybil Attack' on Bitcoin's Network,http://www.coindesk.com/chainalysis-ceo-denies-launching-sybil-attack-on-bitcoin-network/
527,Lobsters,cryptocurrencies,Bitcoin and Cryptocurrencies,µTorrent has included an automatic cryptocoin-miner in their latest update.,http://www.reddit.com/r/technology/comments/2y4lar/popular_torrenting_software_%C2%B5torrent_has_included/
528,Lobsters,cryptocurrencies,Bitcoin and Cryptocurrencies,Electoral Trouble in Sybilania,http://brooker.co.za/blog/2015/03/03/sybil.html
529,Lobsters,cryptocurrencies,Bitcoin and Cryptocurrencies,Does Bitcoin Solve Byzantine Consensus?,http://brooker.co.za/blog/2015/02/28/bitcoin.html
530,Lobsters,cryptocurrencies,Bitcoin and Cryptocurrencies,Blockstore: A Key-Value Store on Bitcoin,http://blog.onename.com/blockstore-bitcoin/
531,Lobsters,cryptocurrencies,Bitcoin and Cryptocurrencies,The Bitcoin Piñata!,http://amirchaudhry.com/bitcoin-pinata/
532,Lobsters,cryptocurrencies,Bitcoin and Cryptocurrencies,Inside the Chinese Bitcoin Mine That's Making $1.5M a Month,http://motherboard.vice.com/read/chinas-biggest-secret-bitcoin-mine
533,Lobsters,cryptocurrencies,Bitcoin and Cryptocurrencies,Nine awesome Bitcoin projects at Princeton,https://freedom-to-tinker.com/blog/randomwalker/nine-awesome-bitcoin-projects-at-princeton/
534,Lobsters,cryptocurrencies,Bitcoin and Cryptocurrencies,BlockchainID: decentralized alternative to Facebook Login and OpenID,https://github.com/okTurtles/blockchainid
535,Lobsters,cryptocurrencies,Bitcoin and Cryptocurrencies,Coinbase – Exchange API,https://docs.exchange.coinbase.com
536,Lobsters,cryptocurrencies,Bitcoin and Cryptocurrencies,ZeroNet - Decentralized websites using Bitcoin crypto and BitTorrent network,https://github.com/HelloZeroNet/ZeroNet
537,Lobsters,cryptocurrencies,Bitcoin and Cryptocurrencies,Bitcoin Price Crashes Through $250 (now $225) Mark,http://www.coindesk.com/bitcoin-price-crashes-250-mark/
538,Lobsters,cryptocurrencies,Bitcoin and Cryptocurrencies,DNSChain Considered Harmful,http://www.indolering.com/dnschain-is-harmful
539,Lobsters,cryptocurrencies,Bitcoin and Cryptocurrencies,Developer Guide - Bitcoin,https://bitcoin.org/en/developer-guide
540,Lobsters,cryptocurrencies,Bitcoin and Cryptocurrencies,MIT computer scientists can predict the price of Bitcoin,http://newsoffice.mit.edu/2014/mit-computer-scientists-can-predict-price-bitcoin#.VEadQI474jk
541,Lobsters,cryptocurrencies,Bitcoin and Cryptocurrencies,Bitcoin over Tor isn't a good idea,http://arxiv.org/abs/1410.6079
542,Lobsters,cryptocurrencies,Bitcoin and Cryptocurrencies,Crytovirus/Cryptowall virus: Have you paid the ransom?,http://en.wikipedia.org/wiki/CryptoLocker
543,Lobsters,cryptocurrencies,Bitcoin and Cryptocurrencies,Mining Bitcoin with pencil and paper: 0.67 hashes per day [blog],http://www.righto.com/2014/09/mining-bitcoin-with-pencil-and-paper.html
544,Lobsters,cryptocurrencies,Bitcoin and Cryptocurrencies,Ken Shirriff's blog: Bitcoins the hard way: Using the raw Bitcoin protocol,http://www.righto.com/2014/02/bitcoins-hard-way-using-raw-bitcoin.html
545,Lobsters,cryptocurrencies,Bitcoin and Cryptocurrencies,Ethereum Update by Vitalik Buterin,https://www.youtube.com/watch?v=z_7mvN7ixK0
546,Lobsters,cryptocurrencies,Bitcoin and Cryptocurrencies,Capture the Coins – Bitcoin Challenge Explained,http://www.kulkan.com/en/proyectos/bitcoin-challenge-explained/
547,Lobsters,cryptocurrencies,Bitcoin and Cryptocurrencies,BGP Hijacking for Cryptocurrency Profit,http://www.secureworks.com/cyber-threat-intelligence/threats/bgp-hijacking-for-cryptocurrency-profit/
548,Lobsters,cryptocurrencies,Bitcoin and Cryptocurrencies,"BitMEX, professional Bitcoin derivatives exchange, launches 10 XBT trading game contest",http://trade.bitmex.com
549,Lobsters,cryptocurrencies,Bitcoin and Cryptocurrencies,Filecoin: A Cryptocurrency Operated File Storage Network,http://filecoin.io/filecoin.pdf
550,Lobsters,cryptocurrencies,Bitcoin and Cryptocurrencies,An Optimal Bitcoin Mining Strategy - Proof of Idle,https://www.youtube.com/watch?v=QN2TPeQ9mnA
551,Lobsters,cryptocurrencies,Bitcoin and Cryptocurrencies,Paypal Freezes ProtonMail Campaign Funds,https://protonmail.ch/blog/paypal-freezes-protonmail-campaign-funds/
552,Lobsters,cryptocurrencies,Bitcoin and Cryptocurrencies,It's Time For a Hard Bitcoin Fork (51% of Mining Now Controlled By One Entity),http://hackingdistributed.com/2014/06/13/time-for-a-hard-bitcoin-fork/
553,Lobsters,cryptocurrencies,Bitcoin and Cryptocurrencies,Proof Market,https://proofmarket.org/
554,Lobsters,cryptocurrencies,Bitcoin and Cryptocurrencies,Timelock: time-release encryption incentivised by Bitcoins,https://www.mail-archive.com/bitcoin-development@lists.sourceforge.net/msg05547.html
555,Lobsters,cryptocurrencies,Bitcoin and Cryptocurrencies,"The Willy Report: proof of massive fraudulent trading activity at Mt. Gox, and how it has affected the price of Bitcoin",http://willyreport.wordpress.com/2014/05/25/the-willy-report-proof-of-massive-fraudulent-trading-activity-at-mt-gox-and-how-it-has-affected-the-price-of-bitcoin/
556,Lobsters,cryptocurrencies,Bitcoin and Cryptocurrencies,Lobste.rs fork in which submissions and voting cost bitcoin,https://github.com/fisher-lebo/updn
557,Lobsters,cryptocurrencies,Bitcoin and Cryptocurrencies,Minimum Viable Block Chain,http://www.igvita.com/2014/05/05/minimum-viable-block-chain/#triple-entry
558,Lobsters,cryptocurrencies,Bitcoin and Cryptocurrencies,LocalBitcoins received a very dangerous attack against the site infrastructure,https://localbitcoins.com/
559,Lobsters,cryptocurrencies,Bitcoin and Cryptocurrencies,How I built and launched a 2048 Game of Thrones Edition,https://medium.com/indie-games/d4085d8aba64
560,Lobsters,cryptocurrencies,Bitcoin and Cryptocurrencies,BitIodine - Get more from the blockchain,https://bitiodine.net/
