ID,Source,Tag_Code,Tag_Name,Title,Url
139,Lobsters,cryptocurrencies,Bitcoin and Cryptocurrencies,The Conversations that Cryptocurrency Kills,https://jacobitemag.com/2018/07/27/the-conversations-that-cryptocurrency-kills/
140,Lobsters,cryptocurrencies,Bitcoin and Cryptocurrencies,Ethereum Network Architecture Analysis,https://www.tutorialdocs.com/article/ethereum-network-architecture.html
141,Lobsters,cryptocurrencies,Bitcoin and Cryptocurrencies,Algorand: Scaling Byzantine Agreements for Cryptocurrencies (2017),https://people.csail.mit.edu/nickolai/papers/gilad-algorand.pdf
142,Lobsters,cryptocurrencies,Bitcoin and Cryptocurrencies,Risks of Cryptocurrencies,https://www1.icsi.berkeley.edu/~nweaver/papers/cryptorisks.pdf
143,Lobsters,cryptocurrencies,Bitcoin and Cryptocurrencies,Blockchain for the Internet of Things: a Systematic Literature Review (2016),https://nexa.polito.it/nexacenterfiles/Blockchain%20for%20the%20Internet%20of%20Things%3A%20a%20Systematic%20Literature%20Review.pdf
144,Lobsters,cryptocurrencies,Bitcoin and Cryptocurrencies,"Ping, Pong, and Unresponsive Bitcoin Nodes",http://www.petecorey.com/blog/2018/07/09/ping-pong-and-unresponsive-bitcoin-nodes/
145,Lobsters,cryptocurrencies,Bitcoin and Cryptocurrencies,Codius: Smart Contracts Made From Containers,https://medium.com/coil/codius-smart-contracts-made-from-containers-b3b16c3e3890
146,Lobsters,cryptocurrencies,Bitcoin and Cryptocurrencies,The Four Most Expensive Words in the English Language,https://blog.dshr.org/2018/06/the-four-most-expensive-words-in.html
147,Lobsters,cryptocurrencies,Bitcoin and Cryptocurrencies,Limiting Peers with DynamicSupervisor Options,http://www.petecorey.com/blog/2018/06/18/limiting-peers-with-dynamicsupervisor-options/
148,Lobsters,cryptocurrencies,Bitcoin and Cryptocurrencies,Generating Test Fixtures with Wireshark,http://www.petecorey.com/blog/2018/06/11/generating-test-fixtures-with-wireshark/
149,Lobsters,cryptocurrencies,Bitcoin and Cryptocurrencies,Leaf-Node weakness in Bitcoin Merkle Tree Design,https://bitslog.wordpress.com/2018/06/09/leaf-node-weakness-in-bitcoin-merkle-tree-design/
150,Lobsters,cryptocurrencies,Bitcoin and Cryptocurrencies,Semi-Formal Development: The Cardano Wallet,http://www.well-typed.com/blog/2018/05/semi-formal-development/
151,Lobsters,cryptocurrencies,Bitcoin and Cryptocurrencies,Step by Step Towards Creating a Safe Smart Contract: Lessons and Insights from a Cryptocurrency Lab,http://muratbuffalo.blogspot.com/2018/04/paper-summary-step-by-step-towards.html
152,Lobsters,cryptocurrencies,Bitcoin and Cryptocurrencies,"The mathcoins: decentralised cryptocurrency, without the blockchain?",https://davidgerard.co.uk/blockchain/2018/06/01/the-mathcoins-decentralised-cryptocurrency-without-the-blockchain/
153,Lobsters,cryptocurrencies,Bitcoin and Cryptocurrencies,Ledger Language Design: Designing and Deploying Formally Verified Public Ledgers,https://eprint.iacr.org/2018/416.pdf
154,Lobsters,cryptocurrencies,Bitcoin and Cryptocurrencies,Cost of a 51% Attack for Different Cryptocurrencies,https://www.crypto51.app/
155,Lobsters,cryptocurrencies,Bitcoin and Cryptocurrencies,"BTCPay: cross platform, self-hosted server compatible with Bitpay API",https://github.com/btcpayserver/btcpayserver
156,Lobsters,cryptocurrencies,Bitcoin and Cryptocurrencies,An Introduction to Mechanism Design,https://medium.com/@bwasti/mechanism-design-a8ff1b1a7bdd
157,Lobsters,cryptocurrencies,Bitcoin and Cryptocurrencies,Spreading Through the Bitcoin Network,http://www.petecorey.com/blog/2018/05/21/spreading-through-the-bitcoin-network/
158,Lobsters,cryptocurrencies,Bitcoin and Cryptocurrencies,The State of Cryptocurrency Mining,https://blog.sia.tech/the-state-of-cryptocurrency-mining-538004a37f9b
159,Lobsters,cryptocurrencies,Bitcoin and Cryptocurrencies,A memory-bound graph-theoretic proof-of-work system,https://github.com/tromp/cuckoo
160,Lobsters,cryptocurrencies,Bitcoin and Cryptocurrencies,Bitcoin As Explained by A.I.,http://botnik.org/content/bitcoin.html
161,Lobsters,cryptocurrencies,Bitcoin and Cryptocurrencies,"The Verge Hack, Explained",https://blog.theabacus.io/the-verge-hack-explained-7942f63a3017
162,Lobsters,cryptocurrencies,Bitcoin and Cryptocurrencies,Crypko [AI Blockchain Anime],https://crypko.ai/#/
163,Lobsters,cryptocurrencies,Bitcoin and Cryptocurrencies,ASICs and Mining Centralization,https://blog.dshr.org/2018/05/asics-and-mining-centralization.html
164,Lobsters,cryptocurrencies,Bitcoin and Cryptocurrencies,"Bitcoin’s stupendous power waste is green, apparently — bad excuses for Proof-of-Work",https://davidgerard.co.uk/blockchain/2018/05/22/bitcoins-stupendous-power-waste-is-green-apparently-bad-excuses-for-proof-of-work/
165,Lobsters,cryptocurrencies,Bitcoin and Cryptocurrencies,Proposed solution to byzantine consensus without proof-of-X,https://drive.google.com/file/d/150uOd161WUzmcypoGUPfW3PrzE9lc_Eo/view
166,Lobsters,cryptocurrencies,Bitcoin and Cryptocurrencies,Beefing Up our Bitcoin Node with Connection,http://www.petecorey.com/blog/2018/05/14/beefing-up-our-bitcoin-node-with-connection/
167,Lobsters,cryptocurrencies,Bitcoin and Cryptocurrencies,DSLs for Ethereum Contracts,http://www.michaelburge.us/2018/05/15/ethereum-chess-engine.html
168,Lobsters,cryptocurrencies,Bitcoin and Cryptocurrencies,Ethereum Casper proof-of-stake only has to work well enough: Worse is Better in action,https://davidgerard.co.uk/blockchain/2018/05/13/ethereum-casper-only-has-to-work-well-enough-worse-is-better-in-action/
169,Lobsters,cryptocurrencies,Bitcoin and Cryptocurrencies,Blockchain’s Two-Flavored Appeal,http://www.circleid.com/posts/20180507_blockchain_two_flavored_appeal/
170,Lobsters,cryptocurrencies,Bitcoin and Cryptocurrencies,Reversing BIP-39 and the Power of Property Testing,http://www.petecorey.com/blog/2018/05/07/reversing-bip39-and-the-power-of-property-testing/
171,Lobsters,cryptocurrencies,Bitcoin and Cryptocurrencies,Creating a NEP5 Token on NEO network,https://blog.ovalerio.net/archives/1478
172,Lobsters,cryptocurrencies,Bitcoin and Cryptocurrencies,"Call for grant proposals from the Zcash Foundation; $250,000 total budget",https://z.cash.foundation//blog/q2-grant-program/
173,Lobsters,cryptocurrencies,Bitcoin and Cryptocurrencies,The Faults and Shortcomings of the EVM,http://earlz.net/view/2017/08/13/0451/the-faults-and-shortcomings-of-the-evm
174,Lobsters,cryptocurrencies,Bitcoin and Cryptocurrencies,Hanging the Linux core dump pipe helper,https://rachelbythebay.com/w/2018/04/29/core/
175,Lobsters,cryptocurrencies,Bitcoin and Cryptocurrencies,Why you should verify the tokens you own: A deep dive into two vulnerable ERC20 contracts,https://cryptojobslist.com/blog/two-vulnerable-erc20-contracts-deep-dive-beautychain-smartmesh
176,Lobsters,cryptocurrencies,Bitcoin and Cryptocurrencies,"Smart contracts, stupid humans: new major Ethereum ERC-20 token bugs BatchOverflow and ProxyOverflow",https://davidgerard.co.uk/blockchain/2018/04/26/smart-contracts-stupid-humans-new-major-erc-20-token-bugs-batchoverflow-and-proxyoverflow/
177,Lobsters,cryptocurrencies,Bitcoin and Cryptocurrencies,Connecting an Elixir Node to the Bitcoin Network,http://www.petecorey.com/blog/2018/04/23/connecting-an-elixir-node-to-the-bitcoin-network/
178,Lobsters,cryptocurrencies,Bitcoin and Cryptocurrencies,How to Build Bitcoin/Cryptocurrency Exchange Software,http://merehead.com/blog/how-build-cryptocurrency-exchange-software/
179,Lobsters,cryptocurrencies,Bitcoin and Cryptocurrencies,Get Started with Blockchain Using the new AWS Blockchain Templates,https://aws.amazon.com/blogs/aws/get-started-with-blockchain-using-the-new-aws-blockchain-templates/
180,Lobsters,cryptocurrencies,Bitcoin and Cryptocurrencies,'Big bitcoin heist' suspect escapes prison and flees Iceland 'on PM's plane',https://www.theguardian.com/technology/2018/apr/18/big-bitcoin-heist-suspect-sindri-thor-stefansson-escapes-prison-flees-iceland-pm-katrin-jakobsdottir-plane
181,Lobsters,cryptocurrencies,Bitcoin and Cryptocurrencies,Casper the Friendly Finality Gadget,https://arxiv.org/abs/1710.09437
182,Lobsters,cryptocurrencies,Bitcoin and Cryptocurrencies,How quantum computing could wreak havoc on cryptocurrency,https://thenextweb.com/contributors/2018/04/14/quantum-computing-wreak-havoc-cryptocurrency/
183,Lobsters,cryptocurrencies,Bitcoin and Cryptocurrencies,Nekøyume – Blockchain-based Role-Playing Game,https://preview.nekoyu.me/
184,Lobsters,cryptocurrencies,Bitcoin and Cryptocurrencies,Numa - Open source social network using IPFS + ActivityPub + Ethereum,https://numaverse.com
185,Lobsters,cryptocurrencies,Bitcoin and Cryptocurrencies,Peepeth: Unstoppable microblogging,https://peepeth.com
186,Lobsters,cryptocurrencies,Bitcoin and Cryptocurrencies,"Multiple vulnerabilities in SecureRandom(), numerous cryptocurrency products affected",https://lists.linuxfoundation.org/pipermail/bitcoin-dev/2018-April/015873.html
187,Lobsters,cryptocurrencies,Bitcoin and Cryptocurrencies,Blockchain is not only crappy tech but also a bad vision for the future,https://medium.com/@kaistinchcombe/decentralized-and-trustless-crypto-paradise-is-actually-a-medieval-hellhole-c1ca122efdec
188,Lobsters,cryptocurrencies,Bitcoin and Cryptocurrencies,"Y'alls: Articles, served using the Lightning Network!",https://yalls.org
189,Lobsters,cryptocurrencies,Bitcoin and Cryptocurrencies,Debunking “But Bitcoin is like the early Internet!”,https://davidgerard.co.uk/blockchain/2018/04/05/debunking-but-bitcoin-is-like-the-early-internet/
190,Lobsters,cryptocurrencies,Bitcoin and Cryptocurrencies,"Satoshi Nakamoto was an easyDNS customer, and we know who it is…",https://www.easydns.com/blog/2018/04/01/satoshi-nakamoto-was-an-easydns-customer-and-we-know-who-it-is/
191,Lobsters,cryptocurrencies,Bitcoin and Cryptocurrencies,Buzzword Convergence: Making Sense of Quantum Neural Blockchain AI—Stephen Wolfram Blog,http://blog.stephenwolfram.com/2018/04/buzzword-convergence-making-sense-of-quantum-neural-blockchain-ai/
192,Lobsters,cryptocurrencies,Bitcoin and Cryptocurrencies,OpenBazaar 2.0 is now live!,https://www.openbazaar.org/blog/openbazaar-2-0-live/
193,Lobsters,cryptocurrencies,Bitcoin and Cryptocurrencies,Making Bitcoin Legal,https://www.cl.cam.ac.uk/~rja14/Papers/making-bitcoin-legal.pdf
194,Lobsters,cryptocurrencies,Bitcoin and Cryptocurrencies,Building Mixed Endian Binaries with Elixir,http://www.petecorey.com/blog/2018/03/19/building-mixed-endian-binaries-with-elixir/
195,Lobsters,cryptocurrencies,Bitcoin and Cryptocurrencies,Who and What Is Coinhive?,https://krebsonsecurity.com/2018/03/who-and-what-is-coinhive/
196,Lobsters,cryptocurrencies,Bitcoin and Cryptocurrencies,Technology and the responsibility of trust,https://startupsventurecapital.com/the-financialization-of-life-a90fe2cb839f
197,Lobsters,cryptocurrencies,Bitcoin and Cryptocurrencies,"Blockchain identity: Cambridge Analytica, but on the blockchain",https://davidgerard.co.uk/blockchain/2018/03/22/blockchain-identity-cambridge-analytica-but-on-the-blockchain/
198,Lobsters,cryptocurrencies,Bitcoin and Cryptocurrencies,Will the ‘new electricity’ please stand up,http://blog.ikura.co/posts/will-the-new-electricity-please-stand-up.html
199,Lobsters,cryptocurrencies,Bitcoin and Cryptocurrencies,BitMinutes: Free Global Value Transfer and Guaranteed Micro-Lending,https://www.bitminutes.com/docs/BitMinutes_White_Paper.pdf
200,Lobsters,cryptocurrencies,Bitcoin and Cryptocurrencies,Child abuse imagery found within bitcoin's blockchain,https://www.theguardian.com/technology/2018/mar/20/child-abuse-imagery-bitcoin-blockchain-illegal-content
201,Lobsters,cryptocurrencies,Bitcoin and Cryptocurrencies,Breaking the Ledger Security Model,https://saleemrashid.com/2018/03/20/breaking-ledger-security-model/
202,Lobsters,cryptocurrencies,Bitcoin and Cryptocurrencies,Small city in Upstate NY passes first Bitcoin mining ban in U.S.,http://www.newyorkupstate.com/northern-ny/2018/03/plattsburgh_passes_first_bitcoin_mining_ban_in_us.html
203,Lobsters,cryptocurrencies,Bitcoin and Cryptocurrencies,Bitcoin – Lightning goes live on the mainnet,https://blog.lightning.engineering/announcement/2018/03/15/lnd-beta.html?1
204,Lobsters,cryptocurrencies,Bitcoin and Cryptocurrencies,Cryptographic javascript-functions for ethereum and tutorials to use them with web3js and solidity,https://github.com/pubkey/eth-crypto
205,Lobsters,cryptocurrencies,Bitcoin and Cryptocurrencies,Keybase is now supported by the Stellar Development Foundation,https://keybase.io/blog/keybase-stellar
206,Lobsters,cryptocurrencies,Bitcoin and Cryptocurrencies,MemesChain: own & monetize memes with the power of blockchain & AI,https://www.memeschain.com/
207,Lobsters,cryptocurrencies,Bitcoin and Cryptocurrencies,"No, You Probably Don't Need a Blockchain",http://www.ashtonkemerling.com/blog/2018/02/21/no-you-probably-dont-need-a-blockchain
208,Lobsters,cryptocurrencies,Bitcoin and Cryptocurrencies,Raise the bar for Cryptocurrency Exchanges,https://medium.com/@brian.cain/raise-the-bar-for-cryptocurrency-exchanges-eae7aaa05912
209,Lobsters,cryptocurrencies,Bitcoin and Cryptocurrencies,JavaScript Cryptomining Scripts Discovered in 19 Google Play Apps,https://www.bleepingcomputer.com/news/security/javascript-cryptomining-scripts-discovered-in-19-google-play-apps/
210,Lobsters,cryptocurrencies,Bitcoin and Cryptocurrencies,Do you need a Blockchain? Probably less than Wüst and Gervais think you do,https://davidgerard.co.uk/blockchain/2018/02/10/do-you-need-a-blockchain-probably-less-than-wust-and-gervais-think-you-do/
211,Lobsters,cryptocurrencies,Bitcoin and Cryptocurrencies,Ledger hardware cryptocurrency wallets vulnerable to man-in-the-middle attack,https://www.hackread.com/all-ledger-hardware-wallet-vulnerable-to-man-in-the-middle-attack/
212,Lobsters,cryptocurrencies,Bitcoin and Cryptocurrencies,Roko's Ransomware,http://www.michaelburge.us/2018/02/06/rokos-ransomware.html
213,Lobsters,cryptocurrencies,Bitcoin and Cryptocurrencies,"Here’s the Solution to the 3-Year-Old, $50,000 Bitcoin Puzzle",https://motherboard.vice.com/en_us/article/kzpqzz/heres-the-solution-to-the-3-year-old-dollar50000-bitcoin-puzzle
214,Lobsters,cryptocurrencies,Bitcoin and Cryptocurrencies,Predicting Random Numbers in Ethereum Smart Contracts,https://blog.positive.com/predicting-random-numbers-in-ethereum-smart-contracts-e5358c6b8620
215,Lobsters,cryptocurrencies,Bitcoin and Cryptocurrencies,How $800k Evaporated from the PoWH Coin Ponzi Scheme Overnight,https://medium.com/@ebanisadr/how-800k-evaporated-from-the-powh-coin-ponzi-scheme-overnight-1b025c33b530
216,Lobsters,cryptocurrencies,Bitcoin and Cryptocurrencies,Chain of Fools,http://www.allenpike.com/2018/blockchain
217,Lobsters,cryptocurrencies,Bitcoin and Cryptocurrencies,Deanonymizing Tor Hidden Service Users Through Bitcoin Transactions Analysis,https://arxiv.org/pdf/1801.07501.pdf
218,Lobsters,cryptocurrencies,Bitcoin and Cryptocurrencies,Haskelling Bitcoin,https://medium.com/@sahabi/haskelling-bitcoin-7e7128a9d4b4
219,Lobsters,cryptocurrencies,Bitcoin and Cryptocurrencies,"U.S. Regulators Subpoena Crypto Exchange Bitfinex, Tether",https://www.bloomberg.com/news/articles/2018-01-30/crypto-exchange-bitfinex-tether-said-to-get-subpoenaed-by-cftc
220,Lobsters,cryptocurrencies,Bitcoin and Cryptocurrencies,From DNA to bitcoin: How I won the Davos DNA-storage Bitcoin Challenge,https://swuyts.wordpress.com/2018/01/16/from-dna-to-bitcoin-how-i-won-the-davos-bitcoin-challenge/
221,Lobsters,cryptocurrencies,Bitcoin and Cryptocurrencies,$9 billion startup Stripe drops bitcoin support because it doesn't make sense as a means of payment,http://www.businessinsider.com/stripe-ends-its-bitcoin-payments-product-2018-1
222,Lobsters,cryptocurrencies,Bitcoin and Cryptocurrencies,"Is the Lightning network a tree structure, or something more complex?",http://www.coppolacomment.com/2018/01/probability-for-geeks.html
223,Lobsters,cryptocurrencies,Bitcoin and Cryptocurrencies,Mathematical Proof That the Lightning Network Cannot Be a Decentralized Bitcoin Scaling Solution,https://medium.com/@jonaldfyookball/mathematical-proof-that-the-lightning-network-cannot-be-a-decentralized-bitcoin-scaling-solution-1b8147650800
224,Lobsters,cryptocurrencies,Bitcoin and Cryptocurrencies,Stripe - Ending Bitcoin Support,https://stripe.com/blog/ending-bitcoin-support
225,Lobsters,cryptocurrencies,Bitcoin and Cryptocurrencies,Turning Down a Blockchain Job Offer,https://hookrace.net/blog/turning-down-blockchain/
226,Lobsters,cryptocurrencies,Bitcoin and Cryptocurrencies,"GPU Prices Skyrocket, Breaking the Entire DIY PC Market",https://www.extremetech.com/gaming/262493-gpu-prices-skyrocket-breaking-entire-diy-pc-market
227,Lobsters,cryptocurrencies,Bitcoin and Cryptocurrencies,The Bitcoin Psyop,https://www.youtube.com/watch?v=FkhUn7nh33Q
228,Lobsters,cryptocurrencies,Bitcoin and Cryptocurrencies,The Tether Conundrum: How Bitcoin's price may be manipulated via a counterfeit cryptocurrency,https://tonyarcieri.com/the-tether-conundrum
229,Lobsters,cryptocurrencies,Bitcoin and Cryptocurrencies,Bulletproofs: Short Proofs for Confidential Transactions,https://crypto.stanford.edu/bulletproofs/
230,Lobsters,cryptocurrencies,Bitcoin and Cryptocurrencies,Sh*tcoin vs. buttcoin: a dummies guide to cryptocurrency manipulation,http://counterthink.com/Shtcoin-Buttcoin.asp
231,Lobsters,cryptocurrencies,Bitcoin and Cryptocurrencies,"Researchers find that one person likely drove Bitcoin from $150 to $1,000",https://techcrunch.com/2018/01/15/researchers-finds-that-one-person-likely-drove-bitcoin-from-150-to-1000/
232,Lobsters,cryptocurrencies,Bitcoin and Cryptocurrencies,The DCS Theorem,https://arxiv.org/abs/1801.04335
233,Lobsters,cryptocurrencies,Bitcoin and Cryptocurrencies,"IELE: A New, Virtual Machine for the Blockchain (2017)",https://runtimeverification.com/blog/?p=498
234,Lobsters,cryptocurrencies,Bitcoin and Cryptocurrencies,Website Glitch Let Me Overstock My Coinbase,https://krebsonsecurity.com/2018/01/website-glitch-let-me-overstock-my-coinbase/
235,Lobsters,cryptocurrencies,Bitcoin and Cryptocurrencies,SpaceKIM - The First North Korean ICO,http://www.spacekim.io/
236,Lobsters,cryptocurrencies,Bitcoin and Cryptocurrencies,Announcing Blockchainifyly,http://blockchainifyly.com
237,Lobsters,cryptocurrencies,Bitcoin and Cryptocurrencies,How to build NodeJS application for your Hyperledger Composer networks,https://www.skcript.com/svr/how-to-build-nodejs-application-for-your-hyperledger-composer-networks/
238,Lobsters,cryptocurrencies,Bitcoin and Cryptocurrencies,"Dogecoin Market Cap Hits $1 Billion, to Its Creator's Dismay",https://www.coindesk.com/dogecoin-market-cap-hits-1-billion-creators-dismay/
239,Lobsters,cryptocurrencies,Bitcoin and Cryptocurrencies,"Be your own bank! Every Bitcoin Electrum wallet since 2015 is insecure, update now",https://davidgerard.co.uk/blockchain/2018/01/07/be-your-own-bank-every-bitcoin-electrum-wallet-since-2015-is-insecure-update-now/
240,Lobsters,cryptocurrencies,Bitcoin and Cryptocurrencies,Essential Programmer's Guide to Cryptocurrencies,https://www.dailydrip.com/blog/essential-programmer-s-guide-to-cryptocurrencies
241,Lobsters,cryptocurrencies,Bitcoin and Cryptocurrencies,"ERC20-K: Formal, Executable Specification of ERC20",https://runtimeverification.com/blog/?p=496
242,Lobsters,cryptocurrencies,Bitcoin and Cryptocurrencies,Bitcoin—The Andromeda Strain of Computer Science Research,https://www.cs.columbia.edu/~smb/blog/2017-12/2017-12-30.html
243,Lobsters,cryptocurrencies,Bitcoin and Cryptocurrencies,Bitcoin is a speculative asset but not yet a systemic risk,https://www.economist.com/news/leaders/21732526-there-investment-case-cryptocurrency-bitcoin-speculative-asset-not-yet
244,Lobsters,cryptocurrencies,Bitcoin and Cryptocurrencies,Red Programming Language Goes Blockchain!,http://www.red-lang.org/2017/12/leaping-into-future-red-goes-blockchain.html
245,Lobsters,cryptocurrencies,Bitcoin and Cryptocurrencies,The blockchain paradox: Why distributed ledger technologies may do little to transform the economy,https://www.oii.ox.ac.uk/blog/the-blockchain-paradox-why-distributed-ledger-technologies-may-do-little-to-transform-the-economy/
246,Lobsters,cryptocurrencies,Bitcoin and Cryptocurrencies,"Meet ‘Picasso’, the Painter on GDAX",https://medium.com/@bitfinexed/meet-picasso-the-painter-on-gdax-c478ff8f50e5
247,Lobsters,cryptocurrencies,Bitcoin and Cryptocurrencies,Searching for Bitcoins in GitHub repositories with Google BigQuery,https://www.youtube.com/watch?v=Xml4Gx3huag
248,Lobsters,cryptocurrencies,Bitcoin and Cryptocurrencies,SegWit daily monitor day 3 on /r/Bitcoin,https://www.reddit.com/r/Bitcoin/comments/7ljpf5/day_3_i_will_repost_this_guide_daily_until/
249,Lobsters,cryptocurrencies,Bitcoin and Cryptocurrencies,Brainwallet: The Bitcoin Wallet That’s All in Your Head,https://news.bitcoin.com/brainwallet-bitcoin-wallet-thats-head/
250,Lobsters,cryptocurrencies,Bitcoin and Cryptocurrencies,How to build your own Ethereum based ERC20 Token and launch an ICO in next 20 minutes,https://hashnode.com/post/how-to-build-your-own-ethereum-based-erc20-token-and-launch-an-ico-in-next-20-minutes-cjbcpwzec01c93awtbij90uzn
251,Lobsters,cryptocurrencies,Bitcoin and Cryptocurrencies,"XMR mining app, built with Vue.js, D3 and CoinHive",https://github.com/bradoyler/xmr-miner
252,Lobsters,cryptocurrencies,Bitcoin and Cryptocurrencies,IOTA : A Tangled Mess,http://codesuppository.blogspot.com/2017/12/iota-tangled-mess.html
253,Lobsters,cryptocurrencies,Bitcoin and Cryptocurrencies,The Creator of Signal Has a Plan to Fix Cryptocurrency,https://www.wired.com/story/mobilecoin-cryptocurrency/
254,Lobsters,cryptocurrencies,Bitcoin and Cryptocurrencies,Parity Proposals’ Potential Problems,http://hackingdistributed.com/2017/12/13/ether-resurrection/
255,Lobsters,cryptocurrencies,Bitcoin and Cryptocurrencies,The deal with Bitcoin,http://lcamtuf.blogspot.com/2017/12/the-deal-with-bitcoin.html
256,Lobsters,cryptocurrencies,Bitcoin and Cryptocurrencies,Starbucks wi-fi made computers mine cash,http://www.bbc.com/news/technology-42338754
257,Lobsters,cryptocurrencies,Bitcoin and Cryptocurrencies,RaiBlocks: a new cryptocurrency without expensive proof-of-work [2014],https://bitcoinist.com/exclusive-interview-raiblocks-team/
258,Lobsters,cryptocurrencies,Bitcoin and Cryptocurrencies,Statement on Cryptocurrencies and Initial Coin Offerings,https://www.sec.gov/news/public-statement/statement-clayton-2017-12-11
259,Lobsters,cryptocurrencies,Bitcoin and Cryptocurrencies,Parity suggests Ethereum hardfork to rescue funds locked by bug in their software,https://paritytech.io/blog/on-classes-of-stuck-ether-and-potential-solutions-2.html
260,Lobsters,cryptocurrencies,Bitcoin and Cryptocurrencies,RaiBlocks is What Bitcoin Should Have Been From the Start,https://medium.com/@DecentRally/raiblocks-is-what-bitcoin-should-have-been-from-the-start-1d91c4c61d2d
261,Lobsters,cryptocurrencies,Bitcoin and Cryptocurrencies,The Problem with Calling Bitcoin a “Ponzi Scheme”,https://prestonbyrne.com/2017/12/08/bitcoin_ponzi/
262,Lobsters,cryptocurrencies,Bitcoin and Cryptocurrencies,"Comparing Solidity to LLL, and why I use the latter",https://ecc-comp.blogspot.com/2017/12/comparing-solidity-to-lll-and-why-i-use.html
263,Lobsters,cryptocurrencies,Bitcoin and Cryptocurrencies,ETC is NOT Coming ... it's failing and is dangerous,https://web.archive.org/web/20171208104145/http://etciscoming.com/
264,Lobsters,cryptocurrencies,Bitcoin and Cryptocurrencies,"I created an educational Bitcoin, Cryptocurrency, and Blockchain newsletter",https://stefanovic.ventures/cryptonews
265,Lobsters,cryptocurrencies,Bitcoin and Cryptocurrencies,Large collection of ICO whitepapers,https://github.com/masonicGIT/ico-whitepapers
266,Lobsters,cryptocurrencies,Bitcoin and Cryptocurrencies,"My $200,000 bitcoin odyssey",https://www.engadget.com/2017/12/05/how-not-to-store-your-bitcoins/
267,Lobsters,cryptocurrencies,Bitcoin and Cryptocurrencies,Can Crypto Currencies be Money?,https://www.youtube.com/watch?v=0UVpYEP_TbE
268,Lobsters,cryptocurrencies,Bitcoin and Cryptocurrencies,"Don’t ""Go Freaking Do It"" (an analysis of smart contract code)",https://medium.com/@jesperht/dont-go-freaking-do-it-5da4df4d4b44
269,Lobsters,cryptocurrencies,Bitcoin and Cryptocurrencies,The UK and EU want to force bitcoin users to reveal their identities,http://www.businessinsider.com/anti-money-laundering-cryptocurrencies-regulation-eu-uk-identity-2017-12
270,Lobsters,cryptocurrencies,Bitcoin and Cryptocurrencies,Ethereum network is currently clogged by cryptokitties.co,https://www.reddit.com/r/ArkEcosystem/comments/7hcwq1/ethereum_network_is_currently_clogged_by/
271,Lobsters,cryptocurrencies,Bitcoin and Cryptocurrencies,"Smart contracts, Heise Technology Review, Oktober 2017: original interview in English",https://davidgerard.co.uk/blockchain/2017/12/03/smart-contracts-article-in-heise-technology-review-oktober-2017-original-interview-in-english/
272,Lobsters,cryptocurrencies,Bitcoin and Cryptocurrencies,Write your next Ethereum Contract in Pyramid Scheme,http://www.michaelburge.us/2017/11/28/write-your-next-ethereum-contract-in-pyramid-scheme.html
273,Lobsters,cryptocurrencies,Bitcoin and Cryptocurrencies,Is Filecoin a $257M Ponzi Scheme?,https://github.com/backender/filecoin-survey/releases/download/0.5/filecoin_survey.2.pdf
274,Lobsters,cryptocurrencies,Bitcoin and Cryptocurrencies,Guessing Bitcoin private keys,https://pastebin.com/jCDFcESz
275,Lobsters,cryptocurrencies,Bitcoin and Cryptocurrencies,Understanding Ethereum Smart Contracts,http://gjermundbjaanes.com/understanding-ethereum-smart-contracts/
