ID,Source,Tag_Code,Tag_Name,Title,Url
276,Lobsters,cryptocurrencies,Bitcoin and Cryptocurrencies,The Great Bitcoin Bull Market Of 2017,http://www.runtogold.com/the-great-bitcoin-bull-market-of-2017/
277,Lobsters,cryptocurrencies,Bitcoin and Cryptocurrencies,"Nearly 4 Million Bitcoins Lost Forever, New Study Says",http://fortune.com/2017/11/25/lost-bitcoins/
278,Lobsters,cryptocurrencies,Bitcoin and Cryptocurrencies,Segwit2x Bugs Explained,https://bitcointechtalk.com/segwit2x-bugs-explained-8e0c286124bc
279,Lobsters,cryptocurrencies,Bitcoin and Cryptocurrencies,Crossing Over to Web3 – 02 Smart Contracts,https://blog.jaak.io/crossing-over-to-web3-smart-contracts-3a295e35e5c0
280,Lobsters,cryptocurrencies,Bitcoin and Cryptocurrencies,"The World Food Programme’s much-publicised “blockchain” has one participant — i.e., it’s a database",https://davidgerard.co.uk/blockchain/2017/11/26/the-world-food-programmes-much-publicised-blockchain-has-one-participant-i-e-its-a-database/
281,Lobsters,cryptocurrencies,Bitcoin and Cryptocurrencies,There can only ever be 21 million forks of Bitcoin: a survey so far,https://davidgerard.co.uk/blockchain/2017/11/20/there-can-only-ever-be-21-million-forks-of-bitcoin-a-survey-so-far/
282,Lobsters,cryptocurrencies,Bitcoin and Cryptocurrencies,SHA-256 and its Relation to Bitcoin,https://www.mycryptopedia.com/sha-256-related-bitcoin/
283,Lobsters,cryptocurrencies,Bitcoin and Cryptocurrencies,Everything you wanted to know about bitcoin but were afraid to ask,https://www.theguardian.com/technology/2017/nov/11/everything-you-ever-wanted-to-know-about-bitcoin-but-were-to-afraid-to-ask-cryptocurrencies
284,Lobsters,cryptocurrencies,Bitcoin and Cryptocurrencies,Björkcoin: Björk’s cryptocurrency album project dissected (impolite ranty version),https://rocknerd.co.uk/2017/11/12/bjorkcoin-bjorks-cryptocurrency-album-project-dissected-impolite-ranty-version/
285,Lobsters,cryptocurrencies,Bitcoin and Cryptocurrencies,Stop Dragging Hayek into Bitcoin,https://paulbutler.org/archives/stop-dragging-hayek-into-bitcoin/
286,Lobsters,cryptocurrencies,Bitcoin and Cryptocurrencies,"Cryptojacking craze that drains your CPU now done by 2,500 sites",https://arstechnica.com/information-technology/2017/11/drive-by-cryptomining-that-drains-cpus-picks-up-steam-with-aid-of-2500-sites/
287,Lobsters,cryptocurrencies,Bitcoin and Cryptocurrencies,"The latest Ethereum Parity wallet disaster, play by play",https://davidgerard.co.uk/blockchain/2017/11/08/the-ethereum-parity-wallet-disaster-play-by-play/
288,Lobsters,cryptocurrencies,Bitcoin and Cryptocurrencies,Chia - eco-friendly Bitcoin competitor by BitTorrent inventor,https://eprint.iacr.org/2017/893.pdf
289,Lobsters,cryptocurrencies,Bitcoin and Cryptocurrencies,Segwit2x Bitcoin Fork Cancelled,https://lists.linuxfoundation.org/pipermail/bitcoin-segwit2x/2017-November/000685.html
290,Lobsters,cryptocurrencies,Bitcoin and Cryptocurrencies,Björkcoin: what’s behind Björk’s cryptocurrency album project,https://davidgerard.co.uk/blockchain/2017/11/07/bjorkcoin-whats-behind-bjorks-cryptocurrency-album-project/
291,Lobsters,cryptocurrencies,Bitcoin and Cryptocurrencies,Parity Wallet security alert,https://paritytech.io/blog/security-alert.html
292,Lobsters,cryptocurrencies,Bitcoin and Cryptocurrencies,Generalized State Channels on Ethereum,https://medium.com/l4-media/generalized-state-channels-on-ethereum-de0357f5fb44
293,Lobsters,cryptocurrencies,Bitcoin and Cryptocurrencies,"How to Build Your Own Blockchain Part 1 — Creating, Storing, Syncing, Displaying, Mining, and Proving Work",https://bigishdata.com/2017/10/17/write-your-own-blockchain-part-1-creating-storing-syncing-displaying-mining-and-proving-work/
294,Lobsters,cryptocurrencies,Bitcoin and Cryptocurrencies,Simplicity: A New Language for Blockchains,https://blockstream.com/simplicity.pdf
295,Lobsters,cryptocurrencies,Bitcoin and Cryptocurrencies,Ujo Music’s second attempt at music on the blockchain: EGO by RAC,https://davidgerard.co.uk/blockchain/2017/11/01/ujo-musics-second-attempt-at-music-on-the-blockchain-ego-by-rac/
296,Lobsters,cryptocurrencies,Bitcoin and Cryptocurrencies,A distinguisher for sha256 using bitcoin (mining faster along the way),https://sensepost.com/blog/2017/a-distinguisher-for-sha256-using-bitcoin-mining-faster-along-the-way/
297,Lobsters,cryptocurrencies,Bitcoin and Cryptocurrencies,"The Dilbert ICO: analysing Scott Adams’ crypto offering, WhenHub SAFT",https://davidgerard.co.uk/blockchain/2017/10/29/the-dilbert-ico-analysing-scott-adams-crypto-offering-whenhub-saft/
298,Lobsters,cryptocurrencies,Bitcoin and Cryptocurrencies,SpaceMint: a Cryptocurrency Based on Proofs of Space,https://eprint.iacr.org/2015/528.pdf
299,Lobsters,cryptocurrencies,Bitcoin and Cryptocurrencies,"Let’s Enhance! How we found @rogerkver’s $1,000 wallet obfuscated private key",https://medium.freecodecamp.org/lets-enhance-how-we-found-rogerkver-s-1000-wallet-obfuscated-private-key-8514e74a5433
300,Lobsters,cryptocurrencies,Bitcoin and Cryptocurrencies,Setup testnet Ethereum network with Docker,https://gist.github.com/fishbullet/4c36ecd6d6932adae24c68c8750894e6
301,Lobsters,cryptocurrencies,Bitcoin and Cryptocurrencies,Setup private Ethereum network with Docker,https://gist.github.com/fishbullet/04fcc4f7af90ee9fa6f9de0b0aa325ab
302,Lobsters,cryptocurrencies,Bitcoin and Cryptocurrencies,How to Create a Private Ethereum Blockchain from Ground-up,https://medium.facilelogin.com/build-your-own-blockchain-b8eaeea2f891
303,Lobsters,cryptocurrencies,Bitcoin and Cryptocurrencies,Everything You Wanted To Know About Blockchains,https://unwttng.com/what-is-a-blockchain
304,Lobsters,cryptocurrencies,Bitcoin and Cryptocurrencies,A Letter to Jamie Dimon,https://blog.chain.com/a-letter-to-jamie-dimon-de89d417cb80
305,Lobsters,cryptocurrencies,Bitcoin and Cryptocurrencies,The Russian “cryptoruble” story: what’s actually happening here,https://davidgerard.co.uk/blockchain/2017/10/16/the-russian-cryptoruble-story-whats-actually-happening-here/
306,Lobsters,cryptocurrencies,Bitcoin and Cryptocurrencies,Crossing Over to Web3 — An Introduction to Decentralised Development,https://blog.jaak.io/crossing-over-to-web3-an-introduction-to-decentralised-development-53de470da331
307,Lobsters,cryptocurrencies,Bitcoin and Cryptocurrencies,Satoshi was wrong,https://medium.com/@homakov/satoshi-was-wrong-cd06d2877128
308,Lobsters,cryptocurrencies,Bitcoin and Cryptocurrencies,"eBTC: not “Bitcoin on Ethereum,” just an ERC-20 token with a related name",https://davidgerard.co.uk/blockchain/2017/10/10/ebtc-not-bitcoin-on-ethereum-just-an-erc-20-token-with-a-related-name/
309,Lobsters,cryptocurrencies,Bitcoin and Cryptocurrencies,"Bitcoin Gold, a new Bitcoin full-history fork on the GPU; SegWit2x; Bitcoin core claims “Bitcoin” and “BTC” names",https://davidgerard.co.uk/blockchain/2017/10/06/bitcoin-gold-a-new-bitcoin-full-history-fork-on-the-gpu-bitcoin-core-claims-bitcoin-and-btc-names/
310,Lobsters,cryptocurrencies,Bitcoin and Cryptocurrencies,No Bitcoin-based protocol can handle more than 20M users per month,https://runeksvendsen.github.io/blog/posts/2017-10-08-no-bitcoin-based-protocol-can-handle-more-than-20m-users-per-month.html
311,Lobsters,cryptocurrencies,Bitcoin and Cryptocurrencies,BlockChain vs Event Driven Architecture,https://www.smalsresearch.be/blockchain-vs-event-driven-architecture/
312,Lobsters,cryptocurrencies,Bitcoin and Cryptocurrencies,"The EtherDelta hack: malicious JavaScript in a contract name, stealing the user’s private key",https://davidgerard.co.uk/blockchain/2017/09/28/etherdelta-hack-malicious-javascript-in-a-contract-name-stealing-the-users-key/
313,Lobsters,cryptocurrencies,Bitcoin and Cryptocurrencies,How one hacker stole thousands of dollars worth of cryptocurrency with a classic code injection…,https://hackernoon.com/how-one-hacker-stole-thousands-of-dollars-worth-of-cryptocurrency-with-a-classic-code-injection-a3aba5d2bff0
314,Lobsters,cryptocurrencies,Bitcoin and Cryptocurrencies,Bitcoin Energy Consumption Index,https://digiconomist.net/bitcoin-energy-consumption
315,Lobsters,cryptocurrencies,Bitcoin and Cryptocurrencies,Blockchain reader – tool to understand how data is stored in Bitcoin blockchain,http://srv1.yogh.io
316,Lobsters,cryptocurrencies,Bitcoin and Cryptocurrencies,Adding Ethereum Precompiled Contracts Without Hard Forks,https://zod.that.world/classic/5-nonfork-precompiled/
317,Lobsters,cryptocurrencies,Bitcoin and Cryptocurrencies,"Zero-knowledge proofs, Zcash, and Ethereum",https://decentralize.today/zero-knowledge-proofs-zcash-and-ethereum-f6d89fa7cba8
318,Lobsters,cryptocurrencies,Bitcoin and Cryptocurrencies,Bootstrapping Urbit from Ethereum,https://urbit.org/blog/2017.9-eth/
319,Lobsters,cryptocurrencies,Bitcoin and Cryptocurrencies,Cracking MtGox,https://www.youtube.com/watch?v=l70iRcSxqzo
320,Lobsters,cryptocurrencies,Bitcoin and Cryptocurrencies,A Prehistory of the Ethereum Protocol,http://vitalik.ca/general/2017/09/14/prehistory.html
321,Lobsters,cryptocurrencies,Bitcoin and Cryptocurrencies,China to close all bitcoin exchanges by end-September,https://www.reuters.com/article/us-china-bitcoin-ban/china-to-close-all-bitcoin-exchanges-by-end-september-yicai-idUSKCN1BP27C
322,Lobsters,cryptocurrencies,Bitcoin and Cryptocurrencies,"How I Snatched 153,037 ETH After A Bad Tinder Date",https://medium.com/@rtaylor30/how-i-snatched-your-153-037-eth-after-a-bad-tinder-date-d1d84422a50b
323,Lobsters,cryptocurrencies,Bitcoin and Cryptocurrencies,The Michelson Language: A contract a day,https://www.michelson-lang.com/
324,Lobsters,cryptocurrencies,Bitcoin and Cryptocurrencies,A self-amending cryptographic ledger built in OCaml,https://git.io/v5iiy
325,Lobsters,cryptocurrencies,Bitcoin and Cryptocurrencies,Building Blockchain in Go,https://jeiwan.cc/posts/building-blockchain-in-go-part-1/
326,Lobsters,cryptocurrencies,Bitcoin and Cryptocurrencies,How to trace ransomware payments end-to-end,https://www.elie.net/blog/security/how-to-trace-ransomware-payments-end-to-end
327,Lobsters,cryptocurrencies,Bitcoin and Cryptocurrencies,Burger King launches WhopperCoin crypto-cash in Russia,http://www.bbc.com/news/technology-41082388
328,Lobsters,cryptocurrencies,Bitcoin and Cryptocurrencies,"Blockchains, Determinism, Monads, Agents and Functional Reactive Programming",https://thomasbarker.com/16/03/blockchains-determinism-monads-agents-and-functional-reactive-programming
329,Lobsters,cryptocurrencies,Bitcoin and Cryptocurrencies,When the cookie meets the blockchain: Privacy risks of web payments via cryptocurrencies,https://arxiv.org/pdf/1708.04748.pdf
330,Lobsters,cryptocurrencies,Bitcoin and Cryptocurrencies,BasicAttentionToken: Blockchain-based digital advertising,https://basicattentiontoken.org
331,Lobsters,cryptocurrencies,Bitcoin and Cryptocurrencies,China’s two biggest bitcoin exchanges helped themselves to $150 million in idle client funds,https://qz.com/1059179/huobi-and-okcoin-chinas-two-biggest-bitcoin-btc-exchanges-were-themselves-to-150-million-in-idle-client-funds/
332,Lobsters,cryptocurrencies,Bitcoin and Cryptocurrencies,Analyzing Cryptocurrency Markets Using Python,https://blog.patricktriest.com/analyzing-cryptocurrencies-python/
333,Lobsters,cryptocurrencies,Bitcoin and Cryptocurrencies,Tinychain - a pocket-sized implementation of Bitcoin,https://github.com/jamesob/tinychain
334,Lobsters,cryptocurrencies,Bitcoin and Cryptocurrencies,The curious Tale Of Tethers,https://medium.com/@bitfinexed/the-curious-tale-of-tethers-6b0031eead87
335,Lobsters,cryptocurrencies,Bitcoin and Cryptocurrencies,Meet ‘Spoofy’: How a Single entity dominates the price of Bitcoin,https://medium.com/@bitfinexed/meet-spoofy-how-a-single-entity-dominates-the-price-of-bitcoin-39c711d28eb4
336,Lobsters,cryptocurrencies,Bitcoin and Cryptocurrencies,Bitcoin Exchange Had Too Many Bitcoins,https://www.bloomberg.com/view/articles/2017-08-02/bitcoin-exchange-had-too-many-bitcoins
337,Lobsters,cryptocurrencies,Bitcoin and Cryptocurrencies,Before and After — the Great Bitcoin Fork,https://blog.bridge21.io/before-and-after-the-great-bitcoin-fork-17d2aad5d512
338,Lobsters,cryptocurrencies,Bitcoin and Cryptocurrencies,Photos: Life inside of China’s massive and remote bitcoin mines,https://qz.com/1026605/photos-chinas-bitcoin-mines-and-miners/
339,Lobsters,cryptocurrencies,Bitcoin and Cryptocurrencies,"Hidden surprises in the Bitcoin blockchain and how they are stored: Nelson Mandela, Wikileaks, photos, and Python software",http://www.righto.com/2014/02/ascii-bernanke-wikileaks-photographs.html
340,Lobsters,cryptocurrencies,Bitcoin and Cryptocurrencies,Big List of Bitcoin Exchanges,http://coinnav.com/bitcoin/exchanges/comparison
341,Lobsters,cryptocurrencies,Bitcoin and Cryptocurrencies,Boobies on the Blockchain [a practical experiment] (~NSFW),https://boobies.surge.sh/
342,Lobsters,cryptocurrencies,Bitcoin and Cryptocurrencies,Timeline Of The ChainCoin Scam - Massive Cryptocurrency Pump And Dump Scheme,https://storeofvalue.github.io/posts/timeline-of-the-chaincoin-scam/
343,Lobsters,cryptocurrencies,Bitcoin and Cryptocurrencies,"FinCEN Fines BTC-e $110 Million for Facilitating Ransomware, Dark Net Drug Sales",https://www.fincen.gov/news/news-releases/fincen-fines-btc-e-virtual-currency-exchange-110-million-facilitating-ransomware
344,Lobsters,cryptocurrencies,Bitcoin and Cryptocurrencies,"SEC Issues Investigative Report Concluding DAO Tokens, a Digital Asset, Were Securities",https://www.sec.gov/news/press-release/2017-131
345,Lobsters,cryptocurrencies,Bitcoin and Cryptocurrencies,Querying the Ethereum Blockchain with SQL on Presto,https://github.com/xiaoyao1991/presto-ethereum
346,Lobsters,cryptocurrencies,Bitcoin and Cryptocurrencies,A hacker stole $31M of Ether—how it happened and what it means for Ethereum,http://haseebq.com/a-hacker-stole-31m-of-ether/
347,Lobsters,cryptocurrencies,Bitcoin and Cryptocurrencies,"AlphaBay, the Largest Online 'Dark Market,' Shut Down",https://www.justice.gov/opa/pr/alphabay-largest-online-dark-market-shut-down
348,Lobsters,cryptocurrencies,Bitcoin and Cryptocurrencies,Bitcoin Transaction Malleability,https://eklitzke.org/bitcoin-transaction-malleability
349,Lobsters,cryptocurrencies,Bitcoin and Cryptocurrencies,"After AlphaBay’s Demise, Customers Flocked to Dark Market Run by Dutch Police",https://krebsonsecurity.com/2017/07/after-alphabays-demise-customers-flocked-to-dark-market-run-by-dutch-police/
350,Lobsters,cryptocurrencies,Bitcoin and Cryptocurrencies,Bitcoin Fork Monitor,https://www.btcforkmonitor.info/
351,Lobsters,cryptocurrencies,Bitcoin and Cryptocurrencies,Tor AlphaBay Black Market Busted,http://gizmodo.com/the-biggest-marketplace-on-the-dark-web-gets-busted-by-1796905547
352,Lobsters,cryptocurrencies,Bitcoin and Cryptocurrencies,Bitcoin Is Having a Civil War Right as It Enters a Critical Month,https://www.bloomberg.com/news/articles/2017-07-10/bitcoin-risks-splintering-as-civil-war-enters-critical-month
353,Lobsters,cryptocurrencies,Bitcoin and Cryptocurrencies,Romeo & Juliet meet Trademark Law,http://250bpm.com/blog:96
354,Lobsters,cryptocurrencies,Bitcoin and Cryptocurrencies,"The Crazy Security Behind the Birth of Zcash, the Inside Story",http://spectrum.ieee.org/tech-talk/computing/networks/the-crazy-security-behind-the-birth-of-zcash
355,Lobsters,cryptocurrencies,Bitcoin and Cryptocurrencies,The Ceremony,http://www.radiolab.org/story/ceremony/
356,Lobsters,cryptocurrencies,Bitcoin and Cryptocurrencies,Bitcoin - potential network disruption - chain split,https://bitcoin.org/en/alert/2017-07-12-potential-split
357,Lobsters,cryptocurrencies,Bitcoin and Cryptocurrencies,Romeo & Juliet meet Reputation Engineering,http://250bpm.com/blog:94
358,Lobsters,cryptocurrencies,Bitcoin and Cryptocurrencies,Catena: an SQL database on top of a blockchain,https://github.com/pixelspark/catena
359,Lobsters,cryptocurrencies,Bitcoin and Cryptocurrencies,"Analyzing Ethereum, Bitcoin, and 1200+ other Cryptocurrencies using PostgreSQL",https://blog.timescale.com/analyzing-ethereum-bitcoin-and-1200-cryptocurrencies-using-postgresql-3958b3662e51
360,Lobsters,cryptocurrencies,Bitcoin and Cryptocurrencies,Head to Head: Siacoin & Storj,https://cryptocanucks.com/head-to-head-siacoin-vs-storj/
361,Lobsters,cryptocurrencies,Bitcoin and Cryptocurrencies,Solving the Romeo and Juliet Problem,http://250bpm.com/blog:92
362,Lobsters,cryptocurrencies,Bitcoin and Cryptocurrencies,Bitcoin mining on a vintage Xerox Alto: very slow at 1.5 hashes/second,http://www.righto.com/2017/07/bitcoin-mining-on-vintage-xerox-alto.html
363,Lobsters,cryptocurrencies,Bitcoin and Cryptocurrencies,hard facts about shitcoins,http://www.tedunangst.com/flak/post/hard-facts-about-shitcoins
364,Lobsters,cryptocurrencies,Bitcoin and Cryptocurrencies,"On Blockchain, Intermediaries, and Hype",http://www.zkorman.com/blockchain.html
365,Lobsters,cryptocurrencies,Bitcoin and Cryptocurrencies,Choosing ASICs for Sia,https://blog.sia.tech/choosing-asics-for-sia-b318505b5b51
366,Lobsters,cryptocurrencies,Bitcoin and Cryptocurrencies,Here’s How Traders Lost Millions in the First Ethereum Flash Crash,https://motherboard.vice.com/en_us/article/mbjyk4/heres-how-traders-lost-millions-in-the-first-ethereum-flash-crash
367,Lobsters,cryptocurrencies,Bitcoin and Cryptocurrencies,OpenZeppelin: a framework to build secure smart contracts,https://openzeppelin.org/
368,Lobsters,cryptocurrencies,Bitcoin and Cryptocurrencies,The Tor of Money,https://medium.com/@hudon/the-tor-of-money-5cedb4894f05
369,Lobsters,cryptocurrencies,Bitcoin and Cryptocurrencies,How I Stole Your Siacoin,https://mtlynch.io/stole-siacoins/
370,Lobsters,cryptocurrencies,Bitcoin and Cryptocurrencies,FreeWallet.org Steals Millions in Ethereum,https://www.reddit.com/r/CryptoCurrency/comments/6gtrmd/freewalletorg_scam_millions_stolen/
371,Lobsters,cryptocurrencies,Bitcoin and Cryptocurrencies,How To Learn Solidity: The Ultimate Ethereum Coding Guide,https://blockgeeks.com/guides/how-to-learn-solidity/
372,Lobsters,cryptocurrencies,Bitcoin and Cryptocurrencies,There's a new way for casual investors to get in on the cryptocurrency craze,http://www.cnbc.com/2017/06/04/bitcoin-and-ethereum-rallies-have-led-to-funds-like-for-storj-ico.html
373,Lobsters,cryptocurrencies,Bitcoin and Cryptocurrencies,Cryptoeconomics 101,https://thecontrol.co/cryptoeconomics-101-e5c883e9a8ff
374,Lobsters,cryptocurrencies,Bitcoin and Cryptocurrencies,"Dissecting Ponzi schemes on Ethereum: identification, analysis, and impact",https://arxiv.org/abs/1703.03779
375,Lobsters,cryptocurrencies,Bitcoin and Cryptocurrencies,How to lose $8k worth of bitcoin in 15 minutes with Verizon and Coinbase.com,https://medium.com/@CodyBrown/how-to-lose-8k-worth-of-bitcoin-in-15-minutes-with-verizon-and-coinbase-com-ba75fb8d0bac
376,Lobsters,cryptocurrencies,Bitcoin and Cryptocurrencies,"Tulips, Myths, and Cryptocurrencies",https://stratechery.com/2017/tulips-myths-and-cryptocurrencies/
377,Lobsters,cryptocurrencies,Bitcoin and Cryptocurrencies,Shedding some light on the recent fatal flaws and vulnerabilities in CryptoNote-based currencies,https://bytecoin.org/news/bytecoin-2.0.2-software-update/
378,Lobsters,cryptocurrencies,Bitcoin and Cryptocurrencies,Why Brainwallets are great for cryptocurrency,https://medium.com/@homakov/why-brainwallet-are-great-for-cryptocurrency-ff73dd65ecd9
379,Lobsters,cryptocurrencies,Bitcoin and Cryptocurrencies,Filecoin,http://filecoin.io/
380,Lobsters,cryptocurrencies,Bitcoin and Cryptocurrencies,Monero: Disclosure of a Major Bug in CryptoNote Based Currencies,https://getmonero.org/2017/05/17/disclosure-of-a-major-bug-in-cryptonote-based-currencies.html
381,Lobsters,cryptocurrencies,Bitcoin and Cryptocurrencies,PonzICO: Let’s Just Cut to the Chase,https://ponzico.win/ponzico.pdf
382,Lobsters,cryptocurrencies,Bitcoin and Cryptocurrencies,I Don’t Believe in Blockchain,https://www.tbray.org/ongoing/When/201x/2017/05/13/Not-Believing-in-Blockchain
383,Lobsters,cryptocurrencies,Bitcoin and Cryptocurrencies,"Dogetipbot's Author Steals All Funds, Shuts Down",https://gizmodo.com/reddit-users-lose-real-money-after-meme-currency-bot-di-1795125165
384,Lobsters,cryptocurrencies,Bitcoin and Cryptocurrencies,Cryptocurrencies On the New Social Network Mastodon,https://carlchenet.com/cryptocurrencies-on-the-new-social-network-mastodon/
385,Lobsters,cryptocurrencies,Bitcoin and Cryptocurrencies,Bitcoin's Energy Consumption Is Unsustainable (2015),https://motherboard.vice.com/en_us/article/bitcoin-is-unsustainable
386,Lobsters,cryptocurrencies,Bitcoin and Cryptocurrencies,Antbleed - Exposing the malicious backdoor on Antminer,http://www.antbleed.com/
387,Lobsters,cryptocurrencies,Bitcoin and Cryptocurrencies,An Empirical Analysis of Linkability in the Monero Blockchain,https://ipfs.io/ipfs/QmWYTeggKeL8xBitA8uQWAaNDWfFrUHXAxBXkvmnisdDw7
388,Lobsters,cryptocurrencies,Bitcoin and Cryptocurrencies,Zcash - Security Announcement 2017-04-12,https://z.cash/blog/security-announcement-2017-04-12.html
389,Lobsters,cryptocurrencies,Bitcoin and Cryptocurrencies,"What Initial Coin Offerings Are, and Why VC Firms Care",https://hbr.org/2017/03/what-initial-coin-offerings-are-and-why-vc-firms-care
390,Lobsters,cryptocurrencies,Bitcoin and Cryptocurrencies,On the emerging consensus regarding Bitcoin’s block size limit: insights from my visit with…,https://medium.com/@peter_r/on-the-emerging-consensus-regarding-bitcoins-block-size-limit-insights-from-my-visit-with-2348878a16d8
391,Lobsters,cryptocurrencies,Bitcoin and Cryptocurrencies,LBRY - Content Freedom,https://lbry.io/
392,Lobsters,cryptocurrencies,Bitcoin and Cryptocurrencies,Bitcoin Unlimited,https://www.bitcoinunlimited.info/
393,Lobsters,cryptocurrencies,Bitcoin and Cryptocurrencies,Keybase is now writing to the Bitcoin blockchain,https://keybase.io/docs/server_security/merkle_root_in_bitcoin_blockchain
394,Lobsters,cryptocurrencies,Bitcoin and Cryptocurrencies,Bitcoin ETF disapproved by SEC,https://www.sec.gov/rules/sro/batsbzx/2017/34-80206.pdf
395,Lobsters,cryptocurrencies,Bitcoin and Cryptocurrencies,Is the Zcoin bug in CheckTransaction() validation code?,https://makebitcoingreatagain.wordpress.com/2017/02/18/is-the-zcoin-bug-in-checktransaction/
396,Lobsters,cryptocurrencies,Bitcoin and Cryptocurrencies,A blockchain in 200 lines of code,https://medium.com/@lhartikk/a-blockchain-in-200-lines-of-code-963cc1cc0e54
397,Lobsters,cryptocurrencies,Bitcoin and Cryptocurrencies,Round error issue -> produce money for free,https://hackerone.com/reports/176461
398,Lobsters,cryptocurrencies,Bitcoin and Cryptocurrencies,"R3 Admits Defeat, Stops Blockchain Development",https://themerkle.com/r3-admits-defeat-stops-blockchain-development/
399,Lobsters,cryptocurrencies,Bitcoin and Cryptocurrencies,Tezos: A self-amending cryptographic ledger,https://github.com/tezos/tezos
400,Lobsters,cryptocurrencies,Bitcoin and Cryptocurrencies,A fistful of Bitcoins: Characterizing payments among men with no names,https://blog.acolyer.org/2017/02/20/a-fistful-of-bitcoins-characterizing-payments-among-men-with-no-names/
401,Lobsters,cryptocurrencies,Bitcoin and Cryptocurrencies,DDoSCoin: Cryptocurrency with a Malicious Proof-of-Work,https://www.usenix.org/system/files/conference/woot16/woot16-paper-wustrow.pdf
402,Lobsters,cryptocurrencies,Bitcoin and Cryptocurrencies,Important Announcement: Zerocoin implementation bug,https://zcoin.io/language/en/important-announcement-zerocoin-implementation-bug/
403,Lobsters,cryptocurrencies,Bitcoin and Cryptocurrencies,Trust: the inside story of the rise and fall of Ethereum,https://aeon.co/essays/trust-the-inside-story-of-the-rise-and-fall-of-ethereum
404,Lobsters,cryptocurrencies,Bitcoin and Cryptocurrencies,Precautions for generating Bitcoin QR codes,http://incoherency.co.uk/blog/stories/bitcoin-qr-code-precautions.html
405,Lobsters,cryptocurrencies,Bitcoin and Cryptocurrencies,Blockchain Gang,http://www.npr.org/sections/money/2017/02/10/514577243/episode-753-blockchain-gang
406,Lobsters,cryptocurrencies,Bitcoin and Cryptocurrencies,Buzz Factor or Innovation Potential: What Explains Cryptocurrencies’ Returns?,http://journals.plos.org/plosone/article?id=10.1371/journal.pone.0169556
407,Lobsters,cryptocurrencies,Bitcoin and Cryptocurrencies,CONIKS vs Key Transparency vs Certificate Transparency vs Blockchains,https://blog.okturtles.com/2017/02/coniks-vs-key-transparency-vs-certificate-transparency-vs-blockchains/
408,Lobsters,cryptocurrencies,Bitcoin and Cryptocurrencies,Hackers Have Stolen Millions Of Dollars In Bitcoin -- Using Only Phone Numbers,http://www.forbes.com/sites/laurashin/2016/12/20/hackers-have-stolen-millions-of-dollars-in-bitcoin-using-only-phone-numbers/
409,Lobsters,cryptocurrencies,Bitcoin and Cryptocurrencies,Blockchain Demo,https://anders.com/blockchain/
410,Lobsters,cryptocurrencies,Bitcoin and Cryptocurrencies,"Bitcoin, Blockchain and the design elements explained",https://techtake.info/2016/12/18/bitcoin-blockchain-and-the-design-elements-explained/
411,Lobsters,cryptocurrencies,Bitcoin and Cryptocurrencies,Votebook – A proposal for a blockchain-based electronic voting system [pdf],http://www.economist.com/sites/default/files/nyu.pdf
412,Lobsters,cryptocurrencies,Bitcoin and Cryptocurrencies,A Provably Secure Proof-of-Stake Blockchain Protocol,https://github.com/input-output-hk/pos-haskell-prototype
413,Lobsters,cryptocurrencies,Bitcoin and Cryptocurrencies,What is Bitcoin? A Step-By-Step Guide For Beginners,http://blockgeeks.com/guides/what-is-bitcoin-a-step-by-step-guide/
