ID,Source,Tag_Code,Tag_Name,Title,Url
1,Lobsters,cryptocurrencies,Bitcoin and Cryptocurrencies,<wbr>BlockchainCommons/Learning-Bit<wbr>coin-from-the-Command-Line</wbr></wbr>,https://github.com/BlockchainCommons/Learning-Bitcoin-from-the-Command-Line
2,Lobsters,cryptocurrencies,Bitcoin and Cryptocurrencies,Bitcoin From Scratch - Part 1,https://monokh.com/posts/bitcoin-from-scratch-part-1
3,Lobsters,cryptocurrencies,Bitcoin and Cryptocurrencies,Docker Images Containing Cryptojacking Malware Distributed via Docker Hub,https://thehackernews.com/2020/06/cryptocurrency-docker-image.html
4,Lobsters,cryptocurrencies,Bitcoin and Cryptocurrencies,Malware on the blockchain,https://www.exablue.de/en/blog/2020-06-11-malware-on-the-blockchain.html
5,Lobsters,cryptocurrencies,Bitcoin and Cryptocurrencies,SAFE Network,https://safenetwork.tech/
6,Lobsters,cryptocurrencies,Bitcoin and Cryptocurrencies,Reddit Rolls Out 'Community Points' on Ethereum to Incentivize Positive Behavior,https://www.coindesk.com/reddit-rolls-out-community-points-on-ethereum-to-incentivize-positive-behavior
7,Lobsters,cryptocurrencies,Bitcoin and Cryptocurrencies,Authentication and Payments with Lightning,https://lightning.engineering/posts/2020-03-30-lsat/
8,Lobsters,cryptocurrencies,Bitcoin and Cryptocurrencies,Decoding Bitcoin Messages with Tokio Codecs,https://www.zfnd.org/blog/decoding-bitcoin-messages-with-tokio-codecs/
9,Lobsters,cryptocurrencies,Bitcoin and Cryptocurrencies,Using the NFC chip of the Passport to do Proof-of-Work,https://medium.com/@janmoritz_48488/using-the-nfc-chip-of-the-passport-to-do-proof-of-work-b77e1a5343a1
10,Lobsters,cryptocurrencies,Bitcoin and Cryptocurrencies,"The dForce and Hegic DeFi exploits, and why Smart Contracts are bad",https://davidgerard.co.uk/blockchain/2020/04/26/the-dforce-and-hegic-defi-exploits-and-why-smart-contracts-are-bad/
11,Lobsters,cryptocurrencies,Bitcoin and Cryptocurrencies,How we recovered over $300K of Bitcoin,https://reperiendi.wordpress.com/2020/04/03/how-i-recovered-over-300k-of-bitcoin/
12,Lobsters,cryptocurrencies,Bitcoin and Cryptocurrencies,Any lobsters attending MIT Bitcoin Expo 2020?,https://mitbitcoinexpo.org/
13,Lobsters,cryptocurrencies,Bitcoin and Cryptocurrencies,"The Brave browser is brilliant, but probably not for the reasons you think",https://rudism.com/the-brave-browser-is-brilliant/
14,Lobsters,cryptocurrencies,Bitcoin and Cryptocurrencies,"The Baseline Protocol — your private business, on the public Ethereum blockchain. Why on earth?",https://davidgerard.co.uk/blockchain/2020/03/05/the-baseline-protocol-your-private-business-on-the-public-ethereum-blockchain-why-on-earth/
15,Lobsters,cryptocurrencies,Bitcoin and Cryptocurrencies,"Flashloans, The Crazy New Invention of Magic Internet Money",https://www.trustnodes.com/2020/02/15/flashloans-the-crazy-new-invention-of-magic-internet-money
16,Lobsters,cryptocurrencies,Bitcoin and Cryptocurrencies,Kraken Identifies Critical Flaw in Trezor Hardware Wallets,https://blog.kraken.com/post/3662/kraken-identifies-critical-flaw-in-trezor-hardware-wallets/
17,Lobsters,cryptocurrencies,Bitcoin and Cryptocurrencies,Forecasting time series with a seq2seq RNN in TensorFlow,https://github.com/guillaume-chevalier/seq2seq-signal-prediction
18,Lobsters,cryptocurrencies,Bitcoin and Cryptocurrencies,The Bitcoin Piñata - no candy for you,https://hannes.nqsb.io/Posts/Pinata
19,Lobsters,cryptocurrencies,Bitcoin and Cryptocurrencies,The cowardice of Brave,https://practicaltypography.com/the-cowardice-of-brave.html
20,Lobsters,cryptocurrencies,Bitcoin and Cryptocurrencies,Cryptocurrency Is Most Useful for Breaking Laws and Social Constructs,https://www.coindesk.com/cryptocurrency-is-most-useful-for-breaking-laws-and-social-constructs
21,Lobsters,cryptocurrencies,Bitcoin and Cryptocurrencies,Hard Problems in Cryptocurrency: Five Years Later,https://vitalik.ca/general/2019/11/22/progress.html
22,Lobsters,cryptocurrencies,Bitcoin and Cryptocurrencies,Global Protests Reveal Bitcoin's Limitations,https://www.coindesk.com/global-protests-reveal-bitcoins-limitations
23,Lobsters,cryptocurrencies,Bitcoin and Cryptocurrencies,96% of Grin transactions de-anonymized in real time,https://medium.com/dragonfly-research/breaking-mimblewimble-privacy-model-84bcd67bfe52
24,Lobsters,cryptocurrencies,Bitcoin and Cryptocurrencies,Scilla: A Safe-By-Design Smart Contract Language,https://scilla-lang.org/
25,Lobsters,cryptocurrencies,Bitcoin and Cryptocurrencies,Facebook’s Libra Is Half A Century Late And A Navy Short,https://palladiummag.com/2019/11/13/facebooks-libra-is-half-a-century-late-and-a-navy-short/
26,Lobsters,cryptocurrencies,Bitcoin and Cryptocurrencies,<wbr>BlockchainCommons/Learning-Bit<wbr>coin-from-the-Command-Line</wbr></wbr>,https://github.com/BlockchainCommons/Learning-Bitcoin-from-the-Command-Line
27,Lobsters,cryptocurrencies,Bitcoin and Cryptocurrencies,Bitcoin From Scratch - Part 1,https://monokh.com/posts/bitcoin-from-scratch-part-1
28,Lobsters,cryptocurrencies,Bitcoin and Cryptocurrencies,Docker Images Containing Cryptojacking Malware Distributed via Docker Hub,https://thehackernews.com/2020/06/cryptocurrency-docker-image.html
29,Lobsters,cryptocurrencies,Bitcoin and Cryptocurrencies,Malware on the blockchain,https://www.exablue.de/en/blog/2020-06-11-malware-on-the-blockchain.html
30,Lobsters,cryptocurrencies,Bitcoin and Cryptocurrencies,SAFE Network,https://safenetwork.tech/
31,Lobsters,cryptocurrencies,Bitcoin and Cryptocurrencies,Reddit Rolls Out 'Community Points' on Ethereum to Incentivize Positive Behavior,https://www.coindesk.com/reddit-rolls-out-community-points-on-ethereum-to-incentivize-positive-behavior
32,Lobsters,cryptocurrencies,Bitcoin and Cryptocurrencies,Authentication and Payments with Lightning,https://lightning.engineering/posts/2020-03-30-lsat/
33,Lobsters,cryptocurrencies,Bitcoin and Cryptocurrencies,Decoding Bitcoin Messages with Tokio Codecs,https://www.zfnd.org/blog/decoding-bitcoin-messages-with-tokio-codecs/
34,Lobsters,cryptocurrencies,Bitcoin and Cryptocurrencies,Using the NFC chip of the Passport to do Proof-of-Work,https://medium.com/@janmoritz_48488/using-the-nfc-chip-of-the-passport-to-do-proof-of-work-b77e1a5343a1
35,Lobsters,cryptocurrencies,Bitcoin and Cryptocurrencies,"The dForce and Hegic DeFi exploits, and why Smart Contracts are bad",https://davidgerard.co.uk/blockchain/2020/04/26/the-dforce-and-hegic-defi-exploits-and-why-smart-contracts-are-bad/
36,Lobsters,cryptocurrencies,Bitcoin and Cryptocurrencies,How we recovered over $300K of Bitcoin,https://reperiendi.wordpress.com/2020/04/03/how-i-recovered-over-300k-of-bitcoin/
37,Lobsters,cryptocurrencies,Bitcoin and Cryptocurrencies,Any lobsters attending MIT Bitcoin Expo 2020?,https://mitbitcoinexpo.org/
38,Lobsters,cryptocurrencies,Bitcoin and Cryptocurrencies,"The Brave browser is brilliant, but probably not for the reasons you think",https://rudism.com/the-brave-browser-is-brilliant/
39,Lobsters,cryptocurrencies,Bitcoin and Cryptocurrencies,"The Baseline Protocol — your private business, on the public Ethereum blockchain. Why on earth?",https://davidgerard.co.uk/blockchain/2020/03/05/the-baseline-protocol-your-private-business-on-the-public-ethereum-blockchain-why-on-earth/
40,Lobsters,cryptocurrencies,Bitcoin and Cryptocurrencies,"Flashloans, The Crazy New Invention of Magic Internet Money",https://www.trustnodes.com/2020/02/15/flashloans-the-crazy-new-invention-of-magic-internet-money
41,Lobsters,cryptocurrencies,Bitcoin and Cryptocurrencies,Kraken Identifies Critical Flaw in Trezor Hardware Wallets,https://blog.kraken.com/post/3662/kraken-identifies-critical-flaw-in-trezor-hardware-wallets/
42,Lobsters,cryptocurrencies,Bitcoin and Cryptocurrencies,Forecasting time series with a seq2seq RNN in TensorFlow,https://github.com/guillaume-chevalier/seq2seq-signal-prediction
43,Lobsters,cryptocurrencies,Bitcoin and Cryptocurrencies,The Bitcoin Piñata - no candy for you,https://hannes.nqsb.io/Posts/Pinata
44,Lobsters,cryptocurrencies,Bitcoin and Cryptocurrencies,The cowardice of Brave,https://practicaltypography.com/the-cowardice-of-brave.html
45,Lobsters,cryptocurrencies,Bitcoin and Cryptocurrencies,Cryptocurrency Is Most Useful for Breaking Laws and Social Constructs,https://www.coindesk.com/cryptocurrency-is-most-useful-for-breaking-laws-and-social-constructs
46,Lobsters,cryptocurrencies,Bitcoin and Cryptocurrencies,Hard Problems in Cryptocurrency: Five Years Later,https://vitalik.ca/general/2019/11/22/progress.html
47,Lobsters,cryptocurrencies,Bitcoin and Cryptocurrencies,Global Protests Reveal Bitcoin's Limitations,https://www.coindesk.com/global-protests-reveal-bitcoins-limitations
48,Lobsters,cryptocurrencies,Bitcoin and Cryptocurrencies,96% of Grin transactions de-anonymized in real time,https://medium.com/dragonfly-research/breaking-mimblewimble-privacy-model-84bcd67bfe52
49,Lobsters,cryptocurrencies,Bitcoin and Cryptocurrencies,Scilla: A Safe-By-Design Smart Contract Language,https://scilla-lang.org/
50,Lobsters,cryptocurrencies,Bitcoin and Cryptocurrencies,Facebook’s Libra Is Half A Century Late And A Navy Short,https://palladiummag.com/2019/11/13/facebooks-libra-is-half-a-century-late-and-a-navy-short/
51,Lobsters,cryptocurrencies,Bitcoin and Cryptocurrencies,The Ultimate Guide to ENS Names,https://medium.com/@eric.conner/the-ultimate-guide-to-ens-names-aa541586067a
52,Lobsters,cryptocurrencies,Bitcoin and Cryptocurrencies,Facebook Libra is Architecturally Unsound,http://www.stephendiehl.com/posts/libra.html
53,Lobsters,cryptocurrencies,Bitcoin and Cryptocurrencies,"The Trillion Dollar Lawsuit, Part One",https://danco.substack.com/p/the-trillion-dollar-lawsuit-part
54,Lobsters,cryptocurrencies,Bitcoin and Cryptocurrencies,Why a decentralized Blockchain Platform is the only Sustainable Answer to the Meetup.com Price Hike,https://www.parity.io/gather-why-a-decentralized-blockchain-platform-is-the-only-sustainable-answer-to-the-meetup-com-pricing-hike/
55,Lobsters,cryptocurrencies,Bitcoin and Cryptocurrencies,Privately Buying a Domain Name with Zcash,https://medium.com/@michael.harms6010/privately-buying-a-domain-with-zec-d321401946f1
56,Lobsters,cryptocurrencies,Bitcoin and Cryptocurrencies,Blockchains Are a Bad Idea,https://www.youtube.com/watch?v=15RTC22Z2xI
57,Lobsters,cryptocurrencies,Bitcoin and Cryptocurrencies,Keybase iOS Has A Backdoor,https://sneak.berlin/20190929/keybase-backdoor/
58,Lobsters,cryptocurrencies,Bitcoin and Cryptocurrencies,Prototyping a Coda Blockchain Explorer,https://medium.com/@_garethtdavies/prototyping-a-coda-blockchain-explorer-dbe5c12b4ae2
59,Lobsters,cryptocurrencies,Bitcoin and Cryptocurrencies,"Keybase Stellar Space Drop, 2 Billion Lumens for the World",https://keybase.io/a/i/r/d/r/o/p/spacedrop2019
60,Lobsters,cryptocurrencies,Bitcoin and Cryptocurrencies,"Mining Bitcoin on an Apple II, a highly impractical guide",https://retroconnector.com/mining-bitcoin-on-an-apple-ii-a-highly-impractical-guide/
61,Lobsters,cryptocurrencies,Bitcoin and Cryptocurrencies,Zcash Protocol-Level Denial-of-Service,https://saplingwoodchipper.github.io/
62,Lobsters,cryptocurrencies,Bitcoin and Cryptocurrencies,Overview of What’s New in Ethereum 2.0,https://medium.com/@indreklasn/overview-of-whats-new-in-ethereum-2-0-cdf902e0220d
63,Lobsters,cryptocurrencies,Bitcoin and Cryptocurrencies,"IBM, MIT and Elliptic release world’s largest labeled dataset of bitcoin transactions",https://decrypt.co/8189/ibm-mit-and-elliptic-release-worlds-largest-labeled-dataset-of-bitcoin-transactions
64,Lobsters,cryptocurrencies,Bitcoin and Cryptocurrencies,Understand and Model Cryptocurrencies Volatility Using GARCH Variants,https://0xboz.github.io/blog/understand-and-model-cryptocurrencies-volatility-using-garch-variants/
65,Lobsters,cryptocurrencies,Bitcoin and Cryptocurrencies,Buying tea with WeChat Pay in a dystopian future,https://salibra.com/p/buying-tea-with-wechat-pay-d3931febd2be
66,Lobsters,cryptocurrencies,Bitcoin and Cryptocurrencies,Hyperledger Fabric,https://www.hyperledger.org/projects/fabric
67,Lobsters,cryptocurrencies,Bitcoin and Cryptocurrencies,Using React Hooks to Wrap Connectors to Live Data Sources,https://medium.com/perlin-network/using-react-hooks-to-wrap-connectors-to-live-data-sources-3d97a934a38f
68,Lobsters,cryptocurrencies,Bitcoin and Cryptocurrencies,lndmon: Dockerized Lightning Network Monitoring,https://blog.lightning.engineering/posts/2019/07/24/lndmon-v0.1.html
69,Lobsters,cryptocurrencies,Bitcoin and Cryptocurrencies,Rhythm Dungeon: A Blockchain-based Music Roguelike Game,https://arxiv.org/abs/1907.00042
70,Lobsters,cryptocurrencies,Bitcoin and Cryptocurrencies,Why was the Rust language chosen? (Congressional Hearing on Facebook Digital Currency),https://www.c-span.org/video/?c4808083/rust-language-chosen
71,Lobsters,cryptocurrencies,Bitcoin and Cryptocurrencies,Meet Sia: the most viable non-financial application of blockchain technology,https://blog.sia.tech/meet-sia-the-most-viable-non-financial-application-of-blockchain-technology-afe6e7412a25
72,Lobsters,cryptocurrencies,Bitcoin and Cryptocurrencies,"The 0x vulnerability, explained",https://samczsun.com/the-0x-vulnerability-explained/
73,Lobsters,cryptocurrencies,Bitcoin and Cryptocurrencies,A physicist’s journey into cracking the bitcoin,https://hackernoon.com/a-physicists-journey-into-cracking-bitcoin-4631e57158cc
74,Lobsters,cryptocurrencies,Bitcoin and Cryptocurrencies,Ethereum in practice: a durable medium for tender offers,https://blog.softwaremill.com/ethereum-in-practice-a-durable-medium-for-tender-offers-5ca5aa81ab9f
75,Lobsters,cryptocurrencies,Bitcoin and Cryptocurrencies,Blockchain visualization in 3D,https://symphony.iohk.io/
76,Lobsters,cryptocurrencies,Bitcoin and Cryptocurrencies,Bitcoin mining on an Apollo Guidance Computer: 10.3 seconds per hash,http://www.righto.com/2019/07/bitcoin-mining-on-apollo-guidance.html
77,Lobsters,cryptocurrencies,Bitcoin and Cryptocurrencies,Build A Decentralized Chat Using JavaScript & Rust (WebAssembly),https://medium.com/perlin-network/build-a-decentralized-chat-using-javascript-rust-webassembly-c775f8484b52
78,Lobsters,cryptocurrencies,Bitcoin and Cryptocurrencies,Cryptominer Uses Cron To Reinfect Linux Host After Removal,https://www.bleepingcomputer.com/news/security/cryptominer-uses-cron-to-reinfect-linux-host-after-removal/
79,Lobsters,cryptocurrencies,Bitcoin and Cryptocurrencies,Cambridge Bitcoin Electricity Consumption Index (CBECI),https://www.cbeci.org/
80,Lobsters,cryptocurrencies,Bitcoin and Cryptocurrencies,"An open ledger for writing scalable, mission-critical, decentralized WebAssembly applications",https://wavelet.perlin.net
81,Lobsters,cryptocurrencies,Bitcoin and Cryptocurrencies,Libra | A New Global Currency,https://libra.org
82,Lobsters,cryptocurrencies,Bitcoin and Cryptocurrencies,Petronomicon,https://medium.com/@jillcarlson/pandoras-protocols-2ae674de603e
83,Lobsters,cryptocurrencies,Bitcoin and Cryptocurrencies,Aion is not at all the “first” Java Blockchain. So what is it?,https://davidgerard.co.uk/blockchain/2019/06/10/aion-is-not-at-all-the-first-java-blockchain-so-what-is-it/
84,Lobsters,cryptocurrencies,Bitcoin and Cryptocurrencies,Bitcoin Build System Security,https://www.youtube.com/watch?v=I2iShmUTEl8
85,Lobsters,cryptocurrencies,Bitcoin and Cryptocurrencies,cointop – an interactive terminal based app for tracking cryptocurrencies,https://github.com/miguelmota/cointop
86,Lobsters,cryptocurrencies,Bitcoin and Cryptocurrencies,Inductive Consensus Tree Protocol: A Scalable Blockchain,https://ictp.io/ictp-whitepaper.pdf
87,Lobsters,cryptocurrencies,Bitcoin and Cryptocurrencies,The Most Expensive Lesson Of My Life: Details of SIM port hack,https://medium.com/coinmonks/the-most-expensive-lesson-of-my-life-details-of-sim-port-hack-35de11517124
88,Lobsters,cryptocurrencies,Bitcoin and Cryptocurrencies,Urbit 2019-5 Roadmap,https://urbit.org/posts/2019-5-roadmap/
89,Lobsters,cryptocurrencies,Bitcoin and Cryptocurrencies,Comprehensive list of Lightning Network resources,https://www.lopp.net/lightning-information.html
90,Lobsters,cryptocurrencies,Bitcoin and Cryptocurrencies,Blockchains: What's Not to Like?,https://blog.dshr.org/2018/12/blockchain-whats-not-to-like.html
91,Lobsters,cryptocurrencies,Bitcoin and Cryptocurrencies,What ordinary people think a “blockchain” is — and the weasel term “Blockchain Technology”,https://davidgerard.co.uk/blockchain/2019/04/29/what-ordinary-people-think-a-blockchain-is-and-the-weasel-term-blockchain-technology/
92,Lobsters,cryptocurrencies,Bitcoin and Cryptocurrencies,Understanding Decentralized IDs (DIDs),https://medium.com/@adam_14796/understanding-decentralized-ids-dids-839798b91809
93,Lobsters,cryptocurrencies,Bitcoin and Cryptocurrencies,Ethercombing: Finding Secrets in Popular Places,https://www.securityevaluators.com/casestudies/ethercombing/
94,Lobsters,cryptocurrencies,Bitcoin and Cryptocurrencies,"Medical records, but on the blockchain — the history of a bad idea",https://davidgerard.co.uk/blockchain/2019/04/20/medical-records-on-the-blockchain-the-history-of-a-bad-idea/
95,Lobsters,cryptocurrencies,Bitcoin and Cryptocurrencies,Plutus Smart Contracts II: Pay $10 in ADA,http://www.javiercasas.com/articles/plutus-smart-contracts-pay-usd10-in-ada
96,Lobsters,cryptocurrencies,Bitcoin and Cryptocurrencies,plutus-yesod-starter-app: a tool for researching Smart Contract User Interfaces,http://www.javiercasas.com/articles/plutus-yesod-starter-app
97,Lobsters,cryptocurrencies,Bitcoin and Cryptocurrencies,"Introducing CryptoGraph: A Cryptocurrency Trading Platform for Neo4j's New Virtual Currency, Nebuchadnezzar",https://neo4j.com/blog/introducing-cryptograph-cryptocurrency-trading-platform-neo4js-new-virtual-currency-nebuchadnezzar/
98,Lobsters,cryptocurrencies,Bitcoin and Cryptocurrencies,Plutus Publisher-Subscriber: a way to communicate using Cardano and Plutus Smart Contracts,http://www.dssti.com/articles/plutus-unlift
99,Lobsters,cryptocurrencies,Bitcoin and Cryptocurrencies,Trust and Sustainability in FOSS,http://oscoin.io/oscoin.pdf
100,Lobsters,cryptocurrencies,Bitcoin and Cryptocurrencies,History that Explains the ICO Bubble,https://haseebq.com/3-models-for-understanding-the-ico-bubble/
101,Lobsters,cryptocurrencies,Bitcoin and Cryptocurrencies,3 Moments in History that Explain the ICO Bubble,https://hackernoon.com/3-moments-in-history-that-explain-the-ico-bubble-e7c42896ca6f
102,Lobsters,cryptocurrencies,Bitcoin and Cryptocurrencies,Experts finally cracked the laptop of the crypto CEO who died with sole access to $137 million. But the money was already gone,https://www.businessinsider.com/crypto-ceo-died-with-passwords-to-137-million-but-the-money-is-gone-2019-3
103,Lobsters,cryptocurrencies,Bitcoin and Cryptocurrencies,Why blockchain is not yet working [2018],https://asindu.drileba.capital/2018/05/why-bockchain-is-not-yet-working/
104,Lobsters,cryptocurrencies,Bitcoin and Cryptocurrencies,A Hitchhiker's Guide to the Blockchain Universe,https://queue.acm.org/detail.cfm?id=3305265
105,Lobsters,cryptocurrencies,Bitcoin and Cryptocurrencies,There's No Good Reason to Trust Blockchain Technology,https://www.wired.com/story/theres-no-good-reason-to-trust-blockchain-technology/
106,Lobsters,cryptocurrencies,Bitcoin and Cryptocurrencies,Zcash Counterfeiting Vulnerability Successfully Remediated,https://z.cash/blog/zcash-counterfeiting-vulnerability-successfully-remediated/
107,Lobsters,cryptocurrencies,Bitcoin and Cryptocurrencies,The reports of bitcoin environmental damage are garbage,https://hackernoon.com/the-reports-of-bitcoin-environmental-damage-are-garbage-5a93d32c2d7
108,Lobsters,cryptocurrencies,Bitcoin and Cryptocurrencies,Bitmain: reflecting on 2018,https://blog.bitmain.com/en/bitmain-following-a-busy-2018-what-can-we-expect-in-2019/
109,Lobsters,cryptocurrencies,Bitcoin and Cryptocurrencies,"QuadrigaCX, my long experience, good-bye, and what's next",https://ecc-comp.blogspot.com/2019/01/quadrigacx-my-long-experience-good-bye.html
110,Lobsters,cryptocurrencies,Bitcoin and Cryptocurrencies,A founder’s farewell,https://urbit.org/posts/essays/a-founders-farewell/
111,Lobsters,cryptocurrencies,Bitcoin and Cryptocurrencies,"The Telegram ICO’s TON blockchain has questionable security, and will probably centralise",https://davidgerard.co.uk/blockchain/2018/12/29/the-telegram-icos-ton-blockchain-has-questionable-security-and-will-probably-centralise/
112,Lobsters,cryptocurrencies,Bitcoin and Cryptocurrencies,Blockchain for International Development: Using a Learning Agenda to Address Knowledge Gaps,http://merltech.org/blockchain-for-international-development-using-a-learning-agenda-to-address-knowledge-gaps/
113,Lobsters,cryptocurrencies,Bitcoin and Cryptocurrencies,IELE: Formally verified Ethereum VM based on LLVM,https://runtimeverification.com/blog/iele-a-new-virtual-machine-for-the-blockchain/
114,Lobsters,cryptocurrencies,Bitcoin and Cryptocurrencies,MineSweeper: An In-depth Look into Drive-by Cryptocurrency Mining and Its Defense,https://seclab.cs.ucsb.edu/media/uploads/papers/minesweeper_ccs18.pdf
115,Lobsters,cryptocurrencies,Bitcoin and Cryptocurrencies,Wavelet – 10k+ TPS DAG-Based Ledger with Proof-of-Stake & Smart Contract Support,https://medium.com/perlin-network/wavelet-pre-alpha-launch-7e6c042a0768
116,Lobsters,cryptocurrencies,Bitcoin and Cryptocurrencies,Diving Deeper into Consensus,https://blog.helium.com/diving-deeper-into-consensus-eaf20ddced92
117,Lobsters,cryptocurrencies,Bitcoin and Cryptocurrencies,The Benefits of Decentralization Go Far Beyond Ideology,https://storj.io/blog/2018/11/the-benefits-of-decentralization-go-far-beyond-ideology/
118,Lobsters,cryptocurrencies,Bitcoin and Cryptocurrencies,Liddle — search .bit web,http://liddle.bit
119,Lobsters,cryptocurrencies,Bitcoin and Cryptocurrencies,Conditions for the possibility of exit,https://medium.com/@enkiv2/conditions-for-the-possibility-of-exit-c38ea186abf1
120,Lobsters,cryptocurrencies,Bitcoin and Cryptocurrencies,How I Exposed a Cryptocurrency Exchange's Dirty Tricks to Fight Competition,https://dev.to/leovarmak/how-i-exposed-a-cryptocurrency-exchanges-dirty-tricks-to-fight-competition-31b2
121,Lobsters,cryptocurrencies,Bitcoin and Cryptocurrencies,Deploying an Ethereum Smart Contract to Testnet,https://www.smoothterminal.com/articles/deploying-to-testnet
122,Lobsters,cryptocurrencies,Bitcoin and Cryptocurrencies,Bitcoin Core CVE-2018-17144 disclosure,https://bitcoincore.org/en/2018/09/20/notice/
123,Lobsters,cryptocurrencies,Bitcoin and Cryptocurrencies,"XML, blockchains, and the strange shapes of progress",https://apenwarr.ca/log/?m=201809#14
124,Lobsters,cryptocurrencies,Bitcoin and Cryptocurrencies,Building a Wallet Web App,https://www.smoothterminal.com/articles/building-a-wallet-web-app
125,Lobsters,cryptocurrencies,Bitcoin and Cryptocurrencies,Describe a compelling distributed blockchain use case,/s/n6budd/describe_compelling_distributed
126,Lobsters,cryptocurrencies,Bitcoin and Cryptocurrencies,Creating Your Own Token - Blockchain,https://www.smoothterminal.com/articles/creating-your-own-token
127,Lobsters,cryptocurrencies,Bitcoin and Cryptocurrencies,Setting up a local Ethereum dev environment,https://www.smoothterminal.com/articles/setting-up-a-local-blockchain-dev-environment
128,Lobsters,cryptocurrencies,Bitcoin and Cryptocurrencies,Electricity consumed by Bitcoin and Ethereum and Litecoin,https://www.ofnumbers.com/2018/08/26/how-much-electricity-is-consumed-by-bitcoin-bitcoin-cash-ethereum-litecoin-and-monero/
129,Lobsters,cryptocurrencies,Bitcoin and Cryptocurrencies,Blockchain implementation dummies in NodeJS,https://repl.it/@maxpert/51b7eBlockchain
130,Lobsters,cryptocurrencies,Bitcoin and Cryptocurrencies,World’s Oldest Blockchain Hiding in the New York Times Since 1995,https://motherboard.vice.com/en_us/article/j5nzx4/what-was-the-first-blockchain
131,Lobsters,cryptocurrencies,Bitcoin and Cryptocurrencies,FOMO3D Ethereum ponzi game R1 ends as hot play outmaneuvers bots,https://www.finder.com.au/fomo3d-ethereum-ponzi-game-r1-ends-as-hot-play-outmaneuvers-bots
132,Lobsters,cryptocurrencies,Bitcoin and Cryptocurrencies,Introduction to Blockchain,https://www.smoothterminal.com/articles/introduction-to-blockchain-b26958df-b569-4061-a596-752fa107847d
133,Lobsters,cryptocurrencies,Bitcoin and Cryptocurrencies,Assembling an entry level High Frequency Trading (HFT) system,https://medium.com/@goncalo.abreu/assembling-an-entry-level-high-frequency-trading-hft-system-e7538545b2a9
134,Lobsters,cryptocurrencies,Bitcoin and Cryptocurrencies,Erlang co-creator joins æternity,https://blog.aeternity.com/trustlessness-erlang-and-the-blockchain-revolution-an-interview-with-robert-virding-458c68664372
135,Lobsters,cryptocurrencies,Bitcoin and Cryptocurrencies,The JPEG Committee is “exploring Blockchain” — to put DRM into JPEG,https://davidgerard.co.uk/blockchain/2018/08/10/the-jpeg-committee-is-exploring-blockchain-to-put-drm-into-jpeg/
136,Lobsters,cryptocurrencies,Bitcoin and Cryptocurrencies,West Virginia and the Voatz “blockchain” voting system — scaling and security concerns,https://davidgerard.co.uk/blockchain/2018/08/07/west-virginia-and-the-voatz-blockchain-voting-system-scaling-and-security-concerns/
137,Lobsters,cryptocurrencies,Bitcoin and Cryptocurrencies,Using SDR to build a decentralized wireless network,https://blog.helium.com/the-heart-of-a-decentralized-machine-network-part-i-7951876938d
138,Lobsters,cryptocurrencies,Bitcoin and Cryptocurrencies,uMine: a Blockchain based on Human Miners,https://eprint.iacr.org/2018/722
