ID,Source,Tag_Code,Tag_Name,Title,Url
534,Lobsters,erlang,Erlang development,zog_web is a web serving and domain/page routing platform for erlang applications,https://github.com/mattsta/zog_web
535,Lobsters,erlang,Erlang development,Jobs is a job scheduler for load regulation of Erlang applications.,https://github.com/esl/jobs
536,Lobsters,erlang,Erlang development,A Visual Tour of Erlang,https://www.youtube.com/watch?v=lHoWfeNuAN8&feature=youtu.be
537,Lobsters,erlang,Erlang development,Making reliable distributed systems in the presence of software errors,http://www.erlang.org/download/armstrong_thesis_2003.pdf
538,Lobsters,erlang,Erlang development,Erlang's Open Telecom Platform (OTP) Framework,http://www.infoq.com/presentations/Erlang-OTP-Behaviors
539,Lobsters,erlang,Erlang development,Building Highly Available Systems in Erlang,http://www.infoq.com/presentations/Building-Highly-Available-Systems-in-Erlang#.UUUKT7OwH5g.twitter
540,Lobsters,erlang,Erlang development,Solving the wrong problem,http://joearms.github.com/2013/03/28/solving-the-wrong-problem.html
541,Lobsters,erlang,Erlang development,Erlang memory architecture vs Java memory architecture,http://java-monitor.com/forum/showthread.php?t=890
542,Lobsters,erlang,Erlang development,Elixir 0.7.1 released! A meta-programming aware language build on the Erlang VM,http://elixir-lang.org/blog/2012/11/18/elixir-v0-7-1-released-and-the-end-of-a-journey/
543,Lobsters,erlang,Erlang development,Why Erlang matters,http://petrohi.me/post/35644212001/why-erlang-matters
544,Lobsters,erlang,Erlang development,Using Unicode to play chess over SMS,http://www.twilio.com/engineering/2012/11/08/adventures-in-unicode-sms
545,Lobsters,erlang,Erlang development,Why I Program In Erlang,http://www.evanmiller.org/why-i-program-in-erlang.html
546,Lobsters,erlang,Erlang development,A Tale of Two Concurrency Models: Comparing the Go and Erlang Programming Languages,http://www.informit.com/articles/article.aspx?p=1768317
