ID,Source,Tag_Code,Tag_Name,Title,Url
1,Lobsters,erlang,Erlang development,The New Scalable ETS ordered_set,http://blog.erlang.org/the-new-scalable-ets-ordered_set/
2,Lobsters,erlang,Erlang development,The BEAM Has Spoiled Me,https://gvaughn.github.io/2020/08/08/beam_spoiled_me.html
3,Lobsters,erlang,Erlang development,Erlang dbg Intro,https://antranigv.am/weblog_en/posts/erlang-dbg-intro/
4,Lobsters,erlang,Erlang development,The Erlang Runtime System,https://blog.stenmans.org/theBeamBook/
5,Lobsters,erlang,Erlang development,"v0.10 of Gleam, a statically typed language for the Erlang VM, is out",https://lpil.uk/blog/gleam-v0.10-released/
6,Lobsters,erlang,Erlang development,Operating via development,https://www.theerlangelist.com/article/operating_via_development
7,Lobsters,erlang,Erlang development,Introducing Lean Server for Midas (HTTP server in Gleam),https://crowdhailer.me/2020-06-23/introducing-lean-server-for-midas/
8,Lobsters,erlang,Erlang development,Hamler – Haskell-style functional programming language running on Erlang VM,https://www.emqx.io/news/open-source-functional-programming-language-hamler
9,Lobsters,erlang,Erlang development,"v0.9 of Gleam, a statically typed language for the Erlang VM, is out",https://lpil.uk/blog/gleam-v0.9-released/
10,Lobsters,erlang,Erlang development,"Scaling Erlang cluster to 10,000 nodes (2018)",https://codesync.global/media/maxim-fedorov-scaling-erlang-cluster-to-10-000-nodes/
11,Lobsters,erlang,Erlang development,Erlang online resources,https://gist.github.com/macintux/6349828
12,Lobsters,erlang,Erlang development,Getting Erlang to talk to the outside world (2002),http://erlang.org/workshop/2002/Armstrong.pdf
13,Lobsters,erlang,Erlang development,Startup hook pattern,http://blog.snailtext.com/posts/startup-hook-pattern.html
14,Lobsters,erlang,Erlang development,Optimising for Concurrency: Comparing and contrasting the BEAM and JVM virtual machines,https://www.erlang-solutions.com/blog/optimising-for-concurrency-comparing-and-contrasting-the-beam-and-jvm-virtual-machines.html
15,Lobsters,erlang,Erlang development,Erlang/OTP 23 Released,https://www.erlang.org/news/140
16,Lobsters,erlang,Erlang development,"v0.8 of Gleam, the statically typed language for the Erlang VM, is out",https://lpil.uk/blog/gleam-v0.8-released/
17,Lobsters,erlang,Erlang development,Less noise with OTP,http://blog.snailtext.com/posts/less-noise-with-otp.html
18,Lobsters,erlang,Erlang development,"archseer/enigma - Enigma VM, an implementation of the Erlang VM in Rust",https://github.com/archseer/enigma
19,Lobsters,erlang,Erlang development,Matching binary patterns with Erlang,https://dev.to/l1x/matching-binary-patterns-11kh
20,Lobsters,erlang,Erlang development,What's the best functional language to learn over the next 30 days?,/s/hf3y19/what_s_best_functional_language_learn
21,Lobsters,erlang,Erlang development,The saddest script I ever wrote,http://blog.snailtext.com/posts/the-saddest-script-i-ever-wrote.html
22,Lobsters,erlang,Erlang development,There's a new Language Server and Code Formatter for Erlang,https://notamonadtutorial.com/erlang-tooling-in-2020-b9606596353a
23,Lobsters,erlang,Erlang development,"BEAM in the Browser with Lumen, Part 1: Motivations & Constraints",https://tylerscript.dev/bringing-the-beam-to-webassembly-with-lumen
24,Lobsters,erlang,Erlang development,Comparing Cpp And Erlang For Motorola Telecoms Software,https://www.slideshare.net/Arbow/comparing-cpp-and-erlang-for-motorola-telecoms-software
25,Lobsters,erlang,Erlang development,Squeezing the most out of the server: Erlang Profiling,http://tech.nextroll.com/blog/dev/2020/04/07/erlang-profiling.html
26,Lobsters,erlang,Erlang development,The New Scalable ETS ordered_set,http://blog.erlang.org/the-new-scalable-ets-ordered_set/
27,Lobsters,erlang,Erlang development,The BEAM Has Spoiled Me,https://gvaughn.github.io/2020/08/08/beam_spoiled_me.html
28,Lobsters,erlang,Erlang development,Erlang dbg Intro,https://antranigv.am/weblog_en/posts/erlang-dbg-intro/
29,Lobsters,erlang,Erlang development,The Erlang Runtime System,https://blog.stenmans.org/theBeamBook/
30,Lobsters,erlang,Erlang development,"v0.10 of Gleam, a statically typed language for the Erlang VM, is out",https://lpil.uk/blog/gleam-v0.10-released/
31,Lobsters,erlang,Erlang development,Operating via development,https://www.theerlangelist.com/article/operating_via_development
32,Lobsters,erlang,Erlang development,Introducing Lean Server for Midas (HTTP server in Gleam),https://crowdhailer.me/2020-06-23/introducing-lean-server-for-midas/
33,Lobsters,erlang,Erlang development,Hamler – Haskell-style functional programming language running on Erlang VM,https://www.emqx.io/news/open-source-functional-programming-language-hamler
34,Lobsters,erlang,Erlang development,"v0.9 of Gleam, a statically typed language for the Erlang VM, is out",https://lpil.uk/blog/gleam-v0.9-released/
35,Lobsters,erlang,Erlang development,"Scaling Erlang cluster to 10,000 nodes (2018)",https://codesync.global/media/maxim-fedorov-scaling-erlang-cluster-to-10-000-nodes/
36,Lobsters,erlang,Erlang development,Erlang online resources,https://gist.github.com/macintux/6349828
37,Lobsters,erlang,Erlang development,Getting Erlang to talk to the outside world (2002),http://erlang.org/workshop/2002/Armstrong.pdf
38,Lobsters,erlang,Erlang development,Startup hook pattern,http://blog.snailtext.com/posts/startup-hook-pattern.html
39,Lobsters,erlang,Erlang development,Optimising for Concurrency: Comparing and contrasting the BEAM and JVM virtual machines,https://www.erlang-solutions.com/blog/optimising-for-concurrency-comparing-and-contrasting-the-beam-and-jvm-virtual-machines.html
40,Lobsters,erlang,Erlang development,Erlang/OTP 23 Released,https://www.erlang.org/news/140
41,Lobsters,erlang,Erlang development,"v0.8 of Gleam, the statically typed language for the Erlang VM, is out",https://lpil.uk/blog/gleam-v0.8-released/
42,Lobsters,erlang,Erlang development,Less noise with OTP,http://blog.snailtext.com/posts/less-noise-with-otp.html
43,Lobsters,erlang,Erlang development,"archseer/enigma - Enigma VM, an implementation of the Erlang VM in Rust",https://github.com/archseer/enigma
44,Lobsters,erlang,Erlang development,Matching binary patterns with Erlang,https://dev.to/l1x/matching-binary-patterns-11kh
45,Lobsters,erlang,Erlang development,What's the best functional language to learn over the next 30 days?,/s/hf3y19/what_s_best_functional_language_learn
46,Lobsters,erlang,Erlang development,The saddest script I ever wrote,http://blog.snailtext.com/posts/the-saddest-script-i-ever-wrote.html
47,Lobsters,erlang,Erlang development,There's a new Language Server and Code Formatter for Erlang,https://notamonadtutorial.com/erlang-tooling-in-2020-b9606596353a
48,Lobsters,erlang,Erlang development,"BEAM in the Browser with Lumen, Part 1: Motivations & Constraints",https://tylerscript.dev/bringing-the-beam-to-webassembly-with-lumen
49,Lobsters,erlang,Erlang development,Comparing Cpp And Erlang For Motorola Telecoms Software,https://www.slideshare.net/Arbow/comparing-cpp-and-erlang-for-motorola-telecoms-software
50,Lobsters,erlang,Erlang development,Squeezing the most out of the server: Erlang Profiling,http://tech.nextroll.com/blog/dev/2020/04/07/erlang-profiling.html
51,Lobsters,erlang,Erlang development,"Haskell, Erlang, and Frank walk into a bar – and begin new project to work in Unison",https://www.theregister.co.uk/2019/09/26/unison_programming_language/
52,Lobsters,erlang,Erlang development,Are formatters better than linters?,https://medium.com/@elbrujohalcon/are-formatters-better-than-linters-cbab91189be3
53,Lobsters,erlang,Erlang development,Observing Processes in Elixir - The Little Elixir & OTP Guidebook (2015),https://www.akitaonrails.com/2015/11/22/observing-processes-in-elixir-the-little-elixir-otp-guidebook
54,Lobsters,erlang,Erlang development,Discord Incident Report (March 16 Outage),https://status.discordapp.com/incidents/62gt9cgjwdgf
55,Lobsters,erlang,Erlang development,"v0.7 of Gleam, the statically typed language for the Erlang VM, is out",https://lpil.uk/blog/gleam-v0.7-released/
56,Lobsters,erlang,Erlang development,The new code formatter for Erlang: rebar3 format,http://tech.nextroll.com/blog/dev/2020/02/25/erlang-rebar3-format.html
57,Lobsters,erlang,Erlang development,"Bastion - distributed, fault tolerant system for Rust",https://github.com/bastion-rs/bastion
58,Lobsters,erlang,Erlang development,The Let It Crash Philosophy Outside Erlang,https://stratus3d.com/blog/2020/01/20/applying-the-let-it-crash-philosophy-outside-erlang
59,Lobsters,erlang,Erlang development,Ernie - binary encoding format based on External Term Format (Erlang),https://github.com/hauleth/ernie
60,Lobsters,erlang,Erlang development,systemd integration library for Erlang applications,https://github.com/hauleth/erlang-systemd
61,Lobsters,erlang,Erlang development,Webserver Benchmark: Erlang vs Go vs Java vs NodeJS,https://stressgrid.com/blog/webserver_benchmark/
62,Lobsters,erlang,Erlang development,Implementing Clojure agents on BEAM VM,https://medium.com/clojure-on-the-beam/agents-9de923017adf
63,Lobsters,erlang,Erlang development,"v0.5 of Gleam, a statically typed language for the Erlang VM, is out",https://lpil.uk/blog/gleam-v0.5-released
64,Lobsters,erlang,Erlang development,ElixirConfLA 2019 - Erlang/OTP: What is in the box? by João Britto,https://www.youtube.com/watch?v=WXqbOBH9xjg
65,Lobsters,erlang,Erlang development,Survey of Cowboy Webserver Performance - Part 2,https://stressgrid.com/blog/cowboy_performance_part_2/
66,Lobsters,erlang,Erlang development,Elixir Module and Struct Interoperability for Erlang,http://marianoguerra.org/posts/rfc-elixir-module-and-struct-interoperability-for-erlang.html
67,Lobsters,erlang,Erlang development,Survey of Cowboy Webserver Performance,https://stressgrid.com/blog/cowboy_performance/
68,Lobsters,erlang,Erlang development,Announcing Bastion 0.3 - Highly-available Distributed Fault-tolerant Runtime,http://bastion.rs/
69,Lobsters,erlang,Erlang development,"Cowboy: Small, fast, modern HTTP server for Erlang/OTP",https://github.com/ninenines/cowboy
70,Lobsters,erlang,Erlang development,Adopting Erlang: Dependencies,https://adoptingerlang.org/docs/development/dependencies/
71,Lobsters,erlang,Erlang development,Adopting Erlang: Docker images best practices,https://adoptingerlang.org/docs/production/docker/
72,Lobsters,erlang,Erlang development,Spawnfest 2019 Submissions,https://github.com/spawnfest?q=2019
73,Lobsters,erlang,Erlang development,"v0.4.0 of Gleam, the statically typed language for the Erlang VM, is out",https://lpil.uk/blog/gleam-v0.4-released/
74,Lobsters,erlang,Erlang development,Types On The BEAM,https://medium.com/@gordonguthrie/types-on-the-beam-2af8b1cb9be9
75,Lobsters,erlang,Erlang development,"Which companies are using Erlang, and why?",https://www.erlang-solutions.com/blog/which-companies-are-using-erlang-and-why-mytopdogstatus.html
76,Lobsters,erlang,Erlang development,Stacking Theory for Systems Design,https://medium.com/@jlouis666/stacking-theory-for-systems-design-2450e6300689
77,Lobsters,erlang,Erlang development,lumen/lumen - Compile Erlang/Elixir Applications to WebAssembly,https://github.com/lumen/lumen
78,Lobsters,erlang,Erlang development,How to Comprehend Comprehensions,https://medium.com/erlang-battleground/how-to-comprehend-comprehensions-c924f92a97e1
79,Lobsters,erlang,Erlang development,"v0.3.0 of Gleam, the statically typed language for the Erlang VM, is out",https://lpil.uk/blog/gleam-v0.3-released/
80,Lobsters,erlang,Erlang development,The Erlang Rationale,http://rvirding.blogspot.com/2019/01/the-erlang-rationale.html
81,Lobsters,erlang,Erlang development,Berkeley smorgasbord — part II,http://blog.snailtext.com/posts/berkeley-smorgasbord-part-2.html
82,Lobsters,erlang,Erlang development,"Two months left until SpawnFest. Code in Elixir, Erlang, LFE and win",https://spawnfest.github.io/
83,Lobsters,erlang,Erlang development,Pattern Matching Versus Elixir's Access Behavior,https://stratus3d.com/blog/2019/07/13/pattern-matching-versus-elixirs-access-behavior
84,Lobsters,erlang,Erlang development,Ten Years of Erlang,https://ferd.ca/ten-years-of-erlang.html
85,Lobsters,erlang,Erlang development,The wide world of almost-actors: comparing Pony to BEAM languages,https://www.youtube.com/watch?v=_0m0_qtfzLs
86,Lobsters,erlang,Erlang development,An Unprecedented Subtraction,https://medium.com/erlang-battleground/erlang-elixir-list-subtraction-wat-5b764020d69c
87,Lobsters,erlang,Erlang development,(BEAM) Data Types Memory Layout,http://beam-wisdoms.clau.se/en/latest/indepth-memory-layout.html
88,Lobsters,erlang,Erlang development,Practical Type Inference Based on Success Typings (2006),http://www.it.uu.se/research/group/hipe/papers/succ_types.pdf
89,Lobsters,erlang,Erlang development,No more need for records,http://www.cs.otago.ac.nz/staffpriv/ok/frames.pdf
90,Lobsters,erlang,Erlang development,BEAM + Rust A match made in heaven,https://codesync.global/media/beam-rust-a-match-made-in-heaven/
91,Lobsters,erlang,Erlang development,New release available for Clojerl (Clojure on the BEAM),https://github.com/clojerl/clojerl
92,Lobsters,erlang,Erlang development,Help Dialyzer Help You,https://medium.com/erlang-battleground/help-dialyzer-help-you-94db66bfbc5a
93,Lobsters,erlang,Erlang development,OTP Cheatsheet,https://stratus3d.com/blog/2019/05/18/otp-cheatsheet
94,Lobsters,erlang,Erlang development,ejabberd & Nintendo Switch NPNS,https://blog.process-one.net/ejabberd-nintendo-switch-npns/
95,Lobsters,erlang,Erlang development,BEAM Architecture Handbook,https://speakerdeck.com/whatyouhide/beam-architecture-handbook
96,Lobsters,erlang,Erlang development,The Soul of Erlang and Elixir,https://www.youtube.com/watch?v=JvBT4XBdoUE
97,Lobsters,erlang,Erlang development,Erlang/OTP 22.0 is released,https://www.erlang.org/news/132
98,Lobsters,erlang,Erlang development,Learn You Some Erlang for Great Good,https://learnyousomeerlang.com/
99,Lobsters,erlang,Erlang development,Gun. The powerful Erlang HTTP client,http://big-elephants.com/2019-05/gun/
100,Lobsters,erlang,Erlang development,My Take on Property-Based Testing,https://medium.com/erlang-battleground/property-based-testing-erlang-elixir-de72ad24966b
101,Lobsters,erlang,Erlang development,Uses This: Joe Armstrong,https://usesthis.com/interviews/joe.armstrong/
102,Lobsters,erlang,Erlang development,Introducing Telemetry,https://www.erlang-solutions.com/blog/introducing-telemetry.html
103,Lobsters,erlang,Erlang development,Using Fault-Injection to Evolve a Reliable Broadcast Protocol,http://christophermeiklejohn.com/erlang/partisan/2019/04/20/fault-injection-reliable-broadcast.html
104,Lobsters,erlang,Erlang development,The Forgotten Ideas in Computer Science,https://www.youtube.com/watch?v=-I_jE0l7sYQ
105,Lobsters,erlang,Erlang development,The Mess We're In,https://www.youtube.com/watch?v=lKXe3HUG2l4
106,Lobsters,erlang,Erlang development,Obfuscated Erlang,https://ferd.ca/obfuscation.html
107,Lobsters,erlang,Erlang development,"Search erlang & efene code by pattern matching code with ""holes""",http://marianoguerra.org/posts/erplorer-search-erlang-and-efene-code-by-pattern-matching-the-ast.html
108,Lobsters,erlang,Erlang development,Necessity is the Mother of Invention: stateful experiments on AWS Lambda,http://christophermeiklejohn.com/lasp/2018/03/10/serverless.html
109,Lobsters,erlang,Erlang development,"The first release of Gleam, a statically typed language for the Erlang VM",https://lpil.uk/blog/hello-gleam/
110,Lobsters,erlang,Erlang development,erlip - Erlang IP Address Library,https://gitlab.com/jimdigriz/erlip
111,Lobsters,erlang,Erlang development,"Elixir protocols, how do they work? the erlang perspective",http://marianoguerra.org/posts/elixir-protocols-how-do-they-work-the-erlang-perspective.html
112,Lobsters,erlang,Erlang development,Why should every process be supervised?,https://medium.com/@derek.kraan2/why-should-every-process-be-supervised-4fbd39c495c6
113,Lobsters,erlang,Erlang development,The Ideas in Erlang (2010),http://www.erlang-factory.com/upload/presentations/222/ErlangFactorySFBay2010-JoeArmstrong.pdf
114,Lobsters,erlang,Erlang development,An interview with the creator of Gleam: an ML like language for the Erlang VM with a compiler,https://notamonadtutorial.com/an-interview-with-the-creator-of-gleam-an-ml-like-language-for-the-erlang-vm-with-a-compiler-e94775f60dc7
115,Lobsters,erlang,Erlang development,Mid-air airplane repair: Troubleshooting at WhatsApp,https://www.youtube.com/watch?v=xi-ixFPjNpc
116,Lobsters,erlang,Erlang development,Operable Erlang and Elixir,https://www.youtube.com/watch?v=OR2Gc6_Le2U
117,Lobsters,erlang,Erlang development,Testing the Hard Stuff and Staying Sane,https://www.youtube.com/watch?v=zi0rHwfiX1Q
118,Lobsters,erlang,Erlang development,Luerl: Lua in Erlang,https://fosdem.org/2019/schedule/event/luainerlang/
119,Lobsters,erlang,Erlang development,GRiSP 2 – Erlang and Elixir on metal,https://www.kickstarter.com/projects/peerstritzinger/grisp-2
120,Lobsters,erlang,Erlang development,Embedded Elixir with Nerves,https://www.youtube.com/watch?v=IVCQvcCEjkU
121,Lobsters,erlang,Erlang development,Introducing the Erlang Ecosystem Foundation,https://codesync.global/media/introducing-erlang-ecosystem-foundation/
122,Lobsters,erlang,Erlang development,Spot The Discrepancies with Dialyzer for Erlang,http://tech.adroll.com/blog/dev/2019/02/19/erlang-dialyzer.html
123,Lobsters,erlang,Erlang development,Figuring out a gen_tcp:recv limitation,http://pzel.github.io/2019/02/18/Figuring-out-a-gen_tcp-recv_limitation.html
124,Lobsters,erlang,Erlang development,The Curious Case of BEAM CPU Usage,https://stressgrid.com/blog/beam_cpu_usage/
125,Lobsters,erlang,Erlang development,Runtime Verification in Erlang by Using Contracts,https://arxiv.org/pdf/1808.07937.pdf
126,Lobsters,erlang,Erlang development,Introducing Fluux: XMPP & MQTT as a Service,https://blog.process-one.net/introducing-fluux-xmpp-mqtt-as-a-service/
127,Lobsters,erlang,Erlang development,"Property-Based Testing with PropEr, Erlang, and Elixir",https://ferd.ca/property-based-testing-with-proper-erlang-and-elixir.html
128,Lobsters,erlang,Erlang development,Sketches of Elixir,https://blog.zdsmith.com/posts/sketches-of-elixir.html
129,Lobsters,erlang,Erlang development,Fibonacci Algorithms in Elixir Part 2,https://stratus3d.com/blog/2018/12/24/fibonacci-algorithms-in-elixir-part-2
130,Lobsters,erlang,Erlang development,SpawnFest 2018 Winners were Announced,https://spawnfest.github.io/winners
131,Lobsters,erlang,Erlang development,Ode to Erlang aka my love story,https://pattern-match.com/blog/2018/12/11/ode-to-erlang/
132,Lobsters,erlang,Erlang development,SpawnFest repos made public,https://twitter.com/spawnfest/status/1074983265566646272
133,Lobsters,erlang,Erlang development,Berkeley smorgasbord,http://blog.obligd.com/posts/berkeley-smorgasbord.html
134,Lobsters,erlang,Erlang development,"Partisan: Enabling Cloud-Scale, Erlang Applications",https://arxiv.org/pdf/1802.02652.pdf
135,Lobsters,erlang,Erlang development,From Datacenter Applications to Planetary Scale Applications,https://www.youtube.com/watch?v=01vedKGBQkQ
136,Lobsters,erlang,Erlang development,AtomVM: how to run Elixir code on a 3 $ microcontroller,https://medium.com/@Bettio/atomvm-how-to-run-elixir-code-on-a-3-microcontroller-b414773498a6
137,Lobsters,erlang,Erlang development,Erlang/OTP 21's new logger,https://ferd.ca/erlang-otp-21-s-new-logger.html
138,Lobsters,erlang,Erlang development,Retiring old performance pitfalls,http://blog.erlang.org/retired-pitfalls-22/
139,Lobsters,erlang,Erlang development,Erlang/OTP on OpenBSD,http://blog.obligd.com/posts/erlang-otp-on-openbsd.html
140,Lobsters,erlang,Erlang development,Diving Deeper into Consensus,https://blog.helium.com/diving-deeper-into-consensus-eaf20ddced92
141,Lobsters,erlang,Erlang development,How many functions do you have in your Erlang/Elixir VM?,https://medium.com/erlang-battleground/code-server-erlang-elixir-6faa86206f70
142,Lobsters,erlang,Erlang development,16 Things I learnt using the BEAM,https://www.youtube.com/watch?v=pR_2289p19w
143,Lobsters,erlang,Erlang development,Removing Erlang dead code with Xref,http://tech.adroll.com/blog/dev/2018/10/09/remove-erlang-dead-code-xref.html
144,Lobsters,erlang,Erlang development,An Elm compiler for the Erlang Virtual Machine,https://kofi.sexy/blog/elm-beam
145,Lobsters,erlang,Erlang development,10 Lessons from Decade with Erlang,https://medium.com/erlang-battleground/erlang-lessons-fe800c51af4f
146,Lobsters,erlang,Erlang development,Experiences with QuickCheck: testing the hard stuff and staying sane,http://publications.lib.chalmers.se/records/fulltext/232550/local_232550.pdf
147,Lobsters,erlang,Erlang development,The Lasp Programming System,https://lasp-lang.readme.io/
148,Lobsters,erlang,Erlang development,Everyday crypto,http://blog.obligd.com/posts/everyday-crypto.html
149,Lobsters,erlang,Erlang development,Riak Core Tutorial – Build a Dynamo Style KV Store,https://marianoguerra.github.io/riak-core-tutorial/
150,Lobsters,erlang,Erlang development,"Code Janitor: nobody's dream, everyone's job (and how Erlang can help) (2012)",https://ferd.ca/code-janitor-nobody-s-dream-everyone-s-job-and-how-erlang-can-help.html
151,Lobsters,erlang,Erlang development,Iridium VM: A BEAM like VM project/tutorial written in Rust,https://blog.subnetzero.io/project/iridium-vm/
152,Lobsters,erlang,Erlang development,What is wrong with gen_event?,https://pattern-match.com/blog/2018/08/31/what-is-wrong-with-gen-event-an-update/
153,Lobsters,erlang,Erlang development,BEAM Bytecode Optimization Traps and Pitfalls,http://blog.erlang.org/opt-traps-and-pitfalls/
154,Lobsters,erlang,Erlang development,Fibonacci Algorithms in Elixir,https://stratus3d.com/blog/2018/08/18/fibonacci-algorithms-in-elixir
155,Lobsters,erlang,Erlang development,Mapping a decentralized wireless network with Uber H3 hexagons,https://blog.helium.com/mapping-the-world-with-hexagons-49f57d8b3df5
156,Lobsters,erlang,Erlang development,Erlang co-creator joins æternity,https://blog.aeternity.com/trustlessness-erlang-and-the-blockchain-revolution-an-interview-with-robert-virding-458c68664372
157,Lobsters,erlang,Erlang development,Building a truly decentralized system with a distributed key generator,https://hackernoon.com/building-a-truly-decentralized-system-with-a-distributed-key-generator-1cfe13af55e7
158,Lobsters,erlang,Erlang development,A Brief History of the BEAM Compiler,http://blog.erlang.org/beam-compiler-history/
159,Lobsters,erlang,Erlang development,Configuring multiple endpoints in Phoenix Framework,https://pattern-match.com/blog/2018/06/19/multiple-endpoints-in-phoenix/
160,Lobsters,erlang,Erlang development,Dark Corners of Erlang and Elixir Tracing,https://pattern-match.com/blog/2018/06/01/erlang-tracing-what-we-can-and-what-we-cannot-trace/
161,Lobsters,erlang,Erlang development,All For Reliability: Reflections on the Erlang Thesis,https://dockyard.com/blog/2018/07/18/all-for-reliability-reflections-on-the-erlang-thesis
162,Lobsters,erlang,Erlang development,Detecting Spam as it happens: Getting Erlang and Python working together with Wallaroo,https://blog.wallaroolabs.com/2018/07/detecting-spam-as-it-happens-getting-erlang-and-python-working-together-with-wallaroo/
163,Lobsters,erlang,Erlang development,Comparison of Erlang Runtime System and Java Virtual Machine (2015),http://ds.cs.ut.ee/courses/course-files/To303nis%20Pool%20.pdf
164,Lobsters,erlang,Erlang development,Erlang OTP 21.0,http://www.erlang.org/news/123
165,Lobsters,erlang,Erlang development,"Comparing Languages for Engineering Server Software: Erlang, Go, and Scala with Akka",http://www.dcs.gla.ac.uk/~trinder/papers/sac-18.pdf
166,Lobsters,erlang,Erlang development,A Theory of Reversibility for Erlang,https://arxiv.org/abs/1806.07100
167,Lobsters,erlang,Erlang development,Elchemy,https://wende.github.io/elchemy/
168,Lobsters,erlang,Erlang development,kvakvs/ErlangRT,https://github.com/kvakvs/ErlangRT
169,Lobsters,erlang,Erlang development,Implementing SSH tunnels in Elixir,https://medium.com/@Drowzy/implementing-ssh-tunnels-in-elixir-e7ad9d1af01a
170,Lobsters,erlang,Erlang development,What is 42? …Or The Semantic of Function Arguments – Erlang Battleground,https://medium.com/erlang-battleground/what-is-42-4eb39b66ba16
171,Lobsters,erlang,Erlang development,Rethinking app env,http://www.theerlangelist.com/article/rethinking_app_env
172,Lobsters,erlang,Erlang development,In Defense of gen_event,http://www.rkallos.com/blog/2018/05/22/in-defense-of-gen-event/
173,Lobsters,erlang,Erlang development,What Sucks About Erlang (2008),http://damienkatz.net/2008/03/what_sucks_abou.html
174,Lobsters,erlang,Erlang development,Riak Core Tutorial Part 2: Starting,http://marianoguerra.org/posts/riak-core-tutorial-part-2-starting.html
175,Lobsters,erlang,Erlang development,The gen server simplified (how it works),http://erlang.org/pipermail/erlang-questions/2011-April/057777.html
176,Lobsters,erlang,Erlang development,Core Erlang by Example,http://blog.erlang.org/core-erlang-by-example/
177,Lobsters,erlang,Erlang development,Leibniz is a pure Erlang/Elixir math expression parser and evaluator,https://github.com/saulecabrera/leibniz
178,Lobsters,erlang,Erlang development,Memory instrumentation in Erlang OTP 21,http://blog.erlang.org/Memory-instrumentation-in-OTP-21/
179,Lobsters,erlang,Erlang development,10 Ways to Stop an Erlang VM,https://medium.com/erlang-battleground/10-ways-to-stop-an-erlang-vm-7016bd593a5
180,Lobsters,erlang,Erlang development,The Erlang Runtime System,https://happi.github.io/theBeamBook/
