ID,Source,Tag_Code,Tag_Name,Title,Url
322,Lobsters,finance,Finance and economics,Libtrading: Connectivity Library for Electronic Trading,http://libtrading.org/
323,Lobsters,finance,Finance and economics,Kx Systems announces free version of its database software and programming language,http://kx.com/press-releases-140402.php
324,Lobsters,finance,Finance and economics,"MtGox knowingly traded non-existent bitcoins for two weeks, filing shows",http://www.theguardian.com/technology/2014/mar/14/mtgox-knowingly-traded-non-existent-bitcoins-for-two-weeks-filing-shows
325,Lobsters,finance,Finance and economics,Why There Will Never Be Another RedHat: The Economics Of Open Source,http://techcrunch.com/2014/02/13/please-dont-tell-me-you-want-to-be-the-next-red-hat/
326,Lobsters,finance,Finance and economics,The incredible stock-picking ability of SEC employees,http://www.washingtonpost.com/blogs/wonkblog/wp/2014/02/27/the-incredible-stock-picking-ability-of-sec-employees/
327,Lobsters,finance,Finance and economics,Introducing Quantave - Market Insights for Bitcoin,http://www.quantave.com
328,Lobsters,finance,Finance and economics,MtGox Situation: Crisis Strategy Draft (attempted),http://www.scribd.com/doc/209050732/MtGox-Situation-Crisis-Strategy-Draft
329,Lobsters,finance,Finance and economics,What is the correct price for a (crypto or other) currency?,http://www.chrisstucchio.com/blog/2014/demand_for_bitcoins.html
330,Lobsters,finance,Finance and economics,Why I Did Not Go To Jail,http://www.bhorowitz.com/why_i_did_not_go_to_jail
331,Lobsters,finance,Finance and economics,Dogecoin and the Appeal of Small Numbers,http://diegobasch.com/dogecoin-and-the-appeal-of-small-numbers
332,Lobsters,finance,Finance and economics,Coingen: Create your own Bitcoin clone with a webform,http://coingen.io/
333,Lobsters,finance,Finance and economics,"Bitcoin, Magical Thinking, and Political Ideology",https://al3x.net/2013/12/18/bitcoin.html
334,Lobsters,finance,Finance and economics,Bitcoin price plunges as China clampdown escalates,http://www.nbcnews.com/business/bitcoin-price-plunges-china-clampdown-escalates-2D11765766
335,Lobsters,finance,Finance and economics,"The rich do not pay the most taxes, they pay ALL the taxes",http://www.cnbc.com/id/101264757
336,Lobsters,finance,Finance and economics,An Engineer's guide to Stock Options,http://blog.alexmaccaw.com/an-engineers-guide-to-stock-options
337,Lobsters,finance,Finance and economics,Bank of America's report on Bitcoin,https://s3.amazonaws.com/s3.documentcloud.org/documents/885843/banks-research-report-on-bitcoin.pdf?lobsters
338,Lobsters,finance,Finance and economics,China Bans Financial Companies From Bitcoin Transactions,http://www.bloomberg.com/news/2013-12-05/china-s-pboc-bans-financial-companies-from-bitcoin-transactions.html?lobsters
339,Lobsters,finance,Finance and economics,Why I don't trade stocks and (probably) neither should you,http://edmarkovich.blogspot.dk/2013/12/why-i-dont-trade-stocks-and-probably.html?lobsters
340,Lobsters,finance,Finance and economics,Bitcoins: The Second Biggest Ponzi Scheme in History,http://www.garynorth.com/public/11828.cfm?lobsters
341,Lobsters,finance,Finance and economics,How good is $20K seed capital?,http://pastebin.com/fsiyJ00S
342,Lobsters,finance,Finance and economics,The 1990s Stock Bubble Was Much Crazier Than People Remember,http://www.slate.com/blogs/moneybox/2013/11/27/_1990s_stock_bubble_really_really_crazy.html
343,Lobsters,finance,Finance and economics,Models help you understand why you disagree,http://www.chrisstucchio.com/blog/2013/basic_income_vs_basic_job2.html
344,Lobsters,finance,Finance and economics,Knight Capital (HFT company that lost $450 million in 45 minutes) postmortem,http://www.sec.gov/litigation/admin/2013/34-70694.pdf
345,Lobsters,finance,Finance and economics,Bitcoin Cryptocurrency Crash Course,https://www.youtube.com/watch?v=JP9-lAYngi4
346,Lobsters,finance,Finance and economics,The secret financial market only robots can see,http://qz.com/124721/the-secret-financial-market-only-robots-can-see/
347,Lobsters,finance,Finance and economics,“NASDAQ is owned.” Five men charged in largest financial hack ever,http://arstechnica.com/security/2013/07/nasdaq-is-owned-five-men-charged-in-largest-financial-hack-ever/
348,Lobsters,finance,Finance and economics,Winklevoss Twins Plan First Fund for Bitcoins,http://dealbook.nytimes.com/2013/07/01/first-name-in-the-first-fund-for-bitcoins-winklevoss/
349,Lobsters,finance,Finance and economics,TREZOR - A hardware bitcoin wallet,http://www.bitcointrezor.com/
350,Lobsters,finance,Finance and economics,The rise of disability in America,http://apps.npr.org/unfit-for-work/
351,Lobsters,finance,Finance and economics,Bitcoin: Monetarists Anonymous,http://www.economist.com/node/21563752?fsrc=scn/tw/te/pe/monetaristsanonymous
352,Lobsters,finance,Finance and economics,USA finance break down by KPCB (2011),http://s3.amazonaws.com/kpcbweb/files/USA_Inc.pdf
353,Lobsters,finance,Finance and economics,Searching for a Speed Limit in High-Frequency Trading,https://www.nytimes.com/2012/09/09/business/high-frequency-trading-of-stocks-is-two-critics-target.html?_r=1&pagewanted=all
