ID,Source,Tag_Code,Tag_Name,Title,Url
388,Lobsters,games,Game Design,AI Neural Networks being used to generate HQ textures for older games (You can do it yourself!),https://www.resetera.com/threads/ai-neural-networks-being-used-to-generate-hq-textures-for-older-games-you-can-do-it-yourself.88272/
389,Lobsters,games,Game Design,"The state of ggez [Rust game framework], 2019",https://wiki.alopex.li/TheStateOfGGEZ2019
390,Lobsters,games,Game Design,Xenix tales,https://github.com/retrohun/blog/tree/master/dt/xenixtales
391,Lobsters,games,Game Design,A NES Emulator writtein in Emacs,https://github.com/gongo/emacs-nes
392,Lobsters,games,Game Design,Classic Doom gets a 3D and HD remaster – courtesy of the fans,https://www.pcgamesn.com/doom/doom-remaster
393,Lobsters,games,Game Design,Introduction to the A* Algorithm,https://www.redblobgames.com/pathfinding/a-star/introduction.html
394,Lobsters,games,Game Design,qengine: Retro game engine for developers that enjoy creating games like it's 1997,https://github.com/klaussilveira/qengine
395,Lobsters,games,Game Design,"SuperTuxKart, the open source Mario Kart clone, achieves beta status with network support",https://betanews.com/2019/01/11/supertuxkart-mario-kart-linux/
396,Lobsters,games,Game Design,"Nethack beaten in 7 minutes, 15 seconds realtime",https://pellsson.github.io/
397,Lobsters,games,Game Design,A step-by-step guide to building a simple chess AI,https://medium.freecodecamp.org/simple-chess-ai-step-by-step-1d55a9266977
398,Lobsters,games,Game Design,NegaMax Search (2013),https://binarydebt.wordpress.com/2013/09/25/negamax-search/
399,Lobsters,games,Game Design,Life on the Grid,https://www.filfre.net/2019/01/life-on-the-grid/
400,Lobsters,games,Game Design,a real time Ray-traced game played on the surface of evolving fractals,https://codeparade.itch.io/marblemarcher
401,Lobsters,games,Game Design,Pathfinding for Tower Defense,https://www.redblobgames.com/pathfinding/tower-defense/
402,Lobsters,games,Game Design,2048 clone over SSH with scoreboard,/s/4og4qb/2048_clone_over_ssh_with_scoreboard
403,Lobsters,games,Game Design,Oscilloscope Games Console,https://mitxela.com/projects/console
404,Lobsters,games,Game Design,Recovering Nintendo’s Lost SimCity for the NES,https://gamehistory.org/simcity/
405,Lobsters,games,Game Design,My christmas present to the world,http://sigma.eruditenow.com/index.html
406,Lobsters,games,Game Design,Creating a (Non-Trivial) Lisp Game in 2018,https://defungames.com/2018/12/creating-a-non-trivial-lisp-game-in-2018/
407,Lobsters,games,Game Design,DOOMBA,http://richwhitehouse.com/index.php?postid=72
408,Lobsters,games,Game Design,Emulation on FPGA instead of CPU,https://github.com/MiSTer-devel/Main_MiSTer/wiki
409,Lobsters,games,Game Design,Runes Reforged: A Technical Retro,https://engineering.riotgames.com/news/runes-reforged-technical-retro
410,Lobsters,games,Game Design,A rediscovered mainframe game from 1974 might be the first text adventure,https://killscreen.com/articles/rediscovered-mainframe-game-from-1974-might-first-text-adventure/
411,Lobsters,games,Game Design,Using Keras and Deep Q-Network to Play FlappyBird (2016),http://example.com/2016/07/10/FlappyBird-Keras.html
412,Lobsters,games,Game Design,My complete SGI Ultra64 dev set + manual scans + dev software,http://assemblergames.com/threads/my-complete-sgi-ultra64-dev-set-manual-scans-dev-software.45165/
413,Lobsters,games,Game Design,"Sandspiel, a falling sand game built in Rust+WebGL",https://sandspiel.club
414,Lobsters,games,Game Design,Tetris,https://www.colinfahey.com/tetris/tetris.html
415,Lobsters,games,Game Design,How the Dreamcast copy protection was defeated,http://fabiensanglard.net/dreamcast_hacking/
416,Lobsters,games,Game Design,SIGIL: A new Doom campaign by John Romero,https://www.romerogames.ie/sigil/
417,Lobsters,games,Game Design,How I created a bot that plays Castlevania (NES),https://meatfighter.com/castlevaniabot/
418,Lobsters,games,Game Design,REXPaint - A powerful and user-friendly ASCII art editor,https://www.gridsagegames.com/rexpaint/
419,Lobsters,games,Game Design,Dialog: An Inform 7 and Prolog inspired language for interactive fiction,https://linusakesson.net/dialog/
420,Lobsters,games,Game Design,"Game Engine Black Book: Wolfenstein 3D, 2nd Edition",http://fabiensanglard.net/gebbwolf3d/
421,Lobsters,games,Game Design,Cards Against Cryptography,https://github.com/CardsAgainstCryptography/CAC
422,Lobsters,games,Game Design,"Using the GOG.com installers for Linux, on NetBSD",http://dressupgeekout.blogspot.com/2018/12/using-gogcom-installers-for-linux-on.html
423,Lobsters,games,Game Design,The Making Of: Dust 2,https://www.johnsto.co.uk/design/making-dust2/
424,Lobsters,games,Game Design,"The legacy of PlayStation creator Ken Kutaragi, in 24 stories",https://www.polygon.com/2018/11/26/18080492/playstation-history-ken-kutaragi-sony
425,Lobsters,games,Game Design,"Cheezball Rising: Collision detection, part 1",https://eev.ee/blog/2018/11/28/cheezball-rising-collision-detection-part-1/
426,Lobsters,games,Game Design,Stardew Valley on FreeBSD,http://bitcannon.net/post/stardew-valley-on-freebsd/
427,Lobsters,games,Game Design,How To Fail With JavaScript [58min],https://www.youtube.com/watch?v=w_-93M6A0Io
428,Lobsters,games,Game Design,Video Games In East Germany: The Stasi Played Along,https://www.zeit.de/digital/games/2018-11/computer-games-gdr-stasi-surveillance-gamer-crowd
429,Lobsters,games,Game Design,Games on FreeBSD,https://oshogbo.vexillium.org/blog/58/
430,Lobsters,games,Game Design,"SoLoud -- an easy to use, free, portable c/c++ audio engine for games",http://sol.gfxile.net/soloud/
431,Lobsters,games,Game Design,Procedural Dungeon Generation: A Drunkard's Walk in ClojureScript,https://blog.jrheard.com/procedural-dungeon-generation-drunkards-walk-in-clojurescript
432,Lobsters,games,Game Design,Over 6000+ DOS/Windows and Console games preserved for future generations,https://classicreload.com/
433,Lobsters,games,Game Design,Designing 2D graphics in the Japanese industry,https://vgdensetsu.tumblr.com/post/179656817318/designing-2d-graphics-in-the-japanese-industry
434,Lobsters,games,Game Design,Wave Function Collapse Demo,https://marian42.itch.io/wfc
435,Lobsters,games,Game Design,What MUDs Are You Playing?,/s/nrcihj/what_muds_are_you_playing
436,Lobsters,games,Game Design,Videogame's onboarding experiences are a lesson to design,https://www.imaginarycloud.com/blog/videogame-onboarding-design-lessons/
437,Lobsters,games,Game Design,"AnyDice, DSL for Rolling Dice",https://anydice.com/
438,Lobsters,games,Game Design,Slime the World: A Postmortem,http://jakob.space/posts/slime-the-world-postmortem/
439,Lobsters,games,Game Design,AI for Imperfect-Information Games: Beating Top Humans in No-Limit Poker,https://www.youtube.com/watch?v=McV4a6umbAY
440,Lobsters,games,Game Design,The Crappy Game,https://blog.mbassem.com/2018/10/28/the-crappy-game/
441,Lobsters,games,Game Design,Teen Developer Makes Game Inspired By '90s Shooters That Came Out Before He Was Born,https://kotaku.com/teen-developer-makes-game-inspired-by-90s-shooters-that-1829874126
442,Lobsters,games,Game Design,"Amethyst 0.9: Rendering 100,000 sprites at 60fps",https://www.amethyst.rs/blog/release-0-9/
443,Lobsters,games,Game Design,"The Internet Sucks: Or, What I Learned Coding X-Wing vs. TIE Fighter (1999)",http://www.gamasutra.com/view/feature/131781/the_internet_sucks_or_what_i_.php?print=1
444,Lobsters,games,Game Design,Slack on a SNES,https://bert.org/2018/10/18/slack-on-a-snes/
445,Lobsters,games,Game Design,1st AI Settlement Generation Competition Results,https://www.dropbox.com/s/4mbcdqgyvwd2rpg/GDMCPresentation.pdf?dl=0
446,Lobsters,games,Game Design,Github Game Jam,https://blog.github.com/2018-10-15-game-off-returns-november-2018/
447,Lobsters,games,Game Design,Developing a 3d fractal exploration game,https://medium.com/@bananaft/my-journey-into-fractals-d25ebc6c4dc2
448,Lobsters,games,Game Design,Spritely: towards secure social spaces as virtual worlds,https://dustycloud.org/blog/spritely/
449,Lobsters,games,Game Design,It's Behind You - The Making of a Computer Game,http://itsbehindyou.atwebpages.com/more.html
450,Lobsters,games,Game Design,QED,https://teorth.github.io/QED/
451,Lobsters,games,Game Design,A Great Old-Timey Game Programming Hack,http://blog.moertel.com/posts/2013-12-14-great-old-timey-game-programming-hack.html
452,Lobsters,games,Game Design,Entity Component Systems and Data Oriented Design,http://aras-p.info/texts/files/2018Academy%20-%20ECS-DoD.pdf
453,Lobsters,games,Game Design,Making a homebrew videogame for Game Boy Color,https://eev.ee/blog/2018/10/09/cheezball-rising-opening-a-dialogue/
454,Lobsters,games,Game Design,Programmers: Play with Minecraft's Inner Workings,https://minecraft.net/en-us/article/programmers-play-minecrafts-inner-workings
455,Lobsters,games,Game Design,Profunctor Optics in Minecraft,https://github.com/Mojang/DataFixerUpper
456,Lobsters,games,Game Design,AI-driven Dynamic Dialog through Fuzzy Pattern Matching [2012],https://www.youtube.com/watch?v=tAbBID3N64A
457,Lobsters,games,Game Design,Brute-forcing a seemingly simple number puzzle,https://www.nurkiewicz.com/2018/09/brute-forcing-seemingly-simple-number.html
458,Lobsters,games,Game Design,Cheezball Rising: Opening a dialogue,https://eev.ee/blog/2018/09/08/cheezball-rising-opening-a-dialogue/
459,Lobsters,games,Game Design,Inside The Culture Of Sexism At Riot Games,https://kotaku.com/inside-the-culture-of-sexism-at-riot-games-1828165483
460,Lobsters,games,Game Design,Cleaning Up Data Debt in League,https://engineering.riotgames.com/news/cleaning-data-debt-league
461,Lobsters,games,Game Design,Untrusted,https://github.com/AlexNisnevich/untrusted
462,Lobsters,games,Game Design,Uncle Buddy's Phantom Funhouse,https://obscuritory.com/multimedia/uncle-buddys-phantom-funhouse/
463,Lobsters,games,Game Design,Mathematics of a roller chain animation,https://www.xarg.org/2017/12/mathematics-of-a-roller-chain-animation/
464,Lobsters,games,Game Design,Simple math to convert simple 2D game view to a perspective 3D view,https://github.com/monim67/perspective-vue
465,Lobsters,games,Game Design,Python AI in Starcraft II Tutorial Series,https://www.youtube.com/playlist?list=PLQVvvaa0QuDcT3tPehHdisGMc8TInNqdq
466,Lobsters,games,Game Design,Orchestrating Game Generation,http://antoniosliapis.com/articles/orchestration.php
467,Lobsters,games,Game Design,"How did Matt DesLauriers create Bellwoods, a 13kb generative game",https://mattdesl.svbtle.com/bellwoods
468,Lobsters,games,Game Design,Underrun – Making Of,https://phoboslab.org/log/2018/09/underrun-making-of
469,Lobsters,games,Game Design,Lock-Step Simulation Is Child’s Play (2017),https://www.joachim-breitner.de/publications/CodeWorld-ICFP17.pdf
470,Lobsters,games,Game Design,PaperCart: an Atari 2600 that plays QR codes,https://www.codedojo.com/?p=2251
471,Lobsters,games,Game Design,DMA & HDMA on the SNES,https://www.youtube.com/watch?v=K7gWmdgXPgk
472,Lobsters,games,Game Design,Hareraiser (The Worst Game Ever),https://www.youtube.com/watch?v=ouvi-fwrfIY
473,Lobsters,games,Game Design,Solving Resistance,https://pavpanchekha.com/blog/resistance-1.html
474,Lobsters,games,Game Design,Cheezball Rising: Resounding failure,https://eev.ee/blog/2018/09/06/cheezball-rising-resounding-failure/
475,Lobsters,games,Game Design,Fuzzing Counter-Strike: Global Offensive maps files with AFL,https://phoenhex.re/2018-08-26/csgo-fuzzing-bsp
476,Lobsters,games,Game Design,Roguelike Universe: Visualising Influence,https://spaxe.github.io/roguelike-universe
477,Lobsters,games,Game Design,"Skipping Steam: Why Jason Rohrer independently distributes One Hour, One Life",http://gamasutra.com/view/news/325327/Skipping_Steam_in_2018_Why_Jason_Rohrer_independently_distributes_One_Hour_One_Life.php
478,Lobsters,games,Game Design,How We Built a Super Nintendo Out of a Wireless Keyboard (2012),https://blog.adafruit.com/2012/12/05/how-we-built-a-super-nintendo-out-of-a-wireless-keyboard-sifteo-sifteo/
479,Lobsters,games,Game Design,OpenBSD Gaming Resource,https://mrsatterly.com/openbsd_games.html
480,Lobsters,games,Game Design,The Indie Post-apocalypse,https://www.goldenkronehotel.com/wp/2018/08/26/the-indie-post-apocalypse/
481,Lobsters,games,Game Design,wideNES - Peeking Past the Edge of NES Games,http://prilik.com/blog/wideNES.html
482,Lobsters,games,Game Design,The Ripper: The disturbing Visceral Games project that never was,https://www.polygon.com/2018/8/24/17770668/jack-the-ripper-visceral-games-electronic-arts-canceled
483,Lobsters,games,Game Design,An Oral History of ‘GoldenEye 007’ on the N64,https://melmagazine.com/an-oral-history-of-goldeneye-007-on-the-n64-129844f1c5ab
484,Lobsters,games,Game Design,The Games of Windows,https://www.filfre.net/2018/08/the-games-of-windows/
485,Lobsters,games,Game Design,Reverse engineering Mortal Kombat GRA file format,http://blog.rewolf.pl/blog/?p=1837
486,Lobsters,games,Game Design,GOG Launches FCKDRM to Promote DRM-Free Art and Media,https://torrentfreak.com/gog-launches-fckdrm-to-promote-drm-free-art-and-media-180822/
487,Lobsters,games,Game Design,Introducing a new version of Steam Play,https://steamcommunity.com/games/221410/announcements/detail/1696055855739350561
488,Lobsters,games,Game Design,"Talking to the SEGA Fish Life, a rare virtual aquarium from 2000",https://www.youtube.com/watch?v=X3oMwg8sSqw
489,Lobsters,games,Game Design,Unity; For More Than Just Games,https://www.smoothterminal.com/articles/for-more-than-just-games
490,Lobsters,games,Game Design,NandGame - Build a computer from scratch,http://nandgame.com/
491,Lobsters,games,Game Design,RPCS3 Progress Report: July 2018,https://rpcs3.net/blog/2018/08/18/progress-report-july-2018/
492,Lobsters,games,Game Design,PuzzleScript - an open-source HTML5 puzzle game engine,https://www.puzzlescript.net/
493,Lobsters,games,Game Design,Play a puzzle game for research,https://twitter.com/chrisamaphone/status/1030133818529927168
494,Lobsters,games,Game Design,EXAPUNKS - new programming game from Zachtronics,http://www.zachtronics.com/exapunks/
495,Lobsters,games,Game Design,The Total Beginner's Guide to Game AI,https://www.gamedev.net/articles/programming/artificial-intelligence/the-total-beginners-guide-to-game-ai-r4942/
496,Lobsters,games,Game Design,Monte Carlo Methods for the Game Kingdomino,https://zayenz.se/blog/post/kingdomino-cig2018-paper/
497,Lobsters,games,Game Design,Fast Sudoku Solver in Haskell #3: Picking the Right Data Structures,https://abhinavsarkar.net/posts/fast-sudoku-solver-in-haskell-3/
498,Lobsters,games,Game Design,Scroll Back: The Theory and Practice of Cameras in Side-Scrollers (2015),https://gamasutra.com/blogs/ItayKeren/20150511/243083/Scroll_Back_The_Theory_and_Practice_of_Cameras_in_SideScrollers.php
499,Lobsters,games,Game Design,Hobby Computer Culture and the Non-entertainment Uses of Homebrew Games in the 1980s Czechoslovakia,http://gamestudies.org/1302/articles/svelch
500,Lobsters,games,Game Design,What Men and Women Consider Hardcore Gaming Are Not The Same,https://quanticfoundry.com/2018/08/01/casual-hardcore/
501,Lobsters,games,Game Design,Let's Make A HyperCard RPG Part 3: Triggers With HyperTalk Metaprogramming,https://www.youtube.com/watch?v=PkS49BR1nAw
502,Lobsters,games,Game Design,History of the BASIC Engine,https://basicengine.org/history.html
503,Lobsters,games,Game Design,How did you get it to run on a gameboy?,http://20dollarlolita.tumblr.com/post/176285106968/the-actual-storys-so-much-cooler-than-that-i
504,Lobsters,games,Game Design,BASIC Engine,https://basicengine.org/
505,Lobsters,games,Game Design,Hackers Are Preserving Gaming History,https://www.gameinformer.com/2018/08/01/how-hackers-are-preserving-gaming-history 
506,Lobsters,games,Game Design,Museum of ZZT,https://museumofzzt.com/
507,Lobsters,games,Game Design,Bootable CD + retro game in a tweet,https://www.quaxio.com/bootable_cd_retro_game_tweet/
508,Lobsters,games,Game Design,Non-Photorealistic Quake,https://research.cs.wisc.edu/graphics/Gallery/NPRQuake/whatIsIt.html
509,Lobsters,games,Game Design,"Boobs, Muscles & Fairy Wings: Everything I Know About How Humans Design Their Avatar Selves",https://hunterwalk.com/2018/07/23/boobs-muscles-fairy-wings-everything-i-know-about-how-humans-design-their-avatar-selves/
510,Lobsters,games,Game Design,Nintendo Sues Console ROM Sites For 'Mass' Copyright Infringement (Update),https://torrentfreak.com/nintendo-sues-console-rom-sites-for-mass-copyright-infringement-180720/
511,Lobsters,games,Game Design,1500 Archers on a 28.8: Network Programming in Age of Empires and Beyond,https://www.gamasutra.com/view/feature/131503/1500_archers_on_a_288_network_.php?print=1
512,Lobsters,games,Game Design,Riot's Approach to Anti-Cheat,https://engineering.riotgames.com/news/riots-approach-anti-cheat
513,Lobsters,games,Game Design,"Is Difficulty Overrated? Choice, Novelty and Suspense in Educational Games",https://www.researchgate.net/publication/313477156_Is_Difficulty_Overrated_The_Effects_of_Choice_Novelty_and_Suspense_on_Intrinsic_Motivation_in_Educational_Games
514,Lobsters,games,Game Design,Cheezball Rising: Maps and sprites,https://eev.ee/blog/2018/07/15/cheezball-rising-maps-and-sprites/
515,Lobsters,games,Game Design,"All this time, Aliens: Colonial Marines' stupid AI may have been caused by a single typo",https://www.pcgamer.com/all-this-time-aliens-colonial-marines-stupid-ai-may-have-been-caused-by-a-single-typo/
516,Lobsters,games,Game Design,Cheezball Rising: Spring cleaning,https://eev.ee/blog/2018/07/13/cheezball-rising-spring-cleaning/
517,Lobsters,games,Game Design,"Atari Vax Mail, Memos and Status Reports: 1982-1992",http://www.jmargolin.com/vmail/vmail.htm
518,Lobsters,games,Game Design,Solving Rush Hour (the puzzle),https://www.michaelfogleman.com/rush/
519,Lobsters,games,Game Design,Fast Sudoku Solver in Haskell #2: A 200x Faster Solution,https://abhinavsarkar.net/posts/fast-sudoku-solver-in-haskell-2/
520,Lobsters,games,Game Design,BloogBot,https://drewkestell.us/
521,Lobsters,games,Game Design,"Cheezball Rising: Main loop, input, and a game",https://eev.ee/blog/2018/07/05/cheezball-rising-main-loop-input-and-a-game/
522,Lobsters,games,Game Design,Armok Web Services: play Dwarf Fortress with others in your browser,https://github.com/numinit/armokweb
523,Lobsters,games,Game Design,"The Great Debian Init Debate, in Ace Attorney Format",http://aaonline.fr/search.php?search&criteria[sequenceId-is]=6512_en_Debian%20init%20case
524,Lobsters,games,Game Design,How a Diablo expansion led to behind the scenes trouble,https://www.polygon.com/features/2018/6/29/17517376/diablo-hellfire-expansion-behind-the-scenes-trouble
525,Lobsters,games,Game Design,Citybound,http://cityboundsim.com/
526,Lobsters,games,Game Design,The Influence of the UNIX® Operating System on the Development of Two Video Games.,http://www.langston.com/Papers/vidgam.pdf
527,Lobsters,games,Game Design,Fast Sudoku Solver in Haskell #1: A Simple Solution,https://abhinavsarkar.net/posts/fast-sudoku-solver-in-haskell-1/
528,Lobsters,games,Game Design,Robot Odyssey Rewired,https://www.robotodyssey.online/
529,Lobsters,games,Game Design,Making a tale tick: The making of Tick's Tales,http://www.tickstales.com/dev-blog/2015/11/16/making-a-tale-tick-the-making-of-ticks-tales-part-1
530,Lobsters,games,Game Design,Writing Indivisible's Story,http://www.indivisiblegame.com/2018/06/28/writing-indivisibles-story/
531,Lobsters,games,Game Design,How Clojure is used at King to write a game engine editor,https://techblog.king.com/how-we-use-clojure-at-king-to-write-a-game-engine-editor/
532,Lobsters,games,Game Design,A Small Look into the GameCube’s Copy Filter,https://ppltoast.wordpress.com/2018/05/11/a-small-look-into-the-gamecubes-copy-filter/
533,Lobsters,games,Game Design,"The Story of NESticle, the Ambitious Emulator That Redefined Retro Gaming",https://motherboard.vice.com/en_us/article/9a48z3/the-story-of-nesticle-the-ambitious-emulator-that-redefined-retro-gaming
534,Lobsters,games,Game Design,Rush Hour - Puzzle Solver & Generator,https://github.com/fogleman/rush
535,Lobsters,games,Game Design,OpenAI Five,https://blog.openai.com/openai-five/
536,Lobsters,games,Game Design,"The creation of Missile Command and the haunting of its creator, Dave Theurer",https://www.polygon.com/features/2013/8/15/4528228/missile-command-dave-theurer
537,Lobsters,games,Game Design,10 years of internal Atari emails [1982 - 1992],http://www.textfiles.com/games/ATARIMAIL/
538,Lobsters,games,Game Design,Ray Tracing in Games with NVIDIA RTX,https://devblogs.nvidia.com/ray-tracing-games-nvidia-rtx/
539,Lobsters,games,Game Design,Cheezball Rising: A new Game Boy Color game,https://eev.ee/blog/2018/06/19/cheezball-rising-a-new-game-boy-color-game/
540,Lobsters,games,Game Design,GitHub for Unity,https://blog.github.com/2018-06-18-announcing-github-for-unity-1.0/
541,Lobsters,games,Game Design,Diablo devolved - magic behind the 1996 computer game,https://github.com/galaxyhaxz/devilution
542,Lobsters,games,Game Design,Dev Watercooler: World of Warcraft Classic,https://worldofwarcraft.com/en-us/news/21881587/dev-watercooler-world-of-warcraft-classic
543,Lobsters,games,Game Design,My Lisp Journey #1: Getting Started With trivial-gamekit,https://lthms.xyz/blog/lisp-journey-getting-started
544,Lobsters,games,Game Design,Roguelike Celebration 2018 is coming!,https://blog.roguetemple.com/2018/06/09/roguelike-celebration-2018-is-coming/
545,Lobsters,games,Game Design,Another World,https://www.filfre.net/2018/06/another-world/
546,Lobsters,games,Game Design,Designing apps for the E-Ink Kindle,https://kevinlynagh.com/kindle-games/
547,Lobsters,games,Game Design,Armory 3D game engine for Blender version 0.4 is released,http://forums.armory3d.org/t/armory-0-4-is-out-and-free/1109
548,Lobsters,games,Game Design,Reverse engineering Animal Crossing’s developer mode,https://jamchamb.github.io/2018/06/09/animal-crossing-developer-mode.html
549,Lobsters,games,Game Design,Friday Facts #246 - The GUI update (Part 3),https://www.factorio.com/blog/post/fff-246
550,Lobsters,games,Game Design,Building an AI Sensory System: Examining The Design of Thief: The Dark Project,https://www.gamasutra.com/view/feature/131297/building_an_ai_sensory_system_.php
551,Lobsters,games,Game Design,The Incredible Machine,https://www.filfre.net/2018/06/the-incredible-machine/
552,Lobsters,games,Game Design,Godot's new animation editor,https://godotengine.org/article/godot-gets-brand-new-animation-editor-cinematic-support
553,Lobsters,games,Game Design,"Getting Started with the New Unity Entity Component, C# Job System, and Burst Compiler",https://software.intel.com/en-us/articles/getting-started-with-the-new-unity-entity-component-c-job-system-and-burst-compiler
554,Lobsters,games,Game Design,The great video game exodus,https://www.gamasutra.com/view/news/318588/The_great_video_game_exodus.php
555,Lobsters,games,Game Design,Reverse emulating the NES,https://www.youtube.com/watch?v=ar9WRwCiSr0
556,Lobsters,games,Game Design,The Secret of Monkey Island,https://www.youtube.com/watch?v=9F9ahZQ7oP0
557,Lobsters,games,Game Design,A Video Game By Any Other Name,https://gamehistory.org/a-video-game-by-any-other-name/
558,Lobsters,games,Game Design,The combat design of DOOM,http://www.gamasutra.com/view/news/318505/Video_The_combat_design_of_DOOM.php
559,Lobsters,games,Game Design,Designing Highly Replayable Stealth Levels for Payday 2,http://www.gamasutra.com/blogs/JasonMojica/20180525/318720/Designing_Highly_Replayable_Stealth_Levels_for_Payday_2.php
560,Lobsters,games,Game Design,Why did I spend 1.5 months creating a Gameboy emulator?,http://blog.rekawek.eu/2017/02/09/coffee-gb/
561,Lobsters,games,Game Design,CIA made Magic - The Gathering like card game,https://www.theverge.com/2018/5/21/17374054/cia-collect-it-all-declassified-training-tabletop-card-game
562,Lobsters,games,Game Design,Meta Crush Saga: a C++17 compile-time game,https://jguegant.github.io//jguegant.github.io/blogs/tech/meta-crush-saga.html
563,Lobsters,games,Game Design,Microsoft’s new Xbox controller is designed entirely for players with disabilities,https://www.polygon.com/2018/5/17/17363528/xbox-adaptive-controller-disability-accessible
564,Lobsters,games,Game Design,Designing the politics of virtual worlds,https://improbable.io/games/blog/klang-games-on-designing-the-politics-of-virtual-worlds-with-professor-lawrence-lessig
565,Lobsters,games,Game Design,Typeracer CLI,https://www.producthunt.com/posts/typeracer-cli
566,Lobsters,games,Game Design,DEF CON 26 Hack for Satan Badge Art Challenge Writeup,https://medium.com/@0x4a454646/def-con-26-hack-for-satan-badge-art-challenge-writeup-de66804c6abf
567,Lobsters,games,Game Design,My Steve Jobs stories,https://www.facebook.com/permalink.php?story_fbid=2146412825593223&id=100006735798590
568,Lobsters,games,Game Design,Jelly Mario by @schteppe,http://jellymar.io/
569,Lobsters,games,Game Design,in which a game jam is recounted,https://technomancy.us/187
570,Lobsters,games,Game Design,Impact HTML 5 game engine open sourced,https://github.com/phoboslab/impact
571,Lobsters,games,Game Design,Game hacking reinvented? – A cod exploit,https://momo5502.com/blog/?p=34
572,Lobsters,games,Game Design,"Dolphin Feature Article - ""The Legend of Dolphin: A Lens Between Worlds""",https://dolphin-emu.org/blog/2018/05/02/legend-dolphin-lens-between-worlds/
573,Lobsters,games,Game Design,"MrWint's TAS video of GBC Pokémon: Yellow Version, ""Arbitrary Code Execution""",http://tasvideos.org/5384S.html
