ID,Source,Tag_Code,Tag_Name,Title,Url
748,Lobsters,games,Game Design,Classic Nintendo Games are (NP-)Hard,https://pdfs.semanticscholar.org/b356/38141f0b9bfeeef18966f68f2321bf6a8ecd.pdf
749,Lobsters,games,Game Design,Deep Reinforcement Learning: Pong from Pixels,http://karpathy.github.io/2016/05/31/rl/
750,Lobsters,games,Game Design,UI Design in NieR:Automata,https://www.platinumgames.com/official-blog/article/9624?age-verified=80e09dd862
751,Lobsters,games,Game Design,Do We Need a Soulslike Genre?,https://www.youtube.com/watch?v=Lx7BWayWu08
752,Lobsters,games,Game Design,Game Development Using Design-by-Contract (2006),http://www.jot.fm/issues/issue_2006_09/article3/
753,Lobsters,games,Game Design,City of the Damned,https://github.com/gwathlobal/CotD
754,Lobsters,games,Game Design,The Enduring Legacy of Zork,https://www.technologyreview.com/s/608670/the-enduring-legacy-of-zork/
755,Lobsters,games,Game Design,Lessons learnt from hunting jitter issues,https://github.com/huwb/jitternator
756,Lobsters,games,Game Design,"""YAT"" is a better genre name than ""Immersive Sim"" (2012)",http://willhubbell.blogspot.com/2012/12/yat-is-better-genre-name-than-immersive.html
757,Lobsters,games,Game Design,Why PS4 downloads are so slow,https://www.snellman.net/blog/archive/2017-08-19-slow-ps4-downloads/
758,Lobsters,games,Game Design,Early History of Core War,http://corewar.co.uk/earlycw.htm
759,Lobsters,games,Game Design,Dwarf Fortress starting during apt-get upgrade,https://askubuntu.com/questions/938606/dwarf-fortress-starting-during-apt-get-upgrade
760,Lobsters,games,Game Design,Fairness in Man vs. Machine Competitions,http://fuzyll.com///2017/fairness-in-man-vs-machine-competitions/
761,Lobsters,games,Game Design,The BFG FAQ,http://www.gamers.org/docs/FAQ/bfgfaq/
762,Lobsters,games,Game Design,WaveFunctionCollapse is Constraint Solving in the Wild,http://isaackarth.com/papers/wfc_is_constraint_solving_in_the_wild/
763,Lobsters,games,Game Design,How to Program an NES game in C,https://nesdoug.com/
764,Lobsters,games,Game Design,Nintendo Being Sued by Gamevice Over Alleged Patent Violation by Switch Controllers,http://www.dualshockers.com/nintendo-sued-gamevice-alleged-patent-violation-switch-controllers/
765,Lobsters,games,Game Design,Nesflix (2015),http://blogofsomeguy.com/a/2015-03-22/nesflix.html
766,Lobsters,games,Game Design,Game Models – A Different Approach,http://www.npruehs.de/game-models-a-different-approach-part-2/
767,Lobsters,games,Game Design,DeepMind and Blizzard open StarCraft II as an AI research environment,https://deepmind.com/blog/deepmind-and-blizzard-open-starcraft-ii-ai-research-environment/
768,Lobsters,games,Game Design,Improved Culling for Tiled and Clustered Rendering in Call of Duty: Infinite Warfare,https://research.activision.com/t5/Research-Papers/Improved-Culling-for-Tiled-and-Clustered-Rendering-in-Call-of/ba-p/10338514
769,Lobsters,games,Game Design,Adventures in Emoji,https://ianrenton.com/blog/adventures-in-emoji/
770,Lobsters,games,Game Design,CiF-CK: An Architecture for Social NPCs in Commercial Games,https://www.visualnarrative.ncsu.edu/wp-content/uploads/sites/16/2017/08/GSJ_IEEECIG_2017_CIFCK.pdf
771,Lobsters,games,Game Design,3 Simple Steps to Implement Inverse Kinematics,http://gamasutra.com/blogs/LuisBermudez/20170804/303066/3_Simple_Steps_to_Implement_Inverse_Kinematics.php
772,Lobsters,games,Game Design,Why we should all support glTF 2.0 as THE standard asset exchange format for game engines,https://godotengine.org/article/we-should-all-use-gltf-20-export-3d-assets-game-engines
773,Lobsters,games,Game Design,Prompto's Facebook: How a Buddy-AI Auto-Snapshots Your Adventure in FFXV,https://www.youtube.com/watch?v=ictRlPZQCZI
774,Lobsters,games,Game Design,RESTful DOOM,http://1amstudios.com/2017/08/01/restful-doom/
775,Lobsters,games,Game Design,Datamining Pokémon,https://eev.ee/blog/2017/08/02/datamining-pokemon/
776,Lobsters,games,Game Design,Developing Games With Ruby,https://leanpub.com/developing-games-with-ruby/read
777,Lobsters,games,Game Design,Tracking and Managing Processes on Windows,https://blog.rainway.io/tracking-and-managing-processes-on-windows-be9d95602b54
778,Lobsters,games,Game Design,RCE in Factorio,https://security.gerhardt.link/RCE-in-Factorio/
779,Lobsters,games,Game Design,Icculus (Ryan Gordon) Tells Us Everything – Part 1,http://boilingsteam.com/icculus-ryan-gordon-tells-us-everything-part-1/
780,Lobsters,games,Game Design,Ever get remote code execution by fragging a player?,https://oneupsecurity.com/research/remote-code-execution-in-source-games?t=r
781,Lobsters,games,Game Design,Ratings and Champion Skill,https://www.thebettermeta.com/posts/2017/07/20/ratings/
782,Lobsters,games,Game Design,Carol Shaw Donates Collection to The Strong,http://www.vintagecomputing.com/index.php/archives/1701/carol-shaw-donates-collection-to-the-strong
783,Lobsters,games,Game Design,The Next Generation of Web Gaming,https://hacks.mozilla.org/2017/07/the-next-generation-of-web-gaming/
784,Lobsters,games,Game Design,"Coding ""Snake"" in 4 min 30 sec (plain browser JavaScript)",https://www.youtube.com/watch?v=xGmXxpIj6vs
785,Lobsters,games,Game Design,How Checkers Was Solved,https://www.theatlantic.com/technology/archive/2017/07/marion-tinsley-checkers/534111/
786,Lobsters,games,Game Design,Game UI Patterns - UI Design Solutions for Video Game Development.,http://www.gameuipatterns.com/
787,Lobsters,games,Game Design,"30 years of Final Fantasy: a cult of devotion, and the music still soars",https://www.theguardian.com/technology/2017/jul/13/30-years-of-final-fantasy-a-cult-of-devotion-and-the-music-still-soars
788,Lobsters,games,Game Design,Running a kickstarter for your indie video game,https://www.betonyourself.com/podcast/chris-parsons
789,Lobsters,games,Game Design,"Pterodactyl/Panel -- free, open-source, game agnostic, self-hosted control panel for game servers",https://github.com/Pterodactyl/Panel
790,Lobsters,games,Game Design,OHRRPGCE: Official Hamster Republic Role Playing Game Construction Engine,http://rpg.hamsterrepublic.com/ohrrpgce/Main_Page
791,Lobsters,games,Game Design,How I Managed to Design the Most Successful Educational Computer Game of All Time,https://medium.com/the-philipendium/how-i-managed-to-design-the-most-successful-educational-computer-game-of-all-time-4626ea09e184
792,Lobsters,games,Game Design,Wikipedia: The Text Adventure,http://kevan.org/wikitext/
793,Lobsters,games,Game Design,Game Development and Application Development Best Practices - Not As Different As You Might Think,http://benlakey.com/2017/07/03/game-development-not-as-different/
794,Lobsters,games,Game Design,Some memorable levels,https://eev.ee/blog/2017/07/01/some-memorable-levels/
795,Lobsters,games,Game Design,An easter egg for one user: Luke Skywalker,http://einaregilsson.com/an-easter-egg-for-one-user-luke-skywalker/
796,Lobsters,games,Game Design,PICO-8 Fictional Console Lighting,https://hackernoon.com/pico-8-lighting-part-1-thin-dark-line-8ea15d21fed7
797,Lobsters,games,Game Design,The Early Days of Id Software - John Romero @ WeAreDevelopers Conference 2017,https://www.youtube.com/watch?v=KFziBfvAFnM
798,Lobsters,games,Game Design,Encounter Editor | Interactive Storytelling Tools for Writers,http://www.erasmatazz.com/library/software/encounter-editor.html
799,Lobsters,games,Game Design,Divide and conquer: How Microsoft researchers used AI to master Ms. Pac-Man,https://blogs.microsoft.com/next/2017/06/14/divide-conquer-microsoft-researchers-used-ai-master-ms-pac-man
800,Lobsters,games,Game Design,The Psychology Behind Video Game Sounds (Part I and II),https://www.youtube.com/watch?v=jlLPbLdHAJ0
801,Lobsters,games,Game Design,A cross platform game in ~100% Scheme,https://www.reddit.com/r/scheme/comments/6hng3q/i_developed_a_medium_sized_cross_platform/
802,Lobsters,games,Game Design,BORDERLANDS 3 Tech Demo GDC 2017,https://www.youtube.com/watch?v=nWZh0DyA_4c
803,Lobsters,games,Game Design,Improve Inventory-Aware Pathfinding with Map Preprocessing,http://www.gamasutra.com/blogs/DavideAversa/20170612/299814/Improve_InventoryAware_Pathfinding_with_Map_Preprocessing.php
804,Lobsters,games,Game Design,The Story Behind Mass Effect: Andromeda's Troubled Five-Year Development,http://kotaku.com/the-story-behind-mass-effect-andromedas-troubled-five-1795886428
805,Lobsters,games,Game Design,Gameboy DMA,https://exez.in/gameboy-dma
806,Lobsters,games,Game Design,Reconstructing Cave Story,https://www.youtube.com/watch?v=IufkC1IRY2Q&list=PL006xsVEsbKjSKBmLu1clo85yLrwjY67X
807,Lobsters,games,Game Design,Strategy headroom in roguelikes (2014),http://nethack4.org/blog/strategy-headroom.html
808,Lobsters,games,Game Design,4D Toys: a box of four-dimensional toys,http://marctenbosch.com/news/2017/06/4d-toys-a-box-of-four-dimensional-toys/
809,Lobsters,games,Game Design,Prolog-based reasoning layer for counter-strike agents (2012),http://ceur-ws.org/Vol-928/0170.pdf
810,Lobsters,games,Game Design,Learning ZIL (1989),http://xlisp.org/zil.pdf
811,Lobsters,games,Game Design,Jailbreaking Super Mario World to Install a Hex Editor & Mod Loader,https://www.youtube.com/watch?v=Ixu8tn__91E
812,Lobsters,games,Game Design,Eric S. Raymond / open-adventure,https://gitlab.com/esr/open-adventure
813,Lobsters,games,Game Design,Artificial intelligence in real-time strategy games,http://hevi.info/tag/artificial-intelligence-in-real-time-strategy-games/
814,Lobsters,games,Game Design,Not playing around: Lessons from indie game developers,https://opensource.com/article/17/5/what-foss-can-learn-indie-game-development
815,Lobsters,games,Game Design,Evolving Maps for Match Balancing in First Person Shooters,http://storage.kghost.de/cig_proc/full/paper_77.pdf
816,Lobsters,games,Game Design,"A complete guide to 3DS custom firmware, from stock to boot9strap",https://3ds.guide/
817,Lobsters,games,Game Design,Where do we find convolutions in games?,https://www.tetracasa.com/posts/2017/05/12/where-do-we-find-convolution-in-games.html
818,Lobsters,games,Game Design,World Record Progression: Super Mario Bros 3 any%,https://www.youtube.com/watch?v=sllAIF99h3s
819,Lobsters,games,Game Design,How Basic is Basic Gaming Literacy?,http://www.ultimaratioregum.co.uk/game/2017/05/17/how-basic-is-basic-gaming-literacy/
820,Lobsters,games,Game Design,Flexbox Froggy,https://flexboxfroggy.com/
821,Lobsters,games,Game Design,The Quake III Arena Bot,http://www.kbs.twi.tudelft.nl/docs/MSc/2001/Waveren_Jean-Paul_van/thesis.pdf
822,Lobsters,games,Game Design,"The View from the Trenches (or, Some Deadly Sins of CRPG Design)",http://www.filfre.net/2017/05/the-view-from-the-trenches-or-some-deadly-sins-of-crpg-design/
823,Lobsters,games,Game Design,District: A Game About Representation & Redistricting,http://polytrope.com/district/
824,Lobsters,games,Game Design,Do less work with the dot product,https://www.tetracasa.com/posts/2017/05/07/do-less-work-with-the-dot-product.html
825,Lobsters,games,Game Design,I Made a Game in Rust,https://michaelfairley.com/blog/i-made-a-game-in-rust/
826,Lobsters,games,Game Design,Making navigation work in adventure games,http://gameshelf.jmac.org/2017/05/making-navigation-work/
827,Lobsters,games,Game Design,The role of the servers behind multiplayer games,http://www.cakesolutions.net/teamblogs/how-does-multiplayer-game-sync-their-state-part-2
828,Lobsters,games,Game Design,Reliable Ordered Messages,http://gafferongames.com/building-a-game-network-protocol/reliable-ordered-messages/
829,Lobsters,games,Game Design,"""Dynamic porting"" of Dying Light for Linux/SteamOS",https://www.youtube.com/watch?v=ZFdgOBniQB4
830,Lobsters,games,Game Design,Scaling Dedicated Game Servers with Kubernetes: Part 1: Containerising and Deploying,http://www.gamasutra.com/blogs/MarkMandel/20170502/297222/Scaling_Dedicated_Game_Servers_with_Kubernetes_Part_1__Containerising_and_Deploying.php
831,Lobsters,games,Game Design,PLEASE REMAIN CALM: Solving the Owl Sector ARG,https://fatebringer.net/please-remain-calm/
832,Lobsters,games,Game Design,Deriving Quests from Open World Mechanics,https://arxiv.org/abs/1705.00341
833,Lobsters,games,Game Design,Emulate the emulators: A visual history of NESticle (2012),http://metopal.com/2012/03/15/emulate-the-emulators/
834,Lobsters,games,Game Design,Phase-Functioned Neural Networks for Character Control,http://theorangeduck.com/page/phase-functioned-neural-networks-character-control
835,Lobsters,games,Game Design,Simon Tatham's Portable Puzzle Collection,http://www.chiark.greenend.org.uk/~sgtatham/puzzles/
836,Lobsters,games,Game Design,Electromechanical Lunar Lander,http://www.chrisfenton.com/electromechanical-lunar-lander/
837,Lobsters,games,Game Design,Post Mortem of Ludum Dare 38 and Bullet Surfing · Andy Rambles,http://www.andy-rambles.com/post/LD38-one-week-later/
838,Lobsters,games,Game Design,Kirby’s Development Secrets,http://sourcegaming.info/2017/04/19/kirbys-development-secrets/
839,Lobsters,games,Game Design,Video Games Are Better Without Stories,https://www.theatlantic.com/technology/archive/2017/04/video-games-stories/524148/
840,Lobsters,games,Game Design,mintyPi 2.0,http://www.sudomod.com/mintypi-2-0/
841,Lobsters,games,Game Design,XProger/OpenLara -- Tomb Raider Emcscripten port,https://github.com/XProger/OpenLara
842,Lobsters,games,Game Design,Adventure Games and Eigenvalues,http://www.evanmiller.org/adventure-games-and-eigenvalues.html
843,Lobsters,games,Game Design,Office Space: The Dos and Don'ts of Game Development Workplace Design,https://www.youtube.com/watch?v=hBcVpRFRIqQ
844,Lobsters,games,Game Design,Puerto Rico Evolver: Improved,http://www.tropiceuro.com/puerto-rico-evolver/
845,Lobsters,games,Game Design,Gaming with Elixir: discovering new lands in the BEAM realm,https://medium.com/@unbalancedparen/gaming-with-elixir-discovering-new-lands-in-the-beam-realm-c7c04c51acce
846,Lobsters,games,Game Design,Reading game frames in Python with OpenCV - Python Plays GTA V,https://pythonprogramming.net/game-frames-open-cv-python-plays-gta-v/
847,Lobsters,games,Game Design,"The History of Computer Role Playing Games, final preview",https://crpgbook.wordpress.com/2017/04/10/update-17-the-final-preview/
848,Lobsters,games,Game Design,The [Street Fighter 2] AI Engine,https://sf2platinum.wordpress.com/2017/01/20/the-ai-engine/
849,Lobsters,games,Game Design,StarCraft 1.18 Release,https://us.battle.net/forums/en/starcraft/topic/20754425295
850,Lobsters,games,Game Design,The Day of The Tentacle: Dependency Graph Analysis,http://thewebsiteisdown.com/twidblog/day-of-the-tentacle-dependency-graph/
851,Lobsters,games,Game Design,"Nintaco: a cycle-accurate, programmable NES emulator with rewinding and API",http://nintaco.com/faq.html
852,Lobsters,games,Game Design,SCUMM-8 (point & click engine in PICO-8),http://www.lexaloffle.com/bbs/?tid=29176
853,Lobsters,games,Game Design,dungeonfs: A FUSE filesystem and dungeon crawling adventure game engine,https://github.com/ChrisRx/dungeonfs
854,Lobsters,games,Game Design,The Curse of Cow Clicker: How a Cheeky Satire Became a Videogame Hit (2011),https://www.wired.com/2011/12/ff_cowclicker/
855,Lobsters,games,Game Design,A Small Template For 5e D&D Material,https://github.com/evanbergeron/DND-5e-LaTeX-Template
856,Lobsters,games,Game Design,Everything I Said Was Wrong: Why Indie Is Different Now,https://www.youtube.com/watch?v=miwrDpbb25Q
857,Lobsters,games,Game Design,"Choice Architecture, Player Expression, and Narrative Design in Fallout: New Vegas",https://www.youtube.com/watch?v=LR4OxNfzTvU
858,Lobsters,games,Game Design,"Chess AI, Old School",http://hackaday.com/2017/04/03/chess-ai-old-school/
859,Lobsters,games,Game Design,Conquering digital worlds in Scottish Gaelic,https://medium.com/r12n/conquering-digital-worlds-in-scottish-gaelic-3eeef9f3aade
860,Lobsters,games,Game Design,Internet scavenger hunt III,https://nixers.net/showthread.php?tid=2074
861,Lobsters,games,Game Design,Playing roguelikes when you can’t see,https://www.rockpapershotgun.com/2017/04/05/playing-roguelikes-when-you-cant-see/
862,Lobsters,games,Game Design,"Emulators, Immutability, and Time Travel - Angus Fletcher",https://www.youtube.com/watch?v=fiK0SmaqN20
863,Lobsters,games,Game Design,RoboZZle online puzzle game,http://www.robozzle.com/js/index.aspx
864,Lobsters,games,Game Design,Killzone's AI: dynamic procedural combat tactics,http://www.cgf-ai.com/docs/straatman_remco_killzone_ai.pdf
865,Lobsters,games,Game Design,A Journey Into Capcom's CPS2 Silicon - Part 1,http://arcadehacker.blogspot.com/2017/03/a-journey-into-capcoms-cps2-silicon.html
866,Lobsters,games,Game Design,Why F.E.A.R.’s AI is still the best in first-person shooters,https://www.rockpapershotgun.com/2017/04/03/why-fears-ai-is-still-the-best-in-first-person-shooters/
867,Lobsters,games,Game Design,Oscilloscope pong for 1 or 2 players,http://www.eevblog.com/forum/projects/oscilloscope-pong-for-1-or-2-players/
868,Lobsters,games,Game Design,Save Yourself: Game History is in Your Hands,http://gdcvault.com/play/1023959/Save-Yourself-Game-History-is
869,Lobsters,games,Game Design,Simple chess AI — Step by step,https://medium.com/@lhartikk/simple-chess-ai-step-by-step-1d55a9266977
870,Lobsters,games,Game Design,Thirteen Years of Bad Game Code,http://etodd.io/2017/03/29/thirteen-years-of-bad-game-code/
871,Lobsters,games,Game Design,Recompiling the Lost Vikings,https://ryiron.wordpress.com/2017/03/26/recompiling-the-lost-vikings/
872,Lobsters,games,Game Design,Mega Man for TempleOS,https://github.com/tramplersheikhs/megaman
873,Lobsters,games,Game Design,Why LÖVE?,https://eev.ee/blog/2017/03/23/why-love/
874,Lobsters,games,Game Design,Chasing the First Arcade Easter Egg,https://edfries.wordpress.com/2017/03/22/chasing-the-first-arcade-easter-egg/
875,Lobsters,games,Game Design,Microsoft Excel: Revolutionary 3D Game Engine?,http://www.gamasutra.com/view/feature/131968/microsoft_excel_revolutionary_3d_.php
876,Lobsters,games,Game Design,Hacking Final Fantasy 1 on the NES,http://www.walknsqualk.com/post/hacking-final-fantasy-1-on-nes/
877,Lobsters,games,Game Design,Analyzing the 2016 World Chess Championship,https://medium.com/pachyderm-data/analyzing-the-2016-world-chess-championship-b823d0d2fd11
878,Lobsters,games,Game Design,An Insider Look into the World of Competitive Bullet Hells,https://waypoint.vice.com/en_us/article/an-insider-look-into-the-world-of-competitive-bullet-hells
879,Lobsters,games,Game Design,Using contrast to affect visibility,http://ben304.blogspot.com/2017/03/using-contrast-to-affect-visibility.html
880,Lobsters,games,Game Design,Breaking Conventions with The Legend of Zelda: Breath of the Wild,https://www.youtube.com/watch?v=QyMsF31NdNc
881,Lobsters,games,Game Design,Dwarf Fortress creator Tarn Adams talks about simulating the most complex magic system ever,http://www.pcgamer.com/dwarf-fortress-creator-tarn-adams-talks-about-simulating-the-most-complex-magic-system-ever/
882,Lobsters,games,Game Design,Proof of Purchase: Dolphin Emulator has Wii Shop support,https://dolphin-emu.org/blog/2017/03/16/proof-of-purchase/
883,Lobsters,games,Game Design,Walking the interface list,https://aixxe.net/2017/03/walking-interface-list
884,Lobsters,games,Game Design,Particle Systems From the Ground Up (2012),http://buildnewgames.com/particle-systems
885,Lobsters,games,Game Design,G3N - Go 3D Game Engine,https://github.com/g3n/engine
886,Lobsters,games,Game Design,Full Throttle Scenery Studies,http://ben304.blogspot.com/2017/03/full-throttle-scenery-studies.html
887,Lobsters,games,Game Design,"This Isn't An Operating System, It's An RPG",http://kotaku.com/this-rpg-is-based-on-an-operating-system-1793059177
888,Lobsters,games,Game Design,"Ron Gilbert: ""From Maniac Mansion to Thimbleweed Park""",https://www.youtube.com/watch?v=KgzWorfLjeE
889,Lobsters,games,Game Design,The Nintendo Entertainment System's Loading Seam,https://www.youtube.com/watch?v=wfrNnwJrujw
890,Lobsters,games,Game Design,Doom Bots in TensorFlow,http://tech.marksblogg.com/tensorflow-vizdoom-bots.html
891,Lobsters,games,Game Design,Snakisms,https://pippinbarr.github.io/SNAKISMS/
892,Lobsters,games,Game Design,Writing a Game Engine in 2017,http://www.randygaul.net/2017/02/24/writing-a-game-engine-in-2017/
893,Lobsters,games,Game Design,The Case for Composite,http://nerdlypleasures.blogspot.com/2015/03/the-case-for-composite.html
894,Lobsters,games,Game Design,GPU Performance for Game Artists,http://fragmentbuffer.com/gpu-performance-for-game-artists/
895,Lobsters,games,Game Design,Introducing GitHub for Unity,https://github.com/blog/2329-introducing-github-for-unity
896,Lobsters,games,Game Design,Nintendo Switch Teardown,https://www.fictiv.com/blog/posts/nintendo-switch-teardown
897,Lobsters,games,Game Design,An Oral History of Nintendo's Power Glove,http://mentalfloss.com/article/91939/losing-their-grip-oral-history-nintendos-power-glove
898,Lobsters,games,Game Design,Dolphin Progress Report: February 2017,https://dolphin-emu.org/blog/2017/03/01/dolphin-progress-report-february-2017/
899,Lobsters,games,Game Design,Web Games Platform: Newest Developments,https://hacks.mozilla.org/2017/03/web-games-platform-newest-developments/
900,Lobsters,games,Game Design,Atari 2600 Emulator in Minecraft,https://www.youtube.com/watch?v=5nViIUfDMJg
901,Lobsters,games,Game Design,Beating the World's Best at Super Smash Bros. with Deep Reinforcement Learning,https://arxiv.org/abs/1702.06230
902,Lobsters,games,Game Design,Gaming Needs To Have More Arguments. Here Are Some Topic Suggestions!!!,http://jeff-vogel.blogspot.com/2016/04/gaming-needs-to-have-more-arguments.html
903,Lobsters,games,Game Design,The Use of ASCII Graphics in Roguelikes: Aesthetic Nostalgia and Semiotic Difference,http://www.academia.edu/31504292/The_Use_of_ASCII_Graphics_in_Roguelikes_Aesthetic_Nostalgia_and_Semiotic_Difference
904,Lobsters,games,Game Design,Finding The Lost Vikings – Reversing a Virtual Machine,https://ryiron.wordpress.com/2017/02/01/finding-the-lost-vikings-reversing-a-virtual-machine/
905,Lobsters,games,Game Design,Amit’s Game Programming Information,http://www-cs-students.stanford.edu/~amitp/gameprog.html
906,Lobsters,games,Game Design,A Beginner's Guide to Coding Graphics Shaders,https://gamedevelopment.tutsplus.com/tutorials/a-beginners-guide-to-coding-graphics-shaders--cms-23313
907,Lobsters,games,Game Design,The NeoClassical Habitat Server Project,https://neohabitat.org/
908,Lobsters,games,Game Design,Sleeping beauty - How one of the oldest bugs in EVE got hunted down and resolved,http://community.eveonline.com/news/dev-blogs/sleeping-beauty/
909,Lobsters,games,Game Design,Hello Space - a WebGL physics puzzle,http://hellospace.reaktor.com
910,Lobsters,games,Game Design,Ramsey Nasser on Magic,https://vimeo.com/203271192
911,Lobsters,games,Game Design,"Creating a ""virus"" for Pokemon Red and Blue (self replicating save file!!)",https://www.youtube.com/watch?v=h5Igc18hc2Q
912,Lobsters,games,Game Design,Creating an AI DOOM bot,https://www.codelitt.com/blog/doom-ai/
913,Lobsters,games,Game Design,The Unbeatable Game from the 60s: Dr NIM,https://www.youtube.com/watch?v=9KABcmczPdg
914,Lobsters,games,Game Design,How Lotus 1-2-3 Improved DOS Gaming,https://www.youtube.com/watch?v=zUvsER6l56Q
915,Lobsters,games,Game Design,WhitestormJS 3D Framework for Three.js with ReactJS Integration,https://github.com/WhitestormJS/whitestorm.js
916,Lobsters,games,Game Design,Minesweeper: Advanced Tactics (2005),http://nothings.org/games/minesweeper/
917,Lobsters,games,Game Design,Tales from the Trenches: AI Disaster Stories (GDC talk),https://www.youtube.com/watch?v=__5whYgSTV0
918,Lobsters,games,Game Design,Depth in Strategic Games,http://julian.togelius.com/Lantz2017Depth.pdf
919,Lobsters,games,Game Design,TADS,http://www.filfre.net/2017/02/tads/
920,Lobsters,games,Game Design,The Prototype that was Banned from Halfbrick,https://www.youtube.com/watch?v=t9WMNuyjm4w
921,Lobsters,games,Game Design,Porting Retro City Rampage to MS-DOS: From PS4 to 1.44MB Floppy,https://www.youtube.com/watch?v=kSKeWH4TY9Y
922,Lobsters,games,Game Design,The Founder: A Game About The Dark Side Of Silicon Valley,https://www.fastcodesign.com/3067405/the-founder-a-game-about-the-dark-side-of-silicon-valley
923,Lobsters,games,Game Design,The physics of trains in Assassin's Creed Syndicate,http://www.gamasutra.com/blogs/BartlomiejWaszak/20170130/290322/The_physics_of_trains_in_Assassins_Creed_Syndicate.php
924,Lobsters,games,Game Design,Game design patterns for building friendships,http://www.lostgarden.com/2017/01/game-design-patterns-for-building.html
925,Lobsters,games,Game Design,The Founder: A Dystopian Business Simulator,http://thefounder.biz/
926,Lobsters,games,Game Design,The Steam Controller Configurator's Untapped Power,http://www.gamasutra.com/blogs/LarsDoucet/20170125/289904/The_Steam_Controller_Configurators_Untapped_Power.php
927,Lobsters,games,Game Design,Using Powerpoint to prototype your UI: A Molemen Must Die case study,http://www.gamasutra.com/blogs/MattKelly/20170124/289848/Using_Powerpoint_to_prototype_your_UI_A_Molemen_Must_Die_case_study.php
928,Lobsters,games,Game Design,16000+ screenshots of CRPGs,https://www.flickr.com/photos/crpgbook/albums
929,Lobsters,games,Game Design,Understanding Twitch Chat: New Forms of Digital Community and Play,http://discoversociety.org/2017/01/03/understanding-twitch-chat-new-forms-of-digital-community-and-play/
930,Lobsters,games,Game Design,Death of Adventure Games (2000),http://www.oldmanmurray.com/features/77.html
931,Lobsters,games,Game Design,Five Months of Gamedev with Elm,http://www.markwunsch.com/thinkpiece/2017/01/hive_city_retrospective.html
