ID,Source,Tag_Code,Tag_Name,Title,Url
574,Lobsters,games,Game Design,Zerg Rush: A History of StarCraft AI Research,https://medium.com/@t2thompson/zerg-rush-a-history-of-starcraft-ai-research-4478759a3c53
575,Lobsters,games,Game Design,Inside Nintendo's secretive creative process,https://www.theguardian.com/games/2018/apr/25/nintendo-interview-secret-innovation-lab-ideas-working
576,Lobsters,games,Game Design,The NetHack DevTeam is happy to announce the release of NetHack 3.6.1,https://groups.google.com/forum/#!topic/rec.games.roguelike.nethack/XhcIrLlNzpA
577,Lobsters,games,Game Design,Leela Chess Zero: AlphaZero for the PC,https://en.chessbase.com/post/leela-chess-zero-alphazero-for-the-pc
578,Lobsters,games,Game Design,"""Flappy Bird"" on e-cigarette (eVic-VTC Mini)",https://www.youtube.com/watch?v=KvQ6K8ariWs
579,Lobsters,games,Game Design,"Planning a Morrowind all-faction speedrun with simulated annealing, part 2",https://kimonote.com/@mildbyte/travelling-murderer-problem-planning-a-morrowind-all-faction-speedrun-with-simulated-annealing-part-2-43269/
580,Lobsters,games,Game Design,Rust Case Study: Chucklefish Taps Rust to Bring Safe Concurrency to Video Games,https://www.rust-lang.org/pdfs/Rust-Chucklefish-Whitepaper.pdf
581,Lobsters,games,Game Design,Lag & Blanking - Super Nintendo Entertainment System Features,https://www.youtube.com/watch?v=Q8ph2OVqZeM
582,Lobsters,games,Game Design,Lovecraft on the Tabletop,https://www.filfre.net/2015/09/lovecraft-on-the-tabletop/
583,Lobsters,games,Game Design,SCUMM internals and syntax for the sake of nostalgia,https://monades.roperzh.com/scumm-internals-syntax/
584,Lobsters,games,Game Design,Nekøyume – Blockchain-based Role-Playing Game,https://preview.nekoyu.me/
585,Lobsters,games,Game Design,Some Minesweeper Conﬁgurations,http://web.mat.bham.ac.uk/R.W.Kaye/minesw/minesw.pdf
586,Lobsters,games,Game Design,Porting the Unity Engine to .NET CoreCLR,http://xoofx.com/blog/2018/04/06/porting-unity-to-coreclr/
587,Lobsters,games,Game Design,Confessions of an Unreal Engine 4 Engineering Firefighter,https://allarsblog.com/2018/03/16/confessions-of-an-unreal-engine-4-engineering-firefighter/
588,Lobsters,games,Game Design,NightDiveStudios/shockmac -- System Shock 1 Source Code Released,https://github.com/NightDiveStudios/shockmac
589,Lobsters,games,Game Design,Haskell Roguelike,http://www.andrevdm.com/posts/2018-04-02-haskell-rogue-like.html
590,Lobsters,games,Game Design,Procedural Worlds from Simple Tiles,http://ijdykeman.github.io/ml/2017/10/12/wang-tile-procedural-generation.html
591,Lobsters,games,Game Design,The Mac gaming console time has forgot,https://arstechnica.com/gaming/2018/03/the-mac-gaming-console-time-has-forgot/
592,Lobsters,games,Game Design,The making of Dark Castle,https://www.gamasutra.com/view/news/315720/The_making_of_Dark_Castle_An_excerpt_from_The_Secret_History_of_Mac_Gaming.php
593,Lobsters,games,Game Design,Raytheon - Proof By Games (2013),http://www.dtic.mil/dtic/tr/fulltext/u2/1006449.pdf
594,Lobsters,games,Game Design,The Trust Spectrum,https://www.gamasutra.com/blogs/RaphKoster/20180316/315615/The_Trust_Spectrum.php
595,Lobsters,games,Game Design,Announcing Microsoft DirectX Raytracing,https://blogs.msdn.microsoft.com/directx/2018/03/19/announcing-microsoft-directx-raytracing/
596,Lobsters,games,Game Design,Luxe Engine: A lovingly hand crafted game engine,https://luxeengine.com/
597,Lobsters,games,Game Design,Making a PS2 Emulator: From Bits to Pixels,https://github.com/PSI-Rockin/DobieStation/wiki/Making-a-PS2-Emulator:-From-Bits-to-Pixels
598,Lobsters,games,Game Design,Now you can muck around with the Build engine successor: Build2,https://www.gamasutra.com/view/news/315408/Now_you_can_muck_around_with_the_Build_engine_successor_Build2.php
599,Lobsters,games,Game Design,"Google partners with Ubisoft to launch Agones, an open source game server hosting system",https://techcrunch.com/2018/03/13/google-partners-with-ubisoft-to-launch-agones-an-open-source-game-server-hosting-system/
600,Lobsters,games,Game Design,The Door Problem,https://web.archive.org/web/20180102132636/http://www.lizengland.com/blog/2014/04/the-door-problem/
601,Lobsters,games,Game Design,Super Nintendo Game Maps - SNES Maps,http://www.snesmaps.com/index.html
602,Lobsters,games,Game Design,Roguelike Tutorial in Rust + tcod,https://tomassedovic.github.io/roguelike-tutorial/
603,Lobsters,games,Game Design,So you want to be a video game programmer? – part 5 – The Method,http://all-things-andy-gavin.com/2011/09/11/video-game-programmer-method/
604,Lobsters,games,Game Design,LoveDOS – a reimplementation of LÖVE 2D game engine API for MS-DOS (2017),https://github.com/rxi/lovedos
605,Lobsters,games,Game Design,4-2: The History of Super Mario Bros.' Most Infamous Level,https://www.youtube.com/watch?v=i1AHCaokqhg
606,Lobsters,games,Game Design,Wolfenstein 3D's map renderer,https://www.youtube.com/watch?v=eOCQfxRQ2pY
607,Lobsters,games,Game Design,Deconstructing the water effect in Super Mario Sunshine,http://blog.mecheye.net/2018/03/deconstructing-the-water-effect-in-super-mario-sunshine/
608,Lobsters,games,Game Design,An Efficient Snell's-Law Method for Optimal-Path Planning AcrossMultiple Two-dimensional Irregular Homogeneous-Cost Regions,http://faculty.nps.edu/ncrowe/snell2.htm
609,Lobsters,games,Game Design,Dumping Donkey Kong 3: Dai Gyakushuu,https://medium.com/@famicomical/dumping-donkey-kong-3-dai-gyakushuu-2d86a2c366b4
610,Lobsters,games,Game Design,Pokémon Red/Blue disassembled and refactored to human-readable (and editable!) asm,https://github.com/pret/pokered
611,Lobsters,games,Game Design,Game industry pushes back against efforts to restore gameplay servers,https://arstechnica.com/gaming/2018/02/preservation-or-theft-historians-publishers-argue-over-dead-game-servers/
612,Lobsters,games,Game Design,Networked Physics in Virtual Reality: Networking a stack of cubes with Unity and PhysX,https://developer.oculus.com/blog/networked-physics-in-virtual-reality-networking-a-stack-of-cubes-with-unity-and-physx/
613,Lobsters,games,Game Design,Replication in networked games (2014),https://0fps.net/2014/02/10/replication-in-networked-games-overview-part-1/
614,Lobsters,games,Game Design,The Poor Man's Netcode,http://etodd.io/2018/02/20/poor-mans-netcode/
615,Lobsters,games,Game Design,Tales of the Drift: Unofficial Heat Signature Lore Wiki,https://drift.junglecoder.com/view/idea/1
616,Lobsters,games,Game Design,Books I had to read to develop a game engine,https://www.haroldserrano.com/blog/books-i-used-to-develop-a-game-engine
617,Lobsters,games,Game Design,Let’s add a photo mode to Wolfenstein II: The New Colossus (PC),https://weblogs.asp.net/fbouma/let-s-add-a-photo-mode-to-wolfenstein-ii-the-new-colossus-pc
618,Lobsters,games,Game Design,3D engine on MS Excel - without vba,https://www.youtube.com/watch?v=iCeOEQVUWZ0
619,Lobsters,games,Game Design,Lessons learned while developing Age of Empires 1 Definitive Edition,http://richg42.blogspot.com/2018/02/some-lessons-learned-while-developing.html
620,Lobsters,games,Game Design,Create VR on the Web using Unity3D and Mozilla's WebVR Assets tool,https://hacks.mozilla.org/2018/02/create-vr-on-the-web-using-unity3d/
621,Lobsters,games,Game Design,CSS Grid Garden,http://cssgridgarden.com/
622,Lobsters,games,Game Design,Phaser HTML5 game framework 3.0 released,https://github.com/photonstorm/phaser/releases/tag/v3.0.0
623,Lobsters,games,Game Design,Welcome to the 2nd Alakajam,https://alakajam.com/post/264/welcome-to-the-2nd-alakajam
624,Lobsters,games,Game Design,Computer Role-Playing Games Book released,https://crpgbook.wordpress.com/2018/02/05/update-19-crpg-book-released/
625,Lobsters,games,Game Design,"Guy Finds StarCraft Source Code And Returns It To Blizzard, Gets Free Trip To BlizzCon",https://kotaku.com/guy-finds-starcraft-source-code-and-returns-it-to-blizz-1794897125
626,Lobsters,games,Game Design,OpenClonk 8 released,http://blog.openclonk.org/2018/02/openclonk-8-released/
627,Lobsters,games,Game Design,The Sound of 1-bit: Technical constraint and musical creativity on the 48k Sinclair ZX Spectrum,https://www.gamejournal.it/the-sound-of-1-bit-technical-constraint-as-a-driver-for-musical-creativity-on-the-48k-sinclair-zx-spectrum/
628,Lobsters,games,Game Design,Billy Mitchell’s Twin Galaxies Donkey Kong records proven fake,http://www.twingalaxies.com/showthread.php/176004-Dispute-Jeremy-Young-Arcade-Donkey-Kong-Points-Hammer-Allowed-Player-Billy-L-Mitchell-Score-1-062-800?p=946633&viewfull=1#post946633
629,Lobsters,games,Game Design,Reverse engineering Dungeon Siege,http://glampert.com/2015/09-16/reverse-engineering-dungeon-siege/
630,Lobsters,games,Game Design,The Continuous World of Dungeon Siege,http://gamedevs.org/uploads/the-continuous-world-of-dungeon-siege.pdf
631,Lobsters,games,Game Design,Solving Minesweeper (2015),http://magnushoff.com/minesweeper/
632,Lobsters,games,Game Design,Oddball • on Orbb from Quake III: Arena,http://www.rigelatin.net/q3a/orbb/
633,Lobsters,games,Game Design,The Sierra Network,https://www.filfre.net/2018/02/the-sierra-network/
634,Lobsters,games,Game Design,"Let's Write a 2D Platformer From Scratch Using HTML5 and JavaScript, Part 3: Collision Detection",https://nlogn.xyz/2018/02/01/lets-write-a-2d-platformer-from-scratch-part-3.html
635,Lobsters,games,Game Design,The Faery Tale Adventure: A personal history,https://medium.com/@dreamertalin/the-faery-tale-adventure-a-personal-history-4fae0617a18d
636,Lobsters,games,Game Design,DOOM MYST 20 Years After (2014),https://vimeo.com/92838909
637,Lobsters,games,Game Design,Godot 3.0 is out and ready for the big leagues,https://godotengine.org/article/godot-3-0-released
638,Lobsters,games,Game Design,"Let's Write a 2D Platformer From Scratch Using HTML5 and JavaScript, Part 1: Game Loop",https://nlogn.xyz/2018/01/28/lets-write-a-2d-platformer-from-scratch-part-1.html
639,Lobsters,games,Game Design,"Running BBS Door Games on Windows 10 with GameSrv, DOSBox, plus telnet fun with WSL",https://www.hanselman.com/blog/RunningBBSDoorGamesOnWindows10WithGameSrvDOSBoxPlusTelnetFunWithWSL.aspx
640,Lobsters,games,Game Design,blizzard: agent rpc auth mechanism vulnerable to dns rebinding,https://bugs.chromium.org/p/project-zero/issues/detail?id=1471
641,Lobsters,games,Game Design,"""Modern"" NES Development",http://timcheeseman.com/nesdev/
642,Lobsters,games,Game Design,The cost of games,https://www.raphkoster.com/2018/01/17/the-cost-of-games/
643,Lobsters,games,Game Design,How a Laser-Shot Disk Defeats Hackers & Pirates,https://www.youtube.com/watch?v=Qaq9vlfoGnA
644,Lobsters,games,Game Design,Nintendo Labo: Switch with the fun of DIY creations,https://labo.nintendo.com/
645,Lobsters,games,Game Design,Play Awesome Indie Games Directly in Firefox Including the Award-Winning FTL (2014),https://blog.mozilla.org/blog/2014/10/14/play-awesome-indie-games-directly-in-firefox-including-the-award-winning-ftl/
646,Lobsters,games,Game Design,Let's Prove Random Games are Winnable (with Formal Methods),https://www.hillelwayne.com/post/alloy-randomizer/
647,Lobsters,games,Game Design,Making a cross-platform mobile game in Reason/OCaml,https://jaredforsyth.com/2018/01/13/making-a-cross-platform-mobile-game-in-reason-ocaml/
648,Lobsters,games,Game Design,The Making of Lemmings,https://readonlymemory.vg/the-making-of-lemmings/
649,Lobsters,games,Game Design,PUBG Match Deaths and Statistics CSV dump (65+M records),https://www.kaggle.com/skihikingkevin/pubg-match-deaths/data
650,Lobsters,games,Game Design,Guy Debord’s Game Of War,http://cabinetmagazine.org/issues/29/galloway.php
651,Lobsters,games,Game Design,Quinto: Resurrecting an Abandoned Board Game,http://blog.jrheard.com/quinto-resurrecting-an-abandoned-board-game
652,Lobsters,games,Game Design,Tips And Tricks for Shipping a PyGame App on the Mac,https://glyph.twistedmatrix.com/2018/01/shipping-pygame-mac-app.html
653,Lobsters,games,Game Design,The World Needs Good Games,http://widdersh.in/the-world-needs-good-games
654,Lobsters,games,Game Design,Classic Tools Retrospective: Tim Sweeney on the first version of the Unreal Editor,https://www.gamasutra.com/blogs/DavidLightbown/20180109/309414/Classic_Tools_Retrospective_Tim_Sweeney_on_the_first_version_of_the_Unreal_Editor.php
655,Lobsters,games,Game Design,Physics cheats,https://eev.ee/blog/2018/01/06/physics-cheats/
656,Lobsters,games,Game Design,Crypto for Kids (A Book that is a Labyrinth),https://github.com/sustrik/crypto-for-kids/blob/gh-pages/README.md
657,Lobsters,games,Game Design,Writing a platformer for the TIC-80 fantasy console,https://medium.com/@btco_code/writing-a-platformer-for-the-tic-80-virtual-console-6fa737abe476
658,Lobsters,games,Game Design,Much Assembly Required: Assembly Programming Game,https://muchassemblyrequired.com/
659,Lobsters,games,Game Design,Game Design Deep Dive: Creating believable crowds in Planet Coaster,https://www.gamasutra.com/view/news/288020/Game_Design_Deep_Dive_Creating_believable_crowds_in_Planet_Coaster.php
660,Lobsters,games,Game Design,Nintendo Switch Kernel exploit 34c3 presentation: “Nvidia Backdoored themselves”,http://wololo.net/2017/12/29/nintendo-switch-kernel-exploit-34c3-presentation-nvidia-backdoored/
661,Lobsters,games,Game Design,openage - a volunteer project to create a free engine clone of the Genie Engine,http://openage.sft.mx/
662,Lobsters,games,Game Design,Minecraft Economics,https://www.alicemaz.com/writing/minecraft.html
663,Lobsters,games,Game Design,The Revenant Problem - A Philosophical Doom 2 Map,https://www.youtube.com/watch?v=MiEYCXPI-qY
664,Lobsters,games,Game Design,SSHTron: Multiplayer Tron in your terminal,http://sshtron.zachlatta.com/
665,Lobsters,games,Game Design,How AlphaZero Wins,http://www.danamackenzie.com/blog/?p=5072
666,Lobsters,games,Game Design,"Mom, 'Final Fantasy' and the Language of Gaming",https://www.rollingstone.com/glixel/features/mom-final-fantasy-and-the-language-of-gaming-w514193
667,Lobsters,games,Game Design,Post Mortem: The Death of Flash and Rewriting 1.4 Million Lines of Code,https://www.gamasutra.com/blogs/DougPearson/20171212/311570/Post_Mortem_The_Death_of_Flash_and_Rewriting_14_Million_Lines_of_Code.php
668,Lobsters,games,Game Design,How to Write Your Own C++ Game Engine,http://preshing.com/20171218/how-to-write-your-own-cpp-game-engine
669,Lobsters,games,Game Design,Truth From Zero?,https://rjlipton.wordpress.com/2017/12/17/truth-from-zero/
670,Lobsters,games,Game Design,Boardgame.io: State management and more for turn-based games,https://google.github.io/boardgame.io/
671,Lobsters,games,Game Design,Metal Gear Solid V - Graphics Study,http://www.adriancourreges.com/blog/2017/12/15/mgs-v-graphics-study/
672,Lobsters,games,Game Design,How a counterfeit NES console opened up the Russian games market,http://www.eurogamer.net/articles/2017-12-17-how-a-counterfeit-nes-console-opened-up-the-russian-games-market
673,Lobsters,games,Game Design,ScummVM v2.0 released,http://www.scummvm.org/news/20171217/
674,Lobsters,games,Game Design,Memory Matters: A special RAM edition of Dirty Coding Tricks,https://www.gamasutra.com/view/news/310660/Memory_Matters_A_special_RAM_edition_of_Dirty_Coding_Tricks.php
675,Lobsters,games,Game Design,How to cheat at Settlers by loading the dice,https://izbicki.me/blog/how-to-cheat-at-settlers-of-catan-by-loading-the-dice-and-prove-it-with-p-values.html
676,Lobsters,games,Game Design,"Vintage Windows GUIs in ""Everything is going to be OK""",https://medium.com/@LiterallyAKing/vintage-windows-guis-in-everything-is-going-to-be-ok-20b38b11bb4f
677,Lobsters,games,Game Design,spawnfest/beam-craft -- Minecraft Classic server in Elixir,https://github.com/spawnfest/beam-craft
678,Lobsters,games,Game Design,"Bot Fighting 103. Code Integrity Checks, Code Scrambling",http://ithare.com/bot-fighting-103-code-integrity-checks-code-scrambling/
679,Lobsters,games,Game Design,The Mathematics of 2048: Counting States by Exhaustive Enumeration,http://jdlm.info/articles/2017/12/10/counting-states-enumeration-2048.html
680,Lobsters,games,Game Design,"Making a Game Boy game in 2017: A ""Sheep It Up!"" Post-Mortem (part 1/2)",https://www.gamasutra.com/blogs/DoctorLudos/20171207/311143/Making_a_Game_Boy_game_in_2017_A_quotSheep_It_Upquot_PostMortem_part_12.php
681,Lobsters,games,Game Design,"TIC-80: a fantasy computer for making, playing and sharing tiny games",https://tic.computer/
682,Lobsters,games,Game Design,How to Prototype a Game in Under 7 Days,http://miami.lgrace.com/documents/How%20to%20Prototype%20a%20Game%20in%20Under%207%20Days.pdf
683,Lobsters,games,Game Design,Dwarf Fortress and ivy-mode,http://vfoley.xyz/ivy-df/
684,Lobsters,games,Game Design,The Poor Man's 3D Camera,http://etodd.io/2017/11/28/poor-mans-3d-camera/
685,Lobsters,games,Game Design,"I Saw a Dinosaur, or How I Built a Real-Life Version of Chrome T-Rex Game",https://codeburst.io/i-saw-a-dinosaur-or-how-i-built-a-real-life-version-of-chrome-t-rex-game-92175f6cad2c
686,Lobsters,games,Game Design,[Post Mortem]: I thought I could ship at least 700 units to stay in business,https://www.gamasutra.com/blogs/ConstantinBacioiu/20171121/310012/Post_Mortem_I_thought_I_could_ship_at_least_700_units_to_stay_in_business.php
687,Lobsters,games,Game Design,Everything but the Clouds,https://vimeo.com/241966869
688,Lobsters,games,Game Design,“Super Mario Brothers” is hard (2016),http://news.mit.edu/2016/mario-brothers-hard-complexity-class-pspace-0601
689,Lobsters,games,Game Design,How good should we expect decisions to be?,https://danluu.com/bad-decisions/
690,Lobsters,games,Game Design,Teaching software testing concepts using a mutation testing game,http://code-defenders.org/
691,Lobsters,games,Game Design,Dolphin Emulator - To The Screen with Hybrid XFB,https://dolphin-emu.org/blog/2017/11/19/hybridxfb/
692,Lobsters,games,Game Design,Magic: the Gathering is Turing Complete (2012),http://www.toothycat.net/~hologram/Turing/index.html
693,Lobsters,games,Game Design,The Lobster Programming Language,https://github.com/aardappel/lobster
694,Lobsters,games,Game Design,Clojure in Unity,https://github.com/arcadia-unity/Arcadia
695,Lobsters,games,Game Design,Christopher Tolkein Resigns as Tolkein Estate Director,https://www.tolkiensociety.org/2017/11/christopher-tolkien-resigns-as-tolkien-estate-director/
696,Lobsters,games,Game Design,"Behold, mortal, the origins of robotfindskitten...",https://www.crummy.com/writing/speaking/2017-Roguelike%20Celebration/
697,Lobsters,games,Game Design,Confessions of a Dominions manual writer,http://www.quartertothree.com/fp/2013/10/25/confessions-dominions-manual-writer/
698,Lobsters,games,Game Design,Annotated NES Metroid Source Code,http://www.metroid-database.com/source-code/
699,Lobsters,games,Game Design,Fraud Detection in Pokémon Go - Schneier on Security,https://www.schneier.com/blog/archives/2017/11/fraud_detection.html
700,Lobsters,games,Game Design,Gamble your life away in ZT Online (2007),http://www.danwei.org/electronic_games/gambling_your_life_away_in_zt.php
701,Lobsters,games,Game Design,Chrono Trigger,http://socksmakepeoplesexy.net/index.php?a=trigger
702,Lobsters,games,Game Design,The Roguelike Celebration - a festival about roguelike game design,https://roguelike.club/
703,Lobsters,games,Game Design,Why Adventure Games Suck,http://grumpygamer.com/why_adventure_games_suck
704,Lobsters,games,Game Design,Here's The Programming Game You Never Asked For,http://blog.codinghorror.com/heres-the-programming-game-you-never-asked-for/
705,Lobsters,games,Game Design,ASYNC October '17: Machine Learning and Games online mini-conference,http://metamakersinstitute.com/events/async/
706,Lobsters,games,Game Design,The Carmack Plan,https://garbagecollected.org/2017/10/24/the-carmack-plan/
707,Lobsters,games,Game Design,Writing a ZX Spectrum game in Haskell (2015),https://dpwright.com/posts/2015/07/17/writing-a-zx-spectrum-game-in-haskell/
708,Lobsters,games,Game Design,Chucklefish developer discusses building one of their next projects in Rust,https://www.reddit.com/r/rust/comments/78bowa/hey_this_is_kyren_from_chucklefish_we_make_and/
709,Lobsters,games,Game Design,"Games Look Bad, Part 1: HDR and Tone Mapping",https://ventspace.wordpress.com/2017/10/20/games-look-bad-part-1-hdr-and-tone-mapping/
710,Lobsters,games,Game Design,A Full-Motion-Video Consulting Detective,http://www.filfre.net/2017/10/a-full-motion-video-consulting-detective/
711,Lobsters,games,Game Design,A Comprehensive Super Mario Bros. Disassembly,https://gist.github.com/1wErt3r/4048722
712,Lobsters,games,Game Design,Coaxing 2D platforming out of Unity,https://eev.ee/blog/2017/10/13/coaxing-2d-platforming-out-of-unity/
713,Lobsters,games,Game Design,Using Team Fortress 2 game-servers to circumvent censorship,http://maikel.pro/blog/using-team-fortress-2-game-servers-to-circumvent-censorship/
714,Lobsters,games,Game Design,Why Most Decisions Are Easy in Tetris,http://proceedings.mlr.press/v48/simsek16.pdf
715,Lobsters,games,Game Design,Digging for treasure in Aladdin’s source code – Video Game History Foundation,https://gamehistory.org/aladdin-source-code/
716,Lobsters,games,Game Design,PlayArchive - A commandline tool to play classic games from 'The Tnternet Archive',https://notabug.org/themightyglider/PlayArchive
717,Lobsters,games,Game Design,Writing a retro 3D FPS engine from scratch,https://medium.com/@btco_code/writing-a-retro-3d-fps-engine-from-scratch-b2a9723e6b06
718,Lobsters,games,Game Design,My path to programming,https://patrickmarchand.com/posts/2017-10-05-path-towards-programming/
719,Lobsters,games,Game Design,Game Tourism,http://vectorpoem.com/tourism/
720,Lobsters,games,Game Design,"The latest progress report for the PS3 emulator 'RPCS3' is out, improved Mesa support and loads more",https://www.gamingonlinux.com/articles/the-latest-progress-report-for-the-ps3-emulator-rpcs3-is-out-improved-mesa-support-and-loads-more.10474
721,Lobsters,games,Game Design,Stern Pinball teaches us how to make a pinball machine,https://www.youtube.com/watch?v=mcLs7kBEwfI
722,Lobsters,games,Game Design,Why does punching Sonic 3D trigger a Secret Level Select?,https://www.youtube.com/watch?v=i9bkKw32dGw
723,Lobsters,games,Game Design,Bill Gates and DONKEY.BAS (2007),https://blog.codinghorror.com/bill-gates-and-donkey-bas/
724,Lobsters,games,Game Design,Coding Games and Programming Challenges to Code Better,https://www.codingame.com
725,Lobsters,games,Game Design,The Mathematics of 2048: Counting States with Combinatorics,http://jdlm.info/articles/2017/09/17/counting-states-combinatorics-2048.html
726,Lobsters,games,Game Design,SDL 2.0.6 released,https://discourse.libsdl.org/t/sdl-2-0-6-released/23109
727,Lobsters,games,Game Design,Building multiplayer games with socket.io and HTML5 Canvas,https://github.com/sgoedecke/socket-io-game/blob/master/BLOG.md
728,Lobsters,games,Game Design,"Making ReelValley, a web game written in Nim",https://yglukhov.github.io/Making-ReelValley-Overview/
729,Lobsters,games,Game Design,Setting a primary monitor for launching games in a dual monitor rig,https://www.gamingonlinux.com/articles/setting-a-primary-monitor-for-launching-games-in-a-dual-monitor-rig.10352
730,Lobsters,games,Game Design,Unity Machine Learning Agents,https://blogs.unity3d.com/2017/09/19/introducing-unity-machine-learning-agents/
731,Lobsters,games,Game Design,PlotEx: a tool for exploring puzzle plot constraints,http://eblong.com/zarf/plotex/index.html
732,Lobsters,games,Game Design,Build a working game of Tetris in Conway's Game of Life,https://codegolf.stackexchange.com/questions/11880/build-a-working-game-of-tetris-in-conways-game-of-life
733,Lobsters,games,Game Design,AI Uses Less Than Two Minutes of Videogame Footage to Recreate Game Engine,https://gvu.gatech.edu/ai-uses-less-two-minutes-videogame-footage-recreate-game-engine
734,Lobsters,games,Game Design,Space Nerds In Space - A Multi-player Networked Starship Bridge Simulator,https://smcameron.github.io/space-nerds-in-space/#screenshots
735,Lobsters,games,Game Design,A/NES: a NES/Famicom emulator for Classic Amigas,http://nes.goondocks.se/anes.php
736,Lobsters,games,Game Design,Game Engine Black Book Release announcement,http://fabiensanglard.net/Game_Engine_Black_Book_Release/index.php
737,Lobsters,games,Game Design,"Game Development Articles, Publications, Papers, Resources",http://gamedevs.org/
738,Lobsters,games,Game Design,Fix Your Timestep! | Gaffer On Games (2004),https://gafferongames.com/post/fix_your_timestep/
739,Lobsters,games,Game Design,"Fixing overwork isn’t easy, but it’s the best investment we can make",https://www.polygon.com/2017/9/7/16262586/how-to-fix-crunch
740,Lobsters,games,Game Design,Fantasy Football for Hackers - Building a draft strategy from the ground up,https://intoli.com/blog/fantasy-football-for-hackers/
741,Lobsters,games,Game Design,Chris Crawford vs. the Dragon,http://www.swaine.com/wordpress/chris-crawford-vs-the-dragon/
742,Lobsters,games,Game Design,Juggle Tutor,http://www.doxsey.net/blog/juggle-tutor
743,Lobsters,games,Game Design,The Lessons of Lucasfilm's Habitat,http://www.fudco.com/chip/lessons.html
744,Lobsters,games,Game Design,Multiplayer-Only Maps,http://rome.ro/news/2017/8/30/multiplayer-only-maps
745,Lobsters,games,Game Design,How (and why) we ported SHENZHEN SOLITAIRE to MS-DOS,https://www.gamasutra.com/blogs/ZachBarth/20170828/304568/How_and_why_we_ported_SHENZHEN_SOLITAIRE_to_MSDOS.php
746,Lobsters,games,Game Design,Developing Lag Compensated Java/Libgdx game,http://www.schibsted.pl/blog/back-end/developing-lag-compensated-multiplayer-game-pt-1/
747,Lobsters,games,Game Design,Fizzlefade,http://fabiensanglard.net/fizzlefade/index.php
