ID,Source,Tag_Code,Tag_Name,Title,Url
1,Lobsters,games,Game Design,Piccolo: Strong Othello AI With GUI Written in Go and Published in WASM,https://piccolo.click
2,Lobsters,games,Game Design,"ROBLOX is a MUD: The history of virtual worlds, MUDs & MMORPGs",https://medium.com/@felipepepe/roblox-is-a-mud-the-history-of-virtual-worlds-muds-mmorpgs-12e41c4cb9b
3,Lobsters,games,Game Design,Reverse Engineering GTA V's Stunt Jump System,https://hackery.site/writing/gta-v-stunt-jumps/
4,Lobsters,games,Game Design,Handmade Hero,https://hero.handmade.network/
5,Lobsters,games,Game Design,How I Modernized My Flash Game,http://twinbeard.com/how-i-modernized-my-flash-game.html
6,Lobsters,games,Game Design,WarsawJS Meetup #72 Online,https://www.meetup.com/WarsawJS/events/267830160/
7,Lobsters,games,Game Design,CROBOTS (2013),https://tpoindex.github.io/crobots/pcjs/crobots-pcjs.html
8,Lobsters,games,Game Design,How the original Pascal source code for ZZT was reconstructed,https://blog.asie.pl/2020/08/reconstructing-zzt/
9,Lobsters,games,Game Design,picolove - a PICO-8 Reimplementation in Love2D,https://github.com/picolove/picolove
10,Lobsters,games,Game Design,Making Advanced GUI Applications with Godot,https://medium.com/swlh/what-makes-godot-engine-great-for-advance-gui-applications-b1cfb941df3b
11,Lobsters,games,Game Design,BSD Gaming is Improving – Proton on FreeBSD,https://www.youtube.com/watch?v=wfvbyWGkRW0
12,Lobsters,games,Game Design,Rethinking Open Source: The Challenges Behind Establishing a Modern Emulator (2019),https://emucross.com/rethinking-open-source/
13,Lobsters,games,Game Design,Using Bullet for physics in UE4,https://www.stevestreeting.com/2020/07/26/using-bullet-for-physics-in-ue4/
14,Lobsters,games,Game Design,Boids in WebAssembly Using Go,https://healeycodes.com/boids-flocking-simulation/
15,Lobsters,games,Game Design,Richter - A modern Quake engine,http://c-obrien.org/richter/
16,Lobsters,games,Game Design,Startup Option Value Calculator,https://valuation.vc/startup_options.html
17,Lobsters,games,Game Design,Elo sucks — better multiplayer rating systems for smaller games,https://medium.com/acolytefight/elo-sucks-better-multiplayer-rating-systems-for-smaller-games-8ca588ee652f
18,Lobsters,games,Game Design,Worms Armageddon 3.8 Features,https://worms2d.info/Worms_Armageddon_3.8_Features
19,Lobsters,games,Game Design,What it's like to code for Roblox,http://www.bemmu.com/what-its-like-to-code-for-roblox
20,Lobsters,games,Game Design,Tricks with Pseudorandom Number Generators,https://theartofmachinery.com/2020/07/18/prng_tricks.html
21,Lobsters,games,Game Design,made up game design terms,http://stuffedwomb.at/design_terms.html
22,Lobsters,games,Game Design,SNES Doom Source (1995),https://github.com/RandalLinden/DOOM-FX
23,Lobsters,games,Game Design,Mathsteroids,http://www.mscroggs.co.uk/blog/55
24,Lobsters,games,Game Design,"OpenDiablo 2: Open source Diablo 2 engine, written in golang",https://github.com/OpenDiablo2/OpenDiablo2
25,Lobsters,games,Game Design,Chopper Commando Revisited,http://blog.loadzero.com/blog/chopper258/
26,Lobsters,games,Game Design,Piccolo: Strong Othello AI With GUI Written in Go and Published in WASM,https://piccolo.click
27,Lobsters,games,Game Design,"ROBLOX is a MUD: The history of virtual worlds, MUDs & MMORPGs",https://medium.com/@felipepepe/roblox-is-a-mud-the-history-of-virtual-worlds-muds-mmorpgs-12e41c4cb9b
28,Lobsters,games,Game Design,Reverse Engineering GTA V's Stunt Jump System,https://hackery.site/writing/gta-v-stunt-jumps/
29,Lobsters,games,Game Design,Handmade Hero,https://hero.handmade.network/
30,Lobsters,games,Game Design,How I Modernized My Flash Game,http://twinbeard.com/how-i-modernized-my-flash-game.html
31,Lobsters,games,Game Design,WarsawJS Meetup #72 Online,https://www.meetup.com/WarsawJS/events/267830160/
32,Lobsters,games,Game Design,CROBOTS (2013),https://tpoindex.github.io/crobots/pcjs/crobots-pcjs.html
33,Lobsters,games,Game Design,How the original Pascal source code for ZZT was reconstructed,https://blog.asie.pl/2020/08/reconstructing-zzt/
34,Lobsters,games,Game Design,picolove - a PICO-8 Reimplementation in Love2D,https://github.com/picolove/picolove
35,Lobsters,games,Game Design,Making Advanced GUI Applications with Godot,https://medium.com/swlh/what-makes-godot-engine-great-for-advance-gui-applications-b1cfb941df3b
36,Lobsters,games,Game Design,BSD Gaming is Improving – Proton on FreeBSD,https://www.youtube.com/watch?v=wfvbyWGkRW0
37,Lobsters,games,Game Design,Rethinking Open Source: The Challenges Behind Establishing a Modern Emulator (2019),https://emucross.com/rethinking-open-source/
38,Lobsters,games,Game Design,Using Bullet for physics in UE4,https://www.stevestreeting.com/2020/07/26/using-bullet-for-physics-in-ue4/
39,Lobsters,games,Game Design,Boids in WebAssembly Using Go,https://healeycodes.com/boids-flocking-simulation/
40,Lobsters,games,Game Design,Richter - A modern Quake engine,http://c-obrien.org/richter/
41,Lobsters,games,Game Design,Startup Option Value Calculator,https://valuation.vc/startup_options.html
42,Lobsters,games,Game Design,Elo sucks — better multiplayer rating systems for smaller games,https://medium.com/acolytefight/elo-sucks-better-multiplayer-rating-systems-for-smaller-games-8ca588ee652f
43,Lobsters,games,Game Design,Worms Armageddon 3.8 Features,https://worms2d.info/Worms_Armageddon_3.8_Features
44,Lobsters,games,Game Design,What it's like to code for Roblox,http://www.bemmu.com/what-its-like-to-code-for-roblox
45,Lobsters,games,Game Design,Tricks with Pseudorandom Number Generators,https://theartofmachinery.com/2020/07/18/prng_tricks.html
46,Lobsters,games,Game Design,made up game design terms,http://stuffedwomb.at/design_terms.html
47,Lobsters,games,Game Design,SNES Doom Source (1995),https://github.com/RandalLinden/DOOM-FX
48,Lobsters,games,Game Design,Mathsteroids,http://www.mscroggs.co.uk/blog/55
49,Lobsters,games,Game Design,"OpenDiablo 2: Open source Diablo 2 engine, written in golang",https://github.com/OpenDiablo2/OpenDiablo2
50,Lobsters,games,Game Design,Chopper Commando Revisited,http://blog.loadzero.com/blog/chopper258/
51,Lobsters,games,Game Design,MTG Hivemind: Artificial Intelligence designing Magic,https://medium.com/@lukbebalduke/mtg-hivemind-artificial-intelligence-designing-magic-372530640cc1
52,Lobsters,games,Game Design,A tale of Ghosts'n Goblins'n Crocodiles,https://fabiensanglard.net/cpc/index.html
53,Lobsters,games,Game Design,a327ex/BYTEPATH,https://github.com/a327ex/BYTEPATH
54,Lobsters,games,Game Design,The Lost Street Fighter II: Champion Edition for Sega Mega Drive,https://hiddenpalace.org/News/The_Lost_Street_Fighter_II:_Champion_Edition_for_Sega_Mega_Drive
55,Lobsters,games,Game Design,Squib is a Ruby DSL for prototyping card games,https://squib.rocks/
56,Lobsters,games,Game Design,Should the Monster Play Fair?: Reception of Artificial Intelligence in Alien: Isolation,http://gamestudies.org/2002/articles/jaroslav_svelch
57,Lobsters,games,Game Design,The Lizard Tool: making an NES game,https://www.youtube.com/watch?v=NBNnjRbM9SI
58,Lobsters,games,Game Design,Open source game developer Perttu Ahola talks about Minetest,https://en.wikinews.org/wiki/Open_source_game_developer_Perttu_Ahola_talks_about_Minetest_with_Wikinews
59,Lobsters,games,Game Design,"GemRB - Open Source reimplementation of Infinity Engine (Baldur's Gate, Icewind Dale, ...)",https://gemrb.github.io/
60,Lobsters,games,Game Design,OpenDiablo2 - Open Source Reimplementation of Diablo 2,https://opendiablo2.com/
61,Lobsters,games,Game Design,Godot 4.0 gets SDF based real-time global illumination,https://godotengine.org/article/godot-40-gets-sdf-based-real-time-global-illumination
62,Lobsters,games,Game Design,Making After Burner,https://readonlymemory.vg/making-after-burner/
63,Lobsters,games,Game Design,Xbox Architecture,https://www.copetti.org/projects/consoles/xbox/
64,Lobsters,games,Game Design,Quantum Game 2,https://github.com/Quantum-Game/quantum-game-2
65,Lobsters,games,Game Design,"Alpha Waves, the first 3D platformer ever",https://fosdem.org/2020/schedule/event/retro_alpha_waves_1st_3d_platformer_ever/
66,Lobsters,games,Game Design,Dungeon Scrawl - Old school maps in minutes,https://dungeonscrawl.com/
67,Lobsters,games,Game Design,Analyzing item distribution in Super Metroid randomizer,https://xen.garden/2020/04/29/smrat-data.html
68,Lobsters,games,Game Design,Games with PPB: Jumping Panda edition,https://www.youtube.com/watch?v=jfFQPWWrbpQ
69,Lobsters,games,Game Design,Game Development With Fennel And Löve,https://beta7.io/posts/game-development-with-fennel-and-love.html
70,Lobsters,games,Game Design,The Enduring Musical Legacy of “Streets of Rage”,https://daily.bandcamp.com/features/streets-of-rage-soundtrack-interview
71,Lobsters,games,Game Design,How a File Format Led to a Crossword Scandal,https://www.youtube.com/watch?v=9aHfK8EUIzg
72,Lobsters,games,Game Design,A frontend stack for video games,https://increment.com/frontend/a-frontend-stack-for-video-games/
73,Lobsters,games,Game Design,"Open source Minecraft clone built with ReactJS, GraphQL, ThreeJS, and NodeJS",https://github.com/ian13456/mine.js
74,Lobsters,games,Game Design,Peeking under the hood of Command & Conquer,http://www.hydrogen18.com/blog/peeking-under-the-hood-of-command-conquer.html
75,Lobsters,games,Game Design,How 3D video games do graphics,https://www.youtube.com/watch?v=bGe-d09Nc_M
76,Lobsters,games,Game Design,SimRefinery recovered,https://obscuritory.com/sim/simrefinery-recovered/
77,Lobsters,games,Game Design,TwilioQuest - A programming RPG,https://www.twilio.com/quest
78,Lobsters,games,Game Design,Modern Portfolio Theory: a Case Study on Turnips,https://www.shawenyao.com/Modern-Portfolio-Theory-a-Case-Study-on-Turnips/
79,Lobsters,games,Game Design,Making a SNES game in 2020 - Yo-Yo Shuriken by Dr. Ludos,https://drludos.itch.io/yo-yo-shuriken/devlog/147478/making-a-snes-game-in-2020
80,Lobsters,games,Game Design,Godot Editor running in a web browser,https://godotengine.org/article/godot-editor-running-web-browser
81,Lobsters,games,Game Design,Troubling Times for Porters in a Proton World,https://boilingsteam.com/ethan-lee-troubling-times-for-porters-in-a-proton-world/
82,Lobsters,games,Game Design,Soldat goes open source,https://github.com/Soldat/soldat
83,Lobsters,games,Game Design,Delores Source Code Released,https://grumpygamer.com/delores_dev
84,Lobsters,games,Game Design,cataclysm -- a post-apocalyptic roguelike,https://github.com/Whales/Cataclysm
85,Lobsters,games,Game Design,PAC-MAN Recreated with AI by NVIDIA Researchers,https://blogs.nvidia.com/blog/2020/05/22/gamegan-research-pacman-anniversary/
86,Lobsters,games,Game Design,Red Alert and Tiberian Dawn to be released under the GPL,https://old.reddit.com/r/commandandconquer/comments/gnevp8/remaster_update_and_open_source_mod_support/fr97x9x/
87,Lobsters,games,Game Design,Teach kids Python by building an interactive game,https://opensource.com/article/20/5/python-games
88,Lobsters,games,Game Design,When SimCity got serious: the story of Maxis Business Simulations and SimRefinery,https://obscuritory.com/sim/when-simcity-got-serious/
89,Lobsters,games,Game Design,King releases the Defold game engine under a permissive license,https://defold.com/2020/05/19/Defold-is-now-open-source/
90,Lobsters,games,Game Design,"Orb.Farm, a virtual aquatic ecosystem",https://orb.farm
91,Lobsters,games,Game Design,"Hello, GBA! Journey of making an emulator — part 1",https://medium.com/@michelheily/hello-gba-journey-of-making-an-emulator-part-1-8793000e8606
92,Lobsters,games,Game Design,Gamebridge: Fitting Square Pegs into Round Holes since 2020,https://christine.website/blog/gamebridge-2020-05-09
93,Lobsters,games,Game Design,A Game Designer Walks Into NASA Astronaut Training,https://www.youtube.com/watch?v=RRduBxiW6ho
94,Lobsters,games,Game Design,Get Lamp: The text adventure documentary,http://www.getlamp.com
95,Lobsters,games,Game Design,Building the AI of F.E.A.R. with Goal Oriented Action Planning,https://www.aiandgames.com/2020/05/06/ai-101-goap-fear/
96,Lobsters,games,Game Design,An emotional trip to the 80's: Developing Games for the Speccy,https://www.gamasutra.com/blogs/PedroGuida/20200504/362225/An_emotional_trip_to_the_80s_Developing_Games_for_the_Speccy.php
97,Lobsters,games,Game Design,The story behind Cryo and Westwood's 16-bit Dune games,https://thedorkweb.substack.com/p/tales-from-the-dork-web-8
98,Lobsters,games,Game Design,announcing the SCOPETREX -- the vector gaming console for your oscilloscope or XY monitor,https://twitter.com/tubetimeus/status/1258222817914441728
99,Lobsters,games,Game Design,Beyond emulation: The massive effort to reverse-engineer N64 source code,https://arstechnica.com/gaming/2020/05/beyond-emulation-the-massive-effort-to-reverse-engineer-n64-source-code/
100,Lobsters,games,Game Design,Super Bootable 64,https://christine.website/blog/super-bootable-64-2020-05-06
101,Lobsters,games,Game Design,Pioneer Palcom PX-7(BK),http://www.computinghistory.org.uk/det/44421/Pioneer-PX-7(BK)/
102,Lobsters,games,Game Design,Neo-Geo Assembly Programming for the Absolute Beginner,https://www.ajworld.net/neogeodev/beginner/#intro
103,Lobsters,games,Game Design,EasyRPG Player 0.6.2 “Pincer Attack” released,https://blog.easyrpg.org/2020/04/easyrpg-player-0-6-2-pincer-attack/
104,Lobsters,games,Game Design,War Stories: How Prince of Persia slew the Apple II’s memory limitations,https://arstechnica.com/gaming/2020/04/war-stories-how-prince-of-persia-slew-the-apple-iis-memory-limitations/
105,Lobsters,games,Game Design,The Making of Stunt Island,http://fabiensanglard.net/stunt_island/index.html
106,Lobsters,games,Game Design,Data-Oriented Design,https://www.dataorienteddesign.com/dodbook/dodmain.html
107,Lobsters,games,Game Design,A wild PyBoy appears: a GameBoy emulator written in Python,https://notamonadtutorial.com/a-wild-pyboy-appears-a-gameboy-emulator-written-in-python-22666762232f
108,Lobsters,games,Game Design,"akevalion/Mario - A mario 1985 version, in Smalltalk",https://github.com/akevalion/Mario
109,Lobsters,games,Game Design,The Story of Facade: The AI-Powered Interactive Drama,https://gamasutra.com/blogs/TommyThompson/20200423/361473/The_Story_of_Facade_The_AIPowered_Interactive_Drama.php
110,Lobsters,games,Game Design,Powering Up Your Unity Game Development with DevOps: Docker + GitLab + Discord,https://gamejolt.com/games/talesofkulplex/313193/devlog/tales-of-kulplex-devlog-9-powering-up-your-unity-game-developme-vbs2ft8u
111,Lobsters,games,Game Design,Algorithmic Botany: Publications,http://algorithmicbotany.org/papers/
112,Lobsters,games,Game Design,A small state-of-the-art study on custom engines,https://gist.github.com/raysan5/909dc6cf33ed40223eb0dfe625c0de74
113,Lobsters,games,Game Design,NEC PC-FX,http://www.computinghistory.org.uk/det/31248/NEC-PC-FX/
114,Lobsters,games,Game Design,Architecture of Consoles,https://copetti.org/projects/consoles/
115,Lobsters,games,Game Design,GDC Vault,https://www.gdcvault.com/gdmag
116,Lobsters,games,Game Design,LostKingdomBF - a text adventure game written in Brainf*ck,https://jonripley.com/i-fiction/games/LostKingdomBF.html
117,Lobsters,games,Game Design,A Month of Reconstructing ZZT,https://museumofzzt.com/article/468/a-month-of-reconstructing-zzt
118,Lobsters,games,Game Design,Upgrading to Unity 2019.3,https://medium.com/@Extrawurst/upgrading-to-unity-2019-3-e9701aaaad38
119,Lobsters,games,Game Design,I ported Heart of Darkness to the Original Xbox,https://www.youtube.com/watch?v=f4rNhTTwGgk
120,Lobsters,games,Game Design,Exploiting the Starcraft 1 EUD Bug,https://zeta-two.com/software/exploit/2020/04/05/exploiting-starcraft1.html
121,Lobsters,games,Game Design,"The same video game in 2D, 3D or virtual reality – How does technology impact game evaluation and brand placements?",https://journals.plos.org/plosone/article?id=10.1371/journal.pone.0200724
122,Lobsters,games,Game Design,OpenTTD 1.10.0,https://www.openttd.org/news/2020/04/01/openttd-1-10-0.html
123,Lobsters,games,Game Design,"Inside the Playstation 2: PS2 Architecture, Graphics Rendering and Programming",http://www.vazgames.com/retro/PS2.htm
124,Lobsters,games,Game Design,Open reimplementation of Might and Magic 6 7 8 game engine,https://github.com/gp-alex/world-of-might-and-magic
125,Lobsters,games,Game Design,How SNES emulators got a few pixels from complete perfection,https://arstechnica.com/gaming/2020/04/how-snes-emulators-got-a-few-pixels-from-complete-perfection/
126,Lobsters,games,Game Design,SNES Projects,https://nesdoug.com/2020/03/19/snes-projects/
127,Lobsters,games,Game Design,SilentPatch for Scarface: The World is Yours & launching a Patreon campaign,https://cookieplmonster.github.io/2020/03/29/silentpatch-scarface/
128,Lobsters,games,Game Design,"Curses City, a simple ASCII Sim City style game using ncurses",https://www.cbabuska.com/CursesCity
129,Lobsters,games,Game Design,Crash Bandicoot Co-Creator Andy Gavin: Extended Interview,https://www.youtube.com/watch?v=pSHj5UKSylk
130,Lobsters,games,Game Design,The polygons of DOOM: PSX,http://fabiensanglard.net/doom_psx/index.html
131,Lobsters,games,Game Design,Party from Home: The story of a party made for our new normal,https://www.carlos-dp.com/2020/03/party-from-home/
132,Lobsters,games,Game Design,Oceans of code programming challenge,https://www.codingame.com/contests/ocean-of-code
133,Lobsters,games,Game Design,DOOM 4 VANILLA v2.5.9,https://www.doomworld.com/forum/topic/108725-doom-4-vanilla-v259-new-version/?page=24&tab=comments#comment-2093390
134,Lobsters,games,Game Design,DOOM95: Making an aimbot,https://0x00sec.org/t/doom95-making-an-aimbot/19862
135,Lobsters,games,Game Design,Reconstruction of ZZT,https://github.com/asiekierka/reconstruction-of-zzt/
136,Lobsters,games,Game Design,The polygons of Another World: Atari Jaguar,http://fabiensanglard.net/another_world_polygons_Jaguar/index.html#back_1
137,Lobsters,games,Game Design,Enter your chess.com name and see the mistakes you make most often,https://chesscoach.network/
138,Lobsters,games,Game Design,making a 3D game in only 2KB of JavaScript,http://frankforce.com/?p=7427
139,Lobsters,games,Game Design,A Game of Tetris,https://alex-hhh.github.io/2020/03/a-game-of-tetris.html
140,Lobsters,games,Game Design,Dungeon Generation in Enter The Gungeon,https://www.boristhebrave.com/2019/07/28/dungeon-generation-in-enter-the-gungeon/
141,Lobsters,games,Game Design,The First Video Game,https://www.youtube.com/watch?v=uHQ4WCU1WQc
142,Lobsters,games,Game Design,Latency Compensating Methods in Client/Server In-game Protocol Design and Optimization,https://developer.valvesoftware.com/wiki/Latency_Compensating_Methods_in_Client/Server_In-game_Protocol_Design_and_Optimization
143,Lobsters,games,Game Design,Using Low Discrepancy Sequences & Blue Noise in Loot Drop Tables for Games,https://blog.demofox.org/2020/03/01/using-low-discrepancy-sequences-blue-noise-in-loot-drop-tables-for-games/
144,Lobsters,games,Game Design,How Crash Bandicoot Hacked The Original Playstation,https://www.youtube.com/watch?v=izxXGuVL21o
145,Lobsters,games,Game Design,OpenRCT2 project - Open-Source adaption of RollerCoaster Tycoon 2 reaches v0.2.4+,http://www.indieretronews.com/2020/02/openrct2-project-open-source-adaption.html
146,Lobsters,games,Game Design,Multiplayer Game Networking: The Brute Force Approach,https://www.deconstructconf.com/2019/ayla-myers-multiplayer-game-networking-the-brute-force-approach
147,Lobsters,games,Game Design,On Emulation,https://blog.cameronseid.com/on-emulation
148,Lobsters,games,Game Design,"Myst (or, The Drawbacks to Success)",https://www.filfre.net/2020/02/myst-or-the-drawbacks-to-success/
149,Lobsters,games,Game Design,a renderer for Diablo using ncurses,https://github.com/AJenbo/devilutionX/tree/roguelike
150,Lobsters,games,Game Design,A Loveletter to the Atari Lynx,https://thedorkweb.substack.com/p/tales-from-the-dork-web-2
151,Lobsters,games,Game Design,The Story of Zelda: Link's Awakening (2019),https://www.youtube.com/watch?v=pfvk6CJ3v34
152,Lobsters,games,Game Design,A Snake Egg Puzzle Solver,https://github.com/tuzz/snake-egg-puzzle
153,Lobsters,games,Game Design,It's a Sony project,https://androidarts.com/Sony/Sony.htm
154,Lobsters,games,Game Design,Minetest -- an open source infinite-world block sandbox game,https://github.com/minetest/minetest
155,Lobsters,games,Game Design,Dolphin Progress Report dec 2019/Jan 2020,https://dolphin-emu.org/blog/2020/02/07/dolphin-progress-report-dec-2019-and-jan-2020/?cr=nl
156,Lobsters,games,Game Design,A bug in Adventure’s endgame,https://quuxplusone.github.io/blog/2020/02/06/water-bottle-bug/
157,Lobsters,games,Game Design,Godot Engine was awarded an Epic MegaGrant,https://godotengine.org/article/godot-engine-was-awarded-epic-megagrant
158,Lobsters,games,Game Design,Conway's Game of Life in Baba is You,https://www.youtube.com/watch?v=YH0NR1kmMUo
159,Lobsters,games,Game Design,Five important realisations about game balance,http://joostdevblog.blogspot.com/2020/02/five-important-realisations-about-game.html
160,Lobsters,games,Game Design,Reach the Credits from Kokiri Forest using ACE (Ocarina of Time Glitch Explained),https://www.youtube.com/watch?v=wdRJWDKb5Bo
161,Lobsters,games,Game Design,Verbs and Adventure Games,https://grumpygamer.com/verbs_verbs_verbs
162,Lobsters,games,Game Design,Raycasting Demo in React,https://ahuth.github.io/raycast/
163,Lobsters,games,Game Design,"Here comes Godot 3.2, with quality as priority",https://godotengine.org/article/here-comes-godot-3-2
164,Lobsters,games,Game Design,Into Hinterland World - A cool side scrolling C64 space snooter by Abyss Connection,http://www.indieretronews.com/2020/01/into-hinterland-world-cool-side.html
165,Lobsters,games,Game Design,PCGRL: Procedural Content Generation via Reinforcement Learning,https://arxiv.org/abs/2001.09212
166,Lobsters,games,Game Design,Interview with Jonathan Blow,https://oxide.computer/blog/on-the-metal-9-jonathan-blow/
167,Lobsters,games,Game Design,Where are the Hacking Simulators?,http://tiniuc.com/where-are-the-hacking-simulators/
168,Lobsters,games,Game Design,Pinebookpro gaming part 2,https://astr0baby.wordpress.com/2020/01/26/pinebookpro-gaming-part-2/
169,Lobsters,games,Game Design,Probability distribution of multiplied dice rolls,https://boredzo.org/blog/archives/2020-01-25/probability-distribution-of-multiplied-dice-rolls
170,Lobsters,games,Game Design,The Infinite Loop That Wasn't: A Holy Grail Bug Story,https://mgba.io/2020/01/25/infinite-loop-holy-grail/
171,Lobsters,games,Game Design,This amazing glitch puts Star Fox 64 ships in an unmodified Zelda cartridge,https://arstechnica.com/gaming/2020/01/how-to-get-star-fox-64-ships-into-ocarina-of-time-no-hacking-required/
172,Lobsters,games,Game Design,"Time travel debugging in Spritely Goblins, previewed through Terminal Phase",https://dustycloud.org/blog/goblins-time-travel-micropreview/
173,Lobsters,games,Game Design,Word Champions,http://blog.danieljanus.pl/2020/01/03/word-champions/
174,Lobsters,games,Game Design,Link’s Awakening disassembly progress report – part 10,https://kemenaran.winosx.com/posts/links-awakening-disassembly-progress-report-part-10/
175,Lobsters,games,Game Design,Frontier: Elite II,https://en.wikipedia.org/wiki/Frontier:_Elite_II
176,Lobsters,games,Game Design,Terminal Phase 1.0,https://dustycloud.org/blog/terminal-phase-1.0/
177,Lobsters,games,Game Design,The polygons of Another World,http://fabiensanglard.net/another_world_polygons_SNES/index.html
178,Lobsters,games,Game Design,Views on Godot (3.1),https://16bpp.net/blog/post/views-on-godot-3_1/
179,Lobsters,games,Game Design,discrete event simulation in Clojure,https://github.com/dvlopt/dsim.clj
180,Lobsters,games,Game Design,Game Off 2019 Winners. More than 200 games with source code,https://github.blog/2020-01-14-game-off-2019-winners/
181,Lobsters,games,Game Design,Roguelike Tutorial in Rust,http://bfnightly.bracketproductions.com/rustbook/
182,Lobsters,games,Game Design,A game in a pure language (part 1): introduction and problems with Idris,https://flowing.systems/2020/01/13/a-game-in-a-pure-language-part-1-introduction-and-problems-with-idris.html
183,Lobsters,games,Game Design,ReDoomEd,http://twilightedge.com/mac/redoomed/
184,Lobsters,games,Game Design,Space Invaders,http://www.computerarcheology.com/Arcade/SpaceInvaders/
185,Lobsters,games,Game Design,Browser Games Aren't an Easy Target,http://jakob.space/blog/browser-games-aren-t-an-easy-target.html
186,Lobsters,games,Game Design,VVVVVV’s source code is now public,http://distractionware.com/blog/2020/01/vvvvvv-is-now-open-source/
187,Lobsters,games,Game Design,"Unciv - Open-source Android/Desktop remake of Civ V (2d, pixel art)",https://github.com/yairm210/UnCiv
188,Lobsters,games,Game Design,DOSBox JIT on ppc64le (and how you can write your own),https://www.talospace.com/2020/01/dosbox-jit-on-ppc64le-and-how-you-can.html
189,Lobsters,games,Game Design,Translating Quake 3 into Rust,https://immunant.com/blog/2020/01/quake3/
190,Lobsters,games,Game Design,BattlEye stack walking,https://vmcall.blog/battleye-stack-walking/
191,Lobsters,games,Game Design,Explaining how fighting games use delay-based and rollback netcode,https://arstechnica.com/gaming/2019/10/explaining-how-fighting-games-use-delay-based-and-rollback-netcode/
192,Lobsters,games,Game Design,Open-source engine for Heroes of Might and Magic 3,https://github.com/vcmi/vcmi
193,Lobsters,games,Game Design,Terrain rendering algorithm in less than 20 lines of code,https://github.com/s-macke/VoxelSpace
