ID,Source,Tag_Code,Tag_Name,Title,Url
570,Lobsters,math,Mathematics,The Octonions,http://math.ucr.edu/home/baez/octonions/
571,Lobsters,math,Mathematics,Programmer's introduction to linear equations,http://wordsandbuttons.online/programmers_introduction_to_linear_equations.html
572,Lobsters,math,Mathematics,FPSheet: A Spreadsheet program with Haskell as the scripting language,https://github.com/RKlompUU/fpsheet
573,Lobsters,math,Mathematics,Diagon - Interactive ASCII art diagram collection,https://arthursonzogni.com/Diagon/
574,Lobsters,math,Mathematics,Ceres Solver — A Large Scale Non-linear Optimization Library,http://ceres-solver.org/
575,Lobsters,math,Mathematics,Trustica beginner introduction to elliptic curve cryptography,https://trustica.cz/en/category/ecc/page/3/
576,Lobsters,math,Mathematics,The 5 unique coordinates you'll need to watch out for in Curve25519,https://crypto.stackexchange.com/a/17706/33117
577,Lobsters,math,Mathematics,Improving the fast inverse square root,http://rrrola.wz.cz/inv_sqrt.html
578,Lobsters,math,Mathematics,Differential Geometry Reconstructed,http://www.geometry.org/tex/conc/dgstats.php
579,Lobsters,math,Mathematics,Bartosz Milewski's 'Category Theory for Programmers' compiled in EPUB,https://github.com/onlurking/category-theory-for-programmers
580,Lobsters,math,Mathematics,"If You’re Not Writing a Program, Don't Use a Programming Language",http://muratbuffalo.blogspot.com/2018/07/if-youre-not-writing-program-dont-use.html
581,Lobsters,math,Mathematics,An introduction to randomness extractors,https://cs.haifa.ac.il/~ronen/online_papers/ICALPinvited.pdf
582,Lobsters,math,Mathematics,Have you ever needed to generate a random number in code?,https://threadreaderapp.com/thread/1012719876706840578.html
583,Lobsters,math,Mathematics,Powers Great and Small,https://mathwithbaddrawings.com/2018/06/27/powers-great-and-small/
584,Lobsters,math,Mathematics,Set Theory: the Method To Database Madness,https://dev.to/vaidehijoshi/set-theory-the-method-to-database-madness
585,Lobsters,math,Mathematics,Superformula,https://gpfault.net/posts/superformula.txt.html
586,Lobsters,math,Mathematics,Colour Space Conversions,https://poynton.ca/PDFs/coloureq.pdf
587,Lobsters,math,Mathematics,Iverson's Algebra: An Algorithmic Treatment,http://www.jsoftware.com/books/pdf/algebra.pdf
588,Lobsters,math,Mathematics,Symbolic Computation with C++,https://www-zeuthen.desy.de/acat05/talks/Vollinga.Jens.3/vollinga.pdf
589,Lobsters,math,Mathematics,Modal Logic Playground,https://rkirsling.github.io/modallogic/
590,Lobsters,math,Mathematics,Fibonacci Hashing: The Optimization that the World Forgot (or: a Better Alternative to Integer Modulo),https://probablydance.com/2018/06/16/fibonacci-hashing-the-optimization-that-the-world-forgot-or-a-better-alternative-to-integer-modulo/
591,Lobsters,math,Mathematics,List of Applications of Set Theory in Computer Science,https://www.quora.com/What-are-the-applications-of-set-theory-in-computer-science
592,Lobsters,math,Mathematics,Illustrating Mathematics using 3D Printers,https://arxiv.org/abs/1306.5599
593,Lobsters,math,Mathematics,Monte Carlo Integration Explanation in 1D,https://blog.demofox.org/2018/06/12/monte-carlo-integration-explanation-in-1d/
594,Lobsters,math,Mathematics,Recursive Lambda Functions the Y-Combinator,https://sookocheff.com/post/fp/recursive-lambda-functions/
595,Lobsters,math,Mathematics,The Paradox of the Proof (2013),http://projectwordsworth.com/the-paradox-of-the-proof/
596,Lobsters,math,Mathematics,The Beginning of the Monte Carlo Method,http://fermatslibrary.com/p/211f9aa0
597,Lobsters,math,Mathematics,The Beginning of the Monte Carlo Method (1987),https://fas.org/sgp/othergov/doe/lanl/pubs/00326866.pdf
598,Lobsters,math,Mathematics,Markets are efficient if and only if P = NP,https://arxiv.org/pdf/1002.2284.pdf
599,Lobsters,math,Mathematics,The Philosophy of Computational Complexity,https://ristret.com/s/qk8wpt/philosophy_computational_complexity
600,Lobsters,math,Mathematics,versilov/matrex - A blazing fast matrix library for Elixir/Erlang with C implementation using CBLAS,https://github.com/versilov/matrex
601,Lobsters,math,Mathematics,Reinforcement Learning of Theorem Proving,https://arxiv.org/abs/1805.07563
602,Lobsters,math,Mathematics,Theorem Proving in Lean,https://leanprover.github.io/theorem_proving_in_lean/introduction.html
603,Lobsters,math,Mathematics,A memory-bound graph-theoretic proof-of-work system,https://github.com/tromp/cuckoo
604,Lobsters,math,Mathematics,"SmoothLife: Generalization of Conway's ""Game of Life"" to a continuous domain",https://github.com/duckythescientist/SmoothLife
605,Lobsters,math,Mathematics,Is the Square a Secure Polygon?,http://www.math3ma.com/mathema/2018/5/17/is-the-square-a-secure-polygon
606,Lobsters,math,Mathematics,Frink: Tool and Programming Language for Physical Calculations,https://frinklang.org
607,Lobsters,math,Mathematics,What is mathwashing?,https://www.mathwashing.com/
608,Lobsters,math,Mathematics,The Axiom of Choice is Wrong,https://cornellmath.wordpress.com/2007/09/13/the-axiom-of-choice-is-wrong/
609,Lobsters,math,Mathematics,what the Dunning-Kruger effect is and isn’t,https://www.talyarkoni.org/blog/2010/07/07/what-the-dunning-kruger-effect-is-and-isnt/
610,Lobsters,math,Mathematics,Understanding Gergonne's Card Trick - Python implementation and underlying mathematics,https://taranovk.github.io/Card-Trick/
611,Lobsters,math,Mathematics,EvilPlot — A combinator based plotting library for Scala,https://medium.com/@CiboEng/evilplot-a-combinator-based-plotting-library-for-scala-4531f00208
612,Lobsters,math,Mathematics,Operads as a Potential Foundation for Systems of Systems (2016),http://categoricaldata.net/operadics/OperadicSoS.pdf
613,Lobsters,math,Mathematics,What are the top takeaways of graph theory?,/s/ibhw0b/what_are_top_takeaways_graph_theory
614,Lobsters,math,Mathematics,The quadratic equation and low-precision arithmetic,https://www.johndcook.com/blog/2018/04/28/quadratic-formula/
615,Lobsters,math,Mathematics,How much time does cutting corners save?,https://masonsimon.com/2018/04/28/how-much-time-does-cutting-corners-save/
616,Lobsters,math,Mathematics,An Algebraic Model for Parameterized Shape Editing,http://vladlen.info/publications/an-algebraic-model-for-parameterized-shape-editing/
617,Lobsters,math,Mathematics,Euclid's Elements,https://mathcs.clarku.edu/~djoyce/java/elements/toc.html
618,Lobsters,math,Mathematics,Why I've lost faith in p values,https://lucklab.ucdavis.edu/blog/2018/4/19/why-i-lost-faith-in-p-values
619,Lobsters,math,Mathematics,VoiceLoop: Voice Fitting and Synthesis via a Phonological Loop,https://ytaigman.github.io/loop/
620,Lobsters,math,Mathematics,Teaching Data Science to High Schoolers,http://mchow.com/posts/data-science-cbk/
621,Lobsters,math,Mathematics,Help needed: Static typing and algebra,/s/gjodxi/help_needed_static_typing_algebra
622,Lobsters,math,Mathematics,Prefix Sums and Summed Area Tables,https://blog.demofox.org/2018/04/16/prefix-sums-and-summed-area-tables/
623,Lobsters,math,Mathematics,Parsing: a timeline,https://jeffreykegler.github.io/personal/timeline_v3
624,Lobsters,math,Mathematics,Eight-bit floating point,https://www.johndcook.com/blog/2018/04/15/eight-bit-floating-point/
625,Lobsters,math,Mathematics,Software Testing as Species Discovery (statistical properties of fuzzing campaigns),https://arxiv.org/abs/1803.02130
626,Lobsters,math,Mathematics,"For mathematicians, = does not mean equality",https://jeremykun.com/2018/04/13/for-mathematicians-does-not-mean-equality/
627,Lobsters,math,Mathematics,"The Making of ""Peace for Triple Piano""",https://www.youtube.com/watch?v=x1zJoU6Luss
628,Lobsters,math,Mathematics,Metachirality?,https://www.youtube.com/watch?v=3ONwD9a9DWs
629,Lobsters,math,Mathematics,Electronic nose: Introduction to machine olfaction,http://www.maskau.dk/projects/electronic-nose
630,Lobsters,math,Mathematics,Determining if Two Date Ranges Overlap (2016),https://www.soliantconsulting.com/blog/determining-if-two-date-ranges-overlap
631,Lobsters,math,Mathematics,Formal Specification and Verification of Computer Algebra Software (2014),http://www.risc.jku.at/publications/download/risc_4981/main.pdf
632,Lobsters,math,Mathematics,String Similarity Algorithms Compared,https://medium.com/@appaloosastore/string-similarity-algorithms-compared-3f7b4d12f0ff
633,Lobsters,math,Mathematics,The Canadian who reinvented mathematics,http://projects.thestar.com/math-the-canadian-who-reinvented-mathematics/
634,Lobsters,math,Mathematics,The Practice of Mathematics,https://video.ias.edu/The-Practice-of-Mathematics
635,Lobsters,math,Mathematics,Quadric splines are useful too,http://wordsandbuttons.online/quadric_splines_are_useful_too.html
636,Lobsters,math,Mathematics,A Circuit-like Notation for the Lambda Calculus,http://csvoss.github.io/projects/2015/11/08/lambda-circuitry.html
637,Lobsters,math,Mathematics,Mathematics for Machine Learning,https://mml-book.github.io/
638,Lobsters,math,Mathematics,Kernel Density Estimation,https://mathisonian.github.io/kde/
639,Lobsters,math,Mathematics,Feynman on Fermat's Last Theorem,http://www.lbatalha.com/blog/feynman-on-fermats-last-theorem
640,Lobsters,math,Mathematics,Flowsnake Earth,http://archive.bridgesmathart.org/2017/bridges2017-237.pdf
641,Lobsters,math,Mathematics,Buzzword Convergence: Making Sense of Quantum Neural Blockchain AI—Stephen Wolfram Blog,http://blog.stephenwolfram.com/2018/04/buzzword-convergence-making-sense-of-quantum-neural-blockchain-ai/
642,Lobsters,math,Mathematics,"Waiting time, load factor, and queueing theory – why you need to cut your systems a bit of slack",https://erikbern.com/2018/03/27/waiting-time-load-factor-and-queueing-theory.html
643,Lobsters,math,Mathematics,Programmers Need To Learn Statistics Or I Will Kill Them All,https://zedshaw.com/archive/programmers-need-to-learn-statistics-or-i-will-kill-them-all/
644,Lobsters,math,Mathematics,Applied Category Theory,https://johncarlosbaez.wordpress.com/2018/03/26/seven-sketches-in-compositionality/
645,Lobsters,math,Mathematics,"Physics, Topology, Logic and Computation: A Rosetta Stone (2009)",https://arxiv.org/pdf/0903.0340.pdf
646,Lobsters,math,Mathematics,Analysis vs Algebra predicts eating corn?,http://bentilly.blogspot.com/2010/08/analysis-vs-algebra-predicts-eating.html
647,Lobsters,math,Mathematics,"Simit Programming Language: Linear, Algebra Language for Sparse Systems (2016)",http://simit-lang.org/language
648,Lobsters,math,Mathematics,"Talent, luck and success: simulating meritocracy and inequality with stochasticity",https://medium.com/@hongsupshin/talent-luck-and-success-simulating-meritocracy-and-inequality-with-stochasticity-501e0c1b4969
649,Lobsters,math,Mathematics,Seven Sketches in Compositionality: An Invitation to Applied Category Theory,https://arxiv.org/abs/1803.05316
650,Lobsters,math,Mathematics,10 Ways to Think Like a Mathematician,http://www.kevinhouston.net/pdf/10ways.pdf
651,Lobsters,math,Mathematics,"For Weighting Online Opt-In Samples, What Matters Most?",http://www.pewresearch.org/2018/01/26/for-weighting-online-opt-in-samples-what-matters-most/
652,Lobsters,math,Mathematics,Software Foundations - Vol 1-3,https://softwarefoundations.cis.upenn.edu/current/index.html
653,Lobsters,math,Mathematics,How to Bake 'How to Bake Pi': Reflections on Making Abstract Math Palatable,https://www.youtube.com/watch?v=h2p68JjSUH0
654,Lobsters,math,Mathematics,Attacking Merkle Trees with a Second Preimage Attack,https://flawed.net.nz/2018/02/21/attacking-merkle-trees-with-a-second-preimage-attack/
655,Lobsters,math,Mathematics,"Darts, Dice, and Coins: Sampling from a Discrete Distribution (2011)",http://www.keithschwarz.com/darts-dice-coins/
656,Lobsters,math,Mathematics,Voronoi variations 3,https://c25l.gitlab.io/posts/voronoi3/
657,Lobsters,math,Mathematics,The simple essence of automatic differentiation,http://conal.net/papers/essence-of-ad/
658,Lobsters,math,Mathematics,Elementary Knightship Found,http://www.conwaylife.com/forums/viewtopic.php?t=3303
659,Lobsters,math,Mathematics,Yet another definition of Intelligence,https://medium.com/@giacomo_59737/yet-another-definition-of-intelligence-9bbaaa73086d
660,Lobsters,math,Mathematics,Defending Scientism: Mathematics is a Part of Science,https://coelsblog.wordpress.com/2014/05/22/defending-scientism-mathematics-is-a-part-of-science/
661,Lobsters,math,Mathematics,A Fully Automatic Theorem Prover with Human-Style Output (2017),https://link.springer.com/content/pdf/10.1007%2Fs10817-016-9377-1.pdf
662,Lobsters,math,Mathematics,What does VR reveal about the 4th dimension?,http://www.albert-hwang.com/blog/2016/6/what-does-vr-reveal-about-the-4th-dimension
663,Lobsters,math,Mathematics,A succinct but comprehensive LaTeX quick reference.,https://math.meta.stackexchange.com/questions/5020/mathjax-basic-tutorial-and-quick-reference
664,Lobsters,math,Mathematics,An Invitation to the SETL Language (2004),https://www.linuxjournal.com/article/6805
665,Lobsters,math,Mathematics,Wolfenstein 3D's map renderer,https://www.youtube.com/watch?v=eOCQfxRQ2pY
666,Lobsters,math,Mathematics,J Software releases many APL/mathematical works under Creative Commons license,http://code.jsoftware.com/wiki/Community/Creative_Commons
667,Lobsters,math,Mathematics,An algebra of graphs,https://blogs.ncl.ac.uk/andreymokhov/an-algebra-of-graphs/
668,Lobsters,math,Mathematics,Types of Errors in Numerical Methods,https://waterprogramming.wordpress.com/2018/02/21/types-of-errors-in-numerical-methods/
669,Lobsters,math,Mathematics,Mathematics and Computation,https://www.math.ias.edu/avi/book
670,Lobsters,math,Mathematics,Smoothly Filling Holes in 3D meshes using Variational Calculus and Surface Fairing,https://erkaman.github.io/posts/hole_filling.html
671,Lobsters,math,Mathematics,Colorization Using Optimization,http://www.cs.huji.ac.il/~yweiss/Colorization/
672,Lobsters,math,Mathematics,How to Write a Proof (1993) Lamport,http://lamport.azurewebsites.net/pubs/lamport-how-to-write.pdf
673,Lobsters,math,Mathematics,Introduction to Statistical Learning with Applications in R,http://www-bcf.usc.edu/~gareth/ISL/
674,Lobsters,math,Mathematics,Elementary Algebra by K. E. Iverson (1971),http://www.softwarepreservation.org/projects/apl/Papers/ElementaryAlgebra
675,Lobsters,math,Mathematics,I don’t understand Graph Theory.,https://medium.com/@vardanator/i-dont-understand-graph-theory-1c96572a1401
676,Lobsters,math,Mathematics,Collecting user data while protecting user privacy,https://www.kryogenix.org/days/2018/02/20/collecting-user-data-while-protecting-user-privacy/
677,Lobsters,math,Mathematics,Computational Geometry Tutorial,http://wykobi.com/tutorial0.html
678,Lobsters,math,Mathematics,Math jobs you don't want: assistant to John von Neumann,https://shitpost.plover.com/m/math.jobs-you-dont-want.html
679,Lobsters,math,Mathematics,My first PostgreSQL extension: pg_rational,/s/7akkwt/my_first_postgresql_extension_pg
680,Lobsters,math,Mathematics,Let's Learn About Waveforms,http://waveforms.surge.sh/waveforms-intro
681,Lobsters,math,Mathematics,Mindless Statistics,http://library.mpib-berlin.mpg.de/ft/gg/GG_Mindless_2004.pdf
682,Lobsters,math,Mathematics,Introducing the backprop library: automatic differentiation of heterogeneous Haskell functions,https://blog.jle.im/entry/introducing-the-backprop-library.html
683,Lobsters,math,Mathematics,Implementation of a robust no-fit polygon generation in a C++ library (github.com),https://github.com/kallaballa/libnfp.git
684,Lobsters,math,Mathematics,Graphical Linear Algebra,https://graphicallinearalgebra.net/
685,Lobsters,math,Mathematics,Think DSP – Free Book on Implementing Digital Signal Processing in Python,http://greenteapress.com/wp/think-dsp/
686,Lobsters,math,Mathematics,An Intuitive Explanation of using Poisson Blending for Seamless Copy-and-Paste of Images,https://erkaman.github.io/posts/poisson_blending.html
687,Lobsters,math,Mathematics,The Matrix Calculus You Need For Deep Learning,http://parrt.cs.usfca.edu/doc/matrix-calculus/index.html
688,Lobsters,math,Mathematics,sinc lowpass in time domain,http://guu.fi/g/sinc-lowpass.html
689,Lobsters,math,Mathematics,The Matrix Calculus You Need For Deep Learning,http://parrt.cs.usfca.edu/doc/matrix-calculus/
690,Lobsters,math,Mathematics,"Mathematics of the Discrete Fourier Transform (DFT), with Audio Applications (2nd ed) (2007)",http://www.dsprelated.com/dspbooks/mdft/MATHEMATICS_DISCRETE_FOURIER_TRANSFORM.html
691,Lobsters,math,Mathematics,Blooms: Phi-Based Strobe Animated Sculptures,http://www.instructables.com/id/Blooming-Zoetrope-Sculptures/
692,Lobsters,math,Mathematics,Showing Off to the Universe: Beacons for the Afterlife of Our Civilization,http://blog.stephenwolfram.com/2018/01/showing-off-to-the-universe-beacons-for-the-afterlife-of-our-civilization/
693,Lobsters,math,Mathematics,Game-theoretic Approach to Tradition,http://250bpm.com/blog:118
694,Lobsters,math,Mathematics,Why Discrete Math Is Important,https://artofproblemsolving.com/articles/discrete-math
695,Lobsters,math,Mathematics,“Dancing Links” pre-fascicle 5c of Knuth's TAOCP,https://www-cs-faculty.stanford.edu/~knuth/fasc5c.ps.gz
696,Lobsters,math,Mathematics,Inventor Claims to Have Solved Floating Point Error Problem,https://www.hpcwire.com/2018/01/17/inventor-claims-solved-floating-point-error-problem/
697,Lobsters,math,Mathematics,The sound of space-filling curves,http://www.win.tue.nl/~hermanh/doku.php?id=sound_of_space-filling_curves
698,Lobsters,math,Mathematics,A Primer on Boolean Satisfiability,https://homes.cs.washington.edu/~emina/blog/2017-06-23-a-primer-on-sat.html
699,Lobsters,math,Mathematics,Area Lights with LTCs,http://blog.magnum.graphics/guest-posts/area-lights-with-ltcs/
700,Lobsters,math,Mathematics,The Power of Two Random Choices: A Survey of Techniques and Results (2001),http://www.eecs.harvard.edu/~michaelm/postscripts/handbook2001.pdf
701,Lobsters,math,Mathematics,Mathematics for Human Flourishing,https://mathyawp.wordpress.com/2017/01/08/mathematics-for-human-flourishing/
702,Lobsters,math,Mathematics,GPU Fluid Simulation,https://benedikt-bitterli.me/gpu-fluid.html
703,Lobsters,math,Mathematics,Techniques for Factoring Numbers in Your Head,http://exupero.org/hazard/post/prime-modulo/
704,Lobsters,math,Mathematics,Divisibility by 7 is a Walk on a Graph,https://blog.tanyakhovanova.com/2009/08/divisibility-by-7-is-a-walk-on-a-graph-by-david-wilson/
705,Lobsters,math,Mathematics,50th Known Mersenne Prime Discovered,https://www.mersenne.org/primes/press/M77232917.html
706,Lobsters,math,Mathematics,Random with care,https://eev.ee/blog/2018/01/02/random-with-care/
707,Lobsters,math,Mathematics,A WebGL based oscilloscope emulator,http://m1el.github.io/woscope-how/index.html
708,Lobsters,math,Mathematics,Probability and Statistics Cookbook,http://pages.cs.wisc.edu/~tdw/files/cookbook-en.pdf
709,Lobsters,math,Mathematics,"Clojure Numerics, Part 6 - More Linear Algebra Fun with Least Squares",http://dragan.rocks/articles/17/Clojure-Numerics-6-More-Linear-Algebra-Fun-with-Least-Squares
710,Lobsters,math,Mathematics,"Generalization Theory and Deep Nets, An introduction",http://offconvex.github.io/2017/12/08/generalization1/
711,Lobsters,math,Mathematics,Stats Without Tears (2016),https://brownmath.com/swt/
712,Lobsters,math,Mathematics,Notes on negation,http://bitmath.blogspot.com/2017/12/notes-on-negation.html
713,Lobsters,math,Mathematics,"Exploring Physics with Geometric Algebra, Book I [pdf] (2016)",http://peeterjoot.com/archives/math2015/gabookI.pdf
714,Lobsters,math,Mathematics,How to cheat at Settlers by loading the dice,https://izbicki.me/blog/how-to-cheat-at-settlers-of-catan-by-loading-the-dice-and-prove-it-with-p-values.html
715,Lobsters,math,Mathematics,A More Conversational Sublevel,https://medium.com/@lucianmarin/a-more-conversational-sublevel-4f8275dfa1e8
716,Lobsters,math,Mathematics,How to Read Mathematics,http://www.people.vcu.edu/~dcranston/490/handouts/math-read.html
717,Lobsters,math,Mathematics,The Mathematics of 2048: Counting States by Exhaustive Enumeration,http://jdlm.info/articles/2017/12/10/counting-states-enumeration-2048.html
718,Lobsters,math,Mathematics,Fun With Random Numbers: Random Projection,http://jasonpunyon.com/blog/2017/12/02/fun-with-random-numbers-random-projection
719,Lobsters,math,Mathematics,"Napoleon was the Best General Ever, and the Math Proves it.",https://towardsdatascience.com/napoleon-was-the-best-general-ever-and-the-math-proves-it-86efed303eeb
720,Lobsters,math,Mathematics,Down with Determinants!,http://www.axler.net/DwD.html
721,Lobsters,math,Mathematics,"Dice Become Ordered When Stirred, Not Shaken",https://physics.aps.org/articles/v10/130
722,Lobsters,math,Mathematics,The Corpus Christi Prime,https://friendlyfieldsandopenmaps.com/2017/09/08/the-corpus-christi-prime/
723,Lobsters,math,Mathematics,A Gentle Introduction to Erasure Codes,https://www.akalin.com/intro-erasure-codes
724,Lobsters,math,Mathematics,Open Problem Garden,http://www.openproblemgarden.org/
725,Lobsters,math,Mathematics,"Hamiltonian Dynamics: Breaking down a Haskell project w/ physics, linear alg, datakinds, ad, hmatrix",https://blog.jle.im/entry/hamiltonian-dynamics-in-haskell.html
726,Lobsters,math,Mathematics,Things I Have Learned (So Far),https://pdfs.semanticscholar.org/fa77/0a7fb7c45a59abbc4c2bc7d174fa51e5d946.pdf
727,Lobsters,math,Mathematics,"Common Math Symbols in HTML, XML, TeX, and Unicode",https://www.johndcook.com/blog/math_symbols/
728,Lobsters,math,Mathematics,Contrast codes are an implementation detail,http://scattered-thoughts.net/blog/2017/11/21/contrast-coding-is-an-implementation-detail/
729,Lobsters,math,Mathematics,Demystifying Floating Point Precision,https://blog.demofox.org/2017/11/21/floating-point-precision/
730,Lobsters,math,Mathematics,Think Bayes - Bayesian Statistics Made Simple,http://greenteapress.com/wp/think-bayes/
731,Lobsters,math,Mathematics,Matrix Calculus,http://www.matrixcalculus.org/
732,Lobsters,math,Mathematics,Fast exact integer divisions using floating-point operations,https://lemire.me/blog/2017/11/16/fast-exact-integer-divisions-using-floating-point-operations/
733,Lobsters,math,Mathematics,The Coin Flip: A Fundamentally Unfair Proposition?,https://econ.ucsb.edu/~doug/240a/Coin%20Flip.htm
734,Lobsters,math,Mathematics,À la carte Entropy,http://shape-of-code.coding-guidelines.com/2017/11/15/a-la-carte-entropy/
735,Lobsters,math,Mathematics,"STARKs, Part I: Proofs with Polynomials",http://vitalik.ca/general/2017/11/09/starks_part_1.html
736,Lobsters,math,Mathematics,Inside a text-based search library,https://blog.kabir.ml/posts/inside-wade.html
737,Lobsters,math,Mathematics,Fake news: “Math is about nothing”,http://www.crikeymath.com/2017/09/12/fake-news-math-is-about-nothing/
738,Lobsters,math,Mathematics,Understanding Perlin Noise,http://flafla2.github.io/2014/08/09/perlinnoise.html
739,Lobsters,math,Mathematics,DIY Random Number Generator - Slashdot comment,https://slashdot.org/comments.pl?sid=193904&cid=15899118
740,Lobsters,math,Mathematics,Markov's Inequality for Matrices,https://people.eecs.berkeley.edu/~stephentu/blog/probability-theory/matrix-analysis/2017/11/04/matrix-markovs-inequality.html
741,Lobsters,math,Mathematics,Self-Replicating Functions,http://tylerneylon.com/a/self_repl/
742,Lobsters,math,Mathematics,"Vector Fields, Math and Art",https://anvaka.github.io/fieldplay/
743,Lobsters,math,Mathematics,Some Natural Solutions to the p-value Communication Problem— And Why They Won’t Work,http://www.stat.columbia.edu/~gelman/research/published/jasa_signif_2.pdf
744,Lobsters,math,Mathematics,Gerard Huet Reflects On The History Of Theorem Provers,https://50ans.inria.fr/en/gerard-huet-languages-and-software/
745,Lobsters,math,Mathematics,Axioms of constructive geometry (1996),https://ac.els-cdn.com/0168007295000052/1-s2.0-0168007295000052-main.pdf?_tid=5ebda0a6-c011-11e7-9b6c-00000aacb35f&acdnat=1509656829_464f11e6375dd57f20f57e87e305f2d6
746,Lobsters,math,Mathematics,The Blind Spot and the cut rule,https://blog.plover.com/math/logic/cut-rule.html
747,Lobsters,math,Mathematics,Practical applications of the dot product,https://medium.com/vertices-and-faces/practical-applications-of-the-dot-product-c5503c2e454e
748,Lobsters,math,Mathematics,On The Notion Of Interestingness In Automated Mathematical Discovery (2000),http://spiral.imperial.ac.uk:8080/bitstream/10044/1/675/1/On%20the%20notion%20of%20interestingness.pdf
749,Lobsters,math,Mathematics,Advanced Aspects of Digital Audio,http://stephan.win31.de/aada.htm
750,Lobsters,math,Mathematics,How Error Correcting Codes and Reed-Solomon works,https://monades.roperzh.com/error-correction-reed-solomon/
751,Lobsters,math,Mathematics,Problem Solving with MiniZinc,http://blog.jpalardy.com/posts/problem-solving-with-minizinc/
752,Lobsters,math,Mathematics,TensorFlow 101,https://mubaris.com/2017-10-21/tensorflow-101
753,Lobsters,math,Mathematics,Modelling Data with Hypergraphs,https://blog.grakn.ai/modelling-data-with-hypergraphs-edff1e12edf0
754,Lobsters,math,Mathematics,Arithmetic Gas,https://mathematicalgarden.wordpress.com/2014/08/27/arithmetic-gas/
755,Lobsters,math,Mathematics,The Top 13 Resources for Understanding Graph Theory & Algorithms,https://neo4j.com/blog/top-13-resources-graph-theory-algorithms/
756,Lobsters,math,Mathematics,Who Invented ‘Zero’?,https://www.nytimes.com/2017/10/07/opinion/sunday/who-invented-zero.html
757,Lobsters,math,Mathematics,Bartosz Milewski's 'Category Theory for Programmers' compiled in PDF,https://github.com/hmemcpy/milewski-ctfp-pdf
