ID,Source,Tag_Code,Tag_Name,Title,Url
758,Lobsters,math,Mathematics,Visionary Mathematician Vladimir Voevodsky Dies at 51,https://www.quantamagazine.org/visionary-mathematician-vladimir-voevodsky-dies-at-51-20171011/
759,Lobsters,math,Mathematics,Category Theory proofs in Idris,http://sitr.us/2014/05/05/category-theory-proofs-in-idris.html
760,Lobsters,math,Mathematics,Metaballs and Marching Squares,http://jamie-wong.com/2014/08/19/metaballs-and-marching-squares/
761,Lobsters,math,Mathematics,"Clojure Numerics, Part 4 - Singular Value Decomposition (SVD)",http://dragan.rocks/articles/17/Clojure-Numerics-4-Singular-Value-Decomposition-SVD
762,Lobsters,math,Mathematics,Tensorflow sucks,http://nicodjimenez.github.io/2017/10/08/tensorflow.html
763,Lobsters,math,Mathematics,Hasse diagram of the 2008 Olympic medal table,https://tartarus.org/~simon/2008-olympics-hasse/
764,Lobsters,math,Mathematics,Image Dithering: Eleven Algorithms and Source Code,http://www.tannerhelland.com/4660/dithering-eleven-algorithms-source-code/
765,Lobsters,math,Mathematics,Sieve Of Eratosthenes In Python,http://www.solipsys.co.uk/new/SieveOfEratosthenesInPython.html
766,Lobsters,math,Mathematics,Should the elementary concepts of category theory be taught in pre-college courses?,https://www.quora.com/Should-the-elementary-concepts-of-category-theory-be-taught-in-pre-college-courses-Could-that-be-a-benefit-for-the-general-population
767,Lobsters,math,Mathematics,Illustrating Group Theory: A Coloring Book,http://www.coloring-book.co/#!/?pageNumber=0&pageName=cover
768,Lobsters,math,Mathematics,What is the rationale for all comparisons returning false for IEEE754 NaN values?,https://stackoverflow.com/questions/1565164/what-is-the-rationale-for-all-comparisons-returning-false-for-ieee754-nan-values
769,Lobsters,math,Mathematics,"Response to some comments on ""Abandon Statistical Significance""",http://andrewgelman.com/2017/10/02/response-comments-abandon-statistical-significance/
770,Lobsters,math,Mathematics,Calculating the Distance Between Points in “Wrap Around” (Toroidal) Space,https://blog.demofox.org/2017/10/01/calculating-the-distance-between-points-in-wrap-around-toroidal-space/
771,Lobsters,math,Mathematics,"The Haskell Road to Logic, Math, and Programming",https://fldit-www.cs.uni-dortmund.de/~peter/PS07/HR.pdf
772,Lobsters,math,Mathematics,Picrypt Encryption Library,https://github.com/tjgillies/picrypt/blob/master/demo/main.go
773,Lobsters,math,Mathematics,The type system of mathematics (2013),https://qchu.wordpress.com/2013/05/28/the-type-system-of-mathematics/
774,Lobsters,math,Mathematics,Floating Point Visually Explained,http://fabiensanglard.net/floating_point_visually_explained/
775,Lobsters,math,Mathematics,Abandon Statistical Significance,http://andrewgelman.com/2017/04/19/abandon-statistical-significance/
776,Lobsters,math,Mathematics,Shtetl-Optimized: Big Numbers,https://www.scottaaronson.com/blog/?p=3445
777,Lobsters,math,Mathematics,Another fast fixed-point sine approximation,http://www.coranac.com/2009/07/sines/
778,Lobsters,math,Mathematics,The Mathematics of 2048: Counting States with Combinatorics,http://jdlm.info/articles/2017/09/17/counting-states-combinatorics-2048.html
779,Lobsters,math,Mathematics,modeling with distance functions,http://iquilezles.org/www/articles/distfunctions/distfunctions.htm
780,Lobsters,math,Mathematics,Conservative Logic,http://52.7.130.124/wp-content/uploads/2015/07/ConservativeLogic.pdf
781,Lobsters,math,Mathematics,0ldskool Plasma Effect,https://www.bidouille.org/prog/plasma
782,Lobsters,math,Mathematics,Tracing metaballs in two dimensions,https://eightsquaredsoftware.com/articles/metaball.html
783,Lobsters,math,Mathematics,The Joy of Sexagesimal Floating-Point Arithmetic,https://blogs.scientificamerican.com/roots-of-unity/the-joy-of-sexagesimal-floating-point-arithmetic/
784,Lobsters,math,Mathematics,Computing the inverse of odd integers,https://lemire.me/blog/2017/09/18/computing-the-inverse-of-odd-integers/
785,Lobsters,math,Mathematics,The Minsky Circle Algorithm,https://nbickford.wordpress.com/2011/04/03/the-minsky-circle-algorithm/
786,Lobsters,math,Mathematics,There are Only Four Billion Floats – So Test Them All!,https://randomascii.wordpress.com/2014/01/27/theres-only-four-billion-floatsso-test-them-all/
787,Lobsters,math,Mathematics,All the Linear Algebra You Need for AI,https://github.com/fastai/fastai/blob/master/tutorials/linalg_pytorch.ipynb
788,Lobsters,math,Mathematics,EvalAI: An open source alternative of Kaggle,https://github.com/Cloud-CV/EvalAI
789,Lobsters,math,Mathematics,Dependent Types,https://hydraz.club/posts/2017-09-08.html
790,Lobsters,math,Mathematics,The Xorshift128+ random number generator fails BigCrush,https://lemire.me/blog/2017/09/08/the-xorshift128-random-number-generator-fails-bigcrush/
791,Lobsters,math,Mathematics,Tabular Integration by Parts (1990),https://www.maa.org/sites/default/files/pdf/mathdl/CMJ/Horowitz307-311.pdf
792,Lobsters,math,Mathematics,When Exactly Will the Eclipse Happen? A Multimillenium Tale of Computation,http://blog.stephenwolfram.com/2017/08/when-exactly-will-the-eclipse-happen-a-multimillenium-tale-of-computation/
793,Lobsters,math,Mathematics,Parallel White Noise Generation on a GPU via Cryptographic Hash,http://www.slideserve.com/aliya/parallel-white-noise-generation-on-a-gpu-via-cryptographic-hash
794,Lobsters,math,Mathematics,"Articles on fractals, computer graphics, mathematics, demoscene and more",http://iquilezles.org/www/index.htm
795,Lobsters,math,Mathematics,Finding the First 10-digit Prime in (a Billion) Digits of e,http://www.hanshq.net/eprime.html
796,Lobsters,math,Mathematics,Great Trigonometrical Survey,https://en.wikipedia.org/wiki/Great_Trigonometrical_Survey
797,Lobsters,math,Mathematics,Hyperbolic VR,http://elevr.com/portfolio/hyperbolic-vr/
798,Lobsters,math,Mathematics,Mastering Bayes,http://www.machinegurning.com/rstats/bayes_r/
799,Lobsters,math,Mathematics,A Game of Life on Penrose tilings,https://arxiv.org/abs/1708.09301
800,Lobsters,math,Mathematics,Category Theory for Programmers,https://bartoszmilewski.com/2014/10/28/category-theory-for-programmers-the-preface/
801,Lobsters,math,Mathematics,Don't Fall for Babylonian Trigonometry Hype,https://blogs.scientificamerican.com/roots-of-unity/dont-fall-for-babylonian-trigonometry-hype/
802,Lobsters,math,Mathematics,Attention Mechanisms in Recurrent Neural Networks (RNNs) - IGGG,https://www.youtube.com/watch?v=QuvRWevJMZ4
803,Lobsters,math,Mathematics,"Physics, Topology, Logic and Computation: A Rosetta Stone",http://math.ucr.edu/home/baez/rosetta.pdf
804,Lobsters,math,Mathematics,How Much Water Is Falling On Southeast Texas Right Now?,https://medium.com/@johnknox_uab88/how-much-water-is-falling-on-southeast-texas-right-now-a1b21f1d028
805,Lobsters,math,Mathematics,Classic Nintendo Games are (NP-)Hard,https://pdfs.semanticscholar.org/b356/38141f0b9bfeeef18966f68f2321bf6a8ecd.pdf
806,Lobsters,math,Mathematics,The hidden math behind Alice in Wonderland (2010),https://www.maa.org/external_archive/devlin/devlin_03_10.html
807,Lobsters,math,Mathematics,How to become a Bayesian in eight easy steps: An anontated reading list,https://osf.io/preprints/psyarxiv/ph6sw
808,Lobsters,math,Mathematics,Satellite Image Segmentation: a Workflow with U-Net,https://vooban.com/en/tips-articles-geek-stuff/satellite-image-segmentation-workflow-with-u-net/
809,Lobsters,math,Mathematics,Mathematical secrets of ancient tablet unlocked after nearly a century of study,https://www.theguardian.com/science/2017/aug/24/mathematical-secrets-of-ancient-tablet-unlocked-after-nearly-a-century-of-study
810,Lobsters,math,Mathematics,Testing non-cryptographic random number generators: my results,https://lemire.me/blog/2017/08/22/testing-non-cryptographic-random-number-generators-my-results/
811,Lobsters,math,Mathematics,Generic GPU Kernels in Julia,http://mikeinnes.github.io/2017/08/24/cudanative.html
812,Lobsters,math,Mathematics,RSA key strength and math,http://0xcc.re/key-strength-and-math/
813,Lobsters,math,Mathematics,The unreasonable relationship between speed and power,https://www.evernote.com/shard/s368/sh/bc7cd2e9-b783-4aef-9e89-03ac6691bbbb/f910e7c57a148780671fe8ee1c0c3576
814,Lobsters,math,Mathematics,Sin & Cos: The Programmer's Pals!,http://www.helixsoft.nl/articles/circle/sincos.htm
815,Lobsters,math,Mathematics,How Are PCA and SVD Related?,https://intoli.com/blog/pca-and-svd/
816,Lobsters,math,Mathematics,The Icewind Dale Problem,http://koaning.io/the-icewind-dale-problem.html
817,Lobsters,math,Mathematics,The Beauty of Bresenham's Algorithm,http://members.chello.at/~easyfilter/bresenham.html
818,Lobsters,math,Mathematics,Recognizing when two arithmetic expressions are essentially the same,https://blog.plover.com/math/24-puzzle-2.html
819,Lobsters,math,Mathematics,Would a Perfect Computer be Old-Fashioned?,http://www.quadibloc.com/arch/perint.htm
820,Lobsters,math,Mathematics,Understanding Asymmetric Numeral Systems,https://ro-che.info/articles/2017-08-20-understanding-ans
821,Lobsters,math,Mathematics,Minus Zero,https://www.fourmilab.ch/documents/univac/minuszero.html
822,Lobsters,math,Mathematics,On Norbert Blum’s claimed proof that P does not equal NP,https://lucatrevisan.wordpress.com/2017/08/15/on-norbert-blums-claimed-proof-that-p-does-not-equal-np/
823,Lobsters,math,Mathematics,Vector Autoregression Overview and Proposals,https://fylux.github.io/2017/08/09/VAR_Model_Time_Series/
824,Lobsters,math,Mathematics,How to Generate a Sequence of Unique Random Integers,http://preshing.com/20121224/how-to-generate-a-sequence-of-unique-random-integers
825,Lobsters,math,Mathematics,A Solution of the P versus NP Problem,https://arxiv.org/abs/1708.03486
826,Lobsters,math,Mathematics,Fixed Point Division,http://blog.veitheller.de/Fixed_Point_Division.html
827,Lobsters,math,Mathematics,Napkin ring problem,https://en.wikipedia.org/wiki/Napkin_ring_problem
828,Lobsters,math,Mathematics,hoc7 — (high-order calculator) [interactive floating-point language],http://ftp.math.utah.edu/pub/hoc/hoc-7.0.6.beta.pdf
829,Lobsters,math,Mathematics,Less Weird Quaternions,https://probablydance.com/2017/08/05/intuitive-quaternions/
830,Lobsters,math,Mathematics,3 Simple Steps to Implement Inverse Kinematics,http://gamasutra.com/blogs/LuisBermudez/20170804/303066/3_Simple_Steps_to_Implement_Inverse_Kinematics.php
831,Lobsters,math,Mathematics,Typesafe modular arithmetic in Haskell,https://rkrishnan.org/posts/2017-06-20-typesafe-modulus-in-haskell.html
832,Lobsters,math,Mathematics,How do you find the integer solutions to x/(y + z) + y/(x + z) + z/(x + y) = 4?,https://www.quora.com/What-is-an-example-of-a-conjecture-that-was-proven-wrong-for-very-large-numbers
833,Lobsters,math,Mathematics,Generating Random Numbers From a Specific Distribution By Inverting the CDF,https://blog.demofox.org/2017/08/05/generating-random-numbers-from-a-specific-distribution-by-inverting-the-cdf/
834,Lobsters,math,Mathematics,Markov's and Chebyshev's Inequalities Explained,https://intoli.com/blog/chebyshevs-inequality/
835,Lobsters,math,Mathematics,Introduction to Reed-Solomon and Berlekamp-Welch for error correction (+ Go library),https://innovation.vivint.com/introduction-to-reed-solomon-bc264d0794f8
836,Lobsters,math,Mathematics,A Bigger Mathematical Picture for Computer Graphics,https://www.youtube.com/watch?v=WZApQkDBr5o
837,Lobsters,math,Mathematics,Naming Convention for Matrix Math,https://www.sebastiansylvan.com/post/matrix_naming_convention/
838,Lobsters,math,Mathematics,A potential new Polymath project: intransitive dice,https://gowers.wordpress.com/2017/04/28/a-potential-new-polymath-project-intransitive-dice/
839,Lobsters,math,Mathematics,The Evolution of Trust (Game Theory),http://ncase.me/trust/
840,Lobsters,math,Mathematics,"The Equidistribution of Lattice Shapes of Rings of Integers of Cubic, Quartic, and Quintic Number Fi",http://www.theliberatedmathematician.com/wp-content/uploads/2015/11/PiperThesisPostPrint.pdf
841,Lobsters,math,Mathematics,Graphical modeling using L-system,http://algorithmicbotany.org/papers/abop/abop-ch1.pdf
842,Lobsters,math,Mathematics,Computing Statistics on Terabytes of Data on Multiple Machines,https://blog.algolia.com/computing-statistics-terabytes-data-multiple-machines/
843,Lobsters,math,Mathematics,Understanding Neural Network Weight Initialization,https://intoli.com/blog/neural-network-initialization/
844,Lobsters,math,Mathematics,Exploring Histograms,http://tinlizzie.org/histograms/
845,Lobsters,math,Mathematics,Robocodes: Towards Generative Street Addresses from Satellite Imagery,https://research.fb.com/wp-content/uploads/2017/07/cvpr_ev_final_sent.pdf
846,Lobsters,math,Mathematics,Using Hilbert Curves to 100% Zelda,https://blog.merovius.de/2017/07/22/using-hilbert-curves-to-100-zelda.html
847,Lobsters,math,Mathematics,Ratings and Champion Skill,https://www.thebettermeta.com/posts/2017/07/20/ratings/
848,Lobsters,math,Mathematics,Zero -- Invented or Discovered?,https://www.farnamstreetblog.com/2017/07/zero-invented-discovered/
849,Lobsters,math,Mathematics,complex arithmetic is complicated,https://medium.com/@smcallis_71148/complex-arithmetic-is-complicated-873ec0c69fc5
850,Lobsters,math,Mathematics,"Maryam Mirzakhani, Stanford mathematician and Fields Medal winner, dies",http://news.stanford.edu/2017/07/15/maryam-mirzakhani-stanford-mathematician-and-fields-medal-winner-dies/
851,Lobsters,math,Mathematics,Quick Insight: Subtracting Negative Numbers,https://betterexplained.com/articles/subtracting-negative-numbers/
852,Lobsters,math,Mathematics,The Lost Art of Square Roots,https://medium.com/i-math/how-to-find-square-roots-by-hand-f3f7cadf94bb
853,Lobsters,math,Mathematics,The strange and righteous history of the equals sign,https://arstechnica.com/science/2017/07/how-the-equals-sign-changed-the-world/
854,Lobsters,math,Mathematics,Dip Transform for 3D Shape Reconstruction,http://irc.cs.sdu.edu.cn/3dshape/
855,Lobsters,math,Mathematics,MRPyMC3 - Multilevel Regression and Poststratification with PyMC3,http://austinrochford.com/posts/2017-07-09-mrpymc3.html
856,Lobsters,math,Mathematics,A Graph Model of the Lambda Calculus,https://github.com/jozefg/graph-models
857,Lobsters,math,Mathematics,Solving the Zebra Puzzle with Boolean Algebra,https://code.energy/solving-zebra-puzzle/
858,Lobsters,math,Mathematics,Counterintuitive problem: Everyone in a room keeps giving dollars to random others,http://www.decisionsciencenews.com/2017/06/19/counterintuitive-problem-everyone-room-keeps-giving-dollars-random-others-youll-never-guess-happens-next/
859,Lobsters,math,Mathematics,Constructing the Sierpinski triangle,http://www.oftenpaper.net/sierpinski.htm
860,Lobsters,math,Mathematics,Unicode Plain Text Encoding of Mathematics,http://www.unicode.org/notes/tn28/UTN28-PlainTextMath-v3.1.pdf
861,Lobsters,math,Mathematics,Beyond Floating Point,http://www.johngustafson.net/pdfs/BeatingFloatingPoint.pdf
862,Lobsters,math,Mathematics,A Path Less Taken to the Peak of the Math World,https://www.quantamagazine.org/a-path-less-taken-to-the-peak-of-the-math-world-20170627/
863,Lobsters,math,Mathematics,Mysterious Math StackExchange user has a penchant for solving difficult integrals,https://plus.google.com/+johncbaez999/posts/9mCF43cqvSn
864,Lobsters,math,Mathematics,Wavelets – part 1,http://michaeljflynn.net/2017/06/26/wavelets-part-1/
865,Lobsters,math,Mathematics,The Map of Mathematics: Animation Shows How All the Different Fields in Math Fit Together,http://www.openculture.com/2017/02/the-map-of-mathematics.html
866,Lobsters,math,Mathematics,Mathematical Genealogy,https://jeremykun.com/2017/06/22/mathematical-genealogy/
867,Lobsters,math,Mathematics,3D Packing for SLS Printing (How many 3DBenchy boats can the Fuse 1 print?),https://www.michaelfogleman.com/pack3d/
868,Lobsters,math,Mathematics,Probabilistic programming from scratch,https://www.oreilly.com/learning/probabilistic-programming-from-scratch
869,Lobsters,math,Mathematics,Quaternion quantization,http://marc-b-reynolds.github.io/quaternions/2017/05/02/QuatQuantPart1.html
870,Lobsters,math,Mathematics,"Tabs, spaces and your salary - how is it really?",http://evelinag.com/blog/2017/06-20-stackoverflow-tabs-spaces-and-salary/index.html
871,Lobsters,math,Mathematics,Intro to SDR and RF Signal Analysis,https://www.elttam.com.au/blog/intro-sdr-and-rf-analysis/
872,Lobsters,math,Mathematics,Render the Mandelbrot Set with jq,http://nullprogram.com/blog/2016/09/15/
873,Lobsters,math,Mathematics,Mathematicians deliver formal proof of Kepler Conjecture,https://www.eurekalert.org/pub_releases/2017-06/cup-mdf061617.php
874,Lobsters,math,Mathematics,The Mosteller Hall Puzzle,http://jonathanweisberg.org/post/Teaching%20Monty%20Hall/
875,Lobsters,math,Mathematics,Common Developments of Three Incongruent Boxes of Area 30,https://twitter.com/jmitani/status/871685924513607683
876,Lobsters,math,Mathematics,Tupper's self-referential formula,https://en.wikipedia.org/wiki/Tupper%27s_self-referential_formula
877,Lobsters,math,Mathematics,Hedging Bets,http://angersock.com/blog/2017/06/12/hedging-bets
878,Lobsters,math,Mathematics,Can’t see the FOUR-est for the trees.,http://www.gigamonkeys.com/trees/
879,Lobsters,math,Mathematics,How to Find a Fast Floating-Point atan2 Approximation,https://www.DSPRelated.com/showarticle/1052.php
880,Lobsters,math,Mathematics,"ConceptNet Numberbatch 17.04: better, less-stereotyped word vectors",https://blog.conceptnet.io/2017/04/24/conceptnet-numberbatch-17-04-better-less-stereotyped-word-vectors/
881,Lobsters,math,Mathematics,Tupper’s Self-Referential Formula Debunked,http://arvindn.livejournal.com/132943.html
882,Lobsters,math,Mathematics,xoroshiro+/xorshift*/xorshift+ generators and the PRNG shootout,http://xoroshiro.di.unimi.it/
883,Lobsters,math,Mathematics,"Floating Point Imprecision: or, why we had to make a regression release",http://blogs.asterisk.org/2016/06/01/float-conversion-bad-released-13-9-1-regression-fix/
884,Lobsters,math,Mathematics,Float or double?,http://www.ilikebigbits.com/blog/2017/6/1/float-or-double
885,Lobsters,math,Mathematics,4D Toys: a box of four-dimensional toys,http://marctenbosch.com/news/2017/06/4d-toys-a-box-of-four-dimensional-toys/
886,Lobsters,math,Mathematics,Miniball,https://d3.express/@mbostock/miniball
887,Lobsters,math,Mathematics,What we talk about when we talk about types,https://joyofhaskell.com/posts/2017-05-31-is-vs-has.html
888,Lobsters,math,Mathematics,A Generative Approach to Simulating Watercolor Paints,http://www.tylerlhobbs.com/writings/watercolor
889,Lobsters,math,Mathematics,Functional Geometry,https://eprints.soton.ac.uk/257577/1/funcgeo2.pdf
890,Lobsters,math,Mathematics,ALEXANDRIA: Large-Scale Formal Proof for the Working Mathematician,https://www.cl.cam.ac.uk/~lp15/Grants/Alexandria/
891,Lobsters,math,Mathematics,When Random Numbers Are Too Random: Low Discrepancy Sequences,https://blog.demofox.org/2017/05/29/when-random-numbers-are-too-random-low-discrepancy-sequences/
892,Lobsters,math,Mathematics,Shuffling and Smooshing,https://www.quantamagazine.org/20150414-for-persi-diaconis-next-magic-trick/
893,Lobsters,math,Mathematics,Multiplicitous P-Values,https://putanumonit.com/2016/12/18/multiplicitous/
894,Lobsters,math,Mathematics,Compiling to categories,http://conal.net/papers/compiling-to-categories/compiling-to-categories.pdf
895,Lobsters,math,Mathematics,A Ray Tracer,http://www.purplealienplanet.com/node/20
896,Lobsters,math,Mathematics,Encyclopedia of Triangle Centers,http://faculty.evansville.edu/ck6/encyclopedia/ETC.html
897,Lobsters,math,Mathematics,How Bayesian inference works,https://brohrer.github.io/how_bayesian_inference_works.html
898,Lobsters,math,Mathematics,Ghosts of departed quantities: The problem with infinitesimals,http://robjlow.blogspot.com/2017/05/ghosts-of-departed-quantities.html
899,Lobsters,math,Mathematics,What's new in gnuplot 5.2,https://lwn.net/SubscriberLink/723818/76976cc1c1229d70/
900,Lobsters,math,Mathematics,The Magic of XOR,https://www.cs.umd.edu/class/sum2003/cmsc311/Notes/BitOp/xor.html
901,Lobsters,math,Mathematics,How to not lie with statistics: The correct way to summarize benchmark results,http://www.cse.unsw.edu.au/~cs9242/15/papers/Fleming_Wallace_86.pdf
902,Lobsters,math,Mathematics,Turing Patterns,http://www.degeneratestate.org/posts/2017/May/05/turing-patterns/
903,Lobsters,math,Mathematics,SIMD vector library behaving like the GLSL shading language.,https://github.com/LiraNuna/glsl-sse2
904,Lobsters,math,Mathematics,0x5f3759df [Explaining the magic constant for Fast Inverse Square Root],http://h14s.p5r.org/2012/09/0x5f3759df.html
905,Lobsters,math,Mathematics,The Fold-and-Cut Problem,http://erikdemaine.org/foldcut/
906,Lobsters,math,Mathematics,Where do we find convolutions in games?,https://www.tetracasa.com/posts/2017/05/12/where-do-we-find-convolution-in-games.html
907,Lobsters,math,Mathematics,Eigentechno – Principal Component Analysis applied to electronic music,https://www.math.uci.edu/~isik/posts/Eigentechno.html
908,Lobsters,math,Mathematics,Rewriting in Coq,http://lthms.xyz/blog/rewriting-in-coq
909,Lobsters,math,Mathematics,Julia for the Raspberry Pi,https://www.raspberrypi.org/blog/julia-language-raspberry-pi/
910,Lobsters,math,Mathematics,Voronoi Tessellations,http://datagenetics.com/blog/may12017/index.html
911,Lobsters,math,Mathematics,"Eprover — a free, efficient automatic theorem prover",https://wwwlehre.dhbw-stuttgart.de/~sschulz/E/E.html
912,Lobsters,math,Mathematics,Do less work with the dot product,https://www.tetracasa.com/posts/2017/05/07/do-less-work-with-the-dot-product.html
913,Lobsters,math,Mathematics,CMU 15-816: Substructural Logics,https://www.cs.cmu.edu/~fp/courses/15816-f16/
914,Lobsters,math,Mathematics,Merging and patches,https://jneem.github.io/merging/
915,Lobsters,math,Mathematics,DifferentialEquations.jl 2.0: State of the Ecosystem,http://www.stochasticlifestyle.com/differentialequations-jl-2-0-state-ecosystem/
916,Lobsters,math,Mathematics,"A program that accepts exactly any desired finite set, in the right universe",http://jdh.hamkins.org/a-program-that-accepts-any-desired-finite-set-in-the-right-universe/
917,Lobsters,math,Mathematics,Computational Balloon Twisting: The Theory of Balloon Polyhedra,http://erikdemaine.org/papers/Balloons_CCCG2008/paper.pdf
918,Lobsters,math,Mathematics,Empirical Bayes for multiple sample sizes,http://chris-said.io/2017/05/03/empirical-bayes-for-multiple-sample-sizes/
919,Lobsters,math,Mathematics,Running TensorFlow in Clojure,http://kieranbrowne.com/research/clojure-tensorflow-interop/
920,Lobsters,math,Mathematics,A Mathematician’s Lament,https://www.maa.org/external_archive/devlin/LockhartsLament.pdf
921,Lobsters,math,Mathematics,You weren’t bad at maths — you just weren’t looking at it the right way,https://hackernoon.com/you-werent-bad-at-maths-you-just-weren-t-looking-at-it-the-right-way-7b11fb0a0982
922,Lobsters,math,Mathematics,"Datasaurus Dozen: Same Stats, Different Graphs",https://www.autodeskresearch.com/publications/samestats
923,Lobsters,math,Mathematics,Identifying Almost Identical Files Using Contrxt Triggered Piecewise Hashing,http://dfrws.org/sites/default/files/session-files/paper-identifying_almost_identical_files_using_context_triggered_piecewise_hashing.pdf
924,Lobsters,math,Mathematics,The Theory Behind Mp3 (2002),https://www.mp3-tech.org/programmer/docs/mp3_theory.pdf
925,Lobsters,math,Mathematics,Simon Tatham's Portable Puzzle Collection,http://www.chiark.greenend.org.uk/~sgtatham/puzzles/
926,Lobsters,math,Mathematics,Computation and Truth,http://fexpr.blogspot.com/2015/05/computation-and-truth.html
927,Lobsters,math,Mathematics,Introduction to programming with dependent types in Scala,https://stepik.org/course/ThCS-Introduction-to-programming-with-dependent-types-in-Scala-2294/
928,Lobsters,math,Mathematics,Bayesian Statistics without Frequentist Language,https://www.youtube.com/watch?v=yakg94HyWdE
929,Lobsters,math,Mathematics,A modern guide to getting started with Data Science and Python,https://twiecki.github.io/blog/2014/11/18/python-for-data-science/
930,Lobsters,math,Mathematics,Adventure Games and Eigenvalues,http://www.evanmiller.org/adventure-games-and-eigenvalues.html
931,Lobsters,math,Mathematics,Doing Mathematics Differently,http://inference-review.com/article/doing-mathematics-differently
932,Lobsters,math,Mathematics,Calculus Made Easy (1914),http://djm.cc/library/Calculus_Made_Easy_Thompson.pdf
933,Lobsters,math,Mathematics,Building a fast Equation Grapher (Part I),http://www.rykap.com/math/computer%20graphics/2017/04/11/compiling-shaders-on-the-fly/
934,Lobsters,math,Mathematics,Exploring Zero-Knowledge Proofs (2016),http://manishearth.github.io/blog/2016/03/05/exploring-zero-knowledge-proofs/
935,Lobsters,math,Mathematics,"Teeny Tiny Mansion is a text adventure proven to have no ""dead ends""",http://svn.clifford.at/handicraft/2017/tttm/README
936,Lobsters,math,Mathematics,How to Quantify (and Fight) Gerrymandering,https://www.quantamagazine.org/20170404-gerrymandering-math-standard/
937,Lobsters,math,Mathematics,Of Bayesian average and star ratings,http://fulmicoton.com/posts/bayesian_rating/
938,Lobsters,math,Mathematics,"Category Theory, Syntactically (2016)",http://www.hedonisticlearning.com/posts/category-theory-syntactically.html
939,Lobsters,math,Mathematics,No bullshit linear algebra v2 release,https://minireference.com/blog/no-bullshit-linear-algebra-v2-release/
940,Lobsters,math,Mathematics,Bayesian networks and conditional independence,https://kaushikghose.wordpress.com/2017/04/13/bayesian-networks-and-conditional-independence/
