ID,Source,Tag_Code,Tag_Name,Title,Url
374,Lobsters,math,Mathematics,Venus is not Earth's closest neighbor,https://physicstoday.scitation.org/do/10.1063/PT.6.3.20190312a/full/
375,Lobsters,math,Mathematics,The orthogonal Procrustes problem,"https://simonensemble.github.io/machine%20learning,%20linear%20algebra/2018/10/27/orthogonal-procrustes/"
376,Lobsters,math,Mathematics,The eqn math preprocessor,https://en.wikipedia.org/wiki/Eqn_(software)
377,Lobsters,math,Mathematics,GraphBLAS Mathematics: Provisional Release 1.0,http://www.mit.edu/~kepner/GraphBLAS/GraphBLAS-Math-release.pdf
378,Lobsters,math,Mathematics,Wrapping Up Wrapping Up The Earth,http://www.solipsys.co.uk/new/WrappingUpWrappingUpTheEarth.html?sc10lo
379,Lobsters,math,Mathematics,Monoids and Graph Processing,https://github.com/frankmcsherry/blog/blob/master/posts/2019-02-09.md
380,Lobsters,math,Mathematics,Viewing Matrices and Probability as Graphs,https://www.math3ma.com/blog/matrices-probability-graphs
381,Lobsters,math,Mathematics,Bayesian inference in non-linear ODEs using PyMC3,https://github.com/pymc-devs/pymc3/blob/e57968b4bde099b88eac917e87b2f9584f3e368b/docs/source/notebooks/ODE_parameter_estimation.ipynb
382,Lobsters,math,Mathematics,Introduction to Theoretical Computer Science,https://introtcs.org/public/index.html
383,Lobsters,math,Mathematics,Piano Tuning,https://sidsite.com/articles/190303PianoTuning/index.html
384,Lobsters,math,Mathematics,Investigating Hash Collisions through the Birthday Paradox,https://www.solipsys.co.uk/new/TheBirthdayParadox.html?sc04lo
385,Lobsters,math,Mathematics,Fundamentals of Grassmann Algebra,http://www.terathon.com/gdc12_lengyel.pdf
386,Lobsters,math,Mathematics,Finding Perrin Pseudo Primes: Part 1,https://www.solipsys.co.uk/new/FindingPerrinPseudoPrimes_Part1.html?sc03l
387,Lobsters,math,Mathematics,Lobste.rs-like math research discussion for PhDs,https://hessix.com
388,Lobsters,math,Mathematics,My Favorite Paradox,https://www.forrestthewoods.com/blog/my_favorite_paradox/
389,Lobsters,math,Mathematics,Clifford Algebras,https://gist.github.com/pervognsen/b204bf31af0809af078617af1609c8b8
390,Lobsters,math,Mathematics,Complexity Explorables,http://www.complexity-explorables.org/
391,Lobsters,math,Mathematics,"How a Kalman filter works, in pictures",https://www.bzarg.com/p/how-a-kalman-filter-works-in-pictures/
392,Lobsters,math,Mathematics,PyCM 1.9 : Confusion matrix analysis + parameter recommender,https://github.com/sepandhaghighi/pycm
393,Lobsters,math,Mathematics,The Other Wrapping The Earth Problem,https://www.solipsys.co.uk/new/TheOtherWrappingTheEarthProblem.html?sb27lb
394,Lobsters,math,Mathematics,Dice Roller: comparing the fairness of d20 dice from different manufacturers,http://www.markfickett.com/stuff/artPage.php?id=389
395,Lobsters,math,Mathematics,Wrapping The Earth,https://www.solipsys.co.uk/new/WrappingTheEarth.html?sb24o
396,Lobsters,math,Mathematics,Stream Ring Theory,https://zenodo.org/record/2565243/files/stream-ring-theory.pdf?download=1
397,Lobsters,math,Mathematics,WordTeX - A WYSIPCTWOTCG Typesetting Tool,https://www.youtube.com/watch?v=jlX_pThh7z8
398,Lobsters,math,Mathematics,Fractional calculus,https://medium.com/@notaredpanda/fractional-calculus-48192f4e9c9f
399,Lobsters,math,Mathematics,Distance Estimated 3D Fractals,http://blog.hvidtfeldts.net/index.php/2011/06/distance-estimated-3d-fractals-part-i/
400,Lobsters,math,Mathematics,Register Allocation by Graph Coloring,http://www.lighterra.com/papers/graphcoloring/
401,Lobsters,math,Mathematics,A Practical Extension to Microfacet Theory for the Modeling of Varying Iridescence,https://www.youtube.com/watch?v=4nKb9hRYbPA
402,Lobsters,math,Mathematics,OpenGR,https://storm-irit.github.io/OpenGR/index.html
403,Lobsters,math,Mathematics,Incompleteness Ex Machina,https://www.scottaaronson.com/incompleteness.pdf
404,Lobsters,math,Mathematics,Nostalgia & Fun With Calculators,http://ludditus.com/2019/02/10/nostalgia-fun-with-calculators/
405,Lobsters,math,Mathematics,Modern Robotics - book,http://hades.mech.northwestern.edu/images/7/7f/MR.pdf
406,Lobsters,math,Mathematics,Solving Knights and Knaves with Alloy,https://www.hillelwayne.com/post/knights-knaves/
407,Lobsters,math,Mathematics,"PCG, A Family of Better Random Number Generators",http://www.pcg-random.org/index.html
408,Lobsters,math,Mathematics,The mathematics of diseases (2001),https://plus.maths.org/content/mathematics-diseases
409,Lobsters,math,Mathematics,Emacs Calc Tutorials,https://github.com/ahyatt/emacs-calc-tutorials
410,Lobsters,math,Mathematics,Get your age in seconds. And find out when you hit that integer exponent in your favorite base,https://gist.github.com/jersey99/f2e2d5d6e4e3bf996e787156d884ac62
411,Lobsters,math,Mathematics,A Lever for the Mind,https://codon.com/a-lever-for-the-mind
412,Lobsters,math,Mathematics,How To Predict Any Three Events More Accurately,https://kaomorphism.com/2019/01/17/How-To-Predict-Any-Three-Events-More-Accurately.html
413,Lobsters,math,Mathematics,Simulating blobs of fluid,https://peeke.nl/simulating-blobs-of-fluid
414,Lobsters,math,Mathematics,Automatic Differentiation and APL,https://www.maa.org/sites/default/files/pdf/upload_library/22/Polya/07468342.di020737.02p00804.pdf
415,Lobsters,math,Mathematics,Coding the Matrix: Linear Algebra through Computer Science Applications,http://academictorrents.com/details/54cd86f3038dfd446b037891406ba4e0b1200d5a
416,Lobsters,math,Mathematics,The Algorithmic Beauty of Plants,http://algorithmicbotany.org/papers/#abop
417,Lobsters,math,Mathematics,Creating Your Own Gravity and Space Simulator,https://css-tricks.com/creating-your-own-gravity-and-space-simulator/
418,Lobsters,math,Mathematics,Introduction to the Modeling and Analysis of Complex Systems,https://textbooks.opensuny.org/introduction-to-the-modeling-and-analysis-of-complex-systems/
419,Lobsters,math,Mathematics,Using spaced repetition systems to see through a piece of mathematics,http://cognitivemedium.com/srs-mathematics
420,Lobsters,math,Mathematics,Seeing Theory - A visual introduction to probability and statistics,https://seeing-theory.brown.edu/
421,Lobsters,math,Mathematics,Blending in Detail,http://blog.selfshadow.com/publications/blending-in-detail
422,Lobsters,math,Mathematics,"Fast 4x4 Matrix Inverse with SSE SIMD, Explained",https://lxjk.github.io/2017/09/03/Fast-4x4-Matrix-Inverse-with-SSE-SIMD-Explained.html
423,Lobsters,math,Mathematics,One-bit catastrophe,https://semidoc.github.io/lagarde-catastrophe
424,Lobsters,math,Mathematics,Data Interpolation with Radial Basis Functions (RBFs),http://shihchinw.github.io/2018/10/data-interpolation-with-radial-basis-functions-rbfs.html
425,Lobsters,math,Mathematics,Resources for Teaching with Formal Methods,https://avigad.github.io/formal_methods_in_education/
426,Lobsters,math,Mathematics,An Open Letter to the Mathematical Community,https://www.mcsweeneys.net/articles/an-open-letter-to-the-mathematical-community
427,Lobsters,math,Mathematics,Complexity Explorer,https://www.complexityexplorer.org/
428,Lobsters,math,Mathematics,The (Almost) Secret Algorithm Researchers Used to Break Thousands of RSA Keys,https://algorithmsoup.wordpress.com/2019/01/15/breaking-an-unbreakable-code-part-1-the-hack/
429,Lobsters,math,Mathematics,Using Fourier Transforms To Multiply Numbers - Interactive Examples,http://blog.robertelder.org/fast-multiplication-using-fourier-transform/
430,Lobsters,math,Mathematics,A VLSI Analog Computer / Math Co-processor for a Digital Computer,http://citeseerx.ist.psu.edu/viewdoc/download?doi=10.1.1.113.3740&rep=rep1&type=pdf
431,Lobsters,math,Mathematics,Neural networks as Ordinary Differential Equations,https://rkevingibson.github.io/blog/neural-networks-as-ordinary-differential-equations/
432,Lobsters,math,Mathematics,Reverse Engineering Machines with the Yoneda Lemma,http://blog.sigfpe.com/2006/11/yoneda-lemma.html
433,Lobsters,math,Mathematics,Can you sign a quantum state?,https://arxiv.org/abs/1811.11858
434,Lobsters,math,Mathematics,Microfacet BRDF,http://simonstechblog.blogspot.com/2011/12/microfacet-brdf.html
435,Lobsters,math,Mathematics,Graphs are to categories as lists are to monoids,https://alhassy.github.io/PathCat/
436,Lobsters,math,Mathematics,Making Formal Methods Popular: The Crux is Math Education! [2015],http://ceur-ws.org/Vol-1385/paper5.pdf
437,Lobsters,math,Mathematics,Quantum Computing for Computer Scientists,https://www.youtube.com/watch?v=F_Riqjdh2oM
438,Lobsters,math,Mathematics,An All-in-One DAG Toolkit,https://vaibhavsagar.com/blog/2017/06/10/dag-toolkit/
439,Lobsters,math,Mathematics,Fermat's Little Theorem,https://www.youtube.com/watch?v=XPMzosLWGHo
440,Lobsters,math,Mathematics,Taming Randomness,https://kynd.github.io/p5sketches/random.html
441,Lobsters,math,Mathematics,The Universe of Discourse : A happy numeric coincidence,https://blog.plover.com/math/power-digit-sum.html
442,Lobsters,math,Mathematics,Exposing Floating Point,https://ciechanow.ski/exposing-floating-point/
443,Lobsters,math,Mathematics,The On-Line Encyclopedia of Integer Sequences,http://oeis.org/
444,Lobsters,math,Mathematics,"Ask: recommended refreshers on algebra, calculus and trigonometry",/s/bwrvtd/ask_recommended_refreshers_on_algebra
445,Lobsters,math,Mathematics,HAKMEM (1972),http://www.inwap.com/pdp10/hbaker/hakmem/hakmem.html
446,Lobsters,math,Mathematics,little mathematics library,https://mirtitles.org/category/little-mathematics-library/
447,Lobsters,math,Mathematics,Variation of the Pigeonhole Principle,https://www.scriptcrafty.com/2018/12/variation-of-the-pigeonhole-principle/
448,Lobsters,math,Mathematics,Seeing Theory,https://seeing-theory.brown.edu/index.html
449,Lobsters,math,Mathematics,The Twelve Days of Christmas - How Many Presents?,https://www.intmath.com/blog/mathematics/the-twelve-days-of-christmas-how-many-presents-1686
450,Lobsters,math,Mathematics,Lean Forward,https://lean-forward.github.io/
451,Lobsters,math,Mathematics,QED Manifesto,http://www.cs.ru.nl/~freek/qed/qed.html
452,Lobsters,math,Mathematics,Topology of Numbers,http://pi.math.cornell.edu/~hatcher/TN/TNpage.html
453,Lobsters,math,Mathematics,PyCM 1.7 : New machine learning library for confusion matrix statistical analysis,https://github.com/sepandhaghighi/pycm
454,Lobsters,math,Mathematics,Curv: a language for making art using mathematics,https://github.com/doug-moen/curv
455,Lobsters,math,Mathematics,Running from the past,http://blog.sigfpe.com/2018/10/running-from-past.html
456,Lobsters,math,Mathematics,Byrne's Euclid,https://www.c82.net/euclid/
457,Lobsters,math,Mathematics,In Praise of Dependent Types | The n-Category Café,https://golem.ph.utexas.edu/category/2010/03/in_praise_of_dependent_types.html
458,Lobsters,math,Mathematics,"Busy Beavers, and the Quest for Big Numbers",https://jeremykun.com/2012/02/08/busy-beavers-and-the-quest-for-big-numbers/
459,Lobsters,math,Mathematics,Bezier Moi,https://cormullion.github.io/blog/2018/06/21/bezier.html
460,Lobsters,math,Mathematics,Self Avoiding Walks,http://datagenetics.com/blog/december22018/index.html
461,Lobsters,math,Mathematics,On self-publishing “A Programmer’s Introduction to Mathematics”,https://medium.com/@jeremyjkun/on-self-publishing-a-programmers-introduction-to-mathematics-1472b7511c99
462,Lobsters,math,Mathematics,A Better Alternative to Piecewise Linear Time Series Segmentation (2007),https://arxiv.org/pdf/cs/0605103
463,Lobsters,math,Mathematics,"""Alchemical Groups"": Advent of Code using Group Theory (free groups, group homomorphisms) in Haskell",https://blog.jle.im/entry/alchemical-groups.html
464,Lobsters,math,Mathematics,Automatic Shading,https://www.peppercarrot.com/en/article456/scientific-paper-automatic-shading-by-trinity-college-dublin-ireland
465,Lobsters,math,Mathematics,PhysX 3.4 Released under BSD license,https://github.com/NVIDIAGameWorks/PhysX-3.4/blob/master/README.md
466,Lobsters,math,Mathematics,Geometric Tools: Documentation,https://www.geometrictools.com/Documentation/Documentation.html
467,Lobsters,math,Mathematics,A Programmer’s Introduction to Mathematics,https://jeremykun.com/2018/12/01/a-programmers-introduction-to-mathematics/
468,Lobsters,math,Mathematics,Fo̅rmulæ – Symbolic computation framework,http://www.formulae.org
469,Lobsters,math,Mathematics,MinHashing - Clustering enormous datasets with a key-value store,https://moultano.wordpress.com/2018/11/08/minhashing-3kbzhsxyg4467-6/
470,Lobsters,math,Mathematics,A Compositional Numeric Library for C++,https://github.com/johnmcfarlane/cnl
471,Lobsters,math,Mathematics,The Divisions of mathematics,https://web.archive.org/web/20100815034900/http://www.math.niu.edu/~rusin/known-math/index/tour_div.html
472,Lobsters,math,Mathematics,A simple method to construct isotropic quasirandom blue noise point sequences,http://extremelearning.com.au/a-simple-method-to-construct-isotropic-quasirandom-blue-noise-point-sequences/
473,Lobsters,math,Mathematics,"Communicating Sequential Processes (CSP), by C. A. R. Hoare(PDF Version)",http://usingcsp.com
474,Lobsters,math,Mathematics,The Birthday Paradox (and Concurrently Indexing in Elasticsearch),https://www.elastic.co/blog/the-birthday-paradox-and-concurrently-indexing-in-elasticsearch
475,Lobsters,math,Mathematics,Inteview with Thomas Wiecki about PyMC and probabilistic programming,https://notamonadtutorial.com/inteview-with-thomas-wiecki-about-probabilistic-programming-and-pymc-66a12b6f3f2e
476,Lobsters,math,Mathematics,A puzzle about representing numbers as a sum of 3-smooth numbers,https://blog.plover.com/math/pow23tab.html
477,Lobsters,math,Mathematics,Estimating number of bugs left to find with Lincoln index,https://www.johndcook.com/blog/2010/07/13/lincoln-index/
478,Lobsters,math,Mathematics,The Consistency of Arithmetic,http://timothychow.net/consistent.pdf
479,Lobsters,math,Mathematics,Fast line-following robots part 1: control,http://www.a1k0n.net/2018/11/13/fast-line-following.html
480,Lobsters,math,Mathematics,The Discoveries of Continuations (1993),http://www.math.bas.bg/~bantchev/place/iswim/conti-disco.pdf
481,Lobsters,math,Mathematics,Wave Function Collapse Demo,https://marian42.itch.io/wfc
482,Lobsters,math,Mathematics,FMIGo! - a set of Free Software tools aimed at the Functional Mockup Interface (FMI) standard,http://www.fmigo.net/
483,Lobsters,math,Mathematics,Visualizing quaternions,https://eater.net/quaternions
484,Lobsters,math,Mathematics,"Logic, Explainability and the Future of Understanding",http://blog.stephenwolfram.com/2018/11/logic-explainability-and-the-future-of-understanding/
485,Lobsters,math,Mathematics,Geometry without geometric algebra,https://0fps.net/2018/11/04/geometry-without-geometric-algebra/
486,Lobsters,math,Mathematics,Benford's law,https://jacob.jkrall.net/benfords-law
487,Lobsters,math,Mathematics,An Automated Prover for Zermelo-Fraenkel Set Theory in Theorema (2006),https://www3.risc.jku.at/publications/download/risc_314/Paper.pdf
488,Lobsters,math,Mathematics,Let's remove Quaternions from every 3D Engine,http://marctenbosch.com/quaternions/
489,Lobsters,math,Mathematics,Storm -- A Modern Probabilistic Model Checker,http://www.stormchecker.org/index.html
490,Lobsters,math,Mathematics,The Unreasonable Effectiveness of Quantum Physics in Modern Mathematics -- Robbert Dijkgraaf,https://www.youtube.com/watch?v=6oWLIVNI6VA
491,Lobsters,math,Mathematics,A Little Taste of Dependent Types,https://www.youtube.com/watch?v=VxINoKFm-S4
492,Lobsters,math,Mathematics,"The Waiting Time Paradox, or, Why Is My Bus Always Late?",http://jakevdp.github.io/blog/2018/09/13/waiting-time-paradox/
493,Lobsters,math,Mathematics,best known lower bound for the minimal length of superpermutations was proved on 4chan,https://twitter.com/robinhouston/status/1054637891085918209
494,Lobsters,math,Mathematics,Algebra and the Lambda Calculus,https://people.csail.mit.edu/jaffer/lambda.txt
495,Lobsters,math,Mathematics,Calculus Made Easy [1910],http://calculusmadeeasy.org/
496,Lobsters,math,Mathematics,QED,https://teorth.github.io/QED/
497,Lobsters,math,Mathematics,"Some Steps into Verification of Exact, Real Arithmetic (2012)",https://shemesh.larc.nasa.gov/nfm2012/talks/NFM2012_168_173.pdf
498,Lobsters,math,Mathematics,0.1 + 0.2 returns 0.30000000000000004,https://qntm.org/notpointthree
499,Lobsters,math,Mathematics,The hacker’s guide to uncertainty estimates,https://erikbern.com/2018/10/08/the-hackers-guide-to-uncertainty-estimates.html
500,Lobsters,math,Mathematics,Arabic mathematical notation,https://www.w3.org/TR/arabic-math/
501,Lobsters,math,Mathematics,How to: Draw the Voronoi Diagram,http://765.blogspot.com/2009/09/how-to-draw-voronoi-diagram.html
502,Lobsters,math,Mathematics,Symbolic Crosschecking of Floating-Point and SIMD Code (2011),http://srg.doc.ic.ac.uk/files/papers/kleefp-eurosys-11.pdf
503,Lobsters,math,Mathematics,Convolution: An Exploration of a Familiar Operator’s Deeper Roots,https://medium.com/@cody.marie.wild/convolution-a-journey-through-a-familiar-operators-deeper-roots-2e3311f23379
504,Lobsters,math,Mathematics,The RISC Algorithm Language (RISCAL),https://www3.risc.jku.at/research/formal/software/RISCAL/
505,Lobsters,math,Mathematics,Example implementation of Algorithm W for Hindley-Milner type inference,https://github.com/mgrabmueller/AlgorithmW
506,Lobsters,math,Mathematics,Apparent Proof of the Riemann Hypothesis,http://vixra.org/pdf/1809.0481v1.pdf
507,Lobsters,math,Mathematics,Mathematics of a roller chain animation,https://www.xarg.org/2017/12/mathematics-of-a-roller-chain-animation/
508,Lobsters,math,Mathematics,News re. proofs of the ABC conjecture & Riemann Hypothesis,https://www.johndcook.com/blog/2018/09/20/abc-conjecture-riemann-hypothesis/
509,Lobsters,math,Mathematics,Forward versus Reverse Mode Automatic Differentiation understood as linear system solving,http://www.alecjacobson.com/weblog/?p=4752
510,Lobsters,math,Mathematics,Simple math to convert simple 2D game view to a perspective 3D view,https://github.com/monim67/perspective-vue
511,Lobsters,math,Mathematics,Patterns That Eventually Fail,https://johncarlosbaez.wordpress.com/2018/09/20/patterns-that-eventually-fail/
512,Lobsters,math,Mathematics,Titans of Mathematics Clash Over Epic Proof of ABC Conjecture,https://www.quantamagazine.org/titans-of-mathematics-clash-over-epic-proof-of-abc-conjecture-20180920/
513,Lobsters,math,Mathematics,Math as Code,https://github.com/Jam3/math-as-code
514,Lobsters,math,Mathematics,Determining Whether A Point Is Inside A Complex Polygon,http://alienryderflex.com/polygon/
515,Lobsters,math,Mathematics,I simulated California housing and learned... about simulators,https://apenwarr.ca/log/20180918
516,Lobsters,math,Mathematics,Quantitative Macroeconomics in Julia,https://www.youtube.com/watch?v=KkKBwJkYgVk
517,Lobsters,math,Mathematics,Dependency hell is NP-complete (2016),https://research.swtch.com/version-sat
518,Lobsters,math,Mathematics,Introduction To Calculus With Derivatives,http://adit.io/posts/2018-02-18-Introduction-To-Calculus-With-Derivatives.html
519,Lobsters,math,Mathematics,These Are Not the K Combinators You Are Looking For,http://memerocket.com/2017/05/25/these-are-not-the-k-combinators-you-are-looking-for
520,Lobsters,math,Mathematics,Solving Resistance,https://pavpanchekha.com/blog/resistance-1.html
521,Lobsters,math,Mathematics,A Few of My Favorite Sigmoids,https://raphlinus.github.io/audio/2018/09/05/sigmoid.html
522,Lobsters,math,Mathematics,Monte Python Simulation: misunderstanding Monte Carlo,https://dannorth.net/2018/09/04/monte-python-simulation/
523,Lobsters,math,Mathematics,The Unreasonable Effectiveness of Metaphor,https://argumatronic.com/posts/2018-09-02-effective-metaphor.html
524,Lobsters,math,Mathematics,Floating point error is the least of my worries (2011),https://www.johndcook.com/blog/2011/11/01/floating-point-worries/
525,Lobsters,math,Mathematics,Better Geometry Through Graph Theory,http://ideolalia.com/2018/08/28/artifex.html
526,Lobsters,math,Mathematics,Pseudo-bandlimited pixel art filtering in 3D – a mathematical derivation,http://themaister.net/blog/2018/08/25/pseudo-bandlimited-pixel-art-filtering-in-3d-a-mathematical-derivation/
527,Lobsters,math,Mathematics,Introduction to Digital Filters,https://karlhiner.com/jupyter_notebooks/intro_to_digital_filters
528,Lobsters,math,Mathematics,Statistical Thinking for Data Science,https://www.youtube.com/watch?v=TGGGDpb04Yc
529,Lobsters,math,Mathematics,X-splines,https://jordi.platinum.edu.pl/xsplines/splines.html
530,Lobsters,math,Mathematics,Predict Economic Indicators with OpenStreetMap,http://janakiev.com/blog/osm-predict-economic-indicators/
531,Lobsters,math,Mathematics,Statistical and Machine Learning forecasting methods: Concerns and ways forward,http://journals.plos.org/plosone/article?id=10.1371/journal.pone.0194889
532,Lobsters,math,Mathematics,Calibrated Uncertainty in Deep Learning,https://web.stanford.edu/~kuleshov/papers/uai2018-slides.pdf
533,Lobsters,math,Mathematics,Mod and Remainder are not the Same,https://rob.conery.io/2018/08/21/mod-and-remainder-are-not-the-same/
534,Lobsters,math,Mathematics,First million integers laid out using the UMAP dimensionality reduction algorithm,https://johnhw.github.io/umap_primes/index.md.html
535,Lobsters,math,Mathematics,Hierarchical Bayesian Neural Networks with Informative Priors,https://twiecki.github.io/blog/2018/08/13/hierarchical_bayesian_neural_network/
536,Lobsters,math,Mathematics,Fast Multiplication with Slow Additions,http://loup-vaillant.fr/tutorials/fast-scalarmult
537,Lobsters,math,Mathematics,Logic in Action: an open course in logic,http://www.logicinaction.org/
538,Lobsters,math,Mathematics,PyMC3: probabilistic programming module for Python,https://docs.pymc.io/intro.html
539,Lobsters,math,Mathematics,Bayesian Deep Learning,https://twiecki.github.io/blog/2016/06/01/bayesian-deep-learning/
540,Lobsters,math,Mathematics,1/0 = 0,https://www.hillelwayne.com/post/divide-by-zero/
541,Lobsters,math,Mathematics,Functional Bits: Lambda Calculus based Algorithmic Information Theory,https://tromp.github.io/cl/LC.pdf
542,Lobsters,math,Mathematics,"A Visual, Intuitive Guide to Imaginary Numbers",https://betterexplained.com/articles/a-visual-intuitive-guide-to-imaginary-numbers/
543,Lobsters,math,Mathematics,Explanation of Binary Arithmetic (1703),http://www.leibniz-translations.com/binary.htm
544,Lobsters,math,Mathematics,On Automatically Proving the Correctness of math.h Implementations,https://theory.stanford.edu/~aiken/publications/papers/popl18.pdf
545,Lobsters,math,Mathematics,Legible Mathematics — Sketches of an interactive arithmetic for programming,http://glench.com/LegibleMathematics/
546,Lobsters,math,Mathematics,Herbie: Automatically Improving Floating Point Accuracy,https://herbie.uwplse.org/
547,Lobsters,math,Mathematics,How many ways to design rock paper scissors lizard Spock?,https://www.johndcook.com/blog/2018/08/07/rock-paper-scissors-lizard-spock/
548,Lobsters,math,Mathematics,Lean Forward: Usable Computer-Checked Proofs and Computations for Number Theorists,https://lean-forward.github.io/
549,Lobsters,math,Mathematics,polyHédronisme – tool to construct and explore polyhedra,https://levskaya.github.io/polyhedronisme/
550,Lobsters,math,Mathematics,Visualizing an Assassin Puzzle,https://jeremykun.com/2018/07/24/visualizing-an-assassin-puzzle/
551,Lobsters,math,Mathematics,Polyhedra Viewer,https://polyhedra.tessera.li/
552,Lobsters,math,Mathematics,Generating Random Points in a Sphere,https://karthikkaranth.me/blog/generating-random-points-in-a-sphere/
553,Lobsters,math,Mathematics,How RSA works,https://yurichev.com/blog/RSA/
554,Lobsters,math,Mathematics,Life Lessons from Differential Equations,https://www.johndcook.com/blog/2015/07/23/life-lessons-from-differential-equations/
555,Lobsters,math,Mathematics,From singularities to graphs,https://arxiv.org/pdf/1808.00378.pdf
556,Lobsters,math,Mathematics,[1807.04271] A quantum-inspired classical algorithm for recommendation systems,https://arxiv.org/abs/1807.04271
557,Lobsters,math,Mathematics,Right and wrong ways to pick random points inside a sphere,https://blog.joeardent.net/2018/07/right-and-wrong-ways-to-pick-random-points-inside-a-sphere/
558,Lobsters,math,Mathematics,The Perils of Floating Point,http://www.lahey.com/float.htm
559,Lobsters,math,Mathematics,Is COBOL holding you hostage with Math?,https://medium.com/@bellmar/is-cobol-holding-you-hostage-with-math-5498c0eb428b
560,Lobsters,math,Mathematics,The Case for Teaching Functional Programming in Discrete Math (2011),https://cs.wheaton.edu/~tvandrun/dmfp/case4dmfp.pdf
561,Lobsters,math,Mathematics,Mathigon: Learn Mathematics,https://mathigon.org
562,Lobsters,math,Mathematics,The Datasaurus Dozen,http://blog.revolutionanalytics.com/2017/05/the-datasaurus-dozen.html
563,Lobsters,math,Mathematics,An infinite descent into pure mathematics,https://infinitedescent.xyz/
564,Lobsters,math,Mathematics,[1807.08248] Subset Sum Made Simple,https://arxiv.org/abs/1807.08248
565,Lobsters,math,Mathematics,Fermat's Library | Recounting the rationals annotated/explained version,https://fermatslibrary.com/s/recounting-the-rationals
566,Lobsters,math,Mathematics,Domino Tilings,http://code-spot.co.za/downloads/polyominoes/Dominoes%20I.pdf
567,Lobsters,math,Mathematics,Computation Graph — Owl Numerical Library documentation,http://ocaml.xyz/chapter/cgraph_intro.html
568,Lobsters,math,Mathematics,The ABC conjecture has (still) not been proved,https://galoisrepresentations.wordpress.com/2017/12/17/the-abc-conjecture-has-still-not-been-proved/
569,Lobsters,math,Mathematics,The ABC Conjecture has not been proved (2012),https://mathbabe.org/2012/11/14/the-abc-conjecture-has-not-been-proved/
