ID,Source,Tag_Code,Tag_Name,Title,Url
1,Lobsters,math,Mathematics,MegaFavNumbers,http://www.youtube.com/playlist?list=PLar4u0v66vIodqt3KSZPsYyuULD5meoAo
2,Lobsters,math,Mathematics,Prime Numbers for the Win (2009),https://blog.dustinkirkland.com/2009/06/prime-numbers-for-win.html
3,Lobsters,math,Mathematics,Depends upon what the meaning of the word “is” is,https://meaningness.com/eggplant/formal-logic
4,Lobsters,math,Mathematics,"Geometric Folding Algorithms: Linkages, Origami, Polyhedra",https://ocw.mit.edu/courses/electrical-engineering-and-computer-science/6-849-geometric-folding-algorithms-linkages-origami-polyhedra-fall-2012/
5,Lobsters,math,Mathematics,Herbie: Automatically Improving Floating Point Accuracy,https://herbie.uwplse.org/
6,Lobsters,math,Mathematics,The Amazing Power of Randomness: NP=RP,https://arxiv.org/abs/2008.00601
7,Lobsters,math,Mathematics,How knowing math helps you write better software,https://buttondown.email/hillelwayne/archive/how-knowing-math-helps-you-write-better-software/
8,Lobsters,math,Mathematics,Non-Euclidean Geometry Explained,https://www.youtube.com/watch?v=zQo_S3yNa2w
9,Lobsters,math,Mathematics,SciML: How Language is Changing Scientific Research,https://www.youtube.com/watch?v=3hM7wn7iJ70
10,Lobsters,math,Mathematics,(2020) IMC - International Mathematics Competition for University Students,https://www.imc-math.org.uk/?year=2020&item=problems
11,Lobsters,math,Mathematics,Designing a physics engine,https://blog.winter.dev/2020/designing-a-physics-engine/
12,Lobsters,math,Mathematics,SETL - The SET Programming Language (2010),http://www.hakank.org/arrays_in_flux/2010/04/setl_the_set_programming_language.html
13,Lobsters,math,Mathematics,Mathcha - Online Math Editor,https://www.mathcha.io/
14,Lobsters,math,Mathematics,Irrational Numbers,https://blog.demofox.org/2020/07/26/irrational-numbers/
15,Lobsters,math,Mathematics,In defense of the epistemic view of quantum states: a toy theory,https://arxiv.org/abs/quant-ph/0401052
16,Lobsters,math,Mathematics,Computation graphs and graph computation,http://breandan.net/2020/06/30/graph-computation/
17,Lobsters,math,Mathematics,Mathematicians Discover the Perfect Way to Multiply,https://www.quantamagazine.org/mathematicians-discover-the-perfect-way-to-multiply-20190411/
18,Lobsters,math,Mathematics,How Gödel’s Proof Works,https://www.quantamagazine.org/how-godels-incompleteness-theorems-work-20200714/
19,Lobsters,math,Mathematics,"Jupyter notebooks from ""Python for Probability, Statistics, and Machine Learning"" book",https://github.com/unpingco/Python-for-Probability-Statistics-and-Machine-Learning-2E
20,Lobsters,math,Mathematics,"Angles, integers, and modulo arithmetic (2010)",https://www.shawnhargreaves.com/blog/angles-integers-and-modulo-arithmetic.html
21,Lobsters,math,Mathematics,New features in gnuplot 5.4 [LWN.net],https://lwn.net/SubscriberLink/826456/2ea90dd464e104d5/
22,Lobsters,math,Mathematics,What are the benefits of using one mathematical notation over another?,https://mathoverflow.net/questions/366070/what-are-the-benefits-of-writing-vector-inner-products-as-langle-u-v-rangle
23,Lobsters,math,Mathematics,Intro To Type Theory,https://danielbmarkham.locals.com/post/88422/technical-tuesdays-intro-to-type-theory
24,Lobsters,math,Mathematics,Implementing cosine in C from scratch,http://web.eecs.utk.edu/~azh/blog/cosine.html
25,Lobsters,math,Mathematics,Compressed Sensing in Python,http://www.pyrunner.com/weblog/2016/05/26/compressed-sensing-python/
26,Lobsters,math,Mathematics,MegaFavNumbers,http://www.youtube.com/playlist?list=PLar4u0v66vIodqt3KSZPsYyuULD5meoAo
27,Lobsters,math,Mathematics,Prime Numbers for the Win (2009),https://blog.dustinkirkland.com/2009/06/prime-numbers-for-win.html
28,Lobsters,math,Mathematics,Depends upon what the meaning of the word “is” is,https://meaningness.com/eggplant/formal-logic
29,Lobsters,math,Mathematics,"Geometric Folding Algorithms: Linkages, Origami, Polyhedra",https://ocw.mit.edu/courses/electrical-engineering-and-computer-science/6-849-geometric-folding-algorithms-linkages-origami-polyhedra-fall-2012/
30,Lobsters,math,Mathematics,Herbie: Automatically Improving Floating Point Accuracy,https://herbie.uwplse.org/
31,Lobsters,math,Mathematics,The Amazing Power of Randomness: NP=RP,https://arxiv.org/abs/2008.00601
32,Lobsters,math,Mathematics,How knowing math helps you write better software,https://buttondown.email/hillelwayne/archive/how-knowing-math-helps-you-write-better-software/
33,Lobsters,math,Mathematics,Non-Euclidean Geometry Explained,https://www.youtube.com/watch?v=zQo_S3yNa2w
34,Lobsters,math,Mathematics,SciML: How Language is Changing Scientific Research,https://www.youtube.com/watch?v=3hM7wn7iJ70
35,Lobsters,math,Mathematics,(2020) IMC - International Mathematics Competition for University Students,https://www.imc-math.org.uk/?year=2020&item=problems
36,Lobsters,math,Mathematics,Designing a physics engine,https://blog.winter.dev/2020/designing-a-physics-engine/
37,Lobsters,math,Mathematics,SETL - The SET Programming Language (2010),http://www.hakank.org/arrays_in_flux/2010/04/setl_the_set_programming_language.html
38,Lobsters,math,Mathematics,Mathcha - Online Math Editor,https://www.mathcha.io/
39,Lobsters,math,Mathematics,Irrational Numbers,https://blog.demofox.org/2020/07/26/irrational-numbers/
40,Lobsters,math,Mathematics,In defense of the epistemic view of quantum states: a toy theory,https://arxiv.org/abs/quant-ph/0401052
41,Lobsters,math,Mathematics,Computation graphs and graph computation,http://breandan.net/2020/06/30/graph-computation/
42,Lobsters,math,Mathematics,Mathematicians Discover the Perfect Way to Multiply,https://www.quantamagazine.org/mathematicians-discover-the-perfect-way-to-multiply-20190411/
43,Lobsters,math,Mathematics,How Gödel’s Proof Works,https://www.quantamagazine.org/how-godels-incompleteness-theorems-work-20200714/
44,Lobsters,math,Mathematics,"Jupyter notebooks from ""Python for Probability, Statistics, and Machine Learning"" book",https://github.com/unpingco/Python-for-Probability-Statistics-and-Machine-Learning-2E
45,Lobsters,math,Mathematics,"Angles, integers, and modulo arithmetic (2010)",https://www.shawnhargreaves.com/blog/angles-integers-and-modulo-arithmetic.html
46,Lobsters,math,Mathematics,New features in gnuplot 5.4 [LWN.net],https://lwn.net/SubscriberLink/826456/2ea90dd464e104d5/
47,Lobsters,math,Mathematics,What are the benefits of using one mathematical notation over another?,https://mathoverflow.net/questions/366070/what-are-the-benefits-of-writing-vector-inner-products-as-langle-u-v-rangle
48,Lobsters,math,Mathematics,Intro To Type Theory,https://danielbmarkham.locals.com/post/88422/technical-tuesdays-intro-to-type-theory
49,Lobsters,math,Mathematics,Implementing cosine in C from scratch,http://web.eecs.utk.edu/~azh/blog/cosine.html
50,Lobsters,math,Mathematics,Compressed Sensing in Python,http://www.pyrunner.com/weblog/2016/05/26/compressed-sensing-python/
51,Lobsters,math,Mathematics,Programmers Need To Learn Statistics Or I Will Kill Them All,https://web.archive.org/web/20110702162929/https://zedshaw.com/essays/programmer_stats.html
52,Lobsters,math,Mathematics,Learning Differential Equations that are Easy to Solve,https://arxiv.org/abs/2007.04504
53,Lobsters,math,Mathematics,Microcentury,https://susam.in/blog/microcentury/
54,Lobsters,math,Mathematics,Why differential privacy is awesome (2018),https://desfontain.es/privacy/differential-privacy-awesomeness.html
55,Lobsters,math,Mathematics,Ten Lessons I Wish I Had Been Taught (1997),https://www.ams.org/notices/199701/comm-rota.pdf
56,Lobsters,math,Mathematics,Burritos for the Hungry Mathematician (2015),https://emorehouse.wescreates.wesleyan.edu/silliness/burrito_monads.pdf
57,Lobsters,math,Mathematics,Exploring Faster Screening with Fewer Tests via Bayesian Group Testing,http://ai.googleblog.com/2020/07/exploring-faster-screening-with-fewer.html
58,Lobsters,math,Mathematics,Mathsteroids,http://www.mscroggs.co.uk/blog/55
59,Lobsters,math,Mathematics,brismu: A relational interpretation of Lojban,https://github.com/MostAwesomeDude/brismu
60,Lobsters,math,Mathematics,The Floppy Disk of Floating Point,https://www.evanmiller.org/the-floppy-disk-of-floating-point.html
61,Lobsters,math,Mathematics,All People in Canada are the Same Age,https://www.math.toronto.edu/mathnet/falseProofs/sameAge.html
62,Lobsters,math,Mathematics,Knuth - Two notes on notation (1992),https://www.maa.org/sites/default/files/pdf/upload_library/22/Ford/knuth403-422.pdf
63,Lobsters,math,Mathematics,Proving Algebraic Datatypes are “Algebraic”,https://soap.coffee/~lthms/posts/AlgebraicDatatypes.html
64,Lobsters,math,Mathematics,Game Theory Meets Embeddings: a Unified Framework for Word Sense Disambiguation,https://www.aclweb.org/anthology/D19-1009.pdf
65,Lobsters,math,Mathematics,Ten Essays on Fizz Buzz,https://leanpub.com/fizzbuzz
66,Lobsters,math,Mathematics,"2 + 1 = 4, by quinoa",https://www.efavdb.com/quinoa%20packing
67,Lobsters,math,Mathematics,Creating Music—Part 3,https://www.lilychan.dev/track3.html
68,Lobsters,math,Mathematics,Getting to the Bottom of Noether’s Theorem,https://johncarlosbaez.wordpress.com/2020/06/29/noethers-theorem-2/
69,Lobsters,math,Mathematics,Introduction to Graph Theory,https://www.maths.ed.ac.uk/~v1ranick/papers/wilsongraph.pdf
70,Lobsters,math,Mathematics,Minkowski Asteroids,https://nickp.svbtle.com/asteroid-intersections
71,Lobsters,math,Mathematics,Implementing the Exponential Function,https://www.pseudorandom.com/implementing-exp
72,Lobsters,math,Mathematics,Finite Fields,https://btcclj.com/posts-output/2020-04-21-finite-fields/
73,Lobsters,math,Mathematics,Truth Table Generator,https://web.stanford.edu/class/cs103/tools/truth-table-tool/
74,Lobsters,math,Mathematics,Runnable code for solving Project Euler problems,https://github.com/nayuki/Project-Euler-solutions
75,Lobsters,math,Mathematics,Control theory for fun and profit,https://fauna.com/blog/control-theory-for-fun-and-profit
76,Lobsters,math,Mathematics,Breakthrough on the computation of Inverse Laplace Transforms,http://inverselaplace.org/
77,Lobsters,math,Mathematics,The Mathematical Hacker (2012),https://www.evanmiller.org/mathematical-hacker.html
78,Lobsters,math,Mathematics,Statistical Shortcomings in Standard Math Libraries (And How To Fix Them) (2014),https://www.evanmiller.org/statistical-shortcomings-in-standard-math-libraries.html
79,Lobsters,math,Mathematics,Bi-whatever transformations,https://wordsandbuttons.online/biwhatever_transformations.html
80,Lobsters,math,Mathematics,SageMath Mathematical Software System,https://www.sagemath.org/
81,Lobsters,math,Mathematics,A dynamic multilevel Bayesian model to predict US presidential elections,https://github.com/TheEconomist/us-potus-model
82,Lobsters,math,Mathematics,How to make PageRank faster (with lots of math and a hint of Python),https://dev.to/karjudev/how-to-make-pagerank-faster-with-lots-of-math-and-a-hint-of-python-2e92
83,Lobsters,math,Mathematics,A Link Between Russian Roulette and Rejection Sampling / Importance Sampling,https://blog.demofox.org/2020/06/04/a-link-between-russian-roulette-and-rejection-sampling-importance-sampling/
84,Lobsters,math,Mathematics,Penrose: from mathematical notation to beautiful diagrams,http://penrose.ink/siggraph20
85,Lobsters,math,Mathematics,Modern Portfolio Theory: a Case Study on Turnips,https://www.shawenyao.com/Modern-Portfolio-Theory-a-Case-Study-on-Turnips/
86,Lobsters,math,Mathematics,The Definitive Glossary of Higher Mathematical Jargon,https://mathvault.ca/math-glossary/
87,Lobsters,math,Mathematics,Fixing a long-standing bug in satellite-based nuclear weapon detectors,https://docs.google.com/document/d/1pyGft-OXrSw1ZPUMZCE0mxG92_xqtzgdanHwkKLpxUQ/edit
88,Lobsters,math,Mathematics,The radix 2^51 trick,https://www.chosenplaintext.ca/articles/radix-2-51-trick.html
89,Lobsters,math,Mathematics,Does anyone know of any human-computable RNG?,/s/mmyysm/does_anyone_know_any_human_computable_rng
90,Lobsters,math,Mathematics,Category Theory -- The math behind hyper-convergence automation,https://multix.sfo2.cdn.digitaloceanspaces.com/Category%20Theory%20TechBBQ.pdf
91,Lobsters,math,Mathematics,"What Is bfloat16, Anyway?",https://www.eejournal.com/article/what-is-bfloat16-anyway/
92,Lobsters,math,Mathematics,[1991] The Psychology of Advanced Mathematical Thinking,https://homepages.warwick.ac.uk/staff/David.Tall/pdfs/dot1991k-psychology-of-amt.pdf
93,Lobsters,math,Mathematics,Kotlingrad: Shape-Safe Differentiable Programming with Algebraic Data Types,https://github.com/breandan/kotlingrad
94,Lobsters,math,Mathematics,Taming Floating Point Error,http://www.johnbcoughlin.com/posts/floating-point-axiom/
95,Lobsters,math,Mathematics,A brief introduction to the beauty of Information Theory,https://notamonadtutorial.com/a-brief-introduction-to-the-beauty-of-information-theory-8357f5b6a355
96,Lobsters,math,Mathematics,A Fervent Defense of Frequentist Statistics (2014),https://jsteinhardt.wordpress.com/2014/02/10/a-fervent-defense-of-frequentist-statistics/
97,Lobsters,math,Mathematics,Named Distributions as Artifacts,https://blog.cerebralab.com/Named_Distributions_as_Artifacts
98,Lobsters,math,Mathematics,Euler's FizzBuzz,http://philcrissman.net/posts/eulers-fizzbuzz/
99,Lobsters,math,Mathematics,Multipole Methods for the Masses,https://andyljones.com/posts/multipole-methods.html
100,Lobsters,math,Mathematics,Numbers in Python,https://orbifold.xyz/numbers.html
101,Lobsters,math,Mathematics,Learning to Prove Theorems via Interacting with Proof Assistants,https://arxiv.org/abs/1905.09381
102,Lobsters,math,Mathematics,Reverse Engineering Uber and Lyft Surge Pricing in Chicago,https://toddwschneider.com/posts/chicago-ridehail-surge-pricing/
103,Lobsters,math,Mathematics,Tiers of answers to half-baked questions,https://blog.plover.com/misc/half-baked.html
104,Lobsters,math,Mathematics,Sampling using integral transforms,https://github.com/eugenedeon/hitchhikersscatter/blob/master/code/MonteCarlo/Sampling/sampling_using_integral_transforms.pdf
105,Lobsters,math,Mathematics,Tutorial for Use of Basic Queueing Formulas,http://web.mst.edu/~gosavia/queuing_formulas.pdf
106,Lobsters,math,Mathematics,"Renowned Princeton Mathematician, 'Game Of Life' Inventor John Conway, Passes Away",https://dailyvoice.com/new-jersey/mercer/obituaries/covid-19-kills-renowned-princeton-mathematician-game-of-life-inventor-john-conway-in-3-days/786461/
107,Lobsters,math,Mathematics,Blazing fast math rendering on the web,http://bollu.github.io/#blazing-fast-math-rendering-on-the-web
108,Lobsters,math,Mathematics,You can use floating-point numbers for money,https://www.evanjones.ca/floating-point-money.html
109,Lobsters,math,Mathematics,The predecessor function for Church Numerals in the Lambda Calculus,http://gregfjohnson.com/pred/
110,Lobsters,math,Mathematics,From conventional to institution-independent logic programming,https://academic.oup.com/logcom/logcom/article-abstract/27/6/1679/2917800
111,Lobsters,math,Mathematics,Cofactor Explained: Clearing Elliptic Curves' dirty little secret,http://loup-vaillant.fr/tutorials/cofactor
112,Lobsters,math,Mathematics,Rotation by Shearing,https://www.ocf.berkeley.edu/~fricke/projects/israel/paeth/rotation_by_shearing.html
113,Lobsters,math,Mathematics,Multiplying backward for profit,https://lemire.me/blog/2020/04/05/multiplying-backward-for-profit/
114,Lobsters,math,Mathematics,Doing a math assignment with the Lean theorem prover,https://ahelwer.ca/post/2020-04-05-lean-assignment/
115,Lobsters,math,Mathematics,Biquadratic interpolation with independent sample weights,https://thomasdeliot.wixsite.com/blog/single-post/2020/03/30/Biquadratic-interpolation-with-independent-sample-weights
116,Lobsters,math,Mathematics,A Brief Case Against Limits,https://mathwithbaddrawings.com/2019/01/09/a-brief-case-against-limits/
117,Lobsters,math,Mathematics,Coordinates and Transformation,https://ocw.mit.edu/courses/electrical-engineering-and-computer-science/6-837-computer-graphics-fall-2012/lecture-notes/MIT6_837F12_Lec03.pdf
118,Lobsters,math,Mathematics,An Overview of Bayesian Inference,https://jaydaigle.net/blog/overview-of-bayesian-inference/
119,Lobsters,math,Mathematics,A Brief Introduction to Ice-Penetrating Radar,https://lindzey.github.io/blog/2015/07/27/a-brief-introduction-to-ice-penetrating-radar/
120,Lobsters,math,Mathematics,3 3 Strassen 's Subcubic Matrix Multiplication Algorithm,https://www.youtube.com/watch?v=ORrM-aSNZUs
121,Lobsters,math,Mathematics,Landmark Computer Science Proof Cascades Through Physics and Math,https://www.quantamagazine.org/landmark-computer-science-proof-cascades-through-physics-and-math-20200304/
122,Lobsters,math,Mathematics,Basic Methods For Finding Zeroes and Mins / Maxes of Functions,https://blog.demofox.org/2020/03/17/basic-methods-for-finding-zeroes-and-mins-maxes-of-functions/
123,Lobsters,math,Mathematics,Three typefaces for mathematics (2007),http://ultrasparky.org/school/pdf/DanielRhatigan_Dissertation.pdf
124,Lobsters,math,Mathematics,Discrete Mathematics: An Open Introduction,http://discrete.openmathbooks.org/dmoi2/dmoi.html
125,Lobsters,math,Mathematics,Math and coding resources for homeschooling,https://welikemath.ml/
126,Lobsters,math,Mathematics,"Lies, Damned Lies, and Averages: Perc50, Perc95 explained for Programmers",https://schneems.com/2020/03/17/lies-damned-lies-and-averages-perc50-perc95-explained-for-programmers/
127,Lobsters,math,Mathematics,MathJax turns 3.0,http://bit-player.org/2020/mathjax-turns-3-0
128,Lobsters,math,Mathematics,Finding coffee in Pi using LibBF and grep,https://www.johndcook.com/blog/2020/03/14/finding-coffee-in-pi/
129,Lobsters,math,Mathematics,"No, really, pi is wrong: The Tau Manifesto",https://tauday.com/tau-manifesto
130,Lobsters,math,Mathematics,Equality Is Hard,https://www.craigstuntz.com/posts/2020-03-09-equality-is-hard.html
131,Lobsters,math,Mathematics,Random L-Systems Visualizer,https://ehrenjn.github.io/LSystems/
132,Lobsters,math,Mathematics,Relating Natural Language Aptitude to Individual Differences in Learning Programming Languages,https://www.nature.com/articles/s41598-020-60661-8
133,Lobsters,math,Mathematics,"Dragging, Resizing and Rotating HTML elements: Fun with Web Components and Math",https://nmattia.com/posts/2020-03-03-drag-resize-rotate.html
134,Lobsters,math,Mathematics,Time Frequency Duality,https://0xfe.blogspot.com/2020/02/time-frequency-duality.html
135,Lobsters,math,Mathematics,Visual explanations of mathematics,https://agilescientific.com/blog/2020/2/25/visual-explanations-of-mathematics
136,Lobsters,math,Mathematics,The Googolplex Page (2002),http://www.fpx.de/fp/Fun/Googolplex/
137,Lobsters,math,Mathematics,Math is your insurance policy,https://bartoszmilewski.com/2020/02/24/math-is-your-insurance-policy/
138,Lobsters,math,Mathematics,Pitch Detection with Convolutional Networks,http://0xfe.blogspot.com/2020/02/pitch-detection-with-convolutional.html
139,Lobsters,math,Mathematics,Using neural networks to solve advanced mathematics equations,https://ai.facebook.com/blog/using-neural-networks-to-solve-advanced-mathematics-equations/
140,Lobsters,math,Mathematics,Popcount: counting the number of 1's in a bit stream,https://www.johndcook.com/blog/2020/02/21/popcount/
141,Lobsters,math,Mathematics,Intel overstates FPU accuracy (2013),http://notabs.org/fpuaccuracy/
142,Lobsters,math,Mathematics,Calculating Pi: My attempt at breaking the Pi World Record,https://blog.timothymullican.com/calculating-pi-my-attempt-breaking-pi-record
143,Lobsters,math,Mathematics,Demystifying Differentiable Programming: Shift/Reset the Penultimate Backpropagator,https://arxiv.org/abs/1803.10228
144,Lobsters,math,Mathematics,Equality in Mechanized Mathematics,https://artagnon.com/articles/equality
145,Lobsters,math,Mathematics,From boiling lead and black art: An essay on the history of mathematical typography (2017),http://www.practicallyefficient.com/2017/10/13/from-boiling-lead-and-black-art.html
146,Lobsters,math,Mathematics,But what is the Fourier Transform? A visual introduction. (2018),https://www.youtube.com/watch?v=spUNpyF58BY
147,Lobsters,math,Mathematics,A Snake Egg Puzzle Solver,https://github.com/tuzz/snake-egg-puzzle
148,Lobsters,math,Mathematics,"Category Theory for Programmers, OCaml edition (alpha) is out",https://github.com/hmemcpy/milewski-ctfp-pdf/releases/tag/v1.4.0-rc1
149,Lobsters,math,Mathematics,Journal for the Mathematics of Composition,https://compositionality-journal.org/
150,Lobsters,math,Mathematics,Gears,https://ciechanow.ski/gears/
151,Lobsters,math,Mathematics,The Evolution of Trust,https://ncase.me/trust/
152,Lobsters,math,Mathematics,Plotting complex functions,https://www.johndcook.com/blog/2020/02/11/plotting-complex-functions/
153,Lobsters,math,Mathematics,Where is the fashionable mathematics?,https://xenaproject.wordpress.com/2020/02/09/where-is-the-fashionable-mathematics/
154,Lobsters,math,Mathematics,How much space would it take to store every word ever said?,https://blog.jonlu.ca/posts/word-storage?ref=l
155,Lobsters,math,Mathematics,Geometric Algebra,https://www.youtube.com/watch?v=tX4H_ctggYo
156,Lobsters,math,Mathematics,Introduction to Statistical Learning with Applications in R,http://faculty.marshall.usc.edu/gareth-james/ISL/
157,Lobsters,math,Mathematics,"Beyond the mean, median, and mode",https://ericneyman.wordpress.com/2019/12/26/beyond-the-mean-median-and-mode/
158,Lobsters,math,Mathematics,SlowerLogLog,https://www.evanmiller.org/slower-log-log.html
159,Lobsters,math,Mathematics,"Separate your filters! Separability, SVD and low-rank approximation of 2D image processing filters",https://bartwronski.com/2020/02/03/separate-your-filters-svd-and-low-rank-approximation-of-image-filters/
160,Lobsters,math,Mathematics,Stiff differential equations,https://www.johndcook.com/blog/2020/02/02/stiff-differential-equations/
161,Lobsters,math,Mathematics,An inquiry into the Foundations of Mathematics,https://artagnon.com/articles/fom
162,Lobsters,math,Mathematics,"John Harrison: let's make set theory great again! [2018, slides]",http://aitp-conference.org/2018/slides/JH.pdf
163,Lobsters,math,Mathematics,An Introduction to Number Theory,https://nrich.maths.org/number-theory
164,Lobsters,math,Mathematics,Progressive Least-Squares Encoding for Linear Bases,http://www.jcgt.org/published/0009/01/02/
165,Lobsters,math,Mathematics,Probability distribution of multiplied dice rolls,https://boredzo.org/blog/archives/2020-01-25/probability-distribution-of-multiplied-dice-rolls
166,Lobsters,math,Mathematics,Fermi Estimates,https://www.lesswrong.com/posts/PsEppdvgRisz5xAHG/fermi-estimates
167,Lobsters,math,Mathematics,DEC64: Decimal Floating Point,http://www.dec64.com/
168,Lobsters,math,Mathematics,Projective Geometric Algebra Done Right,http://terathon.com/blog/projective-geometric-algebra-done-right/
169,Lobsters,math,Mathematics,The phantom of transparency,http://girard.perso.math.cnrs.fr/longo1.pdf
170,Lobsters,math,Mathematics,The TeX Pestilence (Why TeX/LaTeX Sucks) (2004),http://xahlee.info/cmaci/notation/TeX_pestilence.html
171,Lobsters,math,Mathematics,What You Needa Know about Yoneda,https://www.cs.ox.ac.uk/jeremy.gibbons/publications/proyo.pdf
172,Lobsters,math,Mathematics,A season in R,https://confidentialinterval.com/posts/a-season-in-r/
173,Lobsters,math,Mathematics,Reservoir Sampling,https://richardstartin.github.io/posts/reservoir-sampling
174,Lobsters,math,Mathematics,Cobweb plots,https://www.johndcook.com/blog/2020/01/19/cobweb-plots/
175,Lobsters,math,Mathematics,A Sober Look at Bayesian Neural Networks,https://jacobbuckman.com/2020-01-17-a-sober-look-at-bayesian-neural-networks/
176,Lobsters,math,Mathematics,"Using Z: Specification, Refinement, and Proof",http://www.cs.cmu.edu/~15819/zedbook.pdf
177,Lobsters,math,Mathematics,Calculating the mean of a list of numbers (2016),https://hypothesis.works/articles/calculating-the-mean/
178,Lobsters,math,Mathematics,Trellis Plots,https://www.stat.auckland.ac.nz/~ihaka/787/lectures-trellis.pdf
179,Lobsters,math,Mathematics,A non-symmetric divide-and-conquer recursive formula for the convolution of polynomials and power series,https://arxiv.org/abs/1912.00452
180,Lobsters,math,Mathematics,Adjunctions in the wild: foldl,https://blog.jle.im/entry/foldl-adjunction.html
181,Lobsters,math,Mathematics,Math for the Layman,http://www.cs.trinity.edu/About/The_Courses/cs301/math-for-the-layman/
182,Lobsters,math,Mathematics,Hyperproperties,https://www.cs.cornell.edu/fbs/publications/Hyperproperties.pdf
183,Lobsters,math,Mathematics,Mathematical diseases in climate models and how to cure them,https://www.youtube.com/watch?v=WGe-gYRSM7c
184,Lobsters,math,Mathematics,Lean versus Coq: The cultural chasm,https://artagnon.com/articles/leancoq
185,Lobsters,math,Mathematics,Don't bet on an expected value,https://lambdaclass.com/data_etudes/dont_bet_on_an_ev/
186,Lobsters,math,Mathematics,"Monte Πthon - Monte Carlo, Π, and 8 lines of Python",https://www.towardssoftware.com/blog#blog28
187,Lobsters,math,Mathematics,Calculate the day of the week for any date in your head,http://rudy.ca/doomsday.html
188,Lobsters,math,Mathematics,A new take on the birthday problem,https://www.johndcook.com/blog/2019/12/28/expected-number-of-hash-values/
189,Lobsters,math,Mathematics,When Windows’ Calculator Won’t Do: Mathcad PLUS 6.0 Professional Edition,https://socket3.wordpress.com/2019/09/28/when-windows-calculator-wont-do-mathcad-plus-6-0-professional-edition/
190,Lobsters,math,Mathematics,Exposing Floating Point,https://ciechanow.ski/exposing-floating-point/
