ID,Source,Tag_Code,Tag_Name,Title,Url
703,Lobsters,python,Python programming,Rendering GPS traces,https://gkbrk.com/2019/01/rendering-gps-traces/
704,Lobsters,python,Python programming,Python Decorator for Simplifying Delegate Pattern,https://programmingideaswithjake.wordpress.com/2015/05/23/python-decorator-for-simplifying-delegate-pattern/
705,Lobsters,python,Python programming,Inverting Facial Recognition Models,https://blog.floydhub.com/inverting-facial-recognition-models/
706,Lobsters,python,Python programming,What should be in the Python standard library?,https://lwn.net/Articles/776239
707,Lobsters,python,Python programming,Stuck with slow tests? Speed up your feedback loop,https://pythonspeed.com/articles/slow-tests-fast-feedback/
708,Lobsters,python,Python programming,Best engineering practices: how to fix a bug?,https://dev.to/wemake-services/best-engineering-practices-how-to-fix-a-bug-58g5
709,Lobsters,python,Python programming,Transaction tests in Pytest,https://blog.eleni.co/transaction-testcase-pytest/
710,Lobsters,python,Python programming,Using NLP to Automate Customer Support,https://blog.floydhub.com/automate-customer-support-part-two/
711,Lobsters,python,Python programming,Handling SIGTERM in python on Windows,https://maruel.ca/post/python_windows_signal/
712,Lobsters,python,Python programming,Introduction to the A* Algorithm,https://www.redblobgames.com/pathfinding/a-star/introduction.html
713,Lobsters,python,Python programming,Pachyderm vs Airflow,https://szeitlin.github.io/posts/engineering/pachyderm-vs-airflow/
714,Lobsters,python,Python programming,What I've Learned About Optimizing Python,https://gregoryszorc.com/blog/2019/01/10/what-i've-learned-about-optimizing-python/
715,Lobsters,python,Python programming,Exploring DNA with Deep Learning,https://blog.floydhub.com/exploring-dna-with-deep-learning/
716,Lobsters,python,Python programming,Treepace - Tree Transformation Language,https://nbviewer.jupyter.org/github/sulir/treepace/blob/master/doc/Tutorial.ipynb
717,Lobsters,python,Python programming,Checking in JSON,https://orbifold.xyz/check-in-json.html
718,Lobsters,python,Python programming,Modeling Polymorphism in Django,https://realpython.com/modeling-polymorphism-django-python/
719,Lobsters,python,Python programming,Reverse Engineering the Godot File Format,https://gkbrk.com/2019/01/reverse-engineering-the-godot-file-format/
720,Lobsters,python,Python programming,Classification evaluation,http://www.pycm.ir/
721,Lobsters,python,Python programming,PyPy for low-latency systems,https://morepypy.blogspot.com/2019/01/pypy-for-low-latency-systems.html
722,Lobsters,python,Python programming,Bytecode compilers and interpreters,https://bernsteinbear.com/blog/bytecode-interpreters/
723,Lobsters,python,Python programming,Distributing Standalone Python Applications,https://gregoryszorc.com/blog/2018/12/18/distributing-standalone-python-applications/
724,Lobsters,python,Python programming,"Color Code your Columns,Rows and cells of a dataframe",https://kanoki.org/2019/01/02/pandas-trick-for-the-day-color-code-columns-rows-cells-of-dataframe/
725,Lobsters,python,Python programming,Make A Presentation Out of Your Write-up,http://writango.com
726,Lobsters,python,Python programming,Learn Python for Data Science from Scratch,https://kanoki.org/2017/05/14/first-blog-post/
727,Lobsters,python,Python programming,art 2.7 released,http://art.shaghighi.ir
728,Lobsters,python,Python programming,Playground and cheatsheet for learning Python,https://github.com/trekhleb/learn-python
729,Lobsters,python,Python programming,A thing I learned about Python recursion,https://nedbatchelder.com/blog/201812/a_thing_i_learned_about_python_recursion.html
730,Lobsters,python,Python programming,Porting Synapse to Python 3,https://matrix.org/blog/2018/12/21/porting-synapse-to-python-3/
731,Lobsters,python,Python programming,Homemade machine learning in Python with interactive Jupyter demos,https://github.com/trekhleb/homemade-machine-learning
732,Lobsters,python,Python programming,Experiment: Recoil vs Muzzle Velocity,https://blog.ammolytics.com/2018-12-12/experiment-recoil-vs-muzzle-velocity.html
733,Lobsters,python,Python programming,"Build a Simple CRUD App with Python, Flask, and React",https://developer.okta.com/blog/2018/12/20/crud-app-with-python-flask-react
734,Lobsters,python,Python programming,Awesome Python Applications: Case studies in shipping Python software,https://sedimental.org/awesome_python_applications.html
735,Lobsters,python,Python programming,How to open source your Python library,https://opensource.com/article/18/12/tips-open-sourcing-python-libraries
736,Lobsters,python,Python programming,PyCM : New machine learning library,http://pycm.shaghighi.ir
737,Lobsters,python,Python programming,"Advent of Code Python Solutions, Explained",https://www.michaelfogleman.com/aoc18/
738,Lobsters,python,Python programming,mypy - Optional Static Typing for Python,http://mypy-lang.org/
739,Lobsters,python,Python programming,Mitogen comes to Opsmop,https://sweetness.hmmz.org/2018-12-18-mitogen-opsmop.html
740,Lobsters,python,Python programming,How to Write Perfect Python Command-line Interfaces,https://blog.sicara.com/perfect-python-command-line-interfaces-7d5d4efad6a2
741,Lobsters,python,Python programming,PyCM 1.7 : New machine learning library for confusion matrix statistical analysis,https://github.com/sepandhaghighi/pycm
742,Lobsters,python,Python programming,ASCII Art Library For Python,https://github.com/sepandhaghighi/art
743,Lobsters,python,Python programming,Free Hotel Wifi with Python and Selenium,https://gkbrk.com/2018/12/free-hotel-wifi-with-python-and-selenium/
744,Lobsters,python,Python programming,Secure headers and cookies for Python web frameworks,https://github.com/cakinney/secure
745,Lobsters,python,Python programming,Spinning Up a Pong AI with Deep Reinforcement Learning,https://blog.floydhub.com/spinning-up-with-deep-reinforcement-learning/
746,Lobsters,python,Python programming,Multilingual text clustering,https://github.com/ArtificiAI/Multilingual-Latent-Dirichlet-Allocation-LDA
747,Lobsters,python,Python programming,How to Grow Neat Software Architecture out of Jupyter Notebooks,https://github.com/guillaume-chevalier/How-to-Grow-Neat-Software-Architecture-out-of-Jupyter-Notebooks
748,Lobsters,python,Python programming,Wallaroo (stream processing in Python) 0.6.0 is now available,https://github.com/WallarooLabs/wallaroo/releases/tag/0.6.0
749,Lobsters,python,Python programming,A multi-value syntax tree filtering in Python,https://julien.danjou.info/multi-value-syntax-tree-filtering-in-python/
750,Lobsters,python,Python programming,CPython Development Workflow Automation,https://medium.com/mergify/case-study-cpython-development-workflow-9f9ba6fa53a
751,Lobsters,python,Python programming,"What Is a Data Frame? (In Python, R, and SQL)",http://www.oilshell.org/blog/2018/11/30.html
752,Lobsters,python,Python programming,Reading minds with deep learning,https://blog.floydhub.com/reading-minds-with-deep-learning/
753,Lobsters,python,Python programming,minaotp - a TOTP authenticator running as a terminal tool,https://github.com/MinaOTP/MinaOTP-Shell
754,Lobsters,python,Python programming,Generating classical music with LSTM neural networks,https://blog.floydhub.com/generating-classical-music-with-neural-networks/
755,Lobsters,python,Python programming,"DIY Predictive Modeling Cluster with Kubernetes, Dask and JupyterHub",https://www.youtube.com/watch?v=iRHJYXu5qx8
756,Lobsters,python,Python programming,Reposurgeon's Excellent Journey and the Waning of Python,http://esr.ibiblio.org/?p=8161
757,Lobsters,python,Python programming,Embedding Python in a MacOS Application (2017),https://medium.com/python-pandemonium/embedding-a-python-application-in-macos-d866adfcaf94
758,Lobsters,python,Python programming,Recognize relatives with deep learning,https://blog.floydhub.com/build-image-classification-app-with-fastai/
759,Lobsters,python,Python programming,Using Wallaroo with PostgreSQL,https://blog.wallaroolabs.com/2018/11/using-wallaroo-with-postgresql/
760,Lobsters,python,Python programming,pyusbip,https://joshua0.dreamwidth.org/67264.html
761,Lobsters,python,Python programming,Viewing Python execution with source code rewriting,http://www.ianbicking.org/blog/2018/11/viewing-python-execution-source-code-rewriting.html
762,Lobsters,python,Python programming,Tworoutines in Python,http://threespeedlogic.com/python-tworoutines.html
763,Lobsters,python,Python programming,A quick dive into Python’s “__slots__”,https://blog.usejournal.com/a-quick-dive-into-pythons-slots-72cdc2d334e
764,Lobsters,python,Python programming,"Funky - Easier, Flexible, and more Interactive Shell Functions",https://github.com/bbugyi200/funky
765,Lobsters,python,Python programming,Bleeding edge django template focused on code quality and security,https://github.com/wemake-services/wemake-django-template
766,Lobsters,python,Python programming,Python memoization across program runs,https://github.com/bwasti/cache.py
767,Lobsters,python,Python programming,Estimating number of bugs left to find with Lincoln index,https://www.johndcook.com/blog/2010/07/13/lincoln-index/
768,Lobsters,python,Python programming,Bridging the gap between Python and Jupyter,https://fmind.me/posts/bridge-python-jupyter.html
769,Lobsters,python,Python programming,Run SQL directly on CSV files with q,https://harelba.github.io/q/
770,Lobsters,python,Python programming,Colorizing and Restoring Old Images with Deep Learning,https://blog.floydhub.com/colorizing-and-restoring-old-images-with-deep-learning/
771,Lobsters,python,Python programming,Wikked 0.8.1,https://ludovic.chabant.com/devblog/2018/11/08/wikked-0.8.1/
772,Lobsters,python,Python programming,Generating Software Tests,https://www.fuzzingbook.org/
773,Lobsters,python,Python programming,termtosvg - Record terminal sessions as SVG animations,https://github.com/nbedos/termtosvg
774,Lobsters,python,Python programming,Crash reporting in desktop Python applications,http://blogs.dropbox.com/tech/2018/11/crash-reporting-in-desktop-python-applications/
775,Lobsters,python,Python programming,Forms—Comparing Django to Rails,http://www.rubypigeon.com/posts/forms-comparing-django-to-rails/
776,Lobsters,python,Python programming,Algojammer Editor,https://github.com/ChrisKnott/Algojammer
777,Lobsters,python,Python programming,Vespene - A Build & Self-Service Automation Platform From The Creator of Ansible,https://vespene.io/
778,Lobsters,python,Python programming,Python Email Verifier with SOCKS support,https://github.com/Gardener-gg/email-verifier
779,Lobsters,python,Python programming,"The Waiting Time Paradox, or, Why Is My Bus Always Late?",http://jakevdp.github.io/blog/2018/09/13/waiting-time-paradox/
780,Lobsters,python,Python programming,Improve your Python Project: A Layered Approach,https://fmind.me/posts/layered-python-projects.html
781,Lobsters,python,Python programming,Hustlr: The Web App that Names Your Startup,https://github.com/veekaybee/hustlr
782,Lobsters,python,Python programming,Functional Programming in Python with Toolz,https://opensource.com/article/18/10/functional-programming-python-toolz
783,Lobsters,python,Python programming,Introducing Connectors: Wallaroo’s Window to the World,https://blog.wallaroolabs.com/2018/10/introducing-connectors-wallaroos-window-to-the-world/
784,Lobsters,python,Python programming,Tootstream CLI Mastodon interface,https://github.com/magicalraccoon/tootstream
785,Lobsters,python,Python programming,cursive_re - readable regular expressions for Python 3,https://github.com/Bogdanp/cursive_re
786,Lobsters,python,Python programming,1-minute guide to real constants in Python,https://dev.to/wemake-services/1-minute-guide-to-real-constants-in-python-2bpk
787,Lobsters,python,Python programming,Update on Structured Concurrency,http://250bpm.com/blog:137
788,Lobsters,python,Python programming,Covariance and contravariance in subtyping,https://eli.thegreenplace.net/2018/covariance-and-contravariance-in-subtyping/
789,Lobsters,python,Python programming,Oxidizing Python: Speeding up URL quoting by 10x using Rust,https://tech.blue-yonder.com/oxidizing-python-speeding-up-urlquoting-by-using-rust/
790,Lobsters,python,Python programming,Kitten: a tiny multi-server automation tool,https://github.com/hoffa/kitten
791,Lobsters,python,Python programming,An HTTP Service Framework from the author of Python Requests,https://python-responder.org/en/latest/
792,Lobsters,python,Python programming,Spinning up a Wallaroo cluster is easy,https://blog.wallaroolabs.com/2018/10/spinning-up-a-wallaroo-cluster-is-easy/
793,Lobsters,python,Python programming,safemd – A markdown renderer focusing on security first,https://github.com/Hultner/safemd
794,Lobsters,python,Python programming,Python Mock Cookbook,https://chase-seibert.github.io/blog/2015/06/25/python-mocking-cookbook.html
795,Lobsters,python,Python programming,Newscafe,https://news.sub.cafe/
796,Lobsters,python,Python programming,Wallaroo goes full Apache 2.0,https://blog.wallaroolabs.com/2018/10/wallaroo-goes-full-apache-2.0/
797,Lobsters,python,Python programming,dbxfs: Open source macOS/Linux file system for Dropbox,https://github.com/rianhunter/dbxfs	
798,Lobsters,python,Python programming,Don't mix return and yield,http://www.xavierdupre.fr/blog/2016-02-26_nojs.html
799,Lobsters,python,Python programming,Wallaroo 0.5.3 released,https://github.com/WallarooLabs/wallaroo/releases
800,Lobsters,python,Python programming,Updating a Django queryset with annotation and subquery,https://www.paulox.net/2018/10/01/updating-a-django-queryset-with-annotation-and-subquery/
801,Lobsters,python,Python programming,Backtesting for Intraday Execution,https://www.hardikp.com/2018/09/28/backtesting-for-intraday/
802,Lobsters,python,Python programming,Nand to CPU,https://blog.asrpo.com/nand2cpu
803,Lobsters,python,Python programming,How we rolled out one of the largest Python 3 migrations ever,http://blogs.dropbox.com/tech/2018/09/how-we-rolled-out-one-of-the-largest-python-3-migrations-ever/
804,Lobsters,python,Python programming,A Logo-to-Python Transpiler,https://pablasso.com/logo-to-python-transpiler/
805,Lobsters,python,Python programming,asyncio documentation rewritten from scratch,https://docs.python.org/3/library/asyncio.html
806,Lobsters,python,Python programming,You Can't Handle the Truth! (Python Boolean and None checks),https://amir.rachum.com/blog/2012/08/25/you-cant-handle-the-truth/
807,Lobsters,python,Python programming,An Objective Argument Against Python-style Indentation,/s/wjevh7/objective_argument_against_python_style
808,Lobsters,python,Python programming,Python AI in Starcraft II Tutorial Series,https://www.youtube.com/playlist?list=PLQVvvaa0QuDcT3tPehHdisGMc8TInNqdq
809,Lobsters,python,Python programming,"Mayan EDMS version 3.1 ""papercuts"" released",https://www.mayan-edms.com/post/mayan-edms-version-3.1-released/
810,Lobsters,python,Python programming,Make Python Pandas go fast,https://blog.wallaroolabs.com/2018/09/make-python-pandas-go-fast/
811,Lobsters,python,Python programming,Managing Python Processes with PM2,https://blog.pm2.io/managing-python-application-with-pm2/
812,Lobsters,python,Python programming,"Configuring Emacs, lsp-mode and the python language server",https://vxlabs.com/2018/06/08/python-language-server-with-emacs-and-lsp-mode/
813,Lobsters,python,Python programming,A simple split-stream mutation engine in Python,https://rahul.gopinath.org/2018/09/16/writing-a-mutation-engine/
814,Lobsters,python,Python programming,Lazy Interfaces in Python,https://github.com/bwasti/lazy
815,Lobsters,python,Python programming,"So Joel Grus doesn't like Jupyter notebooks. [Some] thoughts on notebooks, IDE, and R Markdown",https://yihui.name/en/2018/09/notebook-war/
816,Lobsters,python,Python programming,Converting a Batch Job to Real-time,https://blog.wallaroolabs.com/2018/09/converting-a-batch-job-to-real-time/
817,Lobsters,python,Python programming,What CPython could use Cython for,http://blog.behnel.de/posts/what-cpython-could-use-cython-for.html
818,Lobsters,python,Python programming,My personal CLI URL shortner less than 200 LoC,http://iret.ml
819,Lobsters,python,Python programming,You Should Use VS Code If You're a Python Developer,https://www.kennethreitz.org/essays/why-you-should-use-vs-code-if-youre-a-python-developer
820,Lobsters,python,Python programming,The First 15 Years of PyPy — a Personal Retrospective,https://morepypy.blogspot.com/2018/09/the-first-15-years-of-pypy.html
821,Lobsters,python,Python programming,Clojure at Scale: Why Python Just Wasn't Enough for AppsFlyer,https://blog.takipi.com/clojure-at-scale-why-python-just-wasnt-enough-for-appsflyer/
822,Lobsters,python,Python programming,An awesome new Python profiler: py-spy,https://jvns.ca/blog/2018/09/08/an-awesome-new-python-profiler--py-spy-/
823,Lobsters,python,Python programming,"A Brief, Animated Introduction to Programming with Python",https://ourcodestories.com/markm208/Playlist/16
824,Lobsters,python,Python programming,Py-Spy: A sampling profiler for Python programs,https://github.com/benfred/py-spy
825,Lobsters,python,Python programming,Multilingual Latent Dirichlet Allocation (LDA) for text clustering,https://github.com/ArtificiAI/Multilingual-Latent-Dirichlet-Allocation-LDA
826,Lobsters,python,Python programming,Stabbing yourself with a fork() in a multiprocessing.Pool full of sharks,https://codewithoutrules.com/2018/09/04/python-multiprocessing/
827,Lobsters,python,Python programming,"50 times faster data loading for Pandas: no problem, using C++",https://blog.esciencecenter.nl/irregular-data-in-pandas-using-c-88ce311cb9ef
828,Lobsters,python,Python programming,Transmit optimisations in Mitogen 0.3,https://sweetness.hmmz.org/2018-08-30-mitogen-03-xmit.html
829,Lobsters,python,Python programming,"Why Python's for-else Clause Makes Perfect Sense, but You Still Shouldn't Use It",https://intoli.com/blog/for-else-in-python/
830,Lobsters,python,Python programming,I Don't Like Notebooks,https://docs.google.com/presentation/d/1n2RlMdmv1p25Xy5thJUhkKGvjtV-dkAIsUXP-AL4ffI/preview?slide=id.g362da58057_0_1
831,Lobsters,python,Python programming,A case for better Python docstrings,https://dorukkilitcioglu.github.io/programming/2018/08/18/python-better-docstring.html
832,Lobsters,python,Python programming,Add caching to speed up your site: Even if you think it isn't needed,https://crondev.blog/2018/08/12/add-caching-to-speed-up-your-site-even-if-you-think-it-isnt-needed/
833,Lobsters,python,Python programming,Remote Code Execution on a Facebook Server,https://blog.scrt.ch/2018/08/24/remote-code-execution-on-a-facebook-server/
834,Lobsters,python,Python programming,parsedmarc - Open source DMARC report analyzer and visualizer,https://github.com/domainaware/parsedmarc
835,Lobsters,python,Python programming,vid2vid: photorealistic video-to-video translation,https://github.com/NVIDIA/vid2vid
836,Lobsters,python,Python programming,A Practical Introduction to Artificial Neural Networks with Python,http://krisbolton.com/a-practical-introduction-to-artificial-neural-networks-with-python/
837,Lobsters,python,Python programming,Dynamic Django Models with Model Models,https://www.protoapi.net/blog/2/
838,Lobsters,python,Python programming,Adding a pipe operator to Python,https://hackernoon.com/adding-a-pipe-operator-to-python-19a3aa295642
839,Lobsters,python,Python programming,An Asyncio socket tutorial; How to build an ASGI web server,https://medium.com/@pgjones/an-asyncio-socket-tutorial-5e6f3308b8b0
840,Lobsters,python,Python programming,Python’s List Comprehensions: Uses and Advantages,https://towardsdatascience.com/how-list-comprehensions-can-help-your-code-look-better-and-run-smoother-3cf8f87172ae
841,Lobsters,python,Python programming,(An ((Even Better) Lisp) Interpreter (in Python)) (2015),https://norvig.com/lispy2.html
842,Lobsters,python,Python programming,Bringing macros to Python by abusing type annotations,https://tinkering.xyz/abusing-type-annotations/
843,Lobsters,python,Python programming,A Guide to Python's Magic Methods,https://rszalski.github.io/magicmethods/
844,Lobsters,python,Python programming,Blocking Compromised Passwords on PyPI,https://caremad.io/posts/2018/08/pypi-compromised-passwords/
845,Lobsters,python,Python programming,"Feather: fast, interoperable data frame storage",https://github.com/wesm/feather
846,Lobsters,python,Python programming,PyMC3: probabilistic programming module for Python,https://docs.pymc.io/intro.html
847,Lobsters,python,Python programming,Strategies for dealing with poor code in limited time,https://chrismm.com/blog/strategies-for-dealing-with-poor-code-in-limited-time/
848,Lobsters,python,Python programming,Three hundred tasks from interviews. You can stretch your brains out a little,https://www.interviewbit.com/all-problem-list/
849,Lobsters,python,Python programming,Sclack - A Python-based CLI client for Slack,https://github.com/haskellcamargo/sclack
850,Lobsters,python,Python programming,Why Numba and Cython are not substitutes for Julia,http://www.stochasticlifestyle.com/why-numba-and-cython-are-not-substitutes-for-julia/
851,Lobsters,python,Python programming,Genstego: Image Steganography Based on a Genetic Algorithim,https://dani.codes/post/genstego/
852,Lobsters,python,Python programming,Operations Scheduling via Dynamic Programming,https://lukasmericle.github.io/dynprotut/
853,Lobsters,python,Python programming,HPolyC: length-preserving encryption for entry-level processors,https://eprint.iacr.org/2018/720
854,Lobsters,python,Python programming,The Worm Ouroboros,http://semantic-domain.blogspot.com/2018/08/the-worm-ouroboros.html
855,Lobsters,python,Python programming,Wallaroo's New Dynamic Keys Feature,https://blog.wallaroolabs.com/2018/08/dynamic-keys/
856,Lobsters,python,Python programming,Python descriptors demystified,http://nbviewer.jupyter.org/urls/gist.github.com/ChrisBeaumont/5758381/raw/descriptor_writeup.ipynb
857,Lobsters,python,Python programming,Faust - Python Stream Processing,http://fauststream.com/en/latest/
858,Lobsters,python,Python programming,SiloRider: a CLI tool that cross-posts entries on your blog to Twitter/Mastodon,https://ludovic.chabant.com/devblog/2018/07/30/announcing-silorider/
859,Lobsters,python,Python programming,RPC Frameworks: gRPC vs Thrift vs RPyC for python,https://www.hardikp.com/2018/07/28/services/
860,Lobsters,python,Python programming,A simple filtering syntax tree in Python,https://julien.danjou.info/simple-filtering-syntax-tree-in-python/
861,Lobsters,python,Python programming,Node.js 8 and Python 3.7 runtimes now available in Google Cloud Functions,https://cloudplatform.googleblog.com/2018/07/bringing-the-best-of-serverless-to-you.html
862,Lobsters,python,Python programming,Diffy: A digital forensics and incident response tool,https://github.com/Netflix-Skunkworks/diffy
863,Lobsters,python,Python programming,Replacing netstat's 90s C Code With Modern Python,https://matt.sh/netmatt
864,Lobsters,python,Python programming,The Frontpage of Mastodon - I ranked all posts in the federiverse using the HN algorithm,http://lazymastodon.com/
865,Lobsters,python,Python programming,Genetic Algorithm Implementation in Python,https://www.aitribune.com/article/2018071087
866,Lobsters,python,Python programming,Tutorial: Getting started with Quantum Computing (Python),http://dataespresso.com/en/2018/07/22/Tutorial-Generating-random-numbers-with-a-quantum-computer-Python/
867,Lobsters,python,Python programming,OSH 0.5 - A Release with Many Contributors,http://www.oilshell.org/blog/2018/07/23.html
868,Lobsters,python,Python programming,Oil Shell Summer Status Update,http://www.oilshell.org/blog/2018/07/21.html
869,Lobsters,python,Python programming,Reading and writing to Google Spreadsheets using Python,https://www.interviewqs.com/blog/python_sheets
870,Lobsters,python,Python programming,Event Triggered Customer Segmentation,https://blog.wallaroolabs.com/2018/07/event-triggered-customer-segmentation/
871,Lobsters,python,Python programming,How to create a traceback object in Python,https://unterwaditzer.net/2018/python-custom-tracebacks.html
872,Lobsters,python,Python programming,Python post-Guido,https://lwn.net/SubscriberLink/759756/931b0f4617723184/
873,Lobsters,python,Python programming,Generating Commencement Speeches with Markov Chains,https://blog.floydhub.com/markov-chains/
874,Lobsters,python,Python programming,Django Girls Tutorial,https://tutorial.djangogirls.org/en/
875,Lobsters,python,Python programming,Mypy 0.620 Released,http://mypy-lang.blogspot.com/2018/07/mypy-0620-released.html
876,Lobsters,python,Python programming,Packaging Python code with XAR,http://sevag.xyz/post/xar/
877,Lobsters,python,Python programming,Nagini: A Static Verifier for Python,http://pm.inf.ethz.ch/publications/getpdf.php?bibname=Own&id=EilersMueller18.pdf
878,Lobsters,python,Python programming,XARs: An efficient system for self-contained executables,https://code.fb.com/data-infrastructure/xars-a-more-efficient-open-source-system-for-self-contained-executables/
879,Lobsters,python,Python programming,"Python vs. Ruby: A Battle to The Death (Gary Bernhardt, 2010)",https://vimeo.com/9471538
880,Lobsters,python,Python programming,Detecting Spam as it happens: Getting Erlang and Python working together with Wallaroo,https://blog.wallaroolabs.com/2018/07/detecting-spam-as-it-happens-getting-erlang-and-python-working-together-with-wallaroo/
881,Lobsters,python,Python programming,Guido van Rossum steps down as Python BDFL,https://www.mail-archive.com/python-committers@python.org/msg05628.html
882,Lobsters,python,Python programming,Github Discovery feed Tutorial,https://github.getstream.io/
