ID,Source,Tag_Code,Tag_Name,Title,Url
357,Lobsters,python,Python programming,Test-driven Development Fundamentals,https://www.pluralsight.com/tech-blog/test-driven-development-fundamentals/
358,Lobsters,python,Python programming,Send SMS using python (Without Twilio),https://muhammadraza.me/2018/sending-sms-using-python/
359,Lobsters,python,Python programming,Doing Python Configuration Right,https://whalesalad.com/blog/doing-python-configuration-right
360,Lobsters,python,Python programming,Monads aren't as hard as you think,https://bytes.yingw787.com/posts/2019/12/06/monads/
361,Lobsters,python,Python programming,Property based testing for scientific code in Python,https://datascience.blog.wzb.eu/2019/11/08/property-based-testing-for-scientific-code-in-python/
362,Lobsters,python,Python programming,"Test Fast, Fix More - Property based testing with Hypothesis by Alexander Hultnér",https://www.youtube.com/watch?v=MKf6KfdTems
363,Lobsters,python,Python programming,Jupyter kernel for TLA+,https://github.com/kelvich/tlaplus_jupyter
364,Lobsters,python,Python programming,nbdev: use Jupyter Notebooks for everything,https://www.fast.ai/2019/12/02/nbdev/
365,Lobsters,python,Python programming,Reducing Pandas memory usage with lossy compression,https://pythonspeed.com/articles/pandas-reduce-memory-lossy/
366,Lobsters,python,Python programming,EAF: Extending Emacs with GUI Support Using Python PyQt,https://github.com/manateelazycat/emacs-application-framework
367,Lobsters,python,Python programming,A Simple Explanation of the Bag-of-Words Model,https://victorzhou.com/blog/bag-of-words/
368,Lobsters,python,Python programming,Thermal testing Raspberry Pi 4,https://www.raspberrypi.org/blog/thermal-testing-raspberry-pi-4/
369,Lobsters,python,Python programming,Python's package index has a very detailed topic taxonomy,https://pypi.org/search/?q=&o=&c=Topic+%3A%3A+Sociology+%3A%3A+History
370,Lobsters,python,Python programming,Building a language server for Muon,https://nickmqb.github.io/2019/11/24/building-a-language-server-for-muon.html
371,Lobsters,python,Python programming,The Mind at Work: Guido van Rossum on how Python makes thinking in code easier,https://blog.dropbox.com/topics/work-culture/-the-mind-at-work--guido-van-rossum-on-how-python-makes-thinking
372,Lobsters,python,Python programming,Testing Django Migrations,https://sobolevn.me/2019/10/testing-django-migrations
373,Lobsters,python,Python programming,Raise Better Exceptions in Python,https://orbifold.xyz/raising-exceptions.html
374,Lobsters,python,Python programming,How to document Python code with Sphinx,https://opensource.com/article/19/11/document-python-sphinx
375,Lobsters,python,Python programming,"Fast, simple and thread-safe HTML/CSS/Python GUI framework",https://www.plynth.net/
376,Lobsters,python,Python programming,grapheneX automated system hardening,https://github.com/grapheneX/grapheneX
377,Lobsters,python,Python programming,Profiling Django with DTrace and cProfile,https://wiedi.frubar.net/blog/2019/11/18/django-performance/
378,Lobsters,python,Python programming,Reduce Pandas memory usage by loading less data,https://pythonspeed.com/articles/pandas-load-less-data/
379,Lobsters,python,Python programming,Implementing a WebAssembly interpreter from scratch and using it to play a game written in Rust,https://www.youtube.com/watch?v=VUT386_GKI8
380,Lobsters,python,Python programming,"Jupyter on your phone (or anywhere, really)",https://thekhan314.github.io/jupyter_on_your_phone_or_anywhere_really
381,Lobsters,python,Python programming,How to port an awk script to Python,https://opensource.com/article/19/11/awk-to-python
382,Lobsters,python,Python programming,State of Calibre in Debian,https://www.preining.info/blog/2019/10/state-of-calibre-in-debian/
383,Lobsters,python,Python programming,Why is the Migration to Python 3 Taking So Long?,https://stackoverflow.blog/2019/11/14/why-is-the-migration-to-python-3-taking-so-long/
384,Lobsters,python,Python programming,Kore4 and Python,https://blog.kore.io/posts/kore4-and-python
385,Lobsters,python,Python programming,"Ubuntu 20.04 LTS and Debian GNU/Linux 11 ""Bullseye"" Progress on Python 2 Removal",https://news.softpedia.com/news/ubuntu-20-04-lts-and-debian-gnu-linux-11-bullseye-progress-on-python-2-removal-528138.shtml
386,Lobsters,python,Python programming,Reverse Polish Notation [Calculator in Python],http://controlaltbackspace.org/efficiency/rpn/
387,Lobsters,python,Python programming,"My Python Development Environment, 2020 Edition",https://jacobian.org/2019/nov/11/python-environment-2020
388,Lobsters,python,Python programming,Creating a Slack App in Python on GCP,https://lethain.com//creating-slack-app-python/
389,Lobsters,python,Python programming,"""Parsing"" in Python",https://asthasr.github.io/posts/parsing-in-python/
390,Lobsters,python,Python programming,Laziness and Streams - Part 2,https://jjmalina.github.io/posts/laziness-and-streams-pt-2/
391,Lobsters,python,Python programming,"The Complex Path for a Simple Portable Python Interpreter, or Snakes on a Data Plane",https://www.scylladb.com/2019/02/14/the-complex-path-for-a-simple-portable-python-interpreter-or-snakes-on-a-data-plane/
392,Lobsters,python,Python programming,Why I can't remove Python 2 from my systems (yet),https://github.com/sanxiyn/blog/blob/master/posts/2019-11-08.md
393,Lobsters,python,Python programming,How We Spotted and Fixed a Performance Degradation in Our Python Code,https://blog.redash.io/how-we-spotted-and-fixed-a-performance-degradation-in-our-python-code/
394,Lobsters,python,Python programming,Python Developers Survey 2019,https://surveys.jetbrains.com/s3/c16-python-developers-survey-2019
395,Lobsters,python,Python programming,Less known bits of the Python Standard Library,https://medium.com/@vmsp/less-known-bits-of-the-python-standard-library-46dc88490115
396,Lobsters,python,Python programming,Why you should use `python -m pip`,https://snarky.ca/why-you-should-use-python-m-pip/
397,Lobsters,python,Python programming,Python is better typed than you think: error handling with mypy type hints,https://beepb00p.xyz/mypy-error-handling.html
398,Lobsters,python,Python programming,Tales from running Kafka Streams in Production,https://ordepdev.me/posts/tales-from-running-kafka-streams-in-production
399,Lobsters,python,Python programming,"PyPortal Blackjack game: uses sprites, touch, audio – AndyFelong.com",https://andyfelong.com/2019/10/pyportal-blackjack-game-uses-sprites-touch-audio/
400,Lobsters,python,Python programming,ART 4.2 released: ASCII art library for Python,https://github.com/sepandhaghighi/art
401,Lobsters,python,Python programming,"Thank you, Guido",https://blog.dropbox.com/topics/company/thank-you--guido
402,Lobsters,python,Python programming,Building Recursive Descent Parsers: The Definitive Guide,https://www.booleanworld.com/building-recursive-descent-parsers-definitive-guide/
403,Lobsters,python,Python programming,OPEM (Open Source PEM Fuel Cell Simulation Tool),https://github.com/ECSIM/opem
404,Lobsters,python,Python programming,5 reasons why I love Python,https://opensource.com/article/19/10/why-love-python
405,Lobsters,python,Python programming,When to switch to Python 3.8,https://pythonspeed.com/articles/major-python-release/
406,Lobsters,python,Python programming,Faster ZIP Decompression,https://tech.marksblogg.com/faster-zip-decompression-unzip-deflate-zlib-crc32-adler32-7zip-archiver.html
407,Lobsters,python,Python programming,Adding type hints to the Django ORM,https://www.willmcgugan.com/blog/tech/post/adding-type-hints-to-the-django-orm/
408,Lobsters,python,Python programming,Schmelvetica - Absurd fonts for an absurd world,https://readevalprint.com/Schmelvetica.html
409,Lobsters,python,Python programming,Consider memoryview and bytearray for Zero-Copy Interactions with bytes,https://effectivepython.com/2019/10/22/memoryview-bytearray-zero-copy-interactions
410,Lobsters,python,Python programming,Roll your own GUI automation library,http://blog.asrpo.com/python_gui_automation
411,Lobsters,python,Python programming,Reimplementing a Solaris command in Python gained 17x performance improvement from C,https://blogs.oracle.com/solaris/reimplementing-a-solaris-in-python-gained-17x-performance-improvement-from-c
412,Lobsters,python,Python programming,Pylint: Making your Python code consistent,https://opensource.com/article/19/10/python-pylint-introduction
413,Lobsters,python,Python programming,Unoon is a desktop tool to monitor processes with network connections,https://github.com/kushaldas/unoon/
414,Lobsters,python,Python programming,Easy Concurrency in Python,http://pljung.de/posts/easy-concurrency-in-python/
415,Lobsters,python,Python programming,Cool New Features in Python 3.8,https://realpython.com/python38-new-features/
416,Lobsters,python,Python programming,Python at Scale: Strict Modules,https://instagram-engineering.com/python-at-scale-strict-modules-c0bb9245c834
417,Lobsters,python,Python programming,Beyond cProfile: Sampling profilers and logging for performance optimization,https://pythonspeed.com/articles/beyond-cprofile/
418,Lobsters,python,Python programming,"The Python documentation is bad, and you should feel bad (2013)",http://cryto.net/~joepie91/blog/2013/02/19/the-python-documentation-is-bad-and-you-should-feel-bad/
419,Lobsters,python,Python programming,"""A Talk Near the Future of Python"" - live coding a simple VM / web assembly interpreter",https://www.youtube.com/watch?v=r-A78RgMhZU
420,Lobsters,python,Python programming,Complexity Waterfall and Architecture on Demand,https://sobolevn.me/2019/10/complexity-waterfall
421,Lobsters,python,Python programming,Django’s Class-Based Views Were a Mistake (2012),https://lukeplant.me.uk/blog/posts/djangos-cbvs-were-a-mistake/
422,Lobsters,python,Python programming,A Python command-line shell,https://github.com/terrycojones/daudin
423,Lobsters,python,Python programming,Python Attribute Access and the Descriptor Protocol,https://amir.rachum.com/blog/2019/10/16/descriptors/
424,Lobsters,python,Python programming,The Simple Essence of the Y Combinator (Explained in Python),https://lptk.github.io/programming/2019/10/15/simple-essence-y-combinator.html
425,Lobsters,python,Python programming,Divide And Conquer Algorithms In Python,https://skerritt.blog/divide-and-conquer-algorithms/
426,Lobsters,python,Python programming,Researchers find bug in Python script may have affected hundreds of studies,https://arstechnica.com/information-technology/2019/10/chemists-discover-cross-platform-python-scripts-not-so-cross-platform/
427,Lobsters,python,Python programming,Python 3.8.0 is now available,https://pythoninsider.blogspot.com/2019/10/python-380-is-now-available.html
428,Lobsters,python,Python programming,How to use uWSGI Avahi plugin in Ubuntu,https://www.paulox.net/2017/07/21/how-to-use-uwsgi-avahi-plugin-in-ubuntu/
429,Lobsters,python,Python programming,Function Arguments in Julia and Python,https://medium.com/@Jernfrost/function-arguments-in-julia-and-python-9865fb88c697
430,Lobsters,python,Python programming,Django 3.0 beta 1 released,https://www.djangoproject.com/weblog/2019/oct/14/django-30-beta-1-released/
431,Lobsters,python,Python programming,Show: I've built a social news aggregator for the Python community and it took off,https://news.python.sc/
432,Lobsters,python,Python programming,New features planned for Python 4.0,http://charlesleifer.com/blog/new-features-planned-for-python-4-0/
433,Lobsters,python,Python programming,All You Need to Know About Big O Notation [Python Examples],https://skerritt.blog/big-o/
434,Lobsters,python,Python programming,A news aggregator for the Python community written in Python/Django,https://github.com/sebst/pythonic-news
435,Lobsters,python,Python programming,flask-swagger-types: effortless swagger specs for flask apps,https://github.com/plainas/flask-swagger-types
436,Lobsters,python,Python programming,PyPy's new JSON parser,https://morepypy.blogspot.com/2019/10/pypys-new-json-parser.html
437,Lobsters,python,Python programming,How dictionaries are implemented in Python,https://www.data-structures-in-practice.com/hash-tables/
438,Lobsters,python,Python programming,"9 best open-source findings, September 2019",https://dev.to/sobolevn/9-best-open-source-findings-september-2019-9en
439,Lobsters,python,Python programming,Timsort  - the fastest sorting algorithm you’ve never heard of,https://skerritt.blog/timsort-the-fastest-sorting-algorithm-youve-never-heard-of/
440,Lobsters,python,Python programming,Turn Python Scripts into Beautiful ML Tools,https://towardsdatascience.com/coding-ml-tools-like-you-code-ml-models-ddba3357eace
441,Lobsters,python,Python programming,Automatically Reload Modules with %autoreload,https://switowski.com/blog/ipython-autoreload
442,Lobsters,python,Python programming,Python Pandas at Extreme Performance,https://towardsdatascience.com/python-pandas-at-extreme-performance-912912b1047c
443,Lobsters,python,Python programming,Analyzing the Stack Overflow Survey with Python and Pandas,https://opensource.com/article/19/9/stack-overflow-survey-python-pandas
444,Lobsters,python,Python programming,Python Negatypes,https://www.hillelwayne.com/post/negatypes/
445,Lobsters,python,Python programming,An advanced look at Python interfaces using zope.interface,https://opensource.com/article/19/9/zopeinterface-python-package
446,Lobsters,python,Python programming,"Weld: accelerating numpy, scikit and pandas as much as 100x with Rust and LLVM",https://notamonadtutorial.com/weld-accelerating-numpy-scikit-and-pandas-as-much-as-100x-with-rust-and-llvm-12ec1c630a1
447,Lobsters,python,Python programming,Learn Functional Python in 10 Minutes,https://skerritt.blog/learn-functional-python-in-10-minutes/
448,Lobsters,python,Python programming,Dollhouse does Incident response and audit on Google Cloud Platform,https://github.com/gojek/dollhouse
449,Lobsters,python,Python programming,Adding Methods Retroactively,https://orbifold.xyz/singledispatch.html
450,Lobsters,python,Python programming,"How ""Export to Excel"" Almost Killed Our System",https://hakibenita.com/python-django-optimizing-excel-export
451,Lobsters,python,Python programming,The boring tech behind a one-person Internet company,https://broadcast.listennotes.com/the-boring-technology-behind-listen-notes-56697c2e347b
452,Lobsters,python,Python programming,Types for Python HTTP APIs: An Instagram Story,https://instagram-engineering.com/types-for-python-http-apis-an-instagram-story-d3c3a207fdb7
453,Lobsters,python,Python programming,Speeding Up Python with Nim,https://robert-mcdermott.gitlab.io/posts/speeding-up-python-with-nim/
454,Lobsters,python,Python programming,"Collection of awesome Python types, stubs, plugins, and tools to work with them",https://github.com/typeddjango/awesome-python-typing
455,Lobsters,python,Python programming,Connection management tool for google APIs with Python,https://github.com/elmoiv/goco
456,Lobsters,python,Python programming,"Design And Generate A REST API From Swagger / OpenAPI In Java, Python, C# And More",https://simply-how.com/design-and-generate-api-code-from-openapi
457,Lobsters,python,Python programming,Expert python topics you should know,http://dev.libreneitor.com/expert-python-topics-you-should-know/
458,Lobsters,python,Python programming,Setting up buildbot in FreeBSD jails,https://andidog.de/blog/2018-04-22-buildbot-setup-freebsd-jails
459,Lobsters,python,Python programming,A Meta-Grammar for PEG Parsers,https://medium.com/@gvanrossum_83706/a-meta-grammar-for-peg-parsers-3d3d502ea332
460,Lobsters,python,Python programming,"Testing mypy stubs, plugins, and types",https://sobolevn.me/2019/08/testing-mypy-types
461,Lobsters,python,Python programming,Open3D – A Modern Library for 3D Data Processing,http://www.open3d.org/
462,Lobsters,python,Python programming,Sunsetting Python 2,https://www.python.org/doc/sunset-python-2/
463,Lobsters,python,Python programming,Our journey to type checking 4 million lines of Python,http://blogs.dropbox.com/tech/2019/09/our-journey-to-type-checking-4-million-lines-of-python/
464,Lobsters,python,Python programming,Try Sneklang Online,https://sneklang.functup.com
465,Lobsters,python,Python programming,A terminal user interface for Mastodon,https://asciinema.org/a/fTq6pzFOIrPzaIt1ralRM86wE
466,Lobsters,python,Python programming,"9 best open-source findings, August 2019",https://dev.to/sobolevn/9-best-open-source-findings-august-2019-31m8
467,Lobsters,python,Python programming,Google Interview Problems: Ratio Finder,https://medium.com/@alexgolec/google-interview-problems-ratio-finder-d7aa8bf201e3
468,Lobsters,python,Python programming,Interview with Dask’s creator: Scale your Python from one computer to a thousand,https://notamonadtutorial.com/interview-with-dasks-creator-scale-your-python-from-one-computer-to-a-thousand-b4483376f200
469,Lobsters,python,Python programming,Adding actions to a PEG grammar,https://medium.com/@gvanrossum_83706/adding-actions-to-a-peg-grammar-d5e00fa1092f
470,Lobsters,python,Python programming,Epicyon ActivityPub server 1.0 release,https://blog.freedombone.net/epicyon-1-0-release
471,Lobsters,python,Python programming,Building a CLI for Firmware Projects using Invoke,https://interrupt.memfault.com/blog/building-a-cli-for-firmware-projects
472,Lobsters,python,Python programming,Typechecking Django and DRF,https://sobolevn.me/2019/08/typechecking-django-and-drf
473,Lobsters,python,Python programming,"How to serve HTTP 1, 2, & 3 in Python",https://pgjones.dev/blog/http-1-2-3-2019/
474,Lobsters,python,Python programming,Left-recursive PEG grammars,https://medium.com/@gvanrossum_83706/left-recursive-peg-grammars-65dab3c580e1
475,Lobsters,python,Python programming,Using Elastic Search with Python,https://dev.libreneitor.com/using-elastic-search-with-python/
476,Lobsters,python,Python programming,<wbr>CorentinJ/Real-Time-Voice-Clon<wbr>ing - Clone a voice in 5 seconds to generate arbitrary speech in real</wbr></wbr>,https://github.com/CorentinJ/Real-Time-Voice-Cloning
477,Lobsters,python,Python programming,Time to Shed Python 2,https://www.ncsc.gov.uk/blog-post/time-to-shed-python-2
478,Lobsters,python,Python programming,Tensor Considered Harmful,http://nlp.seas.harvard.edu//NamedTensor.html
479,Lobsters,python,Python programming,Refactoring to Multiple Exit Points,https://blog.startifact.com/posts/refactoring-to-multiple-exit-points.html
480,Lobsters,python,Python programming,Managing Messes in Computational Notebooks,https://microsoft.github.io/gather
481,Lobsters,python,Python programming,Volumetric TSDF Fusion of RGB-D Images in Python,https://github.com/andyzeng/tsdf-fusion-python
482,Lobsters,python,Python programming,mini-django - Single file Django project for instant gratification,https://github.com/readevalprint/mini-django
483,Lobsters,python,Python programming,OpenDrop: an Open Source AirDrop Implementation,https://github.com/seemoo-lab/opendrop
484,Lobsters,python,Python programming,riposte v0.4.0 has been released with a bunch of new features,https://github.com/fwkz/riposte/releases/tag/v0.4.0
485,Lobsters,python,Python programming,sneklang - Experimental restricted subset of Python for safe evaluation,https://github.com/readevalprint/sneklang
486,Lobsters,python,Python programming,Static Analysis at Scale: An Instagram Story,https://instagram-engineering.com/static-analysis-at-scale-an-instagram-story-8f498ab71a0c
487,Lobsters,python,Python programming,Not just CPU: writing custom profilers for Python,https://pythonspeed.com/articles/custom-python-profiler/
488,Lobsters,python,Python programming,Austin: Python frame stack sampler for CPython,https://github.com/P403n1x87/austin
489,Lobsters,python,Python programming,Testing Scientific Code - How to Get Away with Bad Code,http://pljung.de/posts/testing-scientific-code/
490,Lobsters,python,Python programming,Interactive Projected Surface using OpenCV Color Detection,https://tsukuru.club/posts/interactive-projected-surface/
491,Lobsters,python,Python programming,Keras for Beginners: Implementing a Convolutional Neural Network,https://victorzhou.com/blog/keras-cnn-tutorial/
492,Lobsters,python,Python programming,What You Need to Know to Manage Users in Django Admin,https://realpython.com/manage-users-in-django-admin/
493,Lobsters,python,Python programming,Scalpl 0.3.0: A lightweight wrapper to operate on nested dictionaries seamlessly,https://github.com/ducdetronquito/scalpl
494,Lobsters,python,Python programming,Remainder operator vs. modulo operator (with JavaScript code),https://2ality.com/2019/08/remainder-vs-modulo.html
495,Lobsters,python,Python programming,Next browser 1.3.0 - the programmable web browser,https://github.com/atlas-engineer/next/
496,Lobsters,python,Python programming,A Python prompt into a running process: debugging with Manhole,https://pythonspeed.com/articles/live-debugging-python/
497,Lobsters,python,Python programming,MicroPython for ESP32 with psRAM support,https://github.com/loboris/MicroPython_ESP32_psRAM_LoBo
498,Lobsters,python,Python programming,Hy: A dialect of Lisp that's embedded in Python,https://github.com/hylang/hy
499,Lobsters,python,Python programming,A Simple Explanation of the Softmax Function,https://victorzhou.com/blog/softmax/
500,Lobsters,python,Python programming,BASIC interpreter implemented in a jupyter notebook,https://github.com/norvig/pytudes/blob/master/ipynb/BASIC.ipynb
501,Lobsters,python,Python programming,Why your mock doesn’t work,https://nedbatchelder.com//blog/201908/why_your_mock_doesnt_work.html
502,Lobsters,python,Python programming,"What does ""x = a + b"" mean?",https://www.curiousefficiency.org/posts/2019/03/what-does-x-equals-a-plus-b-mean.html
503,Lobsters,python,Python programming,The 35 Words You Need to Python,https://yawpitchroll.com/posts/the-35-words-you-need-to-python/
504,Lobsters,python,Python programming,Improve your tests in Django with fakes and factories (2017),https://hacksoft.blog/improve-your-tests-django-fakes-and-factories/
505,Lobsters,python,Python programming,Neural Networks From Scratch,https://victorzhou.com/series/neural-networks-from-scratch/
506,Lobsters,python,Python programming,Python vs Rust for Neural Networks,https://ngoldbaum.github.io/posts/python-vs-rust-nn/
507,Lobsters,python,Python programming,riposte v0.3.0 released,https://github.com/fwkz/riposte/releases/tag/v0.3.0
508,Lobsters,python,Python programming,"How to Make a Smart Baby Monitor with Python, Raspberry Pi, Twilio SMS, and Peripheral Sensors",https://www.twilio.com/blog/smart-baby-monitor-python-raspberry-pi-twilio-sms-peripheral-sensors
509,Lobsters,python,Python programming,Implementing an RNN from scratch (numpy only) in Python,https://victorzhou.com/blog/intro-to-rnns/
510,Lobsters,python,Python programming,Pyrasite: tools for injecting code into running Python processes,http://pyrasite.com/
511,Lobsters,python,Python programming,Supercharge GDB with Python PyPi Packages,https://interrupt.memfault.com/blog/using-pypi-packages-with-GDB
512,Lobsters,python,Python programming,Building a Better Profanity Detection Library with scikit-learn,https://towardsdatascience.com/building-a-better-profanity-detection-library-with-scikit-learn-3638b2f2c4c2
513,Lobsters,python,Python programming,Practical production python scripts,https://www.madmode.com/2019/python-eng.html
514,Lobsters,python,Python programming,PEG Parsers,https://medium.com/@gvanrossum_83706/peg-parsers-7ed72462f97c
515,Lobsters,python,Python programming,Sustainable Python scripts,https://vincent.bernat.ch/en/blog/2019-sustainable-python-script
516,Lobsters,python,Python programming,What's coming in Python 3.8,https://lwn.net/SubscriberLink/793818/0c6f9dd271021cd4/
517,Lobsters,python,Python programming,Deep Representation Learning with Genetic Programming (2018),https://ccc.inaoep.mx/archivos/CCC-17-009.pdf
518,Lobsters,python,Python programming,Chu construction on linear logic,http://boxbase.org/entries/2019/jul/15/chu-construction/
519,Lobsters,python,Python programming,Interfaces are forever,https://orbifold.xyz/interfaces-are-forever.html
520,Lobsters,python,Python programming,Fastest Way to Load Data Into PostgreSQL Using Python,https://hakibenita.com/fast-load-data-python-postgresql
521,Lobsters,python,Python programming,Racket is an acceptable Python,https://dustycloud.org/blog/racket-is-an-acceptable-python/
522,Lobsters,python,Python programming,A deep dive on Python type hints,https://veekaybee.github.io/2019/07/08/python-type-hints/
523,Lobsters,python,Python programming,Manage different Python versions on MacOS with pyenv,https://axcoto.com/notes/manage-python-versions-on-macosx/
524,Lobsters,python,Python programming,Spiking Neural Network (SNN) with PyTorch: towards bridging the gap between deep learning and the human brain,https://guillaume-chevalier.com/spiking-neural-network-snn-with-pytorch-where-backpropagation-engenders-stdp-hebbian-learning/
525,Lobsters,python,Python programming,Automate Debugging with GDB Python API,https://interrupt.memfault.com/blog/automate-debugging-with-gdb-python-api
526,Lobsters,python,Python programming,Imports in Nim,https://narimiran.github.io/2019/07/01/nim-import.html
527,Lobsters,python,Python programming,"One Program Written in Python, Go, and Rust",http://nicolas-hahn.com/python/go/rust/programming/2019/07/01/program-in-python-go-rust/
528,Lobsters,python,Python programming,Wrap your application inside a tailored interactive shell,https://github.com/fwkz/riposte
529,Lobsters,python,Python programming,The Bayes Way,https://bayesway.com/
530,Lobsters,python,Python programming,A Visual Intro to NumPy and Data Representation,https://jalammar.github.io/visual-numpy/
