ID,Source,Tag_Code,Tag_Name,Title,Url
1,Lobsters,python,Python programming,Introducing Versioned HDF5,https://labs.quansight.org/blog/2020/08/introducing-versioned-hdf5/
2,Lobsters,python,Python programming,"Debian Janitor: > 60,000 Lintian Tags Automatically Fixed",https://www.jelmer.uk/janitor-update-3.html
3,Lobsters,python,Python programming,Postgres advisory locks for Python developers,https://leontrolski.github.io/postgres-advisory-locks.html
4,Lobsters,python,Python programming,Why proactively clean Python 2 up?,https://blogs.gentoo.org/mgorny/2020/08/02/why-proactively-clean-python-2-up/
5,Lobsters,python,Python programming,Login regression for users with non-ASCII names,https://blog.launchpad.net/general/login-regression-for-users-with-non-ascii-names
6,Lobsters,python,Python programming,A deep dive into the official Docker image for Python,https://pythonspeed.com/articles/official-python-docker-image/
7,Lobsters,python,Python programming,NumPy another Iverson Ghost (2018),https://analyzethedatanotthedrivel.org/2018/03/31/numpy-another-iverson-ghost/
8,Lobsters,python,Python programming,Announcing the Consortium for Python Data API Standards,https://data-apis.org/blog/announcing_the_consortium/
9,Lobsters,python,Python programming,TruffleSqueak: Polyglot Programming with Squeak/Smalltalk and GraalVM,https://github.com/hpi-swa/trufflesqueak
10,Lobsters,python,Python programming,Python 3.8 Makes me Sad Again,https://ilya-sher.org/2020/08/16/python-3-8-makes-me-sad-again/
11,Lobsters,python,Python programming,The Python Data model,https://docs.python.org/3/reference/datamodel.html
12,Lobsters,python,Python programming,"""Structural pattern matching"" for Python, part 1",https://lwn.net/Articles/827179/
13,Lobsters,python,Python programming,Announcing the new Jupyter Book,https://blog.jupyter.org/announcing-the-new-jupyter-book-cbf7aa8bc72e
14,Lobsters,python,Python programming,Developing Python with Poetry & Poetry2nix: Reproducible flexible Python environments,https://www.tweag.io/blog/2020-08-12-poetry2nix/
15,Lobsters,python,Python programming,Pysa: Open Source static analysis for Python code,https://engineering.fb.com/security/pysa/
16,Lobsters,python,Python programming,Django Views — The Right Way,https://spookylukey.github.io/django-views-the-right-way/
17,Lobsters,python,Python programming,"Options for packaging your Python code: Wheels, Conda, Docker, and more",https://pythonspeed.com/articles/distributing-software/
18,Lobsters,python,Python programming,Mypyc - Mypy to Python C Extension Compiler,https://github.com/python/mypy/tree/master/mypyc
19,Lobsters,python,Python programming,Privacy Focused Analytics From Scratch,https://healeycodes.com/privacy-focused-analytics-from-scratch/
20,Lobsters,python,Python programming,TensorFlow Datasets: The Bad Parts,https://determined.ai/blog/tf-dataset-the-bad-parts/
21,Lobsters,python,Python programming,Plants and Soil Sensors,https://battlepenguin.com/tech/plants-and-soil-sensors
22,Lobsters,python,Python programming,Surviving Django (if you care about databases),https://www.varrazzo.com/blog/2020/07/25/surviving-django/
23,Lobsters,python,Python programming,Debugging Python server memory leaks with the Fil profiler,https://pythonspeed.com/articles/python-server-memory-leaks/
24,Lobsters,python,Python programming,Testing a Twilio Interactive Voice Response (IVR) System With Python and pytest,https://www.twilio.com/blog/testing-twilio-ivr-system-python-pytest
25,Lobsters,python,Python programming,Hacking with Environment Variables,https://www.elttam.com/blog/env/
26,Lobsters,python,Python programming,Introducing Versioned HDF5,https://labs.quansight.org/blog/2020/08/introducing-versioned-hdf5/
27,Lobsters,python,Python programming,"Debian Janitor: > 60,000 Lintian Tags Automatically Fixed",https://www.jelmer.uk/janitor-update-3.html
28,Lobsters,python,Python programming,Postgres advisory locks for Python developers,https://leontrolski.github.io/postgres-advisory-locks.html
29,Lobsters,python,Python programming,Why proactively clean Python 2 up?,https://blogs.gentoo.org/mgorny/2020/08/02/why-proactively-clean-python-2-up/
30,Lobsters,python,Python programming,Login regression for users with non-ASCII names,https://blog.launchpad.net/general/login-regression-for-users-with-non-ascii-names
31,Lobsters,python,Python programming,A deep dive into the official Docker image for Python,https://pythonspeed.com/articles/official-python-docker-image/
32,Lobsters,python,Python programming,NumPy another Iverson Ghost (2018),https://analyzethedatanotthedrivel.org/2018/03/31/numpy-another-iverson-ghost/
33,Lobsters,python,Python programming,Announcing the Consortium for Python Data API Standards,https://data-apis.org/blog/announcing_the_consortium/
34,Lobsters,python,Python programming,TruffleSqueak: Polyglot Programming with Squeak/Smalltalk and GraalVM,https://github.com/hpi-swa/trufflesqueak
35,Lobsters,python,Python programming,Python 3.8 Makes me Sad Again,https://ilya-sher.org/2020/08/16/python-3-8-makes-me-sad-again/
36,Lobsters,python,Python programming,The Python Data model,https://docs.python.org/3/reference/datamodel.html
37,Lobsters,python,Python programming,"""Structural pattern matching"" for Python, part 1",https://lwn.net/Articles/827179/
38,Lobsters,python,Python programming,Announcing the new Jupyter Book,https://blog.jupyter.org/announcing-the-new-jupyter-book-cbf7aa8bc72e
39,Lobsters,python,Python programming,Developing Python with Poetry & Poetry2nix: Reproducible flexible Python environments,https://www.tweag.io/blog/2020-08-12-poetry2nix/
40,Lobsters,python,Python programming,Pysa: Open Source static analysis for Python code,https://engineering.fb.com/security/pysa/
41,Lobsters,python,Python programming,Django Views — The Right Way,https://spookylukey.github.io/django-views-the-right-way/
42,Lobsters,python,Python programming,"Options for packaging your Python code: Wheels, Conda, Docker, and more",https://pythonspeed.com/articles/distributing-software/
43,Lobsters,python,Python programming,Mypyc - Mypy to Python C Extension Compiler,https://github.com/python/mypy/tree/master/mypyc
44,Lobsters,python,Python programming,Privacy Focused Analytics From Scratch,https://healeycodes.com/privacy-focused-analytics-from-scratch/
45,Lobsters,python,Python programming,TensorFlow Datasets: The Bad Parts,https://determined.ai/blog/tf-dataset-the-bad-parts/
46,Lobsters,python,Python programming,Plants and Soil Sensors,https://battlepenguin.com/tech/plants-and-soil-sensors
47,Lobsters,python,Python programming,Surviving Django (if you care about databases),https://www.varrazzo.com/blog/2020/07/25/surviving-django/
48,Lobsters,python,Python programming,Debugging Python server memory leaks with the Fil profiler,https://pythonspeed.com/articles/python-server-memory-leaks/
49,Lobsters,python,Python programming,Testing a Twilio Interactive Voice Response (IVR) System With Python and pytest,https://www.twilio.com/blog/testing-twilio-ivr-system-python-pytest
50,Lobsters,python,Python programming,Hacking with Environment Variables,https://www.elttam.com/blog/env/
51,Lobsters,python,Python programming,"termpdf.py - A graphical pdf (and epub and cbz) viewer, written in python, that works inside kitty",https://github.com/dsanson/termpdf.py
52,Lobsters,python,Python programming,Django 3.1 Released,https://www.djangoproject.com/weblog/2020/aug/04/django-31-released/
53,Lobsters,python,Python programming,Keras for Beginners: Implementing a RNN,https://victorzhou.com/blog/keras-rnn-tutorial/
54,Lobsters,python,Python programming,Multi Class Text Classification With Deep Learning Using BERT,https://towardsdatascience.com/multi-class-text-classification-with-deep-learning-using-bert-b59ca2f5c613
55,Lobsters,python,Python programming,Writing and publishing a Python module in Rust,https://blog.yossarian.net/2020/08/02/Writing-and-publishing-a-python-module-in-rust
56,Lobsters,python,Python programming,Exactly-Once Initialization in Asynchronous Python,https://nullprogram.com/blog/2020/07/30/
57,Lobsters,python,Python programming,"Upgrade to pip 20.2, plus, changes coming in 20.3",https://blog.python.org/2020/07/upgrade-pip-20-2-changes-20-3.html
58,Lobsters,python,Python programming,XSS Exploitation in Django Applications,https://tonybaloney.github.io/posts/xss-exploitation-in-django.html
59,Lobsters,python,Python programming,oso: an open source policy engine for authorization,https://www.osohq.com
60,Lobsters,python,Python programming,Notebooks are getting revamped,https://devblogs.microsoft.com/python/notebooks-are-getting-revamped/
61,Lobsters,python,Python programming,Speaking online at EuroPython 2020,https://www.paulox.net/2020/07/24/speaking-online-at-europython-2020/
62,Lobsters,python,Python programming,dnjs - subset of JavaScript for isomorphic html templating and configuration,https://github.com/leontrolski/dnjs
63,Lobsters,python,Python programming,Better code decoupling via delegates,https://heylucas.net/2020/07/27/better-code-decoupling-via-delegates/
64,Lobsters,python,Python programming,reNgine - Automated penetration testing reconnaissance framework,https://github.com/yogeshojha/rengine
65,Lobsters,python,Python programming,An introduction to mutation testing in Python,https://opensource.com/article/20/7/mutmut-python
66,Lobsters,python,Python programming,"Jupyter notebooks from ""Python for Probability, Statistics, and Machine Learning"" book",https://github.com/unpingco/Python-for-Probability-Statistics-and-Machine-Learning-2E
67,Lobsters,python,Python programming,Build and deploy a python package to the PyPI (Python Package Index),https://initialcommit.com/blog/Deploy-Python-Package-PyPI
68,Lobsters,python,Python programming,Transform Jupyter Notebook to an Ebook,https://towardsdatascience.com/transform-jupyter-notebook-to-an-ebook-ef3a9d32ac4f
69,Lobsters,python,Python programming,alsanna - A Command Line TLS-intercepting Proxy,https://github.com/dulaku/alsanna
70,Lobsters,python,Python programming,Why doesn’t Python have a main function?,https://towardsdatascience.com/why-doesnt-python-have-a-main-function-3afe6a8d093
71,Lobsters,python,Python programming,Why you shouldn’t remove your package from PyPI,https://blog.ovalerio.net/archives/1971
72,Lobsters,python,Python programming,Microcentury,https://susam.in/blog/microcentury/
73,Lobsters,python,Python programming,A tool to automatically generate pseudo-code from source code,https://github.com/delihiros/pseudogen
74,Lobsters,python,Python programming,The Most Remarkable Legacy System I Have Seen,https://thehftguy.com/2020/07/09/the-most-remarkable-legacy-system-i-have-seen/
75,Lobsters,python,Python programming,Decoding a JPEG Image using Python,https://yasoob.me/posts/understanding-and-writing-jpeg-decoder-in-python/
76,Lobsters,python,Python programming,The (non-)return of the Python print statement,https://lwn.net/Articles/823292/
77,Lobsters,python,Python programming,Too many objects: Reducing memory overhead from Python instances,https://pythonspeed.com/articles/python-object-memory/
78,Lobsters,python,Python programming,Hashing it Out,https://akshayr.me/blog/articles/python-dictionaries
79,Lobsters,python,Python programming,A Practical Introduction to Graphs (Network Diagrams),https://healeycodes.com/practical-intro-to-graphs/
80,Lobsters,python,Python programming,Django Testing Toolbox,https://www.mattlayman.com/blog/2020/django-testing-toolbox/
81,Lobsters,python,Python programming,Adding two factor authentication to Django admin,https://www.timo-zimmermann.de/2020/06/adding-two-factor-authentication-to-django-admin/
82,Lobsters,python,Python programming,Python 101 - Debugging Your Code with pdb,https://www.blog.pythonlibrary.org/2020/07/07/python-101-debugging-your-code-with-pdb/
83,Lobsters,python,Python programming,Zen Guardian,https://glyph.twistedmatrix.com/2020/07/zen-guardian.html
84,Lobsters,python,Python programming,Ibis: an idiomatic flavor of SQL for Python programmers,https://labs.quansight.org/blog/2020/06/ibis-an-idiomatic-flavor-of-sql-for-python-programmers/
85,Lobsters,python,Python programming,Import Python modules from GitHub,https://gist.github.com/MineRobber9000/998fe8c5a183fa2649f937c9d2e0b8b0
86,Lobsters,python,Python programming,"How to Write a Makefile - Automating Python Setup, Compilation, and Testing",https://stackabuse.com/how-to-write-a-makefile-automating-python-setup-compilation-and-testing/
87,Lobsters,python,Python programming,Python Insider: Python 3.9.0b4 is now ready for testing,https://pythoninsider.blogspot.com/2020/07/python-390b4-is-now-ready-for-testing.html
88,Lobsters,python,Python programming,How to reduce your tests and the origin story of Hypothesis,/s/8sv92g/how_reduce_your_tests_origin_story
89,Lobsters,python,Python programming,Massive memory overhead: Numbers in Python and how NumPy helps,https://pythonspeed.com/articles/python-integers-memory/
90,Lobsters,python,Python programming,Ten Essays on Fizz Buzz,https://leanpub.com/fizzbuzz
91,Lobsters,python,Python programming,Texthero – Python module to quickly analyze text datasets,https://github.com/jbesomi/texthero
92,Lobsters,python,Python programming,Guietta — Python module to create simple GUIs,https://github.com/alfiopuglisi/guietta
93,Lobsters,python,Python programming,Pygooglenews – Python library for advanced Google News data mining,https://github.com/kotartemiy/pygooglenews
94,Lobsters,python,Python programming,"Pylance: Fast, feature-rich language support for Python in Visual Studio Code",https://devblogs.microsoft.com/python/announcing-pylance-fast-feature-rich-language-support-for-python-in-visual-studio-code/
95,Lobsters,python,Python programming,Learn Python regular expressions with hundreds of examples and exercises,https://github.com/learnbyexample/py_regular_expressions
96,Lobsters,python,Python programming,Where’s your code? Debugging ImportErrors in your Docker image,https://pythonspeed.com/articles/importerror-docker/
97,Lobsters,python,Python programming,Python pattern matching: Guards and or-patterns might not interact in the way you expect,https://ncik-roberts.github.io/posts/pep622.html
98,Lobsters,python,Python programming,Data Processing with Dask,https://www.pluralsight.com/tech-blog/data-processing-with-dask/
99,Lobsters,python,Python programming,Magnum Engine,https://magnum.graphics/
100,Lobsters,python,Python programming,PEP 622 -- Structural Pattern Matching,https://www.python.org/dev/peps/pep-0622/
101,Lobsters,python,Python programming,What is the core of the Python programming language?,https://snarky.ca/what-is-the-core-of-the-python-programming-language/
102,Lobsters,python,Python programming,PEP 620: Hide implementation details from the C API,https://www.python.org/dev/peps/pep-0620/
103,Lobsters,python,Python programming,The PVM - Python Virtual Machine,https://www.ics.uci.edu/~brgallar/week9_3.html#virtual
104,Lobsters,python,Python programming,Clinging to memory: how Python function calls can increase your memory usage,https://pythonspeed.com/articles/function-calls-prevent-garbage-collection/
105,Lobsters,python,Python programming,Picking a Language for Introductory CS - Why I don't like Python,http://dynamicsofprogramming.blogspot.com/2019/02/problems-with-python-for-introductory-cs.html
106,Lobsters,python,Python programming,QGIS 3.14 π released with support for vector tiles,https://www.maptiler.com/news/2020/06/vector-tiles-in-qgis-3-14/
107,Lobsters,python,Python programming,Plugin Architecture in Python (aka Py3EE),https://www.dsouzaman.net/python_plugin_architecture.html
108,Lobsters,python,Python programming,Create your own i3/sway status bar with some bash and python,https://en.jeffprod.com/blog/2020/create-your-own-i3-sway-status-bar/
109,Lobsters,python,Python programming,Development with Nix: Python,https://thomazleite.com/posts/development-with-nix-python/
110,Lobsters,python,Python programming,Runnable code for solving Project Euler problems,https://github.com/nayuki/Project-Euler-solutions
111,Lobsters,python,Python programming,Games with PPB: Jumping Panda edition,https://www.youtube.com/watch?v=jfFQPWWrbpQ
112,Lobsters,python,Python programming,Vim as Python IDE,https://www.tekovic.com/blog/vim-as-python-ide/
113,Lobsters,python,Python programming,Writing tests for external API calls,https://www.cosmicpython.com/blog/2020-01-25-testing_external_api_calls.html
114,Lobsters,python,Python programming,Property Testing with Complex Inputs,https://www.hillelwayne.com/post/property-testing-complex-inputs/
115,Lobsters,python,Python programming,What's New in Salt 3001 Sodium,https://salt.tips/whats-new-in-salt-sodium/
116,Lobsters,python,Python programming,Generating cooking recipes using TensorFlow and LSTM Recurrent Neural Network: A step-by-step guide,https://github.com/trekhleb/machine-learning-experiments/blob/master/assets/recipes_generation.en.md
117,Lobsters,python,Python programming,Advanced pytest techniques I learned while contributing to pandas,https://levelup.gitconnected.com/advanced-pytest-techniques-i-learned-while-contributing-to-pandas-7ba1465b65eb
118,Lobsters,python,Python programming,Practical Python Programming by David Beazley released under Creative Commons,https://github.com/dabeaz-course/practical-python
119,Lobsters,python,Python programming,Conditionally Logging Expensive Tasks,https://orbifold.xyz/logging-expensive.html
120,Lobsters,python,Python programming,Debugging out-of-memory crashes in Python,https://pythonspeed.com/articles/crash-out-of-memory/
121,Lobsters,python,Python programming,A Python object-oriented database with JSONB-based access and search in PostgreSQL,https://github.com/newtdb/db
122,Lobsters,python,Python programming,How a File Format Led to a Crossword Scandal,https://www.youtube.com/watch?v=9aHfK8EUIzg
123,Lobsters,python,Python programming,Async Python is not faster,http://calpaterson.com/async-python-is-not-faster.html
124,Lobsters,python,Python programming,Never forget your password with this Python encryption algorithm,https://opensource.com/article/20/6/python-passwords
125,Lobsters,python,Python programming,Getting machine learning to production,http://veekaybee.github.io/2020/06/09/ml-in-prod/
126,Lobsters,python,Python programming,How async should have been in Python,https://sobolevn.me/2020/06/how-async-should-have-been
127,Lobsters,python,Python programming,icl: An interactive cheat sheet for your UNIX terminal,https://github.com/plainas/icl
128,Lobsters,python,Python programming,Make python-style classes from not much javascript,https://leontrolski.github.io/poor-mans-object.html
129,Lobsters,python,Python programming,Sublime SVG Preview - Sublime Text plugin to preview SVG files,https://packagecontrol.io/packages/SVG%20Preview
130,Lobsters,python,Python programming,Python+FontForge+Org: I made a font based on my handwriting,https://sachachua.com/blog/2020/06/pythonfontforgeorg-i-made-a-font-based-on-my-handwriting/
131,Lobsters,python,Python programming,Why you should try pyinfra,https://pointlessramblings.com/posts/Why_You_Should_Try_pyinfra/
132,Lobsters,python,Python programming,Tools to Help Automate Your Workflows,https://vsupalov.com/automation-tools/
133,Lobsters,python,Python programming,rofimoji - pop up emoji/unicode picker based on rofi,https://github.com/fdw/rofimoji
134,Lobsters,python,Python programming,Airshare - Transfer files over WiFi back and forth all devices from your terminal,https://github.com/kurolabs/airshare
135,Lobsters,python,Python programming,OpenDoor Python Monorepo,https://medium.com/opendoor-labs/our-python-monorepo-d34028f2b6fa
136,Lobsters,python,Python programming,Snakeware: a free Linux distro with a fully Python userspace,https://github.com/joshiemoore/snakeware
137,Lobsters,python,Python programming,Ultimate Guide to Python Debugging,https://towardsdatascience.com/ultimate-guide-to-python-debugging-854dea731e1b
138,Lobsters,python,Python programming,Practical Dependency Injection in Python,https://hakibenita.com/python-dependency-injection
139,Lobsters,python,Python programming,Commented walkthrough of a Ninja build system implementation,https://github.com/gkbrk/scripts/blob/master/ninja.py
140,Lobsters,python,Python programming,How to gradually start adding type hints to a python project,https://hernandigiorgi.com/how-to-gradually-start-adding-type-hints-to-a-python-project/
141,Lobsters,python,Python programming,The many ways to pass code to Python from the terminal,https://snarky.ca/the-many-ways-to-pass-code-to-python-from-the-terminal/
142,Lobsters,python,Python programming,CPU-intensive Ruby/Python code runs slower on default-configured Docker,http://mamememo.blogspot.com/2020/05/cpu-intensive-rubypython-code-runs.html
143,Lobsters,python,Python programming,Hypermodern Python,https://cjolowicz.github.io/posts/hypermodern-python-01-setup/
144,Lobsters,python,Python programming,The PEPs of Python 3.9,https://lwn.net/Articles/819853/
145,Lobsters,python,Python programming,Keyword-only arguments in Python,https://lukeplant.me.uk/blog/posts/keyword-only-arguments-in-python/
146,Lobsters,python,Python programming,Latency in Asynchronous Python,https://nullprogram.com/blog/2020/05/24/
147,Lobsters,python,Python programming,Waiting in asyncio,https://hynek.me/articles/waiting-in-asyncio/
148,Lobsters,python,Python programming,OpenAI Model Generates Python Code,https://www.youtube.com/watch?v=fZSFNUT6iY8
149,Lobsters,python,Python programming,Fil: a new Python memory profiler for data scientists and scientists,https://pythonspeed.com/articles/memory-profiler-data-scientists/
150,Lobsters,python,Python programming,How I work on Python 2 and Python 3 with the Python Language Server (in GNU Emacs),https://utcc.utoronto.ca/~cks/space/blog/python/Python2And3LanguageServer
151,Lobsters,python,Python programming,Security scanners for Python and Docker: from code to dependencies,https://pythonspeed.com/articles/docker-python-security-scan/
152,Lobsters,python,Python programming,Automating Every Aspect of Your Python Project,https://martinheinz.dev/blog/17
153,Lobsters,python,Python programming,Teach kids Python by building an interactive game,https://opensource.com/article/20/5/python-games
154,Lobsters,python,Python programming,Python parentheses primer (2018),https://lerner.co.il/2018/06/08/python-parentheses-primer/
155,Lobsters,python,Python programming,Test coverage only matters if it's at 100%,https://www.dein.fr/2019-09-06-test-coverage-only-matters-if-at-100-percent.html
156,Lobsters,python,Python programming,Sampling profiler for Python programs,https://github.com/benfred/py-spy
157,Lobsters,python,Python programming,My Big Fat Alpine Crash,https://www.rookout.com/blog/my-big-fat-alpine-crash
158,Lobsters,python,Python programming,Speed improvements using hash tables,https://blog.asrpo.com/hashtables
159,Lobsters,python,Python programming,Making Python Programs Blazingly Fast,https://martinheinz.dev/blog/13
160,Lobsters,python,Python programming,Parameterize Python Tests,https://kracekumar.com/post/618264170735009792/parameterize-python-tests
161,Lobsters,python,Python programming,macropy: syntactic macros for Python,https://macropy3.readthedocs.io/en/latest/
162,Lobsters,python,Python programming,A Matrix-Telegram hybrid puppeting/relaybot bridge,https://github.com/tulir/mautrix-telegram
163,Lobsters,python,Python programming,Implementing gRPC server using Python,https://towardsdatascience.com/implementing-grpc-server-using-python-9dc42e8daea0
164,Lobsters,python,Python programming,Subinterpreters for Python,https://lwn.net/SubscriberLink/820424/172e6da006687167/
165,Lobsters,python,Python programming,The elements of Python style,https://github.com/amontalenti/elements-of-python-style
166,Lobsters,python,Python programming,Mozilla research shows some machine voices score higher than humans,https://blog.mozilla.org/blog/2020/05/07/mozilla-research-shows-some-machine-voices-score-higher-than-humans/
167,Lobsters,python,Python programming,Finding secrets by decompiling Python bytecode in public repositories,https://blog.jse.li/posts/pyc/
168,Lobsters,python,Python programming,Using Rust to Power Python Importing With oxidized_importer,https://gregoryszorc.com/blog/2020/05/10/using-rust-to-power-python-importing-with-oxidized_importer/
169,Lobsters,python,Python programming,Why Java? Tales from a Python Convert (2015),https://sookocheff.com/post/java/why-java/
170,Lobsters,python,Python programming,Remapping Python Opcodes,https://medium.com/tenable-techblog/remapping-python-opcodes-67d79586bfd5
171,Lobsters,python,Python programming,Variations on the Death of Python 2,https://www.b-list.org/weblog/2020/may/05/python/
172,Lobsters,python,Python programming,Ultimate Setup for Your Next Python Project,https://towardsdatascience.com/ultimate-setup-for-your-next-python-project-179bda8a7c2c
173,Lobsters,python,Python programming,Interactive Machine Learning Experiments,https://github.com/trekhleb/machine-learning-experiments
174,Lobsters,python,Python programming,"A Fast, Extensible Progress Bar for Python and CLI",https://github.com/tqdm/tqdm
175,Lobsters,python,Python programming,Python Multiple Inheritance,https://blog.vtemian.com/post/multiple-inheritance/
176,Lobsters,python,Python programming,The afterlife of Python 2,https://utcc.utoronto.ca/~cks/space/blog/python/Python2Afterlife
177,Lobsters,python,Python programming,Python pydantic Introduction – Give your data classes super powers,https://www.youtube.com/watch?v=WJmqgJn9TXg
178,Lobsters,python,Python programming,A wild PyBoy appears: a GameBoy emulator written in Python,https://notamonadtutorial.com/a-wild-pyboy-appears-a-gameboy-emulator-written-in-python-22666762232f
