ID,Source,Tag_Code,Tag_Name,Title,Url
883,Lobsters,python,Python programming,Optimizing a Python application with C++ code,https://antlarr.io/2018/07/optimizing-a-python-application-with-c-code/
884,Lobsters,python,Python programming,First stable release of Mitogen and Mitogen for Ansible,https://sweetness.hmmz.org/2018-07-10-mitogen-released.html
885,Lobsters,python,Python programming,The Federalist Papers: Author Identification Through K-Means Clustering,https://blog.jonlu.ca/posts/the-federalist-papers-author-identification-through-k-means-clustering
886,Lobsters,python,Python programming,"Making a low level (Linux) debugger, part 3: our first program",https://blog.asrpo.com/making_a_low_level_debugger_part_3
887,Lobsters,python,Python programming,Mayan EDMS “Tempest” version 3.0,https://medium.com/@siloraptor/mayan-edms-tempest-version-3-0-49b20850cc89
888,Lobsters,python,Python programming,PEP 572: Assignment Expressions,https://www.python.org/dev/peps/pep-0572/
889,Lobsters,python,Python programming,Hacking in Android headset button support for Windows,http://www.roligheten.no/blog/programming/2018/07/02/media-controls-windows.html
890,Lobsters,python,Python programming,pdftabextract - A set of tools for data mining (OCR-processed) PDFs,https://github.com/WZBSocialScienceCenter/pdftabextract
891,Lobsters,python,Python programming,explain the way things are · smealum/pyOpenSSL@4cc06a7,https://github.com/smealum/pyOpenSSL/commit/4cc06a7ab794aa55f4a55a5757adebadd9151fc3
892,Lobsters,python,Python programming,Recreating Python's Slice Syntax in JavaScript Using ES6 Proxies,https://intoli.com/blog/python-slicing-in-javascript/
893,Lobsters,python,Python programming,Python 3.7.0 Release Notes,https://www.python.org/downloads/release/python-370/
894,Lobsters,python,Python programming,Python 3 at Facebook,https://lwn.net/SubscriberLink/758159/f1f631e1535ab9d6/
895,Lobsters,python,Python programming,Test-Driven Web Development with Python,https://www.obeythetestinggoat.com/pages/book.html#toc
896,Lobsters,python,Python programming,Numpys indexing and slicing notation explained,https://medium.com/@buch.willi/numpys-indexing-and-slicing-notation-explained-visually-67dc981c22c1
897,Lobsters,python,Python programming,"molten, a modern API framework for Python",https://moltenframework.com
898,Lobsters,python,Python programming,Making a low level (Linux) debugger part 2: C,https://blog.asrpo.com/making_a_low_level_debugger_part_2
899,Lobsters,python,Python programming,Python Idioms: Multiline Strings,https://amir.rachum.com/blog/2018/06/23/python-multiline-idioms/
900,Lobsters,python,Python programming,The state of type hints in Python,https://www.bernat.tech/the-state-of-type-hints-in-python/
901,Lobsters,python,Python programming,Fetching ActivityPub Feeds,https://gkbrk.com/2018/06/fetching-activitypub-feeds/
902,Lobsters,python,Python programming,Classes Without Classes,https://veriny.tf/classes-without-classes/
903,Lobsters,python,Python programming,extratools: 145+ extra higher-level functional tools,https://github.com/chuanconggao/extratools/
904,Lobsters,python,Python programming,Making a low level (Linux) debugger,https://blog.asrpo.com/making_a_low_level_debugger
905,Lobsters,python,Python programming,Introduction to fountain codes: LT Codes with Python,https://franpapers.com/en/algorithmic/2018-introduction-to-fountain-codes-lt-codes-with-python/
906,Lobsters,python,Python programming,Program to generate regexes that match numbers divisible by N,https://github.com/tchajed/div-regex
907,Lobsters,python,Python programming,Beyond Unit Tests,https://www.hillelwayne.com/talks/beyond-unit-tests/
908,Lobsters,python,Python programming,"unyt: Handle, manipulate, and convert data with units in Python",https://github.com/yt-project/unyt
909,Lobsters,python,Python programming,Understanding how to implement a character-based RNN language model,https://eli.thegreenplace.net/2018/understanding-how-to-implement-a-character-based-rnn-language-model/
910,Lobsters,python,Python programming,I don't need types,https://dmerej.info/blog/post/trying-mypy/
911,Lobsters,python,Python programming,Black: An uncompromising Python code formatter,https://github.com/ambv/black
912,Lobsters,python,Python programming,Streaming with Wallaroo: Fast Algorithmic Trading Checks,https://blog.wallaroolabs.com/2018/05/streaming-with-wallaroo-fast-algorithmic-trading-checks/
913,Lobsters,python,Python programming,Walking the Windows Kernel with IDA Python,https://www.thezdi.com/blog/2018/5/21/mindshare-walking-the-windows-kernel-with-ida-python
914,Lobsters,python,Python programming,"SmoothLife: Generalization of Conway's ""Game of Life"" to a continuous domain",https://github.com/duckythescientist/SmoothLife
915,Lobsters,python,Python programming,A Letter to /r/python,http://journal.kennethreitz.org/entry/r-python
916,Lobsters,python,Python programming,Using Flatpak with Python,https://www.loganasherjones.com/2018/05/using-flatpak-with-python/
917,Lobsters,python,Python programming,Exploring The GitHub Archive,https://blog.wallaroolabs.com/2018/05/exploring-the-github-archive/
918,Lobsters,python,Python programming,LARNN: Linear Attention Recurrent Neural Network,https://github.com/guillaume-chevalier/Linear-Attention-Recurrent-Neural-Network
919,Lobsters,python,Python programming,Scraping DeviantArt,https://mlvnt.com/blog/tech/2018/05/scraping-deviantart/
920,Lobsters,python,Python programming,PyCon Charlas,https://us.pycon.org/2018/hatchery/charlas/
921,Lobsters,python,Python programming,Working with Binary Data in Python (2015),https://www.devdungeon.com/content/working-binary-data-python
922,Lobsters,python,Python programming,Pyre: Fast Type Checking for Python,https://www.facebook.com/notes/protect-the-graph/pyre-fast-type-checking-for-python/2048520695388071/
923,Lobsters,python,Python programming,Python vs NumPy vs Nim,https://narimiran.github.io//2018/05/10/python-numpy-nim.html
924,Lobsters,python,Python programming,The Forgotten Optional `else` in Python Loops,https://medium.com/@s16h/the-forgotten-optional-else-in-python-loops-90d9c465c830
925,Lobsters,python,Python programming,Announcing glom: Restructured Data for Python,https://sedimental.org/glom_restructured_data.html
926,Lobsters,python,Python programming,Are you using Python module ‘SSH Decorator’? Newer versions include a backdoor,https://securityaffairs.co/wordpress/72298/malware/ssh-decorator-backdoor.html
927,Lobsters,python,Python programming,helptranslator: help() for everyone,https://github.com/nickdelgrosso/helptranslator
928,Lobsters,python,Python programming,From Unit Testing to Formal Proofs,https://www.adampalay.com/blog/2018/05/04/from-unit-testing-to-formal-proofs/
929,Lobsters,python,Python programming,GloVe as a TensorFlow Embedding Layer [Practical Tutorial],https://github.com/guillaume-chevalier/GloVe-as-a-TensorFlow-Embedding-Layer
930,Lobsters,python,Python programming,Hello Qt for Python,https://blog.qt.io/blog/2018/05/04/hello-qt-for-python/
931,Lobsters,python,Python programming,"our solution for the hell that is filename encoding, such as it is",http://beets.io/blog/paths.html
932,Lobsters,python,Python programming,"You can now ""pip install conv"": do neat convolution-styled loops on your lists.",https://twitter.com/guillaume_che/status/991897492907323393
933,Lobsters,python,Python programming,Python startup time: milliseconds matter,https://mail.python.org/pipermail/python-dev/2018-May/153296.html
934,Lobsters,python,Python programming,Code that debugs itself: Fixing a deadlock with a watchdog,http://evanjones.ca/rare-deadlock-log-bug.html
935,Lobsters,python,Python programming,How To Find All Your Bugs Using Generative Testing,https://www.youtube.com/watch?v=AqWFaDJYhIA
936,Lobsters,python,Python programming,Text Classification Made Easy with Elasticsearch,https://www.elastic.co/blog/text-classification-made-easy-with-elasticsearch
937,Lobsters,python,Python programming,PythonR: A Python Implementation in Racket,https://fenix.tecnico.ulisboa.pt/downloadFile/844820067123802/resumo.pdf
938,Lobsters,python,Python programming,Flask 1.0 Released,https://www.palletsprojects.com/blog/flask-1-0-released/
939,Lobsters,python,Python programming,"Notes on structured concurrency, or: Go statement considered harmful",https://vorpus.org/blog/notes-on-structured-concurrency-or-go-statement-considered-harmful/
940,Lobsters,python,Python programming,2018 John Hunter Excellence in Plotting Contest,https://mail.python.org/pipermail/matplotlib-users/2018-April/001368.html
941,Lobsters,python,Python programming,Programming in the Debugger,http://willcrichton.net/notes/programming-in-the-debugger/
942,Lobsters,python,Python programming,Transforming Python ASTs to Optimize Comprehensions,https://cypher.codes/writing/transforming-python-asts-to-optimize-comprehensions-at-runtime
943,Lobsters,python,Python programming,Lessons learned from migrating to Python 3,https://able.bio/rhett/lessons-learned-from-migrating-to-python-3--27jsj82
944,Lobsters,python,Python programming,A Tale of Two Fibonacci Lambda Functions,https://www.reddit.com/r/serverless/
945,Lobsters,python,Python programming,Black Online Demo,https://black.now.sh
946,Lobsters,python,Python programming,The best of Python: a collection of articles from 2017 and 2018 (so far),https://medium.freecodecamp.org/python-collection-of-my-favorite-articles-8469b8455939
947,Lobsters,python,Python programming,How to make these slides,https://github.com/asrp/maketheseslides
948,Lobsters,python,Python programming,Convert your old hibernate mapping (hbm) xml files to annotated Java POJOs.,https://github.com/isank/hbmtoannotation
949,Lobsters,python,Python programming,Speeding up numpy-based pitch detection with numba,http://sevag.xyz/post/snac2/
950,Lobsters,python,Python programming,Trio: async programming for humans and snake people,http://trio.readthedocs.io/en/latest/
951,Lobsters,python,Python programming,The Set theory and Python + Tips & Tricks,http://www.idiotinside.com/2017/08/19/set-theory-and-python-tips-tricks/
952,Lobsters,python,Python programming,Incrementally improving the performance of a python script,http://mycode.doesnot.run/2018/04/11/pivot/
953,Lobsters,python,Python programming,Modern Python Dictionaries - A Confluence of a Dozen Great Ideas (2017),https://www.youtube.com/watch?v=npw4s1QTmPg
954,Lobsters,python,Python programming,RedHat Deprecates Python2 in RHEL 7.5,https://access.redhat.com/documentation/en-us/red_hat_enterprise_linux/7/html/7.5_release_notes/chap-red_hat_enterprise_linux-7.5_release_notes-deprecated_functionality
955,Lobsters,python,Python programming,Coala: Linting and fixing code for all languages,https://coala.io/#/home
956,Lobsters,python,Python programming,Python 3 Cheat Sheet,https://perso.limsi.fr/pointal/_media/python:cours:mementopython3-english.pdf
957,Lobsters,python,Python programming,Generating Vanity Infohashes for Torrents,https://gkbrk.com/2018/04/generating-vanity-infohashes-for-torrents/
958,Lobsters,python,Python programming,Slicker: A Tool for Moving Things in Python,http://engineering.khanacademy.org/posts/slicker.htm
959,Lobsters,python,Python programming,The Snake and the Horse: How Wallaroo's Python API Works With Pony,https://blog.wallaroolabs.com/2018/04/the-snake-and-the-horse-how-wallaroos-python-api-works-with-pony/
960,Lobsters,python,Python programming,Fedora and Python 2 End of Life,https://lwn.net/SubscriberLink/750833/1e1052c3f7a0ffce/
961,Lobsters,python,Python programming,"Python & Big Data: Airflow & Jupyter Notebook with Hadoop 3, Spark & Presto",http://tech.marksblogg.com/python-big-data-airflow-jupyter-notebook-hadoop-3-hive-presto.html
962,Lobsters,python,Python programming,A Pure Python GNU Find Like Utility (2013),https://meitham.com/2013/01/05/pure-python-find-utility/
963,Lobsters,python,Python programming,Dramatiq – An alternative to Celery,https://dramatiq.io
964,Lobsters,python,Python programming,Is Python interpreted or compiled? Yes.,https://nedbatchelder.com//blog/201803/is_python_interpreted_or_compiled_yes.html
965,Lobsters,python,Python programming,Understanding Generators,http://devarea.com/python-understanding-generators/
966,Lobsters,python,Python programming,Crowdfunding Mitogen: day 23,http://pythonsweetness.tumblr.com/post/172336616242/crowfunding-mitogen-day-23
967,Lobsters,python,Python programming,Addendum: Two Recurse Center Projects That Explain CPython,http://www.oilshell.org/blog/2018/03/27.html
968,Lobsters,python,Python programming,"Sending confirmation Emails with Flask, Redis Queue, and Amazon SES",https://testdriven.io/sending-confirmation-emails-with-flask-rq-and-ses
969,Lobsters,python,Python programming,Warehouse: All New PyPI is now in beta,http://pyfound.blogspot.com/2018/03/warehouse-all-new-pypi-is-now-in-beta.html
970,Lobsters,python,Python programming,I'm Attending Recurse Center this Summer,http://www.oilshell.org/blog/2018/03/25.html
971,Lobsters,python,Python programming,Python 3’s range is more powerful than Python 2’s xrange,http://treyhunner.com/2018/02/python-3-s-range-better-than-python-2-s-xrange
972,Lobsters,python,Python programming,How to Build a High-Performance VM for Squeak/Smalltalk in Your Spare Time (2016),https://www.hpi.uni-potsdam.de/hirschfeld/publications/media/FelgentreffPapeReinHirschfeld_2016_HowToBuildAHighPerformanceVmForSqueakSmalltalkInYourSpareTimeAnExperienceReportOfUsingTheRPythonToolchain_AcmDL.pdf
973,Lobsters,python,Python programming,A Complete Guide to Writing Functions in Python,http://devarea.com/python-writing-functions-complete-guide/
974,Lobsters,python,Python programming,Sunsetting Python 2 support in scientific Python projects,http://python3statement.org/
975,Lobsters,python,Python programming,guitktk - Make and evolve a GUI and its toolkit simultaneously,https://github.com/asrp/guitktk
976,Lobsters,python,Python programming,Declarative Programming with Python,https://nullp0tr.com/pages/declarative_apis.html
977,Lobsters,python,Python programming,"Web application from scratch, Part III",https://defn.io/2018/03/20/web-app-from-scratch-03/
978,Lobsters,python,Python programming,The Great Python Refactor of 2017 -- And Also 2018,http://engineering.khanacademy.org/posts/python-refactor-1.htm
979,Lobsters,python,Python programming,Improve Your Python: 'yield' and Generators Explained,https://jeffknupp.com/blog/2013/04/07/improve-your-python-yield-and-generators-explained/
980,Lobsters,python,Python programming,"Backporting ""yield from"" to Python 2.7",https://github.com/hchasestevens/hchasestevens.github.io/blob/master/notebooks/backporting-yield-from-to-python-27.ipynb
981,Lobsters,python,Python programming,PDL (alpha): download and discover datasets with one line of code.,https://www.zerotosingularity.com/posts/downloading-datasets-introducting-pdl/
982,Lobsters,python,Python programming,"January 1st, 2020 Annouced as Official EOL Date for Python 2.7",https://mail.python.org/pipermail/python-dev/2018-March/152348.html
983,Lobsters,python,Python programming,Python: range is not an iterator!,http://treyhunner.com/2018/02/python-range-is-not-an-iterator
984,Lobsters,python,Python programming,Memory efficiency of parallel IO operations in Python,https://code.kiwi.com/memory-efficiency-of-parallel-io-operations-in-python-6e7d6c51905d
985,Lobsters,python,Python programming,An Introduction to VisiData,https://jsvine.github.io/intro-to-visidata/index.html
986,Lobsters,python,Python programming,Compressing and enhancing hand-written notes,https://mzucker.github.io/2016/09/20/noteshrink.html
987,Lobsters,python,Python programming,An XML-like document with spreadsheet formulas for values and underlying persistent data structures,https://github.com/asrp/persistent_doc
988,Lobsters,python,Python programming,Requests 3 Fundraiser,https://www.kennethreitz.org/requests3/
989,Lobsters,python,Python programming,Type-Safe Mypy Stub Generator for Protocol Buffers,https://github.com/arachnys/protostub
990,Lobsters,python,Python programming,How I learned to stop worrying and replaced my daughter's pancreas with TensorFlow,https://nbviewer.jupyter.org/gist/mariusae/18a62db9cc32d09dc691fd4f78dcdbfa
991,Lobsters,python,Python programming,"Web application from scratch, Part II",https://defn.io/2018/03/04/web-app-from-scratch-02/
992,Lobsters,python,Python programming,Removing polling checks in guitktk,http://blog.asrpo.com/removing_polling
993,Lobsters,python,Python programming,Building Oil with the OPy Bytecode Compiler,http://www.oilshell.org/blog/2018/03/04.html
994,Lobsters,python,Python programming,Running your Coursera (and any other) Jupyter notebook locally,https://www.zerotosingularity.com/posts/coursera-jupyter-locally/
995,Lobsters,python,Python programming,Python & Async Simplified,https://www.aeracode.org/2018/02/19/python-async-simplified/
996,Lobsters,python,Python programming,Wagtail 2.0 launched,https://wagtail.io/blog/wagtail-2/
997,Lobsters,python,Python programming,"Web application from scratch, Part I",https://defn.io/2018/02/25/web-app-from-scratch-01/
998,Lobsters,python,Python programming,Writing a Simple D-Bus Service in Python,https://gkbrk.com/2018/02/simple-dbus-service-in-python/
999,Lobsters,python,Python programming,"My Python Development Environment, 2018 Edition « Jacob Kaplan-Moss",https://jacobian.org/writing/python-environment-2018/
1000,Lobsters,python,Python programming,Guido van Rossum: 2018 Computer History Museum Fellow,http://www.computerhistory.org/fellowawards/hall/guido-van-rossum/
1001,Lobsters,python,Python programming,Truthiness and Short-Circuit Evaluation in Python,http://blog.jrheard.com/truthiness-and-short-circuit-evaluation-in-python
1002,Lobsters,python,Python programming,Computer History Museum 2018 Award Honorees,http://www.computerhistory.org/press/2018-fellow-honorees.html
1003,Lobsters,python,Python programming,How to Deploy Django apps on AWS Lambda,http://blog.apcelent.com/deploy-django-app-aws-lambda.html
1004,Lobsters,python,Python programming,Chomper - An Internet Blocker for Linux,https://github.com/aniketpanjwani/chomper
1005,Lobsters,python,Python programming,Using environment specific settings in a Django project,https://www.stevenmercatante.com/using-environment-specific-settings-in-django/
1006,Lobsters,python,Python programming,Debugging C like it's Python,http://blog.asrpo.com/debugging_c_like_python
1007,Lobsters,python,Python programming,PeachPy: A Python Framework for Developing High-Performance Assembly Kernels (2013),http://www.dlr.de/sc/en/Portaldata/15/Resources/dokumente/PyHPC2013/submissions/pyhpc2013_submission_10.pdf
1008,Lobsters,python,Python programming,"Lark - Python's most innovative parsing library, is now 1 year old",https://github.com/erezsh/lark
1009,Lobsters,python,Python programming,Ant Colony Optimization algorithm for path planning purposes,https://github.com/PelayoChoya/ACO_path_planning
1010,Lobsters,python,Python programming,Building an open source API Gateway on Kubernetes with Envoy,https://blog.getambassador.io/building-ambassador-an-open-source-api-gateway-on-kubernetes-and-envoy-ed01ed520844
1011,Lobsters,python,Python programming,Much ado about latency: Mitogen and the BFG9000 of import hooks,http://pythonsweetness.tumblr.com/post/170846280192/much-ado-about-latency-mitogen-and-the-bfg9000-of
1012,Lobsters,python,Python programming,The ABC Structure Editor,http://citeseerx.ist.psu.edu/viewdoc/download?doi=10.1.1.694.3304&rep=rep1&type=pdf
1013,Lobsters,python,Python programming,The Future of Python Dependency Management,https://speakerdeck.com/kennethreitz/the-future-of-python-dependency-management
1014,Lobsters,python,Python programming,Virtual Environments Demystified,https://meribold.github.io/python/2018/02/13/virtual-environments-9487/
1015,Lobsters,python,Python programming,Dockerizing Django for Development,https://fernandofreitasalves.com/dockerizing-django-for-development/
1016,Lobsters,python,Python programming,Forth Lisp Python Continuum,https://github.com/asrp/flpc
1017,Lobsters,python,Python programming,Thanks (for Python),https://github.com/phildini/thanks
1018,Lobsters,python,Python programming,Let's talk about usernames,https://www.b-list.org/weblog/2018/feb/11/usernames/
1019,Lobsters,python,Python programming,Python’s Weak Performance Matters,https://metarabbit.wordpress.com/2018/02/05/pythons-weak-performance-matters/
1020,Lobsters,python,Python programming,Think DSP – Free Book on Implementing Digital Signal Processing in Python,http://greenteapress.com/wp/think-dsp/
1021,Lobsters,python,Python programming,Fine-grained Language Composition: Case Study (2016),http://drops.dagstuhl.de/opus/volltexte/2016/6097/pdf/LIPIcs-ECOOP-2016-3.pdf
1022,Lobsters,python,Python programming,Python3 with pleasure - A short guide on features of Python 3,https://github.com/arogozhnikov/python3_with_pleasure
1023,Lobsters,python,Python programming,Adding a new statement to Python's syntax in python_terp,http://blog.asrpo.com/adding_new_statement
1024,Lobsters,python,Python programming,A Prolog Interpreter in RPython (2007),http://cfbolz.de/Bolz2007-Bachelorarbeit.pdf
1025,Lobsters,python,Python programming,A minimal Python interpreter in Python with runtime AST definition and edit-and-continue,https://github.com/asrp/python_terp
1026,Lobsters,python,Python programming,"Decorator Pattern versus the Python ""wrapt"" package",http://blog.dscpl.com.au/2018/01/the-pattern-versus-python-package.html
1027,Lobsters,python,Python programming,wxPython 4.0.0 Released,https://wxpython.org/news/wxpython-4.0.0-release/index.html
1028,Lobsters,python,Python programming,Idiomatic Python Stream Processing in Wallaroo,https://blog.wallaroolabs.com/2018/02/idiomatic-python-stream-processing-in-wallaroo/
1029,Lobsters,python,Python programming,Ivy — a minimalist static website generator,http://mulholland.xyz/docs/ivy/
1030,Lobsters,python,Python programming,Python 1.0.0 is out [1994],https://groups.google.com/forum/?hl=en#!topic/comp.lang.misc/_QUzdEGFwCo
1031,Lobsters,python,Python programming,Tensorflow Release 1.5.0,https://github.com/tensorflow/tensorflow/releases/tag/v1.5.0
1032,Lobsters,python,Python programming,Using Hypothesis and Pexpect to Test High School Programming Assignments,http://blog.jrheard.com/hypothesis-and-pexpect
1033,Lobsters,python,Python programming,Poincaré Embeddings for Learning Hierarchical Representations,https://github.com/facebookresearch/poincare-embeddings
1034,Lobsters,python,Python programming,Cracking Codes with Python,http://inventwithpython.com/cracking/
1035,Lobsters,python,Python programming,Detectron by Facebook AI Research (FAIR) Released,https://github.com/facebookresearch/Detectron
1036,Lobsters,python,Python programming,Mailpile: Jobs,https://www.mailpile.is/jobs/
1037,Lobsters,python,Python programming,Eel - electron-like apps in python,https://github.com/ChrisKnott/Eel
1038,Lobsters,python,Python programming,Tips And Tricks for Shipping a PyGame App on the Mac,https://glyph.twistedmatrix.com/2018/01/shipping-pygame-mac-app.html
1039,Lobsters,python,Python programming,Python “bool” — wat?,https://medium.com/@timb07/python-bool-wat-ab0e28d879c7
1040,Lobsters,python,Python programming,What is Actually True and False in Python?,http://giedrius.blog/2018/01/04/what-is-actually-true-and-false-in-python/
1041,Lobsters,python,Python programming,Full-Text Search in Django with PostgreSQL,http://www.paulox.net/2017/12/22/full-text-search-in-django-with-postgresql/
1042,Lobsters,python,Python programming,How To Find Arbitrage Opportunities In Python,https://dailycodingproblem.com/blog/2018/01/02/find-an-arbitrage.html
1043,Lobsters,python,Python programming,What Does It Take To Be An Expert At Python?,https://www.youtube.com/watch?v=7lmCu8wz8ro
1044,Lobsters,python,Python programming,Generating inspirational quotes with Markov chains,http://www.ramtin.xyz/post/4
1045,Lobsters,python,Python programming,Some thoughts on hylang,https://beatworm.co.uk/blog/lisp/thoughts-about-hylang
1046,Lobsters,python,Python programming,Python Data Science Handbook,https://jakevdp.github.io/PythonDataScienceHandbook/
1047,Lobsters,python,Python programming,Python - C++ bindings,https://www.hardikp.com/2017/12/30/python-cpp/
1048,Lobsters,python,Python programming,Copy-on-write friendly Python garbage collection,https://engineering.instagram.com/copy-on-write-friendly-python-garbage-collection-ad6ed5233ddf
1049,Lobsters,python,Python programming,A Python Internals Adventure,https://flowerhack.dreamwidth.org/3594.html
1050,Lobsters,python,Python programming,Topic Modeling with Scikit Learn,https://medium.com/mlreview/topic-modeling-with-scikit-learn-e80d33668730
1051,Lobsters,python,Python programming,Notes on CPython Lists,http://rcoh.svbtle.com/notes-of-cpython-lists
1052,Lobsters,python,Python programming,Why AI and machine learning researchers are beginning to embrace PyTorch,https://www.oreilly.com/ideas/why-ai-and-machine-learning-researchers-are-beginning-to-embrace-pytorch
1053,Lobsters,python,Python programming,Evil Coding Incantations,http://9tabs.com/random/2017/12/23/evil-coding-incantations.html
1054,Lobsters,python,Python programming,"Creating a Chatbot with Deep Learning, Python, and TensorFlow",https://www.youtube.com/watch?v=dvOnYLDg8_Y
1055,Lobsters,python,Python programming,Do Androids Dream of Electric Blue?,http://timcheeseman.com/funwithcomputers/2017/12/21/do-androids-dream-of-electric-blue.html
1056,Lobsters,python,Python programming,Let your code type-hint itself: introducing open source MonkeyType,https://engineering.instagram.com/let-your-code-type-hint-itself-introducing-open-source-monkeytype-a855c7284881
