ID,Source,Tag_Code,Tag_Name,Title,Url
1,Lobsters,rust,Rust programming,nixinfo -- a lib crate supplying information gathering functions for *nix,https://github.com/Phate6660/nixinfo
2,Lobsters,rust,Rust programming,"defmt, a highly efficient Rust logging framework for embedded devices",https://ferrous-systems.com/blog/defmt/
3,Lobsters,rust,Rust programming,Error Handling Isn't All About Errors,https://yaah.dev/rustconf
4,Lobsters,rust,Rust programming,RustConf 2020,https://www.youtube.com/watch?v=ESXMg9OzWrQ
5,Lobsters,rust,Rust programming,Early Impressions of Go from a Rust Programmer,https://www.ncameron.org/blog/early-impressions-of-go-from-a-rust-programmer/
6,Lobsters,rust,Rust programming,"In Rust, ordinary vectors are values",http://smallcultfollowing.com/babysteps/blog/2018/02/01/in-rust-ordinary-vectors-are-values/
7,Lobsters,rust,Rust programming,First thoughts on Rust vs OCaml,https://blog.darklang.com/first-thoughts-on-rust-vs-ocaml/
8,Lobsters,rust,Rust programming,Rust RwLock and Mutex Performance Oddities (2018),https://fy.blackhats.net.au/blog/html/2018/10/19/rust_rwlock_and_mutex_performance_oddities.html
9,Lobsters,rust,Rust programming,Laying the foundation for Rust's future,https://blog.rust-lang.org/2020/08/18/laying-the-foundation-for-rusts-future.html
10,Lobsters,rust,Rust programming,I want off Mr. Golang's Wild Ride,https://fasterthanli.me/articles/i-want-off-mr-golangs-wild-ride
11,Lobsters,rust,Rust programming,Existential types in Rust,https://varkor.github.io/blog/2018/07/03/existential-types-in-rust.html
12,Lobsters,rust,Rust programming,comparative unsafety,https://flak.tedunangst.com/post/comparative-unsafety
13,Lobsters,rust,Rust programming,Error recovery with parser combinators (using nom),https://www.eyalkalderon.com/nom-error-recovery/
14,Lobsters,rust,Rust programming,Hiding messages in x86 binaries using semantic duals,https://blog.yossarian.net/2020/08/16/Hiding-messages-in-x86-binaries-using-semantic-duals
15,Lobsters,rust,Rust programming,How to Read First Impression Posts,https://www.possiblerust.com/community/how-to-read-first-impression-posts
16,Lobsters,rust,Rust programming,xi-editor,https://github.com/xi-editor
17,Lobsters,rust,Rust programming,"Frustrated? It's not you, it's Rust",https://fasterthanli.me/articles/frustrated-its-not-you-its-rust
18,Lobsters,rust,Rust programming,"probe-run, run embedded Rust apps like native apps",https://ferrous-systems.com/blog/probe-run/
19,Lobsters,rust,Rust programming,RustFest 2019 Interview Series: Burnout in Open Source Software; The Rust Roadmap,https://rustacean-station.org/episode/025-katharina-florian/
20,Lobsters,rust,Rust programming,"I am a Java, C#, C or C++ developer, time to do some Rust",https://fasterthanli.me/articles/i-am-a-java-csharp-c-or-cplusplus-dev-time-to-do-some-rust
21,Lobsters,rust,Rust programming,"""Rust does not have a stable ABI""",https://people.gnome.org/~federico/blog/rust-stable-abi.html
22,Lobsters,rust,Rust programming,gitoxide: pure rust implementation of git,https://github.com/Byron/gitoxide
23,Lobsters,rust,Rust programming,rd is a record/replay debugger written in rust,https://github.com/sidkshatriya/rd
24,Lobsters,rust,Rust programming,"probe.rs: a modern, embedded debugging toolkit, written in Rust",http://probe.rs/
25,Lobsters,rust,Rust programming,Single Page Applications using Rust,http://www.sheshbabu.com/posts/rust-wasm-yew-single-page-application/
26,Lobsters,rust,Rust programming,nixinfo -- a lib crate supplying information gathering functions for *nix,https://github.com/Phate6660/nixinfo
27,Lobsters,rust,Rust programming,"defmt, a highly efficient Rust logging framework for embedded devices",https://ferrous-systems.com/blog/defmt/
28,Lobsters,rust,Rust programming,Error Handling Isn't All About Errors,https://yaah.dev/rustconf
29,Lobsters,rust,Rust programming,RustConf 2020,https://www.youtube.com/watch?v=ESXMg9OzWrQ
30,Lobsters,rust,Rust programming,Early Impressions of Go from a Rust Programmer,https://www.ncameron.org/blog/early-impressions-of-go-from-a-rust-programmer/
31,Lobsters,rust,Rust programming,"In Rust, ordinary vectors are values",http://smallcultfollowing.com/babysteps/blog/2018/02/01/in-rust-ordinary-vectors-are-values/
32,Lobsters,rust,Rust programming,First thoughts on Rust vs OCaml,https://blog.darklang.com/first-thoughts-on-rust-vs-ocaml/
33,Lobsters,rust,Rust programming,Rust RwLock and Mutex Performance Oddities (2018),https://fy.blackhats.net.au/blog/html/2018/10/19/rust_rwlock_and_mutex_performance_oddities.html
34,Lobsters,rust,Rust programming,Laying the foundation for Rust's future,https://blog.rust-lang.org/2020/08/18/laying-the-foundation-for-rusts-future.html
35,Lobsters,rust,Rust programming,I want off Mr. Golang's Wild Ride,https://fasterthanli.me/articles/i-want-off-mr-golangs-wild-ride
36,Lobsters,rust,Rust programming,Existential types in Rust,https://varkor.github.io/blog/2018/07/03/existential-types-in-rust.html
37,Lobsters,rust,Rust programming,comparative unsafety,https://flak.tedunangst.com/post/comparative-unsafety
38,Lobsters,rust,Rust programming,Error recovery with parser combinators (using nom),https://www.eyalkalderon.com/nom-error-recovery/
39,Lobsters,rust,Rust programming,Hiding messages in x86 binaries using semantic duals,https://blog.yossarian.net/2020/08/16/Hiding-messages-in-x86-binaries-using-semantic-duals
40,Lobsters,rust,Rust programming,How to Read First Impression Posts,https://www.possiblerust.com/community/how-to-read-first-impression-posts
41,Lobsters,rust,Rust programming,xi-editor,https://github.com/xi-editor
42,Lobsters,rust,Rust programming,"Frustrated? It's not you, it's Rust",https://fasterthanli.me/articles/frustrated-its-not-you-its-rust
43,Lobsters,rust,Rust programming,"probe-run, run embedded Rust apps like native apps",https://ferrous-systems.com/blog/probe-run/
44,Lobsters,rust,Rust programming,RustFest 2019 Interview Series: Burnout in Open Source Software; The Rust Roadmap,https://rustacean-station.org/episode/025-katharina-florian/
45,Lobsters,rust,Rust programming,"I am a Java, C#, C or C++ developer, time to do some Rust",https://fasterthanli.me/articles/i-am-a-java-csharp-c-or-cplusplus-dev-time-to-do-some-rust
46,Lobsters,rust,Rust programming,"""Rust does not have a stable ABI""",https://people.gnome.org/~federico/blog/rust-stable-abi.html
47,Lobsters,rust,Rust programming,gitoxide: pure rust implementation of git,https://github.com/Byron/gitoxide
48,Lobsters,rust,Rust programming,rd is a record/replay debugger written in rust,https://github.com/sidkshatriya/rd
49,Lobsters,rust,Rust programming,"probe.rs: a modern, embedded debugging toolkit, written in Rust",http://probe.rs/
50,Lobsters,rust,Rust programming,Single Page Applications using Rust,http://www.sheshbabu.com/posts/rust-wasm-yew-single-page-application/
51,Lobsters,rust,Rust programming,Surviving Rust async interfaces,https://fasterthanli.me/articles/surviving-rust-async-interfaces
52,Lobsters,rust,Rust programming,Two Years With Rust,http://brooker.co.za/blog/2020/03/22/rust.html
53,Lobsters,rust,Rust programming,Inbound & Outbound FFI,https://www.possiblerust.com/guide/inbound-outbound-ffi
54,Lobsters,rust,Rust programming,Modernize network function development with this Rust(+DPDK)-based framework,https://opensource.com/article/20/8/capsule-networking
55,Lobsters,rust,Rust programming,Rusty Days 2020,https://www.youtube.com/playlist?list=PLf3u8NhoEikhTC5radGrmmqdkOK-xMDoZ
56,Lobsters,rust,Rust programming,How to speed up the Rust compiler some more in 2020,https://blog.mozilla.org/nnethercote/2020/08/05/how-to-speed-up-the-rust-compiler-some-more-in-2020/
57,Lobsters,rust,Rust programming,An introduction to Data Oriented Design with Rust,http://jamesmcm.github.io/blog/2020/07/25/intro-dod
58,Lobsters,rust,Rust programming,1Password for Linux development preview,https://discussions.agilebits.com/discussion/114964/1password-for-linux-development-preview
59,Lobsters,rust,Rust programming,A gentle intro to assembly with Rust,https://lfn3.net/2020/08/03/a-gentle-intro-to-assembly-with-rust/
60,Lobsters,rust,Rust programming,Go vs Rust: Writing a CLI tool,https://cuchi.me/posts/go-vs-rust
61,Lobsters,rust,Rust programming,Learning Rust: Mindsets and Expectations,https://ferrous-systems.com/blog/mindsets-and-expectations/
62,Lobsters,rust,Rust programming,"Blue Team Rust: What is ""Memory Safety"", really?",https://tiemoko.com/blog/blue-team-rust/
63,Lobsters,rust,Rust programming,Writing and publishing a Python module in Rust,https://blog.yossarian.net/2020/08/02/Writing-and-publishing-a-python-module-in-rust
64,Lobsters,rust,Rust programming,Zero Cost References with Regions in Vale,https://vale.dev/blog/zero-cost-refs-regions
65,Lobsters,rust,Rust programming,Rust verification tools,https://alastairreid.github.io/rust-verification-tools/
66,Lobsters,rust,Rust programming,Anachro-PC - The Anachronistic Personal Computer,https://jamesmunns.com/blog/anachro-pc-001/
67,Lobsters,rust,Rust programming,Learning Rust With Entirely Too Many Linked Lists,https://rust-unofficial.github.io/too-many-lists/index.html
68,Lobsters,rust,Rust programming,"An extremely fast, Pytorch-style Tensor+Autograd library written in Rust",https://github.com/bkkaggle/L2
69,Lobsters,rust,Rust programming,oso: an open source policy engine for authorization,https://www.osohq.com
70,Lobsters,rust,Rust programming,Enum or Trait Object,https://www.possiblerust.com/guide/enum-or-trait-object
71,Lobsters,rust,Rust programming,Writing a file system from scratch in Rust,https://blog.carlosgaldino.com/writing-a-file-system-from-scratch-in-rust.html
72,Lobsters,rust,Rust programming,Oak: an infinitely portable language powered by brainfuck inspired technology,https://github.com/adam-mcdaniel/oakc
73,Lobsters,rust,Rust programming,Richter - A modern Quake engine,http://c-obrien.org/richter/
74,Lobsters,rust,Rust programming,servo-unity: A browser plugin for Unity,https://blog.mozvr.com/a-browser-plugin-for-unity/
75,Lobsters,rust,Rust programming,What is Tauri?,https://tauri.studio/docs/about/intro
76,Lobsters,rust,Rust programming,Langcraft: The LLVM target for Minecraft you've never wanted,https://github.com/SuperTails/langcraft
77,Lobsters,rust,Rust programming,Rust explained using easy English,https://github.com/Dhghomon/easy_rust
78,Lobsters,rust,Rust programming,Cross-compiling to Redox using Nix,https://www.redox-os.org/news/redox-plus-nix-0/
79,Lobsters,rust,Rust programming,Nuclei: Proactive IO & Runtime system,https://github.com/vertexclique/nuclei
80,Lobsters,rust,Rust programming,"Monads, Explained Without Bullshit",https://www.boringcactus.com/2020/07/18/monads-without-the-bullshit.html
81,Lobsters,rust,Rust programming,Clear explanation of Rust’s module system,http://www.sheshbabu.com/posts/rust-module-system/
82,Lobsters,rust,Rust programming,"dijo — scriptable, curses-based, digital event tracker",https://github.com/NerdyPepper/dijo
83,Lobsters,rust,Rust programming,Popol: Minimal non-blocking I/O with Rust,https://cloudhead.io/popol/
84,Lobsters,rust,Rust programming,wgpu API tracing infrastructure,http://kvark.github.io/wgpu/debug/test/ron/2020/07/18/wgpu-api-tracing.html
85,Lobsters,rust,Rust programming,Announcing Rust 1.45.0,https://blog.rust-lang.org/2020/07/16/Rust-1.45.0.html
86,Lobsters,rust,Rust programming,Two Beautiful Rust Programs,https://matklad.github.io//2020/07/15/two-beautiful-programs.html
87,Lobsters,rust,Rust programming,Why even unused data needs to be valid,https://www.ralfj.de/blog/2020/07/15/unused-data.html
88,Lobsters,rust,Rust programming,Building and debugging a high-throughput daemon in Rust,https://brokenco.de//2020/07/15/high-throughput-in-rust.html
89,Lobsters,rust,Rust programming,Writing an asynchronous MQTT Broker in Rust - Part 2,https://hassamuddin.com/blog/rust-mqtt/ping-pong/
90,Lobsters,rust,Rust programming,Rewriting FORTRAN Software In Rust,https://mckeogh.tech/post/shallow-water/
91,Lobsters,rust,Rust programming,pgx: Build Postgres Extensions with Rust,https://github.com/zombodb/pgx
92,Lobsters,rust,Rust programming,Faster Integer Parsing,https://rust-malaysia.github.io/code/2020/07/11/faster-integer-parsing.html
93,Lobsters,rust,Rust programming,nnnoiseless: porting audio code from C to rust,https://jneem.github.io/nnnoiseless/
94,Lobsters,rust,Rust programming,Rust is Surprisingly Good as a Server Language,https://stu2b50.dev/posts/rust-is-surpris76171
95,Lobsters,rust,Rust programming,Is It Time to Rewrite the Operating System in Rust?,https://www.youtube.com/watch?v=HgtRAbE1nBM
96,Lobsters,rust,Rust programming,Live loudness normalization in GStreamer & experiences with porting a C audio filter to Rust,https://coaxion.net/blog/2020/07/live-loudness-normalization-in-gstreamer-experiences-with-porting-a-c-audio-filter-to-rust/
97,Lobsters,rust,Rust programming,Tour of Rust,https://tourofrust.com/
98,Lobsters,rust,Rust programming,Linux kernel in-tree Rust support,https://lore.kernel.org/lkml/CAKwvOdmuYc8rW_H4aQG4DsJzho=F+djd68fp7mzmBp3-wY--Uw@mail.gmail.com/T/#u
99,Lobsters,rust,Rust programming,Hunting down a non-determinism-bug in our Rust Wasm build,https://dev.to/gnunicorn/hunting-down-a-non-determinism-bug-in-our-rust-wasm-build-4fk1
100,Lobsters,rust,Rust programming,Concurrency Patterns in Embedded Rust,https://ferrous-systems.com/blog/embedded-concurrency-patterns/
101,Lobsters,rust,Rust programming,The Fatal Flaw of Ownership Semantics,https://www.gingerbill.org/article/2020/06/21/the-ownership-semantics-flaw/
102,Lobsters,rust,Rust programming,Small strings in Rust,https://fasterthanli.me/articles/small-strings-in-rust
103,Lobsters,rust,Rust programming,Writing a winning 4K intro in Rust,https://www.codeslow.com/2020/07/writing-winning-4k-intro-in-rust.html
104,Lobsters,rust,Rust programming,Writing an aysnchronous MQTT Broker in Rust - Part 1,https://hassamuddin.com/blog/rust-mqtt/overview/
105,Lobsters,rust,Rust programming,"Back to old tricks … (or, baby steps in Rust)",https://donsbot.wordpress.com/2020/07/04/back-to-old-tricks-or-baby-steps-in-rust/
106,Lobsters,rust,Rust programming,Cryptographic algorithms written in pure Rust,https://github.com/RustCrypto
107,Lobsters,rust,Rust programming,Disk space and LTO improvements,https://blog.rust-lang.org/inside-rust/2020/06/29/lto-improvements.html
108,Lobsters,rust,Rust programming,A Few More Reasons Rust Compiles Slowly,https://pingcap.com/blog/reasons-rust-compiles-slowly
109,Lobsters,rust,Rust programming,drep - a grep with runtime reloadable filters,https://github.com/maxpert/drep
110,Lobsters,rust,Rust programming,Abstracting away correctness,https://fasterthanli.me/articles/abstracting-away-correctness
111,Lobsters,rust,Rust programming,Im bad at unsafe,https://djugei.github.io/bad-at-unsafe/
112,Lobsters,rust,Rust programming,xi-editor retrospective,https://raphlinus.github.io/xi/2020/06/27/xi-retrospective.html
113,Lobsters,rust,Rust programming,How CDNs Generate Certificates,https://fly.io/blog/how-cdns-generate-certificates/
114,Lobsters,rust,Rust programming,Egui – An experimental immediate mode GUI written in Rust,https://emilk.github.io/emigui/index.html
115,Lobsters,rust,Rust programming,Cross building Rust GStreamer plugins for the Raspberry Pi,https://www.collabora.com/news-and-blog/blog/2020/06/23/cross-building-rust-gstreamer-plugins-for-the-raspberry-pi/
116,Lobsters,rust,Rust programming,Building a faster CouchDB View Server in Rust,https://www.garrensmith.com/blogs/fortuna-rs-couchdb-view-server
117,Lobsters,rust,Rust programming,Tracking eye centers location with Rust & OpenCV,https://www.blog.nodrama.io/rust-opencv-eye-center-localisation/
118,Lobsters,rust,Rust programming,toydb: a distributed SQL database in Rust,https://github.com/erikgrinaker/toydb
119,Lobsters,rust,Rust programming,Rust's Huge Compilation Units,https://pingcap.com/blog/rust-huge-compilation-units
120,Lobsters,rust,Rust programming,Hardware Floating Point,https://blog.stephenmarz.com/2020/06/14/hardware-floating-point/
121,Lobsters,rust,Rust programming,Tips for Faster Rust Compile Times,https://endler.dev/2020/rust-compile-times/
122,Lobsters,rust,Rust programming,Rust concurrency: the archetype of a message-passing bug,https://medium.com/@polyglot_factotum/rust-concurrency-the-archetype-of-a-message-passing-bug-817b60efd8f8
123,Lobsters,rust,Rust programming,Rust code reviews,https://web.crev.dev/rust-reviews/
124,Lobsters,rust,Rust programming,How Rust Lets Us Monitor 30k API calls/min,https://blog.bearer.sh/how-rust-lets-us-monitor-30k-api-calls-min/
125,Lobsters,rust,Rust programming,The Rust compiler isn't slow; we are,https://blog.kodewerx.org/2020/06/the-rust-compiler-isnt-slow-we-are.html
126,Lobsters,rust,Rust programming,Using Rust to Delete Gitignored Cruft,https://www.forrestthewoods.com/blog/using-rust-to-delete-gitignored-cruft/
127,Lobsters,rust,Rust programming,Third-party audit of rustls,http://jbp.io/2020/06/14/rustls-audit.html
128,Lobsters,rust,Rust programming,"Rust, WebAssembly, and Javascript Make Three: An FFI Story",https://www.infoq.com/presentations/rust-webassembly-javascript/
129,Lobsters,rust,Rust programming,Shredder: Garbage Collection as a Library for Rust,https://blog.typingtheory.com/shredder-garbage-collection-as-a-library-for-rust/
130,Lobsters,rust,Rust programming,Building TodoMVC With vgtk,https://bodil.lol/vgtk/
131,Lobsters,rust,Rust programming,Announcing our Rust Driver: Version 1.0 (for MongoDB),https://www.mongodb.com/blog/post/announcing-rust-driver-version-1
132,Lobsters,rust,Rust programming,New inline assembly syntax available in nightly,https://blog.rust-lang.org/inside-rust/2020/06/08/new-inline-asm.html
133,Lobsters,rust,Rust programming,Futures and Segmented Stacks,https://without.boats/blog/futures-and-segmented-stacks/
134,Lobsters,rust,Rust programming,Top for NGINX,https://github.com/gsquire/topngx
135,Lobsters,rust,Rust programming,"Pazi: an autojump ""zap to directory"" helper",https://github.com/euank/pazi
136,Lobsters,rust,Rust programming,chardetng: A More Compact Character Encoding Detector for the Legacy Web,https://hsivonen.fi/chardetng/
137,Lobsters,rust,Rust programming,choose: A human-friendly and fast alternative to awk and cut,https://github.com/theryangeary/choose
138,Lobsters,rust,Rust programming,MiniCouchDB in Rust,https://www.garrensmith.com/blogs/mini-couch-hack-week
139,Lobsters,rust,Rust programming,Zero To Production in Rust,https://lpalmieri.com/posts/2020-06-06-zero-to-production-1-setup-toolchain-ides-ci/
140,Lobsters,rust,Rust programming,A guide to writing a DNS Server from scratch in Rust,https://github.com/EmilHernvall/dnsguide
141,Lobsters,rust,Rust programming,Why the developers who use Rust love it so much,https://stackoverflow.blog/2020/06/05/why-the-developers-who-use-rust-love-it-so-much/
142,Lobsters,rust,Rust programming,"Calculate the frequencies of words, pairs of words and more in a Wikipedia dataset",https://github.com/asimihsan/word-frequencies
143,Lobsters,rust,Rust programming,gitea-release Tool Announcement,https://christine.website/blog/gitea-release-tool-2020-05-31
144,Lobsters,rust,Rust programming,Rust as a High Level Language,https://llogiq.github.io/2020/05/30/hi.html
145,Lobsters,rust,Rust programming,Rust: Dropping heavy things in another thread can make your code 10000 times faster,https://abramov.io/rust-dropping-things-in-another-thread
146,Lobsters,rust,Rust programming,Coverage Marks,https://ferrous-systems.com/blog/coverage-marks/
147,Lobsters,rust,Rust programming,Writing Linux Kernel Modules in Safe Rust - Geoffrey Thomas & Alex Gaynor,https://www.youtube.com/watch?v=RyY01fRyGhM
148,Lobsters,rust,Rust programming,How to build a WebSocket server with Rust,https://blog.logrocket.com/how-to-build-a-websocket-server-with-rust/
149,Lobsters,rust,Rust programming,Maybe you don't need Rust and WASM to speed up your JS (2018),https://mrale.ph/blog/2018/02/03/maybe-you-dont-need-rust-to-speed-up-your-js.html
150,Lobsters,rust,Rust programming,Compiling Rust binaries for Windows 98 SE and more: a journey,https://seri.tools/blog/compiling-rust-for-legacy-windows/
151,Lobsters,rust,Rust programming,Cargo-Guppy: A Tool to Analyze Cargo Dependency Graphs,https://github.com/facebookincubator/cargo-guppy
152,Lobsters,rust,Rust programming,Terminal interface for checking IPv6 exposed local ports,https://github.com/vvilhonen/ipv6shell
153,Lobsters,rust,Rust programming,Conway’s Game of Life on the NES in Rust,https://gridbugs.org/conways-game-of-life-on-the-nes-in-rust/
154,Lobsters,rust,Rust programming,Integration Testing in Rust,https://joshleeb.com/blog/rust-integration-tests/
155,Lobsters,rust,Rust programming,Rust's Runtime,https://blog.mgattozzi.dev/rusts-runtime/
156,Lobsters,rust,Rust programming,Common Rust Lifetime Misconceptions,https://github.com/pretzelhammer/rust-blog/blob/master/posts/common-rust-lifetime-misconceptions.md
157,Lobsters,rust,Rust programming,Broom: An ergonomic tracing garbage collector,https://github.com/zesterer/broom
158,Lobsters,rust,Rust programming,Fil: a new Python memory profiler for data scientists and scientists,https://pythonspeed.com/articles/memory-profiler-data-scientists/
159,Lobsters,rust,Rust programming,acme-redirect: easy to use acmev2 daemon in rust,https://github.com/kpcyrd/acme-redirect
160,Lobsters,rust,Rust programming,Things I hate about Rust,https://blog.yossarian.net/2020/05/20/Things-I-hate-about-rust
161,Lobsters,rust,Rust programming,SAFE Network,https://safenetwork.tech/
162,Lobsters,rust,Rust programming,Oxidizing the technical interview,https://blog.mgattozzi.dev/oxidizing-the-technical-interview/
163,Lobsters,rust,Rust programming,Controlling mutation with types,https://blog.jcoglan.com/2020/05/12/controlling-mutation-with-types/
164,Lobsters,rust,Rust programming,Next Few Years,https://rust-analyzer.github.io//blog/2020/05/18/next-few-years.html
165,Lobsters,rust,Rust programming,"Orb.Farm, a virtual aquatic ecosystem",https://orb.farm
166,Lobsters,rust,Rust programming,SIMD accelerated rank/select data structure,https://github.com/sujayakar/rsdict
167,Lobsters,rust,Rust programming,Common *nix commands written in Rust,https://gcollazo.com/common-nix-commands-written-in-rust/
168,Lobsters,rust,Rust programming,Five Years of Rust,https://blog.rust-lang.org/2020/05/15/five-years-of-rust.html
169,Lobsters,rust,Rust programming,"NuShell: the shell where traditional Unix meets modern development, written in Rust",https://notamonadtutorial.com/nushell-the-shell-where-traditional-unix-meets-modern-development-written-in-rust-caf92c2c7c98
170,Lobsters,rust,Rust programming,Succinct Data Structures and Delta Encoding for Modern Databases,https://github.com/terminusdb/terminus-server/blob/dev/docs/whitepaper/terminusdb.pdf
171,Lobsters,rust,Rust programming,Using Rust to Power Python Importing With oxidized_importer,https://gregoryszorc.com/blog/2020/05/10/using-rust-to-power-python-importing-with-oxidized_importer/
172,Lobsters,rust,Rust programming,ruruby: Ruby in Rust,https://github.com/sisshiki1969/ruruby
173,Lobsters,rust,Rust programming,C++ Is Faster and Safer Than Rust: Benchmarked by Yandex,https://www.viva64.com/en/b/0733/
174,Lobsters,rust,Rust programming,A practical introduction to async programming in Rust,http://jamesmcm.github.io/blog/2020/05/06/a-practical-introduction-to-async-programming-in-rust
175,Lobsters,rust,Rust programming,Writing A Wayland Compositor In Rust,https://wiki.alopex.li/WritingAWaylandCompositorInRust
176,Lobsters,rust,Rust programming,Auto-currying Rust Functions: A guide to Rust's Procedural Macros,https://peppe.rs/posts/auto-currying_rust_functions/
177,Lobsters,rust,Rust programming,gitui release: terminal ui for git written in rust,http://extrawurst.github.io/general/2020/05/08/gitui-release.html
178,Lobsters,rust,Rust programming,micro-mitten: simple Rust-like lang with compile-time memory management,https://github.com/doctorn/micro-mitten
179,Lobsters,rust,Rust programming,Decoding Bitcoin Messages with Tokio Codecs,https://www.zfnd.org/blog/decoding-bitcoin-messages-with-tokio-codecs/
180,Lobsters,rust,Rust programming,Reducing the size of a Rust GStreamer plugin,https://www.collabora.com/news-and-blog/blog/2020/04/28/reducing-size-rust-gstreamer-plugin/
181,Lobsters,rust,Rust programming,no_std async/await - soon on stable,https://ferrous-systems.com/blog/stable-async-on-embedded/
182,Lobsters,rust,Rust programming,smol: A small and fast async runtime for Rust,https://github.com/stjepang/smol
183,Lobsters,rust,Rust programming,Min of Three (2017),https://matklad.github.io//2017/03/12/min-of-three.html
184,Lobsters,rust,Rust programming,Making rust as fast as go,https://www.christianfscott.com/making-rust-as-fast-as-go/
185,Lobsters,rust,Rust programming,Rust in an instant,https://fnordig.de/2020/05/02/rust-in-an-instant/
186,Lobsters,rust,Rust programming,Rust-Written Redox OS Booting The 128-Thread AMD Ryzen Threadripper 3990X,https://www.phoronix.com/scan.php?page=news_item&px=Redox-OS-On-Threadripper-3990X
187,Lobsters,rust,Rust programming,The Safety Boat: Kubernetes and Rust,http://msrc-blog.microsoft.com/2020/04/29/the-safety-boat-kubernetes-and-rust/
188,Lobsters,rust,Rust programming,Hot Reloadable structs: Memory Mapping,https://mun-lang.org/blog/2020/05/01/memory-mapping/
189,Lobsters,rust,Rust programming,Microsoft: Why we used programming language Rust over Go for WebAssembly on Kubernetes app,https://www.zdnet.com/article/microsoft-why-we-used-programming-language-rust-over-go-for-webassembly-on-kubernetes-app/
