ID,Source,Tag_Code,Tag_Name,Title,Url
380,Lobsters,rust,Rust programming,iou: Rust bindings for liburing,https://boats.gitlab.io/blog/post/iou/
381,Lobsters,rust,Rust programming,async-std 0.9.12: async/.await is ready,https://async.rs/blog/async-std-0-9-12-async-await-is-ready/
382,Lobsters,rust,Rust programming,Async-await on stable Rust,https://blog.rust-lang.org/2019/11/07/Async-await-stable.html
383,Lobsters,rust,Rust programming,Rust 1.39.0,https://blog.rust-lang.org/2019/11/07/Rust-1.39.0.html
384,Lobsters,rust,Rust programming,Using Type-Level Programming in Rust to Make Safer Hardware Abstractions,https://blog.auxon.io/2019/10/25/type-level-registers/
385,Lobsters,rust,Rust programming,A sorted array with O(lg n) access and O(sqrt(n)) inserts and deletes,https://github.com/senderista/sorted-vec
386,Lobsters,rust,Rust programming,How to make your C codebase rusty: rewriting keyboard firmware keymap in Rust,https://about.houqp.me/posts/rusty-c/
387,Lobsters,rust,Rust programming,mrustc 0.9 now with Rust 1.29.0 support,https://github.com/thepowersgang/mrustc
388,Lobsters,rust,Rust programming,Announcing cfnts: Cloudflare's implementation of NTS in Rust,https://blog.cloudflare.com/announcing-cfnts/
389,Lobsters,rust,Rust programming,A call for blogs 2020,https://blog.rust-lang.org/2019/10/29/A-call-for-blogs-2020.html
390,Lobsters,rust,Rust programming,pflanze/ruly - Lispy interpreter on Rust,https://github.com/pflanze/ruly
391,Lobsters,rust,Rust programming,"Quantum computing in Rust, part 1",https://walther.guru/blog/impl-quantum-part-1/
392,Lobsters,rust,Rust programming,Ferris Fencing,http://www.ferrisfencing.org/
393,Lobsters,rust,Rust programming,why async fn in traits are hard,http://smallcultfollowing.com/babysteps/blog/2019/10/26/async-fn-in-traits-are-hard/
394,Lobsters,rust,Rust programming,bb - simple process viewer in Rust,https://github.com/epilys/bb
395,Lobsters,rust,Rust programming,Rust and C++ on Floating-point Intensive Code,https://www.reidatcheson.com/hpc/architecture/performance/rust/c++/2019/10/19/measure-cache.html
396,Lobsters,rust,Rust programming,Floorplan: Spatial Layout in Memory Management Systems,http://cronburg.com/papers/floorplan19.pdf
397,Lobsters,rust,Rust programming,How to not rewrite it in Rust,http://adventures.michaelfbryan.com/posts/how-not-to-riir/
398,Lobsters,rust,Rust programming,Where rustc spends its time,https://wiki.alopex.li/WhereRustcSpendsItsTime
399,Lobsters,rust,Rust programming,Interview with Noria’s creator: a promising dataflow research database implemented in Rust,https://notamonadtutorial.com/interview-with-norias-creator-a-promising-dataflow-database-implemented-in-rust-352e2c3d9d95
400,Lobsters,rust,Rust programming,Dealing with process termination in Linux (with Rust examples),https://iximiuz.com/en/posts/dealing-with-processes-termination-in-Linux/
401,Lobsters,rust,Rust programming,Searching for palindromic superpermutations,https://tuzz.tech/blog/palindromic-superpermutations
402,Lobsters,rust,Rust programming,I made a NES emulator in Rust using generators,https://kyle.space/posts/i-made-a-nes-emulator/
403,Lobsters,rust,Rust programming,Types for units of measure,https://varkor.github.io/blog/2018/07/30/types-for-units-of-measure.html
404,Lobsters,rust,Rust programming,"""A Talk Near the Future of Python"" - live coding a simple VM / web assembly interpreter",https://www.youtube.com/watch?v=r-A78RgMhZU
405,Lobsters,rust,Rust programming,Announcing Rustup 1.20.0,https://blog.rust-lang.org/2019/10/15/Rustup-1.20.0.html
406,Lobsters,rust,Rust programming,Rusoto: AWS SDK for Rust,https://github.com/rusoto/rusoto
407,Lobsters,rust,Rust programming,Making the Tokio scheduler 10x faster,https://tokio.rs/blog/2019-10-scheduler/
408,Lobsters,rust,Rust programming,Learning Rust at Hacktoberfest in 8 hours,https://medium.com/@knidarkness/learning-rust-at-hacktoberfest-in-8-hours-7b788883c665
409,Lobsters,rust,Rust programming,My favorite rust function,https://blog.jabid.in/2019/10/11/drop.html
410,Lobsters,rust,Rust programming,How to speed up the Rust compiler some more in 2019,https://blog.mozilla.org/nnethercote/2019/10/11/how-to-speed-up-the-rust-compiler-some-more-in-2019/
411,Lobsters,rust,Rust programming,Designing a COM library for Rust,https://msrc-blog.microsoft.com/2019/10/08/designing-a-com-library-for-rust/
412,Lobsters,rust,Rust programming,Productive and safe Rust binding for OCR applications (leptonica and tesseract),https://github.com/houqp/leptess
413,Lobsters,rust,Rust programming,Compile Stress Test,https://christine.website/blog/compile-stress-test-2019-10-03
414,Lobsters,rust,Rust programming,Async-await hits beta,https://blog.rust-lang.org/2019/09/30/Async-await-hits-beta.html
415,Lobsters,rust,Rust programming,The Fascinating Influence of Cyclone,http://pling.jondgoodwin.com/post/cyclone/
416,Lobsters,rust,Rust programming,HTMLRewriter API Beta to Cloudflare Workers,https://blog.cloudflare.com/html-rewriter-beta/
417,Lobsters,rust,Rust programming,Security advisory for Cargo,https://blog.rust-lang.org/2019/09/30/Security-advisory-for-cargo.html
418,Lobsters,rust,Rust programming,Rust 1.38,https://blog.rust-lang.org/2019/09/26/Rust-1.38.0.html
419,Lobsters,rust,Rust programming,Drone: An Embedded Operating System for writing real-time applications in Rust,https://www.drone-os.com/
420,Lobsters,rust,Rust programming,"Neqo, an Implementation of QUIC written in Rust",https://github.com/mozilla/neqo
421,Lobsters,rust,Rust programming,"Weld: accelerating numpy, scikit and pandas as much as 100x with Rust and LLVM",https://notamonadtutorial.com/weld-accelerating-numpy-scikit-and-pandas-as-much-as-100x-with-rust-and-llvm-12ec1c630a1
422,Lobsters,rust,Rust programming,"Of bitpacking, with or without SSE3",https://fulmicoton.com/posts/bitpacking/
423,Lobsters,rust,Rust programming,"issue-bot, a bot to handle bug reports through mail for gitea's issue tracker",https://github.com/meli/issue-bot
424,Lobsters,rust,Rust programming,Closing the gap: cross-language LTO between Rust and C/C++,http://blog.llvm.org/2019/09/closing-gap-cross-language-lto-between.html
425,Lobsters,rust,Rust programming,An unexpected performance regression,https://dev.to/sharkdp/an-unexpected-performance-regression-11ai
426,Lobsters,rust,Rust programming,Pass-By-Value in C++ and Rust,https://dev.to/deciduously/pass-by-value-in-c-and-rust-1jo
427,Lobsters,rust,Rust programming,Why Go and not Rust?,https://kristoff.it/blog/why-go-and-not-rust/
428,Lobsters,rust,Rust programming,Rust on the ESP32,https://mabez.dev/blog/posts/esp32-rust/
429,Lobsters,rust,Rust programming,Rust Language Cheat Sheet,https://cheats.rs
430,Lobsters,rust,Rust programming,How Rust optimizes async/await II: Program analysis,https://tmandry.gitlab.io/blog/posts/optimizing-await-2/
431,Lobsters,rust,Rust programming,Combining Coverage-Guided and Generation-Based Fuzzing,http://fitzgeraldnick.com/2019/09/04/combining-coverage-guided-and-generation-based-fuzzing.html
432,Lobsters,rust,Rust programming,"9 best open-source findings, August 2019",https://dev.to/sobolevn/9-best-open-source-findings-august-2019-31m8
433,Lobsters,rust,Rust programming,Porting Rust and WebAssembly's Game of Life onto Wavelet,https://medium.com/perlin-network/turning-existing-webassembly-applications-into-distributed-programs-33b817462aa6
434,Lobsters,rust,Rust programming,A Memory Safety Research Agenda,https://alexgaynor.net/2019/sep/02/memory-safety-research-agenda/
435,Lobsters,rust,Rust programming,Exploring lock-free Rust: Crossbeam,https://morestina.net/blog/784/exploring-lock-free-rust-3-crossbeam
436,Lobsters,rust,Rust programming,"A Decentralized Blog using React, Gatsby, and Wavelet",https://medium.com/perlin-network/a-decentralized-blog-using-react-gatsby-and-wavelet-af07db78a2c0
437,Lobsters,rust,Rust programming,"Rust is the future of systems programming, C is the new Assembly",https://hub.packtpub.com/rust-is-the-future-of-systems-programming-c-is-the-new-assembly-intel-principal-engineer-josh-triplett/
438,Lobsters,rust,Rust programming,Async Stack Traces in Rust,http://fitzgeraldnick.com/2019/08/27/async-stacks-in-rust.html
439,Lobsters,rust,Rust programming,Should small Rust structs be passed by-copy or by-borrow?,https://www.forrestthewoods.com/blog/should-small-rust-structs-be-passed-by-copy-or-by-borrow/
440,Lobsters,rust,Rust programming,"Criterion.rs v0.3 - Custom Measurements, Profiling Hooks, Custom Test Framework, API Changes",https://bheisler.github.io/post/criterion-rs-0-3/
441,Lobsters,rust,Rust programming,Intel and Rust: the Future of Systems Programming,https://www.youtube.com/watch?v=l9hM0h6IQDo
442,Lobsters,rust,Rust programming,"pastel: A command-line tool to generate, analyze, convert and manipulate colors",https://github.com/sharkdp/pastel
443,Lobsters,rust,Rust programming,Introducing nushell,http://www.jonathanturner.org/2019/08/introducing-nushell.html
444,Lobsters,rust,Rust programming,Rust GUI ecosystem overview,https://gitlab.com/z0mbie42/rust_gui_ecosystem_overview
445,Lobsters,rust,Rust programming,A framework for Linux device drivers in Rust,https://github.com/lizhuohua/linux-kernel-module-rust
446,Lobsters,rust,Rust programming,Thoughts on Rust bloat,https://raphlinus.github.io/rust/2019/08/21/rust-bloat.html
447,Lobsters,rust,Rust programming,Polsim - a case study for small-scale scientific computing in Rust,https://tinkering.xyz/polsim/
448,Lobsters,rust,Rust programming,Systems performance telemetry,https://github.com/twitter/rezolus
449,Lobsters,rust,Rust programming,Introducing Rezolus,https://blog.twitter.com/engineering/en_us/topics/open-source/2019/introducing-rezolus.html
450,Lobsters,rust,Rust programming,How Rust optimizes async/await: Part 1,https://tmandry.gitlab.io/blog/posts/optimizing-await-1/
451,Lobsters,rust,Rust programming,CPU atomics and orderings explained,https://fy.blackhats.net.au/blog/html/2019/07/16/cpu_atomics_and_orderings_explained.html
452,Lobsters,rust,Rust programming,ruffle: A Flash Player emulator written in Rust,https://github.com/ruffle-rs/ruffle
453,Lobsters,rust,Rust programming,Announcing `async-std`,https://async.rs/blog/announcing-async-std/
454,Lobsters,rust,Rust programming,Rust 1.37.0,https://blog.rust-lang.org/2019/08/15/Rust-1.37.0.html
455,Lobsters,rust,Rust programming,Functional Programming Jargon in Rust,https://functional.works-hub.com/learn/functional-programming-jargon-in-rust-1b555
456,Lobsters,rust,Rust programming,"The Roguelike Toolkit (RLTK), implemented for Rust",https://github.com/thebracket/rltk_rs
457,Lobsters,rust,Rust programming,"Here's My Type, So Initialize Me Maybe (mem::uninitialized is deprecated)",https://gankro.github.io/blah/initialize-me-maybe/
458,Lobsters,rust,Rust programming,Artichoke Ruby Playground,https://artichoke.github.io/artichoke/
459,Lobsters,rust,Rust programming,Rust Compiler Team,https://rust-lang.github.io/compiler-team/
460,Lobsters,rust,Rust programming,Python vs Rust for Neural Networks,https://ngoldbaum.github.io/posts/python-vs-rust-nn/
461,Lobsters,rust,Rust programming,Rustlings: Small exercises to get you used to reading and writing Rust code,https://github.com/rust-lang/rustlings
462,Lobsters,rust,Rust programming,Rust to SPIR-V compiler,https://github.com/MaikKlein/rlsl
463,Lobsters,rust,Rust programming,The Rust compiler is still getting faster,https://blog.mozilla.org/nnethercote/2019/07/25/the-rust-compiler-is-still-getting-faster/
464,Lobsters,rust,Rust programming,Rust ownership explained with books,https://hauleth.dev/post/eli5-ownership/
465,Lobsters,rust,Rust programming,Why Rust for safe systems programming,https://msrc-blog.microsoft.com/2019/07/22/why-rust-for-safe-systems-programming/
466,Lobsters,rust,Rust programming,Bastion: Fault-tolerant Runtime for Rust applications,https://github.com/vertexclique/bastion
467,Lobsters,rust,Rust programming,"Models of Generics and Metaprogramming: Go, Rust, Swift, D and More",http://thume.ca/2019/07/14/a-tour-of-metaprogramming-models-for-generics/
468,Lobsters,rust,Rust programming,Rust compiler added to Android tree,https://android.googlesource.com/toolchain/rustc/
469,Lobsters,rust,Rust programming,Notes on a smaller Rust,https://boats.gitlab.io/blog/post/notes-on-a-smaller-rust/
470,Lobsters,rust,Rust programming,Why was the Rust language chosen? (Congressional Hearing on Facebook Digital Currency),https://www.c-span.org/video/?c4808083/rust-language-chosen
471,Lobsters,rust,Rust programming,A proactive approach to more secure code,https://msrc-blog.microsoft.com/2019/07/16/a-proactive-approach-to-more-secure-code/
472,Lobsters,rust,Rust programming,Rust vs C++ - Implementing a Neural Network,http://www.nicktasios.nl/posts/rust-vs-c%2B%2B-implementing-a-neural-network.html
473,Lobsters,rust,Rust programming,"How the Rust community has been built, by Aaron Turon",https://www.youtube.com/embed/xSjk2PdQm5k?start=800&feature=oembed&enablejsapi=1
474,Lobsters,rust,Rust programming,Global state & unstable ABI in ld breaks linker replacement dryad (2016),https://github.com/m4b/dryad/issues/5
475,Lobsters,rust,Rust programming,"""What The Hardware Does"" is not What Your Program Does: Uninitialized Memory",https://www.ralfj.de/blog/2019/07/14/uninit.html
476,Lobsters,rust,Rust programming,Method for Emulating Higher-Kinded Types in Rust,https://gist.github.com/edmundsmith/855fcf0cb35dd467c29a9350481f0ecf
477,Lobsters,rust,Rust programming,Rust Async-await status report #2,http://smallcultfollowing.com/babysteps/blog/2019/07/08/async-await-status-report-2/
478,Lobsters,rust,Rust programming,"Pista - a simple {bash, zsh} prompt written in rust",https://github.com/nerdypepper/pista
479,Lobsters,rust,Rust programming,"meli, a new mail client for the terminal - pre-alpha release",https://meli.delivery/posts/2019-06-15-pre-alpha.html
480,Lobsters,rust,Rust programming,Speedy Desktop Apps With GTK and Rust,https://nora.codes/tutorial/speedy-desktop-apps-with-gtk-and-rust/
481,Lobsters,rust,Rust programming,Announcing Rust 1.36.0,https://blog.rust-lang.org/2019/07/04/Rust-1.36.0.html
482,Lobsters,rust,Rust programming,Build A Decentralized Chat Using JavaScript & Rust (WebAssembly),https://medium.com/perlin-network/build-a-decentralized-chat-using-javascript-rust-webassembly-c775f8484b52
483,Lobsters,rust,Rust programming,rust-log_buffer,https://github.com/whitequark/rust-log_buffer
484,Lobsters,rust,Rust programming,Vector - A High-Performance Log and Metric Router Written in Rust,https://github.com/timberio/vector
485,Lobsters,rust,Rust programming,Status of rust-analyzer: Achievements and Open Collective,https://ferrous-systems.com/blog/rust-analyzer-status-opencollective/
486,Lobsters,rust,Rust programming,eva - a simple calculator repl written in rust,https://github.com/NerdyPepper/eva
487,Lobsters,rust,Rust programming,Writing a small ray tracer in Rust and Zig,https://nelari.us/post/raytracer_with_rust_and_zig/
488,Lobsters,rust,Rust programming,"One Program Written in Python, Go, and Rust",http://nicolas-hahn.com/python/go/rust/programming/2019/07/01/program-in-python-go-rust/
489,Lobsters,rust,Rust programming,Breaking News: Non-Lexical Lifetimes arrives for everyone,http://blog.pnkfx.org/blog/2019/06/26/breaking-news-non-lexical-lifetimes-arrives-for-everyone/
490,Lobsters,rust,Rust programming,"An open ledger for writing scalable, mission-critical, decentralized WebAssembly applications",https://wavelet.perlin.net
491,Lobsters,rust,Rust programming,"Meuse, a free Rust private registry, first alpha release",https://github.com/mcorbin/meuse
492,Lobsters,rust,Rust programming,"Weld, accelerating Data Science by 100x",https://youtu.be/JbTqNuCIJM4
493,Lobsters,rust,Rust programming,aljabar - an experimental n-dimensional linear algebra library for Rust based on const generics,https://github.com/maplant/aljabar
494,Lobsters,rust,Rust programming,railcar: A rust implementation of the Open Containers Initiative runtime spec,https://github.com/oracle/railcar
495,Lobsters,rust,Rust programming,Building Standalone Python Applications with PyOxidizer,https://gregoryszorc.com/blog/2019/06/24/building-standalone-python-applications-with-pyoxidizer/
496,Lobsters,rust,Rust programming,My iterator is returning a reference to a reference,https://blog.tawhidhannan.co.uk/rust/tidbits/rust-double-ref
497,Lobsters,rust,Rust programming,Real Time For the Masses goes multi-core,https://blog.japaric.io/multicore-rtfm/
498,Lobsters,rust,Rust programming,BEAM + Rust A match made in heaven,https://codesync.global/media/beam-rust-a-match-made-in-heaven/
499,Lobsters,rust,Rust programming,RSoC: Implementing ptrace for Redox OS - part 0,https://www.redox-os.org/news/rsoc-ptrace-0/
500,Lobsters,rust,Rust programming,Collaborative Editor in Rust,https://caolan.org/posts/collaborative_editor_in_rust.html
501,Lobsters,rust,Rust programming,The Typestate Pattern in Rust,http://cliffle.com/blog/rust-typestate/
502,Lobsters,rust,Rust programming,"Rust Creator Graydon Hoare Talks About Security, History, and Rust",https://thenewstack.io/rust-creator-graydon-hoare-talks-about-security-history-and-rust/
503,Lobsters,rust,Rust programming,m-labs/smoltcp,https://github.com/m-labs/smoltcp
504,Lobsters,rust,Rust programming,Amethyst 0.11 Released,https://amethyst.rs/posts/release-0-11
505,Lobsters,rust,Rust programming,"Comparing the Same Project in Rust, Haskell, C++, Python, Scala and OCaml",http://thume.ca/2019/04/29/comparing-compilers-in-rust-haskell-c-and-python/
506,Lobsters,rust,Rust programming,Green Threads Explained in 200 Lines of Rust,https://cfsamson.gitbook.io/green-threads-explained-in-200-lines-of-rust/
507,Lobsters,rust,Rust programming,The rust module system and useful crates for CLI apps,https://ngoldbaum.github.io/posts/helpful-rust-cli-crates/
508,Lobsters,rust,Rust programming,Launching a new keyserver,https://keys.openpgp.org/about/news#2019-06-12-launch
509,Lobsters,rust,Rust programming,Responsive compilers - Nicholas Matsakis - PLISS 2019,https://www.youtube.com/watch?v=N6b44kMS6OM
510,Lobsters,rust,Rust programming,Bzip2 in Rust: porting the randomization table,https://people.gnome.org/~federico/blog/bzip2-in-rust-randomization-table.html
511,Lobsters,rust,Rust programming,rustly: A Clojure to Rust transpiler,https://github.com/timothypratley/rustly
512,Lobsters,rust,Rust programming,Rust for the Brave and True,https://dev.to/gruberb/rust-for-the-brave-and-true-4766
513,Lobsters,rust,Rust programming,SPARK/Ada gets pointer support inspired by the Rust memory model,https://blog.adacore.com/using-pointers-in-spark
514,Lobsters,rust,Rust programming,The first 20 Project Euler problems in rust,https://ngoldbaum.github.io/posts/project-euler/
515,Lobsters,rust,Rust programming,"Actix-web 1.0 – A small, pragmatic, and fast web framework for Rust",https://docs.rs/actix-web/1.0.0/actix_web/
516,Lobsters,rust,Rust programming,Sealed Rust,https://ferrous-systems.com/blog/sealed-rust-the-pitch/
517,Lobsters,rust,Rust programming,Maintaining bzip2,https://people.gnome.org/~federico/blog/maintaining-bzip2.html
518,Lobsters,rust,Rust programming,The design and implementation of a lock-free ring-buffer with contiguous reservations,https://ferrous-systems.com/blog/lock-free-ring-buffer/
519,Lobsters,rust,Rust programming,The Problem With Single-threaded Shared Mutability - In Pursuit of Laziness (2015),http://manishearth.github.io/blog/2015/05/17/the-problem-with-shared-mutability/
520,Lobsters,rust,Rust programming,Gopher Server in Rust,https://gkbrk.com/2019/06/gopher-server/
521,Lobsters,rust,Rust programming,Storing versioned data with revlogs,https://ngoldbaum.github.io/posts/revlog/
522,Lobsters,rust,Rust programming,Orkhon – ML Inference Framework and Server Runtime,https://github.com/vertexclique/orkhon
523,Lobsters,rust,Rust programming,Update on await syntax,https://boats.gitlab.io/blog/post/await-decision-ii/
524,Lobsters,rust,Rust programming,Curiosity Killed the Mario,http://www.michaelburge.us/2019/05/21/marai-agent.html
525,Lobsters,rust,Rust programming,Rust In Avast,https://vorner.github.io/2019/05/19/rust-in-avast.html
526,Lobsters,rust,Rust programming,Shell Completions in Pure Rust,https://www.joshmcguigan.com/blog/shell-completions-pure-rust/
527,Lobsters,rust,Rust programming,A new memory profiler for Linux from Nokia written in Rust,https://github.com/nokia/memory-profiler
528,Lobsters,rust,Rust programming,Crates You Should Know: bindgen and cbindgen—automatic generation of FFI types between Rust and C,https://newrustacean.com/show_notes/cysk/bindgen_cbindgen/
529,Lobsters,rust,Rust programming,Using Rust to Scale Elixir for 11 Million Concurrent Users,https://blog.discordapp.com/using-rust-to-scale-elixir-for-11-million-concurrent-users-c6f19fc029d3
530,Lobsters,rust,Rust programming,Zero Cost Abstractions,https://boats.gitlab.io/blog/post/zero-cost-abstractions/
531,Lobsters,rust,Rust programming,Terraform: generate 3-d models of geographic terrain,https://jaredforsyth.com/posts/intoducing-terraform/
532,Lobsters,rust,Rust programming,4 years of Rust,https://blog.rust-lang.org/2019/05/15/4-Years-Of-Rust.html
533,Lobsters,rust,Rust programming,e031: Rust FFI Deep Dive,https://newrustacean.com/show_notes/e031/
534,Lobsters,rust,Rust programming,Cloud Hypervisor written in Rust from Intel,https://github.com/intel/cloud-hypervisor
535,Lobsters,rust,Rust programming,ManticoreOS: A research operating system to explore parakernels,https://github.com/manticoreos/manticore
536,Lobsters,rust,Rust programming,Security advisory for the Rust standard library,https://blog.rust-lang.org/2019/05/13/Security-advisory.html
537,Lobsters,rust,Rust programming,"Managing Rust Dependencies with Nix, Part I",https://www.hadean.com/blog/managing-rust-dependencies-with-nix-part-i
538,Lobsters,rust,Rust programming,μAMP: Asymmetric Multi-Processing on microcontrollers,https://blog.japaric.io/microamp/
539,Lobsters,rust,Rust programming,How and why await should be a method after all,https://www.hardmo.de/article/2019-05-06-await-method-afterall.md
540,Lobsters,rust,Rust programming,“The Tie Between Ruby and Rust.”,https://github.com/danielpclark/rutie
541,Lobsters,rust,Rust programming,A final proposal for await syntax,https://boats.gitlab.io/blog/post/await-decision/
542,Lobsters,rust,Rust programming,I underestimated the dangers of Rust FFI,https://blog.debiania.in.ua/posts/2019-05-05-i-underestimated-the-dangers-of-rust-ffi.html
543,Lobsters,rust,Rust programming,Rust parallelism for non-C/C++ developers,https://medium.com/nearprotocol/rust-parallelism-for-non-c-c-developers-ec23f48b7e56
544,Lobsters,rust,Rust programming,vtext: NLP in Rust with Python bindings,https://github.com/rth/vtext
545,Lobsters,rust,Rust programming,Risp - Lisp in Rust,https://m.stopa.io/risp-lisp-in-rust-90a0dad5b116
546,Lobsters,rust,Rust programming,Explained: Futures in Rust for Web Development,https://dev.to/gruberb/explained-rust-futures-for-web-development-a10
547,Lobsters,rust,Rust programming,Linkerd's design principles,https://linkerd.io/2019/04/29/linkerd-design-principles/
548,Lobsters,rust,Rust programming,Making Sandspiel,https://maxbittker.com/making-sandspiel
549,Lobsters,rust,Rust programming,Rethinking databases with Noria,https://corecursive.com/030-rethinking-databases-with-jon-gjengset/
550,Lobsters,rust,Rust programming,Stretch: A high performance cross-platform layout engine in Rust,https://vislyhq.github.io/stretch/
551,Lobsters,rust,Rust programming,Giving up on wlroots-rs (rewriting way-cooler in C),http://way-cooler.org/blog/2019/04/29/rewriting-way-cooler-in-c.html
552,Lobsters,rust,Rust programming,e030: Can You See Me Now? Item visibility and pub(<restricted>) as API design tools in Rust,https://newrustacean.com/show_notes/e030/
553,Lobsters,rust,Rust programming,Writing Emacs module in Rust,https://github.com/ubolonton/emacs-module-rs
554,Lobsters,rust,Rust programming,Rust types cheat sheet,https://upsuper.github.io/rust-cheatsheet/
555,Lobsters,rust,Rust programming,What I Learnt Building a Lobsters TUI in Rust,https://www.wezm.net/technical/2019/04/lobsters-tui/
556,Lobsters,rust,Rust programming,Linkerd 2.3: towards Zero-Touch Zero-Trust Networking for Kubernetes,https://linkerd.io/2019/04/16/announcing-linkerd-2.3/
557,Lobsters,rust,Rust programming,Rust's 2019 roadmap,https://blog.rust-lang.org/2019/04/23/roadmap.html
558,Lobsters,rust,Rust programming,Generic returns in Rust,https://blog.jcoglan.com/2019/04/22/generic-returns-in-rust/
559,Lobsters,rust,Rust programming,Rust - Compile Time Memory Safety,https://kkimdev.github.io/posts/2019/04/22/Rust-Compile-Time-Memory-Safety.html
560,Lobsters,rust,Rust programming,Is It Time to Rewrite the Operating System in Rust?,https://www.youtube.com/watch?v=HgtRAbE1nBM
561,Lobsters,rust,Rust programming,Things I Enjoy in Rust: Error Handling,https://blog.jonstodle.com/things-i-enjoy-in-rust-error-handling/
562,Lobsters,rust,Rust programming,"News: Rust 1.33 and 1.34—Moar `const fn`, some `Pin`, and alternative Cargo registries",https://newrustacean.com/show_notes/news/rust_1_33_1_34/
563,Lobsters,rust,Rust programming,AiC: Adventures in consensus,http://smallcultfollowing.com/babysteps/blog/2019/04/19/aic-adventures-in-consensus/
564,Lobsters,rust,Rust programming,The Power of Lifetimes,http://pling.jondgoodwin.com/post/lifetimes/
565,Lobsters,rust,Rust programming,runtime: seamless asynchronous programming in Rust,https://blog.yoshuawuyts.com/runtime/
566,Lobsters,rust,Rust programming,Learning Parser Combinators With Rust,https://bodil.lol/parser-combinators/
567,Lobsters,rust,Rust programming,Build a Roguelike in Rust with libtcod,https://www.youtube.com/watch?v=Q0-xjeEiYw4
