ID,Source,Tag_Code,Tag_Name,Title,Url
568,Lobsters,rust,Rust programming,High performance nudity detection in rust,https://github.com/kpcyrd/nude-rs
569,Lobsters,rust,Rust programming,A z-machine interpreter for text adventure games,https://sterlingdemille.com/encrusted/
570,Lobsters,rust,Rust programming,Rust: beyond the typechecker,https://blog.merigoux.ovh/en/2019/04/16/verifying-rust.html
571,Lobsters,rust,Rust programming,Create a RESTful API with Rust,https://dev.to/gruberb/web-development-with-rust-03-x-create-a-rest-api-3i82
572,Lobsters,rust,Rust programming,Hello world! from Rust Malaysia,https://rust-malaysia.github.io/community/2019/03/11/hello-world.html
573,Lobsters,rust,Rust programming,Announcing Rust 1.34.0,https://blog.rust-lang.org/2019/04/11/Rust-1.34.0.html
574,Lobsters,rust,Rust programming,The Summer of Rust,https://www.youtube.com/watch?v=LjFM8vw3pbU
575,Lobsters,rust,Rust programming,A Love Letter to Rust Macros,https://happens.lol/posts/a-love-letter-to-rust-macros/
576,Lobsters,rust,Rust programming,Noise Explorer Now Generates Rust Implementations with Formally Verified Primitives,https://moderncrypto.org/mail-archive/noise/2019/002013.html
577,Lobsters,rust,Rust programming,e029: I’m Out to C,https://newrustacean.com/show_notes/e029/
578,Lobsters,rust,Rust programming,Idiomatic monads in Rust,https://varkor.github.io/blog/2019/03/28/idiomatic-monads-in-rust.html
579,Lobsters,rust,Rust programming,"Rust, Open-Source and dogs",https://facundoolano.wordpress.com/2019/04/02/rust-open-source-and-dogs/
580,Lobsters,rust,Rust programming,Sonic: a minimalist alternative to Elasticsearch written in Rust,https://notamonadtutorial.com/sonic-a-minimalist-alternative-to-elasticsearch-written-in-rust-7f3612ecb47b
581,Lobsters,rust,Rust programming,Crossing the Rust FFI frontier with Protocol Buffers,https://hacks.mozilla.org/2019/04/crossing-the-rust-ffi-frontier-with-protocol-buffers/
582,Lobsters,rust,Rust programming,Explained: How does async work in Rust?,https://dev.to/gruberb/explained-how-does-async-work-in-rust-46f8
583,Lobsters,rust,Rust programming,An interview with the creator of Gleam: an ML like language for the Erlang VM with a compiler,https://notamonadtutorial.com/an-interview-with-the-creator-of-gleam-an-ml-like-language-for-the-erlang-vm-with-a-compiler-e94775f60dc7
584,Lobsters,rust,Rust programming,Five Super Helpful Rust Things That Nobody Told You About,https://saghm.github.io/five-rust-things/
585,Lobsters,rust,Rust programming,Chaining Functions Without Returning Self,https://randompoison.github.io/posts/returning-self/
586,Lobsters,rust,Rust programming,Using the IOMMU for Safe and SecureUser Space Network Drivers,https://www.net.in.tum.de/fileadmin/bibtex/publications/theses/2019-ixy-iommu.pdf
587,Lobsters,rust,Rust programming,"BoringTun, a userspace WireGuard implementation in Rust",https://blog.cloudflare.com/boringtun-userspace-wireguard-rust/
588,Lobsters,rust,Rust programming,Standardizing WASI: A system interface to run WebAssembly outside the web,https://hacks.mozilla.org/2019/03/standardizing-wasi-a-webassembly-system-interface/
589,Lobsters,rust,Rust programming,How to Debug Rust with Visual Studio Code,https://www.forrestthewoods.com/blog/how-to-debug-rust-with-visual-studio-code/
590,Lobsters,rust,Rust programming,crate2nix - a nix build file generator for rust crates,https://github.com/kolloch/crate2nix
591,Lobsters,rust,Rust programming,Rust is not a good C replacement,https://drewdevault.com/2019/03/25/Rust-is-not-a-good-C-replacement.html
592,Lobsters,rust,Rust programming,My First 3 Weeks of Professional Rust,https://www.wezm.net/technical/2019/03/first-3-weeks-of-professional-rust/
593,Lobsters,rust,Rust programming,Helix: Improve the Performance of Rails with Rust,https://headway.io/blog/helix-improve-the-performance-of-rails-with-rust/
594,Lobsters,rust,Rust programming,DataFusion: A Rust-native Query Engine for Apache Arrow,http://arrow.apache.org/blog/2019/02/04/datafusion-donation/
595,Lobsters,rust,Rust programming,How to combat JavaScript fatigue with Rust,https://dev.to/gruberb/how-to-combat-javascript-fatigue-with-rust-2o5l
596,Lobsters,rust,Rust programming,Why Hashbrown Does A Double-Lookup,https://gankro.github.io/blah/hashbrown-insert/
597,Lobsters,rust,Rust programming,Pijul: Sanakirja database gets its full concurrency model,https://pijul.org/posts/2019-03-20-sanakirja-0.10/
598,Lobsters,rust,Rust programming,Implementing a NES Emulator in Rust,http://www.michaelburge.us/2019/03/18/nes-design.html
599,Lobsters,rust,Rust programming,How to deploy your first Rust web application,https://medium.com/@gruberbastian/rust-for-the-web-02-x-deploy-your-first-app-51d1ed69cbe3
600,Lobsters,rust,Rust programming,A Rust API for librsvg,https://people.gnome.org/~federico/blog/a-rust-api-for-librsvg.html
601,Lobsters,rust,Rust programming,Easy flamegraphs without Perl or pipes,https://github.com/ferrous-systems/flamegraph
602,Lobsters,rust,Rust programming,Paging Implementation,https://os.phil-opp.com/paging-implementation/
603,Lobsters,rust,Rust programming,"Fast, Bump-Allocated Virtual DOMs with Rust and Wasm",https://hacks.mozilla.org/2019/03/fast-bump-allocated-virtual-doms-with-rust-and-wasm/
604,Lobsters,rust,Rust programming,Why I rewrote the mesh generator of Dust3D from Rust to C++,https://blogs.dust3d.org/2019/03/13/why-i-rewrote-the-mesh-generator-of-dust3d-from-rust-to-cplusplus/
605,Lobsters,rust,Rust programming,Implementing a static stack usage analysis tool,https://blog.japaric.io/stack-analysis/
606,Lobsters,rust,Rust programming,How we made Haskell search strings as fast as Rust,https://tech.channable.com/posts/2019-03-13-how-we-made-haskell-search-strings-as-fast-as-rust.html
607,Lobsters,rust,Rust programming,A Coding Retreat and Getting Embedded Rust Running on a SensorTag,https://www.wezm.net/technical/2019/03/sensortag-embedded-rust-coding-retreat/
608,Lobsters,rust,Rust programming,A Case for Oxidation: The Rust Programming Language,https://www.youtube.com/watch?v=cDFSrVhnZKo
609,Lobsters,rust,Rust programming,"ncspot, ncurses spotify client written in rust",https://github.com/hrkfdn/ncspot
610,Lobsters,rust,Rust programming,Introducing @now/rust,https://zeit.co/blog/introducing-now-rust
611,Lobsters,rust,Rust programming,Rust Programming Tipz,https://github.com/spacejam/elements-of-rust
612,Lobsters,rust,Rust programming,Intro to web programming in Rust for NodeJS developers,https://medium.com/@gruberbastian/intro-to-web-programming-in-rust-for-nodejs-developers-1a9c048c4de1
613,Lobsters,rust,Rust programming,Moving from NodeJS to Rust in 2019,https://medium.com/@foreach/moving-from-nodejs-to-rust-in-2019-62c0b85d2fa7
614,Lobsters,rust,Rust programming,Oxide: The Essence of Rust,https://arxiv.org/pdf/1903.00982.pdf
615,Lobsters,rust,Rust programming,Proposal: New channels for Rusts standard library,https://stjepang.github.io/2019/03/02/new-channels.html
616,Lobsters,rust,Rust programming,Building fast interpreters in Rust,https://blog.cloudflare.com/building-fast-interpreters-in-rust/
617,Lobsters,rust,Rust programming,Implications of Rewriting a Browser Component in Rust,https://hacks.mozilla.org/2019/02/rewriting-a-browser-component-in-rust/
618,Lobsters,rust,Rust programming,Building a fast Electron app with Rust,https://keminglabs.com/blog/building-a-fast-electron-app-with-rust/
619,Lobsters,rust,Rust programming,Announcing Rust 1.33.0,https://blog.rust-lang.org/2019/02/28/Rust-1.33.0.html
620,Lobsters,rust,Rust programming,I Still Make Silly Mistakes,https://newrustacean.com/show_notes/bonus/_13/
621,Lobsters,rust,Rust programming,Fuchsia is not unix,https://github.com/rust-lang/rust/issues/58590
622,Lobsters,rust,Rust programming,Community makes Rust an easy choice for npm,https://www.rust-lang.org/static/pdfs/Rust-npm-Whitepaper.pdf
623,Lobsters,rust,Rust programming,"e028: Meet My Associates—Rust's associated items: functions and methods, constants, and types",https://newrustacean.com/show_notes/e028/
624,Lobsters,rust,Rust programming,r/rust - Rust 2019: Rust Audio,https://www.reddit.com/r/rust/comments/aua2tb/rust_2019_rust_audio/
625,Lobsters,rust,Rust programming,Comparing C and Rust network protocol exercises,https://ayende.com/blog/185859-A/comparing-c-and-rust-network-protocol-exercises
626,Lobsters,rust,Rust programming,Getting started with Rust FFI,https://rushsteve1.us/wp/getting-started-with-rust-ffi/
627,Lobsters,rust,Rust programming,Stacked Borrows Implemented,https://www.ralfj.de/blog/2018/11/16/stacked-borrows-implementation.html
628,Lobsters,rust,Rust programming,Cross-compiling Rust code to Minix,https://iandouglasscott.com/2019/02/18/cross-compiling-rust-code-to-minix/
629,Lobsters,rust,Rust programming,Moving from Ruby to Rust,https://deliveroo.engineering/2019/02/14/moving-from-ruby-to-rust.html
630,Lobsters,rust,Rust programming,Replacing a hot path in your app's JavaScript with WebAssembly,https://developers.google.com/web/updates/2019/02/hotpath-with-wasm
631,Lobsters,rust,Rust programming,"No, the problem isnt bad coders",https://medium.com/@sgrif/no-the-problem-isnt-bad-coders-ed4347810270
632,Lobsters,rust,Rust programming,Writing a Rust Roguelike for the Desktop and the Web,https://aimlesslygoingforward.com/blog/2019/02/09/writing-a-rust-roguelike-for-the-desktop-and-the-web/
633,Lobsters,rust,Rust programming,Rust: A unique perspective,https://limpet.net/mbrubeck/2019/02/07/rust-a-unique-perspective.html
634,Lobsters,rust,Rust programming,Zero-Knowledge Proofs in WebAssembly,https://zkwasm.kobi.one/
635,Lobsters,rust,Rust programming,osaka.rs - rust async without the noise,https://aep.github.io/rust-async-without-the-noise/
636,Lobsters,rust,Rust programming,A Python Interpreter Written in Rust,https://github.com/RustPython/RustPython
637,Lobsters,rust,Rust programming,"broot, a new way to browse directories",https://github.com/Canop/broot
638,Lobsters,rust,Rust programming,Enclave Development Platform,https://edp.fortanix.com/
639,Lobsters,rust,Rust programming,"galacritty, GTK terminal emulator based on Alacritty",https://github.com/myfreeweb/galacritty
640,Lobsters,rust,Rust programming,Lock-free Rust: Crossbeam in 2019,https://stjepang.github.io/2019/01/29/lock-free-rust-crossbeam-in-2019.html
641,Lobsters,rust,Rust programming,Embedded Rust Experiments - Is my STM32 MCU running fast?,http://nercury.github.io/rust/embedded/experiments/2019/01/27/rust-embedded-02-measuring-the-clock.html
642,Lobsters,rust,Rust programming,Rust n-body benchmark ranks #1,https://www.reddit.com/r/rust/comments/akgmef/rust_nbody_benchmark_ranks_1/
643,Lobsters,rust,Rust programming,My Rust Powered linux.conf.au E-Paper Badge,http://www.wezm.net/technical/2019/01/linux-conf-au-rust-epaper-badge/
644,Lobsters,rust,Rust programming,Embedding WebAssembly in your Rust application Wasmer,https://medium.com/wasmer/executing-webassembly-in-your-rust-application-d5cd32e8ce46
645,Lobsters,rust,Rust programming,A case where Rust is safer than Haskell,https://www.fpcomplete.com/blog/when-rust-is-safer-than-haskell
646,Lobsters,rust,Rust programming,Savoury implementation of the QUIC transport protocol,https://github.com/cloudflare/quiche
647,Lobsters,rust,Rust programming,News: Rust 1.32,https://newrustacean.com/show_notes/news/rust_1_32/
648,Lobsters,rust,Rust programming,Taglib Rust bindings,https://github.com/ebassi/taglib-rust
649,Lobsters,rust,Rust programming,Quinn 0.2.0: QUIC protocol implementation in Rust,https://github.com/djc/quinn/releases/tag/0.2.0
650,Lobsters,rust,Rust programming,Is It Time to Rewrite the Operating System in Rust?,https://www.infoq.com/presentations/os-rust
651,Lobsters,rust,Rust programming,Leaving Mozilla and (most of) the Rust project,http://www.ncameron.org/blog/leaving-mozilla-and-most-of-the-rust-project/
652,Lobsters,rust,Rust programming,Building Spotifyd on NetBSD,https://atomicules.co.uk/2019/01/17/Building-Spotifyd-on-NetBSD.html
653,Lobsters,rust,Rust programming,The Evolution of a Rust Programmer,http://antoyo.ml/evolution-rust-programmer
654,Lobsters,rust,Rust programming,"The state of ggez [Rust game framework], 2019",https://wiki.alopex.li/TheStateOfGGEZ2019
655,Lobsters,rust,Rust programming,"pushb: like pushd/popd, but for git branches",https://github.com/pwoolcoc/pushb
656,Lobsters,rust,Rust programming,"News: Rust 1.31 and the 2018 Edition, Part II",https://newrustacean.com/show_notes/news/rust_1_31/part_2/
657,Lobsters,rust,Rust programming,Writing an OS in Rust: Introduction to Paging,https://os.phil-opp.com/paging-introduction/
658,Lobsters,rust,Rust programming,Tutorial - Rust and WebAssembly,https://rustwasm.github.io/book/game-of-life/introduction.html
659,Lobsters,rust,Rust programming,Monotonic clocks are not monotonic,https://github.com/rust-lang/rust/pull/56988
660,Lobsters,rust,Rust programming,Toshi: A Full Text Search Engine in Rust Based on Tantivy,https://github.com/toshi-search/Toshi
661,Lobsters,rust,Rust programming,hexyl is a new command-line hex viewer,https://github.com/sharkdp/hexyl
662,Lobsters,rust,Rust programming,Rust programming language: Seven reasons why you should learn it in 2019,https://www.techrepublic.com/article/rust-programming-language-seven-reasons-why-you-should-learn-it-in-2019/
663,Lobsters,rust,Rust programming,"News: Rust 1.31 and the 2018 Edition, Part I",https://newrustacean.com/show_notes/news/rust_1_31/part_1/index.html
664,Lobsters,rust,Rust programming,"thank u, next",https://words.steveklabnik.com/thank-u-next
665,Lobsters,rust,Rust programming,WebGL + Rust: Basic Water Tutorial,http://www.chinedufn.com/3d-webgl-basic-water-tutorial/
666,Lobsters,rust,Rust programming,Rust at speed — building a fast concurrent database,https://www.youtube.com/watch?v=s19G6n0UjsM
667,Lobsters,rust,Rust programming,Leveraging Rust types for modular specification and verification,https://www.research-collection.ethz.ch/handle/20.500.11850/311092
668,Lobsters,rust,Rust programming,Making MPD index SoundCloud,https://polyfloyd.net/post/soundcloud-fuse-mpd/
669,Lobsters,rust,Rust programming,Distributing Standalone Python Applications,https://gregoryszorc.com/blog/2018/12/18/distributing-standalone-python-applications/
670,Lobsters,rust,Rust programming,Interview: Integer32 (Carol Nichols || Goulding and Jake Goulding),https://newrustacean.com/show_notes/interview/integer32/
671,Lobsters,rust,Rust programming,"Comparing Pythagorean triples in C++, D, and Rust",https://atilanevesoncode.wordpress.com/2018/12/31/comparing-pythagorean-triples-in-c-d-and-rust/
672,Lobsters,rust,Rust programming,Easy Postgres Extensions in Rust,https://bluejekyll.github.io/blog/rust/2018/12/27/announcing-pg-extend.html
673,Lobsters,rust,Rust programming,A Rusty Advent of Code: My AOC Experience with the Rust Community,https://cprimozic.net/blog/a-rusty-aoc/
674,Lobsters,rust,Rust programming,Rust 2019 and beyond: limits to (some) growth,https://graydon2.dreamwidth.org/263429.html
675,Lobsters,rust,Rust programming,swc: rust port of babel and closure compiler,https://github.com/swc-project/swc
676,Lobsters,rust,Rust programming,Copying someone else's performance tweak,https://dev.to/notriddle/copying-someone-elses-performance-tweak-5g5h
677,Lobsters,rust,Rust programming,Procedural Macros in Rust 2018,https://blog.rust-lang.org/2018/12/21/Procedural-Macros-in-Rust-2018.html
678,Lobsters,rust,Rust programming,Organizational Debt -- Rust 2019 blog post,https://boats.gitlab.io/blog/post/rust-2019/
679,Lobsters,rust,Rust programming,"Sandspiel, a falling sand game built in Rust+WebGL",https://sandspiel.club
680,Lobsters,rust,Rust programming,The Tale of a Bug in Arc: Synchronization and Data Races,https://www.ralfj.de/blog/2018/07/13/arc-synchronization.html
681,Lobsters,rust,Rust programming,Rust and WebAssembly in 2019,http://fitzgeraldnick.com/2018/12/14/rust-and-webassembly-in-2019.html
682,Lobsters,rust,Rust programming,Rusta Rhymes - Ferris Crab (Rust Raps 2018 Edition),http://fitzgeraldnick.com/2018/12/13/rust-raps.html
683,Lobsters,rust,Rust programming,"Async in Rust, circa 2018",https://rust-lang-nursery.github.io/wg-net/2018/12/13/async-update.html
684,Lobsters,rust,Rust programming,"Scale By The Bay 2018: Bryan Cantrill, Rust and Other Interesting Things",https://www.youtube.com/watch?v=2wZ1pCpJUIM
685,Lobsters,rust,Rust programming,Announcing Rust 1.31 and Rust 2018,https://blog.rust-lang.org/2018/12/06/Rust-1.31-and-rust-2018.html
686,Lobsters,rust,Rust programming,Reflecting on Rust and WebAssembly in 2018,https://rustwasm.github.io/2018/12/06/reflecting-on-rust-and-wasm-in-2018.html
687,Lobsters,rust,Rust programming,Rust 2018 is here… but what is it?,https://hacks.mozilla.org/2018/12/rust-2018-is-here/
688,Lobsters,rust,Rust programming,Patterns of Refactoring C to Rust: The case of librsvg,https://people.gnome.org/~federico/blog/docs/fmq-refactoring-c-to-rust.pdf
689,Lobsters,rust,Rust programming,How I Wrote a Modern C++ Library in Rust,https://hsivonen.fi/modern-cpp-in-rust/
690,Lobsters,rust,Rust programming,Bao - a general purpose cryptographic tree hash built on BLAKE2,https://www.youtube.com/watch?v=Dya9c2DXMqQ
691,Lobsters,rust,Rust programming,Language package managers: mix vs cargo,http://txti.es/wzic4
692,Lobsters,rust,Rust programming,Trust Me; I Promise! – An intro to unsafe Rust and Rust's idea of safety,https://newrustacean.com/show_notes/e027/
693,Lobsters,rust,Rust programming,Rust and WebAssembly,https://rustwasm.github.io/book/
694,Lobsters,rust,Rust programming,Rust Runtime for AWS Lambda,https://aws.amazon.com/blogs/opensource/rust-runtime-for-aws-lambda/
695,Lobsters,rust,Rust programming,A new look for rust-lang.org,https://blog.rust-lang.org/2018/11/29/a-new-look-for-rust-lang-org.html
696,Lobsters,rust,Rust programming,Rust Quiz,https://dtolnay.github.io/rust-quiz
697,Lobsters,rust,Rust programming,Haskell and Rust,https://www.fpcomplete.com/blog/2018/11/haskell-and-rust
698,Lobsters,rust,Rust programming,Fearless Low-Latency Audio Synthesis,https://synthesize.rs/nov-2018-talk
699,Lobsters,rust,Rust programming,Sequoia: The Seeding Sees The Light Of Day,https://sequoia-pgp.org/blog/2018/11/26/initial-release/
700,Lobsters,rust,Rust programming,RustFest Rome livestream,https://rome.rustfest.eu/livetime/
701,Lobsters,rust,Rust programming,Still in love with Rust,https://dpc.pw/still-in-love-with-rust
702,Lobsters,rust,Rust programming,Fastly Labs -- Terrarium,https://www.fastlylabs.com/
703,Lobsters,rust,Rust programming,typed-html: type-checked JSX for Rust,https://github.com/bodil/typed-html
704,Lobsters,rust,Rust programming,A verified email address will be required to publish to crates.io starting on 2019-02-28,https://users.rust-lang.org/t/a-verified-email-address-will-be-required-to-publish-to-crates-io-starting-on-2019-02-28/22425
705,Lobsters,rust,Rust programming,What are some problems that would demonstrate Rust's speed advantage? More context in post,/s/dipydh/what_are_some_problems_would_demonstrate
706,Lobsters,rust,Rust programming,Bringing Elm’s architecture to Rust and Webassembly,https://sindrejohansen.no/blog/willow/rust/elm/2018/11/16/willow-elm-in-rust.html
707,Lobsters,rust,Rust programming,"Porting FlatBuffers to Rust (Rust Bay Area - November 13th, 2018)",https://www.youtube.com/watch?v=YsiQDX20lXI
708,Lobsters,rust,Rust programming,Rust 1.29 and 1.30 – procedural macros and better paths (and a progress bar for Cargo!),https://newrustacean.com/show_notes/news/rust_1_29_1_30/
709,Lobsters,rust,Rust programming,Program Synthesis is Possible in Rust,http://fitzgeraldnick.com/2018/11/15/program-synthesis-is-possible-in-rust.html
710,Lobsters,rust,Rust programming,Things Rust doesn’t let you do,https://medium.com/@GolDDranks/things-rust-doesnt-let-you-do-draft-f596a3c740a5
711,Lobsters,rust,Rust programming,Wavelet – 10k+ TPS DAG-Based Ledger with Proof-of-Stake & Smart Contract Support,https://medium.com/perlin-network/wavelet-pre-alpha-launch-7e6c042a0768
712,Lobsters,rust,Rust programming,Implementing Rust’s std::sync::Mutex in D,https://atilanevesoncode.wordpress.com/2018/11/06/implementing-rusts-stdsyncmutex-in-d/
713,Lobsters,rust,Rust programming,How to speed up the Rust compiler in 2018: NLL edition,https://blog.mozilla.org/nnethercote/2018/11/06/how-to-speed-up-the-rust-compiler-in-2018-nll-edition/
714,Lobsters,rust,Rust programming,A New Way of Thinking,https://boakye.yiadom.org/rust/new/
715,Lobsters,rust,Rust programming,A hammer you can only hold by the handle,https://blog.systems.ethz.ch/blog/2018/a-hammer-you-can-only-hold-by-the-handle.html
716,Lobsters,rust,Rust programming,MIR-based borrowck is almost here,http://smallcultfollowing.com/babysteps/blog/2018/10/31/mir-based-borrowck-is-almost-here/
717,Lobsters,rust,Rust programming,"A minimal, fast alternative to 'du -sh'",https://github.com/sharkdp/dup
718,Lobsters,rust,Rust programming,Azul GUI Framework for Rust,https://azul.rs/
719,Lobsters,rust,Rust programming,Parsing logs 230x faster with Rust,https://andre.arko.net/2018/10/25/parsing-logs-230x-faster-with-rust/
720,Lobsters,rust,Rust programming,Summer School With The Rust Compiler,http://patshaughnessy.net/2018/10/24/summer-school-with-the-rust-compiler
721,Lobsters,rust,Rust programming,Announcing Rust 1.30 - The Rust Programming Language Blog,https://blog.rust-lang.org/2018/10/25/Rust-1.30.0.html
722,Lobsters,rust,Rust programming,Towards fearless SIMD,https://raphlinus.github.io/rust/simd/2018/10/19/fearless-simd.html
723,Lobsters,rust,Rust programming,"Rust can be difficult to learn and frustrating, but it’s also the most exciting thing in software development in a long time",https://www.influxdata.com/blog/rust-can-be-difficult-to-learn-and-frustrating-but-its-also-the-most-exciting-thing-in-software-development-in-a-long-time/
724,Lobsters,rust,Rust programming,"Amethyst 0.9: Rendering 100,000 sprites at 60fps",https://www.amethyst.rs/blog/release-0-9/
725,Lobsters,rust,Rust programming,Multithreading Rust and Wasm,https://rustwasm.github.io/2018/10/24/multithreading-rust-and-wasm.html
726,Lobsters,rust,Rust programming,Kick the Tires - Rust Crash Course lesson 1,https://www.snoyman.com/blog/2018/10/rust-crash-course-01-kick-the-tires
727,Lobsters,rust,Rust programming,Sandcrust: Automatic Sandboxing of Unsafe Components in Rust (2017),https://os.inf.tu-dresden.de/papers_ps/plos2017-lamowski-rust-sandboxing-paper.pdf
728,Lobsters,rust,Rust programming,Writing an OS in Rust: Hardware Interrupts,https://os.phil-opp.com/hardware-interrupts/
729,Lobsters,rust,Rust programming,An introduction to the McLeod Pitch Method,https://github.com/sevagh/mpm-rs
730,Lobsters,rust,Rust programming,Serverless Rust with AWS Lambda and WebAssembly,https://blog.scottlogic.com/2018/10/18/serverless-rust.html
731,Lobsters,rust,Rust programming,Is Rust functional?,https://www.fpcomplete.com/blog/2018/10/is-rust-functional
732,Lobsters,rust,Rust programming,Rust and the Three Laws of Informatics,https://medium.com/@schemouil/rust-and-the-three-laws-of-informatics-4324062b322b
733,Lobsters,rust,Rust programming,Introducing the Rust crash course,https://www.snoyman.com/blog/2018/10/introducing-rust-crash-course
734,Lobsters,rust,Rust programming,Oxidizing Python: Speeding up URL quoting by 10x using Rust,https://tech.blue-yonder.com/oxidizing-python-speeding-up-urlquoting-by-using-rust/
735,Lobsters,rust,Rust programming,Garbage collection as a Rust library,https://boats.gitlab.io/blog/post/shifgrethor-i/
736,Lobsters,rust,Rust programming,Rust Web Survey,https://docs.google.com/forms/d/e/1FAIpQLSf9KCUs-8G87pHB08lM8-iXcDSY_VttOI0PvkKseHaZseCGGA/viewform
737,Lobsters,rust,Rust programming,Evaluation Context for Rust,https://github.com/google/evcxr
738,Lobsters,rust,Rust programming,The Rust Web Survey,https://twitter.com/rustnetwg/status/1052072484353298432
739,Lobsters,rust,Rust programming,The success of Go heralds that of Rust,https://medium.com/@george3d6/the-success-of-go-heralds-that-of-rust-73cb2e4c0500
740,Lobsters,rust,Rust programming,Notes on Type Layouts and ABIs in Rust,https://gankro.github.io/blah/rust-layouts-and-abis/
741,Lobsters,rust,Rust programming,Rust has a static garbage collector,https://words.steveklabnik.com/borrow-checking-escape-analysis-and-the-generational-hypothesis
742,Lobsters,rust,Rust programming,Remacs continues to improve,http://db48x.net/rust-remacs-2018/
743,Lobsters,rust,Rust programming,"Noria: dynamic, partially-stateful data-flow for high-performance web applications",https://www.usenix.org/conference/osdi18/presentation/gjengset
744,Lobsters,rust,Rust programming,How I’ve found vulnerability in a popular Rust crate (and you can too),https://medium.com/@shnatsel/how-ive-found-vulnerability-in-a-popular-rust-crate-and-you-can-too-3db081a67fb
745,Lobsters,rust,Rust programming,Property testing framework for Rust,https://docs.rs/proptest/0.7.0/proptest/index.html
746,Lobsters,rust,Rust programming,Introducing Ruukh Framework,https://sharadchand.com/2018/10/03/ruukh-framework.html
747,Lobsters,rust,Rust programming,Lessons learned on writing web applications completely in Rust,https://medium.com/@saschagrunert/lessons-learned-on-writing-web-applications-completely-in-rust-2080d0990287
748,Lobsters,rust,Rust programming,lolbench: automagically and empirically discovering Rust performance regressions,https://blog.anp.lol/rust/2018/09/29/lolbench/
749,Lobsters,rust,Rust programming,An unsafety bug in rust's stdlib,/s/i0jf4b/unsafety_bug_rust_s_stdlib
750,Lobsters,rust,Rust programming,The relative performance of C and Rust,http://dtrace.org/blogs/bmc/2018/09/28/the-relative-performance-of-c-and-rust/
