ID,Source,Tag_Code,Tag_Name,Title,Url
751,Lobsters,rust,Rust programming,Rust testanything: generating results in the Test Anything Protocol (TAP),https://github.com/Cigna/TAP-Rust
752,Lobsters,rust,Rust programming,Announcing the web-sys crate: raw bindings to all the Web’s APIs,https://rustwasm.github.io/2018/09/26/announcing-web-sys.html
753,Lobsters,rust,Rust programming,Hands On With Linkerd 2.0 - Kubernetes,https://kubernetes.io/blog/2018/09/18/hands-on-with-linkerd-2.0/
754,Lobsters,rust,Rust programming,Cargo's crate index: upcoming squash into one commit,https://internals.rust-lang.org/t/cargos-crate-index-upcoming-squash-into-one-commit/8440
755,Lobsters,rust,Rust programming,The evolution of performance in ppbert,https://vfoley.xyz/ppbert-perf-evolution/
756,Lobsters,rust,Rust programming,Falling in love with Rust,http://dtrace.org/blogs/bmc/2018/09/18/falling-in-love-with-rust/
757,Lobsters,rust,Rust programming,Alacritty now supports scrollback,https://jwilm.io/blog/alacritty-lands-scrollback/
758,Lobsters,rust,Rust programming,The 9p protocol as a serde format and message types,https://github.com/KevinMGranger/nine
759,Lobsters,rust,Rust programming,Iridium VM: A BEAM like VM project/tutorial written in Rust,https://blog.subnetzero.io/project/iridium-vm/
760,Lobsters,rust,Rust programming,"You can't ""turn off the borrow checker"" in Rust",https://words.steveklabnik.com/you-can-t-turn-off-the-borrow-checker-in-rust
761,Lobsters,rust,Rust programming,RustConf 2018 Videos,http://www.youtube.com/playlist?list=PL85XCvVPmGQi3tivxDDF1hrT9qr5hdMBZ
762,Lobsters,rust,Rust programming,Integrating Rust into Tor: Successes and Challenges,http://confreaks.tv/videos/rustconf2018-integrating-rust-into-tor-successes-and-challenges
763,Lobsters,rust,Rust programming,Rust Faster SIMD edition,https://llogiq.github.io/2018/09/06/fast.html
764,Lobsters,rust,Rust programming,Official Rust support for the FlatBuffers serialization format,https://github.com/google/flatbuffers/pull/4898
765,Lobsters,rust,Rust programming,Primitives in Rust are Weird (and Cool),https://speice.io/2018/09/primitives-in-rust-are-weird.html
766,Lobsters,rust,Rust programming,Bat. A cat(1) clone with wings,https://github.com/sharkdp/bat
767,Lobsters,rust,Rust programming,Rust Factory Without Box (Trait Object),https://singpolyma.net/2018/09/rust-factory-without-box-trait-object/
768,Lobsters,rust,Rust programming,WebRender (and PathFinder) in Firefox,http://pcwalton.github.io/slides/201808-webrender/
769,Lobsters,rust,Rust programming,Verifying Rust Programs with SMACK,http://soarlab.org/publications/atva2018-bhr.pdf
770,Lobsters,rust,Rust programming,CVE-2018-1000657 - Arbitrary code execution in a core Rust library,https://cve.mitre.org/cgi-bin/cvename.cgi?name=%20CVE-2018-1000657
771,Lobsters,rust,Rust programming,"News: Rust 1.28—Stable #[global_allocator], more Rust 2018 Edition schedule news, video learning res",https://newrustacean.com/show_notes/news/rust_1_28/index.html
772,Lobsters,rust,Rust programming,"Never patterns, exhaustive matching, and uninhabited types (oh my!)",http://smallcultfollowing.com/babysteps/blog/2018/08/13/never-patterns-exhaustive-matching-and-uninhabited-types-oh-my/
773,Lobsters,rust,Rust programming,How Rust’s standard library was vulnerable for years and nobody noticed,https://medium.com/@shnatsel/how-rusts-standard-library-was-vulnerable-for-years-and-nobody-noticed-aebf0503c3d6
774,Lobsters,rust,Rust programming,Zero cost stack overflow protection for ARM Cortex-M devices,https://blog.japaric.io/stack-overflow-protection/
775,Lobsters,rust,Rust programming,The Summer of RUST,https://www.youtube.com/watch?v=LjFM8vw3pbU
776,Lobsters,rust,Rust programming,Syntax diagram generator,https://lukaslueg.github.io/macro_railroad_wasm_demo/
777,Lobsters,rust,Rust programming,How to alleviate the pain of Rust compile times,https://vfoley.xyz/rust-compile-speed-tips/
778,Lobsters,rust,Rust programming,jrust: a Rust macro which turns Java syntax in to Rust,https://gitlab.com/jD91mZM2/jrust
779,Lobsters,rust,Rust programming,"Kickstart, a fast and simple project template bootstrapper",https://blog.artemix.org/article/show/kickstart
780,Lobsters,rust,Rust programming,Launching the 2018 State of Rust Survey,https://blog.rust-lang.org/2018/08/08/survey.html
781,Lobsters,rust,Rust programming,Stacked Borrows: An Aliasing Model For Rust,https://www.ralfj.de/blog/2018/08/07/stacked-borrows.html
782,Lobsters,rust,Rust programming,Rust and the Case of the Redundant Comparison,https://blog.dend.ro/rust-and-the-case-of-the-redundant-comparison/
783,Lobsters,rust,Rust programming,Implementing a JIT-compiler with Rust,https://dinfuehr.github.io/blog/dora-implementing-a-jit-compiler-with-rust/
784,Lobsters,rust,Rust programming,Announcing Rust 1.28,https://blog.rust-lang.org/2018/08/02/Rust-1.28.html
785,Lobsters,rust,Rust programming,Fastcat - A Faster `cat` Implementation Using Splice,https://matthias-endler.de/2018/fastcat/
786,Lobsters,rust,Rust programming,"Should C Programmers learn C++, Go or Rust?",http://ds9a.nl/articles/posts/cpp-rust-go/
787,Lobsters,rust,Rust programming,Rust compiler cannot be built without test failures on Debian and Fedora,https://salsa.debian.org/rust-team/rust/blob/debian/sid/debian/NEWS#L1-29
788,Lobsters,rust,Rust programming,Streaming UTF-8 in Haskell and Rust,https://www.fpcomplete.com/blog/2018/07/streaming-utf8-haskell-rust
789,Lobsters,rust,Rust programming,Writing an OS in Rust: Double Fault Exceptions,https://os.phil-opp.com/double-fault-exceptions/
790,Lobsters,rust,Rust programming,Percy - A modular toolkit for building isomorphic web apps with Rust + WebAssembly,https://github.com/chinedufn/percy
791,Lobsters,rust,Rust programming,Version selection in Cargo,http://aturon.github.io/2018/07/25/cargo-version-selection/
792,Lobsters,rust,Rust programming,rutie: A bridge betweeh ruby and rust,https://github.com/danielpclark/rutie
793,Lobsters,rust,Rust programming,Natively run OCaml from Rust,https://blog.s-m.ac/ocaml-rust-ffi/
794,Lobsters,rust,Rust programming,Signing my git commits without GPG in pure Rust,https://boats.gitlab.io/blog/post/signing-commits-without-gpg/
795,Lobsters,rust,Rust programming,Futures 0.3.0-alpha.1,https://rust-lang-nursery.github.io/futures-rs/blog/2018/07/19/futures-0.3.0-alpha.1.html
796,Lobsters,rust,Rust programming,Deploying Rust with Docker and Kubernetes,https://www.fpcomplete.com/blog/2018/07/deploying-rust-with-docker-and-kubernetes
797,Lobsters,rust,Rust programming,Auditing popular crates: how a one-line unsafe has nearly ruined everything,https://www.reddit.com/r/rust/comments/8zpp5f/auditing_popular_crates_how_a_oneline_unsafe_has/
798,Lobsters,rust,Rust programming,Async & Await in Rust,https://boats.gitlab.io/blog/post/2018-04-06-async-await-final/
799,Lobsters,rust,Rust programming,rav1e: The fastest and safest AV1 encoder,https://github.com/xiph/rav1e
800,Lobsters,rust,Rust programming,A web application completely in Rust,https://medium.com/@saschagrunert/a-web-application-completely-in-rust-6f6bdb6c4471
801,Lobsters,rust,Rust programming,The State of Rust on Haiku - July 2018,https://www.haiku-os.org/blog/nielx/2018-07-05_the_state_of_rust_on_haiku/
802,Lobsters,rust,Rust programming,Systems Languages: An Experience Report,https://blog.usejournal.com/systems-languages-an-experience-report-d008b2b12628
803,Lobsters,rust,Rust programming,"Rust Traits Deep Dive, Part III: Closure traits, impl trait, dyn trait, and object safety!",https://newrustacean.com/show_notes/e025/index.html
804,Lobsters,rust,Rust programming,Type-safe & high-perf distributed actor systems with Rust,https://www.youtube.com/watch?v=LiIoE8ArACs
805,Lobsters,rust,Rust programming,Josephine: Using JavaScript to safely manage the lifetimes of Rust data,https://arxiv.org/abs/1807.00067
806,Lobsters,rust,Rust programming,A FUSE file system based on Google Drive,https://github.com/harababurel/gcsf
807,Lobsters,rust,Rust programming,c2rust vs Corrode,https://jamey.thesharps.us/2018/06/30/c2rust-vs-corrode/
808,Lobsters,rust,Rust programming,Rust Pointers for C Programmers,http://blahg.josefsipek.net/?p=580
809,Lobsters,rust,Rust programming,News: Rust 1.27,https://newrustacean.com/show_notes/news/rust_1_27/
810,Lobsters,rust,Rust programming,The Story of Stylo: Replacing Firefox's CSS engine with Rust,https://www.youtube.com/watch?v=Y6SSTRr2mFU
811,Lobsters,rust,Rust programming,Citybound,http://cityboundsim.com/
812,Lobsters,rust,Rust programming,Rust 2018 Edition alpha preview,https://internals.rust-lang.org/t/rust-2018-an-early-preview/7776
813,Lobsters,rust,Rust programming,Introducing feL4: Rust Programs for the seL4 Microkernel,https://users.rust-lang.org/t/introducing-fel4-rust-programs-for-the-sel4-microkernel/17897
814,Lobsters,rust,Rust programming,"`llvm-tools`, a new rustup component for binary inspection (objdump, nm, size) and profiling (profdata)",https://internals.rust-lang.org/t/llvm-tools-a-new-rustup-component-for-binary-inspection-objdump-nm-size-and-profiling-profdata/7830
815,Lobsters,rust,Rust programming,Nebulet | More answers to questions that you may or may not have asked.,https://lsneff.me/more-answers.html
816,Lobsters,rust,Rust programming,nannou.cc – A creative-coding toolkit that enables easy access to high-performance graphics and audio.,http://nannou.cc/
817,Lobsters,rust,Rust programming,A Rusty Go at Channels,https://gsquire.github.io/static/post/a-rusty-go-at-channels/
818,Lobsters,rust,Rust programming,RustSec: Security advisory database for Rust crates,https://github.com/RustSec
819,Lobsters,rust,Rust programming,Our Vision for Rust and WebAssembly,https://rustwasm.github.io/2018/06/25/vision-for-rust-and-wasm.html
820,Lobsters,rust,Rust programming,Oxy - A Security Focused Remote Access Tool,https://oxy-secure.app/
821,Lobsters,rust,Rust programming,Translating c to rust,https://c2rust.com/
822,Lobsters,rust,Rust programming,Compiler Explorer (think CodePen for C(++)/D/Go/Rust/Swift/Haskell disassembly),https://gcc.godbolt.org/
823,Lobsters,rust,Rust programming,Announcing Rust 1.27,https://blog.rust-lang.org/2018/06/21/Rust-1.27.html
824,Lobsters,rust,Rust programming,"Traits Deep Dive, Part II",https://newrustacean.com/show_notes/e024/index.html
825,Lobsters,rust,Rust programming,Building better compression together with DivANS,http://blogs.dropbox.com/tech/2018/06/building-better-compression-together-with-divans/
826,Lobsters,rust,Rust programming,Rust is Not so Hairy,https://nevi.me/rust-is-not-so-hairy/
827,Lobsters,rust,Rust programming,A Trick For Test Maintenance,https://matklad.github.io//2018/06/18/a-trick-for-test-maintenance.html
828,Lobsters,rust,Rust programming,kvakvs/ErlangRT,https://github.com/kvakvs/ErlangRT
829,Lobsters,rust,Rust programming,A Web Server Unikernel in Rust,https://rajiv256.github.io/projects/ouros/
830,Lobsters,rust,Rust programming,Rust Distilled: An Expressive Tower of Languages,https://arxiv.org/abs/1806.02693
831,Lobsters,rust,Rust programming,First Impressions of the Rust Programming Language,http://jakob.space/blog/post/First+Impressions+of+the+Rust+Programming+Language
832,Lobsters,rust,Rust programming,"Crates.rs — a new, faster crate index website",https://users.rust-lang.org/t/crates-rs-a-new-faster-crate-index-website/17876
833,Lobsters,rust,Rust programming,How to speed up the Rust compiler some more in 2018,https://blog.mozilla.org/nnethercote/2018/06/05/how-to-speed-up-the-rust-compiler-some-more-in-2018/
834,Lobsters,rust,Rust programming,The Rust Way of OS Development,https://phil-opp.github.io/talk-konstanz-may-2018/
835,Lobsters,rust,Rust programming,Crates You Should Know: The wasm tools,https://newrustacean.com/show_notes/cysk/wasm/index.html
836,Lobsters,rust,Rust programming,Building Reliable Infrastructure in Rust,https://www.youtube.com/watch?v=hMJEPWcSD8w
837,Lobsters,rust,Rust programming,I don't need types,https://dmerej.info/blog/post/trying-mypy/
838,Lobsters,rust,Rust programming,Event Sourcing with Aggregates in Rust,https://medium.com/capital-one-developers/event-sourcing-with-aggregates-in-rust-4022af41cf67
839,Lobsters,rust,Rust programming,Why Nebulet?,http://lsneff.me/why-nebulet/
840,Lobsters,rust,Rust programming,Compile Time Prevention of SQL-Injections in Rust,https://polyfloyd.net/post/compile-time-prevention-of-sql-injections/
841,Lobsters,rust,Rust programming,The Rust compiler is getting faster,https://blog.mozilla.org/nnethercote/2018/05/17/the-rust-compiler-is-getting-faster/
842,Lobsters,rust,Rust programming,Rust turns three,https://blog.rust-lang.org/2018/05/15/Rust-turns-three.html
843,Lobsters,rust,Rust programming,"nebulet: a microkernel that implements a WebAssembly ""usermode"" that runs in Ring 0",https://github.com/nebulet/nebulet
844,Lobsters,rust,Rust programming,News: Rust 1.26,https://newrustacean.com/show_notes/news/rust_1_26/index.html
845,Lobsters,rust,Rust programming,How a Rust upgrade more than tripled the speed of my code,http://troubles.md/posts/the-power-of-compilers/
846,Lobsters,rust,Rust programming,genact: A nonsense activity generator,https://github.com/svenstaro/genact
847,Lobsters,rust,Rust programming,Performance experiments with matrix multiplication,https://vorner.github.io/2018/05/12/Mat-perf.html
848,Lobsters,rust,Rust programming,Announcing Rust 1.26,https://blog.rust-lang.org/2018/05/10/Rust-1.26.html
849,Lobsters,rust,Rust programming,The Simplest Rust Toolchain Installer,https://gitlab.com/Screwtapello/simplest-rust-toolchain-installer/blob/master/src/main.md
850,Lobsters,rust,Rust programming,Entity-Component-System architecture for UI in Rust,https://raphlinus.github.io/personal/2018/05/08/ecs-ui.html
851,Lobsters,rust,Rust programming,Rust in production at Figma,https://blog.figma.com/rust-in-production-at-figma-e10a0ec31929
852,Lobsters,rust,Rust programming,KRust: A Formal Executable Semantics of Rust,https://arxiv.org/abs/1804.10806
853,Lobsters,rust,Rust programming,"Using LLVM from Rust, to generate WebAssembly",https://medium.com/@jayphelps/using-llvm-from-rust-to-generate-webassembly-93e8c193fdb4
854,Lobsters,rust,Rust programming,c3r3s: a serial 64-bit bootloader for the raspberry pi 3,https://github.com/robey/c3r3s
855,Lobsters,rust,Rust programming,Writing an OS in Rust - Unit Testing,https://os.phil-opp.com/unit-testing/
856,Lobsters,rust,Rust programming,"Rust: Traits Deep Dive, Part I",https://newrustacean.com/show_notes/e023/
857,Lobsters,rust,Rust programming,"nperf, a sampling profiler for Linux written in Rust from Nokia",https://github.com/nokia/nperf
858,Lobsters,rust,Rust programming,"Reflections on Rust, and the Sand Castle Metaphor",https://brandur.org/fragments/rust-reflections
859,Lobsters,rust,Rust programming,How does dynamic dispatch work in WebAssembly?,http://fitzgeraldnick.com/2018/04/26/how-does-dynamic-dispatch-work-in-wasm.html
860,Lobsters,rust,Rust programming,Rust Case Study: Chucklefish Taps Rust to Bring Safe Concurrency to Video Games,https://www.rust-lang.org/pdfs/Rust-Chucklefish-Whitepaper.pdf
861,Lobsters,rust,Rust programming,Splitting up modules in Rust,https://chronicbuildfailure.co/splitting-up-modules-in-rust-5ad7713201d5
862,Lobsters,rust,Rust programming,Why Rust's error handling is awesome,http://rantsideasstuff.com/posts/2018/04/20-rust-error-handling-awesome/
863,Lobsters,rust,Rust programming,Hello wasm-pack!,https://hacks.mozilla.org/2018/04/hello-wasm-pack/
864,Lobsters,rust,Rust programming,"Twiggy, a code size profiler for WebAssembly",https://github.com/rustwasm/twiggy
865,Lobsters,rust,Rust programming,Angle Grinder: CLI App to Slice and Dice Your Logs,https://github.com/rcoh/angle-grinder
866,Lobsters,rust,Rust programming,Dark Side Of Ergonomics,https://vorner.github.io/2018/04/08/Dark-side-of-ergonomics.html
867,Lobsters,rust,Rust programming,Tutorial: Conway's Game of Life in Rust and WebAssembly,https://rust-lang-nursery.github.io/rust-wasm/game-of-life/introduction.html
868,Lobsters,rust,Rust programming,Sneak Peek at WebAssembly Studio,https://hacks.mozilla.org/2018/04/sneak-peek-at-webassembly-studio/
869,Lobsters,rust,Rust programming,Writing a recursive ascent parser by hand,https://www.abubalay.com/blog/2018/04/08/recursive-ascent
870,Lobsters,rust,Rust programming,Immutable Data Structures for Rust,https://docs.rs/im/10.0.0/im/
871,Lobsters,rust,Rust programming,Building Actor Systems in Rust,https://www.youtube.com/watch?v=hg89CJKIMhI
872,Lobsters,rust,Rust programming,Anduril Industries is Hiring,/s/frlonn/anduril_industries_is_hiring
873,Lobsters,rust,Rust programming,JavaScript to Rust and Back Again: A wasm-bindgen Tale,https://hacks.mozilla.org/2018/04/javascript-to-rust-and-back-again-a-wasm-bindgen-tale/
874,Lobsters,rust,Rust programming,"MesaLink: a memory-safe and OpenSSL-compatible TLS library, implemented in Rust",https://github.com/mesalock-linux/mesalink
875,Lobsters,rust,Rust programming,Building Tiny Rust Binaries for Embedded Linux,https://jamesmunns.com/update/2018/04/01/tinyrocket.html
876,Lobsters,rust,Rust programming,Rust: the new LLVM,http://willcrichton.net/notes/rust-the-new-llvm/
877,Lobsters,rust,Rust programming,Getting Rid of Rust with Ada,https://blog.adacore.com/getting-rid-of-rust-with-ada
878,Lobsters,rust,Rust programming,You can't Rust that,http://lucumr.pocoo.org/2018/3/31/you-cant-rust-that/
879,Lobsters,rust,Rust programming,"Thoughts on Rust, a few thousand lines in",https://rcoh.me/posts/things-learned-first-thousand-lines-of-rust/
880,Lobsters,rust,Rust programming,A geometric Rust adventure,https://eev.ee/blog/2018/03/30/a-geometric-rust-adventure/
881,Lobsters,rust,Rust programming,I've just learned Rust and I think I'm in love ·,https://rskupnik.github.io/I-learned-rust-and-I-think-Im-in-love
882,Lobsters,rust,Rust programming,Announcing Rust 1.25 - The Rust Programming Language Blog,https://blog.rust-lang.org/2018/03/29/Rust-1.25.html
883,Lobsters,rust,Rust programming,Speeding Up dwarfdump With Rust,https://robert.ocallahan.org/2018/03/speeding-up-dwarfdump-with-rust.html
884,Lobsters,rust,Rust programming,Atomics and Memory Ordering,https://vorner.github.io/2018/03/25/Atomics.html
885,Lobsters,rust,Rust programming,"Touring a Fast, Safe, and Complete(ish) Web Service in Rust — Brandur Leach",https://brandur.org/rust-web
886,Lobsters,rust,Rust programming,Stealing Where from Rust,http://www.parsonsmatt.org/2018/03/26/stealing_where_from_rust.html
887,Lobsters,rust,Rust programming,Making WebAssembly better for Rust & for all languages,https://hacks.mozilla.org/2018/03/making-webassembly-better-for-rust-for-all-languages/
888,Lobsters,rust,Rust programming,Rust Talk videos from meetups and conferences like the Rust Belt Rust Conference or RustFest Zürich,https://blog.meetupfeed.com/rust-talk-videos-meetups-conferences-like-rust-belt-rust-conference-rustfest-zurich/
889,Lobsters,rust,Rust programming,Roguelike Tutorial in Rust + tcod,https://tomassedovic.github.io/roguelike-tutorial/
890,Lobsters,rust,Rust programming,Rust's 2018 roadmap,https://blog.rust-lang.org/2018/03/12/roadmap.html
891,Lobsters,rust,Rust programming,Closing Keynote: Safe Systems Software and Future of Computing by Joe Duffy (2017),https://www.youtube.com/watch?v=CuD7SCqHB7k
892,Lobsters,rust,Rust programming,Writing a Simple IPFS Crawler in Rust,https://gkbrk.com/2018/03/writing-a-simple-ipfs-crawler/
893,Lobsters,rust,Rust programming,Short Paper: Rusty Types for Solid Safety (2016),https://sergio.bz/docs/rusty-types-2016.pdf
894,Lobsters,rust,Rust programming,Writing an OS in pure Rust,https://os.phil-opp.com/news/2018-03-09-pure-rust/
895,Lobsters,rust,Rust programming,A New Preferences Parser for Firefox,https://blog.mozilla.org/nnethercote/2018/03/09/a-new-preferences-parser-for-firefox/
896,Lobsters,rust,Rust programming,Announcing the Tokio runtime,https://tokio.rs/blog/2018-03-tokio-runtime/
897,Lobsters,rust,Rust programming,Writing a Microservice in Rust,https://www.goldsborough.me/rust/web/tutorial/2018/01/20/17-01-11-writing_a_microservice_in_rust/
898,Lobsters,rust,Rust programming,"Adhesion, a Rust design-by-contract library, reaches feature parity with D inspiration (0.5 release)",https://github.com/ErichDonGubler/adhesion-rs/commit/38e34b0f446956ef9c962cf4d54925bb504d77ba
899,Lobsters,rust,Rust programming,Rust in 2018 - A Fast Tour,https://www.youtube.com/watch?v=lKTo7aDf0bE
900,Lobsters,rust,Rust programming,Why Rust Has Macros,https://kasma1990.gitlab.io/2018/03/04/why-rust-has-macros/
901,Lobsters,rust,Rust programming,Serializing awkward data with serde,http://zork.net/~st/jottings/Serializing_awkward_data_with_serde.html
902,Lobsters,rust,Rust programming,Opportunistic Mutations for Rust,https://llogiq.github.io/2018/03/03/opportune.html
903,Lobsters,rust,Rust programming,synapse 1.0-rc1: a lightweight bittorrent daemon written in Rust,https://synapse-bt.org
904,Lobsters,rust,Rust programming,Announcing Rust 1.24.1,https://blog.rust-lang.org/2018/03/01/Rust-1.24.1.html
905,Lobsters,rust,Rust programming,"Rust 1.24: Performance wins, incremental compilation, and the Rust 2018 Roadmap and Epoch!",http://www.newrustacean.com/show_notes/news/rust_1_24/
906,Lobsters,rust,Rust programming,It All Looks the Same to Me,https://www.innoq.com/en/blog/looks-the-same-to-me/
907,Lobsters,rust,Rust programming,Reasoning with Types in Rust,https://aaronweiss.us/posts/2018-02-26-reasoning-with-types-in-rust.html
908,Lobsters,rust,Rust programming,A Code Cartoon introduction to WebAssembly with Lin Clark,https://www.youtube.com/watch?v=smcN0Dvctac
909,Lobsters,rust,Rust programming,Speed Without Wizardry,http://fitzgeraldnick.com/2018/02/26/speed-without-wizardry.html
910,Lobsters,rust,Rust programming,Rust SGX SDK: Towards Memory Safety in Intel SGX (2017),https://qconsf.com/system/files/presentation-slides/qconsf-reviewed-ding.pdf
911,Lobsters,rust,Rust programming,Cargo: Windows 7 users broken by Github dropping TLS 1.0/1.1,https://github.com/rust-lang/cargo/issues/5066
912,Lobsters,rust,Rust programming,Why Writing a Linked List in (safe) Rust is So Damned Hard,https://rcoh.me/posts/rust-linked-list-basically-impossible/
913,Lobsters,rust,Rust programming,Programming an ARM microcontroller in Rust at four different levels of abstraction,http://pramode.in/2018/02/20/programming-a-microcontroller-in-rust-at-four-levels-of-abstraction/
914,Lobsters,rust,Rust programming,Rust things I miss in C,https://people.gnome.org/~federico/blog/rust-things-i-miss-in-c.html
915,Lobsters,rust,Rust programming,Announcing Rust 1.24,https://blog.rust-lang.org/2018/02/15/Rust-1.24.html
916,Lobsters,rust,Rust programming,"Comm - a decentralized, censorship-resistant p2p messaging app written in Rust",https://github.com/zacstewart/comm-gtk
917,Lobsters,rust,Rust programming,Wire's Rust implementation of the Double Ratchet Algorithm,https://github.com/wireapp/proteus
918,Lobsters,rust,Rust programming,Keep your dependencies up-to-date,https://deps.rs/
919,Lobsters,rust,Rust programming,Humble Book Bundle: Functional Programming,https://www.humblebundle.com/books/functional-programming-books
920,Lobsters,rust,Rust programming,Closing out an incredible week in Rust,http://aturon.github.io/2018/02/09/amazing-week/
921,Lobsters,rust,Rust programming,Crates You Should Know: Serde (Rust serialization/deserialization library),http://www.newrustacean.com/show_notes/cysk/serde/
922,Lobsters,rust,Rust programming,Reflecting on ppbert,https://vfoley.xyz/ppbert/
923,Lobsters,rust,Rust programming,A Wee Allocator for WebAssembly,http://fitzgeraldnick.com/2018/02/09/wee-alloc.html
924,Lobsters,rust,Rust programming,Async/Await V: Getting back to the futures,https://boats.gitlab.io/blog/post/2018-02-08-async-v-getting-back-to-the-futures/
925,Lobsters,rust,Rust programming,Guitar Effects in Rust,http://rickyhan.com/jekyll/update/2018/02/06/rust-guitar-pedal-effects-dsp.html
926,Lobsters,rust,Rust programming,A vision for portability in Rust,http://aturon.github.io/2018/02/06/portability-vision/
927,Lobsters,rust,Rust programming,Writing eBPF tracing tools in Rust,https://jvns.ca/blog/2018/02/05/rust-bcc/
928,Lobsters,rust,Rust programming,Improving the bucket compression trick,https://github.com/robey/pack4x5
929,Lobsters,rust,Rust programming,Memory Safety in Rust: A Case Study with C,http://willcrichton.net/notes/rust-memory-safety/
930,Lobsters,rust,Rust programming,Rust's ownership model formally proven with Coq,https://dl.acm.org/citation.cfm?doid=3177123.3158154
931,Lobsters,rust,Rust programming,How it works: Compiler Explorer,https://xania.org/201609/how-compiler-explorer-runs-on-amazon
932,Lobsters,rust,Rust programming,Send and Sync: The “marker traits” that Rust uses for safe concurrency.,http://www.newrustacean.com/show_notes/e022/
933,Lobsters,rust,Rust programming,Rust Lifetimes for the Uninitialised,http://asquera.de/blog/2018-01-29/rust-lifetimes-for-the-uninitialised/
934,Lobsters,rust,Rust programming,Amp - A complete text editor for your terminal,https://amp.rs/
935,Lobsters,rust,Rust programming,How do you read the memory maps of a Mac process?,https://jvns.ca/blog/2018/01/26/mac-memory-maps/
936,Lobsters,rust,Rust programming,"📦 Parcel v1.5.0 released: Source Maps, WebAssembly, Rust, and more! 🚀",https://medium.com/@devongovett/parcel-v1-5-0-released-source-maps-webassembly-rust-and-more-3a6385e43b95
937,Lobsters,rust,Rust programming,Why is Rust difficult?,https://vorner.github.io/difficult.html
938,Lobsters,rust,Rust programming,Interview: Sean Griffin on Diesel 1.0 (the Rust ORM),http://www.newrustacean.com/show_notes/interview/diesel_1_0/index.html
