ID,Source,TimeGST,TimeEpoch,Upvotes,NumComments,Title,Url
6724,HackerNews,2020-07-06T13:46:35.000Z,1594043195,105,110,Giant flywheel project in Scotland could prevent UK blackouts,https://www.theguardian.com/business/2020/jul/06/giant-flywheel-project-in-scotland-could-prevent-uk-blackouts-energy
6725,HackerNews,2020-07-06T13:38:57.000Z,1594042737,204,35,EDEX-UI: science fiction terminal emulator,https://github.com/GitSquared/edex-ui
6726,HackerNews,2020-07-06T13:28:22.000Z,1594042102,463,426,H.266/Versatile Video Coding (VVC),https://newsletter.fraunhofer.de/-viewonline2/17386/465/11/14SHcBTt/V44RELLZBp/1
6727,HackerNews,2020-07-06T13:18:53.000Z,1594041533,76,72,"In 2020, Words Are 'Violence,' Arson Is Not",https://reason.com/2020/07/03/silence-is-violence-george-floyd-protests-arson-is-not/
6728,HackerNews,2020-07-06T13:14:56.000Z,1594041296,143,187,The machine learning community has a toxicity problem,https://www.reddit.com/r/MachineLearning/comments/hiv3vf/d_the_machine_learning_community_has_a_toxicity/
6729,HackerNews,2020-07-06T12:42:03.000Z,1594039323,124,46,"M60 – Open-Source USB&BLE, Hot-Swappable Mechanical Keyboard Powered by Python",https://makerdiary.com/pages/m60-mechanical-keyboard
6730,HackerNews,2020-07-06T12:25:22.000Z,1594038322,209,51,SymPy - a Python library for symbolic mathematics,https://www.sympy.org/en/index.html
6731,HackerNews,2020-07-06T11:50:34.000Z,1594036234,254,130,Around 293 intermediate CAs in violation of CA/Browser guidelines,https://www.mail-archive.com/dev-security-policy@lists.mozilla.org/msg13493.html
6732,HackerNews,2020-07-06T10:57:27.000Z,1594033047,155,72,Algorithms Are Now Commodities,http://shape-of-code.coding-guidelines.com/2020/07/05/algorithms-are-now-commodities/
6733,HackerNews,2020-07-06T10:14:30.000Z,1594030470,519,274,Fujitsu announces permanent work-from-home plan,https://www.bbc.com/news/business-53303364
6734,HackerNews,2020-07-06T09:32:13.000Z,1594027933,309,199,"Brave Browser, wiping history still leaves trace of visited sites",https://github.com/brave/brave-browser/issues/9929
6735,HackerNews,2020-07-06T09:26:41.000Z,1594027601,118,187,“Industrial Society and its Future”: the writings of the Unabomber,https://www.roelpeters.be/industrial-society-and-its-future-the-intelligent-yet-angry-writings-of-a-terrorist/
6736,HackerNews,2020-07-06T09:21:38.000Z,1594027298,403,214,Brython – A Python 3 implementation for client-side web programming,https://brython.info/
6737,HackerNews,2020-07-06T07:59:35.000Z,1594022375,183,16,Everything I Know: Buckminster Fuller (1975),https://www.bfi.org/about-fuller/resources/everything-i-know
6738,HackerNews,2020-07-06T07:27:10.000Z,1594020430,120,82,Division by zero in type theory: a FAQ,https://xenaproject.wordpress.com/2020/07/05/division-by-zero-in-type-theory-a-faq/
6739,HackerNews,2020-07-06T07:24:28.000Z,1594020268,701,132,Ennio Morricone has died,https://www.hollywoodreporter.com/news/ennio-morricone-dead-prolific-italian-composer-was-91-858358
6740,HackerNews,2020-07-06T06:58:33.000Z,1594018713,149,83,Don't bet on the most likely winner,https://avoidboringpeople.substack.com/p/relatively-speaking-the-billionaire
6741,HackerNews,2020-07-06T06:35:48.000Z,1594017348,111,35,The magnetic universe begins to come into view,https://www.quantamagazine.org/the-hidden-magnetic-universe-begins-to-come-into-view-20200702/
6742,HackerNews,2020-07-06T06:33:19.000Z,1594017199,104,31,Parsing city of origin and destination city from a string,https://stackoverflow.com/questions/59956670/parsing-city-of-origin-destination-city-from-a-string
6743,HackerNews,2020-07-06T03:34:55.000Z,1594006495,86,23,Walking Dream – single-player adventure game for the Oculus Quest,http://walkingdre.am/
6744,HackerNews,2020-07-06T03:21:28.000Z,1594005688,112,43,Icdiff: Side-by-side highlighted command line diffs,https://www.jefftk.com/icdiff
6745,HackerNews,2020-07-06T02:39:12.000Z,1594003152,126,8,CoreBGP – Plugging in to BGP,https://www.jordanwhited.com/posts/corebgp-plugging-in-to-bgp/
6746,HackerNews,2020-07-06T02:29:35.000Z,1594002575,349,312,"Uber, Postmates Agree on $2.65B All-Stock Deal",https://www.bloomberg.com/news/articles/2020-07-06/uber-postmates-said-to-agree-on-2-65-billion-all-stock-deal
6747,HackerNews,2020-07-06T01:40:08.000Z,1593999608,133,109,The wild economy of tabletop board game funding,https://www.npr.org/2020/07/05/887283058/a-look-into-the-wild-economy-of-tabletop-board-game-funding
6748,HackerNews,2020-07-06T01:39:29.000Z,1593999569,289,126,Did a Chinese Hack Kill Nortel?,https://www.bloomberg.com/news/features/2020-07-01/did-china-steal-canada-s-edge-in-5g-from-nortel
6749,HackerNews,2020-07-06T01:01:31.000Z,1593997291,110,51,Health Insurance Shouldn't Be Tied to Employers,https://www.nytimes.com/2020/06/29/opinion/sunday/coronavirus-medicare-for-all.html
6750,HackerNews,2020-07-06T00:47:19.000Z,1593996439,94,64,4 Year Compensation Packages Comparison,https://www.levels.fyi/calculator/?co=Facebook&bs=160000&sg=350000&sbone=20000&bp=10&gr=10&co-2=Square&bs-2=145000&sg-2=275000&gr-2=48
6751,HackerNews,2020-07-06T00:09:20.000Z,1593994160,128,45,Elements C++ GUI Library,https://github.com/cycfi/elements
6752,HackerNews,2020-07-06T00:07:34.000Z,1593994054,187,76,Rust for JavaScript Developers – Functions and Control Flow,http://www.sheshbabu.com/posts/rust-for-javascript-developers-functions-and-control-flow/
6753,HackerNews,2020-07-05T23:45:27.000Z,1593992727,242,32,Why I’m Writing a Book on Cryptography,https://www.cryptologie.net/article/504/why-im-writing-a-book-on-cryptography/
6754,HackerNews,2020-07-05T23:15:55.000Z,1593990955,130,71,Modern Object Pascal Introduction for Programmers,http://newpascal.org/assets/modern_pascal_introduction.html
6755,HackerNews,2020-07-05T23:09:04.000Z,1593990544,80,53,A startup is testing a subscription model for search engines,https://www.wired.com/story/a-startup-is-testing-the-subscription-model-for-search-engines/
6756,HackerNews,2020-07-05T23:06:45.000Z,1593990405,404,93,I open sourced my game along with a tutorial on how to make it using Lua,https://github.com/a327ex/BYTEPATH
6757,HackerNews,2020-07-05T23:00:09.000Z,1593990009,330,89,Writing a winning 4K intro in Rust,https://www.codeslow.com/2020/07/writing-winning-4k-intro-in-rust.html
6758,HackerNews,2020-07-05T22:36:23.000Z,1593988583,85,15,Show HN: Getting fit in virtual reality with open source and Godot,https://vrworkout.at
6759,HackerNews,2020-07-05T22:21:01.000Z,1593987661,343,293,Internet mob justice can easily destroy innocent lives (2019),https://observer.com/2019/05/internet-mob-justice-innocent-lives/
6760,HackerNews,2020-07-05T22:02:32.000Z,1593986552,86,0,The Triplebyte data download doesn’t give you all your data,https://www.linestarve.com/blog/post/triplebyte-data-download/
6761,HackerNews,2020-07-05T21:50:57.000Z,1593985857,91,112,Contrarian view on closing files,https://coady.github.io/posts/closing-files/
6762,HackerNews,2020-07-05T20:54:56.000Z,1593982496,128,20,Castle Game Engine: Cross-platform 3D and 2D game engine,https://github.com/castle-engine/castle-engine
6763,HackerNews,2020-07-05T20:27:50.000Z,1593980870,192,221,"Georgia Tech professors revolt over reopening, say current plan threatens lives",https://www.gpbnews.org/post/georgia-tech-professors-revolt-over-reopening-say-current-plan-threatens-lives-students-staff
6764,HackerNews,2020-07-05T20:26:36.000Z,1593980796,489,113,UASP makes Raspberry Pi 4 disk IO 50% faster,https://www.jeffgeerling.com/blog/2020/uasp-makes-raspberry-pi-4-disk-io-50-faster
6765,HackerNews,2020-07-05T19:33:28.000Z,1593977608,85,44,Show HN: A simple Poker API to calculate the winning hand/s,https://www.pokerapi.dev/
6766,HackerNews,2020-07-05T19:05:19.000Z,1593975919,81,74,Transport makes up only 6% of the greenhouse gas emissions from food,https://blog.yeticheese.com/eating-local-has-tiny-environmental-impact/
6767,HackerNews,2020-07-05T18:48:56.000Z,1593974936,194,101,"When India kicked out Coca-Cola, local sodas thrived (2019)",https://www.atlasobscura.com/articles/what-is-thums-up
6768,HackerNews,2020-07-05T18:41:20.000Z,1593974480,150,15,Parallel Programming in Multicore OCaml,https://github.com/prismlab/parallel-programming-in-multicore-ocaml/tree/draft
6769,HackerNews,2020-07-05T18:16:15.000Z,1593972975,82,57,The Purpose of Persuasion,https://www.persuasion.community/p/the-purpose-of-persuasion
6770,HackerNews,2020-07-05T18:14:21.000Z,1593972861,311,97,A Deep Introduction to JIT Compilers: JITs are not very Just-in-time,https://carolchen.me/blog/jits-intro/
6771,HackerNews,2020-07-05T16:58:52.000Z,1593968332,218,322,My dad got scammed for $3k worth of gift cards,https://thehustle.co/phone-scam-gift-cards/
6772,HackerNews,2020-07-05T16:49:34.000Z,1593967774,92,32,Choosing a Rust web framework,https://www.lpalmieri.com/posts/2020-07-04-choosing-a-rust-web-framework-2020-edition/
6773,HackerNews,2020-07-05T16:47:42.000Z,1593967662,92,33,"Scaling Pandas: Comparing Dask, Ray, Modin, Vaex, and Rapids",https://datarevenue.com/en-blog/pandas-vs-dask-vs-vaex-vs-modin-vs-rapids-vs-ray
6774,HackerNews,2020-07-05T16:34:11.000Z,1593966851,104,32,DuckDuckGo coming back online in India following country-wide block,https://www.androidpolice.com/2020/07/04/duckduckgo-has-been-blocked-by-multiple-indian-isps/
6775,HackerNews,2020-07-05T16:24:29.000Z,1593966269,118,81,Pkg.jl telemetry should be opt-in,https://discourse.julialang.org/t/pkg-jl-telemetry-should-be-opt-in/
6776,HackerNews,2020-07-05T15:54:55.000Z,1593964495,654,240,The Wrong Abstraction (2016),https://www.sandimetz.com/blog/2016/1/20/the-wrong-abstraction
6777,HackerNews,2020-07-05T15:50:23.000Z,1593964223,471,217,"China suppression of Uighurs meets U.N. definition of genocide, report says",https://www.npr.org/2020/07/04/887239225/china-suppression-of-uighur-minorities-meets-u-n-definition-of-genocide-report-s
6778,HackerNews,2020-07-05T15:43:54.000Z,1593963834,95,41,"Paul Davis, lead developer of Ardour on fixing big Linux audio issues",http://libregraphicsworld.org/blog/entry/podcast-ep-003-paul-davis-on-fixing-big-linux-audio-issues
6779,HackerNews,2020-07-05T15:26:26.000Z,1593962786,82,16,Andrew Wilkinson and Tiny Capital,https://colinkeeley.com/blog/andrew-wilkinson-tiny-capital-operating-manual
6780,HackerNews,2020-07-05T15:10:16.000Z,1593961816,219,39,Ridiculous Math Problems,http://www.dam.brown.edu/people/mumford/blog/2020/Ridiculous.html
6781,HackerNews,2020-07-05T15:00:30.000Z,1593961230,154,124,Why Can't I Reproduce Their Results?,http://theorangeduck.com/page/reproduce-their-results
6782,HackerNews,2020-07-05T14:48:56.000Z,1593960536,341,232,Linus Torvalds: 'I Do No Coding Any More',https://linux.slashdot.org/story/20/07/03/2133201/linus-torvalds-i-do-no-coding-any-more
6783,HackerNews,2020-07-05T14:48:46.000Z,1593960526,161,48,Dolphin Progress May and June 2020,https://dolphin-emu.org/blog/2020/07/05/dolphin-progress-report-may-and-june-2020/
6784,HackerNews,2020-07-05T14:39:19.000Z,1593959959,265,65,How McKinsey helps companies avoid responsibility,https://slate.com/business/2020/06/mckinsey-companies-avoid-responsibility-management-consulting.html
6785,HackerNews,2020-07-05T13:50:23.000Z,1593957023,429,122,"Florida becomes first state to enact DNA privacy law, blocking insurers",https://www.washingtonexaminer.com/politics/florida-becomes-first-state-to-enact-dna-privacy-law-blocking-insurers-from-genetic-data
6786,HackerNews,2020-07-05T12:56:19.000Z,1593953779,275,186,The Comeback of Fun in Visual Design,https://applypixels.com/blog/comeback
6787,HackerNews,2020-07-05T12:49:53.000Z,1593953393,561,236,Hong Kong: books by pro-democracy activists disappear from library shelves,https://www.theguardian.com/world/2020/jul/05/hong-kong-books-by-pro-democracy-activists-disappear-from-library-shelves
6788,HackerNews,2020-07-05T12:27:57.000Z,1593952077,162,155,Formula 1 2020: The secret aerodynamicist – are capes the key?,https://www.bbc.co.uk/sport/formula1/51739796
6789,HackerNews,2020-07-05T12:23:30.000Z,1593951810,254,54,The cost to train an AI system is improving at 50x the pace of Moore’s Law,https://ark-invest.com/analyst-research/ai-training/
6790,HackerNews,2020-07-05T12:09:32.000Z,1593950972,310,181,I Got My Attention Back (2017),https://craigmod.com/essays/how_i_got_my_attention_back/
6791,HackerNews,2020-07-05T12:07:39.000Z,1593950859,298,50,Rich Tables in the Terminal,https://github.com/willmcgugan/rich#tables
6792,HackerNews,2020-07-05T11:16:17.000Z,1593947777,111,70,"A Journey building a fast JSON parser and full JSONPath, Oj for Go",https://github.com/ohler55/ojg/blob/master/design.md
6793,HackerNews,2020-07-05T09:58:40.000Z,1593943120,165,13,An Introduction to Conflict-Free Replicated Data Types,https://lars.hupel.info/topics/crdt/01-intro.html
6794,HackerNews,2020-07-05T09:49:27.000Z,1593942567,129,12,A crash course in just-in-time compilers (2017),https://hacks.mozilla.org/2017/02/a-crash-course-in-just-in-time-jit-compilers/
6795,HackerNews,2020-07-05T09:45:04.000Z,1593942304,373,288,Bible API,http://bible-api.com/
6796,HackerNews,2020-07-05T09:00:06.000Z,1593939606,133,44,Rust on the ESP32 (2019),https://mabez.dev/blog/posts/esp32-rust/
6797,HackerNews,2020-07-05T08:31:13.000Z,1593937873,349,156,Dutch national broadcaster saw ad revenue rise when it stopped tracking users,https://www.theregister.com/2020/07/03/stop_tracking_increase_revenue_effectiveness/
6798,HackerNews,2020-07-05T08:26:44.000Z,1593937604,107,25,Scann: Scalable Nearest Neighbors,https://github.com/google-research/google-research/tree/master/scann
6799,HackerNews,2020-07-05T07:44:59.000Z,1593935099,194,59,JazzKeys: Type to improvise Jazz music,https://jazzkeys.plan8.co/
6800,HackerNews,2020-07-05T01:12:40.000Z,1593911560,243,79,Beginner's Guide to Abstraction,https://jesseduffield.com/beginners-guide-to-abstraction/
6801,HackerNews,2020-07-05T01:05:28.000Z,1593911128,326,93,"Onyx is violating the Linux kernel's license, refuses to release source code",https://old.reddit.com/r/Onyx_Boox/comments/hk7d5v/onyx_is_violating_the_linux_kernels_license/
6802,HackerNews,2020-07-05T00:11:13.000Z,1593907873,149,104,Our Intellectual Property Laws Are Out of Control (2013),https://www.popularmechanics.com/technology/gadgets/a8937/our-intellectual-property-laws-are-out-of-control-15467970/
6803,HackerNews,2020-07-04T23:50:06.000Z,1593906606,350,110,Repairing your smartphone or installing a ROM will now be a crime in Mexico,https://www.xataka.com.mx/legislacion-y-derechos/reparar-tu-smartphone-instalarle-rom-sera-delito-mexico-nueva-ley-que-proteje-candados-digitales-explicada
6804,HackerNews,2020-07-04T23:03:34.000Z,1593903814,86,76,Tesla’s SA big battery just got 50% bigger after goals thanks to Autobidder,https://techau.com.au/teslas-big-battery-in-sa-just-got-50-bigger-after-kicking-goals-thanks-to-autobidder/
6805,HackerNews,2020-07-04T22:47:06.000Z,1593902826,154,18,Hard Disk Hacking (2013),http://spritesmods.com/?art=hddhack&page=1
6806,HackerNews,2020-07-04T22:03:04.000Z,1593900184,76,54,The Unplanned Impact of Mathematics,https://www.nature.com/articles/475166a
6807,HackerNews,2020-07-04T21:57:22.000Z,1593899842,91,35,Rocket Lab vehicle lost during second stage burn on 13th mission,https://twitter.com/RocketLab/status/1279531664759091200
6808,HackerNews,2020-07-04T21:27:22.000Z,1593898042,329,300,The Fourth of July,https://www.popehat.com/2020/07/04/the-fourth-of-july-rerun/
6809,HackerNews,2020-07-04T20:00:20.000Z,1593892820,139,55,How I grew my Shopify micro-SaaS,https://www.preetamnath.com/blog/grow-shopify-micro-saas-to-25k-mrr-in-14-months
6810,HackerNews,2020-07-04T19:59:15.000Z,1593892755,583,333,De-escalating social media conflict,https://nickpunt.com/blog/deescalating-social-media/
6811,HackerNews,2020-07-04T19:22:09.000Z,1593890529,76,26,A British village that built one of the UK’s fastest internet networks,https://arstechnica.com/information-technology/2020/07/the-remote-british-village-that-built-one-of-the-uks-fastest-internet-networks/
6812,HackerNews,2020-07-04T19:06:44.000Z,1593889604,110,43,Meditations on Moloch (2014),https://web.archive.org/web/20200516181754/https://slatestarcodex.com/2014/07/30/meditations-on-moloch/
6813,HackerNews,2020-07-04T18:43:08.000Z,1593888188,981,183,Websites that look like desktop GUIs,https://simone.computer/#/webdesktops
6814,HackerNews,2020-07-04T18:16:01.000Z,1593886561,158,51,Tinc – A Virtual Private Network (VPN) Daemon,http://tinc-vpn.org/
6815,HackerNews,2020-07-04T18:13:17.000Z,1593886397,457,180,"Show HN: USA.css – units set in inches, 1776 bytes",https://bennettfeely.com/usacss/
6816,HackerNews,2020-07-04T18:10:42.000Z,1593886242,95,7,"Iran dumps Flight 752 investigator, airspace open to conceal 'imminent' attack",https://www.cbc.ca/news/politics/audio-recording-iran-lead-investigator-flight-ps752-1.5636450
6817,HackerNews,2020-07-04T17:08:51.000Z,1593882531,173,54,"Back to old tricks, or, baby steps in Rust",https://donsbot.wordpress.com/2020/07/04/back-to-old-tricks-or-baby-steps-in-rust/
6818,HackerNews,2020-07-04T15:54:20.000Z,1593878060,133,33,GitHub Audio (2016),https://github.audio/
6819,HackerNews,2020-07-04T14:24:34.000Z,1593872674,224,109,From context collapse to content collapse,http://www.roughtype.com/?p=8724
6820,HackerNews,2020-07-04T14:09:49.000Z,1593871789,101,108,Close and tranquil solar system has astronomers excited,https://astrobiology.nasa.gov/news/close-and-tranquil-solar-system-has-astronomers-excited/
6821,HackerNews,2020-07-04T13:03:56.000Z,1593867836,211,330,"After many false starts, hydrogen power might now bear fruit",https://www.economist.com/science-and-technology/2020/07/04/after-many-false-starts-hydrogen-power-might-now-bear-fruit
6822,HackerNews,2020-07-04T12:58:29.000Z,1593867509,122,161,Which firms profit most from America’s health-care system (2018),https://www.economist.com/business/2018/03/15/which-firms-profit-most-from-americas-health-care-system
6823,HackerNews,2020-07-04T12:31:12.000Z,1593865872,99,12,Principles of Programming Languages (1997) [pdf],http://www.cs.nott.ac.uk/~pszgmh/popl.pdf
6824,HackerNews,2020-07-04T12:17:30.000Z,1593865050,95,21,Cassette tape-based navigation system from 1971,https://jalopnik.com/this-cassette-tape-based-navigation-system-from-1971-is-1826459978
6825,HackerNews,2020-07-04T12:00:01.000Z,1593864001,166,132,MaXX Interactive Desktop: A Re-Implementation of the IRIX Interactive Desktop,https://maxxinteractive.com/
6826,HackerNews,2020-07-04T10:36:12.000Z,1593858972,143,123,Yamato becomes Japan's first city to 'ban' use of phones while walking,https://www.japantimes.co.jp/news/2020/06/25/national/yamato-japan-ban-phones-walking/
6827,HackerNews,2020-07-04T10:19:09.000Z,1593857949,135,7,Harmful Workload Generator for PostgreSQL,https://github.com/lesovsky/noisia
6828,HackerNews,2020-07-04T10:16:37.000Z,1593857797,165,72,SSH Emergency Access,https://smallstep.com/blog/ssh-emergency-access/
6829,HackerNews,2020-07-04T09:46:07.000Z,1593855967,91,38,Firefox 80 to Support VA-API Acceleration on X11,https://www.phoronix.com/scan.php?page=news_item&px=Firefox-80-VA-API-X11
6830,HackerNews,2020-07-04T09:04:26.000Z,1593853466,93,157,Analogue radio in the UK given 10-year stay of execution,https://www.theregister.com/2020/07/03/analogue_commercial_radio_licences_extended_10_years/
6831,HackerNews,2020-07-04T08:02:58.000Z,1593849778,249,85,Scuba diver accidentally discovers prehistoric industrial complex in Mexico,https://nationalpost.com/news/world/a-canadian-scuba-diver-in-mexico-accidentally-discovers-a-vast-prehistoric-industrial-complex
6832,HackerNews,2020-07-04T06:51:04.000Z,1593845464,291,93,A ‘viral’ new bird song in Canada is causing sparrows to change their tune,https://gizmodo.com/a-viral-new-bird-song-in-canada-is-causing-sparrows-t-1844245103
6833,HackerNews,2020-07-04T06:18:13.000Z,1593843493,166,36,Gitqlite: Query Git Repositories with SQL,https://github.com/augmentable-dev/gitqlite
6834,HackerNews,2020-07-04T05:44:48.000Z,1593841488,415,347,A look at the Gemini protocol: a brutally simple alternative to the web,https://toffelblog.xyz/blog/gemini-overview/
6835,HackerNews,2020-07-04T04:24:08.000Z,1593836648,90,22,Closos: Specification of a Lisp operating system (2013) [pdf],http://metamodular.com/closos.pdf
6836,HackerNews,2020-07-04T03:54:09.000Z,1593834849,162,25,Lisp Badge: A single-board computer that you can program in uLisp,http://www.ulisp.com/show?2L0C
6837,HackerNews,2020-07-04T01:36:34.000Z,1593826594,179,202,Invention of satanic witchcraft by medieval authorities was met with skepticism,https://theconversation.com/the-invention-of-satanic-witchcraft-by-medieval-authorities-was-initially-met-with-skepticism-140809
6838,HackerNews,2020-07-04T01:22:51.000Z,1593825771,131,30,Cronk: Long-lost beverage resurrected after 120 years,https://www.theguardian.com/world/2020/jul/03/dr-cronk-drink-canada-brewery
6839,HackerNews,2020-07-04T01:14:45.000Z,1593825285,1130,355,Where Am I? NYTimes or Google?,https://theinternetbytes.com/2020/07/03/where-am-i/
6840,HackerNews,2020-07-04T01:14:18.000Z,1593825258,92,33,YouTube Takes Down Chess Podcast for Being Harmful or Dangerous,https://www.youtube.com/watch?v=KSjrYWPxsG8
6841,HackerNews,2020-07-04T00:58:29.000Z,1593824309,175,29,Scaling Linux Services: Before accepting connections,https://theojulienne.io/2020/07/03/scaling-linux-services-before-accepting-connections.html
6842,HackerNews,2020-07-04T00:55:53.000Z,1593824153,93,10,LIGO Black hole merger may have optical confirmation,https://www.caltech.edu/about/news/black-hole-collision-may-have-exploded-light
6843,HackerNews,2020-07-03T23:21:15.000Z,1593818475,241,92,Debubble,http://debubble.me
6844,HackerNews,2020-07-03T23:15:13.000Z,1593818113,86,85,American businesses have the power to change China’s behavior,https://www.washingtonpost.com/opinions/2020/07/03/american-businesses-have-power-change-chinas-behavior-time-step-up/
6845,HackerNews,2020-07-03T23:04:56.000Z,1593817496,86,32,Beware the Google Password Manager,https://fasterthanli.me/articles/beware-the-google-password-manager
6846,HackerNews,2020-07-03T22:35:49.000Z,1593815749,293,70,Bitcoin From Scratch – Part 1,https://monokh.com/posts/bitcoin-from-scratch-part-1
6847,HackerNews,2020-07-03T22:33:59.000Z,1593815639,438,224,The Silence Is Deafening,https://devonzuegel.com/post/the-silence-is-deafening
6848,HackerNews,2020-07-03T22:03:14.000Z,1593813794,153,126,"The Walkman, Forty Years On",https://www.newyorker.com/culture/cultural-comment/the-walkman-forty-years-on
6849,HackerNews,2020-07-03T22:01:48.000Z,1593813708,155,127,A 28-year-old with no degree becomes a must read on the economy,https://www.bloomberg.com/news/articles/2020-07-02/nathan-tankus-s-newsletter-subscribers-don-t-care-about-diplomas
6850,HackerNews,2020-07-03T21:51:59.000Z,1593813119,86,15,Thrones Wreathed in Shadow: Tacitus and the psychology of authoritarianism,https://warontherocks.com/2020/07/thrones-wreathed-in-shadow-tacitus-and-the-psychology-of-authoritarianism/
6851,HackerNews,2020-07-03T21:37:30.000Z,1593812250,96,30,Queues are Databases (1995),https://arxiv.org/abs/cs/0701158
6852,HackerNews,2020-07-03T21:17:04.000Z,1593811024,366,168,"2+1=4, by quinoa",https://www.efavdb.com/quinoa%20packing
6853,HackerNews,2020-07-03T20:49:32.000Z,1593809372,138,78,Photo Requests from Solitary,http://photorequestsfromsolitary.org/
6854,HackerNews,2020-07-03T20:19:21.000Z,1593807561,107,283,"The science of mask-wearing hasn’t changed, so why have our expectations?",https://fivethirtyeight.com/features/the-science-of-mask-wearing-hasnt-changed-so-why-have-our-expectations/
6855,HackerNews,2020-07-03T19:57:36.000Z,1593806256,100,69,Triso particles have safety features that may power a new generation of reactors,https://www.wired.com/story/nuclear-power-balls-triso-fuel/
6856,HackerNews,2020-07-03T19:29:01.000Z,1593804541,97,12,The Millennium Falcon (2016),https://kitbashed.com/blog/a-complete-history-of-the-millennium-falcon
6857,HackerNews,2020-07-03T19:11:53.000Z,1593803513,109,141,The dying mall’s new lease on life: apartments,https://www.bloomberg.com/news/articles/2020-06-30/a-case-for-turning-empty-malls-into-housing
6858,HackerNews,2020-07-03T19:02:45.000Z,1593802965,80,33,The undeserved status of the pigeon-hole principle (1991),https://www.cs.utexas.edu/users/EWD/transcriptions/EWD10xx/EWD1094.html
6859,HackerNews,2020-07-03T18:46:09.000Z,1593801969,124,141,"Colleges are reopening in fall, but many professors won’t be present",https://www.nytimes.com/2020/07/03/us/coronavirus-college-professors.html
6860,HackerNews,2020-07-03T17:44:48.000Z,1593798288,81,20,Low latency multipliers and cryptographic puzzles,https://blog.janestreet.com/really-low-latency-multipliers-and-cryptographic-puzzles/
6861,HackerNews,2020-07-03T17:37:20.000Z,1593797840,128,83,Things You Should Never Do (2000),https://www.joelonsoftware.com/2000/04/06/things-you-should-never-do-part-i/
6862,HackerNews,2020-07-03T17:31:59.000Z,1593797519,153,25,TaBERT: A new model for understanding queries over tabular data,https://ai.facebook.com/blog/tabert-a-new-model-for-understanding-queries-over-tabular-data/
6863,HackerNews,2020-07-03T17:03:50.000Z,1593795830,76,5,Open letter calling for the release of WikiLeaks publisher Julian Assange,https://defend.wikileaks.org/2020/07/03/open-letter-calling-for-the-release-of-wikileaks-publisher-julian-assange/
6864,HackerNews,2020-07-03T16:57:44.000Z,1593795464,140,93,Reddit and LinkedIn apps also caught copying and pasting clipboard contents,https://www.privateinternetaccess.com/blog/reddit-and-linkedin-apps-also-caught-copying-and-pasting-clipboard-contents/?aff=202007B
