ID,Source,TimeGST,TimeEpoch,Upvotes,NumComments,Title,Url
6865,HackerNews,2020-07-03T16:30:47.000Z,1593793847,161,74,Botswana: Lab tests to solve mystery of hundreds of dead elephants,https://www.bbc.com/news/world-africa-53273361
6866,HackerNews,2020-07-03T15:35:08.000Z,1593790508,179,54,Org-roam: Emacs org file based personal knowledge base system,https://www.orgroam.com/
6867,HackerNews,2020-07-03T15:19:26.000Z,1593789566,108,87,Extracting video and audio from used police body cam,https://twitter.com/d0tslash/status/1278414895487365121
6868,HackerNews,2020-07-03T15:17:04.000Z,1593789424,78,35,Lessons learned from building a commercial open-source bot development platform,https://livablesoftware.com/lessons-learned-building-commercial-oss-bot-platform/
6869,HackerNews,2020-07-03T13:27:35.000Z,1593782855,77,48,There's never been an easier time to write your own language (2016),https://joshsharp.com.au/blog/never-been-an-easier-time-to-write-a-language.html
6870,HackerNews,2020-07-03T13:25:27.000Z,1593782727,83,22,CanaryTrap: Detecting data misuse by third-party apps on online social networks,https://arxiv.org/abs/2006.15794
6871,HackerNews,2020-07-03T13:24:20.000Z,1593782660,675,261,Zettlr – FOSS markdown editor for personal knowledge management and publishing,https://www.zettlr.com/
6872,HackerNews,2020-07-03T12:41:27.000Z,1593780087,306,216,Google-backed groups criticize Apple's new warnings on user tracking,https://uk.reuters.com/article/uk-google-apple/google-backed-groups-criticize-apples-new-warnings-on-user-tracking-idUKKBN2440VG
6873,HackerNews,2020-07-03T12:22:26.000Z,1593778946,106,158,It’s Time to Abolish Single-Family Zoning,https://www.theamericanconservative.com/urbs/its-time-to-abolish-single-family-zoning/
6874,HackerNews,2020-07-03T12:14:44.000Z,1593778484,88,91,Apple iPhone SE 2020 Camera review,https://www.dxomark.com/apple-iphone-se-2020-camera-review/
6875,HackerNews,2020-07-03T11:54:23.000Z,1593777263,88,14,A Group Is Its Own Worst Enemy (2003) [pdf],https://www.gwern.net/docs/technology/2005-shirky-agroupisitsownworstenemy.pdf
6876,HackerNews,2020-07-03T11:49:31.000Z,1593776971,77,14,"Building a BASIC Interpreter, '80s style",https://able.bio/kerrishotts/building-a-basic-interpreter-80s-style--79a9d703
6877,HackerNews,2020-07-03T11:42:06.000Z,1593776526,104,14,Web Design Museum 1991 – 2006,https://www.webdesignmuseum.org/
6878,HackerNews,2020-07-03T11:41:58.000Z,1593776518,108,196,“It'll all be over by Christmas” (Part 2),http://www.antipope.org/charlie/blog-static/2020/07/itll-all-be-over-by-christmas-.html
6879,HackerNews,2020-07-03T11:26:24.000Z,1593775584,150,19,Show HN: The Book of Minecraft Modding,https://thebookofmodding.ml/
6880,HackerNews,2020-07-03T10:33:05.000Z,1593772385,226,52,Ten Lessons I Wish I Had Been Taught (1997) [pdf],https://www.ams.org/notices/199701/comm-rota.pdf
6881,HackerNews,2020-07-03T09:58:15.000Z,1593770295,234,97,GPT-3 Creative Fiction,https://www.gwern.net/GPT-3
6882,HackerNews,2020-07-03T08:52:37.000Z,1593766357,202,45,Sphere Eversion,https://rreusser.github.io/explorations/sphere-eversion/
6883,HackerNews,2020-07-03T08:37:28.000Z,1593765448,176,47,QuickBasic64: Basic for the Modern Era,https://www.qb64.org/portal/
6884,HackerNews,2020-07-03T08:27:02.000Z,1593764822,518,163,"Openstreetmap, a global map for worldwide insight",https://blog.mapbox.com/openstreetmap-a-global-map-for-worldwide-insight-4e041cbf1ec1
6885,HackerNews,2020-07-03T08:14:10.000Z,1593764050,75,53,Finding the 'invisible' millions who are not on maps,https://www.bbc.com/news/business-52650856
6886,HackerNews,2020-07-03T07:37:36.000Z,1593761856,258,56,Leonardo da Vinci’s The Last Supper in a new gigapixel image,http://www.openculture.com/2020/06/an-immaculate-copy-of-leonardos-the-last-supper-digitized-by-google.html
6887,HackerNews,2020-07-03T07:18:59.000Z,1593760739,394,111,Barclays Bank Using Internet Archive as CDN for JavaScript Files?,https://twitter.com/immunda/status/1278783894683336704
6888,HackerNews,2020-07-03T06:53:56.000Z,1593759236,126,30,Intro to Fully Homomorphic Encryption,http://blog.higashi.tech/2020/06/16/fhe_01.html
6889,HackerNews,2020-07-03T06:28:44.000Z,1593757724,343,163,Guietta – Python module to create simple GUIs,https://github.com/alfiopuglisi/guietta
6890,HackerNews,2020-07-03T06:06:21.000Z,1593756381,142,99,Göbekli Tepe,https://en.wikipedia.org/wiki/Göbekli_Tepe
6891,HackerNews,2020-07-03T03:54:53.000Z,1593748493,91,131,There are more streaming choices than ever – why are prices going up?,https://www.theverge.com/21310442/tv-streaming-youtube-fubo-price-increases-carrier-fees-disputes-costs-cable-television
6892,HackerNews,2020-07-03T01:31:00.000Z,1593739860,285,162,EU safety agency suspends Pakistani airlines' European authorisation,https://www.reuters.com/article/us-pakistan-airlines-eu/eu-safety-agency-suspends-pakistani-airlines-european-authorisation-for-six-months-idUSKBN2412MT
6893,HackerNews,2020-07-03T00:46:34.000Z,1593737194,139,144,A 1950s proposal to nuke Alaska (2015),https://www.atlasobscura.com/articles/actual-1950s-proposal-nuke-alaska
6894,HackerNews,2020-07-03T00:09:41.000Z,1593734981,376,294,Politically-correct witch-hunt is killing free speech,https://medium.com/@sarahadowney/this-politically-correct-witch-hunt-is-killing-free-speech-and-we-have-to-fight-it-7ced038d33ae
6895,HackerNews,2020-07-02T21:34:37.000Z,1593725677,100,59,Silicon Valley Elite Discuss Journalists Having Too Much Power in Private App,https://www.vice.com/en_us/article/n7w3zw/silicon-valley-elite-discuss-journalists-having-too-much-power-in-private-app
6896,HackerNews,2020-07-02T21:30:13.000Z,1593725413,232,22,The BEAM Book (2017),https://blog.stenmans.org/theBeamBook/
6897,HackerNews,2020-07-02T21:21:47.000Z,1593724907,169,159,Drug overdoses are soaring during the coronavirus pandemic,https://www.washingtonpost.com/health/2020/07/01/coronavirus-drug-overdose/
6898,HackerNews,2020-07-02T20:49:50.000Z,1593722990,184,160,Edge install undermines Microsoft’s argument that automatic updates are critical,https://www.theverge.com/21310611/microsoft-edge-browser-forced-update-chromium-editorial
6899,HackerNews,2020-07-02T20:38:34.000Z,1593722314,289,104,Anti-algorithmic music: How Bandcamp is helping artists beat the odds,https://www.residentadvisor.net/features/3703
6900,HackerNews,2020-07-02T19:49:14.000Z,1593719354,100,112,Does saying “Fuck You AWS” constitute offensive content?,http://thoughts.josephdeon.me/2020/07/02/fuck-you-aws.html
6901,HackerNews,2020-07-02T19:45:28.000Z,1593719128,103,7,RenderMan and Funko Games,https://renderman.pixar.com/stories/renderman-and-funko-games
6902,HackerNews,2020-07-02T19:26:43.000Z,1593718003,228,37,Crooked to the Millimetre,https://ethz.ch/en/news-and-events/eth-news/news/2020/07/crooked-to-the-millimetre.html
6903,HackerNews,2020-07-02T18:33:48.000Z,1593714828,928,360,LinkedIn is copying the contents of my clipboard on every keystroke,https://twitter.com/doncubed/status/1278757106468806656
6904,HackerNews,2020-07-02T18:10:29.000Z,1593713429,151,68,LFortran: Modern interactive LLVM-based Fortran compiler,https://lfortran.org/
6905,HackerNews,2020-07-02T17:38:03.000Z,1593711483,302,210,"Boeing quietly pulls plug on the 747, closing era of jumbo jets",https://www.bloomberg.com/news/articles/2020-07-02/boeing-quietly-pulls-plug-on-the-747-closing-era-of-jumbo-jets
6906,HackerNews,2020-07-02T17:20:07.000Z,1593710407,255,239,Zuckerberg: advertisers will be back to Facebook 'soon enough',https://www.bbc.com/news/technology-53262860
6907,HackerNews,2020-07-02T17:19:30.000Z,1593710370,144,177,Json-Base – Database built as JSON files,https://github.com/Devs-Garden/jsonbase
6908,HackerNews,2020-07-02T16:51:05.000Z,1593708665,75,8,Fixing critical vulnerabilities in Apache's remote desktop,https://blog.checkpoint.com/2020/07/02/hole-y-guacamole-fixing-critical-vulnerabilities-in-apaches-popular-remote-desktop-gateway/
6909,HackerNews,2020-07-02T16:47:26.000Z,1593708446,288,810,MS will ban Forza players who add the confederate flag to their digital cars,https://www.theverge.com/2020/6/30/21308677/microsoft-forza-player-ban-confederate-flag-hate-symbols
6910,HackerNews,2020-07-02T16:32:59.000Z,1593707579,200,118,"Robin Williams, an acid trip, and moral panic: “Blame Canada” at the Oscars",https://www.theringer.com/tv/2020/6/24/21301245/south-park-2000-oscars-blame-canada-controversy
6911,HackerNews,2020-07-02T16:27:23.000Z,1593707243,102,45,Neural Supersampling for Real-Time Rendering,https://research.fb.com/blog/2020/07/introducing-neural-supersampling-for-real-time-rendering/
6912,HackerNews,2020-07-02T16:17:46.000Z,1593706666,798,227,Abstract Wikipedia,https://meta.wikimedia.org/wiki/Abstract_Wikipedia/June_2020_announcement
6913,HackerNews,2020-07-02T15:54:33.000Z,1593705273,98,151,"Markets, Rent and WFH",https://macrocrunch.substack.com/p/markets-rent-and-wfh
6914,HackerNews,2020-07-02T15:33:47.000Z,1593704027,81,113,Modern Android is pretty secure,https://palone.blog/#post-your-android-might-be-the-most-secure-device-you-own-4
6915,HackerNews,2020-07-02T15:09:34.000Z,1593702574,137,65,Urban Gilgamesh: What the earliest epic tells us about living in an ancient city,https://www.laphamsquarterly.org/roundtable/urban-gilgamesh
6916,HackerNews,2020-07-02T14:15:36.000Z,1593699336,95,48,Synthetic Data for Deep Learning (2019),https://arxiv.org/abs/1909.11512
6917,HackerNews,2020-07-02T14:13:20.000Z,1593699200,149,217,"Uber CEO Wants to Shift More Engineering Jobs to India, Sparking Internal Debate",https://www.theinformation.com/articles/uber-ceo-wants-to-shift-more-engineering-jobs-to-india-sparking-internal-debate
6918,HackerNews,2020-07-02T13:33:04.000Z,1593696784,126,78,Ghislaine Maxwell arrested by the FBI,https://www.thedailybeast.com/ghislaine-maxwell-jeffrey-epsteins-confidante-arrested-by-the-fbi-report-says
6919,HackerNews,2020-07-02T12:33:48.000Z,1593693228,163,229,Systemd: Don’t fallback to Google NTP and DNS,https://github.com/systemd/systemd/issues/12499
6920,HackerNews,2020-07-02T11:55:36.000Z,1593690936,222,80,Estonian Electronic Identity Card: Security Flaws in Key Management,https://www.usenix.org/conference/usenixsecurity20/presentation/parsovs
6921,HackerNews,2020-07-02T11:51:32.000Z,1593690692,77,15,Show HN: Dyna-Kinematics – A 2D physics simulator with some unique features,https://github.com/diegomacario/Dyna-Kinematics
6922,HackerNews,2020-07-02T11:50:42.000Z,1593690642,199,49,RCE on Telia Routers,https://full-disclosure.eu/reports/2019/FDEU-CVE-2019-10222-telia-savitarna-backdoor.html
6923,HackerNews,2020-07-02T11:29:58.000Z,1593689398,137,45,HotSpot compiler: Stack allocation prototype for C2,https://mail.openjdk.java.net/pipermail/hotspot-compiler-dev/2020-June/038779.html
6924,HackerNews,2020-07-02T11:12:39.000Z,1593688359,334,365,Hundreds arrested as crime chat network cracked,https://www.bbc.com/news/uk-53263310
6925,HackerNews,2020-07-02T10:47:21.000Z,1593686841,151,57,How Police Secretly Took over a Global Phone Network for Organized Crime,https://www.vice.com/en_us/article/3aza95/how-police-took-over-encrochat-hacked
6926,HackerNews,2020-07-02T10:45:56.000Z,1593686756,95,20,Differential privacy tools from MS Research and Harvard,https://blogs.microsoft.com/on-the-issues/2020/06/24/differential-privacy-harvard-opendp/
6927,HackerNews,2020-07-02T10:20:04.000Z,1593685204,250,375,"Go is boring, and that’s fantastic",https://www.capitalone.com/tech/software-engineering/go-is-boring/
6928,HackerNews,2020-07-02T10:10:04.000Z,1593684604,96,24,Show HN: Ward – Minimalistic Server Dashboard,https://github.com/B-Software/Ward
6929,HackerNews,2020-07-02T10:08:22.000Z,1593684502,242,61,Impressive backyard engineering on an obscure YouTube channel,https://www.thedrive.com/news/34554/some-of-the-most-impressive-backyard-engineering-weve-seen-goes-down-on-this-obscure-youtube-channel
6930,HackerNews,2020-07-02T09:57:29.000Z,1593683849,105,49,AsciiDoc Language Submitted to Eclipse Foundation,https://projects.eclipse.org/proposals/asciidoc-language
6931,HackerNews,2020-07-02T09:29:18.000Z,1593682158,88,37,"Things I wish I had known when I started programming, Part 4 (2019)",https://www.brainstobytes.com/advice-for-new-developers-or-things-i-wish-i-had-known-when-i-started-programming-part-4/
6932,HackerNews,2020-07-02T09:26:12.000Z,1593681972,92,25,Single-use JIT Performance on x86 Processors,https://github.com/animetosho/jit_smc_test/blob/master/README.md
6933,HackerNews,2020-07-02T07:27:39.000Z,1593674859,191,21,Understanding Convolutional Neural Networks,https://poloclub.github.io/cnn-explainer/
6934,HackerNews,2020-07-02T06:25:41.000Z,1593671141,754,92,The Sci-Hub Effect: Sci-Hub downloads lead to more article citations,https://arxiv.org/abs/2006.14979
6935,HackerNews,2020-07-02T05:44:46.000Z,1593668686,155,98,Algolia introduces pay-as-you-go pricing for search,https://blog.algolia.com/introducing-algolias-most-customer-friendly-pricing
6936,HackerNews,2020-07-02T05:11:52.000Z,1593666712,175,103,"On moving from statistics to machine learning, the final stage of grief (2019)",https://ryxcommar.com/2019/07/14/on-moving-from-statistics-to-machine-learning-the-final-stage-of-grief/
6937,HackerNews,2020-07-02T04:07:49.000Z,1593662869,94,57,Peppering (Password Storage),https://cheatsheetseries.owasp.org/cheatsheets/Password_Storage_Cheat_Sheet.html#peppering
6938,HackerNews,2020-07-02T04:03:23.000Z,1593662603,134,60,New Mac Ransomware Is Even More Sinister Than It Appears,https://www.wired.com/story/new-mac-ransomware-thiefquest-evilquest/
6939,HackerNews,2020-07-02T02:37:16.000Z,1593657436,85,111,Why Facebook is well placed to weather an advertising boycott,https://www.economist.com/business/2020/07/01/why-facebook-is-well-placed-to-weather-an-advertising-boycott
6940,HackerNews,2020-07-02T01:32:26.000Z,1593653546,707,266,Space Jam's 1996 website is still alive,https://www.spacejam.com/
6941,HackerNews,2020-07-02T00:58:05.000Z,1593651485,112,35,GShard: Scaling giant models with conditional computation and automatic sharding,https://arxiv.org/abs/2006.16668
6942,HackerNews,2020-07-02T00:56:54.000Z,1593651414,93,25,Quantum fluctuations have been shown to affect macroscopic objects,https://www.nature.com/articles/d41586-020-01914-4
6943,HackerNews,2020-07-02T00:41:01.000Z,1593650461,176,139,RedHat Mandrel Makes Java Native,https://www.infoq.com/news/2020/07/mandrel-graalvm/
6944,HackerNews,2020-07-01T23:44:33.000Z,1593647073,97,126,No More Coffee,https://jayriverlong.github.io/2020/06/30/coffee.html
6945,HackerNews,2020-07-01T23:39:02.000Z,1593646742,824,488,DuckDuckGo browser seemingly sends domains a user visits to DDG servers,https://github.com/duckduckgo/Android/issues/527
6946,HackerNews,2020-07-01T23:26:22.000Z,1593645982,238,58,Comparing how different devices display the SSID “á̶̛̛̓̿̈͐͆̐̇̒̑̈́͘͝aaa”,https://hamptonmoore.com/posts/weird-wifi-name-display/
6947,HackerNews,2020-07-01T23:09:21.000Z,1593644961,102,39,Hundreds of Botswana elephants dead in mysterious mass die-off,https://www.theguardian.com/environment/2020/jul/01/more-than-350-elephants-dead-in-mysterious-mass-die-off-botswana-aoe
6948,HackerNews,2020-07-01T22:01:05.000Z,1593640865,147,66,Ray Tracing in Nim,https://nim-lang.org/blog/2020/06/30/ray-tracing-in-nim.html
6949,HackerNews,2020-07-01T21:23:52.000Z,1593638632,101,52,Substack has spawned a new class of newsletter entrepreneurs,https://digiday.com/media/how-substack-has-spawned-a-new-class-of-newsletter-entrepreneurs/
6950,HackerNews,2020-07-01T20:15:54.000Z,1593634554,198,118,Japan auto companies triple Mexican pay rather than move to US,https://asia.nikkei.com/Business/Automobiles/Japan-auto-companies-triple-Mexican-pay-rather-than-move-to-US
6951,HackerNews,2020-07-01T20:12:14.000Z,1593634334,188,250,The percentage of Americans who are employed has fallen from 61 to 51,https://www.axios.com/half-us-population-unemployed-341ba30c-777e-4ba2-bccf-d2274b2770f0.html
6952,HackerNews,2020-07-01T19:52:23.000Z,1593633143,280,399,San Francisco apartment rent prices are dropping fast,https://www.cnbc.com/2020/07/01/san-francisco-one-bedroom-rent-price-drops-11point8percent-in-june-zumper.html
6953,HackerNews,2020-07-01T19:37:18.000Z,1593632238,597,229,Apple Lightning,https://nyansatan.github.io/lightning/
6954,HackerNews,2020-07-01T19:33:51.000Z,1593632031,337,214,"Invasive, secretive “bossware” tracking workers",https://www.eff.org/deeplinks/2020/06/inside-invasive-secretive-bossware-tracking-workers
6955,HackerNews,2020-07-01T19:06:36.000Z,1593630396,302,226,"Kongregate closed to new games, shutting down forums and chat",https://www.kongregate.com/forums/1-kongregate/topics/1916387-important-kongregate-announcement
6956,HackerNews,2020-07-01T18:48:08.000Z,1593629288,164,66,"Show HN: Browse recently expired, pronounceable domain names (Part II)",https://decentdrops.com
6957,HackerNews,2020-07-01T18:04:29.000Z,1593626669,349,508,How the 2021 Ford F-150's onboard generator works,https://www.roadandtrack.com/new-cars/car-technology/a32970167/f-150-generator-pro-power-onboard/
6958,HackerNews,2020-07-01T17:45:02.000Z,1593625502,279,33,The Whimsical Website Club,https://whimsical.club/
6959,HackerNews,2020-07-01T17:32:29.000Z,1593624749,362,277,A Google bot scrapes pricing info by adding items to carts,https://www.wsj.com/articles/who-is-the-mystery-shopper-leaving-behind-all-those-online-shopping-carts-11593617464
6960,HackerNews,2020-07-01T16:34:24.000Z,1593621264,2229,543,Oppose the Earn IT Act,https://foundation.mozilla.org/en/campaigns/oppose-earn-it-act/
6961,HackerNews,2020-07-01T15:48:07.000Z,1593618487,81,29,An overview of V8,https://blog.appsignal.com/2020/07/01/a-deep-dive-into-v8.html
6962,HackerNews,2020-07-01T15:46:38.000Z,1593618398,138,59,How to list all the targets on a Makefile,https://diamantidis.github.io/tips/2020/07/01/list-makefile-targets
6963,HackerNews,2020-07-01T15:32:17.000Z,1593617537,301,161,Moldova Shuts Down Bootleg Helicopter Factory,https://balkaninsight.com/2020/06/30/moldova-shuts-down-bootleg-helicopter-factory/
6964,HackerNews,2020-07-01T15:31:32.000Z,1593617492,392,147,Fighter pilot breaks down every button in an F-15 cockpit [video],https://www.youtube.com/watch?v=zikI2fazPLo
6965,HackerNews,2020-07-01T15:30:13.000Z,1593617413,386,28,Lights and Shadows,https://ciechanow.ski/lights-and-shadows/
6966,HackerNews,2020-07-01T15:20:26.000Z,1593616826,122,152,Magic hat leaves behind a transformed craft beer industry in Vermont,https://www.sevendaysvt.com/vermont/magic-hat-leaves-behind-a-transformed-craft-beer-industry-in-vermont/Content?oid=30705701
6967,HackerNews,2020-07-01T14:56:55.000Z,1593615415,146,40,The gap between learning code and producing usable software,https://yassine.substack.com/p/the-gap-between-learning-code-and
6968,HackerNews,2020-07-01T14:52:58.000Z,1593615178,209,109,Deconstructing Pinterest’s reverse-image-search SEO growth hack,https://www.rankscience.com/blog/pinterest-image-seo-growth-hack
6969,HackerNews,2020-07-01T14:49:31.000Z,1593614971,151,42,Multiple service providers are blocking DuckDuckGo in India,https://thenextweb.com/in/2020/07/01/multiple-service-providers-are-blocking-duckduckgo-in-india/
6970,HackerNews,2020-07-01T14:38:57.000Z,1593614337,110,13,"Show HN: Delightfully animated, bite-sized knowledge",http://www.brainfoodapp.co
6971,HackerNews,2020-07-01T14:16:51.000Z,1593613011,91,16,A man who saved a generation of premature babies (2016),https://www.bbc.co.uk/news/magazine-36321692
6972,HackerNews,2020-07-01T14:01:44.000Z,1593612104,354,144,Not a Wheelchair [video],https://www.youtube.com/watch?v=vuMg0QwKAGI
6973,HackerNews,2020-07-01T13:55:49.000Z,1593611749,165,11,Show HN: Pygooglenews – Python library for advanced Google News data mining,https://github.com/kotartemiy/pygooglenews
6974,HackerNews,2020-07-01T13:55:34.000Z,1593611734,90,45,"Phrases that incorrectly trigger Alexa, Siri, and Google Assistant",https://arstechnica.com/information-technology/2020/07/uncovered-1000-phrases-that-incorrectly-trigger-alexa-siri-and-google-assistant/
6975,HackerNews,2020-07-01T13:55:03.000Z,1593611703,353,375,Hong Kong: UK makes citizenship offer to residents,https://www.bbc.co.uk/news/uk-politics-53246899
6976,HackerNews,2020-07-01T13:53:31.000Z,1593611611,198,164,"Norwegian Air cancels order for 97 Boeing aircraft, sues Boeing",https://airlinegeeks.com/2020/06/30/norwegian-air-cancels-order-for-97-boeing-aircraft-sues-boeing/
6977,HackerNews,2020-07-01T13:52:45.000Z,1593611565,168,58,What It’s Like to Report on Facebook,https://www.cjr.org/special_report/reporting-on-facebook.php
6978,HackerNews,2020-07-01T13:51:24.000Z,1593611484,302,217,Apple forcing app developers to implement auto-billing after free trial,https://old.reddit.com/r/assholedesign/comments/hj57fv/apple_forcing_app_developers_to_implement/
6979,HackerNews,2020-07-01T13:43:08.000Z,1593610988,236,177,Raspberry Pi 4 PCIe bridge “chip”,https://blog.zakkemble.net/rpi4-pci-express-bridge-chip/
6980,HackerNews,2020-07-01T13:27:17.000Z,1593610037,226,192,Almost everything on computers is perceptually slower than it was in 1983 (2017),https://twitter.com/gravislizard/status/927593460642615296
6981,HackerNews,2020-07-01T13:20:56.000Z,1593609656,214,213,"Turkey determined to control social media platforms, Erdogan says",https://uk.reuters.com/article/uk-turkey-security-socialmedia/turkey-determined-to-control-social-media-platforms-erdogan-says-idUKKBN2425Y4
6982,HackerNews,2020-07-01T12:56:28.000Z,1593608188,118,25,Taking over Azure DevOps accounts with one click,https://blog.assetnote.io/2020/06/28/subdomain-takeover-to-account-takeover/
6983,HackerNews,2020-07-01T12:06:11.000Z,1593605171,245,121,Show HN: Coding Career Handbook,https://www.learninpublic.org/?from=Hacker%20News
6984,HackerNews,2020-07-01T11:42:43.000Z,1593603763,102,14,Studies in Intelligence [pdf],https://www.cia.gov/library/center-for-the-study-of-intelligence/csi-publications/csi-studies/studies/vol-64-no-1/pdfs/Studies-64-1-March-2020-UnclassifiedExtracts.pdf
6985,HackerNews,2020-07-01T11:30:05.000Z,1593603005,385,93,Intuitive Guide to Maxwell's Equations,https://github.com/photonlines/Intuitive-Guide-to-Maxwells-Equations
6986,HackerNews,2020-07-01T11:27:47.000Z,1593602867,151,100,"German stock trading platform Xetra down, all securities affected",https://thestarphoenix.com/pmn/business-pmn/german-stock-trading-platform-xetra-down-all-securities-affected/
6987,HackerNews,2020-07-01T10:52:12.000Z,1593600732,230,147,Web Dark Ages,https://pavellaptev.github.io/web-dark-ages/
6988,HackerNews,2020-07-01T10:48:14.000Z,1593600494,365,198,A researcher on how to live a happy life,http://www.ox.ac.uk/research/research-in-conversation/how-live-happy-life/michael-plant
6989,HackerNews,2020-07-01T10:30:16.000Z,1593599416,91,52,Who Needs an Architect? (2003) [pdf],https://martinfowler.com/ieeeSoftware/whoNeedsArchitect.pdf
6990,HackerNews,2020-07-01T10:14:37.000Z,1593598477,296,339,Hazard pay in focus as essential workers earn less than the jobless,https://www.npr.org/2020/07/01/882957793/when-essential-workers-earn-less-than-the-jobless-we-put-the-country-on-our-back
6991,HackerNews,2020-07-01T09:59:04.000Z,1593597544,101,10,Museum of Digital Art forced to close its doors,https://muda.co/closing/
6992,HackerNews,2020-07-01T08:12:10.000Z,1593591130,152,116,USA buys up world stock of remdesivir,https://www.theguardian.com/us-news/2020/jun/30/us-buys-up-world-stock-of-key-covid-19-drug
6993,HackerNews,2020-07-01T07:35:59.000Z,1593588959,232,129,What is the core of the Python programming language?,https://snarky.ca/what-is-the-core-of-the-python-programming-language/
6994,HackerNews,2020-07-01T07:08:23.000Z,1593587303,155,58,"The caretakers of Sealand, the most stubborn micronation",https://www.atlasobscura.com/articles/caretakers-of-sealand
6995,HackerNews,2020-07-01T06:16:04.000Z,1593584164,95,24,Local area network push notifications,https://thomask.sdf.org/blog/2020/07/01/local-area-network-push-notifications.html
6996,HackerNews,2020-07-01T06:14:09.000Z,1593584049,202,81,Entr: Rerun your build when files change,https://jvns.ca/blog/2020/06/28/entr/
6997,HackerNews,2020-07-01T06:13:46.000Z,1593584026,142,158,Tell candidates what to expect from your job interviews,https://jvns.ca/blog/2020/06/30/tell-candidates-what-to-expect-from-your-job-interviews/
6998,HackerNews,2020-07-01T06:11:19.000Z,1593583879,92,46,Classic ThinkPad Thermal Paste Change,https://vermaden.wordpress.com/2020/06/30/classic-thinkpad-thermal-paste-change/
6999,HackerNews,2020-07-01T05:07:41.000Z,1593580061,140,100,Cirque Du Soleil Files for Bankruptcy Protection,https://www.wsj.com/articles/cirque-du-soleil-files-for-bankruptcy-protection-in-canada-11593455498
7000,HackerNews,2020-07-01T04:30:39.000Z,1593577839,101,121,The world of cheap produce and its consequences,https://www.the-tls.co.uk/articles/cheap-food-consequences-bee-wilson-book-review/
7001,HackerNews,2020-07-01T02:26:35.000Z,1593570395,358,592,California accuses Cisco of job discrimination based on Indian employee's caste,https://www.reuters.com/article/us-cisco-lawsuit/california-accuses-cisco-of-job-discrimination-based-on-indian-employees-caste-idUSKBN2423YE
7002,HackerNews,2020-07-01T00:31:37.000Z,1593563497,218,507,Yann LeCun quits Twitter amid acrimonious exchanges on AI bias,https://syncedreview.com/2020/06/30/yann-lecun-quits-twitter-amid-acrimonious-exchanges-on-ai-bias/
7003,HackerNews,2020-06-30T23:52:55.000Z,1593561175,133,26,"Show HN: Program “Greppy”, a 2-wheeled robot, using a new robotics language",https://yoga.dev/timeshared-robots/
