ID,Source,TimeGST,TimeEpoch,Upvotes,NumComments,Title,Url
6286,HackerNews,2020-07-14T23:32:48.000Z,1594769568,79,1,Facebook and CMU Introduce TaBERT for Understanding Tabular Data Queries,https://syncedreview.com/2020/07/14/facebook-cmu-introduce-tabert-for-understanding-tabular-data-queries/
6287,HackerNews,2020-07-14T23:27:44.000Z,1594769264,87,52,Twilio Acquires Electric Imp,https://www.twilio.com/blog/electric-imp-is-now-part-of-twilio
6288,HackerNews,2020-07-14T23:15:42.000Z,1594768542,194,32,"In search of 2.11BSD, as originally released",https://bsdimp.blogspot.com/2020/07/211bsd-original-tapes-recreation.html
6289,HackerNews,2020-07-14T23:08:29.000Z,1594768109,153,92,AWS Copilot,https://aws.amazon.com/blogs/containers/introducing-aws-copilot/
6290,HackerNews,2020-07-14T21:36:45.000Z,1594762605,85,8,Open Satellite Project: The Open Source Satellite Project,https://github.com/opensatelliteproject
6291,HackerNews,2020-07-14T21:25:43.000Z,1594761943,214,86,SEC issues $3.8M whistleblower award,https://www.sec.gov/news/press-release/2020-155
6292,HackerNews,2020-07-14T21:03:55.000Z,1594760635,263,47,Understanding and writing a JPEG decoder in Python,https://yasoob.me/posts/understanding-and-writing-jpeg-decoder-in-python/
6293,HackerNews,2020-07-14T21:02:56.000Z,1594760576,425,326,Starlink WiFi Router FCC Approved,https://fcc.report/FCC-ID/2AWHPR201
6294,HackerNews,2020-07-14T20:23:57.000Z,1594758237,286,199,TikTok Agreed to Buy More Than $800M in Cloud Services from Google,https://www.theinformation.com/articles/tiktok-agreed-to-buy-more-than-800-million-in-cloud-services-from-google
6295,HackerNews,2020-07-14T20:18:36.000Z,1594757916,82,24,Recreating YikYak with Postgres,https://adamfallon.com/2020/07/10/recreating-yikyak-with-postgres/
6296,HackerNews,2020-07-14T20:16:54.000Z,1594757814,148,119,Bringing the print statement back,https://lwn.net/ml/python-ideas/CAP7+vJKsrT-n4rHjaR4PYPRq09JOZcoR54ZjkboOkZcYhB+7oA@mail.gmail.com/
6297,HackerNews,2020-07-14T20:06:28.000Z,1594757188,123,48,Researchers generate complete human X chromosome sequence,https://www.genome.gov/news/news-release/NHGRI-researchers-generate-complete-human-x-chromosome-sequence
6298,HackerNews,2020-07-14T19:57:32.000Z,1594756652,186,218,The Khmer Rouge: Genocide in the Name of Utopia (2016),https://openendedsocialstudies.org/2016/06/24/the-khmer-rouge-genocide-in-the-name-of-utopia/
6299,HackerNews,2020-07-14T19:49:48.000Z,1594756188,171,133,Doom Eternal Privacy Policy Allows Collection and Disclosure of Medical Records,https://wrap.bnet.idtech.services/legal/?limited=true&fragment=https%3A%2F%2Fbethesda.net%2Fdata%2Fpp%2Fen_fr.html
6300,HackerNews,2020-07-14T19:30:49.000Z,1594755049,498,257,"U.S. backs down in fight with Harvard, MIT over student visas",https://www.bloomberg.com/news/articles/2020-07-14/harvard-and-u-s-make-deal-on-foreign-student-visas
6301,HackerNews,2020-07-14T19:27:54.000Z,1594754874,166,63,Experimental evidence of massive-scale emotional contagion thru social networks (2014),https://www.pnas.org/content/111/24/8788
6302,HackerNews,2020-07-14T18:38:51.000Z,1594751931,964,507,You've only added two lines – why did that take two days?,https://www.mrlacey.com/2020/07/youve-only-added-two-lines-why-did-that.html
6303,HackerNews,2020-07-14T16:58:06.000Z,1594745886,133,123,AMD Announces Ryzen Threadripper Pro: Workstation Parts for OEMs Only,https://www.anandtech.com/show/15910/amd-announces-ryzen-threadripper-pro-workstation-parts-for-oems-only
6304,HackerNews,2020-07-14T16:38:26.000Z,1594744706,493,190,How to Run a Live Coding Stream on Twitch Using OBS,https://jordanlewis.org/posts/twitch-live-coding/
6305,HackerNews,2020-07-14T15:57:05.000Z,1594742225,148,99,Google faces €600k privacy fine in Belgium,https://www.brusselstimes.com/all-news/business/technology/121533/google-faces-e600000-privacy-fine-in-belgium/
6306,HackerNews,2020-07-14T15:51:48.000Z,1594741908,1285,630,"Etcd, or, why modern software makes me sad",https://www.roguelazer.com/2020/07/etcd-or-why-modern-software-makes-me-sad/
6307,HackerNews,2020-07-14T15:43:34.000Z,1594741414,654,647,Resignation Letter,https://www.bariweiss.com/resignation-letter
6308,HackerNews,2020-07-14T15:34:18.000Z,1594740858,858,610,German court bans Tesla ad statements related to autonomous driving,https://mobile.reuters.com/article/idUSKCN24F1T5
6309,HackerNews,2020-07-14T14:39:04.000Z,1594737544,98,94,Verizon has turned to Google Cloud’s Contact Center AI to automate phone calls,https://www.theregister.com/2020/07/13/if_customer_service_for_verizon/
6310,HackerNews,2020-07-14T14:20:31.000Z,1594736431,182,97,Hundreds of hyperpartisan sites are masquerading as local news,https://www.niemanlab.org/2020/07/hundreds-of-hyperpartisan-sites-are-masquerading-as-local-news-this-map-shows-if-theres-one-near-you/
6311,HackerNews,2020-07-14T14:20:02.000Z,1594736402,76,10,Critical SAP Bug Allows Full Enterprise System Takeover,https://threatpost.com/critical-sap-bug-enterprise-system-takeover/157392/
6312,HackerNews,2020-07-14T14:14:08.000Z,1594736048,353,356,The TikTok War,https://stratechery.com/2020/the-tiktok-war/
6313,HackerNews,2020-07-14T14:11:31.000Z,1594735891,165,49,Eventual Consistency isn’t for Streaming,https://materialize.io/eventual-consistency-isnt-for-streaming/
6314,HackerNews,2020-07-14T13:47:59.000Z,1594734479,80,20,BMG: A Production Ready Relational Algebra in Ruby,https://github.com/enspirit/bmg
6315,HackerNews,2020-07-14T13:44:45.000Z,1594734285,154,55,Show HN: 14 Habits of Highly Productive Developers – New Book,https://14habits.com/
6316,HackerNews,2020-07-14T13:28:13.000Z,1594733293,269,130,Poland puts computer game “This War of Mine” on school reading list,https://notesfrompoland.com/2020/06/18/poland-puts-computer-game-this-war-of-mine-on-school-reading-list/
6317,HackerNews,2020-07-14T13:05:23.000Z,1594731923,125,91,Potential large-scale CO2 removal via enhanced rock weathering with croplands,https://www.nature.com/articles/s41586-020-2448-9
6318,HackerNews,2020-07-14T12:27:47.000Z,1594729667,181,168,Confidential VMs,https://cloud.google.com/blog/products/identity-security/introducing-google-cloud-confidential-computing-with-confidential-vms
6319,HackerNews,2020-07-14T12:06:30.000Z,1594728390,293,421,Huawei 5G kit must be removed from UK by 2027,https://www.bbc.com/news/technology-53403793
6320,HackerNews,2020-07-14T11:01:52.000Z,1594724512,89,49,Could predictive database queries replace machine learning models?,https://aito.ai/blog/could-predictive-database-queries-replace-machine-learning-models
6321,HackerNews,2020-07-14T10:53:19.000Z,1594723999,257,411,Is It Time to Kill the Penny?,https://www.npr.org/sections/money/2020/07/14/890435359/is-it-time-to-kill-the-penny
6322,HackerNews,2020-07-14T10:11:12.000Z,1594721472,319,89,Show HN: Is It Worth the Cost?,https://isitworththecost.com/
6323,HackerNews,2020-07-14T09:20:59.000Z,1594718459,90,23,How Late Zhou China Reverse-Engineered a Civilization,https://palladiummag.com/2020/07/10/how-late-zhou-china-reverse-engineered-a-civilization/
6324,HackerNews,2020-07-14T09:12:11.000Z,1594717931,136,123,Microsoft adding support for custom '+' email addresses in Office 365,https://www.zdnet.com/article/microsoft-adds-support-for-custom-email-addresses-in-office-365/
6325,HackerNews,2020-07-14T09:07:27.000Z,1594717647,150,194,Have we let the LED indicator light go too far?,https://tedium.co/2020/07/10/led-indicator-light-history/
6326,HackerNews,2020-07-14T07:42:32.000Z,1594712552,86,35,The coronavirus pandemic has changed our sleep,https://jeffhuang.com/covid_sleep/
6327,HackerNews,2020-07-14T06:10:25.000Z,1594707025,94,3,Show HN: Koinly: Bitcoin and Cryptocurrency Tax Calculator,https://koinly.io/
6328,HackerNews,2020-07-14T05:46:10.000Z,1594705570,202,84,LXD – next generation system container manager release 4.3,https://discuss.linuxcontainers.org/t/lxd-4-3-has-been-released/8303
6329,HackerNews,2020-07-14T05:29:14.000Z,1594704554,121,48,"Grant Imahara, host of MythBusters, dies at 49",https://www.wlwt.com/article/grant-imahara-host-of-mythbusters-dies-at-49/33305253#
6330,HackerNews,2020-07-14T04:21:54.000Z,1594700514,149,47,"Pixelopolis, a self-driving car demo from Google I/O built with TensorFlow-Lite",https://blog.tensorflow.org/2020/07/pixelopolis-self-driving-car-demo-tensorflow-lite.html
6331,HackerNews,2020-07-14T04:17:02.000Z,1594700222,524,375,"Ex-Googler's startup comes out of stealth with simple, clever robot design",https://spectrum.ieee.org/automaton/robotics/home-robots/hello-robots-stretch-mobile-manipulator
6332,HackerNews,2020-07-14T04:09:39.000Z,1594699779,309,127,"Grant Imahara, ‘Mythbusters’ Host, Dies at 49",https://variety.com/2020/tv/news/grant-imahara-mythbusters-dead-dies-1234705834/
6333,HackerNews,2020-07-14T03:45:51.000Z,1594698351,176,67,Homemade Liquid Nitrogen Generator,http://homemadeliquidnitrogen.com/
6334,HackerNews,2020-07-14T03:44:38.000Z,1594698278,85,120,How do unschoolers turn out? (2014),https://www.kqed.org/mindshift/37091/how-do-unschoolers-turn-out
6335,HackerNews,2020-07-14T03:38:16.000Z,1594697896,1963,85,Grant Imahara Has Died,https://www.hollywoodreporter.com/news/grant-imahara-dead-mythbusters-host-was-49-1303101
6336,HackerNews,2020-07-14T01:59:29.000Z,1594691969,144,164,The international student bait-and-switch,https://themargins.substack.com/p/the-international-student-bait-and
6337,HackerNews,2020-07-14T01:41:06.000Z,1594690866,102,38,BigCommerce S1,https://www.sec.gov/Archives/edgar/data/1626450/000119312520191966/d844671ds1.htm
6338,HackerNews,2020-07-14T01:12:34.000Z,1594689154,85,88,Strange public IPv4 address assigned behind NAT (2019),https://broadbandforum.co/t/190267/
6339,HackerNews,2020-07-14T01:07:25.000Z,1594688845,226,65,Hacking with environment variables,https://www.elttam.com/blog/env/
6340,HackerNews,2020-07-14T00:01:21.000Z,1594684881,95,94,Porsche found a way to 3D-print lightweight pistons that add more horsepower,https://www.thedrive.com/tech/34775/porsche-found-a-way-to-3d-print-lightweight-pistons-that-add-even-more-horsepower
6341,HackerNews,2020-07-13T23:58:25.000Z,1594684705,200,182,Do journalists pay too much attention to Twitter? (2018),https://www.cjr.org/the_media_today/journalists-on-twitter-study.php
6342,HackerNews,2020-07-13T23:56:22.000Z,1594684582,77,47,Scientists Discovered a Gigantic Structure in a Hidden Zone of Space,https://www.vice.com/en_us/article/xg8vg7/scientists-discovered-a-gigantic-structure-in-a-hidden-zone-of-space
6343,HackerNews,2020-07-13T23:44:48.000Z,1594683888,109,73,The Winnebago Heli-Home Was a Real Flying RV,https://www.thedrive.com/news/34753/the-winnebago-heli-home-was-a-real-flying-rv-that-needs-to-make-a-comeback-in-2020
6344,HackerNews,2020-07-13T23:06:17.000Z,1594681577,104,16,Small satellites are radically remaking space exploration,https://arstechnica.com/science/2020/07/how-small-satellites-are-radically-remaking-space-exploration/
6345,HackerNews,2020-07-13T22:16:13.000Z,1594678573,211,130,Andean condor can fly for 100 miles without flapping wings,https://www.theguardian.com/environment/2020/jul/13/andean-condor-fly-without-flapping-wings-flight-bird
6346,HackerNews,2020-07-13T22:02:25.000Z,1594677745,501,454,The AirPods Pro “Rattlegate”,https://annoying.technology/posts/abea6876cf4f2e13/
6347,HackerNews,2020-07-13T21:51:55.000Z,1594677115,133,108,The Greatest Teaching Techniques Don't Compute over Zoom,https://www.bloomberg.com/opinion/articles/2020-07-12/the-greatest-teaching-techniques-don-t-compute-over-zoom
6348,HackerNews,2020-07-13T21:47:43.000Z,1594676863,95,97,"Head asleep, body awake",https://alvinalexander.com/misc/head-awake-body-asleep-hear-myself-snoring/
6349,HackerNews,2020-07-13T21:47:05.000Z,1594676825,146,137,Laziness Impatience Hubris,http://wiki.c2.com/?LazinessImpatienceHubris
6350,HackerNews,2020-07-13T21:31:06.000Z,1594675866,122,47,Skypack – A new kind of JavaScript delivery network,https://www.skypack.dev
6351,HackerNews,2020-07-13T21:13:25.000Z,1594674805,339,149,A Steve Jobs masterclass from a decade ago,https://blog.thinkst.com/2020/07/a-steve-jobs-masterclass-from-decade-ago.html
6352,HackerNews,2020-07-13T21:09:10.000Z,1594674550,247,67,Financial Statements: A Beginner's Guide,https://www.causal.app/blog/whats-a-financial-statement
6353,HackerNews,2020-07-13T20:16:39.000Z,1594671399,147,80,Making aerial fiber deployment faster and more efficient,https://engineering.fb.com/connectivity/aerial-fiber-deployment/
6354,HackerNews,2020-07-13T19:47:47.000Z,1594669667,386,133,Atlas of Surveillance,https://atlasofsurveillance.org/
6355,HackerNews,2020-07-13T19:34:12.000Z,1594668852,282,62,Python malware on the rise,https://www.cyborgsecurity.com/python-malware-on-the-rise/
6356,HackerNews,2020-07-13T17:34:48.000Z,1594661688,221,303,Bitcoin is more like ham radio than the early internet,http://jpkoning.blogspot.com/2020/07/bitcoin-is-more-like-ham-radio-than.html
6357,HackerNews,2020-07-13T17:25:51.000Z,1594661151,113,169,Building Elixir from source segfaults on macOS on Apple Silicon while compiling,https://groups.google.com/forum/#!msg/elixir-lang-core/9s6-BIxaCz8/i-NmhjabAQAJ
6358,HackerNews,2020-07-13T16:01:02.000Z,1594656062,287,162,Linux founder tells Intel to stop inventing magic instructions and fix problems,https://www.pcgamer.com/linux-founder-tells-intel-to-stop-inventing-magic-instructions-and-start-fixing-real-problems/
6359,HackerNews,2020-07-13T15:55:45.000Z,1594655745,219,132,Chipmaker Analog Devices to acquire Maxim Integrated for $21B,https://www.reuters.com/article/us-maxim-intg-m-a-analog-devices/chipmaker-analog-devices-to-buy-rival-maxim-for-about-21-billion-idUSKCN24E14B
6360,HackerNews,2020-07-13T15:50:00.000Z,1594655400,102,20,Optimizations in C++ Compilers,https://queue.acm.org/detail.cfm?id=3372264
6361,HackerNews,2020-07-13T15:34:54.000Z,1594654494,201,195,Deschooling Society (1970),https://davidtinapple.com/illich/1970_deschooling.html
6362,HackerNews,2020-07-13T15:17:35.000Z,1594653455,880,754,I Know What You Download on BitTorrent,http://iknowwhatyoudownload.com
6363,HackerNews,2020-07-13T14:55:59.000Z,1594652159,87,19,Using GPT-3 to generate user interfaces,https://twitter.com/sharifshameem/status/1282676454690451457
6364,HackerNews,2020-07-13T14:29:31.000Z,1594650571,207,200,The greatest privilege we never talk about: beauty,https://medium.com/@sfard/the-greatest-privilege-we-hardly-talk-about-beauty-7db3f70c1116
6365,HackerNews,2020-07-13T14:27:39.000Z,1594650459,305,59,PGX: Write Postgres extensions in Rust instead of C,https://github.com/zombodb/pgx
6366,HackerNews,2020-07-13T14:19:23.000Z,1594649963,128,92,The Floppy Disk of Floating Point,https://www.evanmiller.org/the-floppy-disk-of-floating-point.html
6367,HackerNews,2020-07-13T13:29:48.000Z,1594646988,282,528,The stock market and economy have parted ways,https://www.washingtonpost.com/opinions/the-stock-market-and-economy-have-parted-ways-its-a-fomo-market-now/2020/07/12/c14246d8-c2bf-11ea-b4f6-cb39cd8940fb_story.html
6368,HackerNews,2020-07-13T13:19:46.000Z,1594646386,110,140,Don't use ENV variables for secret data (2017),https://diogomonica.com/2017/03/27/why-you-shouldnt-use-env-variables-for-secret-data/
6369,HackerNews,2020-07-13T12:51:50.000Z,1594644710,575,208,"Show HN: Primo – all-in-one IDE, CMS, component library, static site generator",https://primo.af
6370,HackerNews,2020-07-13T11:24:23.000Z,1594639463,150,98,Google Search Upgrades Make It Harder for Websites to Win Traffic,https://www.bloomberg.com/news/articles/2020-07-13/how-google-search-changes-make-it-more-expensive-to-win-traffic
6371,HackerNews,2020-07-13T10:16:58.000Z,1594635418,89,58,The Meddling Middlemen of Academia,https://bastian.rieck.me/blog/posts/2020/middlemen/
6372,HackerNews,2020-07-13T09:37:12.000Z,1594633032,112,24,Real World Programming in SWI-Prolog,http://www.pathwayslms.com/swipltuts/
6373,HackerNews,2020-07-13T09:30:47.000Z,1594632647,250,120,Writing a software book and making over $100k,https://twitter.com/vlad_mihalcea/status/1282199525562753025
6374,HackerNews,2020-07-13T09:08:07.000Z,1594631287,296,206,Dark Web Price Index 2020,https://www.privacyaffairs.com/dark-web-price-index-2020/
6375,HackerNews,2020-07-13T08:56:25.000Z,1594630585,270,87,Libtorrent adds support for the WebTorrent protocol,https://feross.org/libtorrent-webtorrent/
6376,HackerNews,2020-07-13T08:54:59.000Z,1594630499,422,330,Google to Invest $10B in India,https://techcrunch.com/2020/07/13/google-to-invest-10-billion-in-india/
6377,HackerNews,2020-07-13T08:43:10.000Z,1594629790,93,44,ARM64 Popcount in Golang and Assembler,https://barakmich.dev/posts/popcnt-arm64-go-asm/
6378,HackerNews,2020-07-13T08:29:55.000Z,1594628995,187,172,13% of my website visitors block Google Analytics,https://markosaric.com/google-analytics-blocking/
6379,HackerNews,2020-07-13T07:10:21.000Z,1594624221,526,182,The most remarkable legacy system I have seen,https://thehftguy.com/2020/07/09/the-most-remarkable-legacy-system-i-have-seen/
6380,HackerNews,2020-07-13T06:57:05.000Z,1594623425,173,124,GitHub was down,http://status.github.com/
6381,HackerNews,2020-07-13T06:47:32.000Z,1594622852,201,128,GitHub was down,https://www.githubstatus.com/incidents/j597fw8kv04c
6382,HackerNews,2020-07-13T05:31:19.000Z,1594618279,309,343,Rust Is Surprisingly Good as a Server Language,https://stu2b50.dev/posts/rust-is-surpris76171
6383,HackerNews,2020-07-13T04:27:20.000Z,1594614440,119,44,Insecam: Directory of Unsecured Surveillance Cameras,https://www.insecam.org/
6384,HackerNews,2020-07-13T02:55:42.000Z,1594608942,155,57,Pulsar – an open-source distributed pub-sub messaging platform,https://github.com/apache/pulsar
6385,HackerNews,2020-07-13T02:40:58.000Z,1594608058,428,181,Website allows you to experience what it is like to live with dyslexia (2016),http://geon.github.io/programming/2016/03/03/dsxyliea
6386,HackerNews,2020-07-13T02:22:23.000Z,1594606943,189,205,Science is the belief in the ignorance of experts,https://lemire.me/blog/2020/07/12/science-is-the-belief-in-the-ignorance-of-experts/
6387,HackerNews,2020-07-13T02:00:01.000Z,1594605601,115,72,Self Host a Wiki or Knowledge Base for Your Team,http://chsasank.github.io/outline-self-hosted-wiki.html
6388,HackerNews,2020-07-13T01:46:39.000Z,1594604799,133,24,How to Build a Biotech,https://www.celinehh.com/how-to-build-a-biotech
6389,HackerNews,2020-07-13T00:48:32.000Z,1594601312,84,72,"With cops away, it’s like Capitol Hill is slipping back to the Pinkerton’s era",https://www.seattletimes.com/seattle-news/crime/with-cops-away-its-like-capitol-hill-is-slipping-back-to-the-pinkertons-era/
6390,HackerNews,2020-07-13T00:15:45.000Z,1594599345,153,87,I Have Cancer. Now My Facebook Feed Is Full of ‘Alternative Care’ Ads,https://www.nytimes.com/2020/07/10/opinion/facebook-cancer-ads.html
6391,HackerNews,2020-07-13T00:09:37.000Z,1594598977,450,230,"Your DS18B20 temperature sensor is likely a fake, counterfeit, clone",https://github.com/cpetrich/counterfeit_DS18B20
6392,HackerNews,2020-07-13T00:05:30.000Z,1594598730,126,78,Do We Need a Theory of Everything?,http://backreaction.blogspot.com/2020/07/do-we-need-theory-of-everything.html
6393,HackerNews,2020-07-12T22:58:37.000Z,1594594717,442,69,WindowSwap: View someone's window somewhere in the world,https://window-swap.com/
6394,HackerNews,2020-07-12T22:49:33.000Z,1594594173,159,69,The Lost Art of Growing Blueberries with Fire,https://www.atlasobscura.com/articles/why-do-people-burn-blueberry-fields
6395,HackerNews,2020-07-12T21:26:52.000Z,1594589212,132,91,All People in Canada are the Same Age (1997),https://www.math.toronto.edu/mathnet/falseProofs/sameAge.html
6396,HackerNews,2020-07-12T21:13:01.000Z,1594588381,99,25,"ELF Statifier, self-contained dynamically linked executables",http://statifier.sourceforge.net/
6397,HackerNews,2020-07-12T20:59:30.000Z,1594587570,78,32,Creating randomness Without Math.random,https://healeycodes.com/creating-randomness/
6398,HackerNews,2020-07-12T20:32:12.000Z,1594585932,447,230,Text-Only Social Network,https://subreply.com/trending
6399,HackerNews,2020-07-12T20:21:01.000Z,1594585261,204,97,Can Facebook provide postmortems on their iOS SDK crashes?,https://github.com/facebook/facebook-ios-sdk/issues/1385
6400,HackerNews,2020-07-12T18:43:36.000Z,1594579416,112,128,Canada aims to ban single-use plastics by 2021,https://www.nationalgeographic.com/environment/2019/06/canada-single-use-plastics-ban-2021/
6401,HackerNews,2020-07-12T18:37:32.000Z,1594579052,243,142,"Dude, You Broke the Future (2017)",http://www.antipope.org/charlie/blog-static/2018/01/dude-you-broke-the-future.html
6402,HackerNews,2020-07-12T18:33:07.000Z,1594578787,111,101,Tesla may call warranty repairs goodwill due to lemon laundering,https://insideevs.com/news/433383/tesla-warranty-repairs-goodwill-lemon-laundering/
6403,HackerNews,2020-07-12T18:17:22.000Z,1594577842,420,120,"July 11, 2020 RIP my darling boy",https://twitter.com/beadmomsw/status/1282305932140130304
6404,HackerNews,2020-07-12T17:15:33.000Z,1594574133,364,600,Apple Silicon: The Passing of Wintel,https://mondaynote.com/apple-silicon-the-passing-of-wintel-79a5ef66ad2b
6405,HackerNews,2020-07-12T17:11:31.000Z,1594573891,160,14,Show HN: Sed to C translator written in sed,https://github.com/lhoursquentin/sed-bin
6406,HackerNews,2020-07-12T17:00:35.000Z,1594573235,178,84,Wt – C++ Web Toolkit,https://www.webtoolkit.eu/wt
6407,HackerNews,2020-07-12T15:47:59.000Z,1594568879,94,35,"Robot Game: Comparing 6502 C, Assembly, and Forth",http://calc6502.com/RobotGame/summary.html
6408,HackerNews,2020-07-12T15:46:51.000Z,1594568811,96,29,Show HN: Notado – Content-First Bookmarking,https://notado.app/
6409,HackerNews,2020-07-12T15:29:42.000Z,1594567782,113,37,WireGuard as VPN Server on Kubernetes with AdBlocking,https://codingcoffee.dev/blog/wireguard_on_kubernetes_with_adblocking/
6410,HackerNews,2020-07-12T15:18:56.000Z,1594567136,132,60,Haproxy 2.2,https://www.haproxy.com/#
6411,HackerNews,2020-07-12T14:43:21.000Z,1594565001,85,37,Cockroachdb/copyist: Mocking an SQL database in Go tests,https://github.com/cockroachdb/copyist
6412,HackerNews,2020-07-12T14:40:45.000Z,1594564845,284,230,US citizens warned they face arbitrary arrest in China,https://m.dw.com/en/us-citizens-warned-they-face-arbitrary-arrest-in-china/a-54144205
6413,HackerNews,2020-07-12T14:30:35.000Z,1594564235,276,194,The Future of Online Identity Is Decentralized,https://yarmo.eu/post/future-online-identity-decentralized
6414,HackerNews,2020-07-12T14:16:58.000Z,1594563418,109,39,Rust for JavaScript Developers – Pattern Matching and Enums,http://www.sheshbabu.com/posts/rust-for-javascript-developers-pattern-matching-and-enums
6415,HackerNews,2020-07-12T13:55:36.000Z,1594562136,181,76,SAS Rescue 3 Trapped British Diplomats in Albania,https://www.mydiplomaticlife.com/sas-rescue-trapped-diplomats-in-albania/
6416,HackerNews,2020-07-12T12:27:57.000Z,1594556877,152,84,The company that sells lost airplane luggage,https://thehustle.co/unclaimed-baggage-store-that-sells-lost-luggage/
6417,HackerNews,2020-07-12T12:25:49.000Z,1594556749,80,64,Candy Land was invented for polio wards (2019),https://www.theatlantic.com/technology/archive/2019/07/how-polio-inspired-the-creation-of-candy-land/594424/
6418,HackerNews,2020-07-12T12:18:07.000Z,1594556287,95,472,Merge tag 'inclusive-terminology' into Linux kernel,https://git.kernel.org/pub/scm/linux/kernel/git/torvalds/linux.git/commit/?id=49decddd39e5f6132ccd7d9fdc3d7c470b0061bb
6419,HackerNews,2020-07-12T11:13:05.000Z,1594552385,390,253,IBM looking for 12 years’ experience in Kubernetes administration,https://intellijobs.ai/job/IBMCloud-Native-Infrastructure-Engineer-Architect-bvJJ6yraexfWOk1nMRKP-bvJJ6yraexfWOk1nMRKP
6420,HackerNews,2020-07-12T11:09:06.000Z,1594552146,206,166,Dealing with Insomnia,https://jacquesmattheij.com/dealing-with-insomnia/
6421,HackerNews,2020-07-12T09:36:49.000Z,1594546609,123,143,How companies became addicted to debt,https://www.ft.com/content/c732fded-5252-4333-a3f8-80b767508bbc
6422,HackerNews,2020-07-12T08:08:05.000Z,1594541285,83,41,Sandboxie-Plus – a fork of Sandboxie with improved functionality,https://github.com/sandboxie-plus/Sandboxie/releases/tag/v0.3
6423,HackerNews,2020-07-12T06:49:00.000Z,1594536540,76,13,Ruby lib/irb/easter-egg.rb,https://github.com/ruby/ruby/blob/a0c7c23c9cec0d0ffcba012279cd652d28ad5bf3/lib/irb/easter-egg.rb
6424,HackerNews,2020-07-12T06:28:53.000Z,1594535333,140,120,Linus Torvalds on AVX512,http://www.phoronix.com/scan.php?page=news_item&px=Linus-Torvalds-On-AVX-512
6425,HackerNews,2020-07-12T06:25:02.000Z,1594535102,119,121,Hosting your entire web application using S3 and CloudFront,https://www.sankalpjonna.com/posts/hosting-your-entire-web-application-using-s3-cloudfront
6426,HackerNews,2020-07-12T06:18:12.000Z,1594534692,570,296,Just Too Efficient,https://www.tbray.org/ongoing/When/202x/2020/07/05/Too-Efficient
6427,HackerNews,2020-07-12T05:51:54.000Z,1594533114,329,195,Tour of Rust,https://tourofrust.com/
6428,HackerNews,2020-07-12T03:04:14.000Z,1594523054,124,43,MariaDB Temporal Data Tables,https://mariadb.com/kb/en/temporal-data-tables/
6429,HackerNews,2020-07-12T02:58:11.000Z,1594522691,782,122,Do not remain nameless to yourself (1966),https://lettersofnote.com/2015/10/23/do-not-remain-nameless-to-yourself/
6430,HackerNews,2020-07-12T01:33:19.000Z,1594517599,326,55,Building a self-updating profile README for GitHub,https://simonwillison.net/2020/Jul/10/self-updating-profile-readme/
6431,HackerNews,2020-07-12T00:36:44.000Z,1594514204,119,169,The growing short case on Facebook and Google,https://twitter.com/chamath/status/1281630456807452677
