ID,Source,TimeGST,TimeEpoch,Upvotes,NumComments,Title,Url
6576,HackerNews,2020-07-09T01:43:59.000Z,1594259039,95,123,Cars and hygiene killed the middle-class hat,https://medium.com/s/pulling-at-threads/how-cars-and-hygiene-killed-the-middle-class-hat-2f382b4a35ec
6577,HackerNews,2020-07-09T00:40:40.000Z,1594255240,122,46,Web Monetization,https://webmonetization.org/
6578,HackerNews,2020-07-09T00:13:02.000Z,1594253582,248,147,MoreOnionsPorfavor: Onionize your website and take back the internet,https://blog.torproject.org/more-onions-porfavor
6579,HackerNews,2020-07-08T23:54:17.000Z,1594252457,99,77,XMPP works – 1 July 2020,https://xmpp.org/2020/07/newsletter-01-july/
6580,HackerNews,2020-07-08T23:29:25.000Z,1594250965,1034,135,We can't send email more than 500 miles (2002),http://web.mit.edu/jemorris/humor/500-miles
6581,HackerNews,2020-07-08T21:37:04.000Z,1594244224,358,161,The saddest “Just Ship It” story,https://kitze.io/posts/saddest-just-ship-it-story-ever
6582,HackerNews,2020-07-08T21:25:59.000Z,1594243559,94,72,Facebook takes down accounts and pages of Roger Stone,https://www.reuters.com/article/us-facebook-disinformation-usa/facebook-takes-down-accounts-and-pages-of-trump-ally-roger-stone-idUSKBN2492YK
6583,HackerNews,2020-07-08T21:23:21.000Z,1594243401,1099,540,Reddit's website uses DRM for fingerprinting,https://smitop.com/post/reddit-whiteops/
6584,HackerNews,2020-07-08T21:02:52.000Z,1594242172,150,245,A $500M call option on home gyms,https://napkinmath.substack.com/p/the-future-of-fitness-lululemon-buys
6585,HackerNews,2020-07-08T21:00:10.000Z,1594242010,102,35,GhostDB – A Fast Distributed Cache,https://github.com/jakekgrog/GhostDB
6586,HackerNews,2020-07-08T20:41:09.000Z,1594240869,113,212,"Robinhood has lured young traders, sometimes with devastating results",https://www.nytimes.com/2020/07/08/technology/robinhood-risky-trading.html
6587,HackerNews,2020-07-08T20:28:01.000Z,1594240081,98,81,The myth of “joins don't scale”,https://blog.dbi-services.com/the-myth-of-nosql-vs-rdbms-joins-dont-scale/
6588,HackerNews,2020-07-08T20:25:38.000Z,1594239938,97,6,FPGA Softcore SoC Shootout,https://justanotherelectronicsblog.com/?p=705
6589,HackerNews,2020-07-08T19:09:41.000Z,1594235381,75,17,Behind the dead-water phenomenon,https://phys.org/news/2020-07-dead-water-phenomenon.html
6590,HackerNews,2020-07-08T17:51:52.000Z,1594230712,156,235,VCs Promised to Help Black Founders – My Experience Shows a Different Reality,https://thebolditalic.com/vcs-have-a-well-known-black-founder-problem-but-really-they-have-just-forgotten-about-people-2e8452029793
6591,HackerNews,2020-07-08T17:42:59.000Z,1594230179,182,65,CUDA 11.0,https://docs.nvidia.com/cuda/cuda-toolkit-release-notes/index.html#cuda-whats-new
6592,HackerNews,2020-07-08T17:19:00.000Z,1594228740,111,68,On Interviewing Programmers,https://thecobraeffect.blogspot.com/2020/07/interviewing-programmers.html
6593,HackerNews,2020-07-08T17:10:45.000Z,1594228245,249,211,The stable marriage problem and modern dating,https://www.arvarik.com/the-stable-marriage-problem-and-modern-dating
6594,HackerNews,2020-07-08T17:07:17.000Z,1594228037,1106,522,Linux Mint drops Ubuntu Snap packages,https://lwn.net/SubscriberLink/825005/6440c82feb745bbe/
6595,HackerNews,2020-07-08T16:56:57.000Z,1594227417,193,96,Polynesian DNA suggests epic voyage to South America 800 years ago,https://www.nytimes.com/2020/07/08/science/polynesian-ancestry.html
6596,HackerNews,2020-07-08T16:33:16.000Z,1594225996,103,84,"Harvard, MIT sue govt over order revoking visas for foreign students",https://phys.org/news/2020-07-harvard-mit-sue-trump-govt.html
6597,HackerNews,2020-07-08T16:26:10.000Z,1594225570,460,215,Flutter for Linux,https://snapcraft.io/blog/canonical-enables-linux-desktop-app-support-with-flutter
6598,HackerNews,2020-07-08T15:57:35.000Z,1594223855,380,196,Show HN: Runnaroo – A new search engine,https://www.runnaroo.com/
6599,HackerNews,2020-07-08T15:16:34.000Z,1594221394,175,109,Spreading rock dust on fields could remove vast amounts of CO2 from air,https://www.theguardian.com/environment/2020/jul/08/spreading-rock-dust-on-fields-could-remove-vast-amounts-of-co2-from-air
6600,HackerNews,2020-07-08T15:15:57.000Z,1594221357,116,26,Barebones WebGL in 75 lines of code,https://avikdas.com/2020/07/08/barebones-webgl-in-75-lines-of-code.html
6601,HackerNews,2020-07-08T15:04:36.000Z,1594220676,251,153,Firefox Picture-in-Picture,https://blog.mozilla.org/firefox/firefox-picture-in-picture-mode/
6602,HackerNews,2020-07-08T14:02:04.000Z,1594216924,133,22,Evidence-based Software Engineering – book beta,http://shape-of-code.coding-guidelines.com/2020/06/30/beta-evidence-based-software-engineering-book/
6603,HackerNews,2020-07-08T13:59:53.000Z,1594216793,153,218,Concorde ‘B’ (2014),https://www.heritageconcorde.com/concorde-b
6604,HackerNews,2020-07-08T13:17:18.000Z,1594214238,392,152,SUSE to Acquire Rancher Labs,https://www.zdnet.com/article/suse-to-acquire-rancher-labs/
6605,HackerNews,2020-07-08T13:16:32.000Z,1594214192,365,289,MIT and Harvard file suit against new ICE regulations,http://news.mit.edu/2020/mit-and-harvard-file-suit-against-new-ice-regulations-0708
6606,HackerNews,2020-07-08T13:11:40.000Z,1594213900,139,14,Tin Can Phone Modem,https://www.mikekohn.net/micro/tin_can_phone_modem.php
6607,HackerNews,2020-07-08T12:59:48.000Z,1594213188,268,116,Tauri – toolchain for building secure native apps that have tiny binaries,https://github.com/tauri-apps/tauri
6608,HackerNews,2020-07-08T12:59:24.000Z,1594213164,145,53,Foreign data wrappers: PostgreSQL's secret weapon?,https://www.splitgraph.com/blog/foreign-data-wrappers
6609,HackerNews,2020-07-08T12:27:22.000Z,1594211242,203,54,On the Closing of Living Computers: Museum+Labs,https://rottedbits.blogspot.com/2020/07/on-closing-of-living-computers.html?m=1&fbclid=IwAR30zAZFD54sW4qfZ-X3GatKhMo6nNsuEEHuIQkKPq7ONWhKFBPQncBVIlM
6610,HackerNews,2020-07-08T11:59:09.000Z,1594209549,121,71,The GDPR as accidentally explained by people in the US,https://hroy.eu/posts/gdprExplainedByUS/
6611,HackerNews,2020-07-08T11:41:36.000Z,1594208496,394,84,A graphical analysis of women's tops sold on Goodwill's website,https://goodwill.awardwinninghuman.com/
6612,HackerNews,2020-07-08T11:30:54.000Z,1594207854,419,69,EasyOCR: Ready-to-use OCR with 40 languages,https://github.com/JaidedAI/EasyOCR
6613,HackerNews,2020-07-08T11:22:23.000Z,1594207343,249,174,KeePassXC 2.6.0 Released,https://keepassxc.org/blog/2020-07-07-2.6.0-released/
6614,HackerNews,2020-07-08T10:40:05.000Z,1594204805,344,132,"The more senior your job title, the more you need to keep a journal (2017)",https://hbr.org/2017/07/the-more-senior-your-job-title-the-more-you-need-to-keep-a-journal
6615,HackerNews,2020-07-08T08:43:09.000Z,1594197789,210,34,Ariane RISC-V CPU – An open source CPU capable of booting Linux,https://github.com/openhwgroup/cva6
6616,HackerNews,2020-07-08T07:58:43.000Z,1594195123,339,152,Git commit accepts several message flags (-m) to allow multiline commits,https://www.stefanjudis.com/today-i-learned/git-commit-accepts-several-message-flags-m-to-allow-multiline-commits/
6617,HackerNews,2020-07-08T07:33:12.000Z,1594193592,82,67,Curry Before Columbus,https://contingentmagazine.org/2020/06/25/curry-before-columbus/
6618,HackerNews,2020-07-08T07:08:11.000Z,1594192091,130,93,"Pope pulls speech on Hong Kong freedom, raising questions over Beijing pressure",https://hk.appledaily.com/us/20200707/3JPO2PWP2UXTHBOUYIKKMLKKUU/
6619,HackerNews,2020-07-08T06:30:59.000Z,1594189859,672,432,How Developers Stop Learning: Rise of the Expert Beginner (2012),https://daedtech.com/how-developers-stop-learning-rise-of-the-expert-beginner/
6620,HackerNews,2020-07-08T06:09:20.000Z,1594188560,181,78,Identity Beyond Usernames,https://lord.io/blog/2020/usernames/
6621,HackerNews,2020-07-08T04:49:19.000Z,1594183759,102,56,Fig: Visual Apps and Shortcuts for Your Terminal,https://withfig.com/
6622,HackerNews,2020-07-08T04:41:23.000Z,1594183283,114,32,The GNU Name System IETF Draft,https://tools.ietf.org/id/draft-schanzen-gns-01.html
6623,HackerNews,2020-07-08T04:32:08.000Z,1594182728,78,60,N. K. Jemisin’s Dream Worlds,https://www.newyorker.com/magazine/2020/01/27/nk-jemisins-dream-worlds
6624,HackerNews,2020-07-08T04:25:28.000Z,1594182328,115,19,Never Have I Seen So Much Fake Unemployment and Jobs Data by the Bureau of Labor,https://wolfstreet.com/2020/07/02/never-before-have-i-seen-so-much-fake-unemployment-jobs-data-by-the-bureau-of-labor-statistics-while-labor-department-nails-it/
6625,HackerNews,2020-07-08T03:54:20.000Z,1594180460,94,23,Show HN: ip2unix – Turn IP sockets into Unix domain sockets,https://github.com/nixcloud/ip2unix
6626,HackerNews,2020-07-08T03:00:42.000Z,1594177242,320,125,"Yoloface-500k: ultra-light real-time face detection model, 500kb",https://github.com/dog-qiuqiu/MobileNetv2-YOLOV3#500kb%E7%9A%84yolo-face-detection
6627,HackerNews,2020-07-08T02:50:40.000Z,1594176640,93,5,FBI chief says China threatens families to coerce overseas critics to return,https://www.reuters.com/article/us-usa-china-wray/fbi-chief-says-china-threatens-families-to-coerce-overseas-critics-to-return-to-china-idUSKBN24825V
6628,HackerNews,2020-07-08T02:35:15.000Z,1594175715,152,116,"Increase in delirium, rare brain inflammation and stroke linked to Covid-19",https://medicalxpress.com/news/2020-07-delirium-rare-brain-inflammation-linked.html
6629,HackerNews,2020-07-08T01:30:11.000Z,1594171811,92,22,Russian election data revisited (2018),https://rss.onlinelibrary.wiley.com/doi/full/10.1111/j.1740-9713.2018.01141.x
6630,HackerNews,2020-07-08T01:04:19.000Z,1594170259,564,89,New Stuff,https://www.thefarside.com/new-stuff
6631,HackerNews,2020-07-08T00:32:27.000Z,1594168347,222,136,Intel in Macs (2007),https://www.apple.com/sg/intel/
6632,HackerNews,2020-07-07T23:12:00.000Z,1594163520,293,26,Loopy: a tool for thinking in systems,https://ncase.me/loopy/
6633,HackerNews,2020-07-07T22:44:06.000Z,1594161846,382,47,Ron Graham has died,https://www.ams.org/news?news_id=6244
6634,HackerNews,2020-07-07T22:01:46.000Z,1594159306,176,40,Building Cloudflare TV from Scratch,https://blog.cloudflare.com/building-cloudflare-tv-from-scratch/
6635,HackerNews,2020-07-07T21:30:07.000Z,1594157407,111,105,Legacy and Athlete Preferences at Harvard (2019),https://www.nber.org/papers/w26316.pdf
6636,HackerNews,2020-07-07T21:09:22.000Z,1594156162,102,68,I got 400 signups with a video of a product that didn’t exist,https://www.lunadio.com/blog/i-got-400-signups-with-a-video-of-a-product-that-didnt-exist/
6637,HackerNews,2020-07-07T19:53:46.000Z,1594151626,101,16,The Giant Ghibli Clock (2019),https://www.atlasobscura.com/places/the-giant-ghibli-clock-tokyo-japan
6638,HackerNews,2020-07-07T19:50:36.000Z,1594151436,131,65,Germany to meet EU guidelines to ban single-use plastics by 2021,https://mymodernmet.com/germany-single-use-plastic-ban/
6639,HackerNews,2020-07-07T19:40:03.000Z,1594150803,457,120,Help Message for Shell Scripts,https://samizdat.dev/help-message-for-shell-scripts/
6640,HackerNews,2020-07-07T19:08:31.000Z,1594148911,136,95,"Pattern Matching, Racial Diversity and the Hypocrisy of Big Tech Media",https://oonwoye.com/2020/07/06/diversity-and-big-tech-media/
6641,HackerNews,2020-07-07T18:52:49.000Z,1594147969,209,110,Firefox Android: Camera remains active even when the phone is locked,https://bugzilla.mozilla.org/show_bug.cgi?id=1564451
6642,HackerNews,2020-07-07T18:37:44.000Z,1594147064,160,58,Goodhart's Law and how systems are shaped by the metrics you chase,https://whyisthisinteresting.substack.com/p/why-is-this-interesting-the-goodharts
6643,HackerNews,2020-07-07T18:27:02.000Z,1594146422,178,46,Show HN: Map33.js – a library to build 3D maps with Three.js,https://map33.openbloc.com
6644,HackerNews,2020-07-07T18:07:30.000Z,1594145250,100,45,Analysis of all YouTube trending videos in US for 2019,https://ammar-alyousfi.com/2020/youtube-trending-videos-analysis-2019-us
6645,HackerNews,2020-07-07T17:54:36.000Z,1594144476,175,110,Dune: The Battle for Arrakis – Extended Reference (2003),http://ledmeister.com/dunexref.htm
6646,HackerNews,2020-07-07T17:43:21.000Z,1594143801,96,22,Parallel ray tracing benchmark for functional programming languages,https://github.com/athas/raytracers
6647,HackerNews,2020-07-07T17:22:23.000Z,1594142543,155,49,Caffenol: Developing Photos with Coffee and Vitamin C [video],https://www.youtube.com/watch?v=9bhOtTUtPhg
6648,HackerNews,2020-07-07T17:15:26.000Z,1594142126,148,52,Keeping your Go modules compatible,https://blog.golang.org/module-compatibility
6649,HackerNews,2020-07-07T17:07:35.000Z,1594141655,196,120,Google Common Lisp style guide,https://google.github.io/styleguide/lispguide.xml
6650,HackerNews,2020-07-07T17:01:42.000Z,1594141302,80,41,Discovery of oldest bow and arrow technology in Eurasia,https://phys.org/news/2020-06-discovery-oldest-arrow-technology-eurasia.html
6651,HackerNews,2020-07-07T16:50:50.000Z,1594140650,477,340,Searchable PPP Loan Data,https://pppreport.org/
6652,HackerNews,2020-07-07T16:48:29.000Z,1594140509,331,694,Sweden: higher Covid-19 death rate while failing to collect on economic gains,https://www.nytimes.com/2020/07/07/business/sweden-economy-coronavirus.html
6653,HackerNews,2020-07-07T16:30:18.000Z,1594139418,425,146,Show HN: SheetUI – Turn Google Sheets into Web Pages,https://sheetui.com
6654,HackerNews,2020-07-07T16:30:07.000Z,1594139407,98,143,Brazil's President Bolsonaro tests positive for coronavirus,https://www.france24.com/en/20200707-brazil-s-president-bolsonaro-tests-positive-for-coronavirus
6655,HackerNews,2020-07-07T16:14:41.000Z,1594138481,102,80,New Compute Engine A2 VMs–First Nvidia Ampere A100 GPUs in the Cloud,https://cloud.google.com/blog/products/compute/announcing-google-cloud-a2-vm-family-based-on-nvidia-a100-gpu
6656,HackerNews,2020-07-07T15:39:32.000Z,1594136372,280,218,Int. students may need to leave US if classes are 100% Remote,https://edition.cnn.com/2020/07/06/politics/international-college-students-ice-online-learning/index.html
6657,HackerNews,2020-07-07T15:34:28.000Z,1594136068,106,45,Show HN: Reclaim – an adaptive calendar app that plans time for your routines,https://reclaim.ai/daily-habits/
6658,HackerNews,2020-07-07T15:16:45.000Z,1594135005,152,31,Classifying 200k articles in 7 hours using NLP,https://salt.agency/blog/nlp-and-stuff/
6659,HackerNews,2020-07-07T15:01:13.000Z,1594134073,204,147,The Slack Social Network,https://stratechery.com/2020/the-slack-social-network/
6660,HackerNews,2020-07-07T14:58:50.000Z,1594133930,166,54,Turn your phone into a wireless webcam,https://www.kinoni.com/
6661,HackerNews,2020-07-07T14:43:16.000Z,1594132996,84,52,Europe's recession will be even deeper than expected,https://lite.cnn.com/en/article/h_cf9744f2a6542445f3e4adfb1dce24c5
6662,HackerNews,2020-07-07T14:39:00.000Z,1594132740,149,63,"Coconut: Simple, elegant, Pythonic functional programming",http://coconut-lang.org/
6663,HackerNews,2020-07-07T14:34:03.000Z,1594132443,307,166,Professor solves 240 computer science exam problems in 4 hours [video],https://www.youtube.com/watch?v=g_ZdcHSFGv0&t=10s
6664,HackerNews,2020-07-07T14:24:09.000Z,1594131849,87,48,Browser Font Rendering Inconsistencies,https://blog.stephaniestimac.com/posts/2020/06/browser-fonts/
6665,HackerNews,2020-07-07T13:59:08.000Z,1594130348,171,38,Show HN: Continuous Machine Learning – CI/CD for Machine Learning Projects,http://cml.dev
6666,HackerNews,2020-07-07T13:55:02.000Z,1594130102,214,332,A Letter on Justice and Open Debate,https://harpers.org/a-letter-on-justice-and-open-debate/
6667,HackerNews,2020-07-07T13:26:48.000Z,1594128408,107,29,Show HN: ScotusWars – see your state's win rate in state vs. state court cases,https://scotuswars.gilslotd.com/
6668,HackerNews,2020-07-07T13:25:12.000Z,1594128312,335,97,Invite Rick to Rick Roll Your Zoom Calls,http://inviterick.com
6669,HackerNews,2020-07-07T12:37:41.000Z,1594125461,775,553,YouTube deleted an electronics repair channel [video],https://www.youtube.com/watch?v=W0mMOHrftgU
6670,HackerNews,2020-07-07T12:14:39.000Z,1594124079,121,67,A REST View of GraphQL,https://hasura.io/blog/rest-view-of-graphql
6671,HackerNews,2020-07-07T12:10:56.000Z,1594123856,94,38,Ireland's Health Service Open Sources Official Covid-19 Tracking App,https://github.com/HSEIreland
6672,HackerNews,2020-07-07T11:50:41.000Z,1594122641,114,44,Whole Earth Software Catalog (1984),https://archive.org/details/Whole_Earth_Software_Catalog_1984_Point/
6673,HackerNews,2020-07-07T11:44:56.000Z,1594122296,103,39,Robot Disinfects Greater Boston Food Bank,https://news.mit.edu/2020/csail-robot-disinfects-greater-boston-food-bank-covid-19-0629
6674,HackerNews,2020-07-07T11:43:11.000Z,1594122191,77,39,Quantum Bayesianism Explained by Its Founder,https://www.quantamagazine.org/quantum-bayesianism-explained-by-its-founder-20150604/
6675,HackerNews,2020-07-07T11:41:48.000Z,1594122108,93,28,Mcfly – neural-network powered directory and context-aware shell history search,https://github.com/cantino/mcfly
6676,HackerNews,2020-07-07T11:41:38.000Z,1594122098,80,62,The rise and fall of Adobe Flash,https://arstechnica.com/information-technology/2020/07/the-rise-and-fall-of-adobe-flash/
6677,HackerNews,2020-07-07T10:52:59.000Z,1594119179,247,37,Nokia to add open interfaces to its telecom equipment,https://www.reuters.com/article/us-nokia-5g-idUSKBN2480S0
6678,HackerNews,2020-07-07T10:35:15.000Z,1594118115,83,35,Snapchat Detection on iOS (2019),https://aeonlucid.com/Snapchat-detection-on-iOS/
6679,HackerNews,2020-07-07T10:01:11.000Z,1594116071,108,61,The Complete Spectrum ROM Disassembly,https://speccy.xyz/rom/
6680,HackerNews,2020-07-07T09:58:27.000Z,1594115907,197,217,Kosher search engine powered by 4 car batteries on a passively cooled server,https://jewjewjew.com/
6681,HackerNews,2020-07-07T09:27:07.000Z,1594114027,328,122,Dark patterns in GDPR consent boxes,https://arxiv.org/abs/2001.02479
6682,HackerNews,2020-07-07T09:06:21.000Z,1594112781,116,122,Why Facts Don’t Change Our Minds (2017),https://www.newyorker.com/magazine/2017/02/27/why-facts-dont-change-our-minds
6683,HackerNews,2020-07-07T08:43:25.000Z,1594111405,94,21,Work on Unimportant Problems (2012),http://yosefk.com/blog/work-on-unimportant-problems.html
6684,HackerNews,2020-07-07T08:33:49.000Z,1594110829,364,63,"Show HN: I built a desktop radiation monitor with Raspberry Pi, brass and wood",https://www.balena.io/blog/show-tell-a-steampunk-desktop-background-radiation-monitor/
6685,HackerNews,2020-07-07T08:26:50.000Z,1594110410,651,446,Only 9% of visitors give GDPR consent to be tracked,https://markosaric.com/gdpr-consent/
6686,HackerNews,2020-07-07T08:13:54.000Z,1594109634,96,28,Weird Constants in Math Problems,https://blog.plover.com/math/odd-constants.html
6687,HackerNews,2020-07-07T05:04:54.000Z,1594098294,147,159,"U.S. looking at banning Chinese social media apps, including TikTok",https://www.reuters.com/article/us-usa-tiktok-china-pompeo/pompeo-says-u-s-looking-at-banning-chinese-social-media-apps-including-tiktok-fox-idUSKBN2480DF
6688,HackerNews,2020-07-07T05:00:47.000Z,1594098047,631,271,"A terrible, horrible, no-good, very bad day at Slack",https://slack.engineering/a-terrible-horrible-no-good-very-bad-day-at-slack-dfe05b485f82
6689,HackerNews,2020-07-07T05:00:32.000Z,1594098032,160,140,Building Domain Driven Microservices,https://medium.com/walmartlabs/building-domain-driven-microservices-af688aa1b1b8
6690,HackerNews,2020-07-07T04:26:29.000Z,1594095989,1055,384,Google offers free fabbing for 130nm open-source chips,https://fossi-foundation.org/2020/06/30/skywater-pdk
6691,HackerNews,2020-07-07T04:22:48.000Z,1594095768,163,187,Academic acceleration in gifted youth: a 35-year longitudinal study,https://psycnet.apa.org/record/2020-47023-001
6692,HackerNews,2020-07-07T03:31:19.000Z,1594092679,223,144,TikTok to pull out of Hong Kong,https://www.axios.com/tiktok-to-pull-out-of-hong-kong-e253eb02-69e9-4abb-a5c2-28ffa196a9a0.html
6693,HackerNews,2020-07-07T03:17:26.000Z,1594091846,107,85,UniFi-Video Products End of Life Announcement,https://community.ui.com/questions/UniFi-Video-Products-End-of-Life-Announcement/dc529d39-0e58-43cc-96f0-8f0eed0d002c
6694,HackerNews,2020-07-07T03:14:26.000Z,1594091666,172,230,Against Testing,https://flak.tedunangst.com/post/against-testing
6695,HackerNews,2020-07-07T03:06:48.000Z,1594091208,91,46,ICE says international students must take in-person classes to remain in the US,https://www.theverge.com/2020/7/6/21315168/ice-immigration-international-students-universities-deportation
6696,HackerNews,2020-07-07T02:59:03.000Z,1594090743,107,24,NetBSD Internals,https://www.netbsd.org/docs/internals/en/index.html
6697,HackerNews,2020-07-07T02:53:42.000Z,1594090422,139,64,The Faces of Microsoft (2017),https://www.typemag.org/post/the-faces-of-microsoft
6698,HackerNews,2020-07-07T01:33:16.000Z,1594085596,120,103,Calls for TikTok to be banned in Australia over Chinese spying fears,https://7news.com.au/sunrise/on-the-show/fresh-calls-for-australian-government-to-ban-tik-tok-app--c-1146435
6699,HackerNews,2020-07-07T01:30:41.000Z,1594085441,290,94,Should I Use a Carousel?,http://shouldiuseacarousel.com/
6700,HackerNews,2020-07-07T01:23:35.000Z,1594085015,195,194,Palantir Announces Confidential Submission of Draft S-1,https://www.businesswire.com/news/home/20200706005622/en/Palantir-Announces-Confidential-Submission-Draft-Registration-Statement
6701,HackerNews,2020-07-07T01:07:24.000Z,1594084044,94,54,Where $521B in U.S. Small-Business Aid Went,https://www.bloomberg.com/graphics/2020-ppp-loans-data-disclosure/
6702,HackerNews,2020-07-07T00:46:00.000Z,1594082760,91,18,Electronic Whole Earth Catalog,https://archive.org/details/the-electronic-whole-earth-catalog
6703,HackerNews,2020-07-06T23:43:23.000Z,1594079003,78,39,The Super Duper Universal Binary,https://tenfourfox.blogspot.com/2020/06/the-super-duper-universal-binary.html
6704,HackerNews,2020-07-06T22:23:15.000Z,1594074195,88,39,Technology Holy Wars Are Coordination Problems,https://www.gwern.net/Holy-wars
6705,HackerNews,2020-07-06T21:45:05.000Z,1594071905,207,149,US online grocery sales hit record $7.2B in June,https://techcrunch.com/2020/07/06/u-s-online-grocery-shopping-hits-record-7-2-billion-in-june/
6706,HackerNews,2020-07-06T21:14:52.000Z,1594070092,145,182,Exciting Days for ARM Processors,https://smist08.wordpress.com/2020/06/24/exciting-days-for-arm-processors/
6707,HackerNews,2020-07-06T21:00:24.000Z,1594069224,102,132,H-1B: Government issues first-ever official estimate of visa population in U.S.,https://www.mercurynews.com/2020/06/26/h-1b-government-issues-first-ever-official-estimate-of-visa-population-in-u-s/
6708,HackerNews,2020-07-06T20:47:01.000Z,1594068421,82,48,Abusing linear regression to make a point,http://www.goodmath.org/blog/2020/07/06/abusing-linear-regression-to-make-a-point/
6709,HackerNews,2020-07-06T20:20:35.000Z,1594066835,315,167,Booting a 486 from floppy with the most up-to-date stable Linux kernel,https://www.insentricity.com/a.cl/283
6710,HackerNews,2020-07-06T19:45:53.000Z,1594064753,196,150,ICE changes exemptions for foreign students taking online courses in Fall 2020,https://www.ice.gov/news/releases/sevp-modifies-temporary-exemptions-nonimmigrant-students-taking-online-courses-during
6711,HackerNews,2020-07-06T17:36:49.000Z,1594057009,97,132,The Fed now owns Walmart debt,https://www.cnn.com/2020/06/29/investing/premarket-stocks-trading/index.html
6712,HackerNews,2020-07-06T16:57:42.000Z,1594054662,885,197,1:60 scale Boeing 777 made from manila folders,https://www.lucaiaconistewart.com/model-777
6713,HackerNews,2020-07-06T16:46:35.000Z,1594053995,127,157,Bullshit Jobs (2018),https://www.bloomberg.com/news/articles/2018-05-15/bullshit-jobs-by-david-graeber-review
6714,HackerNews,2020-07-06T16:45:56.000Z,1594053956,112,100,Autodesk and coal mining,https://autodesk.earth/
6715,HackerNews,2020-07-06T16:41:58.000Z,1594053718,170,114,Code only says what it does,http://brooker.co.za/blog/2020/06/23/code.html
6716,HackerNews,2020-07-06T16:37:45.000Z,1594053465,94,43,From the gig economy to the creator economy to the participatory economy,https://sariazout.substack.com/p/check-your-pulse-48
6717,HackerNews,2020-07-06T16:23:22.000Z,1594052602,127,129,Berkshire Hathaway buys Dominion Energy natural gas assets in $10B deal,https://www.cnbc.com/2020/07/05/warren-buffetts-berkshire-buys-dominion-energy-natural-gas-assets-in-10-billion-deal.html
6718,HackerNews,2020-07-06T16:12:07.000Z,1594051927,350,505,Decision for 2020-21 Academic Year,https://www.fas.harvard.edu/fas-decision-2020-2021-academic-year
6719,HackerNews,2020-07-06T16:05:17.000Z,1594051517,366,64,Two young scientists built a $250M business using yeast to clean up wastewater,https://www.forbes.com/sites/alexknapp/2020/07/06/how-two-young-scientists-built-a-250-million-business-using-yeast-to-clean-up-wastewater/#591ecf777802
6720,HackerNews,2020-07-06T15:03:19.000Z,1594047799,428,272,Playstation's secret weapon: a nearly all-automated factory,https://asia.nikkei.com/Business/Companies/PlayStation-s-secret-weapon-a-nearly-all-automated-factory
6721,HackerNews,2020-07-06T15:03:11.000Z,1594047791,150,37,I made a macro keypad with 3D-printed switches,https://incoherency.co.uk/blog/stories/3pct-keyboard.html
6722,HackerNews,2020-07-06T14:24:15.000Z,1594045455,102,180,Limitations and pitfalls of the job interview,https://fs.blog/2020/07/job-interviews/
6723,HackerNews,2020-07-06T13:57:04.000Z,1594043824,158,54,Dopamine is not addictive (2017),https://www.psychologytoday.com/us/blog/women-who-stray/201701/no-dopamine-is-not-addictive
