ID,Source,TimeGST,TimeEpoch,Upvotes,NumComments,Title,Url
5571,HackerNews,2020-07-31T22:43:00.000Z,1596235380,76,37,ecj rule u cloud service fundamentally incompatible eu privacy law,https://nextcloud.com/blog/breaking-news-ecj-rules-us-cloud-services-fundamentally-incompatible-with-eu-privacy-laws/
5572,HackerNews,2020-07-31T21:21:24.000Z,1596230484,98,56,israel systematically hide evidence expulsion arab,https://www.haaretz.com/israel-news/.premium.MAGAZINE-how-israel-systematically-hides-evidence-of-1948-expulsion-of-arabs-1.7435103
5573,HackerNews,2020-07-31T20:24:13.000Z,1596227053,106,30,legal deep dive mexico disastrous new copyright law,https://www.eff.org/deeplinks/2020/07/legal-deep-dive-mexicos-disastrous-new-copyright-law
5574,HackerNews,2020-07-31T20:17:34.000Z,1596226654,172,199,gtk,https://blog.gtk.org/2020/07/31/gtk-3-99/
5575,HackerNews,2020-07-31T20:08:24.000Z,1596226104,212,210,apple surpasses saudi aramco become valuable company,https://www.cnbc.com/2020/07/31/apple-surpasses-saudi-aramco-to-become-worlds-most-valuable-company.html
5576,HackerNews,2020-07-31T20:06:49.000Z,1596226009,79,61,microsoft shut cortana io android apps,https://www.engadget.com/cortana-shutdown-harman-kardon-invoke-ios-android-191700426.html
5577,HackerNews,2020-07-31T19:57:24.000Z,1596225444,430,213,man read letter number expose root consciousness,https://www.sciencemag.org/news/2020/07/mysterious-case-man-who-can-read-letters-not-numbers-exposes-complex-roots
5578,HackerNews,2020-07-31T19:44:17.000Z,1596224657,237,582,app store monopoly eu correct investigate apple,https://protonmail.com/blog/apple-app-store-antitrust/
5579,HackerNews,2020-07-31T19:38:26.000Z,1596224306,188,375,three individual charged alleged role twitter hack,https://www.justice.gov/usao-ndca/pr/three-individuals-charged-alleged-roles-twitter-hack
5580,HackerNews,2020-07-31T19:07:18.000Z,1596222438,279,148,glucosamine supplementation reduces allcause mortality study,https://www.lifespan.io/news/glucosamine-supplementation-reduces-all-cause-mortality/
5581,HackerNews,2020-07-31T18:28:15.000Z,1596220095,382,258,tampa teen accused mastermind behind twitter hack,https://www.wfla.com/news/hillsborough-county/tampa-teen-accused-of-being-mastermind-behind-twitter-hack-that-targeted-high-profile-accounts/
5582,HackerNews,2020-07-31T18:14:55.000Z,1596219295,134,7,spherical geometry stranger hyperbolic,https://www.youtube.com/watch?v=yY9GAyJtuJ0
5583,HackerNews,2020-07-31T18:10:48.000Z,1596219048,179,308,microsoft talk buy tiktok source,https://twitter.com/CGasparino/status/1289254703705075722
5584,HackerNews,2020-07-31T18:03:50.000Z,1596218630,200,193,niklaus wirth right problem,https://bowero.nl/blog/2020/07/31/niklaus-wirth-was-right-and-that-is-a-problem/
5585,HackerNews,2020-07-31T17:59:14.000Z,1596218354,293,201,microsoft reportedly talk buy tiktok u operation,https://www.businessinsider.com/microsoft-tiktok-donald-trump-bytedance-2020-7
5586,HackerNews,2020-07-31T17:26:48.000Z,1596216408,130,54,web wo nt nirvana,https://www.newsweek.com/clifford-stoll-why-web-wont-be-nirvana-185306
5587,HackerNews,2020-07-31T17:20:36.000Z,1596216036,76,50,think cancel culture exist lived experience say otherwise,https://quillette.com/2020/07/30/think-cancel-culture-doesnt-exist-my-own-lived-experience-says-otherwise/
5588,HackerNews,2020-07-31T16:11:13.000Z,1596211873,415,832,spotify ceo musician longer release music every year,https://www.thefader.com/2020/07/30/spotify-ceo-daniel-ek-says-working-musicians-can-no-longer-release-music-only-once-every-three-to-four-years
5589,HackerNews,2020-07-31T14:54:07.000Z,1596207247,1106,674,nvidia reportedly advanced talk buy arm,https://www.bloomberg.com/news/articles/2020-07-31/nvidia-said-in-advanced-talks-to-buy-softbank-s-chip-company-arm
5590,HackerNews,2020-07-31T14:13:52.000Z,1596204832,115,47,eliminating cold start cloudflare worker,https://blog.cloudflare.com/eliminating-cold-starts-with-cloudflare-workers/
5591,HackerNews,2020-07-31T14:08:40.000Z,1596204520,184,183,hacker post fake story real news site discredit nato,https://www.bbc.co.uk/news/technology-53594440
5592,HackerNews,2020-07-31T14:05:00.000Z,1596204300,167,69,show hn breathe peripheral breath trainer,https://github.com/filipeisho/breathe/
5593,HackerNews,2020-07-31T13:56:54.000Z,1596203814,194,205,facebook say apple io change could hurt ad targeting,https://www.cnbc.com/2020/07/30/facebook-says-apples-ios-14-changes-could-hurt-its-ad-targeting.html
5594,HackerNews,2020-07-31T13:51:14.000Z,1596203474,150,303,case oop wildly overstated,https://medium.com/young-coder/the-case-against-oop-is-wildly-overstated-572eae5ab495
5595,HackerNews,2020-07-31T13:21:46.000Z,1596201706,180,85,google eat,https://www.gwei.org/index.php
5596,HackerNews,2020-07-31T13:12:40.000Z,1596201160,209,48,understand jio need understand reliance,https://diff.substack.com/p/to-understand-jio-you-need-to-understand
5597,HackerNews,2020-07-31T12:19:20.000Z,1596197960,119,71,starting business around bad idea,https://www.allencheng.com/starting-a-business-around-gpt-3-is-a-bad-idea/
5598,HackerNews,2020-07-31T11:17:14.000Z,1596194234,247,165,ibm completes successful field trial fully homomorphic encryption,https://arstechnica.com/gadgets/2020/07/ibm-completes-successful-field-trials-on-fully-homomorphic-encryption/
5599,HackerNews,2020-07-31T10:36:25.000Z,1596191785,104,58,exactlyonce initialization asynchronous python,https://nullprogram.com/blog/2020/07/30/
5600,HackerNews,2020-07-31T10:21:44.000Z,1596190904,237,481,college degree guarantee good life,https://www.theatlantic.com/family/archive/2020/07/will-going-college-make-you-happier/613729/
5601,HackerNews,2020-07-31T10:20:51.000Z,1596190851,277,128,success addict choose special happy,https://www.theatlantic.com/family/archive/2020/07/why-success-wont-make-you-happy/614731/
5602,HackerNews,2020-07-31T10:00:08.000Z,1596189608,224,140,microsoft flight simulator returned sky,https://www.theverge.com/21347809/microsoft-flight-simulator-2020-preview-interview-hands-on
5603,HackerNews,2020-07-31T08:59:44.000Z,1596185984,191,181,google remove danish music youtube,https://www.koda.dk/about-us/press-release-google-removes-all-danish-music-from-youtube
5604,HackerNews,2020-07-31T08:08:01.000Z,1596182881,487,92,monitoring demystified guide logging tracing metric,https://techbeacon.com/enterprise-it/monitoring-demystified-guide-logging-tracing-metrics
5605,HackerNews,2020-07-31T07:48:51.000Z,1596181731,210,149,wordsafety check name unwanted meaning foreign language,http://wordsafety.com/
5606,HackerNews,2020-07-31T07:00:55.000Z,1596178855,146,134,frustration trying invest hometown,https://www.bbc.com/news/business-53473239
5607,HackerNews,2020-07-31T06:09:03.000Z,1596175743,524,442,australia make facebook google pay news,https://www.reuters.com/article/us-australia-media-regulator/australia-to-make-facebook-google-pay-for-news-in-world-first-idUSKCN24V3UP
5608,HackerNews,2020-07-31T03:44:54.000Z,1596167094,228,232,update security incident,https://blog.twitter.com/en_us/topics/company/2020/an-update-on-our-security-incident.html
5609,HackerNews,2020-07-31T02:18:49.000Z,1596161929,444,101,google earth timelapse,https://earthengine.google.com/timelapse/
5610,HackerNews,2020-07-31T01:11:55.000Z,1596157915,171,26,reverse engineering pla chip commodore,https://c128.se/posts/silicon-adventures/
5611,HackerNews,2020-07-31T01:02:14.000Z,1596157334,217,103,show hn bookmarking tool designed help synthesize web research,https://klobie.com
5612,HackerNews,2020-07-31T00:58:38.000Z,1596157118,355,210,youtube community contribution discontinued across channel,https://support.google.com/youtube/answer/6052538
5613,HackerNews,2020-07-31T00:20:32.000Z,1596154832,150,132,show hn deck reddit reddit client optimized desktop,https://rdddeck.com
5614,HackerNews,2020-07-30T22:36:19.000Z,1596148579,248,287,best buy saved,https://www.inc.com/justin-bariso/amazon-almost-killed-best-buy-then-best-buy-did-something-completely-brilliant.html
5615,HackerNews,2020-07-30T22:07:14.000Z,1596146834,282,56,ten modern layout one line cs,https://web.dev/one-line-layouts/
5616,HackerNews,2020-07-30T22:07:06.000Z,1596146826,284,325,philosopher,http://dailynous.com/2020/07/30/philosophers-gpt-3/
5617,HackerNews,2020-07-30T20:37:57.000Z,1596141477,185,238,apple report result,https://www.apple.com/newsroom/2020/07/apple-reports-third-quarter-results/
5618,HackerNews,2020-07-30T20:34:45.000Z,1596141285,95,104,facebook report second quarter result,https://www.reuters.com/article/us-facebook-results/facebook-quarterly-revenue-beats-estimates-idUSKCN24V3H5
5619,HackerNews,2020-07-30T19:53:05.000Z,1596138785,97,34,small lightweight ada rtos microcontrollers,https://m2os.unican.es/
5620,HackerNews,2020-07-30T19:18:39.000Z,1596136719,227,37,wrote crowdfunded independently published book,https://www.blakeboles.com/2020/07/book-story/
5621,HackerNews,2020-07-30T18:08:42.000Z,1596132522,158,46,sandboxing workload isolation,https://fly.io/blog/sandboxing-and-workload-isolation/
5622,HackerNews,2020-07-30T17:07:16.000Z,1596128836,427,237,migrating dropbox nginx envoy,https://dropbox.tech/infrastructure/how-we-migrated-dropbox-from-nginx-to-envoy
5623,HackerNews,2020-07-30T17:02:51.000Z,1596128571,116,165,hire great engineer,https://autoiterative.com/blog/posts/how-to-hire-great-engineers/
5624,HackerNews,2020-07-30T16:37:24.000Z,1596127044,243,106,recorded vlogs show built side project,https://indielog.com/user/damon
5625,HackerNews,2020-07-30T16:35:57.000Z,1596126957,206,31,one byte rule,https://googleprojectzero.blogspot.com/2020/07/one-byte-to-rule-them-all.html
5626,HackerNews,2020-07-30T16:21:08.000Z,1596126068,335,368,google problem bigger antitrust case,https://www.economist.com/briefing/2020/07/30/googles-problems-are-bigger-than-just-the-antitrust-case
5627,HackerNews,2020-07-30T16:14:27.000Z,1596125667,155,169,study find learning music make child smart,https://www.thenational.ae/arts-culture/music/put-down-the-banjo-timmy-study-finds-learning-music-won-t-make-children-smart-1.1055974
5628,HackerNews,2020-07-30T15:48:26.000Z,1596124106,264,191,apple halved app store fee get amazon prime video device,https://www.bloomberg.com/news/articles/2020-07-29/apple-considered-taking-40-cut-from-subscriptions-emails-show
5629,HackerNews,2020-07-30T15:22:04.000Z,1596122524,134,85,security update render system unbootable,https://bugzilla.redhat.com/show_bug.cgi?id=1861977
5630,HackerNews,2020-07-30T15:19:40.000Z,1596122380,155,177,chip card secure much depends bank,https://krebsonsecurity.com/2020/07/is-your-chip-card-secure-much-depends-on-where-you-bank/
5631,HackerNews,2020-07-30T15:09:25.000Z,1596121765,86,66,show hn alternative r reader search engine news content,https://newsandrumors.com/
5632,HackerNews,2020-07-30T14:58:08.000Z,1596121088,101,59,pci bank payment,https://www.moderntreasury.com/journal/what-is-the-pci-of-bank-payments
5633,HackerNews,2020-07-30T14:46:56.000Z,1596120416,247,100,plant green reduce noise photosynthesis,https://www.quantamagazine.org/why-are-plants-green-to-reduce-the-noise-in-photosynthesis-20200730/
5634,HackerNews,2020-07-30T14:23:11.000Z,1596118991,126,120,migrating sql server database,https://www.tarynpivots.com/post/migrating-40tb-sql-server-database/
5635,HackerNews,2020-07-30T14:09:03.000Z,1596118143,135,104,apps bicycle direction,https://jakecoppinger.blog/articles/the-best-apps-for-bicycle-directions-2020/
5636,HackerNews,2020-07-30T13:58:10.000Z,1596117490,96,120,donald trump suggests delay u presidential election,https://www.bbc.co.uk/news/world-us-canada-53597975
5637,HackerNews,2020-07-30T13:53:22.000Z,1596117202,356,348,internet archive responds publisher lawsuit,https://blog.archive.org/2020/07/29/internet-archive-responds-to-publishers-lawsuit/
5638,HackerNews,2020-07-30T13:40:48.000Z,1596116448,92,13,show hn gomp tool comparing git branch,https://github.com/MarkForged/GOMP
5639,HackerNews,2020-07-30T13:33:14.000Z,1596115994,101,62,alzheimer promising blood test early stage disease,https://www.bbc.co.uk/news/health-53567486
5640,HackerNews,2020-07-30T13:10:57.000Z,1596114657,420,329,haskell elephant room,https://www.stephendiehl.com/posts/crypto.html
5641,HackerNews,2020-07-30T12:51:18.000Z,1596113478,161,109,anticlimate action statement get visibility news coverage study find,https://www.brown.edu/news/2020-07-27/wetts
5642,HackerNews,2020-07-30T12:45:50.000Z,1596113150,99,40,show hn building catalog cloud architecture,https://getrevolv.com
5643,HackerNews,2020-07-30T12:37:28.000Z,1596112648,132,143,u economy contracted record rate last quarter,https://www.wsj.com/articles/us-economy-gdp-report-second-quarter-coronavirus-11596061406
5644,HackerNews,2020-07-30T12:37:18.000Z,1596112638,85,20,codimd selfhosted realtime collaborative markdown note,https://github.com/codimd/server
5645,HackerNews,2020-07-30T12:28:52.000Z,1596112132,150,20,expert recommend machine learning book,https://mentorcruise.com/books/ml/
5646,HackerNews,2020-07-30T12:14:54.000Z,1596111294,120,19,seven set venn diagram,http://moebio.com/research/sevensets/
5647,HackerNews,2020-07-30T12:12:34.000Z,1596111154,142,72,nasa launched new perseverance rover mar,https://www.wired.com/story/how-to-watch-nasa-launch-its-new-perseverance-mars-rover/
5648,HackerNews,2020-07-30T11:00:09.000Z,1596106809,157,53,flipper zero tamagochi hacker,https://www.kickstarter.com/projects/flipper-devices/flipper-zero-tamagochi-for-hackers
5649,HackerNews,2020-07-30T10:59:51.000Z,1596106791,97,52,mysterious life bird never come,https://www.nytimes.com/2020/07/29/magazine/vesper-flights.html
5650,HackerNews,2020-07-30T10:25:57.000Z,1596104757,228,240,forgiving someone else,https://www.npr.org/2020/07/28/896245305/why-forgiving-someone-else-is-really-about-you
5651,HackerNews,2020-07-30T10:25:27.000Z,1596104727,112,121,remote first quora,https://greylock.com/quora-remote-first/
5652,HackerNews,2020-07-30T10:15:42.000Z,1596104142,100,94,argo stop printing catalogue almost year,https://www.theguardian.com/business/2020/jul/30/argos-to-stop-printing-catalogue-after-almost-50-years
5653,HackerNews,2020-07-30T10:11:38.000Z,1596103898,119,60,abandoned seaside town cyprus reopen,https://www.messynessychic.com/2020/07/29/seaside-ghost-town-the-abandoned-millionaires-resort/
5654,HackerNews,2020-07-30T10:10:52.000Z,1596103852,489,134,want see data thought friend,http://nautil.us/blog/you-want-to-see-my-data-i-thought-we-were-friends
5655,HackerNews,2020-07-30T08:37:49.000Z,1596098269,242,195,nano,https://lists.gnu.org/archive/html/info-gnu/2020-07/msg00010.html
5656,HackerNews,2020-07-30T08:06:56.000Z,1596096416,1594,351,apple keep commission refund,https://twitter.com/twolivesleft/status/1288625617873694721
5657,HackerNews,2020-07-30T07:42:59.000Z,1596094979,207,246,five buck fatigue,https://underjord.io/five-buck-fatigue.html
5658,HackerNews,2020-07-30T05:43:01.000Z,1596087781,202,275,zsa moonlander nextgeneration ergonomic keyboard,https://zsa.io/moonlander
5659,HackerNews,2020-07-30T04:14:51.000Z,1596082491,277,119,luckysheet opensource spreadsheet,https://github.com/mengshukeji/Luckysheet
5660,HackerNews,2020-07-30T02:44:53.000Z,1596077093,106,71,elite disillusionment,https://saffronhuang.com/post/elite-disillusionment/
5661,HackerNews,2020-07-30T02:16:59.000Z,1596075419,129,119,planet primordial black hole,https://link.aps.org/doi/10.1103/PhysRevLett.125.051103
5662,HackerNews,2020-07-30T01:00:42.000Z,1596070842,1105,1976,universal basic income capitalism,https://timjrobinson.com/universal-basic-income-is-capitalism-2-0/
5663,HackerNews,2020-07-30T00:59:08.000Z,1596070748,128,16,example,https://gpt3examples.com/
5664,HackerNews,2020-07-30T00:54:03.000Z,1596070443,122,49,pluto dark side spill secret including hint hidden ocean,https://www.nature.com/immersive/d41586-020-02082-1/index.html
5665,HackerNews,2020-07-29T23:59:10.000Z,1596067150,123,91,chronic mania persistent euphoric state,https://srconstantin.github.io/2020/07/29/chronic-mania.html
5666,HackerNews,2020-07-29T23:05:21.000Z,1596063921,160,51,tihle new emulator targeting ti graphing calculator,https://www.taricorp.net/2020/introducing-tihle/
5667,HackerNews,2020-07-29T22:27:13.000Z,1596061633,80,175,bezos guarantee amazon nt exploit thirdparty seller data,https://www.axios.com/bezos-no-guarantee-amazon-didnt-exploit-third-party-seller-data-9f31e00d-1e4b-4eaa-88b3-3d50a87be5e7.html
5668,HackerNews,2020-07-29T22:20:38.000Z,1596061238,105,29,lifelabs go court block privacy watchdog probing data breach,https://www.cbc.ca/news/business/lifelabs-data-breach-1.5667618
5669,HackerNews,2020-07-29T22:15:27.000Z,1596060927,312,100,jeff bezos promise amazon employee access independent seller data,https://www.theverge.com/2020/7/29/21347083/jeff-bezos-amazon-tech-antitrust-hearing-jayapal-questioning
5670,HackerNews,2020-07-29T20:28:47.000Z,1596054527,186,104,minimal singleboard computer based motorola,https://github.com/74hc595/68k-nano
5671,HackerNews,2020-07-29T20:17:45.000Z,1596053865,131,54,show hn meetingbar menu bar macos app calendar meeting,https://github.com/leits/MeetingBar
5672,HackerNews,2020-07-29T20:04:26.000Z,1596053066,160,180,credit card fraud still thing,https://krebsonsecurity.com/2020/07/heres-why-credit-card-fraud-is-still-a-thing/
5673,HackerNews,2020-07-29T18:32:56.000Z,1596047576,195,103,uefi secureboot vulnerability boothole,https://www.debian.org/security/2020-GRUB-UEFI-SecureBoot/
5674,HackerNews,2020-07-29T18:04:25.000Z,1596045865,511,334,rb ruby new type signature language,https://developer.squareup.com/blog/the-state-of-ruby-3-typing
5675,HackerNews,2020-07-29T17:54:26.000Z,1596045266,95,35,closer look super ne doom source code release video,https://www.youtube.com/watch?v=JqP3ZzWiul0
5676,HackerNews,2020-07-29T17:43:08.000Z,1596044588,92,119,u prosecutor seek month imprisonment former uber selfdriving head,https://www.reuters.com/article/us-uber-autonomous-levandowski-idUSKCN24U125
5677,HackerNews,2020-07-29T17:19:58.000Z,1596043198,322,141,teaching identify nonsense,https://arr.am/2020/07/25/gpt-3-uncertainty-prompts/
5678,HackerNews,2020-07-29T17:06:01.000Z,1596042361,119,74,ancient trash heap reveal plague justinian economic toll,https://arstechnica.com/science/2020/07/ancient-trash-heaps-reveal-the-plague-of-justinians-economic-toll/
5679,HackerNews,2020-07-29T17:04:41.000Z,1596042281,138,67,speculation javascriptcore,https://webkit.org/blog/10308/speculation-in-javascriptcore/
5680,HackerNews,2020-07-29T16:16:36.000Z,1596039396,168,142,harmful impact audibleexclusive audiobooks,https://blog.libro.fm/the-harmful-impact-of-audible-exclusive-audiobooks/
5681,HackerNews,2020-07-29T16:02:32.000Z,1596038552,220,66,schemastoreorg schema commonly known json file format,https://www.schemastore.org/json/
5682,HackerNews,2020-07-29T15:34:13.000Z,1596036853,377,166,microsoft join blender development fund,https://www.blender.org/press/microsoft-joins-the-blender-development-fund/
5683,HackerNews,2020-07-29T15:32:34.000Z,1596036754,246,181,soviet web tale ussr almost invented internet,https://www.calvertjournal.com/articles/show/7605/soviet-internet-cybernetics-viktor-glushkov
5684,HackerNews,2020-07-29T15:25:54.000Z,1596036354,419,158,zoom security exploit cracking private meeting password,https://www.tomanthony.co.uk/blog/zoom-security-exploit-crack-private-meeting-passwords/
5685,HackerNews,2020-07-29T15:24:35.000Z,1596036275,296,124,student group leader arrested suspicion inciting secession hk,https://hongkongfp.com/2020/07/29/breaking-pro-independence-student-group-leader-arrested-on-suspicion-of-inciting-secession-under-hong-kongs-security-law/
5686,HackerNews,2020-07-29T15:20:13.000Z,1596036013,1243,548,customer refund paid app apple refund cut edited,https://twitter.com/twolivesleft/status/1288344977169235968
5687,HackerNews,2020-07-29T15:17:42.000Z,1596035862,257,126,theirtube recommended video look youtube home page,http://www.their.tube
5688,HackerNews,2020-07-29T14:57:18.000Z,1596034638,170,161,google offer refund smart glass stop working,https://www.bbc.co.uk/news/technology-53581762
5689,HackerNews,2020-07-29T14:18:49.000Z,1596032329,205,57,taxi ride using omniscidb macbook pro,https://tech.marksblogg.com/omnisci-macos-macbookpro-mbp.html
5690,HackerNews,2020-07-29T14:04:24.000Z,1596031464,327,68,sql trick application dba,https://hakibenita.com/sql-tricks-application-dba
5691,HackerNews,2020-07-29T13:33:52.000Z,1596029632,133,117,antitrust hearing role congress ceo question,https://stratechery.com/2020/the-antitrust-hearing-the-role-of-congress-ceo-questions/
5692,HackerNews,2020-07-29T13:14:01.000Z,1596028441,94,122,tiktok new ceo say company reveal algorithm work,https://www.axios.com/tiktoks-new-ceo-says-company-will-reveal-how-its-algorithms-work-aff01b6c-8f33-454f-9b4a-7d52292ce501.html
5693,HackerNews,2020-07-29T13:04:06.000Z,1596027846,163,26,interactive generative art,http://weavesilk.com/?ika/
5694,HackerNews,2020-07-29T12:22:56.000Z,1596025376,393,60,show hn webgl simulation rainy autumn dayevening,https://pluvoir.netlify.app/index.html
5695,HackerNews,2020-07-29T12:21:53.000Z,1596025313,186,150,brown m one read manual,https://blog.nuclino.com/brown-m-ms-or-why-no-one-s-reading-the-manual
5696,HackerNews,2020-07-29T11:31:05.000Z,1596022265,138,200,bytedance investor value tiktok takeover bid,https://www.reuters.com/article/us-bytedance-tiktok-exclusive/exclusive-bytedance-investors-value-tiktok-at-50-billion-in-takeover-bid-sources-idUSKCN24U1M9
5697,HackerNews,2020-07-29T11:17:07.000Z,1596021427,109,157,thought difference european american hw sw design,https://liam-on-linux.livejournal.com/72876.html
5698,HackerNews,2020-07-29T11:10:39.000Z,1596021039,199,213,airbus build first interplanetary cargo ship,https://www.bbc.com/news/science-environment-53575353
5699,HackerNews,2020-07-29T10:55:03.000Z,1596020103,94,34,microsoft engineer proposes trampfd improving linux security,https://www.phoronix.com/scan.php?page=news_item&px=Microsoft-TRAMPFD-Linux
5700,HackerNews,2020-07-29T10:17:29.000Z,1596017849,212,122,unauthorized bread jailbreaking iot toaster,https://arstechnica.com/gaming/2020/01/unauthorized-bread-a-near-future-tale-of-refugees-and-sinister-iot-appliances/
5701,HackerNews,2020-07-29T09:30:45.000Z,1596015045,90,187,love arm,https://www.20i.com/blog/i-love-arm/
5702,HackerNews,2020-07-29T08:26:06.000Z,1596011166,1649,506,delicious,http://del.icio.us/
5703,HackerNews,2020-07-29T07:15:12.000Z,1596006912,95,96,bitoduc french dictionnary c related word,https://bitoduc.fr/
5704,HackerNews,2020-07-29T06:59:08.000Z,1596005948,309,205,amd report earnings,https://www.anandtech.com/show/15935/amd-reports-q2-2020-earnings-notebook-and-server-sales-drive-a-record-quarter
5705,HackerNews,2020-07-29T06:58:11.000Z,1596005891,214,172,independence autonomy many small team,https://kislayverma.com/organizations/independence-autonomy-and-too-many-small-teams/
5706,HackerNews,2020-07-29T06:50:46.000Z,1596005446,100,78,show hn human v ai ab testing,https://vwo.com/ab-testing-openai-gpt-3/
5707,HackerNews,2020-07-29T06:38:34.000Z,1596004714,111,243,american getting nervous say public,https://www.economist.com/graphic-detail/2020/07/28/americans-are-getting-more-nervous-about-what-they-say-in-public
5708,HackerNews,2020-07-29T06:27:28.000Z,1596004048,169,296,people stay poor pdf,http://sticerd.lse.ac.uk/dps/eopp/eopp67.pdf
5709,HackerNews,2020-07-29T06:11:39.000Z,1596003099,109,33,scann efficient vector similarity search,https://ai.googleblog.com/2020/07/announcing-scann-efficient-vector.html
5710,HackerNews,2020-07-29T05:28:36.000Z,1596000516,97,137,scientist taking diy coronavirus vaccine,https://www.technologyreview.com/2020/07/29/1005720/george-church-diy-coronavirus-vaccine
5711,HackerNews,2020-07-29T05:17:49.000Z,1595999869,85,24,sifive core ip,https://www.sifive.com/blog/sifive-core-ip-20g1
5712,HackerNews,2020-07-29T04:33:27.000Z,1595997207,84,55,empty stadium shrunk football team home advantage,https://www.economist.com/graphic-detail/2020/07/25/empty-stadiums-have-shrunk-football-teams-home-advantage
5713,HackerNews,2020-07-29T04:26:16.000Z,1595996776,173,33,lockless algorithm mere mortal,https://lwn.net/SubscriberLink/827180/a1c1305686bfea67/
5714,HackerNews,2020-07-29T04:25:18.000Z,1595996718,124,52,secret origin action rpg,https://medium.com/@obskyr/the-secret-origin-of-the-action-rpg-254a180079dd
5715,HackerNews,2020-07-29T02:06:24.000Z,1595988384,169,96,modified gravity theory pass critical test,https://www.quantamagazine.org/modified-gravity-theory-passes-a-critical-test-20200728/
5716,HackerNews,2020-07-28T23:36:46.000Z,1595979406,114,158,stop abusing semver,https://samver.org/
5717,HackerNews,2020-07-28T23:26:45.000Z,1595978805,481,450,hiring without whiteboards,https://github.com/poteto/hiring-without-whiteboards
5718,HackerNews,2020-07-28T23:10:00.000Z,1595977800,76,19,bit bit,https://wiki.tcl-lang.org/page/UTF%2D8+bit+by+bit
5719,HackerNews,2020-07-28T22:57:27.000Z,1595977047,556,155,macintosh quadra mac o electron app,https://github.com/felixrieseberg/macintosh.js
5720,HackerNews,2020-07-28T22:55:06.000Z,1595976906,354,175,new funding model open source software,https://vriad.com/essays/a-modest-proposal-for-oss-sustainability
5721,HackerNews,2020-07-28T22:43:57.000Z,1595976237,132,135,statement jeff bezos u house committee judiciary,https://blog.aboutamazon.com/policy/statement-by-jeff-bezos-to-the-u-s-house-committee-on-the-judiciary
5722,HackerNews,2020-07-28T22:40:39.000Z,1595976039,258,225,flawed idea teaching million kid poor reader,https://www.apmreports.org/episode/2019/08/22/whats-wrong-how-schools-teach-reading
