ID,Source,TimeGST,TimeEpoch,Upvotes,NumComments,Title,Url
5873,HackerNews,2020-07-25T17:27:06.000Z,1595698026,202,95,instagram promise fix bug always accessing camera io,https://9to5mac.com/2020/07/25/instagram-promises-to-fix-bug-after-being-exposed-by-always-accessing-the-camera-on-ios-14/
5874,HackerNews,2020-07-25T16:58:24.000Z,1595696304,129,47,inside processor tiny charge pump create negative voltage,http://www.righto.com/2020/07/inside-8086-processor-tiny-charge-pumps.html
5875,HackerNews,2020-07-25T16:00:22.000Z,1595692822,79,37,redux overview concept reimagined redux tutorial,https://redux.js.org/tutorials/essentials/part-1-overview-concepts
5876,HackerNews,2020-07-25T15:02:12.000Z,1595689332,146,69,cryptography magic,http://loup-vaillant.fr/articles/crypto-is-not-magic
5877,HackerNews,2020-07-25T14:44:48.000Z,1595688288,155,102,noprocrast,http://web.archive.org/web/20100423003857/http://mmcgrana.github.com/2010/03/noprocrast.html
5878,HackerNews,2020-07-25T14:27:18.000Z,1595687238,242,255,homeland security destined become secret police force,https://www.newyorker.com/news/our-columnists/the-dhs-was-destined-to-become-a-secret-police-force
5879,HackerNews,2020-07-25T14:00:45.000Z,1595685645,154,38,browser plugin unity,https://blog.mozvr.com/a-browser-plugin-for-unity/
5880,HackerNews,2020-07-25T13:55:47.000Z,1595685347,172,195,smartphone contact tracing failed everywhere,https://eclecticlight.co/2020/07/25/smartphone-contact-tracing-has-failed-everywhere/
5881,HackerNews,2020-07-25T13:54:01.000Z,1595685241,82,72,u university pressure cut fee remote learning,https://www.ft.com/content/41bdaca1-1988-4fac-9204-4ff4e70b36cc
5882,HackerNews,2020-07-25T13:53:10.000Z,1595685190,99,30,intel graphic accelerated decode linux support land,https://www.phoronix.com/scan.php?page=news_item&px=Intel-Gen12-Xe-AV1-Decode-Media
5883,HackerNews,2020-07-25T13:45:19.000Z,1595684719,103,104,iceland got teen say drug,https://www.theatlantic.com/health/archive/2017/01/teens-drugs-iceland/513668/
5884,HackerNews,2020-07-25T13:30:28.000Z,1595683828,145,65,ansibledefined homelab,https://0xc45.com/blog/ansible-defined-homelab/
5885,HackerNews,2020-07-25T13:24:22.000Z,1595683462,79,33,convert paperbased note html content google vision api,https://itnext.io/convert-paper-based-notes-to-html-content-with-google-vision-api-e398fdb45cb9
5886,HackerNews,2020-07-25T12:24:23.000Z,1595679863,303,53,show hn simple cli tool generate satellite image location,https://github.com/plant99/felicette
5887,HackerNews,2020-07-25T12:22:24.000Z,1595679744,116,21,audio scratch go stereo panning,https://dylanmeeus.github.io/posts/audio-from-scratch-pt4/
5888,HackerNews,2020-07-25T12:12:23.000Z,1595679143,76,21,show hn spacedrepetition flashcard linked learning material,https://www.iDoRecall.com/
5889,HackerNews,2020-07-25T12:11:53.000Z,1595679113,138,95,ozymandias,https://www.poetryfoundation.org/poems/46565/ozymandias
5890,HackerNews,2020-07-25T12:07:53.000Z,1595678873,123,56,reframe build web apps clojurescript react,http://day8.github.io/re-frame/
5891,HackerNews,2020-07-25T12:05:11.000Z,1595678711,126,66,combo fasting plus vitamin c effective hardtotreat cancer mouse,https://www.sciencedaily.com/releases/2020/05/200512151941.htm
5892,HackerNews,2020-07-25T11:27:29.000Z,1595676449,80,50,teaching managing behavior,https://www.theatlantic.com/education/archive/2020/07/reality-pedagogy-teaching-form-protest/614554/
5893,HackerNews,2020-07-25T10:57:55.000Z,1595674675,200,77,show hn textdbdev simple data sharing fun project,https://textdb.dev
5894,HackerNews,2020-07-25T10:53:31.000Z,1595674411,235,176,bank slow increase rate saving account quick reduce,http://jpkoning.blogspot.com/2020/06/banks-are-slow-to-increase-rates-on.html
5895,HackerNews,2020-07-25T10:36:19.000Z,1595673379,115,66,everything need nt need know php type system,https://thephp.website/en/issue/php-type-system/
5896,HackerNews,2020-07-25T10:07:58.000Z,1595671678,98,68,blackbaud hack uk university confirm breach,https://www.bbc.com/news/technology-53528329
5897,HackerNews,2020-07-25T09:57:10.000Z,1595671030,110,90,ice confirms new foreign student ca nt take onlineonly course load u,https://www.npr.org/sections/coronavirus-live-updates/2020/07/24/895223219/ice-confirms-new-foreign-students-cant-take-online-only-course-loads-in-the-u-s
5898,HackerNews,2020-07-25T08:51:18.000Z,1595667078,85,76,video show federal officer escalated violence portland,https://www.nytimes.com/video/us/100000007243995/portland-protests-federal-government.html
5899,HackerNews,2020-07-25T08:42:17.000Z,1595666537,99,49,mozilla sending political ad via firefox push notification,https://www.reddit.com/r/firefox/comments/hx8737/why_did_i_just_receive_an_ad_for_mozillas_blog/
5900,HackerNews,2020-07-25T08:37:32.000Z,1595666252,140,70,show hn made minimalist spaced repetition tool,https://memordo.com
5901,HackerNews,2020-07-25T07:51:39.000Z,1595663499,123,144,independently poor twist fu money aka fu money,https://streetlifesolutions.blogspot.com/2020/07/independently-poor-twist-on-fu-money.html
5902,HackerNews,2020-07-25T07:14:01.000Z,1595661241,274,130,digikam opensource photo management,https://www.digikam.org/news/2020-07-19-7.0.0_release_announcement/
5903,HackerNews,2020-07-25T07:09:20.000Z,1595660960,155,141,de shaw computer geek english major transformed wall st,https://nymag.com/intelligencer/2018/01/d-e-shaw-the-first-great-quant-hedge-fund.html
5904,HackerNews,2020-07-25T06:02:41.000Z,1595656961,117,47,wayland lvgl pinephone ubuntu touch,https://lupyuen.github.io/pinetime-rust-mynewt/articles/wayland
5905,HackerNews,2020-07-25T05:56:43.000Z,1595656603,515,375,lsd chemist william pickard released prison,https://www.psymposia.com/magazine/william-leonard-pickard-lsd/
5906,HackerNews,2020-07-25T05:09:16.000Z,1595653756,130,69,machu picchu purposely built intersecting fault line research,https://www.smithsonianmag.com/smart-news/machu-picchu-was-purposely-built-top-intersecting-fault-lines-180973216/
5907,HackerNews,2020-07-25T04:53:28.000Z,1595652808,95,18,alexandrian glass confirmed hafnium isotope,https://www.nature.com/articles/s41598-020-68089-w
5908,HackerNews,2020-07-25T04:33:38.000Z,1595651618,99,18,opensource version control system machine learning project,https://dvc.org/
5909,HackerNews,2020-07-25T04:15:00.000Z,1595650500,472,126,bloom filter debunked dispelling year bad math coq,https://gopiandcode.uk/logs/log-bloomfilters-debunked.html
5910,HackerNews,2020-07-25T03:53:25.000Z,1595649205,467,214,dance superior repetitive physical exercise brain plasticity,https://journals.plos.org/plosone/article?id=10.1371/journal.pone.0196636
5911,HackerNews,2020-07-25T01:21:21.000Z,1595640081,136,13,sun ra everything nothing,https://www.nybooks.com/articles/2020/07/23/sun-ra-everything-nothing/
5912,HackerNews,2020-07-25T01:04:21.000Z,1595639061,218,78,saliva based covid test result minute,https://www.colorado.edu/today/2020/07/22/new-covid-19-test-returns-results-45-minutes-without-nasal-swab
5913,HackerNews,2020-07-24T23:45:31.000Z,1595634331,133,121,thinking cybersecurity career,https://krebsonsecurity.com/2020/07/thinking-of-a-cybersecurity-career-read-this/
5914,HackerNews,2020-07-24T22:03:37.000Z,1595628217,468,186,liberating smartwatch cloud service,https://www.bunniestudios.com/blog/?p=5863
5915,HackerNews,2020-07-24T21:46:12.000Z,1595627172,76,83,futility told software engineering team,https://humza.sh/2020/07/24/the-futility-of-i-told-you-so.html
5916,HackerNews,2020-07-24T21:11:41.000Z,1595625101,258,39,machine learning research apple,https://machinelearning.apple.com
5917,HackerNews,2020-07-24T20:02:35.000Z,1595620955,194,27,kalman filter work picture,https://www.bzarg.com/p/how-a-kalman-filter-works-in-pictures/
5918,HackerNews,2020-07-24T19:35:53.000Z,1595619353,75,32,fda update hand sanitizers methanol,https://www.fda.gov/drugs/drug-safety-and-availability/fda-updates-hand-sanitizers-methanol
5919,HackerNews,2020-07-24T19:26:47.000Z,1595618807,304,327,regional air mobility plan operate flight,https://lilium.com/newsroom-detail/why-regional-air-mobility
5920,HackerNews,2020-07-24T17:51:57.000Z,1595613117,79,96,pentagon ufo unit disclose finding public,https://www.sciencetimes.com/articles/26600/20200724/pentagons-ufo-unit-disclose-findings-public.htm
5921,HackerNews,2020-07-24T17:07:36.000Z,1595610456,169,105,reporter leaving newsroom newsletter,https://www.washingtonpost.com/business/2020/07/24/substack-email-newsletter-journalism/
5922,HackerNews,2020-07-24T16:46:13.000Z,1595609173,101,47,eastland disaster killed passenger titanic lusitania,https://www.smithsonianmag.com/history/eastland-disaster-killed-more-passengers-titanic-and-lusitania-why-has-it-been-forgotten-180953146/
5923,HackerNews,2020-07-24T16:39:24.000Z,1595608764,114,31,source corruption bug,https://lwn.net/Articles/304105/
5924,HackerNews,2020-07-24T15:53:46.000Z,1595606026,611,223,hubble stared nothing hour,https://www.nationalgeographic.com/science/phenomena/2015/04/24/when-hubble-stared-at-nothing-for-100-hours/
5925,HackerNews,2020-07-24T15:03:32.000Z,1595603012,117,148,anniversary power mac cube,https://www.wired.com/story/20-years-ago-steve-jobs-built-the-coolest-computer-ever-it-bombed/
5926,HackerNews,2020-07-24T14:47:50.000Z,1595602070,233,107,emulating nintendo switch game linux,https://boilingsteam.com/emulating-nintendo-switch-games-on-linux/
5927,HackerNews,2020-07-24T13:51:29.000Z,1595598689,409,120,get reply say le,https://www.gkogan.co/blog/increase-reply-rates/
5928,HackerNews,2020-07-24T13:32:28.000Z,1595597548,299,275,indian consultancy struggle technological obsolescence,https://www.economist.com/business/2020/07/23/indian-it-consultancies-struggle-against-technological-obsolescence
5929,HackerNews,2020-07-24T13:14:20.000Z,1595596460,387,406,amazon warehouse scam hdd swapped returned full refund,https://twitter.com/BlissWallpaper/status/1286419567783432193
5930,HackerNews,2020-07-24T13:04:47.000Z,1595595887,154,208,pandemic forcing rethink macroeconomics,https://www.economist.com/briefing/2020/07/25/the-covid-19-pandemic-is-forcing-a-rethink-in-macroeconomics
5931,HackerNews,2020-07-24T13:00:02.000Z,1595595602,216,162,faa issue emergency directive boeing ng classic plane,https://www.reuters.com/article/us-boeing-737ng/faa-issues-emergency-directive-on-2000-boeing-737-ng-classic-planes-idUSKCN24P1KS
5932,HackerNews,2020-07-24T12:38:52.000Z,1595594332,107,65,nist postquantum cryptography program enters selection round,https://www.nist.gov/news-events/news/2020/07/nists-post-quantum-cryptography-program-enters-selection-round
5933,HackerNews,2020-07-24T12:27:25.000Z,1595593645,101,27,treating selfimprovement like software upgrade,https://medium.com/team-human/were-treating-self-improvement-like-a-software-upgrade-b25a8e3a80c6
5934,HackerNews,2020-07-24T12:25:01.000Z,1595593501,653,411,editorial board index staff member resign,https://index.hu/english/2020/07/24/editorial_board_of_index_resigns/
5935,HackerNews,2020-07-24T12:12:57.000Z,1595592777,76,51,avoid characterbycharacter processing performance matter,https://lemire.me/blog/2020/07/21/avoid-character-by-character-processing-when-performance-matters/
5936,HackerNews,2020-07-24T11:59:30.000Z,1595591970,186,154,apple first time make topoftheline iphone model india,https://m.economictimes.com/tech/hardware/the-i-in-iphone-11-now-stands-for-india-made/articleshow/77135725.cms
5937,HackerNews,2020-07-24T11:56:41.000Z,1595591801,177,177,dividing front end back end antipattern,https://www.thoughtworks.com/insights/blog/dividing-frontend-backend-antipattern
5938,HackerNews,2020-07-24T11:20:17.000Z,1595589617,77,62,building ultimate home office,https://www.troyhunt.com/building-the-ultimate-home-office-again/
5939,HackerNews,2020-07-24T11:06:12.000Z,1595588772,638,802,four quadrant conformism,http://paulgraham.com/conformism.html
5940,HackerNews,2020-07-24T10:49:24.000Z,1595587764,94,51,erythrocyte index ambient fine particle exposure brain aging,https://n.neurology.org/content/early/2020/07/15/WNL.0000000000010074
5941,HackerNews,2020-07-24T10:36:19.000Z,1595586979,107,163,negative online review early hurt restaurant,https://news.osu.edu/how-a-few-negative-online-reviews-early-on-can-hurt-a-restaurant/
5942,HackerNews,2020-07-24T10:06:45.000Z,1595585205,146,8,datahike durable datalog database powered efficient datalog query engine,https://github.com/replikativ/datahike
5943,HackerNews,2020-07-24T09:44:15.000Z,1595583855,386,52,townscaper building game inspired design scandinavian city,https://www.bloomberg.com/news/articles/2020-07-24/the-video-game-where-you-build-an-empty-town
5944,HackerNews,2020-07-24T09:34:32.000Z,1595583272,205,126,american say social medium company much political influence,https://www.pewresearch.org/fact-tank/2020/07/22/most-americans-say-social-media-companies-have-too-much-power-influence-in-politics/
5945,HackerNews,2020-07-24T08:14:13.000Z,1595578453,130,109,domainoriented microservice architecture,https://eng.uber.com/microservice-architecture/
5946,HackerNews,2020-07-24T07:29:15.000Z,1595575755,96,69,garmin outage persists hour downtime,https://twitter.com/GarminFitness/status/1286273563096489985
5947,HackerNews,2020-07-24T07:17:41.000Z,1595575061,340,176,made simple geolocation service,https://maxkostinevich.com/blog/serverless-geolocation/
5948,HackerNews,2020-07-24T06:16:27.000Z,1595571387,100,99,good logging,https://henrikwarne.com/2020/07/23/good-logging/
5949,HackerNews,2020-07-24T05:56:25.000Z,1595570185,284,60,best data science book according expert,https://builtin.com/data-science/data-science-books
5950,HackerNews,2020-07-24T05:15:29.000Z,1595567729,96,89,understanding null safety dart,https://dart.dev/null-safety/understanding-null-safety
5951,HackerNews,2020-07-24T05:08:17.000Z,1595567297,588,240,cold shower people get hyped thing,https://github.com/hwayne/awesome-cold-showers
5952,HackerNews,2020-07-24T04:27:59.000Z,1595564879,175,77,validate startup idea quickly,https://amanjain.substack.com/p/how-to-validate-your-startup-idea
5953,HackerNews,2020-07-24T04:00:24.000Z,1595563224,82,89,judge rule seattle medium company must hand protest image police,https://www.seattletimes.com/seattle-news/judge-rules-seattle-media-companies-must-hand-over-protest-images-to-police/
5954,HackerNews,2020-07-24T01:37:12.000Z,1595554632,153,86,make hacker news look like window,https://github.com/chowderman/Hacker95
5955,HackerNews,2020-07-24T00:52:58.000Z,1595551978,145,151,advocate approach calendar reform,https://qntm.org/calendar
5956,HackerNews,2020-07-24T00:50:55.000Z,1595551855,113,66,steve wozniak sue youtube ongoing bitcoin scam,https://www.theverge.com/2020/7/23/21335554/steve-wozniak-youtube-lawsuit-bitcoin-scam-cryptocurrency-apple
5957,HackerNews,2020-07-24T00:39:23.000Z,1595551163,593,408,put tiny business back residential neighborhood,https://www.fastcompany.com/90530672/with-downtowns-staying-abandoned-put-tiny-businesses-back-into-residential-neighborhoods
5958,HackerNews,2020-07-23T23:29:27.000Z,1595546967,211,172,go command support embedded static asset file,https://go.googlesource.com/proposal/+/master/design/draft-embed.md
5959,HackerNews,2020-07-23T23:18:02.000Z,1595546282,382,228,people twitter ability aid hack account,https://www.reuters.com/article/us-twitter-cyber-access-exclusive/exclusive-more-than-1000-people-at-twitter-had-ability-to-aid-hack-of-accounts-idUSKCN24O34E
5960,HackerNews,2020-07-23T21:54:47.000Z,1595541287,474,253,perseverance toward life goal fend depression anxiety panic disorder,https://www.apa.org/news/press/releases/2019/05/goals-perseverance
5961,HackerNews,2020-07-23T21:38:26.000Z,1595540306,210,82,intel broken company announces delay,https://www.tomshardware.com/news/intel-announces-delay-to-7nm-processors-now-one-year-behind-expectations
5962,HackerNews,2020-07-23T21:14:11.000Z,1595538851,597,587,still need office u company start cutting space,https://www.reuters.com/article/us-usa-results-realestate/who-still-needs-the-office-u-s-companies-start-cutting-space-idUSKCN24N2NL
5963,HackerNews,2020-07-23T21:14:04.000Z,1595538844,391,508,american say political view afraid share,https://www.cato.org/publications/survey-reports/poll-62-americans-say-they-have-political-views-theyre-afraid-share#introduction
5964,HackerNews,2020-07-23T20:48:23.000Z,1595537303,207,101,intel grew revenue key manufacturing upgrade delayed,https://venturebeat.com/2020/07/23/intel-grew-revenues-20-to-19-7-billion-in-q2-but-manufacturing-upgrade-delayed/
5965,HackerNews,2020-07-23T20:18:16.000Z,1595535496,275,240,buy google open commissionfree,https://blog.google/products/shopping/buy-on-google-is-zero-commission/
5966,HackerNews,2020-07-23T19:19:55.000Z,1595531995,311,232,thought response lawsuit internet archive,http://blog.archive.org/2020/07/22/libraries-have-been-bringing-older-books-to-digital-learners-four-publishers-sue-to-stop-it/
5967,HackerNews,2020-07-23T18:32:42.000Z,1595529162,77,67,show hn iposfyi missing ipo frustrating fixed,https://ipos.fyi
5968,HackerNews,2020-07-23T18:30:18.000Z,1595529018,189,171,uk u say russia fired satellite weapon space,https://www.bbc.co.uk/news/world-europe-53518238
5969,HackerNews,2020-07-23T18:06:07.000Z,1595527567,220,81,show hn react spreadsheet google sheetslike performance,http://rowsncolumns.app
5970,HackerNews,2020-07-23T17:44:09.000Z,1595526249,226,176,report arm sale nvidia interested apple,https://arstechnica.com/gadgets/2020/07/reports-arm-is-for-sale-and-nvidias-interested-apple-isnt/
5971,HackerNews,2020-07-23T17:11:43.000Z,1595524303,86,30,control social medium,https://tech.newstatesman.com/policy/russia-report-mi5-social-media
5972,HackerNews,2020-07-23T16:52:55.000Z,1595523175,171,163,survive ransomware attack without paying ransom,https://www.bloomberg.com/news/features/2020-07-23/how-to-survive-ransomware-attack-without-paying-ransom
5973,HackerNews,2020-07-23T16:50:40.000Z,1595523040,227,88,tor stopping tor connection,https://www.hackerfactor.com/blog/index.php?/archives/888-Tor-0day-Stopping-Tor-Connections.html
5974,HackerNews,2020-07-23T16:49:28.000Z,1595522968,76,20,show hn aesthetically pleasing arch linux distro,https://archcraft-os.github.io/
5975,HackerNews,2020-07-23T16:35:57.000Z,1595522157,376,106,recursive free variable font code ui google font,https://fonts.google.com/specimen/Recursive
5976,HackerNews,2020-07-23T16:26:18.000Z,1595521578,1125,351,amazon met startup investing launched competing product,https://www.wsj.com/articles/amazon-tech-startup-echo-bezos-alexa-investment-fund-11595520249
5977,HackerNews,2020-07-23T16:24:01.000Z,1595521441,119,71,ludic fallacy,https://en.wikipedia.org/wiki/Ludic_fallacy
5978,HackerNews,2020-07-23T16:12:09.000Z,1595520729,178,92,goodjob postgresbased activejob back end ruby rail,https://island94.org/2020/07/introducing-goodjob-1-0
5979,HackerNews,2020-07-23T16:02:37.000Z,1595520157,241,211,facebook employee reckon social network built,https://www.buzzfeednews.com/article/ryanmac/facebook-employee-leaks-show-they-feel-betrayed
5980,HackerNews,2020-07-23T15:46:06.000Z,1595519166,250,41,antiprivacy earn act could change internet know,https://mashable.com/article/earn-it-act-threatens-privacy-encryption-section-230/
5981,HackerNews,2020-07-23T14:57:42.000Z,1595516262,170,158,history status future fpgas,https://queue.acm.org/detail.cfm?id=3411759
5982,HackerNews,2020-07-23T14:35:53.000Z,1595514953,177,134,inuit parent teach kid control anger,https://www.npr.org/sections/goatsandsoda/2019/03/13/685533353/a-playful-way-to-teach-kids-to-control-their-anger
5983,HackerNews,2020-07-23T13:56:16.000Z,1595512576,756,279,show hn tinypilot build kvm ip using raspberry pi,https://mtlynch.io/tinypilot/
5984,HackerNews,2020-07-23T13:01:57.000Z,1595509317,88,126,siberian heatwave almost impossible without climate change,https://www.worldweatherattribution.org/siberian-heatwave-of-2020-almost-impossible-without-climate-change
5985,HackerNews,2020-07-23T12:42:11.000Z,1595508131,249,204,stacked image comet photobombed starlink satellite,https://twitter.com/djulik/status/1286053695956881409
5986,HackerNews,2020-07-23T12:18:12.000Z,1595506692,145,50,unofficial guide datomic internals,https://tonsky.me/blog/unofficial-guide-to-datomic-internals/
5987,HackerNews,2020-07-23T12:05:34.000Z,1595505934,618,271,nubank acquires cognitect,https://cognitect.com/blog/2020/07/23/Cognitect-Joins-Nubank
5988,HackerNews,2020-07-23T11:57:51.000Z,1595505471,79,43,whose bug anyway,https://shkspr.mobi/blog/2020/07/whose-bug-is-it-anyway/
5989,HackerNews,2020-07-23T11:48:45.000Z,1595504925,102,27,wolfsort ultrafast hybrid radix sort algorithm,https://github.com/scandum/wolfsort
5990,HackerNews,2020-07-23T11:45:05.000Z,1595504705,226,223,garmin service production go ransomware attack,https://www.zdnet.com/article/garmin-services-and-production-go-down-after-ransomware-attack/
5991,HackerNews,2020-07-23T11:43:23.000Z,1595504603,120,62,mail good,https://github.com/freeCodeCamp/mail-for-good/tree/heroku/stable
5992,HackerNews,2020-07-23T11:18:59.000Z,1595503139,166,55,unmasking china invisible fleet,https://newsinteractives.cbc.ca/longform/china-at-sea
5993,HackerNews,2020-07-23T10:55:44.000Z,1595501744,106,38,cave discovery suggest human reached america much earlier thought,https://www.nature.com/articles/d41586-020-02190-y
5994,HackerNews,2020-07-23T10:10:56.000Z,1595499056,129,57,designing scalable api aws spot instance,https://blog.adapty.io/designing-scalable-api-on-aws-stop-instance/
5995,HackerNews,2020-07-23T09:43:10.000Z,1595497390,179,190,model know artificial intelligence take job,https://www.vogue.com/article/sinead-bovell-model-artificial-intelligence
5996,HackerNews,2020-07-23T09:42:48.000Z,1595497368,154,98,nvidia build supercomputer university florida,https://venturebeat.com/2020/07/21/nvidia-collaborates-with-the-university-of-florida-to-build-700-petaflop-ai-supercomputer/
5997,HackerNews,2020-07-23T05:58:36.000Z,1595483916,260,114,bitwarden second security audit report,https://bitwarden.com/blog/post/bitwarden-network-security-assessment-2020/
5998,HackerNews,2020-07-23T05:42:31.000Z,1595482951,115,108,vocal range greatest artist time,https://www.concerthotels.com/worlds-greatest-vocal-ranges
5999,HackerNews,2020-07-23T05:40:22.000Z,1595482822,335,79,rust explained using easy english,https://github.com/Dhghomon/easy_rust
6000,HackerNews,2020-07-23T05:29:24.000Z,1595482164,189,319,carbon removal becomes new big oil,https://www.economist.com/the-world-if/2020/07/04/what-if-carbon-removal-becomes-the-new-big-oil
6001,HackerNews,2020-07-23T05:15:55.000Z,1595481355,119,105,kharkovchanka soviet antarctic cruiser video,https://www.youtube.com/watch?v=f6R-h06IsJw
6002,HackerNews,2020-07-23T04:00:52.000Z,1595476852,118,141,airbus eye hydrogen power airliner next decade,https://www.ainonline.com/aviation-news/air-transport/2020-07-21/airbus-eyes-hydrogen-power-airliner-next-decade
6003,HackerNews,2020-07-23T03:06:06.000Z,1595473566,185,67,written layman term,https://tinkeredthinking.com/index.php?id=841
6004,HackerNews,2020-07-23T02:37:16.000Z,1595471836,78,35,gnu grep fast,https://lists.freebsd.org/pipermail/freebsd-current/2010-August/019310.html
6005,HackerNews,2020-07-23T01:43:00.000Z,1595468580,449,296,kde slimbook linux laptop ryzen,https://kde.slimbook.es/
6006,HackerNews,2020-07-23T01:04:25.000Z,1595466265,175,151,onethird u museum may survive year survey find,https://www.npr.org/sections/coronavirus-live-updates/2020/07/22/894049653/one-third-of-u-s-museums-may-not-survive-the-year-survey-finds
6007,HackerNews,2020-07-23T01:02:05.000Z,1595466125,186,76,joscha bach artificial consciousness nature reality video,https://www.youtube.com/watch?v=P-2P3MSZrBM
6008,HackerNews,2020-07-23T00:46:39.000Z,1595465199,155,14,verified secure riscv processor,https://ts.data61.csiro.au/publications/csiroabstracts/Heiser_20.abstract.pml
6009,HackerNews,2020-07-23T00:22:05.000Z,1595463725,344,115,personal info could instacart customer sold online,https://www.buzzfeednews.com/article/janelytvynenko/instacart-customers-info-sold-online
6010,HackerNews,2020-07-23T00:00:11.000Z,1595462411,172,181,macos virtualization framework run linux vm,https://developer.apple.com/documentation/virtualization
6011,HackerNews,2020-07-22T23:37:09.000Z,1595461029,698,396,breach exposed one million dna profile major genealogy database,https://www.buzzfeednews.com/article/peteraldhous/hackers-gedmatch-dna-privacy
6012,HackerNews,2020-07-22T22:16:41.000Z,1595456201,171,63,flash game history,http://www.flashgamehistory.com/
6013,HackerNews,2020-07-22T21:27:04.000Z,1595453224,154,41,new feature gnuplot,https://lwn.net/SubscriberLink/826456/2ea90dd464e104d5/
6014,HackerNews,2020-07-22T21:09:11.000Z,1595452151,307,110,amazon ion,https://amzn.github.io/ion-docs/
6015,HackerNews,2020-07-22T20:56:24.000Z,1595451384,418,399,get invited party,https://medium.com/@cyril0allen/who-gets-invited-to-the-party-246a1ba6849a
6016,HackerNews,2020-07-22T20:56:10.000Z,1595451370,242,40,show hn react guitar guitar component react,https://react-guitar.com
6017,HackerNews,2020-07-22T20:43:58.000Z,1595450638,81,25,twitter hacking profit lols,https://krebsonsecurity.com/2020/07/twitter-hacking-for-profit-and-the-lols/
6018,HackerNews,2020-07-22T20:28:50.000Z,1595449730,103,19,show hn biff selfhosted firebase alternative clojure,https://findka.com/biff/
6019,HackerNews,2020-07-22T20:26:52.000Z,1595449612,126,291,update,https://ir.tesla.com/static-files/f41f4254-f1cc-4929-a0b6-6623b00475a6
6020,HackerNews,2020-07-22T20:03:53.000Z,1595448233,390,92,show hn minesweeper implemented cs html javascript,https://github.com/propjockey/css-sweeper#readme
