ID,Source,TimeGST,TimeEpoch,Upvotes,NumComments,Title,Url
6021,HackerNews,2020-07-22T19:42:51.000Z,1595446971,119,93,japan top court tell twitter disclose retweeters info,https://www.japantimes.co.jp/news/2020/07/22/national/japan-top-court-tells-twitter-disclose-retweeters-info/
6022,HackerNews,2020-07-22T18:45:41.000Z,1595443541,198,46,lwn pay wellwritten article new author,https://lwn.net/op/AuthorGuide.lwn
6023,HackerNews,2020-07-22T18:22:13.000Z,1595442133,85,29,bacteria colon cancer,https://blogs.sciencemag.org/pipeline/archives/2020/07/22/bacteria-and-colon-cancer
6024,HackerNews,2020-07-22T18:10:58.000Z,1595441458,266,94,mathematician discover perfect way multiply,https://www.quantamagazine.org/mathematicians-discover-the-perfect-way-to-multiply-20190411/
6025,HackerNews,2020-07-22T18:03:26.000Z,1595441006,88,110,defining music canon,https://pudding.cool/2020/07/song-decay
6026,HackerNews,2020-07-22T17:55:25.000Z,1595440525,112,84,show hn gitern git host hacker,https://gitern.com
6027,HackerNews,2020-07-22T17:45:49.000Z,1595439949,423,138,generate abstract painting one click,https://1secondpainting.com/
6028,HackerNews,2020-07-22T17:44:07.000Z,1595439847,112,177,consider getting diy degree online instead traditional c major,https://www.pashabitz.com/posts/undergrad-altenative/
6029,HackerNews,2020-07-22T17:39:04.000Z,1595439544,213,71,react implementation spectrum adobe design system,https://react-spectrum.adobe.com/react-spectrum/
6030,HackerNews,2020-07-22T17:20:52.000Z,1595438452,202,28,semgrep lightweight static analysis many language,https://github.com/returntocorp/semgrep
6031,HackerNews,2020-07-22T17:09:49.000Z,1595437789,330,186,apple security research device program,https://developer.apple.com/programs/security-research-device/
6032,HackerNews,2020-07-22T16:33:24.000Z,1595435604,218,256,trauma facebook content moderator,https://restofworld.org/2020/facebook-international-content-moderators/
6033,HackerNews,2020-07-22T14:44:27.000Z,1595429067,654,171,first ever image multiplanet system around sunlike star captured eso,https://www.eso.org/public/news/eso2011/?lang
6034,HackerNews,2020-07-22T14:28:58.000Z,1595428138,96,45,mathematician never stop proving prime number theorem,https://www.quantamagazine.org/mathematicians-will-never-stop-proving-the-prime-number-theorem-20200722/
6035,HackerNews,2020-07-22T14:26:44.000Z,1595428004,498,121,fawkes image cloaking personal privacy,http://sandlab.cs.uchicago.edu/fawkes/
6036,HackerNews,2020-07-22T14:08:24.000Z,1595426904,194,155,twilio someone broke aws silo added nonmalicious code j sdk,https://www.theregister.com/2020/07/21/twilio_sdk_code_injection/
6037,HackerNews,2020-07-22T13:42:11.000Z,1595425331,145,33,show hn ui playbook documented collection ui component,https://uiplaybook.dev
6038,HackerNews,2020-07-22T13:39:11.000Z,1595425151,197,50,brain connectivity level equal mammal including human study,https://www.aftau.org/press-release---brain-connectivity---july-20-2020
6039,HackerNews,2020-07-22T13:29:23.000Z,1595424563,256,324,slack file eu competition complaint microsoft,https://slackhq.com/slack-files-eu-competition-complaint-against-microsoft
6040,HackerNews,2020-07-22T12:43:25.000Z,1595421805,488,398,combinator lost soul yc founder perspective,https://twitter.com/AdamNeumannsCoS/status/1285651161723342848
6041,HackerNews,2020-07-22T12:28:54.000Z,1595420934,296,313,online class worth cost full tuition,https://www.thestar.com/opinion/contributors/2020/07/20/online-classes-are-not-worth-cost-of-full-tuition.html
6042,HackerNews,2020-07-22T12:20:46.000Z,1595420446,144,73,swiss police automated crime prediction little show,https://algorithmwatch.org/en/story/swiss-predictive-policing/
6043,HackerNews,2020-07-22T12:18:42.000Z,1595420322,92,259,swedish epidemiology bos say questioned strategy seems working,https://www.reuters.com/article/us-health-coronavirus-sweden-strategy-idUSKCN24M25L
6044,HackerNews,2020-07-22T12:12:04.000Z,1595419924,121,4,debugging incident google distributed system,https://queue.acm.org/detail.cfm?id=3404974
6045,HackerNews,2020-07-22T12:02:33.000Z,1595419353,148,58,bb graphic history pretty awesome web showed,https://tedium.co/2020/07/21/bbs-graphics-history-ripscrip-naplps/
6046,HackerNews,2020-07-22T11:38:15.000Z,1595417895,77,15,exploring fully homomorphic encryption,https://vitalik.ca/general/2020/07/20/homomorphic.html
6047,HackerNews,2020-07-22T11:09:48.000Z,1595416188,92,41,terminal server budget,https://blog.lasseter.org/posts/2020/07/terminal-server-on-a-budget/
6048,HackerNews,2020-07-22T10:50:45.000Z,1595415045,212,27,data visualization catalog,https://datavizcatalogue.com/index.html
6049,HackerNews,2020-07-22T10:18:29.000Z,1595413109,104,103,cold war created world largest airplane,https://www.cnn.com/travel/article/an-225-worlds-largest-airplane/index.html
6050,HackerNews,2020-07-22T10:12:56.000Z,1595412776,459,187,design doc google,https://www.industrialempathy.com/posts/design-docs-at-google/
6051,HackerNews,2020-07-22T10:10:18.000Z,1595412618,154,96,listenbrainz move timescaledb,https://blog.metabrainz.org/2020/07/22/listenbrainz-moves-to-timescaledb/
6052,HackerNews,2020-07-22T09:15:45.000Z,1595409345,198,163,cs way,https://increment.com/frontend/ask-an-expert-why-is-css-the-way-it-is/
6053,HackerNews,2020-07-22T09:04:49.000Z,1595408689,109,63,new kde slimbook launched series processor,https://www.neowin.net/news/new-kde-slimbook-launched-with-ryzan-4000-series-processor
6054,HackerNews,2020-07-22T08:20:05.000Z,1595406005,146,42,bangladesh majority ecommerce happens facebook,https://restofworld.org/2020/bangladesh-economy-runs-on-facebook/
6055,HackerNews,2020-07-22T07:33:34.000Z,1595403214,650,189,experimental blood test detects cancer four year symptom appear,https://www.scientificamerican.com/article/experimental-blood-test-detects-cancer-up-to-four-years-before-symptoms-appear/
6056,HackerNews,2020-07-22T07:25:17.000Z,1595402717,89,167,rise rise json,https://twobithistory.org/2017/09/21/the-rise-and-rise-of-json.html
6057,HackerNews,2020-07-22T07:14:03.000Z,1595402043,77,53,people loved nikola warrant,https://www.bloomberg.com/opinion/articles/2020-07-21/people-loved-nikola-but-not-its-warrants
6058,HackerNews,2020-07-22T06:41:53.000Z,1595400113,131,90,united nation uniqlo,https://www.economist.com/1843/2020/07/06/the-united-nations-of-uniqlo
6059,HackerNews,2020-07-22T06:32:29.000Z,1595399549,365,109,write code easy delete easy extend,https://programmingisterrible.com/post/139222674273/write-code-that-is-easy-to-delete-not-easy-to
6060,HackerNews,2020-07-22T06:30:49.000Z,1595399449,111,182,sudden change attitude,https://apenwarr.ca/log/20200708
6061,HackerNews,2020-07-22T06:27:20.000Z,1595399240,164,76,deep learning translate programming language,https://ai.facebook.com/blog/deep-learning-to-translate-between-programming-languages
6062,HackerNews,2020-07-22T05:25:58.000Z,1595395558,94,37,understand seed round dynamic silicon valley,https://thevalley.substack.com/p/understand-seed-rounds-dynamics-in
6063,HackerNews,2020-07-22T04:59:50.000Z,1595393990,237,109,trump administration establishes quantum computing center,https://thehill.com/policy/cybersecurity/508305-trump-administration-establishes-75-million-quantum-computing-centers
6064,HackerNews,2020-07-22T04:56:29.000Z,1595393789,574,345,medium home idea,https://hulry.com/medium-vs-own-blog/
6065,HackerNews,2020-07-22T03:16:20.000Z,1595387780,87,25,aristotle lost book magic,https://www.ancientmedicine.org/home/2018/3/11/aristotles-lost-book-on-magic
6066,HackerNews,2020-07-22T02:28:43.000Z,1595384923,90,18,basic intro elliptic curve cryptography,https://qvault.io/2020/07/21/very-basic-intro-to-elliptic-curve-cryptography/
6067,HackerNews,2020-07-22T02:28:37.000Z,1595384917,260,165,slatestarcodex back,https://slatestarcodex.com/
6068,HackerNews,2020-07-22T01:25:51.000Z,1595381151,84,73,costco convinces brand cannibalize,https://napkinmath.substack.com/p/how-costco-convinces-brands-to-cannibalize
6069,HackerNews,2020-07-22T00:21:51.000Z,1595377311,245,39,build toy quantum computer home,https://www.dhruvonmath.com/2020/07/19/quantum-computers/#
6070,HackerNews,2020-07-22T00:18:04.000Z,1595377084,135,240,twitter ban qanon account limit others part broad crackdown,https://news.yahoo.com/twitter-bans-7-000-qanon-000000686.html
6071,HackerNews,2020-07-21T23:11:19.000Z,1595373079,393,217,terry tao desirable property mathematical notation,https://mathoverflow.net/questions/366070/what-are-the-benefits-of-writing-vector-inner-products-as-langle-u-v-rangle/366118#366118
6072,HackerNews,2020-07-21T22:53:07.000Z,1595371987,388,206,attach people may explain lot inner life,https://www.theguardian.com/science/2020/jan/10/psychotherapy-childhood-mental-health
6073,HackerNews,2020-07-21T22:33:49.000Z,1595370829,365,542,billionaire behind effort kill u postal service pdf,https://www.inthepublicinterest.org/wp-content/uploads/ITPI_USPSPrivatization_July2020.pdf
6074,HackerNews,2020-07-21T22:15:24.000Z,1595369724,280,57,time start writing,https://alexnixon.github.io/2019/12/10/writing.html
6075,HackerNews,2020-07-21T20:11:19.000Z,1595362279,95,53,turing wittgenstein logic mathematics pdf,https://www.britishwittgensteinsociety.org/wp-content/uploads/documents/lectures/Turing-and-Wittgenstein-on-Logic-and-Mathematics.pdf
6076,HackerNews,2020-07-21T19:48:15.000Z,1595360895,289,193,attempt use link main browser,https://dataswamp.org/~lich/musings/links-browser.html
6077,HackerNews,2020-07-21T19:41:33.000Z,1595360493,221,203,big sur,https://eclecticlight.co/2020/07/21/big-sur-is-both-10-16-and-11-0-its-official/
6078,HackerNews,2020-07-21T19:23:31.000Z,1595359411,199,139,every game slay spire winnable,https://forgottenarbiter.github.io/Is-Every-Seed-Winnable/
6079,HackerNews,2020-07-21T19:12:49.000Z,1595358769,238,131,show hn datagridxljs nononsense fast excellike data table library,https://datagridxl.com
6080,HackerNews,2020-07-21T18:46:00.000Z,1595357160,197,230,eric schmidt working launch university,https://www.businessinsider.com/google-eric-schmidt-us-digital-service-academy-2020-7
6081,HackerNews,2020-07-21T17:57:17.000Z,1595354237,250,81,opensource music production tool,https://midination.com/free-music-production-software/
6082,HackerNews,2020-07-21T17:00:20.000Z,1595350820,161,155,elo suck better multiplayer rating system smaller game,https://medium.com/acolytefight/elo-sucks-better-multiplayer-rating-systems-for-smaller-games-8ca588ee652f
6083,HackerNews,2020-07-21T16:20:43.000Z,1595348443,174,84,safely reviving shared memory,https://hacks.mozilla.org/2020/07/safely-reviving-shared-memory/
6084,HackerNews,2020-07-21T16:12:54.000Z,1595347974,420,260,india jio four internet,https://stratechery.com/2020/india-jio-and-the-four-internets/
6085,HackerNews,2020-07-21T16:02:34.000Z,1595347354,85,146,ford electric car engineer go crazy mustang mache,https://arstechnica.com/cars/2020/07/check-out-this-bonkers-1400-horsepower-ford-mustang-mach-e/
6086,HackerNews,2020-07-21T16:01:40.000Z,1595347300,151,196,oil cheap arab state balance book,https://www.economist.com/leaders/2020/07/18/with-oil-cheap-arab-states-cannot-balance-their-books
6087,HackerNews,2020-07-21T15:35:00.000Z,1595345700,95,92,life without line number smaller go binary,https://commaok.xyz/post/no-line-numbers/
6088,HackerNews,2020-07-21T15:07:05.000Z,1595344025,337,150,svelte typescript,https://svelte.dev/blog/svelte-and-typescript
6089,HackerNews,2020-07-21T15:02:38.000Z,1595343758,164,202,founderpool community founder share risk diversify equity,http://www.founderpools.com
6090,HackerNews,2020-07-21T13:17:20.000Z,1595337440,90,57,jelly world smallest android smartphone,https://www.kickstarter.com/projects/jellyphone/jelly-2-worlds-smallest-android-10-4g-smartphone
6091,HackerNews,2020-07-21T13:12:02.000Z,1595337122,87,17,neurips english bash competition go live,http://nlc2cmd.us-east.mybluemix.net/#/
6092,HackerNews,2020-07-21T13:11:45.000Z,1595337105,140,138,amd launch desktop renoir ryzen series apus buy,https://www.anandtech.com/show/15921/amd-launches-12-desktop-renoir-ryzen-4000g-series-apus-but-you-cant-buy-them
6093,HackerNews,2020-07-21T13:11:27.000Z,1595337087,236,245,facebook override factchecks climate science opinion,https://arstechnica.com/tech-policy/2020/07/facebook-overrides-fact-checks-when-climate-science-is-opinion/
6094,HackerNews,2020-07-21T12:48:10.000Z,1595335690,155,95,common mistake writing react component hook,https://www.lorenzweiss.de/common_mistakes_react_hooks/
6095,HackerNews,2020-07-21T12:32:19.000Z,1595334739,166,137,apple commits carbon neutral supply chain product,https://www.apple.com/newsroom/2020/07/apple-commits-to-be-100-percent-carbon-neutral-for-its-supply-chain-and-products-by-2030/
6096,HackerNews,2020-07-21T12:26:31.000Z,1595334391,359,293,linkedin cut job worldwide,https://www.bbc.com/news/business-53484764
6097,HackerNews,2020-07-21T12:03:07.000Z,1595332987,96,28,nt create chaos,https://staysaasy.com/management/2020/07/07/dont-create-chaos.html
6098,HackerNews,2020-07-21T12:02:37.000Z,1595332957,385,292,monitoring infrastructure using grafana influxdb collectd,https://serhack.me/articles/monitoring-infrastructure-grafana-influxdb-connectd/
6099,HackerNews,2020-07-21T11:22:39.000Z,1595330559,366,131,harvard c professor david malan built distancelearning empire,https://www.newyorker.com/news/our-local-correspondents/how-harvards-star-computer-science-professor-built-a-distance-learning-empire
6100,HackerNews,2020-07-21T11:08:14.000Z,1595329694,88,11,machine learning better developer experience,https://netflixtechblog.com/machine-learning-for-a-better-developer-experience-1e600c69f36c
6101,HackerNews,2020-07-21T10:18:38.000Z,1595326718,121,20,volcano venus still active,https://phys.org/news/2020-07-scientists-volcanoes-venus.html
6102,HackerNews,2020-07-21T08:23:51.000Z,1595319831,678,172,invert always invert,https://www.anup.io/2020/07/20/invert-always-invert/
6103,HackerNews,2020-07-21T07:40:53.000Z,1595317253,133,30,simple made easy,https://www.infoq.com/presentations/Simple-Made-Easy/
6104,HackerNews,2020-07-21T07:38:29.000Z,1595317109,181,21,cadence operate saas startup,https://medium.com/craft-ventures/the-cadence-how-to-operate-a-saas-startup-436aa8099e8
6105,HackerNews,2020-07-21T07:28:05.000Z,1595316485,198,36,brick block,https://oskarstalberg.com/game/house/index.html
6106,HackerNews,2020-07-21T06:57:43.000Z,1595314663,168,54,spacex successfully catch fairing first time,https://www.engadget.com/space-x-falcon-9-005622474.html
6107,HackerNews,2020-07-21T06:02:38.000Z,1595311358,136,16,selfhosted lightweight comment engine,https://github.com/umputun/remark42
6108,HackerNews,2020-07-21T04:24:02.000Z,1595305442,130,102,exploration python nt require main function,https://utcc.utoronto.ca/~cks/space/blog/python/WhyNoMainFunction
6109,HackerNews,2020-07-21T04:19:31.000Z,1595305171,181,86,magican,https://en.wikipedia.org/wiki/MagiCan
6110,HackerNews,2020-07-21T03:49:05.000Z,1595303345,381,199,wikijs,https://wiki.js.org/
6111,HackerNews,2020-07-21T03:29:19.000Z,1595302159,143,50,many face undying programming language,http://jakob.space/blog/thoughts-on-lisps.html
6112,HackerNews,2020-07-21T03:08:03.000Z,1595300883,945,110,system design advanced beginner,https://robertheaton.com/2020/04/06/systems-design-for-advanced-beginners/
6113,HackerNews,2020-07-21T02:56:39.000Z,1595300199,91,7,oldschool disk partition,https://bsdimp.blogspot.com/2020/07/old-school-disk-partitioning.html
6114,HackerNews,2020-07-21T02:19:25.000Z,1595297965,282,126,building developer cult,https://subvert.substack.com/p/stripe-building-a-developer-cult
6115,HackerNews,2020-07-21T02:07:25.000Z,1595297245,438,94,essay programming think lot,https://www.benkuhn.net/progessays/
6116,HackerNews,2020-07-21T01:35:39.000Z,1595295339,135,175,first manufactured noncuttable material,https://www.nature.com/articles/s41598-020-65976-0
6117,HackerNews,2020-07-21T00:08:48.000Z,1595290128,290,169,strong opinion weakly held nt work well,https://commoncog.com/blog/strong-opinions-weakly-held-is-bad/
6118,HackerNews,2020-07-20T23:26:04.000Z,1595287564,93,22,sec charge youplus ceo defrauding investor,https://www.sec.gov/news/press-release/2020-160
6119,HackerNews,2020-07-20T22:49:21.000Z,1595285361,95,45,maximum entropy intuition fundamental statistical distribution,https://longintuition.com/2020/07/20/max-entropy-intuition.html
6120,HackerNews,2020-07-20T22:02:50.000Z,1595282570,169,88,new data cell coronavirus,https://blogs.sciencemag.org/pipeline/archives/2020/07/15/new-data-on-t-cells-and-the-coronavirus
6121,HackerNews,2020-07-20T21:29:57.000Z,1595280597,196,100,syntax highlighting waste information channel,https://buttondown.email/hillelwayne/archive/syntax-highlighting-is-a-waste-of-an-information/
6122,HackerNews,2020-07-20T20:58:15.000Z,1595278695,85,27,show hn gui faster ml prototyping sharing,http://github.com/gradio-app/gradio
6123,HackerNews,2020-07-20T20:52:03.000Z,1595278323,180,111,need yelp doctoral program,https://community.chronicle.com/news/2283-why-we-need-a-yelp-for-doctoral-programs
6124,HackerNews,2020-07-20T20:47:48.000Z,1595278068,196,131,ai physic facing scientific revolution,https://www.4alltech.com/2020/07/ai-in-physics-are-we-facing-science.html
6125,HackerNews,2020-07-20T20:37:07.000Z,1595277427,196,57,proteus technology new material strong light noncuttable,https://scitechdaily.com/proteus-technology-new-material-is-strong-light-and-non-cuttable/
6126,HackerNews,2020-07-20T20:23:51.000Z,1595276631,186,85,highly automated digital audio workstation extensible guile,https://www.zrythm.org
6127,HackerNews,2020-07-20T20:17:24.000Z,1595276244,155,168,peter thiel progress stagnation,https://docs.google.com/document/d/1zao_AyBhNb8TPWrQqgXn5NzNAgfEqzTIaFYos7wdqGI/edit?usp=drivesdk
6128,HackerNews,2020-07-20T20:09:29.000Z,1595275769,110,24,reactive probabilistic programming,https://arxiv.org/abs/1908.07563
6129,HackerNews,2020-07-20T19:53:04.000Z,1595274784,399,81,zoom earth website let look live satellite photo earth surface,https://zoom.earth/
6130,HackerNews,2020-07-20T19:51:30.000Z,1595274690,231,46,city map generator create procedural americanstyle city browser,https://maps.probabletrain.com/
6131,HackerNews,2020-07-20T19:29:48.000Z,1595273388,166,101,asked make presentation,http://www.bemmu.com/gpt3-presentation
6132,HackerNews,2020-07-20T18:56:22.000Z,1595271382,226,89,principle great product manager,http://reeve.blog/blog/principles/
6133,HackerNews,2020-07-20T18:53:11.000Z,1595271191,80,32,lincos language,https://en.wikipedia.org/wiki/Lincos_language
6134,HackerNews,2020-07-20T18:36:53.000Z,1595270213,342,112,dijo terminalbased habit tracker written rust,https://github.com/NerdyPepper/dijo
6135,HackerNews,2020-07-20T17:14:01.000Z,1595265241,642,430,fbi secretly using sabre global travel surveillance tool,https://www.forbes.com/sites/thomasbrewster/2020/07/16/the-fbi-is-secretly-using-a-2-billion-company-for-global-travel-surveillance--the-us-could-do-the-same-to-track-covid-19
6136,HackerNews,2020-07-20T15:28:42.000Z,1595258922,131,58,rare hardest crack enigma code machine sell,https://www.zdnet.com/article/rare-and-hardest-to-crack-enigma-code-machine-sells-for-437000/
6137,HackerNews,2020-07-20T15:06:45.000Z,1595257605,413,208,reasonably priced color eink display,https://www.waveshare.com/5.65inch-e-paper-module-f.htm
6138,HackerNews,2020-07-20T14:32:10.000Z,1595255530,350,119,mar image rendered video,https://www.youtube.com/watch?v=ZEyAs3NWH4A
6139,HackerNews,2020-07-20T14:03:03.000Z,1595253783,174,88,twitter hack,https://www.schneier.com/blog/archives/2020/07/on_the_twitter_.html
6140,HackerNews,2020-07-20T13:55:19.000Z,1595253319,88,7,man trying automate thailand hospital,https://restofworld.org/2020/the-man-trying-to-automate-thailands-hospitals/
6141,HackerNews,2020-07-20T13:49:03.000Z,1595252943,415,355,coronavirus oxford vaccine trigger immune response,https://www.bbc.co.uk/news/uk-53469839
6142,HackerNews,2020-07-20T13:42:27.000Z,1595252547,972,384,turn half internet singlepointoffailure called cloudflare,https://easydns.com/blog/2020/07/20/turns-out-half-the-internet-has-a-single-point-of-failure-called-cloudflare/
6143,HackerNews,2020-07-20T13:17:15.000Z,1595251035,312,129,ireland donates contact tracing app linux foundation,https://www.nearform.com/blog/ireland-donates-contact-tracing-app-to-linux-foundation/
6144,HackerNews,2020-07-20T12:55:09.000Z,1595249709,144,124,german problem tor,https://worldofmatthew.com/post/tor-german-avoid/
6145,HackerNews,2020-07-20T12:49:20.000Z,1595249360,134,41,show hn youtube search fixer firefox addon remove unrelated suggestion,https://addons.mozilla.org/en-US/firefox/addon/youtube-suite-search-fixer/
6146,HackerNews,2020-07-20T12:48:33.000Z,1595249313,169,52,way think longterm cognitive toolkit good ancestor,https://blog.longnow.org/02020/07/20/six-ways-to-think-long-term-a-cognitive-toolkit-for-good-ancestors/
6147,HackerNews,2020-07-20T12:17:16.000Z,1595247436,82,75,tackling misinformation epidemic event moon disaster,http://news.mit.edu/2020/mit-tackles-misinformation-in-event-of-moon-disaster-0720
6148,HackerNews,2020-07-20T11:57:06.000Z,1595246226,470,270,claim without uri treated suspicious,https://shkspr.mobi/blog/2020/07/any-claim-without-a-uri-should-be-treated-as-suspicious/
6149,HackerNews,2020-07-20T11:51:38.000Z,1595245898,638,87,show hn book image cs generator,https://3d-book-css.netlify.app/
6150,HackerNews,2020-07-20T11:41:31.000Z,1595245291,140,13,explorer zilog netlistlevel simulator,https://baltazarstudios.com/z80explorer/
6151,HackerNews,2020-07-20T09:17:25.000Z,1595236645,94,61,tiledb close series universal data engine,https://tiledb.com/blog/tiledb-closes-15m-series-a-for-industry-s-first-universal-data-engine-2020-07-14
6152,HackerNews,2020-07-20T08:19:22.000Z,1595233162,223,74,minecraft home,https://minecraftathome.com/minecrafthome/
6153,HackerNews,2020-07-20T08:03:13.000Z,1595232193,92,85,demo openai generating tweet given word,https://thoughts.sushant-kumar.com/hong%20kong
6154,HackerNews,2020-07-20T07:59:04.000Z,1595231944,503,108,openai change name closedai,https://www.reddit.com/r/MachineLearning/comments/aqwcyx/discussion_openai_should_now_change_their_name_to/
6155,HackerNews,2020-07-20T07:31:30.000Z,1595230290,154,98,show hn uuids shakespearean grammatically correct sentence,https://github.com/Debdut/uuid-readable
6156,HackerNews,2020-07-20T07:21:04.000Z,1595229664,223,163,matter,https://leogao.dev/2020/05/29/GPT-3-A-Brief-Summary/
6157,HackerNews,2020-07-20T07:19:37.000Z,1595229577,157,70,coronavirus protein treatment trial breakthrough,https://www.bbc.co.uk/news/health-53467022
6158,HackerNews,2020-07-20T06:30:55.000Z,1595226655,319,117,video vectorization,https://vectorly.io/docs/technology/
6159,HackerNews,2020-07-20T05:21:29.000Z,1595222489,135,39,world money market one visualization,https://www.visualcapitalist.com/all-of-the-worlds-money-and-markets-in-one-visualization-2020/
6160,HackerNews,2020-07-20T05:12:05.000Z,1595221925,509,198,diy video hosting,https://tyler.io/diy-video-hosting/
6161,HackerNews,2020-07-20T05:03:21.000Z,1595221401,149,120,praise zfs linux zed zfs event daemon,https://utcc.utoronto.ca/~cks/space/blog/linux/ZFSZEDPraise
6162,HackerNews,2020-07-20T04:39:54.000Z,1595219994,103,28,assasination attempt judge epsteindeutsche bank case,https://www.cnn.com/2020/07/19/us/federal-judge-esther-salas-shooting-investigation/index.html
6163,HackerNews,2020-07-20T04:35:12.000Z,1595219712,136,69,seven log vpn provider accused leaking user data,https://www.theregister.com/2020/07/17/ufo_vpn_database/
6164,HackerNews,2020-07-20T04:31:21.000Z,1595219481,117,17,man dressed delivery driver executes hit federal judge house,https://abcnews.go.com/US/federal-judges-son-shot-killed-husband-injured-attack/story?id=71871708
6165,HackerNews,2020-07-20T04:11:36.000Z,1595218296,117,130,school beat earlier plague outdoor class,https://www.nytimes.com/2020/07/17/nyregion/coronavirus-nyc-schools-reopening-outdoors.html
6166,HackerNews,2020-07-20T04:09:52.000Z,1595218192,108,22,one earliest science fiction book written duchess,https://www.atlasobscura.com/articles/one-of-the-earliest-science-fiction-books-was-written-in-the-1600s-by-a-duchess
6167,HackerNews,2020-07-20T03:39:10.000Z,1595216350,83,46,fernando pessoa disappearing act,https://www.newyorker.com/magazine/2017/09/04/fernando-pessoas-disappearing-act
6168,HackerNews,2020-07-20T03:21:12.000Z,1595215272,345,233,nt want founder,https://carolchen.me/blog/founding-bad/
6169,HackerNews,2020-07-20T02:45:16.000Z,1595213116,255,204,robinhood lose money,https://themargins.substack.com/p/robinhood-and-how-to-lose-money
6170,HackerNews,2020-07-20T01:23:08.000Z,1595208188,133,50,pharo smalltalk overview,https://www.pharo.org/features
6171,HackerNews,2020-07-20T01:15:05.000Z,1595207705,198,71,feeling unproductive maybe stop overthinking,https://adolos.substack.com/p/feeling-unproductive-maybe-you-should
6172,HackerNews,2020-07-20T00:49:33.000Z,1595206173,351,286,doomscrolling breed anxiety stop cycle,https://www.npr.org/2020/07/19/892728595/your-doomscrolling-breeds-anxiety-here-s-how-to-stop-the-cycle
6173,HackerNews,2020-07-19T23:43:39.000Z,1595202219,171,54,binary search new implementation faster,https://github.com/scandum/binary_search
6174,HackerNews,2020-07-19T23:01:25.000Z,1595199685,83,15,first uae spacecraft blast mar japan,https://www.smh.com.au/world/asia/in-a-first-uae-spacecraft-blasts-off-to-mars-from-japan-20200720-p55djq.html
6175,HackerNews,2020-07-19T22:50:05.000Z,1595199005,113,89,new cobaltfree liion battery reduces cost similar design performance,https://news.utexas.edu/2020/07/14/new-cobalt-free-lithium-ion-battery-reduces-costs-without-sacrificing-performance/
